date_generated,id,congress,chamber,rollnumber,date,keyvote,yea,nay,description,Issue1,Issue2,Peltzman1,Peltzman2,Clausen1,mid.dim1,mid.dim2,spread.dim1,spread.dim2,pre,classified,log_likelihood,geo_mean_probability
2017-01-23 07:31:50,RH0540136,54,House,136,1897-01-29,,71,144,"TO AGREE TO REPORT OF THE COMMITTEE ON CONFERENCE ON S. 1832 (29 STAT 622 3/3/97), AN ACT TO DEFINE THE RIGHTS OF PURCHASERS UNDER MORTGAGES CONCERNING THE ATLANTIC AND PACIFIC RAILROAD COMPANY.  (P. 1315-1)",,,Budget Special Interest,,Government Management,-0.039,-0.541,-0.077,0.411,0.338,0.781,-98.008719,0.634
2017-01-23 07:31:50,RH0540137,54,House,137,1897-02-08,,132,52,"TO PASS H.R. 9470, A BILL INCORPORATING THE WASHINGTON AND GETTYSBURG RAILROAD COMPANY.  (P. 1658-1)",,,Government Organization,,Government Management,0.147,0.794,-0.104,0.252,0.519,0.864,-68.330939,0.69
2017-01-23 07:31:50,RH0540138,54,House,138,1897-02-09,,218,37,"TO AGREE TO REPORT OF CONFERENCE COMMITTEE RELATING TO H.R. 7864, A BILL TO AMEND THE IMMIGRATION LAWS.  (P. 1677-1",Immigration/Naturalization,,Domestic Social Policy,,Social Welfare,-0.278,-0.64,-0.109,-0.241,-0.027,0.851,-79.659324,0.732
2017-01-23 07:31:50,RH0540139,54,House,139,1897-02-09,,137,63,"TO OVERRIDE THE PRESIDENT'S VETO OF H.R. 1185 (29 STAT 836 3/3/97), A BILL GRANTING A PENSION TO RACHEL PATTON. (P. 1681-1)",,,Budget Special Interest,,Government Management,-0.032,-0.019,-0.147,-0.052,0.683,0.9,-53.557258,0.765
2017-01-23 07:31:50,RH0540140,54,House,140,1897-02-09,,143,55,"TO OVERRIDE THE PRESIDENT'S VETO OF H.R. 1139 (29 STAT 835 3/3/97), A BILL GRANTING A PENSION TO CAROLINE D. MOWATT, WIDOW OF ALFRED B. SOULE, LATE MAJOR OF THE TWENTY-THIRD REGIMENT VOLUNTEERS.  (P. 1682-2)",,,Budget Special Interest,,Government Management,-0.14,0.877,-0.217,-0.048,0.8,0.944,-31.62064,0.852
2017-01-23 07:31:50,RH0540141,54,House,141,1897-02-15,,160,5,TO RESOLVE INTO THE COMMITTEE OF THE WHOLE FOR CONSIDERA- TION OF BILLS ON THE PRIVATE CALENDAR.  (P. 1857-2),,,Internal Organization,,Miscellaneous Policy,-0.557,-0.301,-0.328,-0.27,-0.2,0.964,-13.809572,0.92
2017-01-23 07:31:50,RH0540142,54,House,142,1897-02-16,,115,79,"TO OVERRIDE PRESIDENT'S VETO OF S. 894, A BILL GRANTING A PENSION TO NANCY G. ALLABACH, WIDOW OF PETER H. ALLABACH, A SOLDIER IN THE MEXICAN WAR.  (P. 1898-1)",,,Budget Special Interest,,Government Management,0.072,-0.125,-0.125,0.033,0.633,0.851,-73.460822,0.685
2017-01-23 07:31:50,RH0540143,54,House,143,1897-02-16,,52,141,"TO TABLE H.R. 2153, A BILL AMENDING THE MILITARY RECORD OF GEORGE F. MILLER.  (P. 1904-1",,,Defense Policy Resolutions,,Foreign and Defense Policy,-0.13,-0.076,0.164,-0.081,0.731,0.927,-38.603663,0.819
2017-01-23 07:31:50,RH0540144,54,House,144,1897-02-19,,197,91,"TO PASS H.RES. 533, A RESOLUTION DECLARING THAT JOSEPH M. KENDALL WAS NOT ELECTED A MEMBER OF THE 54TH CONGRESS FROM THE 10TH CONGRESSIONAL DISTRICT OF KEN. AND IS NOT ENTITLED TO A SEAT THEREIN, BUT THAT N.T. HOPKINS WAS ELECTED AND IS ENTITLED TO A SEA",Disputed Elections to Congress,,Internal Organization,,Miscellaneous Policy,-0.133,0.991,-0.279,-0.288,0.89,0.965,-40.892497,0.868
2017-01-23 07:31:50,RH0540145,54,House,145,1897-02-19,,92,126,"TO LIMIT GENERAL DEBATE TO ONE MINUTE WHEN H.R. 10329, THE GENERAL DEFICIENCY APPROPRIATION BILL FOR FISCAL  YEAR ENDING JUNE 30, 1897 AND FOR PRIOR YEARS IS CONSIDERED IN THE COMMITTEE OF THE WHOLE.  (P. 1997-2)",,,Budget Special Interest,,Government Management,0.795,0.607,-0.063,0.175,0.109,0.624,-141.715874,0.522
2017-01-23 07:31:50,RH0540146,54,House,146,1897-02-19,,53,74,"TO ADJOURN, IN ORDER TO SECURE A ROLL CALL AND TO DETERMINE WHETHER A SUFFICIENT NUMBER OF MEMBERS ARE PRESENT TO CONTINUE WITH BUSINESS.  (P. 2016-1)",,,Internal Organization,,Miscellaneous Policy,0.738,0.675,-0.042,0.066,0.075,0.614,-84.360573,0.515
2017-01-23 07:31:50,RH0540147,54,House,147,1897-02-19,,64,73,TO ADJOURN.  (P. 2017-1),,,Internal Organization,,Miscellaneous Policy,0.62,0.764,-0.05,0.091,0.109,0.584,-91.102562,0.514
2017-01-23 07:31:50,RH0540148,54,House,148,1897-02-19,,56,75,TO DISPENSE WITH FURTHER PROCEEDINGS UNDER THE CALL OF THE HOUSE.  (P. 2017-2),,,Internal Organization,,Miscellaneous Policy,0.44,0.698,-0.101,0.057,0.107,0.618,-78.055963,0.551
2017-01-23 07:31:50,RH0540149,54,House,149,1897-02-19,,71,58,"TO ADJOURN, DUE TO LATENESS OF HOUR.  (P. 2018-1)",,,Internal Organization,,Miscellaneous Policy,0.163,0.128,-0.063,0.178,0.293,0.682,-74.690024,0.56
2017-01-23 07:31:50,RH0540150,54,House,150,1897-02-22,,122,96,"TO AMEND THE AMENDMENT MADE IN COMMITTEE OF THE WHOLE, TO H.R. 10329 THE DEFICIENCY APPROPRIATION BILL, FOR FISCAL 1897 AND FOR PRIOR YEARS, BY STRIKING OUT THE APPROPRIATION OF $12,202.48 ENABLING THE SERGEANT-AT-ARMS OF THE HOUSE TO PAY TO MEMBERS OF TE HOUSE OF THE 53RD CONGRESS THE AMOUNTS WITHHELD IN THEIR SALARIES ON ACCOUNT OF ABSENCE",,,Internal Organization,Budget Special Interest,Government Management,-0.101,-0.079,-0.003,-0.307,0.25,0.668,-133.468891,0.542
2017-01-23 07:31:50,RH0540151,54,House,151,1897-02-22,,103,138,"TO RECOMMIT TO THE COMMITTEE ON APPROPRIATIONS, DEFICIENCY APPROPRIATION BILL, H.R. 10329, WITH INSTRUCTIONS TO AMEND, BY REDUCING FROM $16,277.91 TO $14,712.45, THE APPROPRIATION FOR SERVICES OVER BOND-AIDED RAILROAD LINES, TO BE CREDITED TO THE SINKINGFUND AND INTEREST ACCOUNTS OF SAID RAILROADS AND BY INSERTING ""EXCEPT FOR CLAIM FOR SERVICES OVER BOND- AIDED LINES OF THE BOND-AIDED PACIFIC RAILROADS."" (P",,,Budget Special Interest,,Government Management,-0.053,-0.102,0.081,-0.354,0.34,0.717,-121.308924,0.604
2017-01-23 07:31:50,RH0540152,54,House,152,1897-02-24,,157,64,"TO PASS S. 3307 (29 STAT 624, 3/3/97), A BILL DECLARING THE POTOMAC FLATS A PULIC PARK UNDER THE NAME OF THE POTOMAC PARK.  (P. 2219-2)",Parks and Conservation,,Domestic Social Policy,,Social Welfare,0.116,0.484,-0.065,0.295,0.219,0.773,-103.637944,0.626
2017-01-23 07:31:50,RH0540153,54,House,153,1897-02-25,,118,94,"TO ORDER ENGROSSMENT AND A THIRD READING OF H.R. 4808, A BILL TO INCREASE THE EFFICIENCY OF THE POSTAL SERVICE. (P. 2269-1)",,,Budget Special Interest,,Government Management,0.191,0.167,-0.092,0.13,0.409,0.739,-107.78305,0.601
2017-01-23 07:31:50,RH0540154,54,House,154,1897-02-25,,150,87,"TO ORDER THE PREVIOUS QUESTION ON PASSAGE OF H.R. 849, A BILL INCREASING THE CIRCULATION OF NATIONAL BANKS. (P. 2270-2)",Banking and Finance,,Budget General Interest,,Government Management,0.179,-0.024,-0.23,0.042,0.77,0.915,-49.210795,0.812
2017-01-23 07:31:50,RH0540155,54,House,155,1897-02-25,,148,49,"TO PASS H.R. 849, A BILL INCREASING THE CIRCULATION OF NATIONAL BANKS.  (P. 2286-2)",Banking and Finance,,Budget General Interest,,Government Management,0.202,0.864,-0.22,0.525,0.735,0.934,-31.307158,0.853
2017-01-23 07:31:50,RH0540156,54,House,156,1897-02-26,,284,4,"TO SUSPEND THE RULES AND PASS S. 3547 (29 STAT 624, 3/3/97), AN ACT AUTHORIZING REPRESENTATION BY THE UNITED STATES AT ANY INTERNATIONAL CONFERENCE, INCLUDING THE INTERNATIONAL MONETARY CONFERENCE.  (P. 2383-1)",,,Foreign Policy Budget,,Foreign and Defense Policy,0.0,0.0,0.0,0.0,,,0.0,
2017-01-23 07:31:50,RH0540157,54,House,157,1897-02-27,,153,69,"TO CONSIDER H.R. 10090, THE ANTITICKET SCALPING BILL, WHICH MAKES IT THE DUTY OF EVERY COMMON CARRIER TO PROVIDE EACH AGENT WHO MAY BE AUTHORIZED TO SELL TICKETS OR OTHER EVIDENCES OF TRANSPORTATION, WITH A CERTIFICATE SETTING FORTH THE AUTHORITY OF SAIDAGENT TO MAKE SUCH SALES",,,Regulation Special Interest,Domestic Social Policy,Social Welfare,-0.479,0.028,-0.065,0.311,0.203,0.752,-121.373284,0.579
2017-01-23 07:31:50,RH0540158,54,House,158,1897-02-27,,56,175,"TO ADJOURN, MOTION MADE DURING DEBATE ON H.R. 10090. (P. 2468-2)",,,Regulation Special Interest,Domestic Social Policy,Social Welfare,-0.102,0.365,0.071,-0.422,0.286,0.826,-94.775739,0.663
2017-01-23 07:31:50,RH0540159,54,House,159,1897-02-27,,131,80,TO ORDER THE PREVIOUS QUESTION ON H.R. 10090.  (P. 2468-2),,,Regulation Special Interest,Domestic Social Policy,Social Welfare,-0.177,-0.118,-0.085,0.319,0.412,0.777,-103.036355,0.614
2017-01-23 07:31:50,RH0540160,54,House,160,1897-03-01,,62,191,"TO REFER TO THE COMMITTEE ON INVALID PENSIONS H.R. 7422 (29 STAT 829, 3/3/97), A BILL GRANTING A PENSION TO LYDIA W. HOLLIDAY, LATE ARMY NURSE IN ARMY HOSPITALS OF U. S. VOLUNTEERS, AT THE RATE OF $12.00 PER MONTH. (P. 2574-1)",Military Pensions/Veterans Benefits,,Defense Policy Budget,,Foreign and Defense Policy,-0.238,-0.628,0.242,-0.188,0.742,0.937,-36.967445,0.864
2017-01-23 07:31:50,RH0540161,54,House,161,1897-03-03,,184,75,"TO SUSPEND THE RULES, NON-CONCUR IN SENATE AMENDMENTS AND REQUEST A CONFERENCE TO H.R. 10329, THE 1897 GENERAL DEFICIENCY BILL.  (P. 2941-1)",,,Budget Special Interest,,Government Management,0.113,-0.994,-0.074,-0.111,0.095,0.74,-133.617657,0.597
2017-01-23 07:31:50,RH0540162,54,House,162,1897-03-03,,195,40,"TO OVERRIDE THE PRESIDENT'S VETO OF H.R. 7864, AN ACT AMENDING THE IMMIGRATION LAWS OF THE UNITED STATES, BY ADDING TO THOSE TO BE EXCLUDED FROM ADMISSION TO THE U. S., PERSONS OVER 16 YEARS OF AGE WHO CANNOT READ AT LEAST TWENTY WORDS OF THE CONSTITUTIO IN ENGLISH OR SOME OTHER LANGUAGE",Immigration/Naturalization,,Regulation Special Interest,Domestic Social Policy,Social Welfare,-0.168,-0.302,-0.118,-0.427,0.55,0.923,-60.800452,0.772
