date_generated,id,congress,chamber,rollnumber,date,keyvote,yea,nay,description,Issue1,Issue2,Peltzman1,Peltzman2,Clausen1,mid.dim1,mid.dim2,spread.dim1,spread.dim2,pre,classified,log_likelihood,geo_mean_probability
2017-01-23 07:31:50,RH0670001,67,House,1,1921-04-11,,419,0,"TO ELECT A SPEAKER OF THE HOUSE.  VOTES FOR CLAUDE KITCHIN, (DEM.) ARE CODED 1.  VOTES FOR FREDERICK H. GILLETT (REP.) ARE CODED 2.",Election of the Speaker of the House,,Internal Organization,,Miscellaneous Policy,0.0,0.0,0.0,0.0,,,0.0,
2017-01-23 07:31:50,RH0670002,67,House,2,1921-04-11,,286,113,"TO AMEND H. RES. 1, REFERRING TO A SPECIAL COMMITTEE THE QUESTION OF THE RIGHT OF OFFICE OF RICHARD E. BIRD, BY SUBSTITUTING THAT R. E. BIRD IS ENTITLED TO HIS SEAT AS REPRESENTATIVE FROM KANSAS.  (P.80-2)",Disputed Elections to Congress,,Internal Organization,,Miscellaneous Policy,-0.04,-0.43,-0.37,0.09,0.956,0.987,-19.363987,0.953
2017-01-23 07:31:50,RH0670003,67,House,3,1921-04-15,,121,268,"TO RECOMMIT TO THE COMMITTEE ON WAYS AND MEANS H. R. 2435 (42 STAT. 9 APP. 5/27/21), A BILL IMPOSING TEMPORARY DUTIES UPON CERTAIN AGRICULTURAL PRODUCTS TO MEET EMERGENCIES AND PROVIDE REVENUES, TO REGULATE COMMERCE WITH FOREIGN COUN- TRIES, TO PREVENT DMPING OF FOREIGN MERCHANDISE ON U",Tariffs,,Regulation Special Interest,,Government Management,0.041,0.999,0.317,-0.112,0.909,0.972,-33.73106,0.917
2017-01-23 07:31:50,RH0670004,67,House,4,1921-04-15,,275,116,"TO PASS H. R. 2435 (42 SLAT. 9, APP. 5/27/21), A BILL IMPOSING TEMPORARY DUTIES ON CERTAIN AGRICULTURAL PRODUCTS TO MEET PRESENT EMERGENCIES, AND PROVIDE REVENUES, TO REG- ULATE COMMERCE WITH FOREIGN COUNTRIES, TO PREVENT DUMPING OF FOREIGN MERCHANDISE O U",Tariffs,,Regulation Special Interest,,Government Management,-0.034,0.697,-0.2,0.048,0.776,0.934,-72.604674,0.831
2017-01-23 07:31:50,RH0670005,67,House,5,1921-04-28,,72,266,"TO RECOMMIT TO THE COMMITTEE ON JUDICIARY H. R. 4810 (42 STAT. 849, APP. 9/19/22), A BILL AUTHORIZING THE INCORPORATION OF COMPANIES TO PROMOTE TRADE IN CHINA, WITH INSTRUCTIONS TO REPORT AN AMENDMENT STRIKING OUT SEC. 231 AND SEC. 254 OF THE REVENUE ACTOF 1918",,,Foreign Policy Resolutions,Government Organization,Foreign and Defense Policy,0.143,0.99,0.137,-0.439,0.403,0.873,-83.165074,0.782
2017-01-23 07:31:50,RH0670006,67,House,6,1921-05-02,,251,126,"TO ORDER A SECOND TO THE MOTION TO SUSPEND THE RULES AND PASS S. J. RES. 30 (APP. 5/5/21), AUTHORIZING THE PRESIDENT TO APPOINT A REPRESENTATIVE OF THE EXECUTIVE TO COOPERATE WITH THE JOINT COMMITTEE ON REORGANIZATION.",,,Government Organization,,Government Management,-0.048,-0.013,-0.737,0.525,0.992,0.997,-3.157511,0.992
2017-01-23 07:31:50,RH0670007,67,House,7,1921-05-02,,126,244,"TO ADJOURN, MOTION MADE DURING CONSIDERATION OF S. J. RES. 30 (APP. 5/5/21), AUTHORIZING THE PRESIDENT TO APPOINT A REPRESENTATIVE OF THE EXECUTIVE TO CO-OPERATE WITH THE JOINT COMMITTEE ON REORGANIZATION.  (P.937-2)",,,Government Organization,,Government Management,-0.044,-0.01,0.725,-0.525,0.992,0.997,-2.962917,0.992
2017-01-23 07:31:50,RH0670008,67,House,8,1921-05-02,,255,54,TO DISPENSE WITH FURTHER PROCEEDINGS UNDER THE CALL OF THE HOUSE.,,,Internal Organization,,Miscellaneous Policy,-0.329,-0.227,-0.228,0.098,0.296,0.877,-68.115056,0.802
2017-01-23 07:31:50,RH0670009,67,House,9,1921-05-02,,224,98,"TO SUSPEND THE RULES AND PASS S. J. RES. 30 (APP. 5/5/21), AUTHORIZING THE PRESIDENT TO APPOINT A REPRESENTATIVE OF THE EXECUTIVE TO CO-OPERATE WITH THE JOINT COMMITTEE ON REORGANIZATION.  (P.943-2)",,,Government Organization,,Government Management,-0.087,0.166,-0.381,0.378,0.949,0.984,-15.065424,0.954
2017-01-23 07:31:50,RH0670010,67,House,10,1921-05-03,,163,171,"TO ORDER THE THIRD READING OF S. J. RES. 3, GRANTING TO EMIL FISCHER ALL RIGHTS AND PRIVILEGES OF A CITIZEN OF THE UNITED STATES BY AN ACT OF CONGRESS.  (P.971-2)",Immigration/Naturalization,,Domestic Social Policy,,Government Management,-0.733,-0.461,-0.087,0.653,0.405,0.71,-177.06215,0.589
2017-01-23 07:31:50,RH0670011,67,House,11,1921-05-04,,97,231,"TO RECOMMIT TO THE COMMITTEE ON JUDICIARY H. R. 2373 (42 STAT. 388, APP. 2/18/22), AUTHORIZING COOPERATIVE ASSOCIATIONS AMONG FARMERS FOR THE PURPOSE OF MARKETING THEIR PRODUCTS, WITH INSTRUCTIONS TO REPORT THE SAME WITH AMENDMENTS.  (P.1033-1, 1045-1)",Agriculture,,Regulation Special Interest,,Agriculture,-0.021,0.991,0.156,-0.073,0.649,0.896,-98.571004,0.74
2017-01-23 07:31:50,RH0670012,67,House,12,1921-05-04,,297,51,"TO PASS H. R. 2373 (42 STAT. 388, APP. 2/18/22), AUTHORIZING COOPERATIVE ASSOCIATIONS AMONG FARMERS FOR THE PURPOSE OF MARKETING THEIR PRODUCTS.  (P.1045-2)",Agriculture,,Regulation Special Interest,,Agriculture,0.428,-0.705,0.015,-0.417,0.176,0.879,-107.954205,0.733
2017-01-23 07:31:50,RH0670013,67,House,13,1921-05-05,,286,66,"TO PASS H. R. 2376, A BILL TO AMEND SEC. 858 OF THE REVISED STATUTES OF THE UNITED STATES RELATING TO COMPETENCY OF WITNESSES.  (P.1073-1)",,,Domestic Social Policy,,Civil Liberties,0.576,-0.05,0.139,-0.111,0.106,0.832,-147.926867,0.657
2017-01-23 07:31:50,RH0670014,67,House,14,1921-05-05,,59,297,"TO RECOMMIT TO THE SELECT COMMITTEE ON THE BUDGET S. 1084 (42 STAT. 20, APP. 6/10/21), PROVIDING FOR A NATIONAL BUDGET SYSTEM AND AN INDEPENDENT AUDIT OF GOVERNMENT ACCOUNTS, WITH INSTRUCTIONS TO AMEND BY LIMITING TERM TO OFFICE FOR CERTAIN EMPLOYEES OF HE GOVERNMENT TO 7 YEARS INSTEAD OF ""DURING GOOD BEHAVIOR""",,,Government Organization,,Government Management,-0.03,0.931,0.157,-0.393,0.373,0.896,-74.092282,0.812
2017-01-23 07:31:50,RH0670015,67,House,15,1921-05-05,,346,10,"TO PASS S. 1084 (42 STAT. 20, APP. 6/10/21), TO PROVIDE A NATIONAL BUDGET SYSTEM AND AN INDEPENDENT AUDIT OF GOVERN- MENT ACCOUNTS.",,,Government Organization,,Government Management,-0.508,-0.861,-0.211,-0.164,-0.1,0.969,-41.392754,0.89
2017-01-23 07:31:50,RH0670016,67,House,16,1921-05-06,,287,47,TO SUSTAIN THE DECISION OF THE CHAIR THAT MR. TINKHAM'S RESOLUTION IS NOT PRIVILIGED UNDER THE HOUSE RULES.  THE RESOLUTION RELATES TO APPORTIONMENT OF REPRESENTATIVES PURSUANT TO THE 1920 CENSUS.  (P.1125-1),Ratio of Representatives to Population,,Internal Organization,,Miscellaneous Policy,0.526,0.851,0.129,0.125,0.021,0.862,-136.412586,0.665
2017-01-23 07:31:50,RH0670017,67,House,17,1921-05-10,,200,165,"TO AMEND H. R. 5010 (APP. 6/30/21), MAKING APPROPRIATIONS FOR THE ARMY FOR FISCAL 1922, BY REDUCING THE APPROPRIATIONS THEREIN.  (P.1279-2)",,,Defense Policy Budget,,Foreign and Defense Policy,0.088,-0.353,0.161,-0.44,0.642,0.838,-130.709131,0.699
2017-01-23 07:31:50,RH0670018,67,House,18,1921-05-10,,184,170,"TO AMEND H. R. 5010 (APP. 6/30/21), MAKING APPROPRIATIONS FOR THE ARMY FOR FISCAL 1922, BY REDUCING THE NUMBER OF ENLISTED MEN.  (P.1280-2)",,,Defense Policy Budget,,Foreign and Defense Policy,0.398,0.435,0.24,-0.449,0.729,0.87,-108.638482,0.736
2017-01-23 07:31:50,RH0670019,67,House,19,1921-05-13,,271,71,"TO PASS H. R. 5676 (42 STAT. 187, APP. 8/24/21), TAXING CONTRACTS AND OPTIONS FOR THE SALE OF GRAIN FOR FUTURE DELIVERY, AND PROVIDING FOR THE REGULATION OF BOARDS OF TRADE.",Tax rates,,Budget Special Interest,Regulation Special Interest,Agriculture,0.275,-0.394,0.051,-0.494,0.352,0.865,-112.976822,0.719
2017-01-23 07:31:50,RH0670020,67,House,20,1921-05-13,,240,106,"TO PASS H. RES. 90, PROVIDING THAT H. R. 2435, IMPOSING TEMPORARY DUTIES UPON CERTAIN AGRICULTURAL PRODUCTS TO MEET PRESENT EMERGENCIES AND PROVIDE REVENUE; TO REGULATE COMMERCE WITH FOREIGN COUNTRIES; TO PREVENT DUMPING OF FOREIGN MERCHANDISE ON U.S. MAKETS; AND TO REGULATE THE VALUE OF FOREIGN MONEY; BE TAKEN FROM THE SPEAKERS TABLE AND SPEAKER APPOINT THE CONFEREES",Tariffs,,Regulation Special Interest,,Government Management,-0.115,0.156,-0.255,0.212,0.858,0.957,-41.911371,0.886
2017-01-23 07:31:50,RH0670021,67,House,21,1921-05-13,,285,41,"TO AGREE TO THE CONFERENCE REPORT ON H. R. 4075 (42 STAT. 5, APP. 5/19/21), LIMITING THE IMMIGRATION OF ALIENS INTO THE UNITED STATES.  (P.1443-1)",Immigration/Naturalization,,Domestic Social Policy,,Social Welfare,-0.219,-0.419,-0.081,-0.626,0.415,0.926,-62.595141,0.825
2017-01-23 07:31:50,RH0670022,67,House,22,1921-05-23,,268,118,"TO AGREE TO CONFERENCE REPORT ON H. R. 2435 (42 STAT. 9, APP. 5/27/21), IMPOSING TEMPORARY DUTIES UPON CERTAIN AGRICULTURAL PRODUCTS TO MEET PRESENT EMERGENCIES AND PROVIDE REVENUE; TO REGULATE COMMERCE WITH FOREIGN COUNTRIES; TO PREVENT DUMPING OF FOREIN MERCHANDISE ON U",Tariffs,,Regulation Special Interest,,Government Management,-0.041,0.521,-0.204,0.091,0.831,0.948,-60.492495,0.855
2017-01-23 07:31:50,RH0670023,67,House,23,1921-05-25,,246,135,"TO PASS H. RES. 101, GIVING THE RIGHT TO OFFER AND CONSIDER CERTAIN AMENDMENTS IN H. R. 6300, A BILL TO SUPPLY DEFICIENCIES IN APPROPRIATIONS FOR FISCAL 1921 AND PRIOR FISCAL YEARS.  (P.1768-2)",,,Budget Special Interest,,Government Management,-0.013,-0.331,-0.277,0.185,0.948,0.982,-32.176112,0.919
2017-01-23 07:31:50,RH0670024,67,House,24,1921-05-26,,194,157,"TO AMEND H. R. 6300, BY INCREASING THE LIMIT OF EXPENDITURES FOR THE MAINTENANCE BUREAU OF SUPPLIES AND ACCOUNTS.",,,Budget Special Interest,,Government Management,-0.338,-0.347,-0.075,0.323,0.42,0.741,-180.505737,0.598
2017-01-23 07:31:50,RH0670025,67,House,25,1921-05-26,,244,109,TO AMEND H. R. 6300 BY MAKING VARIOUS APPROPRIATIONS FOR SALARIES AND PROVIDING FOR TRANSFER OF MONEYS.  (P.1798-1),,,Budget Special Interest,,Government Management,-0.164,-0.21,-0.285,0.517,0.89,0.966,-36.932008,0.901
2017-01-23 07:31:50,RH0670026,67,House,26,1921-05-26,,308,27,TO PASS H. R. 6300.,,,Budget Special Interest,,Government Management,-0.494,-0.229,-0.248,0.151,0.0,0.919,-60.217109,0.835
2017-01-23 07:31:50,RH0670027,67,House,27,1921-05-27,,335,3,"TO AGREE TO THE CONFERENCE REPORT ON S. 1084 (42 STAT. 20, APP. 6/10/21), A BILL TO PROVIDE A NATIONAL BUDGET SYSTEM AND AN INDEPENDENT AUDIT OF GOVERNMENT ACCOUNTS.",,,Government Organization,,Government Management,0.0,0.0,0.0,0.0,,,0.0,
2017-01-23 07:31:50,RH0670028,67,House,28,1921-06-01,,96,195,"TO RECOMMIT TO THE COMMITTEE ON INTERSTATE AND FOREIGN COMMERCE H. R. 6567 (42 STAT. 27, APP. 6/10/21), A BILL TO AMEND SEC. 407 OF THE TRANSPORTATION ACT OF 1920, WITH INSTRUCTIONS TO ADD A PROVISION THAT NOTHING IN THIS ACT SHALL AFFECT EXISTING STATE AWS REGARDING CONSOLIDATION AND ACQUISITION",Interstate Commerce/Anti-trust/Restraint of Commerce,,Regulation General Interest,,Government Management,0.371,0.929,0.207,-0.583,0.792,0.931,-57.111659,0.822
2017-01-23 07:31:50,RH0670029,67,House,29,1921-06-02,,71,258,"TO RECOMMIT TO THE COMMITTEE ON AGRICULTURE H. R. 6320 (42 STAT. 159, APP. 8/15/21), REGULATING INTERSTATE AND FOREIGN COMMERCE IN CERTAIN FARM COMMODITIES, WITH INSTRUC- TIONS TO ELIMINATE THE SECTION AUTHORIZING THE SECRETARY OF AGRICULTURE TO PRESCRIB THE RATE OR PRACTICE TO BE OBSERVED BY MARKET AGENICIES, WHENEVER IT FINDS THAT THEY USE A RATE OR PRACTICE WHICH CAUSES AN UNDUE ADVANTAGE BETWEEN INTER- STATE COMMERCE AND INTERSTATE OR FOREIGN COMMERCE",Interstate Commerce/Anti-trust/Restraint of Commerce,,Regulation General Interest,,Agriculture,-0.258,-0.225,0.144,-0.056,0.296,0.848,-105.266013,0.726
2017-01-23 07:31:50,RH0670030,67,House,30,1921-06-07,,259,133,"TO PASS H. RES. 107, PROVIDING THAT H. R. 4803, MAKING APPROPRIATIONS FOR THE NAVAL SERVICE FOR FISCAL 1922, BE TAKEN FROM THE SPEAKERS TABLE, THAT THE SENATE AMENDMENTS BE DISAGREED TO, AND THAT THE SPEAKER APPOINT CONFEREES. (P.2206-2)",,,Defense Policy Budget,,Foreign and Defense Policy,-0.016,0.026,-0.407,0.56,0.955,0.985,-18.534178,0.954
2017-01-23 07:31:50,RH0670031,67,House,31,1921-06-08,,276,31,"TO CONCUR IN A SENATE AMENDMENT TO H. R. 6300 (APP. 6/16/21), A BILL TO SUPPLY DEFICIENCIES IN APPROPRI- ATIONS FOR FISCAL 1921 AND PRIOR FISCAL YEARS, WHICH AMEND- MENT MAKES AN APPROPRIATION FOR PUBLIC SCHOOLS.",Education,,Budget Special Interest,,Government Management,-0.124,0.992,-0.053,0.458,0.032,0.902,-75.961952,0.781
2017-01-23 07:31:50,RH0670032,67,House,32,1921-06-08,,187,81,TO RECEDE AND CONCUR IN A SENATE AMENDMENT TO H. R. 6300 WHICH AMENDMENT PROVIDES FOR EXPENSES OF AN INTERDEPART- MENTAL SOCIAL HYGENIC BOARD TO ASSIST STATES IN PROTECTING THE MILITARY AND NAVAL FORCES AGAINST VENEREAL DISEASES. (P.2286-1),Public Health,,Domestic Social Policy,,Social Welfare,-0.071,0.403,-0.1,0.16,0.494,0.847,-108.188295,0.668
2017-01-23 07:31:50,RH0670033,67,House,33,1921-06-08,,260,13,"TO RECEDE AND CONCUR IN A SENATE AMENDMENT H. R. 6300, WHICH AMENDMENT ADDS AN APPROPRIATION FOR SALARIES AND EXPENSES OF PASSPORT BUREAUS IN THE DEPARTMENT OF STATE.",,,Budget Special Interest,,Government Management,0.731,0.172,0.208,0.268,0.077,0.956,-44.327986,0.85
2017-01-23 07:31:50,RH0670034,67,House,34,1921-06-08,,144,132,"TO RECEDE AND CONCUR IN A SENATE AMENDMENT TO H. R. 6300, WHICH AMENDMENT MAKES AN APPROPRIATION FOR SALARIES FOR THE UNDER SECRETARY OF THE TREASURY AND OTHERS.  (P.2291-2)",,,Budget Special Interest,,Government Management,-0.054,-0.739,-0.165,0.26,0.659,0.837,-102.260479,0.69
2017-01-23 07:31:50,RH0670035,67,House,35,1921-06-08,,189,77,"TO ORDER THE PREVIOUS QUESTION ON RECEDING AND CONCURRING IN A SENATE AMENDMENT TO H. R. 6300, WHICH AMENDMENT FIXES SALARIES AND EXPENSES IN THE OFFICE OF THE COMPTROLLER OF CURRENCY.  (P.2293-1)",,,Budget Special Interest,,Government Management,0.054,0.616,-0.243,0.32,0.883,0.966,-28.669216,0.898
2017-01-23 07:31:50,RH0670036,67,House,36,1921-06-10,,224,113,"TO RECOMMIT TO THE COMMITTEE ON INTERSTATE AND FOREIGN COMMERCE H. R. 6611 (42 STAT. 147, APP. 8/9/21), ESTAB- LISHING IN THE TREASURY DEPARTMENT A VETERANS BUREAU, IMPROVING THE FACILITIES AND SERVICE OF SUCH BUREAU, AND AMENDING THE WAR RISK INSURANCE CT WITH INSTRUCTIONS TO INCREASE THE VETERANS DISABILITY COMPENSATION",Military Pensions/Veterans Benefits,,Government Organization,,Government Management,-0.464,-0.886,-0.087,0.082,0.221,0.739,-190.139805,0.569
2017-01-23 07:31:50,RH0670037,67,House,37,1921-06-10,,334,0,"TO PASS H. R. 6611 (42 STAT. 147, APP. 8/9/21), A BILL ESTABLISHING IN THE TREASURY DEPARTMENT A VETERANS BUREAU, IMPROVING THE FACILITIES AND SERVICE OF SUCH BUREAU, AND AMENDING THE WAR RISK INSURANCE ACT.  (P.2428-2)",Military Pensions/Veterans Benefits,,Government Organization,,Government Management,0.0,0.0,0.0,0.0,,,0.0,
2017-01-23 07:31:50,RH0670038,67,House,38,1921-06-11,,213,105,"TO PASS H. RES. 110, PROVIDING FOR THE IMMEDIATE CONSID- ERATION OF S. J. RES. 16 (42 STAT. 105, APP. 7/2/21), TER- MINATING THE STATE OF WAR BETWEEN THE IMPERIAL GERMAN GOVERNMENT AND THE UNITED STATES OF AMERICA AND BETWEEN THE IMPERIAL ROYAL AUSTRO-HUGARIAN GOVERNMENT AND THE UNITED STATES OF AMERICA",,,Foreign Policy Resolutions,,Foreign and Defense Policy,-0.059,0.03,-0.316,0.327,0.933,0.978,-21.892391,0.933
2017-01-23 07:31:50,RH0670039,67,House,39,1921-06-13,,112,254,"TO RECOMMIT TO THE COMMITTEE ON FOREIGN AFFAIRS S. J. RES. 16,WITH INSTRUCTIONS THAT AN AMENDMENT CONCERNING JOINT DISARMAMENT MAY BE ADDED.  (P.2546-1)",,,Foreign Policy Resolutions,,Foreign and Defense Policy,-0.008,0.039,0.743,-0.477,1.0,1.0,-1.696438,0.995
2017-01-23 07:31:50,RH0670040,67,House,40,1921-06-13,,304,61,TO PASS S. J. RES. 16.,,,Foreign Policy Resolutions,,Foreign and Defense Policy,-0.331,0.123,-0.212,0.252,0.393,0.899,-78.067555,0.807
2017-01-23 07:31:50,RH0670041,67,House,41,1921-06-15,,166,113,"TO AMEND H. R. 6754, A BILL AMENDING AN ACT TO PROMOTE WELFARE OF AMERICAN SEAMEN.  SEE GLOBE, PAGE 2644-2 FOR DETAILS.",Shipping/Maritime,,Domestic Social Policy,,Government Management,0.551,0.834,0.087,-0.115,0.239,0.692,-164.60092,0.554
2017-01-23 07:31:50,RH0670042,67,House,42,1921-06-15,,129,159,"TO RECOMMIT TO THE COMMITTEE ON MERCHANT MARINE AND FISHERIES H. R. 6754, WITH INSTRUCTIONS TO ADD AN ADMENDMENT.  (P.2645-2)",Shipping/Maritime,,Domestic Social Policy,,Government Management,0.438,0.899,0.047,-0.126,0.186,0.635,-181.801796,0.532
2017-01-23 07:31:50,RH0670043,67,House,43,1921-06-15,,190,102,TO PASS H. R. 6754.,Shipping/Maritime,,Domestic Social Policy,,Government Management,0.039,-0.999,-0.058,-0.043,-0.059,0.63,-180.01507,0.54
2017-01-23 07:31:50,RH0670044,67,House,44,1921-06-17,,154,135,"TO RECEDE AND CONCUR IN A SENATE AMENDMENT TO H. R. 5010 (APP. 6/30/21), A BILL MAKING APPROPRIATIONS FOR THE SUPPORT OF THE ARMY FOR FISCAL 1922, WHICH AMENDMENT WOULD INCREASE THE APPROPRIATIONS THEREIN.  (P.2733-1)",,,Defense Policy Budget,,Foreign and Defense Policy,-0.024,-0.279,-0.188,0.501,0.696,0.858,-88.360671,0.737
2017-01-23 07:31:50,RH0670045,67,House,45,1921-06-17,,163,133,"TO RECEDE AND CONCUR IN A SENATE AMENDMENT TO H. R. 5010 (APP. 6/30/21), A BILL MAKING APPROPRIATION FOR THE SUPPORT OF THE ARMY FOR FISCAL 1922, WITH AN AMENDMENT REDUCING THE APPROPRIATION INCREASE PROPOSED BY THE SENATE AMENDMENT. (P.2734-1)",,,Defense Policy Budget,,Foreign and Defense Policy,-0.0,-0.173,-0.166,0.431,0.699,0.865,-92.493355,0.732
2017-01-23 07:31:50,RH0670046,67,House,46,1921-06-20,,237,15,"TO SUSPEND THE RULES AND PASS H. R. 6877 (42 STAT. 171, APP. 8/19/21), A BILL TO PERMIT A COMPACT BETWEEN THE STATES OF ARIZONA, CALIFORNIA, COLORADO, NEVADA, NEW MEXICO, UTAH AND WYOMING RESPECTING THE DISPOSITION AND APPORTIONMENT OF THE WATERS OF THE OLORADO RIVER",,,Regulation Special Interest,,Government Management,0.621,0.783,0.107,1.574,-0.267,0.925,-43.119918,0.843
2017-01-23 07:31:50,RH0670047,67,House,47,1921-06-20,,208,42,"TO SUSPEND RULES AND PASS S. J. RES 34 (APP. 6/25/21), CREATING A COMMISSION TO REPRESENT THE UNITED STATES IN THE CELEBRATION OF THE FIRST CENTENNIAL OF THE PROCLAMATION OF THE INDEPENDENCE OF THE REPUBLIC OF PERU.  (P.2777-2)",,,Foreign Policy Resolutions,,Foreign and Defense Policy,-0.351,0.496,-0.128,0.47,0.31,0.884,-69.751199,0.757
2017-01-23 07:31:50,RH0670048,67,House,48,1921-06-20,,188,71,"TO SUSPEND THE RULES AND PASS H. J. RES. 153 (42 STAT. 173, APP. 8/22/21), PERMITTING THE ADMISSION OF CERTAIN ALIENS WHO SAILED FROM FORIEGN PORTS ON OR BEFORE JUNE 8, 1921. (P.2778-2)",Immigration/Naturalization,,Domestic Social Policy,,Social Welfare,-0.143,0.388,-0.152,0.457,0.69,0.915,-62.078755,0.787
2017-01-23 07:31:50,RH0670049,67,House,49,1921-06-21,,267,6,"TO PASS H. R. 2158 (42 STAT. 505, APP. 5/3/22), PROVIDING FOR THE MONTHLY PAYMENT OF PENSIONS.  (P.2869-2)",Military Pensions/Veterans Benefits,,Defense Policy Budget,,Foreign and Defense Policy,0.0,0.0,0.0,0.0,,,0.0,
2017-01-23 07:31:50,RH0670050,67,House,50,1921-06-24,,219,103,"TO AMEND S. 1837 (APP. 7/1/21), A BILL TO AMEND THE FEDERAL FARM LOAN ACT OF 1916, BY ADDING A PROVISION THAT UNTIL THE AGGREGATE PAIDIN CAPITAL OF THE 12 FEDERAL LAND BANKS SHALL BE $50,000,000 OR MORE, THE SECRETARY OF THE TREASURY MAY MAKE DEPOSITS INADDITION TO THOSE AUTHORIZED.",Banking and Finance,,Budget Special Interest,,Agriculture,-0.063,0.06,-0.366,0.259,0.981,0.994,-11.951287,0.964
2017-01-23 07:31:50,RH0670051,67,House,51,1921-06-24,,317,4,"TO PASS S. 1837 (APP. 7/1/21), A BILL AMENDING THE FEDERAL FARM LOAN ACT, OF 1916.  (P.3043-2)",Banking and Finance,,Budget Special Interest,,Agriculture,0.0,0.0,0.0,0.0,,,0.0,
2017-01-23 07:31:50,RH0670052,67,House,52,1921-06-27,,270,79,"TO PASS S. 1072 (42 STAT. 212, APP. 11/9/21), A BILL TO AMEND AN ACT OF 1916 TO PROVIDE THAT THE UNITED STATES SHALL AID THE STATES IN THE CONSTRUCTION OF RURAL POST ROADS AND FOR OTHER PURPOSES.  (P.3086-2)",Public Works,,Budget Special Interest,,Government Management,0.923,0.207,0.102,-0.437,0.228,0.825,-144.918167,0.66
2017-01-23 07:31:50,RH0670053,67,House,53,1921-06-27,,268,102,"TO SUSPEND THE RULES AND PASS H. R. 7294 (42 STAT. 222, APP. 11/23/21), A BILL SUPPLEMENTING THE NATIONAL PROHIBI- TION ACT.  (P.3136-1)",Temperance and Liquor,,Domestic Social Policy,,Social Welfare,-0.174,-0.093,-0.048,-0.677,0.608,0.892,-121.497564,0.72
2017-01-23 07:31:50,RH0670054,67,House,54,1921-06-28,,239,72,"TO RECEDE AND CONCUR IN A SENATE AMENDMENT TO H. R. 4803 (APP. 7/12/21), A BILL MAKING APPROPRIATIONS FOR THE NAVAL SERVICE FOR FISCAL 1922, WITH AN AMENDMENT REDUCING THE APPROPRIATION INCREASE PROPOSED BY THE SENATE AMENDMENT. (P.3177-2)",,,Defense Policy Budget,,Foreign and Defense Policy,0.132,0.589,0.029,0.67,0.236,0.823,-116.472734,0.688
2017-01-23 07:31:50,RH0670055,67,House,55,1921-06-28,,222,96,"TO RECEDE AND CONCUR IN A SENATE AMENDMENT, TO H. R. 4803, WHICH AMENDMENT MAKES APPROPRIATIONS FOR CERTAIN NEW CONSTRUCTION.  (P.3182-2)",,,Defense Policy Budget,,Foreign and Defense Policy,0.166,0.505,0.035,0.52,0.281,0.783,-144.185844,0.635
2017-01-23 07:31:50,RH0670056,67,House,56,1921-06-29,,202,123,"TO RECEDE AND CONCUR IN A SENATE AMENDMENT TO H. R. 4803, WHICH AMENDMENT PROVIDES FOR A BUREAU OF AERONAUTICS IN THE NAVY.",,,Defense Policy Resolutions,Government Organization,Foreign and Defense Policy,-0.161,0.765,0.08,0.436,0.382,0.766,-165.536278,0.601
2017-01-23 07:31:50,RH0670057,67,House,57,1921-06-29,,333,5,"TO RECEDE AND CONCUR IN A SENATE AMENDMENT TO H. R. 4803, WHICH AMENDMENT AUTHORIZES THE PRESIDENT TO INVITE GREAT BRITAIN AND JAPAN TO A CONFERENCE TO REDUCE NAVAL CONSTRUCTION DURING THE NEXT FIVE YEARS.",,,Defense Policy Resolutions,,Foreign and Defense Policy,0.0,0.0,0.0,0.0,,,0.0,
2017-01-23 07:31:50,RH0670058,67,House,58,1921-06-30,,277,71,"TO AGREE TO THE CONFERENCE REPORT ON S. J. RES. 16 (42 STAT. 105, APP. 7/2/21), TERMINATING THE STATE OF WAR BETWEEN THE IMPERIAL GERMAN GOVERNMENT AND THE UNITED STATES AND BETWEEN THE IMPERIAL AND ROYAL AUSTRO-HUNGARIAN GOVERN- MENT AND THE UNITED STATS OF AMERICA.",,,Foreign Policy Resolutions,,Foreign and Defense Policy,-0.303,0.144,-0.199,0.204,0.338,0.865,-85.068263,0.783
2017-01-23 07:31:50,RH0670059,67,House,59,1921-07-06,,63,203,"TO STRIKE OUT THE ENACTING CLAUSE OF H. R. 4981, A BILL AMENDING AN ACT FOR PREVENTING THE MANUFACTURE, SALE, OR TRANSPORTATION OF ADULTERATED, MISBRANDED OR DELETERIOUS FOODS, DRUGS, MEDICINES, AND LIQUORS, AND FOR REGULATING TRAFFIC THEREIN.",Public Safety,,Regulation General Interest,,Social Welfare,0.711,0.534,-0.152,0.338,0.238,0.82,-109.736539,0.662
2017-01-23 07:31:50,RH0670060,67,House,60,1921-07-08,,54,252,"TO RECEDE AND CONCUR IN A SENATE AMENDMENT TO H. R. 4803 (APP. 7/12/21), A BILL MAKING APPROPRIATIONS FOR THE NAVAL SERVICE FOR FISCAL 1922, WHICH AMENDMENT PROVIDES THAT ALL CONTRACTS FOR WORK AND MATERIALS WITH GOVERNMENT OWNED ESTABLISHMENTS SHALL BE ONSIDERED IN THE SAME MANNER AS CONTRACTS WITH PRIVATE CONTRACTORS.",,,Defense Policy Resolutions,,Foreign and Defense Policy,-0.423,-0.906,0.048,0.195,0.0,0.824,-141.279124,0.63
2017-01-23 07:31:50,RH0670061,67,House,61,1921-07-12,,256,134,"TO PASS H. RES. 145, PROVIDING THAT THE HOUSE IMMEDIATELY RESOLVE INTO THE COMMITTEE OF THE WHOLE TO CONSIDER H. R. 7456 (42 STAT. 858, APP. 9/21/22), A BILL PROVIDING REVENUE, REGULATING COMMERCE WITH FOREIGN COUNTRIES, AND ENCOURAGING THE INDUSTRIES OFTHE UNITED STATES",Tariffs,,Regulation General Interest,,Government Management,0.014,0.089,-0.329,0.468,0.94,0.979,-27.048891,0.933
2017-01-23 07:31:50,RH0670062,67,House,62,1921-07-15,,236,136,"TO ADJOURN, MOTION MADE DURING CONSIDERATION OF H. R. 7456. (P.3916-1)",Tariffs,,Regulation General Interest,,Government Management,0.059,-0.168,-0.271,0.193,0.926,0.973,-40.996658,0.896
2017-01-23 07:31:50,RH0670063,67,House,63,1921-07-16,,230,134,"TO ADJOURN, MOTION MADE DURING CONSIDERATION OF H. R. 7456. (P.3948-2)",Tariffs,,Regulation General Interest,,Government Management,-0.006,-0.397,-0.402,0.325,0.963,0.986,-18.269359,0.951
2017-01-23 07:31:50,RH0670064,67,House,64,1921-07-21,,210,194,"TO AMEND H. R. 7456, WHICH AMENDMENT RELATES TO DYE STUFF. (P.4194-1)",Tariffs,,Regulation Special Interest,,Government Management,0.214,-0.128,0.151,-0.313,0.66,0.837,-157.389453,0.677
2017-01-23 07:31:50,RH0670065,67,House,65,1921-07-21,,198,217,"TO AMEND H. R. 7456, WHICH AMENDMENT RELATES TO THE TARIFF ON CERTAIN COTTON STAPLE.  (P.4195-1)",Tariffs,,Regulation Special Interest,,Government Management,-0.083,0.997,-0.086,-0.161,0.354,0.692,-245.89098,0.553
2017-01-23 07:31:50,RH0670066,67,House,66,1921-07-21,,173,241,"TO AMEND 7456, WHICH AMENDMENT RELATES TO THE TARIFF ON HIDES.  (P.4195-2)",Tariffs,,Regulation Special Interest,,Government Management,0.58,-0.21,-0.098,-0.377,0.422,0.758,-214.26479,0.596
2017-01-23 07:31:50,RH0670067,67,House,67,1921-07-21,,289,126,TO AGREE TO AMENDMENTS IN GROSS TO H. R. 7456.  (P.4197-1),Tariffs,,Regulation General Interest,,Government Management,-0.114,-0.221,-0.339,0.493,0.905,0.971,-31.146626,0.928
2017-01-23 07:31:50,RH0670068,67,House,68,1921-07-21,,127,288,"TO RECOMMIT TO THE COMMITTEE ON WAYS AND MEANS H. R. 7456, WITH INSTRUCTIONS TO STRIKE OUT CERTAIN SECTIONS. (P.4197-1)",Tariffs,,Regulation General Interest,,Government Management,-0.182,-0.53,0.337,-0.433,0.921,0.976,-33.15229,0.923
2017-01-23 07:31:50,RH0670069,67,House,69,1921-07-21,,294,131,TO PASS H. R. 7456.  (P.4198-1),Tariffs,,Regulation General Interest,,Government Management,0.012,0.199,-0.352,0.612,0.893,0.967,-29.745824,0.932
2017-01-23 07:31:50,RH0670070,67,House,70,1921-07-26,,77,161,"TO ADJOURN, MOTION MADE DURING DEBATE ON H. RES. 151, A BILL TO PROVIDE 1/2 PAYMENT OF EXPENSES OF THE JOINT COMMITTEE ON THE REORGANIZATION OF THE ADMINISTRATIVE BRANCH OF THE GOVERNMENT OUT OF THE CONTINGENT FUND.  (P.4317-1)",,,Internal Organization,Budget Special Interest,Government Management,0.143,0.954,0.356,-0.306,0.974,0.992,-10.973193,0.955
2017-01-23 07:31:50,RH0670071,67,House,71,1921-07-26,,71,127,"TO ADJOURN, MOTION MADE DURING DEBATE ON H. RES. 151. (P.4323-2)",,,Internal Organization,Budget Special Interest,Government Management,0.024,0.437,0.236,-0.083,0.915,0.97,-23.306725,0.889
