date_generated,id,congress,chamber,rollnumber,date,keyvote,yea,nay,description,Issue1,Issue2,Peltzman1,Peltzman2,Clausen1,mid.dim1,mid.dim2,spread.dim1,spread.dim2,pre,classified,log_likelihood,geo_mean_probability
2017-01-23 00:25:07,RS0360078,36,Senate,78,1860-03-02,,21,22,"TO ADJOURN DURING DEBATE ON S. 45, AUTHORIZING THE SALE OF PUBLIC ARMS TO DIFFERENT STATES AND REGULATING APPOINTMENT OF SUPERINTENDENTS OF THE NATIONAL ARMORIES. (P. 951-1)",,,Foreign Policy Resolutions,,Foreign and Defense Policy,0.296,0.939,-0.257,0.614,0.81,0.907,-8.369037,0.823
2017-01-23 00:25:07,RS0360079,36,Senate,79,1860-03-02,,29,15,"ON ORDERING S. 60, (APP. 5-25-60), GRANTING PAYMENT TO MRS. ANN SCOTT WIDOW OF WILLIAM B. SCOTT, 2% ON SUCH SUMS AS HE PAID FROM THE NAVY PENSION FUND DURING THE TIME HE WAS NAVY AGENT OF WASHINGTON.  (P. 965-3)",,,Budget Special Interest,,Government Management,-0.867,-0.056,-0.056,0.34,0.267,0.75,-24.031229,0.579
2017-01-23 00:25:07,RS0360080,36,Senate,80,1860-03-05,,32,20,"TO MAKE S. 230, DECLARATORY OF THE ACTS FOR CARRYING INTO EFFECT THE TREATY OF 1819 BETWEEN THE U.S. AND SPAIN, A SPECIAL ORDER FOR MARCH 19, 1860.  (P. 981-2)",Treaties,,Foreign Policy Resolutions,,Foreign and Defense Policy,0.672,0.601,-0.046,0.619,0.3,0.731,-26.698041,0.598
2017-01-23 00:25:07,RS0360081,36,Senate,81,1860-03-05,,9,37,"TO AMEND S. 53, AMENDING AN ACT TO ESTABLISH A COURT FOR THE INVESTIGATION OF CLAIMS AGAINST THE U.S., APPROVED FEB. 24, 1853, BY PROVIDING THAT ALL CLAIMS ALLOWED BY THE COURT OF CLAIMS SHALL BE PAID WHENEVER CONGRESS MAKES AN APPROPRIATION THEREFOR.  (",Judiciary,,Domestic Social Policy,Government Organization,Government Management,0.222,0.975,-0.054,-0.134,0.0,0.804,-23.477636,0.6
2017-01-23 00:25:07,RS0360082,36,Senate,82,1860-03-05,,11,27,"TO AMEND S. 53, AMENDING AN ACT ESTABLISHING A COURT FOR THE INVESTIGATION OF CLAIMS AGAINST THE U.S., APPROVED FEB. 24, 1853, BY AUTHORIZING THE SECRETARY OF THE TREASURY TO SEND A LIST OF THE BILLS HE WANTS PAID TO THE SENATE. (P. 988-3)",Judiciary,,Domestic Social Policy,Government Organization,Government Management,0.121,0.993,-1.665,0.141,0.273,0.789,-13.25171,0.706
2017-01-23 00:25:07,RS0360083,36,Senate,83,1860-03-06,,12,42,"TO AMEND A RESOLUTION RELATING TO THE EXAMINATION OF A CONTUMACIOUS WITNESS ARRESTED BY THE SERGEANT-AT-ARMS, BY USING THE WORD, ""REASON"" INSTEAD OF ""EXCUSE"", IN THE RESOLUTION SO IT SHALL READ THAT THE WITNESS MUST GIVE A REASON FOR NOT APPEARING BEFOREA SELECT COMMITTEE OF THE SENATE WHEN SUMMONED TO DO SO.",Impeachments and Investigations,,Domestic Social Policy,,Civil Liberties,0.238,-0.965,-0.232,-0.029,0.333,0.852,-15.941958,0.744
2017-01-23 00:25:07,RS0360084,36,Senate,84,1860-03-06,,49,6,"ON ADOPTION OF THE RESOLUTION PROVIDING THAT THADDEUS HYATT, A WITNESS IN THE CUSTODY OF THE SERGEANT-AT-ARMS BE ORDERED TO ANSWER THE QUESTIONS OF THE SENATE SELECT COMMITTEE, IN WRITING AND UNDER OATH. (P. 999-2)",Impeachments and Investigations,,Domestic Social Policy,,Civil Liberties,0.155,-0.988,0.21,-0.409,0.0,0.891,-11.376513,0.813
2017-01-23 00:25:07,RS0360085,36,Senate,85,1860-03-06,,27,17,"TO PROCEED TO THE CONSIDERATION OF H.R.5, (APP. 6-1-60), APPROPRIATING FOR THE WEST POINT ACADEMY FOR THE YEAR ENDING JUNE 30, 1861.  (P. 1012-2)",,,Defense Policy Budget,,Foreign and Defense Policy,-0.078,-0.204,0.678,-0.575,1.0,1.0,-0.167465,0.996
2017-01-23 00:25:07,RS0360086,36,Senate,86,1860-03-07,,23,19,"TO POSTPONE UNTIL TOMMORROW FURTHER CONSIDERATION OF H.R.5, AND ORDER TO BE PRINTED THE PRESIDENT'S MESSAGE AND ACCOMPANYING DOCUMENTS REGARDING ALLEGED HOSTILITIES BETWEEN TEXAS AND MEXICO.  (P. 1022-3)",,,Foreign Policy Resolutions,,Foreign and Defense Policy,-0.24,-0.103,-1.289,0.799,0.842,0.929,-6.841414,0.85
2017-01-23 00:25:07,RS0360087,36,Senate,87,1860-03-08,,8,23,"TO AMEND H.R. 5, BY PROVIDING THAT WHEN THE REGIMENT OF TEXAS MOUNTED VOLUNTEERS HAS BEEN RAISED, THE PRESIDENT SHALL DISBAND AN EQUAL NUMBER OF THE REGULAR ARMY. (P. 1062-3)",,,Foreign Policy Resolutions,,Foreign and Defense Policy,-0.241,-0.971,-0.223,0.54,0.875,0.968,-3.665679,0.888
2017-01-23 00:25:07,RS0360088,36,Senate,88,1860-03-09,,33,15,"TO AMEND S. 73, (APP. 5-7-60), RELATING TO THE PENSION CLAIM OF MRS. ANNE M. SMITH, WIDOW OF GENERAL SMITH, BY ADDING THE NAMES OF MRS. MACOMB AND MRS. RILEY.  (P. 1076-1)",,,Budget Special Interest,,Government Management,-0.931,-0.246,-0.079,0.294,0.2,0.75,-25.737877,0.585
2017-01-23 00:25:07,RS0360089,36,Senate,89,1860-03-09,,36,13,"TO ORDER THE ENGROSSMENT AND THIRD READING OF S. 73, (APP. 5-7-60), REGARDING THE PENSION CLAIM OF MRS. SMITH, MRS. MACOMB, AND MRS. RILEY, WIDOWS OF GENERALS. (P. 1076-3)",,,Budget Special Interest,,Government Management,-0.87,0.18,-0.06,0.191,0.231,0.796,-25.68341,0.592
2017-01-23 00:25:07,RS0360090,36,Senate,90,1860-03-09,,40,12,"THAT THE PAPER OF MR. HYATT BE READ TO THE SENATE, REGARDING THE EXAMINATION OF A WITNESS ARRESTED BY THE SERGEANT-AT-ARMS.  (P. 1081-1)",Impeachments and Investigations,,Internal Organization,,Miscellaneous Policy,-0.607,-0.551,-0.158,0.1,0.083,0.788,-21.079947,0.667
2017-01-23 00:25:07,RS0360091,36,Senate,91,1860-03-12,,44,10,"ON ADOPTION OF THE RESOLUTION PROVIDING THAT MR. HYATT BE COMMITTED TO THE COMMON JAIL OF THE DISTRICT OF COLUMBIA, UNTIL HE IS READY AND WILLING TO ANSWER THE QUESTIONS OF THE SENATE.  (P. 1100-1)",Impeachments and Investigations,,D. C.,Domestic Social Policy,Civil Liberties,0.158,-0.987,0.155,-0.154,0.3,0.87,-17.708731,0.72
2017-01-23 00:25:07,RS0360092,36,Senate,92,1860-03-13,,31,23,"TO POSTPONE S. 1, THE HOMESTEAD BILL, AND MAKE IT THE SPECIAL ORDER OF THURSDAY.  (P. 1119-3)",Public Lands,,Budget Special Interest,,Government Management,0.024,0.768,-0.276,0.663,0.739,0.889,-11.755076,0.804
2017-01-23 00:25:07,RS0360093,36,Senate,93,1860-03-13,,16,33,"TO AMEND S. 53, ESTABLISHING A COURT FOR THE INVESTIGATION OF CLAIMS AGAINST THE U.S., BY PAYING PRIVATE CLAIMS WHEN ALLOWED, FROM APPROPRIATIONS THEREAFTER MADE.  (P. 1125-3)",Judiciary,,Domestic Social Policy,Government Organization,Government Management,0.104,0.995,-0.125,0.002,0.25,0.755,-22.723373,0.629
2017-01-23 00:25:07,RS0360094,36,Senate,94,1860-03-13,,18,31,"TO AMEND S. 53, BY PROVIDING THAT IF A PRIVATE CLAIM SHALL EXCEED THE SUM OF $20,000, IT SHALL NOT BE PAYABLE, UNTIL CONGRESS SHALL MAKE A SPECIAL APPROPRIATION.  (P. 1128-3)",,,Budget Special Interest,,Government Management,0.012,1.0,-0.096,-0.001,0.222,0.714,-26.201241,0.586
2017-01-23 00:25:07,RS0360095,36,Senate,95,1860-03-13,,16,35,"TO AMEND S. 53, BY PROVIDING THAT A FEDERAL JUDGE, IF CONVINCED THAT A BALANCE IS DUE A PERSON MAY ORDER SAME PAID OUT OF THE TREASURY.  (P. 1128-3)",Banking and Finance,,Budget Special Interest,,Government Management,-0.058,0.998,-0.155,-0.073,0.25,0.765,-20.163974,0.673
2017-01-23 00:25:07,RS0360096,36,Senate,96,1860-03-13,,40,6,"TO AMEND S. 53, BY FORBIDDING ANY U.S. OFFICER FROM ACTING AS AGENT OR ATTORNEY FOR ANY PERSON HAVING A CLAIM AGAINST THIS GOVERNMENT.  (P. 1129-1)",Judiciary,,Internal Organization,,Miscellaneous Policy,-0.687,-0.726,-0.186,0.04,0.0,0.87,-15.238708,0.718
2017-01-23 00:25:07,RS0360097,36,Senate,97,1860-03-13,,35,17,TO PASS S. 53.  (P. 1129-2),Judiciary,,Domestic Social Policy,Government Organization,Government Management,0.44,0.891,0.114,-0.142,0.235,0.75,-27.447356,0.59
2017-01-23 00:25:07,RS0360098,36,Senate,98,1860-03-14,,16,32,"TO AMEND H.R.5, (APP. 6-1-60), MAKING APPROPRIATIONS FOR THE WEST POINT ACADEMY FOR 1860, BY PROVIDING THAT WHEN THE REGIMENT OF MOUNTED VOLUNTEERS SHALL HAVE BEEN RAISED, THE PRESENT FORCE OF THE U.S. TROOPS SHALL BE REDUCED BY ONE MOUNTED REGIMENT.",,,Defense Policy Budget,,Foreign and Defense Policy,-0.01,-1.0,-0.168,0.121,0.562,0.854,-16.615183,0.707
2017-01-23 00:25:07,RS0360099,36,Senate,99,1860-03-14,,12,33,"TO AMEND H.R.5, BY DENYING THE REGIMENT OF TEXAS MOUNTED VOLUNTEERS ENTRANCE INTO THE U.S. SERVICE, EXCEPT UPON THE OPINION OF THE LIEUTENANT GENERAL OF THE UNITED STATES. (P. 1143-2)",,,Foreign Policy Resolutions,,Foreign and Defense Policy,0.104,0.995,-0.242,-0.0,,,-11.681115,0.771
2017-01-23 00:25:07,RS0360100,36,Senate,100,1860-03-14,,15,32,"TO AMEND H.R.5, BY MAKING THE TERM OF STUDY FOUR YEARS AT WEST POINT ACADEMY.  (P. 1145-1)",,,Foreign Policy Resolutions,,Foreign and Defense Policy,-0.873,-0.007,0.051,0.11,0.0,0.681,-28.652312,0.544
2017-01-23 00:25:07,RS0360101,36,Senate,101,1860-03-14,,37,19,"TO AMEND H.R.5, BY PROVIDING AN APPROPRIATION FOR THE SUPP- -ORT OF ONE REGIMENT OF TEXAS MOUNTED VOLUNTEERS. (P. 1146-2)",,,Defense Policy Budget,,Foreign and Defense Policy,-0.205,-0.895,0.261,-0.481,0.895,0.964,-7.545223,0.874
2017-01-23 00:25:07,RS0360102,36,Senate,102,1860-03-14,,41,11,TO PASS H.R.5.  (P. 1146-2),,,Defense Policy Budget,,Foreign and Defense Policy,0.165,-0.402,0.194,-0.446,0.364,0.865,-11.429943,0.803
2017-01-23 00:25:07,RS0360103,36,Senate,103,1860-03-15,,26,21,"TO RETAIN IN THE TREATY OF FRIENDSHIPS AND COMMERCE BETWEEN THE U.S., AND NICARAGUA, SIGNED AT MANUGUA ON MARCH 16, '59 THE PROVISION PERMITTING THE U.S., TO USE FORCE IN THE CASE OF UNFORSEEN OR IMMINENT DANGER TO THE LIVES OR PROPERTY OF U.S., CITIZENS.",Treaties,,Foreign Policy Budget,,Foreign and Defense Policy,0.27,0.922,0.449,-0.885,0.952,0.979,-3.647814,0.925
2017-01-23 00:25:07,RS0360104,36,Senate,104,1860-03-15,,28,18,"TO RETAIN THE PROVISION IN THE 16TH ARTICLE OF THE TREATY OF FRIENDSHIP BETWEEN THE U.S. AND NICARAGUA, WHICH PROVISION PERMITS THE U.S., TO USE FORCE IN NICARAGUA IN THE CASE OF UNFORSEEN OR IMMINENT DANGER TO THE LIVES OR PROPER- TY OF U.S., CITIZENS.",Treaties,,Foreign Policy Budget,,Foreign and Defense Policy,0.087,0.219,0.698,-0.564,0.944,0.978,-1.580251,0.966
2017-01-23 00:25:07,RS0360105,36,Senate,105,1860-03-15,,26,13,"TO PASS S. 247 (APP. 4-3-60), A BILL TO PAY A PENSION TO MARY CASTOR, WIDOW OF LIEUTENANT THOMAS CASTOR.",,,Budget Special Interest,,Government Management,-0.448,-0.877,-0.153,0.07,0.385,0.795,-16.199285,0.66
2017-01-23 00:25:07,RS0360106,36,Senate,106,1860-03-15,,25,18,"ON PASSAGE OF S. 86, AMENDING THE EXISTING LAWS RELATIVE TO THE COMPENSATION OF THE DISTRICT ATTORNEYS, MARSHALLS AND CLERKS OF THE CIRCUIT AND DISTRICT COURTS OF THE U.S. (P. 1173-1)",Judiciary,,Domestic Social Policy,Budget Special Interest,Government Management,-0.096,-0.965,0.112,-0.081,0.667,0.86,-18.932877,0.644
2017-01-23 00:25:07,RS0360107,36,Senate,107,1860-03-15,,31,14,"ON ADOPTION OF S.J.RES. 6, (APP. 5-24-60), AUTHORIZING THE ENLARGEMENTS AND CONSTRUCTION OF A BRANCH TO THE LOUISVILLE AND PORTLAND CANAL.  (P. 1176-2)",Public Works,,Budget Special Interest,,Government Management,-0.118,0.827,-0.19,0.421,0.5,0.844,-14.588035,0.723
2017-01-23 00:25:07,RS0360108,36,Senate,108,1860-03-16,,38,14,TO RETAIN IN THE TREATY OF FRIENDSHIP AND COMMERCE BETWEEN THE U.S. AND NICARAGUA THE PROVISION PERMITTING THE U.S. TO USE FORCE IN NICARAGUA TO PROTECT LIVES AND PROPERTY OF U.S. CITIZENS.,Treaties,,Foreign Policy Budget,,Foreign and Defense Policy,0.191,0.978,0.203,-0.095,0.571,0.885,-16.337961,0.73
2017-01-23 00:25:07,RS0360109,36,Senate,109,1860-03-16,,34,13,TO RECONSIDER THE VOTE TO RETAIN IN THE TREATY OF FRIENDSHIP AND COMMERCE BETWEEN THE U.S. AND NICARAGUA THE PROVISION PERMITTING THE U.S. TO USE FORCE IN NICARAGUA TO PROTECT LIVES AND PROPERTY OF U.S. CITIZENS.,Treaties,,Foreign Policy Budget,,Foreign and Defense Policy,0.111,-0.282,0.254,-0.338,0.615,0.894,-8.57681,0.833
2017-01-23 00:25:07,RS0360110,36,Senate,110,1860-03-16,,38,8,"TO RETAIN IN ARTICLE 15 OF THE TREATY OF FRIENDSHIP AND COMMERCE BETWEEN THE U.S. AND NICARAGUA THE WORDS ""THEY ALSO AGREE TO EMPLOY THEIR INFLUENCE WITH OTHER NATIONS TO INDUCE THEM TO GUARANTEE SUCH NEUTRALITY AND PROTECTION.""",Treaties,,Foreign Policy Budget,,Foreign and Defense Policy,-0.541,0.809,-0.093,0.198,-0.125,0.804,-19.693625,0.652
2017-01-23 00:25:07,RS0360111,36,Senate,111,1860-03-16,,31,20,TO PASS A SENATE RESOLUTION THAT THE SENATE ADVISE AND CONSENT TO THE RATIFICATION OF THE TREATY OF FRIENDSHIP AND COMMERCE BETWEEN THE U.S. AND NICARAGUA.  (TWO-THIRDS MAJORITY NOT OBTAINED),Treaties,,Foreign Policy Budget,,Foreign and Defense Policy,-0.244,-0.933,0.294,-0.547,0.95,0.98,-5.48532,0.898
2017-01-23 00:25:07,RS0360112,36,Senate,112,1860-03-16,,28,18,"TO AMEND S. 45, A BILL AUTHORIZING THE SALE OF PUBLIC ARMS TO THE STATES AND REGULATING APPOINTMENT OF SUPTS. OF ARSENALS, BY PROVIDING THAT THE ANNUAL SALE SHALL NOT EXCEED THE INCREASED MANUFACTURE RESULTANT FROM SUCH SALES, AND THE NUMBER SOLD, IF LES THAN REQUISITIONS MADE, SHALL BE DIVIDED PRO RATA AS ARMS FURNISHED BY THE U.S",,,Foreign Policy Resolutions,,Foreign and Defense Policy,-0.062,-0.139,0.603,-1.011,1.0,1.0,-0.281533,0.994
2017-01-23 00:25:07,RS0360113,36,Senate,113,1860-03-16,,22,20,"TO AMEND S. 45, BY PROVIDING FOR THE SALE OF PRIMERS MADE BY THE U.S.  (P. 1196-1)",,,Foreign Policy Resolutions,,Foreign and Defense Policy,-0.016,1.0,0.171,-0.154,0.7,0.857,-15.56405,0.69
2017-01-23 00:25:07,RS0360114,36,Senate,114,1860-03-16,,27,24,"TO POSTPONE THE SPECIAL ORDER, WHICH IS THE PRIVATE CALENDAR AND CONSIDER S. 45.  (P. 1197-1)",,,Internal Organization,,Miscellaneous Policy,-0.176,0.001,0.612,-1.029,0.958,0.98,-3.409325,0.935
2017-01-23 00:25:07,RS0360115,36,Senate,115,1860-03-16,,20,28,"TO AMEND S. 45, BY ELIMINATING THE FIRST SECTION AUTHORIZING THE SALE OF PUBLIC ARMS TO THE STATES.  (P. 1197-1)",,,Foreign Policy Resolutions,,Foreign and Defense Policy,-0.064,-0.251,-0.633,0.872,1.0,1.0,-0.422712,0.991
2017-01-23 00:25:07,RS0360116,36,Senate,116,1860-03-16,,31,8,"TO TABLE S. 101, REGARDING THE CLAIM OF THOMAS CROWN FOR THE BREAKING OF HIS CONTRACT BY THE U.S.  (P. 1200-3)",,,Budget Special Interest,,Government Management,0.666,0.746,0.149,-0.203,0.0,0.795,-17.714267,0.635
2017-01-23 00:25:07,RS0360117,36,Senate,117,1860-03-16,,29,16,TO GO INTO EXECUTIVE SESSION.  (P. 1202-2),,,Internal Organization,,Miscellaneous Policy,0.093,0.98,0.142,-0.071,0.562,0.844,-19.12385,0.654
2017-01-23 00:25:07,RS0360118,36,Senate,118,1860-03-19,,22,29,"TO CONSIDER S. 37, PROVIDING FOR THE DEEPENING OF THE CHANNEL AT ST. CLAIR FLATS, MICHIGAN.  (P. 1219-2)",Public Works,,Budget Special Interest,,Government Management,-0.162,-0.049,-0.661,0.804,1.0,1.0,-1.805052,0.965
2017-01-23 00:25:07,RS0360119,36,Senate,119,1860-03-20,,30,17,"TO TABLE THE MEMORIAL REPEALING THE FUGITIVE SLAVE LAW OF 1850, ABOLISHING SLAVERY IN THE DISTRICT OF COLUMBIA, ETC., IN ORDER TO PREVENT ITS REFERENCE TO THE COMMITTEE ON THE JUDICIARY.",Slavery,,D. C.,Domestic Social Policy,Civil Liberties,-0.087,-0.299,0.666,-0.709,1.0,1.0,-0.238035,0.995
2017-01-23 00:25:07,RS0360120,36,Senate,120,1860-03-20,,5,33,TO AMEND A RESOLUTION MAKING A PEACE TREATY WITH CERTAIN INDIAN TRIBES BY PREVENTING THE GOVERNMENT FROM TAKING TITLE TO INDIAN LANDS.,Treaties,,Indian Affairs,,Government Management,0.34,0.764,0.029,-0.973,0.2,0.895,-8.940908,0.79
2017-01-23 00:25:07,RS0360121,36,Senate,121,1860-03-22,,28,13,"TO AMEND S. 192, (APP. 5-19-60), MAKING A LOAN AND ISSUING STOCK FOR WASHINGTON MARKET HOUSE, BY WITHOLDING THE QUESTION OF ISSUING STOCK FOR $200,000 FROM THE VOTE OF THE CITIZENS OF WASHINGTON, FOR THE BUILDING OF A NEW MARKET HOUSE.  (P. 1290-3)",Banking and Finance,,Budget Special Interest,,Government Management,-0.277,0.961,0.067,0.131,-0.154,0.634,-23.763369,0.56
2017-01-23 00:25:07,RS0360122,36,Senate,122,1860-03-23,,22,20,"ON PASSAGE OF S. 66, AUTHORIZING THE SETTLEMENT OF THE CLAIMS OF ROSS WILKINS, JAMES WITHERELL AND SALOMAN SIBLEY, DUE THEM FOR SERVICES PERFORMED IN THE CAPACITY OF A LAND BOARD.  (P. 1325-1)",,,Budget Special Interest,,Government Management,-0.061,0.52,-0.247,0.311,0.9,0.952,-7.90074,0.829
2017-01-23 00:25:07,RS0360123,36,Senate,123,1860-03-23,,28,14,"ON PASSAGE OF S. 109, GRANTING CREDIT CLAIM OF JOHN HASTINGS COLLECTOR OF THE PORT OF PITTSBURG, IN THE AMOUNT OF $9,956.62, BEING THE SUM HE WAS ROBBED OF ON MARCH 10, 1854, IN THE CITY OF ALLEGHANY.  (P. 1325-1)",,,Budget Special Interest,,Government Management,-0.02,1.0,0.17,0.034,0.5,0.833,-15.935864,0.684
2017-01-23 00:25:07,RS0360124,36,Senate,124,1860-03-23,,18,29,TO RECONSIDER THE VOTE THAT WHEN SENATE ADJOURN IT MEET MONDAY NEXT.  (P. 1330-2),,,Internal Organization,,Miscellaneous Policy,-0.774,0.381,0.068,0.197,0.0,0.617,-29.304418,0.536
2017-01-23 00:25:07,RS0360125,36,Senate,125,1860-03-23,,6,36,"ON PASSAGE OF S. 110, GRANTING CLAIM OF A.W. MC PHERSON, IN THE AMOUNT OF $18,098.15, EXPENDED FOR FURNISHING THE DISTRICT AND CIRCUIT COURT ROOMS FOR USE OF U.S. COURTS IN SAN FRANCISCO.  (P, 1330-2,3)",Public Works,,Budget Special Interest,,Government Management,-0.465,-0.72,0.151,0.229,0.0,0.857,-13.893139,0.718
2017-01-23 00:25:07,RS0360126,36,Senate,126,1860-03-26,,28,15,"ON PASSAGE OF S. 84 (APP. 6-16-60,12 STAT. L 41), FACILITATING COMMUNICATIONS BETWEEN THE ATLANTIC AND PACIFIC STATES BY ELECTRIC TELEGRAPH.  (P. 1345-3)",,,Budget Special Interest,,Government Management,-0.602,-0.222,-0.113,0.197,0.4,0.791,-20.432227,0.622
2017-01-23 00:25:07,RS0360127,36,Senate,127,1860-03-26,,26,9,"TO AMEND CONSULAR SECOND DIPLOMATIC APPROPRIATION BILL H.R.4, (APP. 5-26-60), BY FIRST DETERMINING THE BOUNDARY LINE BETWEEN THE PACIFIC OCEAN AND THE ROCKY MOUNTAINS AFTER WHICH ANY UNEXPENDED BALANCE OF THE APPROPRIATION IS TO BE APPLIED IN DETERMININGTHAT PORTION OF THE BOUNDARY LINE WHICH LIES EAST OF THE ROCKY MOUNTAINS AND WHICH HAS NOT AS YET BEEN TRACED, THEREBY LEAVING IT IN THE HANDS OF THE U.S",,,Foreign Policy Resolutions,,Foreign and Defense Policy,0.443,-0.889,0.125,0.185,-0.111,0.714,-18.462774,0.59
2017-01-23 00:25:07,RS0360128,36,Senate,128,1860-03-26,,29,18,"ON PASSAGE OF S. 45, AUTHORIZING THE SALE OF PUBLIC ARMS TO DIFFERENT STATES AND REGULATING APPOINTMENT OF SUPERINTENDENTS OF THE NATIONAL ARMORIES.  (P. 1352-1)",Public Lands,,Budget Special Interest,,Government Management,-0.062,-0.206,0.597,-1.004,1.0,1.0,-0.211065,0.996
2017-01-23 00:25:07,RS0360129,36,Senate,129,1860-03-27,,30,15,"TO AMEND S. 299, (APP. 6-1-60), INCREASING AND REGULATING THE PAY OF THE NAVY, BY PROVIDING THAT THE OFFICER CHARGED WITH THE EXPERIMENTS IN GUNNERY AT THE NAVY YARD, WASHINGTON, SHALL RECEIVE THE SEA SERVICE PAY OF THE GRADE NEXT ABOVE LINE, AS PROVIDEDBY THE ACT OF MAR",,,Defense Policy Budget,,Foreign and Defense Policy,-0.15,-0.989,0.18,-0.205,0.8,0.933,-10.506694,0.792
2017-01-23 00:25:07,RS0360130,36,Senate,130,1860-03-27,,15,23,"TO AMEND S. 299, BY MAKING NO APPOINTMENT TO FILL ANY VACANCIES FOR CHAPLAINS UNTIL NUMBERS BE REDUCED TO 15. (P. 1376-1)",,,Foreign Policy Resolutions,,Foreign and Defense Policy,0.226,0.974,0.081,-0.308,0.2,0.684,-19.39937,0.6
2017-01-23 00:25:07,RS0360131,36,Senate,131,1860-03-27,,16,32,"TO AMEND S. 299, BY DENYING COMPENSATION TO PERSONS OFFICIATING AS CHAPLAINS WHO ARE NOT CHAPLAINS.  (P. 1376-3)",,,Defense Policy Budget,,Foreign and Defense Policy,-0.051,-0.214,-0.638,0.895,1.0,1.0,-0.382811,0.992
2017-01-23 00:25:07,RS0360132,36,Senate,132,1860-03-28,,20,29,"TO AMEND S. 299, BY INCREASING THE PAY OF THE LOWER OFFICERS AND COMMANDERS OF THE NAVY FOR THE FIRST FIVE YEARS WHEN ON DUTY AT SEA $2,750.00 WHEN ON OTHER DUTY $2,500.00 AND A TEN CENT A MILE ALLOWANCE FOR TRAVEL.",,,Defense Policy Budget,,Foreign and Defense Policy,-0.09,-0.982,-0.16,0.059,0.8,0.918,-15.713811,0.726
2017-01-23 00:25:07,RS0360133,36,Senate,133,1860-03-28,,10,36,"TO AMEND S. 299, BY PROVIDING THAT ALL OFFICERS ON SHORE DUTY RECEIVE THE SAME PAY AS IF THEY WERE AT SEA. (P. 1408-3)",,,Defense Policy Budget,,Foreign and Defense Policy,-0.74,0.557,0.069,-0.142,0.0,0.783,-24.868725,0.582
2017-01-23 00:25:07,RS0360134,36,Senate,134,1860-03-29,,12,29,"ON ADOPTION OF THE S. RESOLUTION THAT THE TWO HOUSES OF CONGRESS ADJOURN ON APRIL 20TH NEXT, UNTIL MAY 20, NEXT, 1860.  (P. 1124-3)",,,Internal Organization,,Miscellaneous Policy,-0.851,0.498,0.095,0.17,0.083,0.732,-22.594131,0.576
2017-01-23 00:25:07,RS0360135,36,Senate,135,1860-03-29,,29,5,"ON PASSAGE OF S. 303, AN ACT TO AUTHORIZE PROTECTION TO BE GIVEN TO CITIZENS OF THE U.S. WHO MAY DISCOVER DEPOSITS OF ""GUANO"" FOR AGRICULTURAL INTEREST.  (P. 1352-2)",,,Defense Policy Resolutions,,Foreign and Defense Policy,-0.627,0.746,-0.382,-0.138,-0.2,0.824,-8.807884,0.772
2017-01-23 00:25:07,RS0360136,36,Senate,136,1860-03-30,,20,15,"TO AMEND S. 324, RELATING TO THE CLAIM OF ABIGAIL NASON, HEIR OF JOHN LORD, FOR WAGES DUE AS U.S. SEAMAN DURING THE REVOLUTIONARY WAR, BY PAYING THE PRINCIPAL OF $120 INSTEAD OF $336.",,,Budget Special Interest,,Government Management,0.562,0.54,0.276,-1.177,0.8,0.914,-7.264704,0.813
2017-01-23 00:25:07,RS0360137,36,Senate,137,1860-03-30,,20,16,"ON PASSAGE OF S. 111 (APP. 2-16-1860), GRANTING CLAIM OF $3,000 TO AARON H. PALMER FOR SERVICES RENDERED IN RESEARCH IN ORIENTAL COUNTRIES.  (P. 1446-1)",Science and Technology,,Budget Special Interest,,Government Management,-0.041,0.438,-0.124,0.353,0.625,0.833,-12.762042,0.702
2017-01-23 00:25:07,RS0360138,36,Senate,138,1860-03-31,,9,31,"TO AMEND S. 201, RELATIVE TO A RAILWAY ABOVE PENNSYLVANIA AVENUE AND OTHER STREETS IN THE CITIES OF WASHINGTON AND GEORGETOWN IN THE DISTRICT OF COLUMBIA BY ELIMINATING THE PROVISION THAT THE RAILWAY CORPORATION PURCHASE THE REAL ESTATE, HOUSES ETC., OF ILBERT VANDERWETKEN, USED BY HIM IN HIS OPERATION OF OMNIBUSES BETWEEN GEORGETOWN AND THE NAVY YARD",,,D. C.,Government Organization,Government Management,-0.142,0.99,-0.021,-0.196,0.0,0.775,-20.64602,0.597
2017-01-23 00:25:07,RS0360139,36,Senate,139,1860-03-31,,27,15,"TO POSTPONE THE SPECIAL ORDER AND ALL PRIOR ORDERS IN ORDER TO TAKE UP H.R. 215, (APP. 6-19-60), MAKING APPROPRIATIONS FOR THE CURRENT AND CONTINGENT EXPENSES OF THE INDIAN DEPT. (P. 1504-1)",,,Indian Affairs,Budget Special Interest,Government Management,-0.031,1.0,0.126,0.024,0.333,0.762,-19.381987,0.63
2017-01-23 00:25:07,RS0360140,36,Senate,140,1860-04-03,,26,24,"TO POSTPONE CONSIDERATION OF S. 1, GRANTING TO ANY U.S. CITIZEN AND HEAD OF A FAMILY, A HOMESTEAD OF 160 ACRES OF LAND, OUT OF THE PUBLIC DOMAIN, UPON CONDITION OF OCCUPANCY AND CULTIVATION FOR SPECIFIED PERIOD OF TIME, AND PROCEED TO CONSIDERATION OF H..280, SECURING HOMESTEAD TO ACTUAL SETT- -LERS ON THE PUBLIC DOMAIN",Public Lands,,Budget Special Interest,,Government Management,-0.28,-0.061,-0.266,0.453,0.958,0.98,-9.938315,0.82
2017-01-23 00:25:07,RS0360141,36,Senate,141,1860-04-05,,25,29,"TO POSTPONE FURTHER CONSIDERATION OF H.R. 280, SECURING HOMESTEADS TO ACTUAL SETTLERS ON THE PUBLIC DOMAIN AND PROCEED TO CONSIDERATION OF H.R. 215, (APP. 6-19-60), APPROPRIATING FOR THE INDIAN DEPARTMENT.  (P. 1549-3)",Public Lands,,Budget Special Interest,,Government Management,-0.331,-0.197,0.428,-1.203,0.8,0.907,-6.948861,0.879
2017-01-23 00:25:07,RS0360142,36,Senate,142,1860-04-05,,17,28,"TO AMEND H.R. 280, SECURING HOMESTEADS FOR ACTUAL SETTLERS ON THE PUBLIC DOMAIN, BY PROVIDING THAT LANDS GRANTED FOR HOMESTEADS SHALL BE LOCATED IN ALTERNATE QUARTER SECTIONS, AND THOSE SECTIONS WHICH SHALL REMAIN TO THE UNITED STATES AND NOT SUBJECT TO NTRY UNDER PROVISIONS OF THIS ACT, TO BE SOLD FOR NOT LESS THAN DOUBLE THE MINIMUM PRICE OF PUBLIC LANDS WHEN SOLD, AND THAT PROVISIONS OF THIS ACT SHALL BE APPLICABLE ONLY TO LANDS SUBJECT TO PRIVATE ENTRY AT DATE OF ITS PASSAGE",Public Lands,,Budget Special Interest,,Government Management,-0.344,-0.022,0.389,-0.889,0.824,0.933,-7.386321,0.849
2017-01-23 00:25:07,RS0360143,36,Senate,143,1860-04-05,,21,29,THAT THE SENATE ADJOURN BECAUSE OF TODAY BEING GOOD FRIDAY TO RESUME SESSION AGAIN ON SATURDAY.  (P. 1556-3),,,Internal Organization,,Miscellaneous Policy,-0.068,0.953,0.057,-0.1,0.238,0.68,-29.87099,0.55
2017-01-23 00:25:07,RS0360144,36,Senate,144,1860-04-07,,18,23,"TO POSTPONE CONSIDERATION OF THE BILLS RELATING TO THE DISTRICT OF COLUMBIA AND PROCEED TO THE CONSIDERATION OF S. 345, (APP. 2-23-61), REGARDING THE CLAIM OF MARY WALBACH, WIDOW OF THE LATE BREVET BRIGADIER GENERAL JOHN DE B. WALBACH, OF THE U.S. ARMY. (P",,,Budget Special Interest,,Government Management,-0.211,-0.977,0.073,-0.004,0.278,0.683,-24.481901,0.55
2017-01-23 00:25:07,RS0360145,36,Senate,145,1860-04-07,,17,19,"TO AMEND S. 201, CONSTRUCTING A WASHINGTON PASSENGER RAILWAY, BY ENTITLING ONLY CITIZENS OF THE DIST. OF COLUMBIA TO SUBSCRIBE TO STOCK.  (P. 1590-2)",,,D. C.,Government Organization,Government Management,0.656,0.076,-0.004,-0.069,0.118,0.583,-24.631287,0.504
2017-01-23 00:25:07,RS0360146,36,Senate,146,1860-04-07,,12,31,TO TABLE S. 201.  (P. 1596-3),,,Government Organization,,Government Management,0.112,0.994,0.016,-0.167,0.0,0.721,-24.659483,0.564
2017-01-23 00:25:07,RS0360147,36,Senate,147,1860-04-07,,22,20,TO AMEND S. 201 BY INCLUDING G. VANDERWERKEN AS ONE OF THE CORPORATORS.  (P. 1596-3),,,Government Organization,,Government Management,-0.062,0.353,-0.056,0.142,0.35,0.69,-24.383798,0.56
2017-01-23 00:25:07,RS0360148,36,Senate,148,1860-04-07,,16,26,"TO GO INTO EXECUTIVE SESSION, MOTION MADE DURING DEBATE ON S. 201.  (P. 1598-2)",,,Internal Organization,,Miscellaneous Policy,-0.625,-0.78,0.089,-0.109,0.312,0.738,-24.09988,0.563
2017-01-23 00:25:07,RS0360149,36,Senate,149,1860-04-07,,21,22,"TO AMEND S. 201, BY PLACING A TAX OF 1/2 CENT ON EACH PASSENGER CARRIED, TO BE USED FOR THE SUPPORT OF PUBLIC SCHOOLS.  (P. 1598-2)",Tax rates,,D. C.,Budget Special Interest,Government Management,-0.209,-0.978,0.039,-0.008,0.286,0.651,-28.313408,0.518
2017-01-23 00:25:07,RS0360150,36,Senate,150,1860-04-07,,22,18,"TO AMEND S. 201, BY PROHIBITING ANY PERSON FROM SUBSCRIBING TO STOCK TO BE TRANSFERRED TO ANOTHER.  (P. 1598-3)",,,D. C.,Government Organization,Government Management,0.993,-0.047,0.009,0.218,0.111,0.6,-27.524294,0.503
