date_generated,id,congress,chamber,rollnumber,date,keyvote,yea,nay,description,Issue1,Issue2,Peltzman1,Peltzman2,Clausen1,slope,intercept,mid.dim1,mid.dim2,spread.dim1,spread.dim2,pre,classified,log_likelihood,vote_result
2016-10-18 10:30:10,RH0390484,39,House,484,1867-01-26,,32,75,TO TABLE A RESOLUTION PROVIDING THAT HON. MR. HUNTER FROM N.Y. WHO HAS TRANSGRESSED RULES OF HOUSE DURING DEBATE BE CENSURED BY SPEAKER.  (P. 784-1),,,Internal Organization,,Miscellaneous Policy,7.759682523737327,-0.055837142713635934,0.009,0.014,0.699,-0.521,1.0,1.0,-1.623558,
2016-10-18 10:30:10,RH0390485,39,House,485,1867-01-26,,77,33,"TO PASS A RESOLUTION PROVIDING THAT HON. MR. HUNTER FROM N.Y. WHO TRANSGRESSED RULES OF HOUSE DURING DEBATE BE CENSURED BY SPEAKER.  (P. 786-1, 787-2)",,,Internal Organization,,Miscellaneous Policy,-87.9601828282373,0.3388407313129492,0.004,-0.013,-0.73,-0.048,0.97,0.991,-2.244684,
2016-10-18 10:30:10,RH0390486,39,House,486,1867-01-28,,49,74,"TO REFER H. R. 1074 TO A SELECT COMMITTEE OF FIVE MEMBERS FOR RECONDISERATION.  H. R. 1074 IS A BILL TO AMEND AN ACT ENTITLED 'AN ACT TO REGULATE THE ELECTIVE FRANCHISE IN THE DISTRICT OF COLUMBIA' PASSED AT SECOND SESSION OF 39 CONGRESS, JAN. 8, 1867",Voting Rights,,Government Organization,D. C.,Government Management,-12.257955554227467,1.3903114665312013,0.102,0.14,0.142,0.067,0.449,0.78,-58.988678,
2016-10-18 10:30:10,RH0390487,39,House,487,1867-01-28,,104,38,"TO SUSPEND RULES AND INTRODUCE H. R. 1080, A BILL TO ENFORCE A PROVISION OF THE EIGHTH AMENDMENT TO THE UNITED STATES CONSTITUTION RELATING TO CRUEL AND UNUSUAL PUNISHMENT. (P. 810-1)",,,Domestic Social Policy,,Civil Liberties,4.501893992660321,0.04342804234123254,-0.226,-0.974,-0.288,0.37,0.816,0.951,-22.912364,
2016-10-18 10:30:10,RH0390488,39,House,488,1867-01-28,,88,65,"TO REFER TO JOINT COMMITTEE ON RECONSTRUCTION, H. R. 543, A BILL TO RESTORE THE STATES LATELY IN INSURRECTION THEIR FULL POLITICAL RIGHTS.  (P. 813-1, 817)",Nullification/Secession/Reconstruction,,Domestic Social Policy,,Civil Liberties,3.58449830441049,-1.1009619489334093,0.325,0.064,0.207,-0.334,0.508,0.791,-69.057958,
2016-10-18 10:30:10,RH0390489,39,House,489,1867-01-31,,76,73,"TO AMEND S. 204, AN ACT TO PROVIDE FOR THE ANNUAL INSPECTION OF INDIAN AFFAIRS AND FOR OTHER PURPOSES, BY ELIMINATING ALL AFTER THE ENACTING CLAUSE AND INSERTING IN LIEU THEREOF, THAT FROM AND AFTER JULY 1, 1867 THE SECRETARY OF WAR SHALL EXERCISE SUPERVSORY AND APPELLATE POWERS AND POSSESS THE JURISDICTION NOW EXERCISED AND POSSESSED BY THE SECRETARY OF INTERIOR IN RELATION TO ALL ACTS OF COMMISSION OF INDIAN AFFAIRS.",,,Indian Affairs,Government Organization,Government Management,7.769126759721634,-1.3486107041874735,0.045,-0.999,-0.09,0.067,0.274,0.644,-90.283554,
2016-10-18 10:30:10,RH0390490,39,House,490,1867-01-31,,77,70,TO TABLE RECONSIDERATION OF VOTE BY WHICH A SUBSTITUTE TO S. 204 WAS ADOPTED.  (P. 898-3),,,Indian Affairs,Government Organization,Government Management,9.388007601441409,-1.3557442888547735,0.038,-0.999,-0.112,0.069,0.4,0.714,-82.258026,
2016-10-18 10:30:10,RH0390491,39,House,491,1867-01-31,,90,53,TO MOVE S. 204 TO THIRD READING AS AMENDED.  (P. 899),,,Indian Affairs,Government Organization,Government Management,14.247609968302521,-0.2522858504754622,-0.015,-0.466,-0.101,0.041,0.434,0.79,-73.235468,
2016-10-18 10:30:10,RH0390492,39,House,492,1867-02-01,,72,74,"TO TABLE H. R. 1060, EXTENDING CERTAIN LETTERS-PATENT FOR THE BENEFIT OF THE HEIRS OF THOMAS H. HARVEY.  (P. 934)",,,Budget Special Interest,,Government Management,-2.1355138170311774,0.3065140759631457,-0.284,0.913,0.024,0.065,0.042,0.527,-100.102248,
2016-10-18 10:30:10,RH0390493,39,House,493,1867-02-01,,76,78,"TO AMEND S. 453 (14 STAT 430, 3/2/1867), A BILL REGULATING THE TENURE OF CERTAIN CIVIL OFFICERS BY ELIMINATING THE CLAUSE EXCEPTING ALL CABINET OFFICERS FROM THE APPLICATION OF ITS PROVISIONS; FOR THE PURPOSE OF TAKING FROM THE PRESIDENT THE POWER TO REMVE ANY HEAD OF DEPARTMENT WITH- OUT THE CONSENT OF THE SENATE",,,Domestic Social Policy,,Civil Liberties,1.9448802720575793,-0.5671176734555465,0.27,-0.042,-0.229,0.681,0.684,0.844,-54.263621,
2016-10-18 10:30:10,RH0390494,39,House,494,1867-02-01,,37,119,"TO AMEND SECTION EIGHT OF S. 453, BY PROVIDING THAT NO PERSON NOMINATED BY PRESIDENT FOR ANY OFFICE BELOW THAT OF AMBASSADOR WHO HAS BEEN REJECTED BY THE SENATE MAY BE APPOINTED FOR ANY OTHER US OFFICE FOR ONE YEAR AFTER REJECTION.  (P. 949-1)",,,Domestic Social Policy,,Civil Liberties,3.4829915731275083,-1.5555570646505466,0.467,0.071,-0.218,0.362,0.216,0.814,-63.550364,
2016-10-18 10:30:10,RH0390495,39,House,495,1867-02-01,,69,74,TO TABLE A MOTION TO RECONSIDER THE VOTE BY WHICH HOUSE REJECTED AN AMENDMENT TO S. 453 WHICH WOULD HAVE TAKEN FROM THE PRESIDENT THE POWER TO REMOVE CABINET OFFICERS WITHOUT THE CONSENT OF THE SENATE.,,,Domestic Social Policy,,Civil Liberties,2.0475250980385447,-0.5875485988233663,0.243,-0.09,0.445,-1.257,0.667,0.839,-42.218661,
2016-10-18 10:30:10,RH0390496,39,House,496,1867-02-02,,75,66,TO RECONSIDER THE VOTE BY WHICH AN AMENDMENT TO S. 453 WAS REJECTED.  (SEE H392109),,,Domestic Social Policy,,Civil Liberties,2.6740824685527826,-0.6679722255501649,0.221,-0.077,-0.307,0.664,0.636,0.83,-44.930649,
2016-10-18 10:30:10,RH0390497,39,House,497,1867-02-02,,83,63,"TO AMEND S. 453, BY ELIMINATING THE CLAUSE EXCEPTING CABINET OFFICERS FROM THE APPLICATION OF PROVIS- IONS OF ABOVE BILL; FOR THE PURPOSE OF TAKING FROM PRESIDENT THE POWER TO REMOVE ANY HEAD OF A DEPARTMENT WITHOUT CONSENT OF SENATE.",,,Domestic Social Policy,,Civil Liberties,3.061395859445143,-0.7134456932184864,0.219,-0.043,-0.325,0.614,0.651,0.849,-43.634821,
2016-10-18 10:30:10,RH0390498,39,House,498,1867-02-02,,111,38,TO PASS S. 453.,,,Domestic Social Policy,,Civil Liberties,6.08668052819075,0.065346722112763,-0.004,0.041,-0.683,0.649,0.895,0.973,-5.673143,
2016-10-18 10:30:10,RH0390499,39,House,499,1867-02-02,,74,62,TO TABLE H. R. 1060 EXTENDING CERTAIN LETTERS-PATENT FOR THE BENEFIT OF THE HEIRS OF THOMAS W. HARVEY.  (P. 970),,,Budget Special Interest,,Government Management,-0.369633892202295,0.11499404897058055,0.863,-0.204,0.017,0.266,0.113,0.596,-87.723548,
2016-10-18 10:30:10,RH0390500,39,House,500,1867-02-04,,71,82,TO TABLE A RESOLUTION AND PREAMBLE PROVIDING THAT PUBLIC INTEREST DEMANDS NO REDUCTION DURING CURRENT YEAR OF U.S. NOTES COMMONLY CALLED GREENBACKS AND PROVIDING THAT THE COM- MITTEE ON WAYS AND MEANS BE INSTRUCTED TO REPORT SUCH BILL AS MAY BE NECESSARYTO EFFECT THIS,U.S. Currency,,Budget General Interest,,Government Management,0.8996840618048016,-0.15845259814828078,-0.483,-0.593,0.077,-0.495,0.31,0.68,-84.914178,
2016-10-18 10:30:10,RH0390501,39,House,501,1867-02-04,,87,66,"TO ORDER MAIN QUESTION ON PASSAGE OF A RESOLUTION, PROVIDING THAT PUBLIC INTEREST DEMANDS NO REDUCTION DURING CURRENT YEAR OF U.S. NOTES COMMONLY CALLED GREENBACKS AND PROVIDING THAT THE COMMITTEE ON WAYS AND MEANS BE INSTRUCTED TO REPORT SUCH BILL AS MA BE NECESSARY TO EFFECT THIS",U.S. Currency,,Budget General Interest,,Government Management,0.9639472090765732,-0.07300168060914625,-0.638,-0.688,-0.104,0.624,0.318,0.706,-83.074589,
2016-10-18 10:30:10,RH0390502,39,House,502,1867-02-04,,60,82,"TO SUSPEND RULES AND TO INTRODUCE A RESOLUTION AND PREAMBLE PROVIDING WHEREAS OVERTHROW OF ARMED FORCES OF THE REBELLION DEPRIVED THE PEOPLE OF VIRGINIA, NORTH CAROLINA, SOUTH CAROLINA, GEORGIA, FLORIDA, MISSISSIPPI, ALABAMA, LOUISIANA, ARKAN., AND TEXASOF CIVIL GOVERNMENT;IT IS THE DUTY OF CONGRESS TO ESTABLISH GOVERNMENTS OVER SAID STATES IN ORDER TO MAINTAIN AUTHORITY OF NATIONAL GOVERNMENT, TO ESTABLISH ORDER AND PROTECT CITIZENS IN LAWFUL RIGHTS, TO RESTORE STATES TO FORMER RELATIONS TO UNION AND PR...",Nullification/Secession/Reconstruction,,Domestic Social Policy,,Civil Liberties,2.1612711108769482,-0.7530587910413306,0.298,-0.109,-0.142,0.38,0.367,0.732,-70.494946,
2016-10-18 10:30:10,RH0390503,39,House,503,1867-02-04,,96,36,TO SUSPEND RULES AND INTRODUCE A RESOLUTION PROVIDING THAT THE COMMITTEE ON NAVAL AFFAIRS REPORT BY BILL OR OTHERWISE ON THE PROPRIETY OF IMMEDIATE REMOVAL OF UNITED STATES NAVY ACADEMY FROM PRESENT LOCATION IN STATE OF MD. TO A LOYAL STATE IN ORDER TO SCURE STUDENTS FROM HOSTILE POLITICAL AND SOCIAL INFLUENCES PREDOMINATING AT ANNAPOLIS,,,Defense Policy Resolutions,,Foreign and Defense Policy,8.9546601738928,-0.5112342706074607,0.061,0.035,-0.401,0.259,0.917,0.977,-11.978801,
2016-10-18 10:30:10,RH0390504,39,House,504,1867-02-04,,108,35,TO PASS A RESOLUTION PROVIDING THAT COMMITTEE ON NAVAL AFFAIRS REPORT BY BILL OR OTHERWISE ON THE PROPRIETY OF IMMEDIATE REMOVAL OF UNITED STATES NAVY ACADEMY FROM PRESENT LOCATION IN STATE OM MD. TO A LOYAL STATE TO SECURE STUDENTS FROM HOSTILE POLITICA AND SOCIAL INFLUENCES PREDOMINATING AT ANNAPOLIS,,,Defense Policy Resolutions,,Foreign and Defense Policy,4.819736045382866,-0.1132144569530402,0.021,-0.012,-0.575,0.69,0.914,0.979,-7.698632,
2016-10-18 10:30:10,RH0390505,39,House,505,1867-02-04,,32,109,"TO TABLE H. R. 1099 (14 STAT 398, 2/22/1867), A BILL PROVIDING FOR THE SELECTION OF A CONGRESSIONAL PRINTER. (P. 995)",,,Budget Special Interest,,Government Management,7.597120119030209,0.3208848047612084,-0.04,0.017,0.708,-0.539,0.969,0.993,-2.081652,
2016-10-18 10:30:10,RH0390506,39,House,506,1867-02-05,,87,66,"TO STRIKE OUT ENACTING WORDS ON H. R. 919, A BILL MAKING APPROPRIATIONS FOR THE CONSTRUCTION, RESERVATION AND REPAIR OF CERTAIN FORTIFICATIONS AND OTHER WORKS OF DEFENSE FOR THE FISCAL YEAR ENDING JUNE 30, 1868.  (P. 997, 998, 1013)",,,Defense Policy Budget,,Foreign and Defense Policy,-2.705816727232486,0.6660862123443606,0.479,-0.63,0.16,0.342,0.424,0.752,-78.190808,
2016-10-18 10:30:10,RH0390507,39,House,507,1867-02-05,,64,73,"TO TABLE H. J. RES. 263 (14 STAT 566, 2/18/1867), A BILL PROVIDING FOR THE PURCHASE OF DAVID'S ISLAND, N.Y. HARBOR.  (P. 1017)",,,Budget Special Interest,,Government Management,-1.7949361824184467,0.05287361250517475,-0.37,0.717,0.099,0.319,0.375,0.708,-76.749471,
2016-10-18 10:30:10,RH0390508,39,House,508,1867-02-06,,72,66,"TO TABLE H.R. 889, A BILL TO REGULATE THE CIVIL SERVICE OF UNITED STATES AND PROMOTE THE EFFICIENCY THEREOF.  (P. 1036)",Civil Service and Patronage,,Government Organization,,Government Management,-1.7106668780795526,0.30849870429816034,0.178,0.004,0.042,0.142,0.212,0.623,-89.385816,
2016-10-18 10:30:10,RH0390509,39,House,509,1867-02-09,,122,44,"TO PASS S. 456 (14 STAT 391, 2/9/1867), OVER PRESIDENTIAL VETO. S. 456 IS A BILL PROVIDING FOR THE ADMISSION OF NEBRASKA INTO THE UNION.  (P. 399, 1121, 1122)",,,Government Organization,,Government Management,4.924720394886255,-0.20513937500567767,0.038,-0.018,-0.602,0.707,0.841,0.958,-10.630983,
2016-10-18 10:30:10,RH0390510,39,House,510,1867-02-11,,30,127,"TO ADJOURN, MOTION MADE WHILE THE HOUSE WAS DEBATING H. R. 1162, A BILL PROVIDING FOR REESTABLISHMENT OF CIVIL GOVERNMENT IN LOUISIANA.  (P. 1132)",Nullification/Secession/Reconstruction,,Government Organization,,Government Management,9.671076917292833,1.9777276913533175,-0.165,0.382,0.204,-0.122,0.7,0.943,-25.660188,
2016-10-18 10:30:10,RH0390511,39,House,511,1867-02-11,,85,59,TO PUT THE MAIN QUESTION ON PASSAGE OF H.R. 1162.  (P. 1133),Nullification/Secession/Reconstruction,,Government Organization,,Government Management,4.5875123995598726,-0.9290899923115344,0.201,-0.007,-0.349,0.44,0.763,0.903,-36.616407,
2016-10-18 10:30:10,RH0390512,39,House,512,1867-02-12,,115,47,TO PASS H. R. 1162.  (P. 1175),Nullification/Secession/Reconstruction,,Government Organization,,Government Management,6.642646114032623,-0.4529131663243815,0.073,0.032,-0.348,0.303,0.894,0.969,-16.695746,
2016-10-18 10:30:10,RH0390513,39,House,513,1867-02-13,,39,116,"TO TABLE H. R. 1143 (14 STAT 428, 3/2/1867), A BILL TO PROVIDE A MORE EFFICIENT GOVERNMENT FOR THE STATES LATELY IN INSURRECTION.  (P. 1213-1)",,,Domestic Social Policy,Government Organization,Civil Liberties,13.842914018870133,0.5361838373772856,0.033,0.993,0.438,-0.183,0.923,0.981,-9.917153,
2016-10-18 10:30:10,RH0390514,39,House,514,1867-02-13,,85,78,"TO ORDER THE MAIN QUESTION ON H. R. 1143, THE MAIN QUESTION IS ON REFERRING TO COMMITTEE ON JUDICIARY WITH INSTRUCTIONS TO REPORT IT BACK PROVIDING THAT WHEN THE CONSTITUTIONAL AMENDMENT HAS BECOME A U.S. LAW AND THE LATE SO-CALLED CONFEDERATE STATES SHAL CONSENT AND LIVE UP THERETO, THEY SHALL BE ENTITLED TO REPRESENTATION IN CONG- ESS",Nullification/Secession/Reconstruction,,Domestic Social Policy,,Civil Liberties,1.389586236461034,-0.5256169203511325,0.805,0.593,0.037,-0.154,0.09,0.564,-109.236465,
2016-10-18 10:30:10,RH0390515,39,House,515,1867-02-13,,38,121,"TO RECOMMIT H. R. 1143 TO COMMITTEE ON RECONSTRUCTION. (P. 1037-1, 1215)",Nullification/Secession/Reconstruction,,Domestic Social Policy,,Civil Liberties,3.7468208909324185,0.19491443379512452,0.209,0.978,0.298,-0.46,0.816,0.956,-22.032871,
2016-10-18 10:30:10,RH0390516,39,House,516,1867-02-13,,69,95,TO RECOMMIT H. R. 1143 WITH INSTRUCTION TO COMMITTEE ON JUDICIARY.  THE INSTRUCTIONS PROVIDE THAT WHEN H. R. 1143 BECOMES LAW LIVED UP TO BY SOUTHERN STATES THEY SHALL BE ENTITLED TO REPRESENTATION IN CONGRESS. (P. 1213-1),Nullification/Secession/Reconstruction,,Domestic Social Policy,,Civil Liberties,0.6616021434990501,0.007870220895788482,0.83,0.557,0.031,-0.271,0.087,0.616,-104.899547,
2016-10-18 10:30:10,RH0390517,39,House,517,1867-02-13,,109,55,"TO PASS H. R. 1143.  (P. 1036, 1215-2)",Nullification/Secession/Reconstruction,,Domestic Social Policy,,Civil Liberties,7.555705357953395,-0.8839061161646404,0.115,-0.015,-0.307,0.235,0.782,0.927,-30.361508,
2016-10-18 10:30:10,RH0390518,39,House,518,1867-02-14,,72,75,TO TABLE MOTION TO RECONSIDER VOTE BY WHICH H. R. 998 WAS RECOMMITTED.  H. R. 998 IS A BILL TO REIMBURSE THE STATES THAT HAVE FURNISHED TROOPS TO THE UNION ARMY FOR ADVANCES MADE AND EXPENSES INCURRED IN RAISING SAME.  (P. 1248),,,Defense Policy Budget,,Foreign and Defense Policy,-3.4561034081525914,0.5008803291795108,0.39,-0.847,0.098,0.164,0.347,0.68,-89.276426,
2016-10-18 10:30:10,RH0390519,39,House,519,1867-02-14,,62,87,TO TABLE H. R. 998 A BILL TO REIMBURSE THE STATES THAT HAVE FURNISHED TROOPS TO THE UNION ARMY FOR ADVANCES MADE AND EXPENSES INCURRED IN RAISING SAME.  (P. 1248-3),,,Defense Policy Budget,,Foreign and Defense Policy,-8.272012096494315,0.6593143709128859,0.196,-0.962,0.123,0.086,0.403,0.752,-79.932047,
2016-10-18 10:30:10,RH0390520,39,House,520,1867-02-14,,101,28,"TO AMEND H. R. 1145, A BILL TO PROVIDE FOR ORGANIZATION, ARMING, AND DISCIPLINE OF NATIONAL MILITIA AND FOR OTHER PURPOSES, BY PROVIDING THAT OFFICE OF MILITIA SEND A CERTIFICATE ATTACHED TO AN OATH TO GOVERNMENT OF STATE AND SECRETARY OF WAR SHOWING TIM, PLACE OF ELECTION AND OFFICE APPOINTED TO, ETC",,,Defense Policy Resolutions,,Foreign and Defense Policy,815.4993388787808,139.43238694827153,-0.171,-0.018,-0.282,0.002,0.893,0.977,-15.619975,
2016-10-18 10:30:10,RH0390521,39,House,521,1867-02-14,,63,59,"TO LIMIT DEBATE IN COMMITTEE OF WHOLE TO TEN MINUTES ON H. R. 1161 (14 STAT 471, 3/2/1867), A BILL TO AMEND EXISTING LAWS RE. INTERNAL REVENUE.  (P. 1255-3)",Tax rates,,Budget General Interest,,Government Management,-33.1449540351714,5.951091726330852,0.18,-0.015,-0.149,-0.026,0.576,0.795,-57.796769,
2016-10-18 10:30:10,RH0390522,39,House,522,1867-02-15,,76,85,"TO ORDER MAIN QUESTION ON H. R. 836, A BILL TO EQUALIZE THE BOUNTIES OF SOLDIERS , SAILORS, AND MARINES WHO SERVED IN THE LATE WAR FOR THE UNION.  (P. 1269)",,,Defense Policy Budget,,Foreign and Defense Policy,-0.8996840618048016,0.0049834188059718065,0.369,-0.327,0.028,0.18,0.184,0.615,-105.552654,
2016-10-18 10:30:10,RH0390523,39,House,523,1867-02-15,,75,84,"TO AMEND H. R. 836, BY PROVIDING THAT IN COMPUTING BOUNTY TO BE PAID ANY SOLDIER, SAILOR, OR MARINE, ALL BOUNTIES OR PRIZE MONEY ALREADY PAID SHALL BE DEDUCTED FROM BOUNTY TO BE PAID UNDER EXISTING LAW, SO THAT BOUNTY AND PRIZE MONEY PREVIOUSLY PAID TOGEHER WITH BOUNTY TO BE PAID SHALL ONLY AMOUNT IN AGGREGATE TO SUM ALLOWED BY THIS ACT.",,,Defense Policy Budget,,Foreign and Defense Policy,-0.9432616466500372,0.1395031889855674,0.467,-0.301,-0.076,-0.466,0.427,0.73,-86.001511,
2016-10-18 10:30:10,RH0390524,39,House,524,1867-02-15,,92,69,TO PASS H. R. 836.  (P. 1272),,,Defense Policy Budget,,Foreign and Defense Policy,-1.0466990576515922,0.3158536159661246,0.832,-0.555,0.078,0.431,0.246,0.677,-94.263937,
2016-10-18 10:30:10,RH0390525,39,House,525,1867-02-15,,63,66,"TO TABLE BILL AND SENATE AMENDMENTS ON H. R. 598 (14 STAT 517, 3/2/1867), A BILL TO ESTABLISH A UNIFORM SYSTEM OF BANKRUPTCY THROUGHOUT THE UNITED STATES. SENATE AMENDMENTS PROVIDE FOR TAKING THE POWER OF APPOINTMENT OF REGISTRARS IN BANKRUPTCY FROM CIRCIT COURT AND RESTING SAME IN DISTRICT COURTS AND FOR MAKING BILL SYMMETRICAL WITH THAT AMENDMENT AND ALSO PROVIDING FOR FRAMING OF RULES AND CODE OF PRACTICE BY JUSTICE OF SUPREME COURT",Judiciary,,Domestic Social Policy,Government Organization,Civil Liberties,-0.7193635888631142,0.0329746165559186,0.417,-0.267,0.05,0.402,0.365,0.69,-72.714213,
2016-10-18 10:30:10,RH0390526,39,House,526,1867-02-15,,55,61,"TO TABLE SENATE AMENDMENTS ON H. R. 598 (14 STAT 517, 3/2/1867), A BILL TO ESTABLISH A UNIFORM SYSTEM OF BANKRUPTCY THROUGHOUT THE UNITED STATES.  (P. 1273)",,,Domestic Social Policy,,Civil Liberties,-0.22094969736137185,-0.0829997349122018,0.611,-0.218,0.017,0.445,0.364,0.698,-65.696625,
2016-10-18 10:30:10,RH0390527,39,House,527,1867-02-16,,80,41,TO PASS A RESOLUTION AND PREAMBLE PROVIDING THAT WHEREAS DUE TO THE IMPEACHMENT OF PRESIDENT OF UNITED STATES FOR HIGH CRIMES AND MISDEMEANORS AND UPON RUMORED AND ASSERTED COMMUNICATIONS THAT CERTAIN MEMBERS OF THE HOUSE HAVE HELD PRIVATE MEETINGS WITH  VIEW TO A CORRUPT BARGAIN; THEREFORE BE IT RESOLVED THAT THE COMMITTEE ON JUDICIARY INQUIRE INTO THE NATURE OF SUCH COMMUNICATIONS AND REPORT TO THIS HOUSE FOR ITS ACTION THEREON,Impeachments and Investigations,,Internal Organization,,Miscellaneous Policy,4.227666947422128,-0.2922133557937702,0.08,0.046,-0.144,0.197,0.561,0.851,-45.438513,
2016-10-18 10:30:10,RH0390528,39,House,528,1867-02-16,,64,69,TO AMEND A RESOLUTION AND PREAMBLE PROVIDING THAT WHEREAS DUE TO THE IMPEACHMENT OF PRESIDENT OF UNITED STATES FOR HIGH CRIMES AND MISDEMEANORS AND UPON RUMORED AND ASSERTED COMMUNICATIONS THAT CERTAIN MEMBERS OF THE HOUSE HAVE HELD PRIVATE MEETINGS WITHA VIEW TO A CORRUPT BARGAIN; THEREFORE BE IT RESOLVED THAT THE COMMITTEE ON JUDICIARY INQUIRE INTO THE NATURE OF SUCH COMMUNICATIONS AND REPORT TO THIS HOUSE FOR ITS ACTION THEREON,Impeachments and Investigations,,Internal Organization,,Miscellaneous Policy,2.5303614238260046,-0.6046542044616925,0.565,0.825,0.112,-0.256,0.359,0.692,-77.960462,
2016-10-18 10:30:10,RH0390529,39,House,529,1867-02-16,,78,68,"TO POSTPONE FURTHER CONSIDERATION OF BILL S. 220 UNTIL FRIDAY NEXT AT COMMENCEMENT OF MORNING HOUR, IN ORDER TO GIVE MEMBERS A CHANCE TO EXAMINE FACTS IN THE CASE.  S. 220 (14 STAT 424, 3/2/1867), IS A BILL PROVIDING FOR THE RELIEF OF CERTAIN CONTRACTORSFOR THE CONSTRUCTION OF VESSELS OF WAR AND MACHINERY",,,Budget Special Interest,,Government Management,1.2393606973841653,-0.25632371955120314,0.745,0.667,-0.072,0.336,0.221,0.637,-90.090979,
2016-10-18 10:30:10,RH0390530,39,House,530,1867-02-18,,94,55,"TO TABLE A RESOLUTION PROVIDING THAT COMMITTEE ON BANKING AND CURRENCY INQUIRE AND REPORT BY BILL OR OTHERWISE THE EXPEDIENCY OF THE WITHDRAWAL OF NATIONAL BANK CURRENCY AS RAPIDLY AS POSSIBLE WITHOUT INJUSTICE TO BANKS, AND THE SUPPLY, IN PLACE OF SUCH URRENCY, OF UNITED STATES TREASURY NOTES",U.S. Currency,,Budget General Interest,,Government Management,-4.984621752198596,0.10870781329177331,0.019,0.014,-0.131,-0.152,0.436,0.792,-68.023375,
2016-10-18 10:30:10,RH0390531,39,House,531,1867-02-18,,40,119,"TO TABLE H. R. 1143 AND A SENATE AMENDMENT THERETO.  H. R. 1143 (14 STAT. 428, 3/2/1867), IS A BILL TO PROVIDE FOR THE MORE EFFICIENT GOVERNMENT OF THE INSURRECTIONARY STATES. THE SENATE AMENDMENT IS A SUBSTITUTE FOR THE BILL AND WOULD INSERT A PREAMBLE,TO WIT: THAT NO LEGAL STATE GOVERNMENT OR ADEQUATE PROTECTION FOR LIFE AND PROPERTY NOW EXISTS IN THE STATES OF VIRGINIA, NORTH CAROLINA, SOUTH CAROLINA, GEORGIA ALABAMA, LOUISIANA, FLORIDA, TEXAS, AND ARKAN.; THEREFORE SAID STATES ARE TO BE DIVIDED INTO ...",Nullification/Secession/Reconstruction,,Domestic Social Policy,,Civil Liberties,6.245291777115826,0.20511346153635895,-0.029,0.024,0.69,-0.639,0.975,0.994,-3.234522,
2016-10-18 10:30:10,RH0390532,39,House,532,1867-02-18,,103,60,"TO ORDER THE MAIN QUESTION ON SENATE AMENDMENT TO H.R. 1143, TO TEST THE SENSE OF THE HOUSE ON SENATE AMENDMENT WHICH IS A SUBSTITUTE FOR THE BILL AND WHICH PROPOSES TO INSERT A PREAMBLE TO WIT, THAT NO LEGAL STATE GOVERNMENT OR ADEQUATE PROTECTION FOR LFE AND PROPERTY NOW EXISTS IN THE REBEL STATES OF VIRGINIA, NORTH CAROLINA, SOUTH CAROLINA, GEORGIA, ALABAMA, LOUISIANA, FLORIDA, TEXAS, AND ARKAN.; THEREFORE, SAID STATES ARE TO BE DIVIDED INTO MILITARY DISTRICTS AND MADE SUBJECT TO MILITARY AUTHORITY AN...",Nullification/Secession/Reconstruction,,Domestic Social Policy,,Civil Liberties,-25.89512729837522,1.3366366548788777,0.013,1.0,-0.197,-0.044,0.617,0.859,-60.447391,
2016-10-18 10:30:10,RH0390533,39,House,533,1867-02-18,,75,99,"TO CONCUR IN SENATE AMENDMENT ON H. R. 1143. THE SENATE AMENDMENT IS A SUBSTITUTE FOR THE BILL. (P. 1315-3, 1340)",Nullification/Secession/Reconstruction,,Domestic Social Policy,,Civil Liberties,-3.3967663557936394,0.7738134205176198,-0.066,0.998,-0.111,-0.189,0.173,0.644,-99.134325,
2016-10-18 10:30:10,RH0390534,39,House,534,1867-02-18,,112,41,"TO AMEND S. 453 (14 STAT 430, 3/2/1867), A BILL REGULATING THE TENURE OF CERTAIN CIVIL OFFICERS, BY PROVIDING THAT HOUSE AGREE TO REPORT OF COMMITTEE OF CONFERENCE WHICH ADVISES THAT SECRETARIES OF STATE, TREASURY, WAR, NAVY, INTERIOR, THE POSTMASTER GENRAL, AND ATTORNEY GENERAL HOLD THEIR OFFICES FOR AND DURING TERM OF PRESIDENT BY WHOM APPOINTED AND FOR ONE MONTH THEREAFTER; SUBJECT TO REMOVAL BY AND WITH CONSENT OF SENATE",,,Domestic Social Policy,,Civil Liberties,8.627527510282857,-0.3788662654730114,0.046,0.018,-0.719,0.482,0.951,0.987,-4.485639,
2016-10-18 10:30:10,RH0390535,39,House,535,1867-02-19,,49,84,"TO TABLE H. R. 1145, A BILL TO PROVIDE FOR ORGANIZING, ARMING AND DISCIPLINING THE MILITIA AND FOR OTHER PURPOSES. (P. 1348, 1350)",,,Defense Policy Resolutions,Defense Policy Budget,Foreign and Defense Policy,5.608420125536426,-0.43458940878754987,0.07,-0.042,0.192,-0.198,0.755,0.91,-37.729558,
2016-10-18 10:30:10,RH0390536,39,House,536,1867-02-19,,33,101,"TO ADJOURN, MOTION MADE WHILE THE HOUSE WAS CONSIDERING H. R. 1145, A BILL TO PROVIDE FOR ORGANIZING, ARMING AND DISCIPLINING THE MILITIA AND FOR OTHER PURPOSES. (P. 1350-2, 3)",,,Defense Policy Resolutions,Defense Policy Budget,Foreign and Defense Policy,8.092396323111972,1.0569191256814443,-0.129,0.013,0.34,-0.243,0.909,0.978,-9.589787,
2016-10-18 10:30:10,RH0390537,39,House,537,1867-02-19,,98,39,"TO CONCUR IN SENATE AMENDMENTS ON H. R. 1099 (14 STAT 398, 2/22/1867), A BILL PROVIDING FOR THE ELECTION OF A CONGRESSIONAL PRINTER. THE SENATE AMENDMENTS PROVIDE FOR ABOLITION OF OFFICE OF SUPERINTENDANT OF PUBLIC PRINTING AND FOR SENATE TO ELECT A COMPNTENT, PRACTICAL PRINTER DESIGNATED 'CONGRESSIONAL PRINTER,' AT A SALARY OF $4,000, TO SUPERINTEND PRINTING AND BINDING OF JOURNALS AND DOCUMENTS FOR RESPECTIVE DEPARTMENTS OF GOVERNMENT",,,Government Organization,Budget Special Interest,Government Management,12.105383555845338,-0.43905841068057616,0.048,0.142,-0.27,0.129,0.897,0.971,-19.553289,
2016-10-18 10:30:10,RH0390538,39,House,538,1867-02-19,,79,43,"TO TABLE A MOTION TO RECONSIDER VOTE BY WHICH S. 594 WAS REFERRED TO COMMITTEE ON BANKING AND CURRENCY.  S. 594 IS A BILL TO PROVIDE FOR THE PAYMENT OF COMPOUND-INTEREST NOTES. (P. 1352-3, 1353-1)",,,Budget Special Interest,,Government Management,-2.3022428488624955,0.9074663572670625,-0.015,0.942,0.082,0.206,0.186,0.713,-67.963734,
2016-10-18 10:30:10,RH0390539,39,House,539,1867-02-19,,32,97,"TO POSTPONE THE REGULAR ORDER OF BUSINESS FOR PURPOSE OF FINISHING CONSIDERATION OF H. R. 1126 (14 STAT 485, 3/2/1867), A BILL MAKING APPROPRIATIONS FOR THE SUPPORT OF THE ARMY FOR YEAR ENDING JUNE 30, 1868, AND FOR OTHER PURPOSES.  (P. 1356-1)",,,Defense Policy Budget,,Foreign and Defense Policy,20.423631492309894,1.013812683430789,-0.009,0.83,0.226,-0.064,0.75,0.938,-24.919583,
2016-10-18 10:30:10,RH0390540,39,House,540,1867-02-19,,27,108,"TO TABLE SENATE AMENDMENTS ON H. R. 1143, A BILL TO PROVIDE FOR THE MORE EFFECTUAL GOVERNMENT OF THE REBEL STATES.  THE SENATE AMENDMENT, IS IN NATURE OF A SUBSTITUTE FOR THE BILL AND PROPOSES TO INSERT A PREAMBLE, TO WIT -- THAT NO LEGAL STATE GOVERNMEN OR ADEQUATE PROTECTION OF LIFE AND PROPERTY NOW EXISTS IN REBEL STATES OF VIRGINIA, NORTH CAROLINA, SOUTH CAROLINA, GEORGIA, ALABAMA, LOUISIANA, FLORIDA, TEXAS AND ARKAN.; THEREFORE, SAID STATES ARE TO BE DIVIDED INTO MILITARY DISTRICTS AND MADE SUBJECT ...",Nullification/Secession/Reconstruction,,Domestic Social Policy,,Civil Liberties,7.193064552928797,0.517321454152087,-0.069,0.021,0.689,-0.554,0.963,0.993,-2.849767,
2016-10-18 10:30:10,RH0390541,39,House,541,1867-02-19,,27,112,"TO ADJOURN BY SETTING DATE TO RECONVENE UPON ADJOURNMENT, TO WIT:  THURSDAY NEXT, FEB. 21, 1867.  (P. 1357-1)",,,Internal Organization,,Miscellaneous Policy,24.773443273267933,4.714524366996137,-0.161,0.726,0.257,-0.06,0.778,0.957,-18.116843,
