date_generated,id,congress,chamber,rollnumber,date,keyvote,yea,nay,description,Issue1,Issue2,Peltzman1,Peltzman2,Clausen1,slope,intercept,mid.dim1,mid.dim2,spread.dim1,spread.dim2,pre,classified,log_likelihood,vote_result
2016-10-18 10:30:10,RH0560001,56,House,1,1899-12-04,,336,6,"TO ELECT A SPEAKER OF THE HOUSE.  VOTES FOR J.D. RICHARDSON (DEM.) ARE CODED 1; VOTES 2 FOR D.B. HENDERSON (REP.) ARE CODED 3, VOTES FOR OTHER CANDIDATES ARE CODED 5.",Election of the Speaker of the House,,Internal Organization,,Miscellaneous Policy,,,0.0,0.0,0.0,0.0,-24.5,0.551,0.0,
2016-10-18 10:30:10,RH0560002,56,House,2,1899-12-04,,178,159,TO ADOPT THE H. RES. WHICH PROPOSES THAT THE RULES OF THE HOUSE OF REPRESENTATIVES OF THE 55TH CONGRESS BE ADOPTED AS THE RULES OF THE HOUSE OF REPRESENTATIVES OF THE 56TH CONGRESS.,,,Internal Organization,,Miscellaneous Policy,89.46250480834067,-8.139087937559,0.091,0.002,-0.727,0.047,1.0,1.0,-0.425939,
2016-10-18 10:30:10,RH0560003,56,House,3,1899-12-05,,307,32,"TO ADOPT H. RES. 1, PROVIDING THAT THE QUESTION OF THE ELIGIBILITY OF BRIGHAM H. ROBERTS AS A REPRESENTATIVE ELECT FROM UTAH TO A SEAT IN THE HOUSE BE REFERRED TO A SPECIAL COMMITTEE AND THAT PENDING THE REPORT OF SAID COMMITTEE, MR. ROBERTS SHALL NOT OCUPY A SEAT IN THE HOUSE; SAID COMMITTEE IS ALSO GIVEN POWERS TO EXAMINE PERSONS AND PAPERS RELATING TO THE CASE",Religion,,Internal Organization,,Miscellaneous Policy,-7.0013007817140585,-3.708664699455884,-0.511,-0.131,-0.23,-0.19,0.094,0.914,-67.533144,
2016-10-18 10:30:10,RH0560004,56,House,4,1899-12-08,,170,149,"TO PASS H. RES. 30, RULE FOR CONSIDERATION OF H.R. 1, A BILL DEFINING AND FIXING THE STANDARD OF VALUE, TO MAINTAIN THE PARITY OF ALL FORMS OF MONEY ISSUED OR COINED BY THE U.S.  (P. 163,160)",U.S. Currency,,Budget General Interest,,Government Management,-11.920361261538469,1.411478654984616,0.107,0.136,-0.439,-0.213,0.993,0.997,-6.87947,
2016-10-18 10:30:10,RH0560005,56,House,5,1899-12-18,,193,152,"TO PASS H.R. 1, A BILL DEFINING AND FIXING THE STANDARD OF VALUE, TO MAINTAIN THE PARITY OF ALL FORMS OF MONEY ISSUED OR COINED BY THE U.S.  (P. 572,160,163)",U.S. Currency,,Budget General Interest,,Government Management,4.0001685944939736,0.08400033718898794,-0.002,0.076,-0.628,0.908,0.954,0.98,-19.483144,
2016-10-18 10:30:10,RH0560006,56,House,6,1899-12-20,,82,107,TO ADJOURN.  (P. 621),,,Internal Organization,,Miscellaneous Policy,-6.824746240262138,1.572382499909729,0.266,-0.243,-0.177,-0.15,0.768,0.899,-51.846488,
2016-10-18 10:30:10,RH0560007,56,House,7,1899-12-20,,77,95,TO ADJOURN.  (P. 622-2),,,Internal Organization,,Miscellaneous Policy,-4.534933460882969,0.9812901617769021,0.223,-0.03,-0.207,-0.264,0.805,0.913,-35.39898,
2016-10-18 10:30:10,RH0560008,56,House,8,1900-01-15,,89,140,"TO RECOMMIT TO THE COMMITTEE ON THE DISTRICT OF COLUMBIA H.R. 5297, A BILL TO AMEND THE ACT ENTITLED ""AN ACT TO BETTER DEFINE AND REGULATE THE RIGHTS OF ALIENS TO HOLD AND OWN REAL ESTATE IN THE TERRITORIES,"" APPROVED MARCH 2, 1897, WITH INSTRUCTIONS TO TRIKE OUT ALL AFTER THE ENACTING CLAUSE AND INSERT AN AMENDMENT WHICH WOULD AUTHORIZE ALIENS WHO MAKE CLAIMS TO REAL ESTATE IN THE DISTRICT OF COLUMBIA TO SELL OR DISPOSE OF SAME TO CITIZENS OF THE U.S",,,D. C.,Regulation Special Interest,Social Welfare,-76.63380312158756,-12.496140893210836,-0.158,-0.388,0.159,0.012,0.708,0.886,-70.067016,
2016-10-18 10:30:10,RH0560009,56,House,9,1900-01-17,,165,138,"TO TABLE THE APPEAL FROM THE DECISION OF THE CHAIR RELATING TO S. 2179, AN ACT HAVING TO DO WITH THE 12TH CENSUS AND SUBSEQUENT CENSUSES AND GIVING THE DIRECTOR THEREOF ADDITIONAL POWER AND AUTHORITY IN CERTAIN CASES, WHICH DECISION OF THE CHAIR WAS THATSAID BILL WAS A PRIVILEDGED BILL BECAUSE IT IS CARRYING OUT A DUTY IMPOSED ON CONGRESS BY THE CONSTITUTION",,,Budget Special Interest,,Government Management,-112.05886305515163,2.7994715763787914,0.025,-0.002,-0.31,-0.016,0.993,0.997,-10.243196,
2016-10-18 10:30:10,RH0560010,56,House,10,1900-01-25,,84,246,"TO AGREE TO THE SUBSTITUTE RESOLUTION, THAT BRIGHAM ROBERTS HAVING BEEN ELECTED A REPRESENTATIVE TO THE 56TH CONGRESS FROM THE STATE OF UTAH WITH THE QUALIFICATIONS REQUISITE FOR ADMISSION TO THE HOUSE, HE IS ENTITLED AS A CONSTITUTIONAL RIGHT TO TAKE TH OATH OF OFFICE, HIS STATUS AS A POLYGAMIST AFFORDING CONSTITUTIONAL GROUNDS FOR EXPULSION, BUT NOT FOR EXCLUSION FROM THE HOUSE",Religion,,Internal Organization,,Miscellaneous Policy,-4.774901291472327,-1.7742154520153144,-0.35,-0.103,0.142,0.172,0.31,0.824,-122.173476,
2016-10-18 10:30:10,RH0560011,56,House,11,1900-01-25,,269,50,"TO ADOPT THE RESOLUTION WHICH PROVIDES THAT UNDER THE FACTS AND CIRCUMSTANCES OF THIS CASE, BRIGHAM ROBERTS, REPRESENTATIVE FROM THE STATE OF UTAH, OUGHT NOT TO HAVE OR HOLD A SEAT IN THE HOUSE OF REPRESENTATIVES AND THAT THE SEAT TO WHICH HE WAS ELECTEDIS HEREBY DECLARED VACANT",Religion,,Internal Organization,,Miscellaneous Policy,-4.346972127555502,-1.9747086525070874,-0.443,-0.049,-0.236,-0.314,0.32,0.893,-73.854988,
2016-10-18 10:30:10,RH0560012,56,House,12,1900-02-02,,24,89,TO ADJOURN.  (P. 1465-2,,,Internal Organization,,Miscellaneous Policy,-31.299932906486376,-26.658042500858823,-0.857,0.166,0.092,0.017,0.0,0.788,-56.055499,
2016-10-18 10:30:10,RH0560013,56,House,13,1900-02-02,,29,84,TO ADJOURN.  (P. 1466-2),,,Internal Organization,,Miscellaneous Policy,5.710472074023245,-3.65499990004932,0.487,-0.874,-0.078,0.079,0.0,0.743,-62.183341,
2016-10-18 10:30:10,RH0560014,56,House,14,1900-02-02,,33,80,TO ADJOURN.  7P. 1467-2),,,Internal Organization,,Miscellaneous Policy,5.160825057825345,-4.52551162767889,0.911,0.176,-0.058,0.065,0.0,0.708,-67.392891,
2016-10-18 10:30:10,RH0560015,56,House,15,1900-02-09,,84,152,TO ADJOURN.,,,Internal Organization,,Miscellaneous Policy,-5.867101762937219,-1.296960550523834,-0.369,0.868,0.211,0.208,0.679,0.886,-71.028997,
2016-10-18 10:30:10,RH0560016,56,House,16,1900-02-09,,169,0,TO RESOLVE INTO COMMITTEE OF THE WHOLE FOR CONSIDERATION OF BILLS ON THE PRIVATE CALENDAR.  (P. 1673-1),,,Internal Organization,,Miscellaneous Policy,,,0.0,0.0,0.0,0.0,-6300000.0,0.627,0.0,
2016-10-18 10:30:10,RH0560017,56,House,17,1900-02-17,,82,129,"TO AGREE TO THE AMENDMENT TO H.R. 8347, (31-STAT-86) MAKING APPROPRIATIONS FOR THE LEGISLATIVE, EXECUTIVE, AND JUDICIAL EXPENSES OF THE GOVERNMENT FOR FISCAL 1901, WHICH AMENDMENT STRIKES OUT THE BILL'S PROVISIONS FOR 3 CIVIL SERVICE COMMISSIONERS AND THIR STAFF AT SPECIFIC SALARIES AND NECESSARY PERSONEL EXPENSES",Civil Service and Patronage,,Budget Special Interest,,Government Management,16.06578681794289,7.233156556243217,-0.504,-0.864,0.05,-0.018,0.073,0.64,-134.729775,
2016-10-18 10:30:10,RH0560018,56,House,18,1900-02-19,,155,1,TO RESOLVE THE HOUSE INTO THE COMMITTEE OF THE WHOLE TO PROCEED TO CONSIDERATION OF BILLS ON THE PRIVATE CALENDAR.,,,Internal Organization,,Miscellaneous Policy,,,0.0,0.0,0.0,0.0,-53.999,0.647,0.0,
2016-10-18 10:30:10,RH0560019,56,House,19,1900-02-28,,167,176,"TO AGREE TO THE SUBSTITUTE AMENDMENT FOR H.R. 8245 (31 STAT. 77, APRIL 12, 1900), AN ACT FOR THE REGULATION OF TARIFFS AND CUSTOMS FOR PUERTO RICO, WHICH SUBSTITUTE PROVIDES FOR THE SELECTION OF A CUSTOMS OFFICER AND FEES FOR SERVICE RENDERED, AND FURTHE PROVIDES THAT THE DISTRICT OF PUERTO RICO SHALL COMPRISE ALL THE ISLANDS CEDED, AND THAT SAN JUAN WILL BE THE PORT OF ENTRY",Tariffs,,Government Organization,Regulation Special Interest,Government Management,-11.441634264256717,0.5492840461863523,-0.022,0.801,0.273,0.138,0.946,0.974,-33.461363,
2016-10-18 10:30:10,RH0560020,56,House,20,1900-02-28,,162,173,TO RECOMMIT BILL H.R. 8245 TO THE COMMITTEE ON WAYS AND MEANS.,Tariffs,,Government Organization,Regulation Special Interest,Government Management,-10.069183497221552,0.48547164164170087,-0.051,0.999,0.289,0.166,0.938,0.97,-37.028225,
2016-10-18 10:30:10,RH0560021,56,House,21,1900-02-28,,173,161,TO PASS H.R. 8245.,Tariffs,,Government Organization,Regulation Special Interest,Government Management,-9.9803802500733,0.4949221282465549,-0.047,0.964,-0.283,-0.164,0.937,0.97,-36.990305,
2016-10-18 10:30:10,RH0560022,56,House,22,1900-03-01,,137,144,TO CONSIDER H. RES. 145 REGARDING THE CONTESTED ELECTION OF ALDRICH VS. ROBBINS FROM THE 4TH ALABAMA CONGRESSIONAL DISTRICT.,Disputed Elections to Congress,,Internal Organization,,Miscellaneous Policy,46.53581986976246,-6.814229700985319,0.146,-0.02,-1.223,0.152,0.978,0.989,-14.263433,
2016-10-18 10:30:10,RH0560023,56,House,23,1900-03-01,,128,132,TO PROCEED TO THE CONSIDERATION OF H. RES. 145 RELATIVE TO THE CONTESTED ELECTION CASE OF ALDRICH VS. ROBBINS FROM THE 4TH CONGRESSIONAL DISTRICT OF THE STATE OF ALABAMA. (P. 2456-1),Disputed Elections to Congress,,Internal Organization,,Miscellaneous Policy,77.18588197769506,-7.082472905903336,0.094,0.173,-0.734,0.055,1.0,1.0,-0.398279,
2016-10-18 10:30:10,RH0560024,56,House,24,1900-03-02,,153,135,"TO ORDER THE PREVIOUS QUESTION ON H.R. 9080 (31 STAT. 51, MARCH 24, 1900), AN APPROPRIATIONS BILL FOR PUERTO RICO, CONCERNING REVENUES COLLECTED OR TO BE COLLECTED ON IMPORTATIONS THEREFROM.",,,Budget Special Interest,,Government Management,-47.89409616333266,0.5268350577966593,0.011,-0.0,-0.737,-0.089,1.0,1.0,-1.029663,
2016-10-18 10:30:10,RH0560025,56,House,25,1900-03-02,,131,150,"TO RECOMMIT H.R. 9080 TO THE COMMITTEE ON APPROPRIATIONS WITH INSTRUCTIONS TO LIMIT THE APPROPRIATIONS THEREIN TO SUCH AMOUNT AS HAS ALREADY BEEN COLLECTED ON IMPORTATIONS THEREFROM, AND SPECIFYING THE USES TO WHICH SUCH MONEY MAY BE PUT.  (P. 2487-2)",,,Budget Special Interest,,Government Management,-41.73324387531517,0.4600656826284668,0.011,0.001,0.736,0.102,1.0,1.0,-1.009609,
2016-10-18 10:30:10,RH0560026,56,House,26,1900-03-02,,164,110,TO PASS H.R. 9080.,,,Budget Special Interest,,Government Management,-24.058178243339686,-4.832868361641295,-0.204,0.075,-0.495,-0.119,0.891,0.956,-31.807801,
2016-10-18 10:30:10,RH0560027,56,House,27,1900-03-02,,152,110,TO TABLE THE MOTION TO RECONSIDER THE VOTE BY WHICH H.R. 9080 PASSED THE HOUSE.  (P. 2489-1),,,Budget Special Interest,,Government Management,-160.01523670671114,-25.600437873073783,-0.16,0.002,-0.747,-0.027,0.945,0.977,-15.567666,
2016-10-18 10:30:10,RH0560028,56,House,28,1900-03-02,,136,129,"TO CONSIDER H.R. 145, RELATING TO THE CONTESTED ELECTION CASE OF ALDRICH VS. ROBBINS FROM THE 4TH CONGRESSIONAL DISTRICT OF ALABAMA, WHICH RESOLUTION PROVIDES THAT ALDRICH WAS ELECTED.",Disputed Elections to Congress,,Internal Organization,,Miscellaneous Policy,121.62259643663276,-10.792411082860315,0.089,0.032,-0.736,0.035,1.0,1.0,-0.405161,
2016-10-18 10:30:10,RH0560029,56,House,29,1900-03-02,,162,1,TO RESOLVE INTO COMMITTEE OF WHOLE TO TAKE UP BILLS ON THE PRIVATE CALENDAR.  (P. 2495-2),,,Internal Organization,,Miscellaneous Policy,,,0.0,0.0,0.0,0.0,-55.999,0.65,0.0,
2016-10-18 10:30:10,RH0560030,56,House,30,1900-03-05,,123,90,"TO TABLE THE APPEAL FROM THE DECISION OF THE CHAIR, WHICH DECISION WAS THAT MR. BABCOCK AND NOT MR. BAILEY WAS ENTITLED TO THE FLOOR AS HE WAS IN CHARGE OF H.R. 3597, (31 STAT. 662, 6/6/1900), TO INCORPORATE A MEMORIAL TO THE LATE FREDERICK DOUGLAS, FOR HE PURPOSE OF COLLECTING AND PRESERVING A HISTORICAL RECORD OF THE ANTI-SLAVERY MOVEMENT IN THE UNITED STATES AND TO ASSEMBLE ALL SAID EXHIBITS IN THE VILLAGE OF ANACOSTIN IN THE DISTRICT OF COLUMBIA, AS A MONUMENT TO THE ANTI-SLAVERY MOVEMENT",Civil Rights/Desegregation/Busing/Affirmative Action,,D. C.,Budget Special Interest,Government Management,29.73567586260124,0.6096562207024299,-0.024,-0.104,-0.473,0.092,0.989,0.995,-4.160516,
2016-10-18 10:30:10,RH0560031,56,House,31,1900-03-05,,107,95,TO ORDER THE PREVIOUS QUESTION ON H.R. 3597.  (P. 2550-1),Civil Rights/Desegregation/Busing/Affirmative Action,,D. C.,Budget Special Interest,Government Management,-37.40822655407251,2.172677140136206,0.058,0.003,-0.705,-0.109,1.0,1.0,-0.060012,
2016-10-18 10:30:10,RH0560032,56,House,32,1900-03-05,,101,81,TO ORDER THE ENGROSSMENT AND THIRD READING OF H.R. 3597.,Civil Rights/Desegregation/Busing/Affirmative Action,,D. C.,Budget Special Interest,Government Management,-56.52586434025026,-7.682517550274036,-0.136,0.005,-0.733,-0.075,0.963,0.984,-7.065088,
2016-10-18 10:30:10,RH0560033,56,House,33,1900-03-08,,134,138,"TO AGREE TO A SUBSTITUTE FOR H. RES. 145, RELATIVE TO THE CONTESTED ELECTION IN THE 4TH ALABAMA DISTRICT, WHICH SUBSTITUTE DECLARES GASTON ROBBINS ELECTED. (P. 2680-1, 2452-1)",Disputed Elections to Congress,,Internal Organization,,Miscellaneous Policy,222.21519872396792,-20.44179828260505,0.092,0.002,0.73,-0.019,1.0,1.0,-0.417573,
2016-10-18 10:30:10,RH0560034,56,House,34,1900-03-08,,141,135,"TO PASS H. RES. 145, PROVIDING THAT W. ALDRICH WAS DULY ELECTED FROM THE 4TH CONGRESSIONAL DISTRICT OF ALABAMA. (P. 3241-1)",Disputed Elections to Congress,,Internal Organization,,Miscellaneous Policy,352.8046785220257,-32.10222574550434,0.091,0.003,-0.732,0.012,1.0,1.0,-0.422823,
2016-10-18 10:30:10,RH0560035,56,House,35,1900-03-09,,215,0,TO GO INTO COMMITTEE OF THE WHOLE TO CONSIDER THE BILLS ON THE PRIVATE CALENDAR.  (P. 2702-2),,,Internal Organization,,Miscellaneous Policy,,,0.0,0.0,0.0,0.0,-9900000.0,0.54,0.0,
2016-10-18 10:30:10,RH0560036,56,House,36,1900-03-12,,129,134,"TO AGREE TO A SUBSTITUTE FOR H. RES. 146, RELATIVE TO THE CONTESTED ELECTION IN THE 2ND CONGRESSIONAL DISTRICT OF VIRGINIA, WISE VS. YOUNG; WHICH SUBSTITUTE DECLARES YOUNG DULY ELECTED.  (P. 2793, 2747)",Disputed Elections to Congress,,Internal Organization,,Miscellaneous Policy,-30.570897202142746,0.5294142244578541,0.027,-0.296,0.259,0.049,0.977,0.989,-17.071161,
2016-10-18 10:30:10,RH0560037,56,House,37,1900-03-12,,132,129,"TO TABLE THE MOTION TO RECONSIDER THE VOTE BY WHICH THE HOUSE REJECTED THE SUBSTITUTE TO H. RES. 146, THE SUBSTITUTE DECLARING YOUNG DULY ELECTED.",Disputed Elections to Congress,,Internal Organization,,Miscellaneous Policy,-237.13101343283702,23.726101343283705,0.1,0.013,-0.738,-0.018,1.0,1.0,-0.330069,
2016-10-18 10:30:10,RH0560038,56,House,38,1900-03-12,,132,127,TO ADOPT THAT PART OF H. RES. 146 WHICH PROPOSES THAT WM. A. YOUNG WAS NOT ELECTED TO THE 56TH CONGRESS.,Disputed Elections to Congress,,Internal Organization,,Miscellaneous Policy,-237.13101343283702,23.726101343283705,0.1,0.013,-0.738,-0.018,1.0,1.0,-0.330069,
2016-10-18 10:30:10,RH0560039,56,House,39,1900-03-12,,131,125,TO AGREE TO 2ND PART OF H. RES. 146 WHICH PROVIDES THAT RICHARD A. WISE WAS DULY ELECTED TO THE 56TH CONGRESS.,Disputed Elections to Congress,,Internal Organization,,Miscellaneous Policy,-213.41791208955328,21.34279120895533,0.1,0.001,-0.738,-0.02,1.0,1.0,-0.330714,
2016-10-18 10:30:10,RH0560040,56,House,40,1900-03-13,,173,127,"TO ADOPT THE CONFERENCE REPORT ON H.R. 1, A BILL TO DEFINE AND FIX THE STANDARD OF VALUE, TO MAINTAIN THE PARITY OF ALL FORMS OF MONEY ISSUED OR COINED BY THE U.S.",U.S. Currency,,Budget General Interest,,Government Management,4.012662472044664,0.16137987416133992,-0.03,0.041,-0.648,0.934,0.937,0.973,-16.286204,
2016-10-18 10:30:10,RH0560041,56,House,41,1900-03-19,,93,113,"TO AGREE TO THE SENATE AMENDMENTS TO H.R. 9080, WHICH PROVIDE THAT SUCH REVENUES SHALL BE PLACED AT THE DISPOSAL OF THE PRESIDENT TO BE USED FOR THE GOVERNMENT OF PUERTO RICO UNTIL OTHERWISE PROVIDED FOR BY LAW.  (P.3043-2)",,,Budget Special Interest,,Government Management,7.895186664817646,0.43050157321869403,-0.062,-0.059,0.688,-0.504,0.978,0.99,-4.331417,
2016-10-18 10:30:10,RH0560042,56,House,42,1900-03-20,,112,103,"TO TABLE H. RES. 175, PROVIDING THAT THE SECRETARY OF WAR BE DIRECTED TO INFORM THE HOUSE WHAT FORTIFICATIONS GREAT BRITAIN IS ERECTING AND COMPLETING AT PUGET SOUND AND OTHER PLACES ON THE PACIFIC OCEAN CONTIGUOUS TO THE STATE OF WASHINGTON AND THE DISTICT OF ALASKA.",,,Foreign Policy Resolutions,,Foreign and Defense Policy,-107.81378784594902,8.948544391213769,0.083,-0.0,-0.727,-0.039,1.0,1.0,-0.130812,
2016-10-18 10:30:10,RH0560043,56,House,43,1900-03-22,,153,99,"TO RECOMMIT TO THE COMMITTEE ON POST OFFICE AND POST ROADS, H.R. 6071, A BILL REGULATING THE POSTAL LAWS RELATIVE TO SECOND CLASS MAIL MATTER.  (P. 3199-1)",,,Budget Special Interest,,Government Management,8.008176813866916,-2.0694636496821777,0.179,-0.636,0.108,-0.078,0.469,0.793,-113.365064,
2016-10-18 10:30:10,RH0560044,56,House,44,1900-03-23,,150,1,"TO ORDER THE ENGROSSMENT AND 3RD READING OF H.R. 4836 (31 STAT. 1523, 4/23/1900), FOR THE RELIEF OF W. F. LOVELAND, LATE OF COMPANY E. SEVENTH PA. VOLUNTEERS. (P. 3255-2)",,,Budget Special Interest,,Government Management,,,0.0,0.0,0.0,0.0,-51.999,0.649,0.0,
2016-10-18 10:30:10,RH0560045,56,House,45,1900-03-24,,135,90,"TO AGREE TO THE REPORT OF THE COMMITTEE OF CONFERENCE ON H.R. 9080, WHICH REPORT PROVIDES THAT THE CUSTOMS REVENUES, SINCE THE EVACUATION OF PUERTO RICO BY SPAIN, SHALL BE AT THE DISPOSAL OF THE PRESIDENT FOR THE BENEFIT OF THE CITIZENS IN PUERTO RICO.  P",,,Budget Special Interest,,Government Management,-29.106198196143286,-5.8523458374248,-0.201,-0.002,-0.775,-0.154,0.922,0.969,-17.369212,
2016-10-18 10:30:10,RH0560046,56,House,46,1900-04-02,,89,92,"TO AMEND H. RES. 207, PROVIDING THAT THE SECRETARY OF THE TREASURY REPORT TO THE HOUSE THE NAMES OF PERSONS AND FIRMS WHO FROM TIME TO TIME HAVE PAID CUSTOM DUTIES ON ARTICLES ENTERED INTO THE U.S. FROM PUERTO RICO SINCE THE TREATY WITH SPAIN, TOGETHER WTH THE DATES AND AMOUNTS PAID BY EACH, SAID AMENDMENT TO ADD A PROVISION TO REPORT, IF POSSIBLE, THE NAMES OF PERSONS, FIRMS AND CORPORATIONS FROM WHOM THE IMPORTERS PURCHASED SUCH GOODS UPON WHICH IMPORT TAXES WERE COLLECTED.",,,Government Organization,,Government Management,-124.34918997087793,0.12534918997087793,0.001,0.001,0.731,0.034,1.0,1.0,-0.906357,
2016-10-18 10:30:10,RH0560047,56,House,47,1900-04-10,,93,109,"TO AMEND BILL H.R. 2864, (31-STAT-274, 6/6/1900), AUTHORIZ- ING AND EMPOWERING THE SECRETARY OF THE TREASURY, THE SECRETARY OF THE INTERIOR AND THE ATTORNEY GENERAL TO MAKE SETTLEMENTS AND ADJUSTMENTS WITH THE SIOUX CITY AND PACIFIC RAILROAD COMPANY FOR TS INDEBTEDNESS TO THE GOVERNMENT OF THE U.S",,,Budget Special Interest,,Government Management,-18.604181135177864,0.5642717737865612,0.065,-0.645,0.193,0.06,0.902,0.955,-38.799424,
2016-10-18 10:30:10,RH0560048,56,House,48,1900-04-11,,159,146,"TO ADOPT H. RES. 217, WHICH PROVIDES THAT IMMEDIATELY UPON THE ADOPTION OF THE RESOLUTION, THE COMMITTEE OF THE WHOLE SHALL BE DISCHARGED FROM FURTHER CONSIDERATION OF H.R. 8245, AN ACT TO TEMPORARILY PROVIDE REVENUES FOR THE RELIEF OF THE ISLAND OF PUERO RICO",,,Budget Special Interest,,Government Management,-11.567366508918878,1.816374442373507,0.154,0.035,-0.264,-0.132,0.931,0.967,-31.998114,
2016-10-18 10:30:10,RH0560049,56,House,49,1900-04-11,,163,159,"TO CONCUR IN THE SENATE AMENDMENT TO BILL H.R. 8245, WHICH AMENDMENT PROVIDES FOR FREE TRADE BETWEEN THE U.S. AND PUERTO RICO AND ALSO  A CIVIL GOVERNMENT, REPUBLICAN IN FORM FOR THE TERRITORY.  (P. 4071-1, 4032-2)",,,Budget Special Interest,,Government Management,-8.813231625842954,1.420611207128129,0.152,0.081,-0.256,-0.168,0.924,0.963,-37.96864,
2016-10-18 10:30:10,RH0560050,56,House,50,1900-04-12,,121,135,"TO AMEND H.R. 9388, (31 STAT. 658, 6/6/1900), FOR THE PURPOSE OF THE PROTECTION OF THE DISBURSING OFFICERS OF THE U.S. IN THE PHILIPPINES, CUBA, AND PUERTO RICO AND THE SAFE KEEPING OF THE PUBLIC MONEYS IN THEIR HANDS, WHICH AMENDMENT PROVIDES THAT THIS CT SHALL APPLY TO CUBA AND THE PHILIPPINES ONLY WHILE THEY ARE OCCUPIED BY THE UNITED STATES",,,Government Organization,,Government Management,-183.56907720675608,11.940990018439146,0.065,0.009,0.73,0.023,1.0,1.0,-0.191472,
2016-10-18 10:30:10,RH0560051,56,House,51,1900-04-12,,123,111,"TO PASS H.R. 9388, PROVIDING DEPOSITORIES FOR PUBLIC MONEYS IN THE PHILIPPINE ISLANDS, AND THE ISLANDS OF CUBA AND PUERTO RICO, AND PROVIDING FOR THE PROTECTION OF THE DISBURSING OFFICERS OF THE U.S. IN THE PHILIPPINES, CUBA, AND PUERTO RICO.  (P. 4104-1)",,,Budget Special Interest,,Government Management,13.101813086632609,-0.15695955162366948,0.088,0.996,-0.333,0.147,0.973,0.987,-16.342334,
2016-10-18 10:30:10,RH0560052,56,House,52,1900-04-13,,245,15,"TO PASS H.J. RES. 28, PROPOSING AN AMENDMENT TO THE CONSTITUTION PROVIDING FOR THE ELECTION OF SENATORS OF THE UNITED STATES.",Constitutional Amendments,,Government Organization,,Government Management,1.8563350183527019,-1.5682749517354417,0.367,-0.887,0.147,-0.458,0.0,0.942,-43.32255,
2016-10-18 10:30:10,RH0560053,56,House,53,1900-04-20,,107,99,"TO RESOLVE INTO THE COMMITTEE OF THE WHOLE FOR THE FURTHER CONSIDERATION OF H.R. 10450, (31 STAT. 684, 6/7/1900), MAKING APPROPRIATIONS FOR THE NAVAL SERVICE FOR THE FISCAL YEAR ENDING JUNE 30, 1901.",,,Defense Policy Budget,,Foreign and Defense Policy,-6.7215778362636724,0.3789373561989004,0.011,0.305,-0.129,-0.111,0.758,0.883,-70.11609,
2016-10-18 10:30:10,RH0560054,56,House,54,1900-04-20,,69,104,"TO ADJOURN, MOTION MADE DURING DEBATE ON H.R. 10450, MAKING APPROPRIATIONS FOR THE NAVAL SERVICES FOR THE FISCAL YEAR ENDING JUNE 30, 1901.  (P. 4502-1)",,,Defense Policy Budget,,Foreign and Defense Policy,9.073802471068102,1.087317679387212,-0.194,-0.673,0.262,-0.167,0.899,0.96,-21.632908,
2016-10-18 10:30:10,RH0560055,56,House,55,1900-04-27,,142,57,"TO CONCUR IN THE REPORT OF THE CONFERENCE COMMITTEE ON S. 222, (31 STAT. 141, 4/30/1900), PROVIDING FOR A GOVERNMENT FOR THE TERRITORY OF HAWAII.  (P. 4733-1,2)",,,Government Organization,,Government Management,4.809258358327685,1.5843553068984413,-0.276,0.257,-0.153,0.184,0.456,0.844,-63.528972,
2016-10-18 10:30:10,RH0560056,56,House,56,1900-04-30,,142,27,"TO PASS H.R. 6634, ENLARGING THE POWERS OF THE DEPT. OF AGRICULTURE TO PROHIBIT THE INTERSTATE TRANSPORTATION OF GAME KILLED IN VILOATION OF LOCAL LAWS.  (P. 4875-1)",Fish and Wildlife,,Regulation Special Interest,,Government Management,-10.670671430708111,-4.844119458095817,-0.446,-0.085,-0.238,-0.129,0.185,0.87,-43.515931,
2016-10-18 10:30:10,RH0560057,56,House,57,1900-05-02,,154,105,"TO AMEND H.R. 2538, PROVIDING FOR THE CONSTRUCTION OF A CANAL CONNECTING THE ATLANTIC AND THE PACIFIC OCEANS IN NICARAGUA, IN ORDER TO PROVIDE FOR THE DEFENSE OF THE HARBORS AT THE EXITS AND ENTRANCES OF SAID CANAL. (P. 4988-1)",,,Defense Policy Budget,,Foreign and Defense Policy,12.556680749813257,0.6735263005048553,0.026,1.0,-0.165,0.076,0.762,0.903,-76.983678,
2016-10-18 10:30:10,RH0560058,56,House,58,1900-05-02,,226,36,"TO PASS BILL H.R. 2538, PROVIDING FOR THE CONSTRUCTION OF A CANAL CONNECTING THE ATLANTIC AND THE PACIFIC OCEANS IN NICARAGUA.",Public Works,,Budget Special Interest,,Government Management,21.263541376689112,-16.810291446283724,0.76,-0.65,0.125,-0.034,0.0,0.863,-100.502942,
2016-10-18 10:30:10,RH0560059,56,House,59,1900-05-08,,82,139,TO TABLE H. RES. 229 CALLING FOR THE SECRETARY OF THE TREASURY TO FURNISH INFORMATION ON THE AMOUNT AND CHARACTER OF THE MATERIAL USED BY THE SEVERAL MANUFACTURES OF OLEOMARGARINE.,Agriculture,,Government Organization,,Agriculture,-2.2541534735329094,-0.6648957626404634,-0.637,0.771,0.152,0.39,0.427,0.787,-108.840024,
2016-10-18 10:30:10,RH0560060,56,House,60,1900-05-10,,127,128,"TO AGREE TO THE SUBSTITUTE TO H. RES. 131, RELATIVE TO THE CONTESTED ELECTION CASE OF PEARSON VS. CRAWFORD IN THE 9TH CONGRESSIONAL DISTRICT OF NORTH CAROLINA, WHICH SUBSTITUTE DECLARES THAT CRAWFORD WAS DULY ELECTED.",Disputed Elections to Congress,,Internal Organization,,Miscellaneous Policy,-29.073682936846442,4.708936635769123,0.162,-0.001,0.749,0.149,0.992,0.996,-3.390327,
2016-10-18 10:30:10,RH0560061,56,House,61,1900-05-10,,129,127,"TO PASS H. RES. 131, DECLARING THAT PEARSON WAS DULY ELECTED FROM THE 9TH CONGRESSIONAL DISTRICT OF NORTH CAROLINA.",Disputed Elections to Congress,,Internal Organization,,Miscellaneous Policy,-29.995377981748266,4.828255855061471,0.161,-0.001,-0.752,-0.145,0.992,0.996,-3.420931,
2016-10-18 10:30:10,RH0560062,56,House,62,1900-05-16,,110,100,"TO ORDER THE PREVIOUS QUESTION ON S. 2931, (31 STAT. 277, 6/6/1900), INCORPORATING THE AMERICAN RED CROSS.",Humanitarian Assistance (foreign),,Government Organization,,Social Welfare,-14.885138298298711,-0.3436624468468841,-0.09,0.996,-0.332,-0.129,0.96,0.981,-17.272463,
2016-10-18 10:30:10,RH0560063,56,House,63,1900-05-16,,94,113,"TO RECOMMIT TO THE COMMITTEE ON FOREIGN AFFAIRS S. 2931, INCORPORATING THE AMERICAN NATIONAL RED CROSS.",Humanitarian Assistance (foreign),,Government Organization,,Social Welfare,-39.36636021583683,-3.2862696613678457,-0.099,0.611,0.211,0.031,0.872,0.942,-36.687479,
2016-10-18 10:30:10,RH0560064,56,House,64,1900-05-18,,75,11,"TO ORDER THE ENGROSSMENT AND THIRD READING, ON H.R. 636, FOR THE RELIEF OF ST. JOHNS' LODGE, ANCIENT FREE AND ACCEPTED MASONS, NO. 3, OF NEWBERN, N.C.",,,Budget Special Interest,,Government Management,-6.254752478804551,3.4090758435120674,0.542,0.019,0.239,0.221,0.0,0.872,-23.243881,
2016-10-18 10:30:10,RH0560065,56,House,65,1900-05-23,,129,103,"TO TABLE THE APPEAL FROM THE DECISION OF THE CHAIR, MADE DURING THE CONSIDERATION OF H.R. 11719, (31 STAT. 656, 6/6/1900),RELATING TO FUGITIVES FROM JUSTICE, SAID DECISION HOLDING THAT THE DEBATE BY UNANIMOUS CONSENT WAS LIMITED TO 40 MINUTES ON EACH SID AND THEREFORE THE OFFER OF FURTHER AMENDMENTS WAS OUT OF ORDER.",,,Internal Organization,,Miscellaneous Policy,-63.04214747360789,-0.9005900646305105,-0.014,-0.018,-0.327,-0.03,0.99,0.996,-8.360407,
2016-10-18 10:30:10,RH0560066,56,House,66,1900-05-23,,107,127,"TO RECOMMIT TO THE COMMITTEE ON THE JUDICIARY BILL H.R. 11719, RELATING TO FUGITIVES FROM JUSTICE, WITH INSTRUCTIONS TO REPORT THE BILL SO AMENDED AS TO APPLY TO CUBA ONLY AND ONLY DURING THE U.S. OCCUPANCY THEREOF.",,,Domestic Social Policy,,Civil Liberties,-35.898723648368936,0.44178468378042723,0.012,0.011,0.72,0.116,1.0,1.0,-1.027795,
