date_generated,id,congress,chamber,rollnumber,date,keyvote,yea,nay,description,Issue1,Issue2,Peltzman1,Peltzman2,Clausen1,mid.dim1,mid.dim2,spread.dim1,spread.dim2,pre,classified,log_likelihood,geo_mean_probability
2017-01-23 13:12:32,RH1060565,106,House,565,1999-11-04,,216,201,MOTION QUESTION: TABLE APPEAL FROM RULING OF THE CHAIR,Tariffs,,Regulation Special Interest,,Government Management,-0.048,0.094,-0.537,0.865,0.985,0.993,-11.252,0.973
2017-01-23 13:12:32,RH1060566,106,House,566,1999-11-04,,214,204,MOTION QUESTION: TABLE APPEAL FROM RULING OF THE CHAIR,Tariffs,,Regulation Special Interest,,Government Management,-0.002,0.008,-0.69,0.634,0.995,0.998,-2.467,0.994
2017-01-23 13:12:32,RH1060567,106,House,567,1999-11-04,,335,79,Waiving points of order against the conference report to accompany S.900; Financial Services Modernization Act,Banking and Finance,,Regulation Special Interest,,Government Management,-0.436,-0.055,-0.242,0.023,0.418,0.889,-110.889,0.765
2017-01-23 13:12:32,RH1060568,106,House,568,1999-11-04,,362,57,Financial Services Modernization Act,Banking and Finance,,Regulation Special Interest,,Government Management,-0.541,-0.089,-0.177,-0.056,0.175,0.888,-122.103,0.747
2017-01-23 13:12:32,RH1060569,106,House,569,1999-11-05,,351,58,Young of Florida Amendment,,,Foreign Policy Budget,Foreign Policy Resolutions,Foreign and Defense Policy,0.316,0.949,0.177,0.274,0.086,0.87,-111.271,0.762
2017-01-23 13:12:32,RH1060570,106,House,570,1999-11-05,,316,100,"Foreign Operations Appropriations, FY 2000",,,Foreign Policy Budget,,Foreign and Defense Policy,0.23,0.498,0.114,0.314,0.23,0.815,-159.194,0.682
2017-01-23 13:12:32,RH1060571,106,House,571,1999-11-05,,388,25,"Medicare, Medicaid, and SCHIP Balanced Budget Refinement Act",,,Domestic Social Policy,Budget Special Interest,Social Welfare,0.999,0.053,0.272,-0.84,0.04,0.942,-71.229,0.842
2017-01-23 13:12:32,RH1060572,106,House,572,1999-11-08,,382,0,Recognizing the Generous Contribution Made by Each Living Person Who Has Donated a Kidney to Save a Life,,,Domestic Social Policy,,Social Welfare,0.0,0.0,0.0,0.0,,,0.0,
2017-01-23 13:12:32,RH1060573,106,House,573,1999-11-08,,386,1,Reauthorize Funding for the Office of Government Ethics,,,Budget Special Interest,,Government Management,0.0,0.0,0.0,0.0,,,0.0,
2017-01-23 13:12:32,RH1060574,106,House,574,1999-11-08,,389,0,Recognizing and Honoring Payne Stewart and Extending Condolences to His Family and the Families of Those Who Died With Him,,,Government Organization,,Government Management,0.0,0.0,0.0,0.0,,,0.0,
2017-01-23 13:12:32,RH1060575,106,House,575,1999-11-09,,418,2,Inslee of Washington Amendment,Radio/Television/Motion Pictures/Telecommunications,,Regulation Special Interest,,Government Management,0.0,0.0,0.0,0.0,,,0.0,
2017-01-23 13:12:32,RH1060576,106,House,576,1999-11-09,,126,278,Dingell of Michigan Amendment,Radio/Television/Motion Pictures/Telecommunications,,Regulation Special Interest,,Government Management,-0.291,0.019,0.201,0.024,0.635,0.886,-105.002,0.771
2017-01-23 13:12:32,RH1060577,106,House,577,1999-11-09,,356,67,Electronic Signatures in Global and National Commerce Act,Radio/Television/Motion Pictures/Telecommunications,,Regulation Special Interest,,Government Management,-0.484,0.029,-0.214,0.043,0.104,0.858,-116.086,0.76
2017-01-23 13:12:32,RH1060578,106,House,578,1999-11-09,,417,0,Expressing the sense of the Congress regarding Freedom Day,,,Foreign Policy Resolutions,Defense Policy Resolutions,Foreign and Defense Policy,0.0,0.0,0.0,0.0,,,0.0,
2017-01-23 13:12:32,RH1060579,106,House,579,1999-11-09,,412,8,"Satellite Copyright, Competition, and Consumer Protection Act",Radio/Television/Motion Pictures/Telecommunications,,Regulation Special Interest,,Government Management,0.0,0.0,0.0,0.0,,,0.0,
2017-01-23 13:12:32,RH1060580,106,House,580,1999-11-10,,278,144,Providing for consideration of H.R. 3073; Fathers Count Act of 1999,,,Domestic Social Policy,,Social Welfare,-0.27,-0.036,-0.176,-0.035,0.611,0.867,-123.445,0.746
2017-01-23 13:12:32,RH1060581,106,House,581,1999-11-10,,172,253,Mink Of Hawaii Amendment,,,Domestic Social Policy,,Social Welfare,-0.171,-0.072,0.269,0.225,0.855,0.941,-66.85,0.854
2017-01-23 13:12:32,RH1060582,106,House,582,1999-11-10,,184,238,Edwards of Texas Amendment,Religion,,Domestic Social Policy,,Social Welfare,-0.239,0.497,0.259,0.341,0.842,0.931,-73.739,0.84
2017-01-23 13:12:32,RH1060583,106,House,583,1999-11-10,,176,246,Fathers Count Act of 1999,Religion,,Domestic Social Policy,,Social Welfare,-0.159,0.005,0.258,0.117,0.869,0.945,-63.899,0.859
2017-01-23 13:12:32,RH1060584,106,House,584,1999-11-10,,329,93,Fathers Count Act of 1999,Religion,,Domestic Social Policy,,Social Welfare,0.801,0.599,0.123,-0.135,0.108,0.803,-195.902,0.629
2017-01-23 13:12:32,RH1060585,106,House,585,1999-11-16,,401,0,State Flexibility Clarification Act,,,Regulation Special Interest,,Government Management,0.0,0.0,0.0,0.0,,,0.0,
2017-01-23 13:12:32,RH1060586,106,House,586,1999-11-16,,399,0,Condemning the assassination of Armenian Prime Minister Vazgen Sargsian and other officials of the Armenian Government,,,Foreign Policy Resolutions,,Foreign and Defense Policy,0.0,0.0,0.0,0.0,,,0.0,
2017-01-23 13:12:32,RH1060587,106,House,587,1999-11-16,,396,4,Expressing the strong support of the Congress for the recently concluded elections in the Republic of India,,,Foreign Policy Resolutions,,Foreign and Defense Policy,0.0,0.0,0.0,0.0,,,0.0,
2017-01-23 13:12:32,RH1060588,106,House,588,1999-11-16,,214,202,Providing for Consideration of Motions to Suspend the Rules,,,Internal Organization,,Miscellaneous Policy,-0.304,-0.586,-0.417,0.952,0.975,0.988,-26.139,0.939
2017-01-23 13:12:32,RH1060589,106,House,589,1999-11-16,,412,1,"Expressing the sense of the House of Representatives with respect to democracy, free elections, and human rights in the Lao People’s Democratic Republic.",,,Foreign Policy Resolutions,,Foreign and Defense Policy,0.0,0.0,0.0,0.0,,,0.0,
2017-01-23 13:12:32,RH1060590,106,House,590,1999-11-16,,404,12,Expressing United States policy toward the Slovak Republic,,,Foreign Policy Resolutions,,Foreign and Defense Policy,0.743,0.372,0.287,-0.018,-0.083,0.969,-41.354,0.905
2017-01-23 13:12:32,RH1060591,106,House,591,1999-11-16,,407,4,Expressing grave concern regarding armed conflict in the North Caucasus region of the Russian Federation.,,,Foreign Policy Resolutions,,Foreign and Defense Policy,0.0,0.0,0.0,0.0,,,0.0,
2017-01-23 13:12:32,RH1060592,106,House,592,1999-11-16,,414,0,Expressing the sense of the House of Representatives regarding the importance of increased support and funding to combat diabetes.,Public Health,,Domestic Social Policy,,Social Welfare,0.0,0.0,0.0,0.0,,,0.0,
2017-01-23 13:12:32,RH1060593,106,House,593,1999-11-16,,183,231,United States Marshals Service Improvement Act of 1999,,,Government Organization,,Government Management,0.929,-0.37,0.018,0.387,0.049,0.58,-280.47,0.508
2017-01-23 13:12:32,RH1060594,106,House,594,1999-11-17,,403,8,Making further continuing appropriations for FY 2000,,,Budget General Interest,,Government Management,0.0,0.0,0.0,0.0,,,0.0,
2017-01-23 13:12:32,RH1060595,106,House,595,1999-11-17,,128,291,To provide support for certain institutes and schools.,,,Budget Special Interest,,Government Management,-0.299,0.954,0.054,-0.078,0.023,0.702,-253.182,0.546
2017-01-23 13:12:32,RH1060596,106,House,596,1999-11-18,,14,375,ADJOURN QUESTION: ON MOTION TO ADJOURN,,,Internal Organization,,Miscellaneous Policy,0.747,-0.665,-0.183,0.188,-0.071,0.961,-62.682,0.851
2017-01-23 13:12:32,RH1060597,106,House,597,1999-11-18,,375,45,Providing for consideration of H.J. Res 82; making further continuing appropriations for FY 2000,,,Budget General Interest,,Government Management,-0.237,0.972,-0.164,0.344,-0.044,0.888,-111.94,0.766
2017-01-23 13:12:32,RH1060598,106,House,598,1999-11-18,,316,101,Providing for consideration of H.J. Res 82; making further continuing appropriations for FY 2000,,,Budget General Interest,,Government Management,-0.352,0.42,-0.14,0.103,0.059,0.772,-165.409,0.673
2017-01-23 13:12:32,RH1060599,106,House,599,1999-11-18,,352,63,Providing for consideration of H.J. Res 82; making further continuing appropriations for FY 2000,,,Budget General Interest,,Government Management,-0.424,0.57,-0.149,0.172,0.063,0.858,-138.518,0.716
2017-01-23 13:12:32,RH1060600,106,House,600,1999-11-18,,294,123,Providing for consideration of H.J. Res 82; making further continuing appropriations for FY 2000,,,Budget General Interest,,Government Management,-0.329,0.093,-0.143,0.063,0.333,0.803,-164.279,0.674
2017-01-23 13:12:32,RH1060601,106,House,601,1999-11-18,,25,395,ADJOURN QUESTION: ON MOTION TO ADJOURN,,,Internal Organization,,Miscellaneous Policy,-0.446,0.895,0.134,-0.304,0.0,0.94,-85.596,0.816
2017-01-23 13:12:32,RH1060602,106,House,602,1999-11-18,,24,378,ADJOURN QUESTION: ON MOTION TO ADJOURN,,,Internal Organization,,Miscellaneous Policy,-0.496,0.764,0.144,-0.301,0.0,0.94,-81.251,0.817
2017-01-23 13:12:32,RH1060603,106,House,603,1999-11-18,,24,379,ADJOURN QUESTION: ON MOTION TO ADJOURN,,,Internal Organization,,Miscellaneous Policy,-0.452,0.892,0.131,-0.297,0.0,0.94,-86.046,0.808
2017-01-23 13:12:32,RH1060604,106,House,604,1999-11-18,,1,420,Making further continuing appropriations for F.Y. 2000,,,Budget General Interest,,Government Management,0.0,0.0,0.0,0.0,,,0.0,
2017-01-23 13:12:32,RH1060605,106,House,605,1999-11-18,,403,16,Making further continuing appropriations for F.Y. 2000,,,Budget General Interest,,Government Management,0.772,-0.486,0.188,-0.249,0.062,0.964,-62.462,0.862
2017-01-23 13:12:32,RH1060606,106,House,606,1999-11-18,,226,204,"Waiving points of order against the conference report on H.R. 3194, D.C. Appropriations, FY 2000",,,Budget Special Interest,D. C.,Government Management,-0.126,-0.711,-0.169,0.107,0.843,0.926,-113.387,0.768
2017-01-23 13:12:32,RH1060607,106,House,607,1999-11-18,,212,219,"District of Columbia Appropriations Act, 2000",Military Pensions/Veterans Benefits,,Budget Special Interest,Defense Policy Budget,Government Management,-0.08,-0.436,0.238,-0.283,0.972,0.986,-44.016,0.903
2017-01-23 13:12:32,RH1060608,106,House,608,1999-11-18,,296,135,"District of Columbia Appropriations Act, 2000",,,Budget Special Interest,D. C.,Government Management,0.916,-0.402,0.066,0.085,0.007,0.689,-257.973,0.55
2017-01-23 13:12:32,RH1060609,106,House,609,1999-11-18,,418,2,Ticket to Work and Work Incentives Improvement Act,Handicapped,Social Security,Domestic Social Policy,Budget Special Interest,Social Welfare,0.0,0.0,0.0,0.0,,,0.0,
2017-01-23 13:12:32,RH1060610,106,House,610,2000-01-31,,339,0,Authorizing the Use of the Rotunda for Holocaust Memorial,,,Government Organization,,Government Management,0.0,0.0,0.0,0.0,,,0.0,
2017-01-23 13:12:32,RH1060611,106,House,611,2000-01-31,,339,2,Hillory J. Farias and Samantha Reid Date-Rape Prevention Drug Act of 1999,Narcotics,,Domestic Social Policy,Regulation Special Interest,Civil Liberties,0.0,0.0,0.0,0.0,,,0.0,
2017-01-23 13:12:32,RH1060612,106,House,612,2000-02-01,,410,2,Child Abuse Prevention and Enforcement Act,"Children (aid, infant mortality, etc.)",,Domestic Social Policy,,Social Welfare,0.0,0.0,0.0,0.0,,,0.0,
2017-01-23 13:12:32,RH1060613,106,House,613,2000-02-01,,341,71,Taiwan Security Enhancement Act,,,Defense Policy Resolutions,,Foreign and Defense Policy,-0.523,-0.015,-0.145,-0.066,0.155,0.854,-151.103,0.693
2017-01-23 13:12:32,RH1060614,106,House,614,2000-02-01,,207,175,Bipartisan Consensus Managed Care Improvement Act of 1999,Public Health,,Domestic Social Policy,Regulation Special Interest,Social Welfare,0.042,0.999,0.338,0.062,0.96,0.982,-29.771,0.925
2017-01-23 13:12:32,RH1060615,106,House,615,2000-02-02,,222,195,Workplace Goods Job Growth and Competitiveness Act of 1999,,,Domestic Social Policy,Regulation Special Interest,Civil Liberties,-0.133,0.991,-0.202,-0.102,0.805,0.909,-106.208,0.775
2017-01-23 13:12:32,RH1060616,106,House,616,2000-02-08,,385,9,Abraham Lincoln Bicentennial Commission Act,,,Government Organization,,Government Management,0.0,0.0,0.0,0.0,,,0.0,
2017-01-23 13:12:32,RH1060617,106,House,617,2000-02-08,,378,16,Poison Control Center Enhancement and Awareness Act,Public Health,,Budget Special Interest,,Government Management,0.675,-0.0,0.293,-0.11,-0.125,0.954,-42.896,0.897
2017-01-23 13:12:32,RH1060618,106,House,618,2000-02-08,,390,0,Expressing the Condolences of the House on the Death of the Honorable Carl B. Albert,,,Government Organization,,Government Management,0.0,0.0,0.0,0.0,,,0.0,
2017-01-23 13:12:32,RH1060619,106,House,619,2000-02-10,,362,37,JOURNAL QUESTION: ON APPROVING THE JOURNAL,,,Internal Organization,,Miscellaneous Policy,-0.725,-0.085,-0.186,0.487,0.108,0.917,-104.278,0.77
2017-01-23 13:12:32,RH1060620,106,House,620,2000-02-10,,255,165,Providing for consideration of H.R. 6; Marriage Tax Penalty Relief Act of 2000,Tax rates,,Budget Special Interest,,Government Management,-0.153,0.284,-0.206,0.2,0.758,0.905,-99.524,0.789
2017-01-23 13:12:32,RH1060621,106,House,621,2000-02-10,,192,233,Rangel of New York Substitute Amendment,Tax rates,,Budget Special Interest,,Government Management,-0.143,-0.989,0.323,-0.091,0.917,0.962,-46.293,0.897
2017-01-23 13:12:32,RH1060622,106,House,622,2000-02-10,,196,230,Marriage Tax Penalty Relief Act of 2000,Tax rates,,Budget Special Interest,,Government Management,-0.084,0.09,0.278,-0.268,0.949,0.977,-38.696,0.913
2017-01-23 13:12:32,RH1060623,106,House,623,2000-02-10,,268,159,Marriage Tax Penalty Relief Act of 2000,Tax rates,,Budget Special Interest,,Government Management,-0.237,-0.031,-0.247,0.032,0.755,0.909,-89.026,0.812
2017-01-23 13:12:32,RH1060624,106,House,624,2000-02-14,,379,0,"Expressing the sense of Congress regarding the importance of organ, tissue, bone marrow, and blood donation and supporting National Donor Day.",,,Domestic Social Policy,,Social Welfare,0.0,0.0,0.0,0.0,,,0.0,
2017-01-23 13:12:32,RH1060625,106,House,625,2000-02-14,,378,0,"Recognizing the social problem of child abuse and neglect, and supporting efforts to enhance public awareness of it","Children (aid, infant mortality, etc.)",,Domestic Social Policy,,Social Welfare,0.0,0.0,0.0,0.0,,,0.0,
2017-01-23 13:12:32,RH1060626,106,House,626,2000-02-15,,413,1,"To award a Congressional gold medal to John Cardinal O’Connor, Archbishop of New York",,,Government Organization,,Government Management,0.0,0.0,0.0,0.0,,,0.0,
2017-01-23 13:12:32,RH1060627,106,House,627,2000-02-15,,410,1,To authorize the President to award a gold medal on behalf of the Congress to Charles M. Schulz in recognition of his lasting artistic contributions,,,Government Organization,,Government Management,0.0,0.0,0.0,0.0,,,0.0,
2017-01-23 13:12:32,RH1060628,106,House,628,2000-02-15,,413,1,Carter G. Woodson Home National Historic Site Study Act,Parks and Conservation,,Budget Special Interest,,Government Management,0.0,0.0,0.0,0.0,,,0.0,
2017-01-23 13:12:32,RH1060629,106,House,629,2000-02-15,,375,33,JOURNAL QUESTION: ON APPROVING THE JOURNAL,,,Internal Organization,,Miscellaneous Policy,-0.738,0.019,-0.172,0.404,0.03,0.922,-100.732,0.781
2017-01-23 13:12:32,RH1060630,106,House,630,2000-02-16,,354,46,JOURNAL QUESTION: ON APPROVING THE JOURNAL,,,Internal Organization,,Miscellaneous Policy,-0.666,0.0,-0.16,0.457,0.022,0.887,-122.549,0.736
2017-01-23 13:12:32,RH1060631,106,House,631,2000-02-16,,223,187,Providing for consideration of H.R. 2366; Small Business Liability Reform Act of 2000,,,Regulation Special Interest,,Government Management,-0.096,-0.002,-0.399,0.064,0.952,0.978,-23.183,0.945
2017-01-23 13:12:32,RH1060632,106,House,632,2000-02-16,,178,237,Conyers of Michigan Amendment,,,Regulation Special Interest,,Government Management,-0.229,0.652,0.317,0.306,0.893,0.954,-52.143,0.882
2017-01-23 13:12:32,RH1060633,106,House,633,2000-02-16,,221,194,Small Business Liability Reform Act of 2000,,,Regulation Special Interest,,Government Management,-0.196,0.981,-0.204,-0.166,0.83,0.92,-106.165,0.774
2017-01-23 13:12:32,RH1060634,106,House,634,2000-02-29,,406,2,Indian Tribal Economic Development and Contract Encouragement Act,,,Indian Affairs,,Government Management,0.0,0.0,0.0,0.0,,,0.0,
2017-01-23 13:12:32,RH1060635,106,House,635,2000-03-01,,423,0,Senior Citizens’ Freedom to Work Act,Social Security,,Domestic Social Policy,Budget Special Interest,Social Welfare,0.0,0.0,0.0,0.0,,,0.0,
2017-01-23 13:12:32,RH1060636,106,House,636,2000-03-01,,420,0,Iran Nonproliferation Act,,,Defense Policy Resolutions,Foreign Policy Resolutions,Foreign and Defense Policy,0.0,0.0,0.0,0.0,,,0.0,
2017-01-23 13:12:32,RH1060637,106,House,637,2000-03-08,,375,0,Government Waste Corrections Act,,,Government Organization,,Government Management,0.0,0.0,0.0,0.0,,,0.0,
2017-01-23 13:12:32,RH1060638,106,House,638,2000-03-08,,377,0,"To redesignate the Facility of the U.S. Postal Service in Greenville, South Carolina as the Keith D. Oglesby Station",,,Government Organization,,Government Management,0.0,0.0,0.0,0.0,,,0.0,
2017-01-23 13:12:32,RH1060639,106,House,639,2000-03-08,,375,0,"To designate the U.S. Postal Office in Charleston, South Carolina as the Marybelle H. Howe Post Office",,,Government Organization,,Government Management,0.0,0.0,0.0,0.0,,,0.0,
2017-01-23 13:12:32,RH1060640,106,House,640,2000-03-08,,384,0,"Whereas the United States had never recognized the forcible incorporation of the Baltic states of Estonia, Latvia, and Lithuania into the former Soviet Union",,,Foreign Policy Resolutions,,Foreign and Defense Policy,0.0,0.0,0.0,0.0,,,0.0,
2017-01-23 13:12:32,RH1060641,106,House,641,2000-03-08,,383,0,Recognizing the 50th Anniversary of the Korean War and the Service by Members of the Armed Forces,,,Defense Policy Resolutions,,Foreign and Defense Policy,0.0,0.0,0.0,0.0,,,0.0,
2017-01-23 13:12:32,RH1060642,106,House,642,2000-03-09,,406,0,"Providing for consideration of H.R. 1695; to provide for the conveyance of certain Federal public lands in the Ivanpah Valley, Nevada",,,Government Organization,,Government Management,0.0,0.0,0.0,0.0,,,0.0,
2017-01-23 13:12:32,RH1060643,106,House,643,2000-03-09,,369,45,JOURNAL QUESTION: ON APPROVING THE JOURNAL,,,Internal Organization,,Miscellaneous Policy,-0.727,-0.319,-0.197,0.355,0.111,0.903,-120.48,0.748
2017-01-23 13:12:32,RH1060644,106,House,644,2000-03-09,,417,3,Hansen of Utah Amendments (en bloc),,,Government Organization,,Government Management,0.0,0.0,0.0,0.0,,,0.0,
2017-01-23 13:12:32,RH1060645,106,House,645,2000-03-09,,420,1,Ivanpah Valley Airport Public Lands Transfer Act,,,Government Organization,,Government Management,0.0,0.0,0.0,0.0,,,0.0,
2017-01-23 13:12:32,RH1060646,106,House,646,2000-03-09,,216,208,Providing for the consideration of H.R. 3081 and H.R. 3846,Tax rates,Minimum Wage,Budget General Interest,Regulation General Interest,Government Management,-0.237,-0.629,-0.417,0.7,0.986,0.993,-16.213,0.962
2017-01-23 13:12:32,RH1060647,106,House,647,2000-03-09,,214,211,Providing for the consideration of H.R. 3081 and H.R. 3846,Tax rates,Minimum Wage,Budget General Interest,Regulation General Interest,Government Management,-0.339,-0.939,-0.462,0.814,0.976,0.988,-26.483,0.94
2017-01-23 13:12:32,RH1060648,106,House,648,2000-03-09,,207,218,Wage and Employment Growth Act,Tax rates,,Budget General Interest,,Government Management,-0.036,0.017,0.328,-0.233,0.971,0.986,-19.379,0.955
2017-01-23 13:12:32,RH1060649,106,House,649,2000-03-09,,257,170,Wage and Employment Growth Act,Tax rates,,Budget General Interest,,Government Management,-0.233,-0.15,-0.253,0.141,0.8,0.92,-82.807,0.824
2017-01-23 13:12:32,RH1060650,106,House,650,2000-03-09,,274,141,"To Amend the Fair Labor Standards Act of 1938 to Increase the Minimum Wage, and for other purposes",Minimum Wage,,Regulation General Interest,,Social Welfare,0.321,-0.095,0.273,0.248,0.695,0.896,-88.441,0.808
2017-01-23 13:12:32,RH1060651,106,House,651,2000-03-09,CQ,247,179,Traficant of Ohio Amendment,Minimum Wage,,Regulation General Interest,,Social Welfare,0.186,0.068,0.254,0.225,0.816,0.923,-77.581,0.834
2017-01-23 13:12:32,RH1060652,106,House,652,2000-03-09,,181,243,"To Amend the Fair Labor Standards Act of 1938 to Increase the Minimum Wage, and for other purposes",Minimum Wage,,Regulation General Interest,,Social Welfare,-0.189,0.104,0.334,-0.186,0.901,0.958,-56.433,0.875
2017-01-23 13:12:32,RH1060653,106,House,653,2000-03-09,,282,143,"To Amend the Fair Labor Standards Act of 1938 to Increase the Minimum Wage, and for other purposes",Minimum Wage,,Regulation General Interest,,Social Welfare,0.277,0.163,0.202,0.197,0.622,0.873,-117.371,0.759
2017-01-23 13:12:32,RH1060654,106,House,654,2000-03-14,,405,0,Designating the Joel T. Broyhill Post Office Building,,,Government Organization,,Government Management,0.0,0.0,0.0,0.0,,,0.0,
2017-01-23 13:12:32,RH1060655,106,House,655,2000-03-14,,400,0,Designating the Joseph L. Fisher Post Office Building,,,Government Organization,,Government Management,0.0,0.0,0.0,0.0,,,0.0,
2017-01-23 13:12:32,RH1060656,106,House,656,2000-03-15,,319,101,Wendell H. Ford Aviation Investment and Reform Act for the 21st Century,,,Budget Special Interest,,Government Management,0.698,0.681,0.124,-0.11,0.099,0.783,-211.481,0.604
2017-01-23 13:12:32,RH1060657,106,House,657,2000-03-15,,410,11,Small Business Authorization Act,,,Budget Special Interest,,Government Management,0.718,-0.055,0.37,-0.062,0.273,0.981,-25.075,0.942
2017-01-23 13:12:32,RH1060658,106,House,658,2000-03-15,,218,205,Juvenile Justice Reform Act,,,Domestic Social Policy,Regulation Special Interest,Civil Liberties,-0.109,0.253,0.183,0.657,0.756,0.882,-112.837,0.766
2017-01-23 13:12:32,RH1060659,106,House,659,2000-03-16,,276,145,Providing for consideration of H.R. 2372; Private Property Rights Implementation Act of 2000,,,Regulation General Interest,,Government Management,-0.174,-0.331,-0.24,-0.294,0.772,0.922,-83.259,0.821
2017-01-23 13:12:32,RH1060660,106,House,660,2000-03-16,,170,251,Watt of North Carolina Amendment,,,Regulation General Interest,,Government Management,-0.171,-0.362,0.272,0.084,0.824,0.929,-70.511,0.846
2017-01-23 13:12:32,RH1060661,106,House,661,2000-03-16,,179,234,Boehlert of New York Substitute Amendment,,,Regulation General Interest,,Government Management,0.138,-0.268,0.154,0.691,0.704,0.872,-127.788,0.734
2017-01-23 13:12:32,RH1060662,106,House,662,2000-03-16,,155,254,Private Property Rights Implementation Act of 2000,Pollution and Environmental Protection,,Regulation General Interest,,Government Management,-0.222,-0.034,0.315,0.154,0.839,0.939,-63.407,0.856
2017-01-23 13:12:32,RH1060663,106,House,663,2000-03-16,,226,183,Private Property Rights Implementation Act of 2000,,,Regulation General Interest,,Government Management,0.076,-0.184,-0.158,-0.625,0.727,0.878,-120.49,0.745
2017-01-23 13:12:32,RH1060664,106,House,664,2000-03-21,,392,0,Recognizing the importance of families and children in the United States and expressing support for the goals and ideas of National Family Day,,,Government Organization,,Government Management,0.0,0.0,0.0,0.0,,,0.0,
2017-01-23 13:12:32,RH1060665,106,House,665,2000-03-21,,392,2,Expressing the sense of the House of Representatives that the National Park Service should take full advantage of support services offered by the Department of Defense,,,Government Organization,,Government Management,0.0,0.0,0.0,0.0,,,0.0,
2017-01-23 13:12:32,RH1060666,106,House,666,2000-03-22,,352,49,JOURNAL QUESTION: ON APPROVING THE JOURNAL,,,Internal Organization,,Miscellaneous Policy,-0.677,-0.286,-0.183,0.289,0.122,0.893,-125.753,0.731
2017-01-23 13:12:32,RH1060667,106,House,667,2000-03-22,,219,195,Providing for consideration of S. 1287; Nuclear Waste Policy Amendments Act,Pollution and Environmental Protection,Nuclear Power,Regulation Special Interest,,Government Management,-0.116,-0.442,-0.278,0.209,0.969,0.986,-32.474,0.925
2017-01-23 13:12:32,RH1060668,106,House,668,2000-03-22,,220,191,Providing for consideration of S. 1287; Nuclear Waste Policy Amendments Act,Pollution and Environmental Protection,Nuclear Power,Regulation Special Interest,,Government Management,-0.032,0.124,-0.212,0.158,0.948,0.976,-53.969,0.877
2017-01-23 13:12:32,RH1060669,106,House,669,2000-03-22,,206,205,Nuclear Waste Policy Amendments Act of 2000,Pollution and Environmental Protection,Nuclear Power,Regulation Special Interest,,Government Management,-0.154,-0.988,-0.212,0.197,0.888,0.944,-86.546,0.81
2017-01-23 13:12:32,RH1060670,106,House,670,2000-03-22,,188,233,Nuclear Waste Policy Amendments Act of 2000,Pollution and Environmental Protection,Nuclear Power,Regulation Special Interest,,Government Management,-0.052,-0.674,0.216,0.014,0.899,0.955,-70.918,0.845
2017-01-23 13:12:32,RH1060671,106,House,671,2000-03-22,,253,167,Nuclear Waste Policy Amendments Act of 2000,Pollution and Environmental Protection,Nuclear Power,Regulation Special Interest,,Government Management,-0.137,-0.091,-0.122,-0.146,0.611,0.845,-161.13,0.681
2017-01-23 13:12:32,RH1060672,106,House,672,2000-03-22,,222,200,Providing for consideration of H.R. 3822; Oil Price Reduction Act of 2000,Tariffs,Energy,Regulation Special Interest,,Government Management,-0.053,-0.011,-0.396,0.177,0.985,0.993,-13.806,0.968
2017-01-23 13:12:32,RH1060673,106,House,673,2000-03-22,,382,39,Oil Price Reduction Act,Tariffs,Energy,Regulation Special Interest,,Government Management,-0.838,-0.546,-0.183,0.149,0.0,0.907,-122.934,0.747
2017-01-23 13:12:32,RH1060674,106,House,674,2000-03-23,,345,58,JOURNAL QUESTION: ON APPROVING THE JOURNAL,,,Internal Organization,,Miscellaneous Policy,-0.589,0.06,-0.135,0.309,0.069,0.866,-148.439,0.692
