date_generated,id,congress,chamber,rollnumber,date,keyvote,yea,nay,description,Issue1,Issue2,Peltzman1,Peltzman2,Clausen1,slope,intercept,mid.dim1,mid.dim2,spread.dim1,spread.dim2,pre,classified,log_likelihood,vote_result
2016-10-19 13:03:23,RH1120496,112,House,496,2011-07-06,,98,322,Welch of Vermont Amendment,,,Defense Policy Budget,,Foreign and Defense Policy,-0.9616244447173526,-0.48049851122846166,-0.43,-0.067,0.138,0.83,0.429,0.867,-136.284414,Failed
2016-10-19 13:03:23,RH1120497,112,House,497,2011-07-06,,212,208,Amash of Michigan Amendment No. 62,Union Regulation/Davis-Bacon/Situs Picketing,,Defense Policy Budget,,Foreign and Defense Policy,16.508886034677584,-2.993534901941167,0.229,0.787,-1.333,0.467,0.899,0.95,-59.339557,Agreed to
2016-10-19 13:03:23,RH1120498,112,House,498,2011-07-06,,217,204,Sessions of Texas Amendment,Union Regulation/Davis-Bacon/Situs Picketing,,Defense Policy Budget,,Foreign and Defense Policy,7.860964255799322,-1.0778507065078238,0.26,0.966,-1.298,0.955,0.897,0.95,-60.959622,Agreed to
2016-10-19 13:03:23,RH1120499,112,House,499,2011-07-06,,97,323,Lee of California Amendment #1,,,Defense Policy Budget,,Foreign and Defense Policy,-2.1276128673909986,-0.8915534031933403,-0.451,0.068,0.174,0.473,0.485,0.881,-122.632383,Failed
2016-10-19 13:03:23,RH1120500,112,House,500,2011-07-07,,133,295,Garamendi of California Amendment,,,Defense Policy Budget,,Foreign and Defense Policy,-1.3918878983078768,-0.4163769886111411,-0.348,0.068,0.161,0.669,0.586,0.871,-123.051107,Failed
2016-10-19 13:03:23,RH1120501,112,House,501,2011-07-07,,174,251,Nadler of New York Amendment,,,Defense Policy Budget,,Foreign and Defense Policy,-2.9782644804572747,-0.39291438673010626,-0.372,0.715,0.224,0.435,0.816,0.925,-89.318748,Failed
2016-10-19 13:03:23,RH1120502,112,House,502,2011-07-07,,131,297,Poe of Texas Amendment #1,,,Defense Policy Budget,,Foreign and Defense Policy,0.9804141127795895,-0.6135109224639324,0.944,0.312,-0.129,0.761,0.16,0.743,-231.705966,Failed
2016-10-19 13:03:23,RH1120503,112,House,503,2011-07-07,,114,314,Lee of California Amendment #2,,,Defense Policy Budget,,Foreign and Defense Policy,-2.0637233430684816,-0.7708129568185164,-0.358,-0.032,0.157,0.44,0.447,0.853,-126.952976,Failed
2016-10-19 13:03:23,RH1120504,112,House,504,2011-07-07,,210,217,Cohen of Tennessee Amendment #41,,,Defense Policy Budget,,Foreign and Defense Policy,-1.3701664201908466,-0.10123237799446905,-0.495,0.577,0.104,0.439,0.5,0.754,-219.468322,Failed
2016-10-19 13:03:23,RH1120505,112,House,505,2011-07-07,,145,283,Cicilline of Rhode Island Amendment,,,Defense Policy Budget,,Foreign and Defense Policy,-1.4545104422105917,-0.584794933627833,-0.664,0.381,0.127,0.505,0.228,0.738,-229.886152,Failed
2016-10-19 13:03:23,RH1120506,112,House,506,2011-07-07,,119,306,Cohen of Tennessee Amendment,,,Defense Policy Budget,,Foreign and Defense Policy,-1.2220228005080724,-0.5535494066987465,-0.588,0.165,0.146,0.691,0.345,0.816,-179.703509,Failed
2016-10-19 13:03:23,RH1120507,112,House,507,2011-07-07,,140,285,Poe of Texas Amendment #2,,,Defense Policy Budget,,Foreign and Defense Policy,0.887546671426322,-0.5952697112264165,0.958,0.255,-0.091,0.593,0.157,0.722,-241.552313,Failed
2016-10-19 13:03:23,RH1120508,112,House,508,2011-07-07,,226,201,McCollum of Minnesota Amendment #1,,,Defense Policy Budget,,Foreign and Defense Policy,-0.5558344945844136,0.12252821953072746,-0.098,0.177,0.037,0.385,0.358,0.698,-250.951772,Agreed to
2016-10-19 13:03:23,RH1120509,112,House,509,2011-07-07,,167,260,McCollum of Minnesota Amendment #2,,,Defense Policy Budget,,Foreign and Defense Policy,-1.6726331363070854,-0.2507338757657715,-0.123,-0.045,0.083,0.287,0.509,0.808,-193.871862,Failed
2016-10-19 13:03:23,RH1120510,112,House,510,2011-07-07,,225,202,Cole of Oklahoma Amendment #13,,,Defense Policy Budget,,Foreign and Defense Policy,1.550585322911378,-0.25977719550746037,0.559,0.607,-0.1,0.373,0.391,0.712,-233.249013,Agreed to
2016-10-19 13:03:23,RH1120511,112,House,511,2011-07-07,,199,230,Amash of Michigan Amendment,,,Defense Policy Budget,,Foreign and Defense Policy,0.9208657695647711,-0.27610283028657356,0.858,0.514,-0.114,0.716,0.271,0.662,-257.795386,Failed
2016-10-19 13:03:23,RH1120512,112,House,512,2011-07-07,,176,250,Rigell of Virginia Amendment No. 2,,,Defense Policy Budget,,Foreign and Defense Policy,1.5351751848256536,-0.5861125200881381,0.785,0.619,-0.129,0.486,0.278,0.702,-240.727339,Failed
2016-10-19 13:03:23,RH1120513,112,House,513,2011-07-07,,248,175,Foxx of North Carolina Amendment No. 61,Homosexuality,,Defense Policy Budget,Regulation Special Interest,Foreign and Defense Policy,-2.055525059076177,-0.062215512996758926,-0.22,0.39,-0.51,-1.435,0.937,0.974,-34.285755,Agreed to
2016-10-19 13:03:23,RH1120514,112,House,514,2011-07-07,,135,290,Mulvaney of South Carolina Amendment,,,Defense Policy Budget,,Foreign and Defense Policy,-1.1430474597570726,-0.6094579510801506,-0.905,0.425,0.167,0.845,0.059,0.701,-244.513371,Failed
2016-10-19 13:03:23,RH1120515,112,House,515,2011-07-07,,316,111,Sherman of California Amendment No. 8,,,Defense Policy Budget,,Foreign and Defense Policy,0.16643692818588315,0.45824362905772914,0.335,0.514,-0.012,0.417,0.036,0.749,-230.507472,Agreed to
2016-10-19 13:03:23,RH1120516,112,House,516,2011-07-07,,89,338,Rohrabacher of California Amendment,,,Defense Policy Budget,,Foreign and Defense Policy,1.321145921069415,-0.9926796384315927,0.628,-0.163,-0.09,0.394,0.124,0.817,-188.680225,Failed
2016-10-19 13:03:23,RH1120517,112,House,517,2011-07-07,,162,266,Gohmert of Texas Amendment,,,Defense Policy Budget,,Foreign and Defense Policy,1.5847563015731954,-0.6272098817690883,0.616,0.349,-0.117,0.427,0.358,0.757,-222.283418,Failed
2016-10-19 13:03:23,RH1120518,112,House,518,2011-07-07,,169,257,Welch of Vermont Amendment,,,Defense Policy Budget,,Foreign and Defense Policy,-2.417968419406362,-0.4634763991867429,-0.494,0.731,0.199,0.476,0.621,0.85,-143.587244,Failed
2016-10-19 13:03:23,RH1120519,112,House,519,2011-07-07,,256,171,Cole of Oklahoma Amendment No. 4,"Campaign Contributions, Lobbying/House Ethics Campaign Laws",,Defense Policy Budget,,Foreign and Defense Policy,-3.797099345116105,-0.23921740392930338,0.006,-0.262,-1.143,-1.741,0.901,0.96,-47.845186,Agreed to
2016-10-19 13:03:23,RH1120520,112,House,520,2011-07-07,,181,244,Frank of Massachusetts Amendment No. 97,,,Defense Policy Budget,,Foreign and Defense Policy,-1.2214707472775765,-0.26398894344729273,-0.754,0.657,0.317,1.501,0.508,0.791,-182.29841,Failed
2016-10-19 13:03:23,RH1120521,112,House,521,2011-07-07,,407,6,"Reaffirming the United States commitment to a negotiated settlement of the Israeli-Palestinian conflict through direct Israeli-Palestinian negotiations, and for other purposes",,,Foreign Policy Resolutions,,Foreign and Defense Policy,,,0.0,0.0,0.0,0.0,-28.167,0.576,0.0,Passed
2016-10-19 13:03:23,RH1120522,112,House,522,2011-07-08,,39,380,Flake of Arizona Amendment #1,,,Defense Policy Budget,,Foreign and Defense Policy,3.3326184442910334,-2.238195554787791,0.659,-0.042,-0.964,1.673,0.231,0.928,-66.034285,Failed
2016-10-19 13:03:23,RH1120523,112,House,523,2011-07-08,,118,295,Flake of Arizona Amendment #2,,,Defense Policy Budget,,Foreign and Defense Policy,-0.5049713298309764,-0.4248080386505279,-0.766,-0.038,0.086,0.985,0.119,0.748,-221.869,Failed
2016-10-19 13:03:23,RH1120524,112,House,524,2011-07-08,,100,321,Flake of Arizona Amendment #3,,,Defense Policy Budget,,Foreign and Defense Policy,1.6420807002171558,-0.9702631600861025,0.857,0.437,-0.203,0.715,0.26,0.824,-177.889892,Failed
2016-10-19 13:03:23,RH1120525,112,House,525,2011-07-08,,236,184,Huelskamp of Kansas Amendment No. 77,Homosexuality,,Defense Policy Budget,,Foreign and Defense Policy,-2.864737127479189,0.12875783195457846,-0.22,0.759,-0.687,-1.387,0.918,0.964,-35.123648,Agreed to
2016-10-19 13:03:23,RH1120526,112,House,526,2011-07-08,,113,307,Polis of Colorado Amendment,,,Defense Policy Budget,,Foreign and Defense Policy,-1.1628976983001003,-0.5349693581089584,-0.583,0.143,0.151,0.751,0.398,0.838,-167.15262,Failed
2016-10-19 13:03:23,RH1120527,112,House,527,2011-07-08,,169,252,Kucinich of Ohio Amendment,,,Defense Policy Budget,,Foreign and Defense Policy,1.2280423348509768,-0.5091518576187773,0.847,0.531,-0.124,0.584,0.278,0.71,-240.119171,Failed
2016-10-19 13:03:23,RH1120528,112,House,528,2011-07-08,,188,234,"Making appropriations for the Department of Defense for the fiscal year ending September 30, 2012, and for other purposes",,,Defense Policy Budget,,Foreign and Defense Policy,-13.043202925574047,0.41205586834916796,-0.045,0.999,0.327,0.145,0.979,0.991,-21.257958,Failed
2016-10-19 13:03:23,RH1120529,112,House,529,2011-07-08,,336,87,"Making appropriations for the Department of Defense for the fiscal year ending September 30, 2012, and for other purposes",,,Defense Policy Budget,,Foreign and Defense Policy,-1.0729910110083123,-0.577378766184915,-0.471,-0.072,-0.164,-0.884,0.471,0.891,-118.468657,Passed
2016-10-19 13:03:23,RH1120530,112,House,530,2011-07-08,,269,146,Providing for consideration of the bill (H.R. 1309) to extend the authorization of the national flood insurance program,Public Safety,,Budget Special Interest,Regulation Special Interest,Government Management,52.74719128067008,12.250129273028088,-0.221,0.593,-0.228,0.025,0.774,0.92,-85.858686,Passed
2016-10-19 13:03:23,RH1120531,112,House,531,2011-07-11,,162,246,Tierney of Massachusetts Amendment,Public Works,Energy,Budget Special Interest,,Government Management,-2.7260672664331116,-0.3404637763313348,-0.294,0.461,0.148,0.314,0.698,0.88,-129.815887,Failed
2016-10-19 13:03:23,RH1120532,112,House,532,2011-07-11,,216,190,Graves of Missouri Amendment,Public Works,Energy,Budget Special Interest,,Government Management,-28.918416272297197,2.8322915364033663,0.119,-0.609,-0.15,-0.03,0.8,0.906,-115.465925,Agreed to
2016-10-19 13:03:23,RH1120533,112,House,533,2011-07-11,,241,168,Scalise of Louisiana Amendment,Public Works,Energy,Budget Special Interest,,Government Management,-3.895133620350234,-0.4254982844617145,-0.062,-0.184,-0.066,-0.098,0.387,0.748,-222.348108,Agreed to
2016-10-19 13:03:23,RH1120534,112,House,534,2011-07-11,,218,191,Woodall of Georgia Amendment,Public Works,Energy,Budget Special Interest,,Government Management,-36.148020340371495,4.948058481525322,0.122,0.538,-0.225,-0.036,0.906,0.956,-57.591336,Agreed to
2016-10-19 13:03:23,RH1120535,112,House,535,2011-07-11,,96,313,McClintock of California Amendment,Public Works,Energy,Budget Special Interest,,Government Management,25.964160796997767,-13.05986536328087,0.506,0.078,-1.248,0.278,0.562,0.897,-96.222787,Failed
2016-10-19 13:03:23,RH1120536,112,House,536,2011-07-12,,224,196,Sessions of Texas Amendment,Public Works,Union Regulation/Davis-Bacon/Situs Picketing,Budget Special Interest,,Government Management,-20.296872434316327,2.7533589311367246,0.173,-0.758,-1.316,-0.375,0.908,0.957,-46.548129,Agreed to
2016-10-19 13:03:23,RH1120537,112,House,537,2011-07-12,,170,250,Moran of Virginia Amendment,Public Works,Pollution and Environmental Protection,Budget Special Interest,,Government Management,-2.0872751967604017,-0.09935310510434145,-0.153,0.22,0.227,0.629,0.918,0.967,-55.514408,Failed
2016-10-19 13:03:23,RH1120538,112,House,538,2011-07-12,,154,266,Markey of Massachusetts Amendment,Pollution and Environmental Protection,Energy,Budget Special Interest,,Government Management,-1.3390239441258236,-0.12314882108455005,0.091,-0.245,0.238,1.028,0.838,0.94,-63.914043,Failed
2016-10-19 13:03:23,RH1120539,112,House,539,2011-07-12,,164,259,Lamborn of Colorado Amendment No. 5,Pollution and Environmental Protection,Energy,Budget Special Interest,,Government Management,-32.319308672859485,10.983077344173678,0.351,-0.361,-1.492,-0.267,0.671,0.872,-120.884048,Failed
2016-10-19 13:03:23,RH1120540,112,House,540,2011-07-12,,173,249,Connolly of Virginia Amendment,Pollution and Environmental Protection,Energy,Budget Special Interest,,Government Management,-1.9736291397516699,-0.04392088741925501,-0.003,-0.038,0.187,0.548,0.838,0.934,-70.743427,Failed
2016-10-19 13:03:23,RH1120541,112,House,541,2011-07-12,,179,244,Miller of North Carolina Amendment,Pollution and Environmental Protection,Energy,Budget Special Interest,,Government Management,-1.7779064273670382,-0.0028918478294418792,-0.023,0.038,0.162,0.527,0.793,0.913,-91.267219,Failed
2016-10-19 13:03:23,RH1120542,112,House,542,2011-07-12,,131,292,Broun of Georgia Amendment,Pollution and Environmental Protection,Energy,Budget Special Interest,,Government Management,-26.934232966022787,11.844799436914117,0.444,-0.114,-1.276,-0.274,0.695,0.905,-105.937631,Failed
2016-10-19 13:03:23,RH1120543,112,House,543,2011-07-12,,123,300,Welch of Vermont Amendment,Pollution and Environmental Protection,Energy,Budget Special Interest,,Government Management,-4.131202324613885,-1.3067189974257687,-0.257,-0.245,0.18,0.252,0.602,0.884,-106.326457,Failed
2016-10-19 13:03:23,RH1120544,112,House,544,2011-07-12,,127,296,Pompeo of Kansas Amendment,Pollution and Environmental Protection,Energy,Budget Special Interest,,Government Management,-11.504107473323227,5.231557844134937,0.501,-0.532,-1.273,-0.64,0.654,0.896,-113.337226,Failed
2016-10-19 13:03:23,RH1120545,112,House,545,2011-07-12,,149,273,Tonko of New York Amendment,Pollution and Environmental Protection,Energy,Budget Special Interest,,Government Management,-75.18788230797271,-15.496146225446024,-0.219,0.97,0.169,0.013,0.604,0.86,-138.686341,Failed
2016-10-19 13:03:23,RH1120546,112,House,546,2011-07-12,,149,274,Garrett of New Jersey Amendment,Science and Technology,Energy,Budget Special Interest,,Government Management,-51.07167576816608,19.680953549584775,0.39,-0.237,-1.457,-0.165,0.577,0.851,-133.734057,Failed
2016-10-19 13:03:23,RH1120547,112,House,547,2011-07-12,,196,228,Wu of Oregon Amendment,Pollution and Environmental Protection,Energy,Budget Special Interest,,Government Management,-2.4708773397215964,0.23220913938854043,0.113,-0.047,0.135,0.316,0.786,0.901,-121.507375,Failed
2016-10-19 13:03:23,RH1120548,112,House,548,2011-07-12,,119,305,McClintock of California Amendment,Pollution and Environmental Protection,Energy,Budget Special Interest,,Government Management,-7.301540426960609,3.4687026901989166,0.586,-0.81,-1.015,-0.804,0.538,0.87,-125.590416,Failed
2016-10-19 13:03:23,RH1120549,112,House,549,2011-07-12,,167,257,Schiff of California Amendment,Nuclear Weapons,Energy,Budget Special Interest,,Government Management,-3.5842544112143004,-0.825685088224286,-0.02,-0.754,0.044,0.071,0.204,0.686,-260.934453,Failed
2016-10-19 13:03:23,RH1120550,112,House,550,2011-07-12,,145,276,Garamendi of California Amendment,Science and Technology,Energy,Budget Special Interest,,Government Management,-1.7249581636107099,-0.3136961510521853,-0.092,-0.155,0.187,0.627,0.793,0.929,-75.756717,Failed
2016-10-19 13:03:23,RH1120551,112,House,551,2011-07-12,,195,230,Speier of California Amendment No. 3,Public Safety,,Budget Special Interest,Regulation Special Interest,Government Management,-4.5112729384783625,-0.017480046465239818,-0.22,0.975,0.195,0.25,0.831,0.922,-104.134525,Failed
2016-10-19 13:03:23,RH1120552,112,House,552,2011-07-12,,118,305,Flake of Arizona Amendment No. 4,Public Safety,,Budget Special Interest,Regulation Special Interest,Government Management,3.6126819155421126,-1.64900332802792,0.568,0.403,-0.213,0.341,0.424,0.839,-138.765608,Failed
2016-10-19 13:03:23,RH1120553,112,House,553,2011-07-12,,261,163,Cardoza of California Amendment No. 11,Public Safety,,Budget Special Interest,Regulation Special Interest,Government Management,-5.205314929013495,1.8604929080742671,0.168,0.986,0.072,0.08,0.184,0.686,-242.733816,Agreed to
2016-10-19 13:03:23,RH1120554,112,House,554,2011-07-12,,241,183,Westmoreland of Georgia Amendment No. 19,Public Safety,,Budget Special Interest,Regulation Special Interest,Government Management,-2.9810636012095837,-0.05684929952900686,-0.272,0.754,-0.284,-0.551,0.885,0.95,-57.228547,Agreed to
2016-10-19 13:03:23,RH1120555,112,House,555,2011-07-12,,186,238,Miller of Michigan Amendment No. 20,Public Safety,,Budget Special Interest,Regulation Special Interest,Government Management,33.25617871314177,-8.949143537695711,0.266,-0.103,-0.161,0.028,0.677,0.858,-133.564354,Failed
2016-10-19 13:03:23,RH1120556,112,House,556,2011-07-12,,192,230,Scott of Virginia Amendment No. 23,Public Safety,,Budget Special Interest,Regulation Special Interest,Government Management,-7.303125465376749,0.39054688198065124,0.015,0.281,0.149,0.118,0.818,0.917,-107.794133,Failed
2016-10-19 13:03:23,RH1120557,112,House,557,2011-07-12,,38,384,Miller of Michigan Substitute Amendment No. 25,Public Safety,,Budget Special Interest,Regulation Special Interest,Government Management,7.043815360179652,-4.9803640446044986,0.693,-0.099,-0.218,0.179,0.184,0.927,-83.473558,Failed
2016-10-19 13:03:23,RH1120558,112,House,558,2011-07-12,,181,244,"To extend the authorization of the national flood insurance program, to achieve reforms to improve the financial integrity and stability of the program, and to increase the role of private markets in the management of flood insurance risk, and for other urposes",Public Safety,,Budget Special Interest,Regulation Special Interest,Government Management,6.57814523996211,0.19771789992159133,0.042,0.474,0.207,-0.182,0.934,0.972,-55.072396,Failed
2016-10-19 13:03:23,RH1120559,112,House,559,2011-07-12,,406,22,"To extend the authorization of the national flood insurance program, to achieve reforms to improve the financial integrity and stability of the program, and to increase the role of private markets in the management of flood insurance risk, and for other urposes",Public Safety,,Budget Special Interest,Regulation Special Interest,Government Management,2.617522787126848,-2.1088901438201333,0.884,0.205,0.854,-1.887,0.273,0.963,-51.781215,Passed
2016-10-19 13:03:23,RH1120560,112,House,560,2011-07-12,,233,193,Better Use of Light Bulbs Act,Energy,Pollution and Environmental Protection,Regulation General Interest,,Government Management,-3.4181454850229955,0.19649712206106773,-0.171,0.781,-0.302,-0.511,0.927,0.967,-49.208229,Failed
2016-10-19 13:03:23,RH1120561,112,House,561,2011-07-13,,250,171,"Providing for consideration of the bill (H.R. 2018), to amend the Federal Water Pollution Control Act to preserve the authority of each State to make determinations relating to the State’s water quality standards, and for other purposes",Pollution and Environmental Protection,,Regulation General Interest,,Government Management,-3.7291808446663848,-0.21374948959201012,0.036,-0.348,-0.648,-1.005,0.936,0.974,-16.952004,Passed
2016-10-19 13:03:23,RH1120562,112,House,562,2011-07-13,,170,252,Jackson Lee of Texas Amendment No. 2,Pollution and Environmental Protection,,Regulation General Interest,,Government Management,-2.8641685016102962,-0.20212177309339718,-0.058,-0.036,0.621,1.254,0.959,0.983,-14.478482,Failed
2016-10-19 13:03:23,RH1120563,112,House,563,2011-07-13,,268,152,Capito of West Virginia Amendment No. 3,Pollution and Environmental Protection,,Regulation General Interest,,Government Management,-3.0445857843949686,-0.5958152328646668,-0.265,0.211,-0.887,-1.685,0.901,0.964,-52.200257,Agreed to
2016-10-19 13:03:23,RH1120564,112,House,564,2011-07-13,,191,231,Polis of Colorado Amendment No. 5,Pollution and Environmental Protection,,Regulation General Interest,,Government Management,-1.8549642016769583,0.24113040604942487,0.268,-0.256,0.39,1.216,0.906,0.957,-43.218849,Failed
2016-10-19 13:03:23,RH1120565,112,House,565,2011-07-13,,181,240,Connolly of Virginia Amendment No. 6,Pollution and Environmental Protection,,Regulation General Interest,,Government Management,-1.8574081597819347,0.10270181649024906,-0.047,0.19,0.325,1.012,0.895,0.955,-44.621556,Failed
2016-10-19 13:03:23,RH1120566,112,House,566,2011-07-13,,183,237,Blumenauer of Oregon Amendment No. 9,Pollution and Environmental Protection,,Regulation General Interest,,Government Management,-1.9816057623459133,0.131356201682107,0.035,0.062,0.578,1.687,0.934,0.971,-29.611933,Failed
2016-10-19 13:03:23,RH1120567,112,House,567,2011-07-13,,173,247,Carnahan of Missouri Amendment No. 10,Pollution and Environmental Protection,,Regulation General Interest,,Government Management,-2.631438826673489,-0.09597337706796288,-0.19,0.404,0.384,0.844,0.942,0.976,-25.814958,Failed
2016-10-19 13:03:23,RH1120568,112,House,568,2011-07-13,,167,254,Jackson Lee of Texas Amendment No. 1,Pollution and Environmental Protection,,Regulation General Interest,,Government Management,-2.9788276553047695,-0.29775573146230555,-0.106,0.018,0.839,1.629,0.934,0.974,-25.751752,Failed
2016-10-19 13:03:23,RH1120569,112,House,569,2011-07-13,,188,238,"To amend the Federal Water Pollution Control Act to preserve the authority of each State to make determinations relating to the State’s water quality standards, and for other purposes",Pollution and Environmental Protection,,Regulation General Interest,,Government Management,33.879909260191326,-0.7094780944640179,0.021,0.002,1.195,-0.204,0.989,0.995,-9.7487,Failed
2016-10-19 13:03:23,RH1120570,112,House,570,2011-07-13,,239,185,"To amend the Federal Water Pollution Control Act to preserve the authority of each State to make determinations relating to the State’s water quality standards, and for other purposes",Pollution and Environmental Protection,,Regulation General Interest,,Government Management,-1.700456182647522,0.09266852339732097,-0.069,0.21,-0.319,-1.085,0.886,0.95,-48.320523,Passed
2016-10-19 13:03:23,RH1120571,112,House,571,2011-07-14,,168,257,Matheson of Utah Amendment,Pollution and Environmental Protection,Energy,Budget Special Interest,,Government Management,-36.32876044207335,-4.621629108079296,-0.154,0.973,0.201,0.032,0.804,0.922,-95.130214,Failed
2016-10-19 13:03:23,RH1120572,112,House,572,2011-07-14,,261,162,Reed of New York Amendment,Pollution and Environmental Protection,Energy,Budget Special Interest,,Government Management,-1.394280784557186,0.5084237395642637,-0.179,0.758,0.054,0.224,0.222,0.702,-236.737506,Agreed to
2016-10-19 13:03:23,RH1120573,112,House,573,2011-07-14,,164,261,Holt of New Jersey Amendment No. 65,Science and Technology,Energy,Budget Special Interest,,Government Management,-5.099898042109554,-0.7093812397481579,-0.184,0.229,0.179,0.203,0.835,0.936,-88.861444,Failed
2016-10-19 13:03:23,RH1120574,112,House,574,2011-07-14,,136,291,Royce of California Amendment No. 68,Science and Technology,Energy,Budget Special Interest,,Government Management,22.646596067972894,-9.261638427189157,0.4,-0.203,-1.531,0.391,0.61,0.876,-134.825256,Failed
2016-10-19 13:03:23,RH1120575,112,House,575,2011-07-14,,99,328,Broun of Georgia Amendment No. 43,Science and Technology,Energy,Budget Special Interest,,Government Management,-39.09176681732072,20.226003480449265,0.534,-0.649,-1.318,-0.195,0.505,0.885,-117.457162,Failed
2016-10-19 13:03:23,RH1120576,112,House,576,2011-07-14,,215,213,Schiff of California Amendment,Science and Technology,Energy,Budget Special Interest,,Government Management,-8.675524881689158,1.1448881220422291,0.025,0.928,0.159,0.106,0.803,0.902,-124.764164,Agreed to
2016-10-19 13:03:23,RH1120577,112,House,577,2011-07-14,,114,309,Broun of Georgia Amendment No. 48,Science and Technology,Energy,Budget Special Interest,,Government Management,168.67108919637832,-80.68045172506521,0.479,0.113,-1.429,0.049,0.553,0.879,-135.822937,Failed
2016-10-19 13:03:23,RH1120578,112,House,578,2011-07-14,,297,130,Shimkus of Illinois Amendment,Nuclear Power,Energy,Budget Special Interest,,Government Management,-5.973935993092973,-1.774363245976241,-0.293,-0.024,-0.157,-0.152,0.615,0.883,-125.80989,Agreed to
2016-10-19 13:03:23,RH1120579,112,House,579,2011-07-14,,187,239,Broun of Georgia Amendment No. 47,Public Works,Energy,Budget Special Interest,,Government Management,3.1455119454077654,-0.5963281911265242,0.016,-0.546,-0.155,0.285,0.69,0.864,-131.084023,Failed
2016-10-19 13:03:23,RH1120580,112,House,580,2011-07-15,,249,170,Cole of Oklahoma Amendment No. 26,"Campaign Contributions, Lobbying/House Ethics Campaign Laws",Energy,Budget Special Interest,,Government Management,-3.8083329737055993,-0.2435083286581728,-0.013,-0.194,-0.214,-0.325,0.906,0.962,-50.411538,Agreed to
2016-10-19 13:03:23,RH1120581,112,House,581,2011-07-15,,158,264,Cohen of Tennessee Amendment,Science and Technology,Energy,Budget Special Interest,,Government Management,-1.7340666130964566,-0.08294048075563193,0.263,-0.539,0.167,0.557,0.791,0.922,-95.539835,Failed
2016-10-19 13:03:23,RH1120582,112,House,582,2011-07-15,,183,238,Gosar of Arizona Amendment,Union Regulation/Davis-Bacon/Situs Picketing,Energy,Budget Special Interest,,Government Management,-8.39103019187521,2.293782770316283,0.158,0.968,-1.342,-0.925,0.754,0.893,-94.099429,Failed
2016-10-19 13:03:23,RH1120583,112,House,583,2011-07-15,,212,210,Kaptur of Ohio Amendment,Science and Technology,Energy,Budget Special Interest,,Government Management,-2.1846914877679793,0.4164375424113501,0.089,0.222,0.19,0.503,0.843,0.922,-88.749966,Agreed to
2016-10-19 13:03:23,RH1120584,112,House,584,2011-07-15,,81,342,Flake of Arizona Amendment No. 1,Science and Technology,Energy,Budget Special Interest,,Government Management,11.631629656190649,-6.305553495718188,0.536,-0.071,-1.267,0.63,0.37,0.879,-97.447785,Failed
2016-10-19 13:03:23,RH1120585,112,House,585,2011-07-15,,152,269,Capps of California Amendment,Nuclear Power,Energy,Budget Special Interest,,Government Management,-14.772781324643386,-3.014600043864732,-0.169,-0.518,0.212,0.083,0.77,0.917,-79.272619,Failed
2016-10-19 13:03:23,RH1120586,112,House,586,2011-07-15,,68,353,Flake of Arizona Amendment No. 2,Science and Technology,Energy,Budget Special Interest,,Government Management,2.0200646692202295,-1.3498976849444448,0.892,0.452,-0.263,0.753,0.265,0.881,-132.206694,Failed
