date_generated,id,congress,chamber,rollnumber,date,keyvote,yea,nay,description,Issue1,Issue2,Peltzman1,Peltzman2,Clausen1,slope,intercept,mid.dim1,mid.dim2,spread.dim1,spread.dim2,pre,classified,log_likelihood,vote_result
2016-10-19 13:03:23,RS0450298,45,Senate,298,1878-06-10,,33,25,TO ADJOURN IN ORDER TO TERMINATE DEBATE ON H.R. 4236.,,,Internal Organization,,Miscellaneous Policy,-0.5289954196151926,0.3566844701514743,0.334,0.18,0.015,0.164,0.16,0.638,-38.377252,
2016-10-19 13:03:23,RS0450299,45,Senate,299,1878-06-11,,12,34,"TO POSTPONE CONSIDERATION OF H.R. 933, A BILL REGARDING THE CONVENTION BETWEEN U.S. AND CHINA AT SHANGHAI, NOV. 8, 1858.",,,Foreign Policy Resolutions,,Foreign and Defense Policy,-3.855788836306293,-1.820417755151078,-0.219,-0.976,0.098,0.147,-0.083,0.717,-20.822827,
2016-10-19 13:03:23,RS0450300,45,Senate,300,1878-06-11,,43,10,"TO AMEND H.R. 4236, BY PERMITTING THE LETTING OF CONTRACTS, EXCEPT WHEN SPECIFIC ESTIMATES CANNOT BE MADE.",Public Works,,Budget Special Interest,,Government Management,-1.9372531289208805,1.5277160566420298,0.897,-0.21,0.138,0.412,0.0,0.811,-23.392377,
2016-10-19 13:03:23,RS0450301,45,Senate,301,1878-06-11,,33,19,"TO AMEND H.R. 4236, BY PROVIDING UP TO $5,000 FOR EXPENSES OF A COMMITTEE TO BE APPOINTED TO EXAMINE REPORTS ON IMPROVEMENTS TO MISSISSIPPI RIVER.",Public Works,,Budget Special Interest,,Government Management,0.0,0.359,0.07,0.359,-0.0,0.336,0.053,0.654,-28.922815,
2016-10-19 13:03:23,RS0450302,45,Senate,302,1878-06-11,,30,21,"TO AMEND H.R. 4236, BY APPROPRIATING $250,000 INSTEAD OF $75,000 FOR THE CANAL AROUND COLUMBIA RIVER CASCADES.",Public Works,,Budget Special Interest,,Government Management,-0.6957814441454965,-0.16372254038226325,-0.208,-0.019,-0.048,-0.399,0.238,0.686,-26.255185,
2016-10-19 13:03:23,RS0450303,45,Senate,303,1878-06-11,,20,22,"TO AMEND H.R. 4236, BY APPROPRIATING $15,000 TO IMPROVE THE HARBOR AT TWO RIVERS, WISCONSIN.",Public Works,,Budget Special Interest,,Government Management,-1.7092078871387597,-0.05286087880564727,-0.365,0.571,-0.099,-0.335,0.6,0.81,-18.687553,
2016-10-19 13:03:23,RS0450304,45,Senate,304,1878-06-11,,21,38,"TO AMEND H.R. 4236, BY PROVIDING THE EXPENDING OF NOT MORE THAN 75% OF APPROPRIATIONS FOR THIS YEAR.",Public Works,,Budget Special Interest,,Government Management,-0.30567449745404546,-0.21385491644342886,-0.415,-0.087,0.038,0.719,0.429,0.797,-25.613034,
2016-10-19 13:03:23,RS0450305,45,Senate,305,1878-06-11,,37,26,TO PASS H.R. 4236.,Public Works,,Budget Special Interest,,Government Management,-0.3749735705248753,-0.1684908025426566,-0.348,-0.038,-0.033,-0.509,0.385,0.746,-32.169571,
2016-10-19 13:03:23,RS0450306,45,Senate,306,1878-06-12,,31,13,TO CONSENT TO THE NOMINATION OF JOHN C. FREMONT AS GOVERNOR OF THE TERRITORY OF ARIZONA.,,,Government Organization,,Government Management,-2.7127009954544268,-0.8606522492318243,0.051,-0.999,-0.159,-0.339,0.154,0.75,-14.77528,
2016-10-19 13:03:23,RS0450307,45,Senate,307,1878-06-12,,24,23,"TO SUSPEND THE CALENDAR AND BRING UP FOR CONSIDERATION H.J.R. 176, A RESOLUTION PROVIDING FOR THE ENFORCEMENT OF THE 8 HOUR LAW.",Workplace conditions/8 hour day,,Domestic Social Policy,,Civil Liberties,-5.314735963557322,-0.8437512837552603,-0.336,0.942,-0.102,-0.111,0.522,0.766,-23.721566,
2016-10-19 13:03:23,RS0450308,45,Senate,308,1878-06-12,,31,25,TO POSTPONE CONSIDERATION OF H.J.R. 176.,Workplace conditions/8 hour day,,Domestic Social Policy,,Civil Liberties,-3.1796552488971326,-0.017794850913625426,-0.305,0.952,0.116,0.211,0.56,0.804,-24.405245,
2016-10-19 13:03:23,RS0450309,45,Senate,309,1878-06-13,,31,30,"TO POSTPONE THE CALENDAR IN ORDER TO CONSIDER H.R. 805, A BILL RESUMING SPECIE PAYMENTS.",,,Internal Organization,,Miscellaneous Policy,1.3370230117526527,0.18715234479405785,-0.493,-0.472,0.221,-0.956,0.633,0.82,-17.549688,
2016-10-19 13:03:23,RS0450310,45,Senate,310,1878-06-13,,32,32,"TO AMEND H.R. 805, BY MAKING U.S. NOTES LEGAL TENDER FOR PAYMENT ON 4% BONDS AND DUTIES ON IMPORTS AFTER JULY 1, 1878.",U.S. Currency,,Budget Special Interest,,Government Management,1.2970273659886158,0.2345629121809646,-0.618,-0.567,0.196,-0.874,0.562,0.781,-24.208928,
2016-10-19 13:03:23,RS0450311,45,Senate,311,1878-06-13,,31,33,"TO AMEND H.R 805, BY MAKING U.S. NOTES LEGAL TENDER FOR PAYMENT ON 4% BONDS, AND DUTIES ON IMPORTS AFTER JULY 1, 1878.",U.S. Currency,,Budget Special Interest,,Government Management,1.5313615889648287,0.30573179572918907,-0.677,-0.731,0.233,-0.88,0.613,0.813,-25.65948,
2016-10-19 13:03:23,RS0450312,45,Senate,312,1878-06-13,,31,31,"TO AMEND H.R. 805, BY MAKING U.S. NOTES LEGAL TENDER FOR DUTIES ON IMPORTS AND FOR PAYMENT OF 4% BONDS.",U.S. Currency,,Budget Special Interest,,Government Management,1.2470645711829793,0.2173204461661109,-0.487,-0.39,-0.185,0.858,0.581,0.79,-22.075296,
2016-10-19 13:03:23,RS0450313,45,Senate,313,1878-06-13,,47,15,TO PASS H.R. 805.,U.S. Currency,,Budget Special Interest,,Government Management,0.3855788836306293,-0.3504769768790187,-0.463,-0.529,0.047,-0.705,0.667,0.919,-21.927037,
2016-10-19 13:03:23,RS0450314,45,Senate,314,1878-06-14,,24,35,"TO RECEDE FROM THE AMENDMENT TO H.R. 4236, DECREASING A SAVING ON SOME UNIMPORTANT IMPROVEMENTS, THEREBY EFFECTING A SAVING OF $1,000, BUT PROVIDING GREAT NATIONAL IMPROVE- MENTS IN THE EAST, WEST, AND SOUTH OF THE COUNTRY.",Public Works,,Budget Special Interest,,Government Management,0.12468968873627316,-0.21729022958572067,0.676,-0.133,-0.013,0.603,0.292,0.712,-32.961081,
2016-10-19 13:03:23,RS0450315,45,Senate,315,1878-06-14,,59,2,"TO INSIST ON THE SENATE AMENDMENT, AND AGREE TO A SECOND CONFERENCE ON H.R. 4104.  THE AMENDMENT RESERVES TO THE SENATE THE RIGHT TO REGULATE ITS OWN AFFAIRS IN REGARD TO THE NUMBER OF ITS EMPLOYEES AND THE AMOUNTS OF THEIR SALARIES.",,,Internal Organization,,Miscellaneous Policy,3.842307057158369,2.896014840927564,-0.856,-0.393,-0.665,1.001,0.5,0.984,-1.163309,
2016-10-19 13:03:23,RS0450316,45,Senate,316,1878-06-15,,39,23,TO CONCUR IN A CONFERENCE REPORT TO H.R. 4236.,Public Works,,Budget Special Interest,,Government Management,-0.24787213947683315,-0.250540382126996,-0.216,-0.197,-0.021,-0.49,0.261,0.726,-29.881603,
2016-10-19 13:03:23,RS0450317,45,Senate,317,1878-06-15,,37,7,"TO PASS H.R. 762 (20-STAT-578), A BILL GRANTING A PENSION OF $25.00 A MONTH TO JOHN S. HALL, OF WEST VIRGINIA, LATE TEAMSTER DISABLED IN THE U.S. SERVICE.",,,Budget Special Interest,,Government Management,-3.757926175486336,-2.756110430355604,-0.834,0.378,-0.128,-0.197,0.0,0.841,-18.860107,
2016-10-19 13:03:23,RS0450318,45,Senate,318,1878-06-15,,15,30,"TO ADJOURN, MADE DURING DEBATE ON THE ORDER OF SENATE BUSINESS DUE TO LATE HOUR.",,,Internal Organization,,Miscellaneous Policy,0.10942103454382725,-0.3272939362444538,0.615,-0.26,-0.014,0.74,0.267,0.756,-21.359968,
2016-10-19 13:03:23,RS0450319,45,Senate,319,1878-06-15,,20,20,"TO ADJOURN BECAUSE OF THE LATE HOUR DURING DEBATE ON H.J. RES. 195, A RESOLUTION RELATING TO COMMITTEE CLERKS AND OTHER EMPLOYEES OF THE HOUSE AND SENATE.",,,Internal Organization,,Miscellaneous Policy,0.7050948283855,0.053079956516887516,0.475,0.388,-0.074,0.607,0.55,0.775,-20.264887,
2016-10-19 13:03:23,RS0450320,45,Senate,320,1878-06-17,,18,21,"TO RECONSIDER THE VOTE CONSENTING TO THE APPOINTMENT OF WILLIAM M. WOOD AS LIEUTENANT IN THE NAVY FROM DECEMBER 11, 1877.",,,Defense Policy Resolutions,,Foreign and Defense Policy,-3.846945283929443,-0.507672675360608,0.122,-0.977,0.145,0.218,0.667,0.846,-14.858891,
2016-10-19 13:03:23,RS0450321,45,Senate,321,1878-06-17,,24,30,TO LAY THE CALENDAR ASIDE IN ORDER TO PROCEED TO CONSIDER- ATION OF A MOTION TO RECONSIDER THE POSTPONEMENT OF H.J.R. 176.,Workplace conditions/8 hour day,,Domestic Social Policy,Budget Special Interest,Social Welfare,-0.6871702876585473,0.04232865590473118,-0.049,0.076,-0.036,-0.303,0.333,0.704,-29.911323,
2016-10-19 13:03:23,RS0450322,45,Senate,322,1878-06-17,,33,23,"TO TABLE AN AMENDMENT TO H.R. 5130 (20-STAT-216), A BILL MAKING SUNDRY CIVIL APPROPRIATIONS FOR FISCAL 1879.  THE AMENDMENT APPROPRIATES $6,000 FOR EXPENSES AND COMPENSATION OF COMMISSION APPOINTED BY THE PRESIDENT TO GO TO LOUISIANA.",,,Budget Special Interest,,Government Management,-6.456204563117514,-2.7785621462195733,-0.558,0.824,-0.048,-0.043,-0.043,0.571,-36.640305,
2016-10-19 13:03:23,RS0450323,45,Senate,323,1878-06-17,,16,25,TO PASS A RESOLUTION ACCEPTING A DONATION OF A LARGE SAFE AND BOOK CONTAINING AUTOGRAPHS OF DISTINGUISHED GENTLEMEN IN PUBLIC SERVICE.,,,Internal Organization,,Miscellaneous Policy,-4.428132491695508,1.5148040314951565,0.121,0.979,-0.049,-0.064,0.187,0.683,-25.425487,
2016-10-19 13:03:23,RS0450324,45,Senate,324,1878-06-17,,35,13,"TO TABLE AN AMENDMENT TO H.R. 5130 PROVIDING FOR THE CONSTRUCTION OF A CONGRESSIONAL LIBRARY ON OR NEAR JUDICIARY SQUARE, BECAUSE ITS CONSTRUCTION UPON THE NORTH, EAST, OR SOUTH SIDE OF THE CAPITOL WOULD BE BETTER.",Public Works,,Budget Special Interest,,Government Management,0.6219014252106922,1.0334467743736104,-0.824,0.521,-0.03,0.279,0.0,0.729,-26.820645,
2016-10-19 13:03:23,RS0450325,45,Senate,325,1878-06-17,,40,8,"TO TABLE AN AMENDMENT TO H.R. 5130, AUTHORIZING THE PURCHASE OF A SITE FOR THE CONGRESSIONAL LIBRARY.",Public Works,,Budget Special Interest,,Government Management,2.4277188969335914,2.5205803024489235,-0.995,0.105,-0.102,0.243,0.0,0.833,-17.9744,
2016-10-19 13:03:23,RS0450326,45,Senate,326,1878-06-17,,19,27,"TO AMEND H.R. 5130, BY ELIMINATING THE PROVISO AUTHORIZING THE SEC'Y OF INTERIOR TO LEASE GROUNDS TO PRESENT PROPRIETORS OF ARLINGTON HOTEL OR ASSIGNS FOR 5 YEARS AT $1,000 PER YEAR, AND TAXING THE TUBS IN BATHHOUSES ON HOT SPRINGS RESERVATION ST $15.00 ACH PER YEAR.",Public Lands,,Budget Special Interest,,Government Management,6.213874570906836,1.3969890895191566,-0.374,-0.927,0.52,-0.484,0.842,0.935,-8.303773,
2016-10-19 13:03:23,RS0450327,45,Senate,327,1878-06-17,,36,16,"TO CONCUR IN AN AMENDMENT TO H.R. 5130, APPROPRIATING $27,500 FOR THE EXPENSES OF THE HOT SPRINGS COMMISSION OF 3 MEMBERS, APPOINTED BY THE PRESIDENT FOR ONE YEAR TO ACT UNDER POWERS GRANTED BY THE ACT RELATING TO THE HOT SPRINGS RESERVATION, APPROVED MACH 18, 1877; AND DIRECTING THE SECRETARY OF THE INTERIOR TO LEASE TO THE PRESENT PROPRIETORS OF THE ARLINGTON HOTEL GROUNDS NOW OCCUPIED BY THEM, FOR 5 YEARS AT $1,000 ANNUAL RENTAL, AND AUTHORIZING THE LEASING TO ANY PERSON, FOR A TERM OF 5 YEARS, SITES ...",Public Lands,,Budget Special Interest,,Government Management,-4.616334340715332,-1.7460095066030368,-0.172,-0.952,-0.174,-0.218,0.375,0.808,-18.179041,
2016-10-19 13:03:23,RS0450328,45,Senate,328,1878-06-17,,31,21,"TO DETERMINE THE GERMANENESS OF AN AMENDMENT TO H.R. 512, A BILL MAKING SUNDRY CIVIL APPROPRIATIONS FOR FISCAL 1879. THE AMENDMENT DIRECTS THE SECRETARY OF TREASURY TO PAY ERRORS DUE MAIL CONTRACTORS FOR YEARS 1859, 1860, AND 1861, FROM APPROPRIATIONS APROVED MARCH 3, 1877.",,,Budget Special Interest,,Government Management,3.434636927356613,0.16241453290256924,-0.139,-0.315,0.56,-0.943,0.952,0.981,-3.886645,
2016-10-19 13:03:23,RS0450329,45,Senate,329,1878-06-17,,26,30,"TO AMEND H.R. 5130 BY PROVIDING THAT SECTION 3480, PROHIBITING ANY OFFICER TO PAY CLAIMS OF SUSTAINERS OF REBELLION AGAINST U.S., EXISTING PRIOR TO MAR. 13, 1861, NOT BE CONSTRUED AS BEING REPEALED.",,,Budget Special Interest,,Government Management,3.5642245570176994,0.20739486278948674,-0.084,-0.092,-0.599,0.972,0.962,0.982,-4.297702,
2016-10-19 13:03:23,RS0450330,45,Senate,330,1878-06-17,,30,23,"TO AMEND H.R. 5130, BY INSTRUCTING THE SEC'Y OF TREASURY TO PAY ARREARAGES DUE MAIL CONTRACTORS FOR CARRYING MAIL IN YEARS 1859, 1860, AND 1861, ACCORDING TO ACT APPROVED MARCH 3, 1877.",,,Budget Special Interest,,Government Management,3.603871747109175,0.23095753158372118,-0.144,-0.288,0.577,-0.926,0.957,0.981,-4.225255,
2016-10-19 13:03:23,RS0450331,45,Senate,331,1878-06-18,,29,25,"TO TABLE AN AMENDMENT TO H.R. 5130, PROVIDING TO STOP ACTION ON A PROPOSAL TO REQUIRE SURETY OF CLAIMANTS SEEKING PAYMENT FOR CARRYING MAIL IN 1859, 1860, AND 1861, THEREBY PREVENT PAYING FOR SERVICE COMPENSATED BY CONFEDERACY.",,,Budget Special Interest,,Government Management,3.114694336490396,0.48305720710865546,-0.14,0.047,-0.594,1.103,0.96,0.981,-4.700733,
2016-10-19 13:03:23,RS0450332,45,Senate,332,1878-06-18,,23,27,"TO TABLE AN AMENDMENT TO H.R. 5130, REQUIRING CLAIMANTS TO GIVE BOND, WITH SECURITY TO REPAY SUMS SUBSEQUENTLY PROVEN TO HAVE BEEN PAID BY CONFEDERACY.",,,Budget Special Interest,,Government Management,4.072070995402777,0.7849815340875552,-0.416,-0.909,0.364,-0.517,0.783,0.9,-9.786228,
2016-10-19 13:03:23,RS0450333,45,Senate,333,1878-06-18,,19,24,"TO TABLE AN AMENDMENT TO H.R. 5130, AUTHORIZING AN EXPEN- DITURE OF UP TO $50,000 FOR ERECTION OF A NEW CUSTOM-HOUSE AT PROVIDENCE, R.I.",,,Budget Special Interest,,Government Management,-19.443020302225346,-4.507488704925322,-0.281,0.956,0.158,0.047,0.684,0.86,-15.896443,
2016-10-19 13:03:23,RS0450334,45,Senate,334,1878-06-18,,24,28,"TO TABLE AN AMENDMENT TO H.R. 5130 PROVIDING FOR APPRORI- ATIONS OF $100,000 FOR IMPROVING CAPITAL AND CAPITAL GROUNDS.",Public Works,,D. C.,Budget Special Interest,Government Management,14.606250930753498,-0.2601375800448007,0.086,0.996,-0.149,0.059,0.667,0.846,-21.120173,
2016-10-19 13:03:23,RS0450335,45,Senate,335,1878-06-18,,25,25,"TO AMEND H.R. 5130, BY WITHDRAWING AN APPROPRIATION OF $100,000 PURPOSED FOR IMPROVEMENT OF CAPITAL GROUNDS, NAVAL MONUMENT APPROACHES, AND SENATE AND HOUSE WINGS OF CAPITAL.",Public Works,,D. C.,Budget Special Interest,Government Management,-9.06986692176594,-0.8994624528055493,-0.207,0.978,0.138,0.088,0.72,0.86,-19.650942,
2016-10-19 13:03:23,RS0450336,45,Senate,336,1878-06-18,,39,9,"TO DECIDE A POINT OF ORDER MADE DURING DEBATE ON H.R. 5130 IN ORDER TO DETERMINE WHETHER AMENDMENT LIMITING RANK OF OFFICER OF THE ENGINEER CORPS TO BE DETAILED AS COMMISSIONER OF DISTRICT OF COLUMBIA IS RELEVANT, SINCE IT DOES NOT INVOLVE AN APPROPRIATIN.",,,Internal Organization,,Miscellaneous Policy,-0.9938159958366924,-0.9651855201248992,0.03,-0.995,-0.061,-0.355,0.111,0.833,-18.042497,
2016-10-19 13:03:23,RS0450337,45,Senate,337,1878-06-18,,29,25,"TO CONCUR IN AN AMENDMENT TO H.R. 5130, PAYING ARREARS DUE MAIL CONTRACTORS FOR 1859, 1860, AND 1861, UNDER SURETY BOND AND GUARANTEEING REFUND OF MONEY PAID FOR SAME SERVICE BY CONFEDERACY, AND PUNISHING FRAUD.",,,Budget Special Interest,,Government Management,5.875124886941012,-0.2778841167466939,0.073,0.151,0.257,-0.253,0.84,0.926,-10.300328,
2016-10-19 13:03:23,RS0450338,45,Senate,338,1878-06-19,,22,27,TO CONSENT TO THE NOMINATION OF SAMUEL G. REID AS UNITED STATES MARSHAL FOR THE MIDDLE AND SOUTHERN DISTRICTS OF ALABAMA.,,,Government Organization,,Government Management,-3.688758317823296,-0.7694404218824826,-0.201,-0.028,0.611,0.958,0.955,0.98,-2.044711,
2016-10-19 13:03:23,RS0450339,45,Senate,339,1878-06-19,,23,25,"TO CONSENT TO THE NOMINATION OF REUBEN E. FENTON AS UNITED STATES COMMISSIONER TO THE INTERNATIONAL MONETARY CONFERENCE AS AUTHORIZED BY ""AN ACT TO AUTHORIZE THE COINAGE OF THE STANDARD SILVER DOLLAR AND TO RESTORE ITS LEGAL TENDER CHARACTER.""",,,Government Organization,,Government Management,4.203441928104401,0.5205943490522271,-0.347,-0.938,-0.133,0.183,0.565,0.792,-21.979327,
2016-10-19 13:03:23,RS0450340,45,Senate,340,1878-06-19,,25,22,"TO CONSENT TO THE NOMINATION OF REUBEN E. FENTON AS UNITED STATES COMMISSIONER TO THE INTERNATIONAL MONETARY CONFERENCE AS AUTHORIZED BY ""AN ACT TO AUTHORIZE THE COINAGE OF THE STANDARD SILVER DOLLAR AND TO RESTORE ITS LEGAL TENDER CHARACTER.""",,,Government Organization,,Government Management,3.416521753689121,0.5861869628547675,-0.435,-0.9,-0.14,0.237,0.591,0.809,-22.18446,
2016-10-19 13:03:23,RS0450341,45,Senate,341,1878-06-19,,22,22,TO DISCONTINUE THE EXECUTIVE SESSION AND PROCEED TO THE CONSIDERATION OF LEGISLATIVE BUSINESS MADE DURING THE CONSIDERATION OF THE NOMINATION OF RUBEN E. FENTON AS UNITED STATES COMMISSIONER TO ATTEND THE INTERNATIONAL MONETARY CONFERENCE.,,,Internal Organization,,Miscellaneous Policy,-25.01443007553707,-2.134803759442134,-0.125,0.992,-0.173,-0.04,0.727,0.864,-14.090944,
2016-10-19 13:03:23,RS0450342,45,Senate,342,1878-06-19,,22,21,TO TABLE THE RECONSIDERATION OF THE VOTE CONSENTING TO THE APPOINTMENT OF RUBEN E. FENTON AS UNITED STATES COMMISSIONER TO ATTEND THE INTERNATIONAL MONETARY CONFERENCE.,,,Government Organization,,Government Management,-63.62051579905383,-2.3092668215507985,-0.052,0.999,-0.154,-0.014,0.714,0.86,-16.192956,
2016-10-19 13:03:23,RS0450343,45,Senate,343,1878-06-19,,41,9,"TO ORDER THE ENGROSSMENT FOR THIRD READING OF H.R. 4981 (20-STAT-243), A BILL RELATING TO CLAIM-AGENTS AND ATTORNEYS IN PENSION CASES.",,,Budget Special Interest,,Government Management,-6.397879706260441,3.082746214011439,0.497,-0.097,0.125,0.113,0.0,0.82,-21.277284,
2016-10-19 13:03:23,RS0450344,45,Senate,344,1878-06-19,,33,20,"TO POSTPONE PRESENT AND ALL PRIOR ORDERS OF PRESENT BUSINESS IN ORDER TO TAKE UP H.R. 5216, A BILL FORBIDDING PAYMENT OF LEGAL TENDER NOTES IN PAYMENT OF DUTIES.",U.S. Currency,,Budget Special Interest,,Government Management,0.7121051454439551,-0.09815900222311691,-0.466,-0.43,0.123,-0.999,0.65,0.868,-17.637174,
2016-10-19 13:03:23,RS0450345,45,Senate,345,1878-06-19,,34,12,"TO SUSTAIN THE DECISION OF THE CHAIR, IN ORDER TO BRING H.R. 5216, A BILL FORBIDDING PAYMENT OF LEGAL TENDER NOTES IN PAYMENT OF DUTIES, BEFORE THE SENATE.",U.S. Currency,,Budget Special Interest,,Government Management,0.538215723827097,-0.40755073536652653,0.263,-0.266,0.063,-0.677,0.167,0.783,-17.99769,
2016-10-19 13:03:23,RS0450346,45,Senate,346,1878-06-19,,19,24,"TO POSTPONE UNTIL NEXT SESSION THE CONSIDERATION OF H.R. 1496 (20-STAT-581), A BILL APPROPRIATING $2,967.43, IN FULL SETTLEMENT OF CLAIM OF GEORGE H. GIDDINGS, FOR MAIL SERVICE FROM SANTA FE, NEW MEXICO TO SAN ANTONIO, TEXAS FROM 1854 TO 1858.",,,Budget Special Interest,,Government Management,0.18437916415223043,-0.10456982435127546,0.258,-0.057,-0.019,0.596,0.526,0.791,-20.032256,
2016-10-19 13:03:23,RS0450347,45,Senate,347,1878-06-19,,17,24,"TO AMEND H.R. 1496, BY REINSTATING CASE OF CLAIMANT ON DOCKET OF COURT OF CLAIMS.",,,Budget Special Interest,,Government Management,0.08228817638458552,-0.17245213026960687,0.285,-0.149,-0.007,0.492,0.294,0.707,-21.681443,
2016-10-19 13:03:23,RS0450348,45,Senate,348,1878-06-19,,23,17,TO PASS H.R. 1496.,,,Budget Special Interest,,Government Management,-0.022302120518481128,-0.12387697354688407,-0.129,-0.121,-0.003,-0.778,0.471,0.775,-16.392725,
2016-10-19 13:03:23,RS0450349,45,Senate,349,1878-06-19,,25,14,"TO POSTPONE UNTIL DECEMBER CONSIDERATION OF S. 501, A BILL PROVIDING FOR THE RELIEF OF JOHN C. BIRDSELL, IN ORDER TO ALLOW FOR ITS CONSIDERATION AND FOR RETURN OF SENATOR WHITERS OF VIRGINIA, WHO IS INTERESTED IN THE BILL.",,,Budget Special Interest,,Government Management,-5.0125254871981815,1.2813984849824163,0.431,-0.879,0.065,0.075,0.0,0.641,-24.811501,
2016-10-19 13:03:23,RS0450350,45,Senate,350,1878-12-05,,43,7,"TO ORDER THE ENGROSSMENT AND THIRD READING OF S. 1038, A BILL GRANTING THE CLAIM OF JESSIE TURNER AND OTHERS, SURETIES UPON THE OFFICIAL BOND OF GEORGE W. CLARKE, FORMERLY INDIAN AGENT.",,,Budget Special Interest,,Government Management,11.59967758855273,-3.8226942490452953,0.328,-0.018,0.718,-0.358,0.143,0.88,-8.328926,
2016-10-19 13:03:23,RS0450351,45,Senate,351,1878-12-10,,24,34,"TO POSTPONE ACTION ON H.R. 1435 (20-STAT-276), A BILL AUTHORIZING THE APPOINTMENT OF DR. JUNIUS L. POWELL AS AN ASSISTANT SURGEON IN THE U.S. ARMY UNTIL TOMORROW.",,,Defense Policy Resolutions,,Foreign and Defense Policy,118.75829615823382,-8.547289250285198,0.065,-0.828,-0.308,0.015,0.875,0.948,-9.000687,
2016-10-19 13:03:23,RS0450352,45,Senate,352,1878-12-10,,39,21,"TO ORDER THE ENGROSSMENT AND THIRD READING OF S. 1435, (20-STAT-276), A BILL AUTHORIZING THE APPOINTMENT OF DR. JUNIUS L. POWELL AS AN ASSISTANT SURGEON IN THE U.S. ARMY.",,,Defense Policy Resolutions,,Foreign and Defense Policy,5.250975586285544,-0.5245682910399881,0.07,-0.157,0.276,-0.304,0.667,0.883,-11.387274,
2016-10-19 13:03:23,RS0450353,45,Senate,353,1878-12-13,,37,28,"TO PASS S. 1308, A BILL AMENDING CHAPTER 1 TITLE 3 OF THE U.S. REVISED STATUTES, RELATING TO PRESIDENTIAL ELECTIONS AND REGULATING THE COUNTING OF THE VOTES FOR PRESIDENT AND VICE PRESIDENT AND THE DECISION OF QUESTIONS ARISING THEREON.",Electoral Votes,,Government Organization,,Government Management,5.955475826374077,1.1786642747912224,-0.03,1.0,-0.312,0.303,0.857,0.938,-11.971933,
2016-10-19 13:03:23,RS0450354,45,Senate,354,1878-12-13,,35,26,"TO ADJOURN BECAUSE OF THE LATE HOUR, MADE DURING DEBATE ON S. 300, A BILL AMENDING THE PATENT LAWS.",,,Internal Organization,,Miscellaneous Policy,-21.32547825618634,2.6923357385356654,0.127,-0.016,0.719,0.195,0.923,0.967,-6.617475,
2016-10-19 13:03:23,RS0450355,45,Senate,355,1878-12-16,,26,32,"TO AMEND A MOTION TO POSTPONE CONSIDERATION OF S. 300 AND TO RESUME CONSIDERATION OF A RESOLUTION INSTRUCTING THE COMMITTEE ON JUDICIARY IN INQUIRE AND REPORT ON WHETHER THERE WAS ANY VIOLATION OF THE RIGHTS OF CITIZENS AT THE RECENT STATE ELECTIONS, BY LIMINATING FROM SAID MOTION THE REFERENCE TO SAID RESOLUTION AND SUBSTITUTING THEREFORE THE S",Impeachments and Investigations,,Domestic Social Policy,,Civil Liberties,2.036309018684986,0.35629811275568224,-0.201,-0.053,0.144,-0.409,0.615,0.828,-21.393166,
2016-10-19 13:03:23,RS0450356,45,Senate,356,1878-12-16,,3,60,TO TABLE THE RESOLUTION AND AMENDMENTS.,Impeachments and Investigations,,Domestic Social Policy,,Civil Liberties,-5.004736014801603,-3.6683294184055266,-0.703,-0.15,0.257,0.297,0.0,0.952,-7.673003,
2016-10-19 13:03:23,RS0450357,45,Senate,357,1878-12-16,,36,27,TO AMEND THE RESOLUTION BY SUBSTITUTING INSTEAD A SELECT COMMITTEE OF NINE TO BE APPOINTED BY THE CHAIR.,Impeachments and Investigations,,Domestic Social Policy,,Civil Liberties,-4.250905006811178,-1.305020597036542,-0.299,-0.034,-0.624,-0.849,0.889,0.952,-7.211742,
2016-10-19 13:03:23,RS0450358,45,Senate,358,1878-12-16,,32,30,"TO AMEND THE RESOLUTION BY INSTRUCTING THE SAID COMMITTEE TO SIT WITH DOORS OPEN AND PERMIT ANY CITIZEN TO TESTIFY SAFLY, WHETHER IN SOUTH CAROLINA OR MAINE.",Impeachments and Investigations,,Domestic Social Policy,,Civil Liberties,-26.46584172768465,-0.12232920863842327,-0.005,0.01,0.723,0.158,1.0,1.0,-0.488478,
2016-10-19 13:03:23,RS0450359,45,Senate,359,1878-12-16,,32,29,TO AMEND A RESOLUTION BY HAVING THE SELECT COMMITTEE OR A SUB-COMMITTEE SIT WITH OPEN DOORS IF ANY MEMBER THEREOF SO DESIRES.,Impeachments and Investigations,,Domestic Social Policy,,Civil Liberties,-27.654432514700098,-0.1372721625735005,-0.005,0.001,0.722,0.151,1.0,1.0,-0.474524,
2016-10-19 13:03:23,RS0450360,45,Senate,360,1878-12-17,,59,6,TO PASS THE RESOLUTION.,Impeachments and Investigations,,Domestic Social Policy,,Civil Liberties,-2.843297523175504,-1.9711043897598417,-0.529,-0.467,-0.205,-0.417,0.167,0.923,-12.874829,
2016-10-19 13:03:23,RS0450361,45,Senate,361,1878-12-18,,47,4,"TO CONSENT TO THE NOMINATION OF HENRY S. FOOTE AS SUPERINTENDENT OF THE UNITED STATES MINT AT NEW ORLEANS, LA.",,,Government Organization,,Government Management,7.305705163527712,-3.121142129266391,0.393,-0.25,0.216,-0.171,0.0,0.922,-10.789628,
2016-10-19 13:03:23,RS0450362,45,Senate,362,1878-12-18,,22,31,"TO AMEND S. 300, BY PROHIBITING THE RECOVERY OF DAMAGES OR COSTS AGAINST PERSONS WHO PURCHASE PATENTED ARTICLES FOR THEIR OWN USE, AND NOT FOR RESALE, UNLESS SUCH PERSONS HAD KNOWLEDGE OF THE EXISTING PATENT RIGHT, OR AFTER SUCH PURCHASE CONTINUED TO USETHE ARTICLE WITH KNOWLEDGE OF THE PATENT RIGHT.",,,Domestic Social Policy,,Civil Liberties,2.220934369712425,-0.05483559581215436,-0.39,-0.921,-0.096,0.25,0.318,0.717,-27.05266,
2016-10-19 13:03:23,RS0450363,45,Senate,363,1878-12-19,,16,33,"TO AMEND S. 300, BY FORBIDDING ACTIONS FOR DAMAGES FOR UNLAWFUL USE WHERE THE PATENTED ARTICLE IS BOUGHT FOR THE PERSONAL USE OF THE PURCHASER, APPLY ONLY ONLY TO PATENTS ""HEREAFTER ISSUED.""",,,Domestic Social Policy,,Civil Liberties,2.0378749722088627,-0.251243507892683,-0.284,-0.83,-0.105,0.298,0.312,0.776,-21.381814,
2016-10-19 13:03:23,RS0450364,45,Senate,364,1878-12-19,,28,16,"TO ORDER THE THIRD READING OF H.R. 5683, A BILL AMENDING ACT APPROVED JUNE 20, 1878, BY FIXING RATE OF INTEREST ON DISTRICT OF COLUMBIA BONDS.",Banking and Finance,,D. C.,Budget Special Interest,Government Management,-141.3789239978974,-47.424181691299836,-0.333,-0.345,-0.22,-0.009,0.687,0.886,-11.16798,
2016-10-19 13:03:23,RS0450365,45,Senate,365,1878-12-20,,28,28,TO GO INTO EXECUTIVE SESSION.,,,Internal Organization,,Miscellaneous Policy,-1045.4007482435436,7.331805237704805,0.007,0.014,-0.723,-0.004,1.0,1.0,-0.38997,
2016-10-19 13:03:23,RS0450366,45,Senate,366,1879-01-10,,8,32,"TO AGREE TO AN AMENDMENT TO H.R. 5534,(20-STAT-295), THE INDIAN APPROPRIATION BILL FOR 1880, ELIMINATING THE PROVISION THEREFORE THAT THE PRESIDENT IS DIRECTED TO PROHIBIT THE REMOVAL OF INDIANS TO NEW INDIAN TERRITORY WITHOUT CONGRESSIONAL APPROVAL.",,,D. C.,,Government Management,8.521521481422488,-2.410914899236193,0.391,0.921,-0.249,0.169,0.5,0.9,-11.785189,
2016-10-19 13:03:23,RS0450367,45,Senate,367,1879-01-16,,20,28,"TO AMEND H.R. 4234 (20-STAT-265), A BILL PROVIDING DEATH AND DISABILITY PENSIONS TO CIVIL WAR SOLDIERS, BY RESTRICTING THE DISABILITY PENSIONS TO THE ACTUAL START OF DISABILITY AND NOT BEFORE.",Military Pensions/Veterans Benefits,,Defense Policy Budget,,Foreign and Defense Policy,-1.1158231359085735,-0.6521364007154306,-0.925,0.38,0.06,0.311,0.0,0.583,-31.209522,
