date_generated,id,congress,chamber,rollnumber,date,keyvote,yea,nay,description,Issue1,Issue2,Peltzman1,Peltzman2,Clausen1,slope,intercept,mid.dim1,mid.dim2,spread.dim1,spread.dim2,pre,classified,log_likelihood,vote_result
2016-10-18 10:30:10,RH0420307,42,House,307,1872-05-24,,42,63,"TO ADJOURN, MOTION MADE DURING DEBATE ON S. 569. (P. 3849-2)",,,Budget Special Interest,,Government Management,1.721334301922452,-0.4748172296942976,-0.107,-0.659,-0.075,0.252,0.333,0.733,-53.655439,
2016-10-18 10:30:10,RH0420308,42,House,308,1872-05-24,,47,69,"TO ADJOURN, MOTION MADE DURING DEBATE ON A RESOLUTION DIRECTING THE SERGEANT-AT-ARMS COMPEL THE ATTENDANCE OF ABSENT MEMBERS.  THE BILL UNDER CONSIDERATION WAS S. 569.",,,Budget Special Interest,,Government Management,2.9453942499561956,-0.7333143694906258,0.214,-0.103,-0.11,0.216,0.404,0.759,-54.47837,
2016-10-18 10:30:10,RH0420309,42,House,309,1872-05-24,,48,56,TO TABLE AN APPEAL FROM A DECISION OF THE CHAIR OVERRULING A POINT OF ORDER THAT WHILE PENDING BUSINESS WAS RESOLUTION THAT SERGEANT-AT-ARMS BE DIRECTED TO COMPEL ATTENDANCE OF ABSENT MEMBERS NO OTHER MOTION COULD BE ENTERTAINED BY HOUSE.  THE BILL UNDERCONSIDERATION WAS S,,,Budget Special Interest,,Government Management,3.786935464229394,-0.6464383823435134,0.242,0.27,-0.11,0.168,0.583,0.808,-50.836133,
2016-10-18 10:30:10,RH0420310,42,House,310,1872-05-24,,38,76,"TO ADJOURN, MOTION MADE DURING APPEAL FROM A DECISION OF THE CHAIR OVERULING A POINT OF ORDER THAT NO MOTION COULD BE ENTERTAINED BY THE HOUSE UNTIL PENDING BUSINESS, A MOTION DIRECTING THE SERGEANT-AT-ARMS TO COMPEL THE ATTENDANCE OF ABSENT MEMBERS, IS ECIDED",,,Budget Special Interest,,Government Management,2.4282639617959476,-0.8358177871098813,0.128,-0.525,-0.11,0.262,0.289,0.763,-50.498125,
2016-10-18 10:30:10,RH0420311,42,House,311,1872-05-24,,43,63,TO SUSTAIN THE DECISION OF THE CHAIR THAT OTHER MOTIONS MAY BE ENTERTAINED PENDING THE MOTION THAT THE SERGEANT-AT-ARMS BE COMPELLED TO DIRECT THE ATTENDANCE OF ABSENT MEMBERS.  THE BILL BEING CONSIDERED IS S. 569. (P. 385-1-3),,,Budget Special Interest,,Government Management,1.8932200581144205,-0.42817124738917073,-0.217,-0.839,-0.091,0.278,0.349,0.736,-51.422765,
2016-10-18 10:30:10,RH0420312,42,House,312,1872-05-24,,40,81,"TO ADJOURN, A MOTION MADE DURING CONSIDERATION OF A MOTION TO TABLE A MOTION TO RECONSIDER THE VOTE BY WHICH THE HOUSE REFUSED TO SUSTAIN A DECISION OF THE CHAIR.  THE DECISION OF THE CHAIR OVERULED A POINT OF ORDER THAT NO BUSINESS COULD BE ENTERTAINED HILE A MOTION THAT THE SERGEANT-OF-ARMS BE DIRECTED TO COMPEL THE ATTENDANCE OF ABSENT MEMBERS WAS PENDING",,,Budget Special Interest,,Government Management,1.644561692162588,-0.6165066556978217,-0.038,-0.679,-0.089,0.313,0.375,0.793,-52.654706,
2016-10-18 10:30:10,RH0420313,42,House,313,1872-05-24,,44,79,"TO ADJOURN, MOTION MADE DURING RECONSIDERATION OF VOTE BY WHICH THE HOUSE REFUSED TO SUSTAIN A DECISION OF THE CHAIR OVERRULING A POINT OF ORDER THAT NO BUSINESS COULD BE ENTERTAINED WHILE THE MOTION ON DIRECTING THE SERGEANT-OF-ARMS TO COMPEL THE ATTENDNCE OF ABSENT MEMBERS",,,Budget Special Interest,,Government Management,1.6634487236277147,-0.5706497966663578,0.316,-0.045,-0.13,0.452,0.386,0.78,-50.624212,
2016-10-18 10:30:10,RH0420314,42,House,314,1872-05-24,,105,7,TO DISPENSE WITH ALL FURTHER PROCEEDINGS IN THE CALL MOTION MADE DURING CONSIDERATION OF S. 569.  (P. 3855-1),,,Budget Special Interest,,Government Management,-31.419468490441826,16.77273776842461,0.531,0.089,0.201,0.037,0.0,0.938,-24.025102,
2016-10-18 10:30:10,RH0420315,42,House,315,1872-05-24,,92,27,TO PASS S. 569.  THERE WAS NO QUORUM FOR THIS VOTE.,,,Budget Special Interest,,Government Management,4.021986630974668,-1.5541130668296526,0.369,-0.07,0.242,-0.348,0.185,0.815,-37.048326,
2016-10-18 10:30:10,RH0420316,42,House,316,1872-05-24,,73,36,"A CALL OF THE HOUSE, MOTION MADE DURING CONSIDERATION OF S. 569.  (P. 3855-3,3856-1)",,,Budget Special Interest,,Government Management,2.7217332962162066,-0.8568937210475644,0.331,0.044,0.184,-0.391,0.444,0.817,-36.014263,
2016-10-18 10:30:10,RH0420317,42,House,317,1872-05-24,,38,74,"TO ADJOURN, MOTION MADE DURING CONSIDERATION OF S. 569. (P. 3856-2)",,,Budget Special Interest,,Government Management,3.2378739586931045,-0.9240943969537898,0.219,-0.215,-0.131,0.234,0.395,0.795,-46.559874,
2016-10-18 10:30:10,RH0420318,42,House,318,1872-05-24,,94,26,TO PASS S. 569.  THERE WAS NOT A QUORUM ON THIS VOTE.,,,Budget Special Interest,,Government Management,4.3746272774523245,-1.6981106017671694,0.374,-0.062,0.267,-0.353,0.231,0.833,-35.799352,
2016-10-18 10:30:10,RH0420319,42,House,319,1872-05-24,,59,77,THAT WHEN THE HOUSE ADJOURN TODAY IT WILL MEET AGAIN NEXT WEDNESDAY.  THE BILL UNDER CONSIDERATION OS S. 569. (P. 3863-2),,,Budget Special Interest,,Government Management,3.8302538109002913,0.637252793414618,-0.405,-0.914,0.1,-0.151,0.441,0.757,-72.342085,
2016-10-18 10:30:10,RH0420320,42,House,320,1872-05-24,,103,35,TO PASS S. 569.,,,Budget Special Interest,,Government Management,5.002104436289244,-1.763707090593186,0.336,-0.083,0.224,-0.259,0.286,0.819,-45.406762,
2016-10-18 10:30:10,RH0420321,42,House,321,1872-05-27,,84,120,"TO RECEDE IN ITS AMENDMENT TO H.R. 1070.  THE AMENDMENT CALLS FOR $400,000 FOR MAIL SERVICE BETWEEN NEW YORK AND RIO DE JANERIO.",,,Budget Special Interest,,Government Management,-1.114563960494788,0.1031011057581765,0.158,-0.073,-0.111,-0.576,0.583,0.828,-82.465794,
2016-10-18 10:30:10,RH0420322,42,House,322,1872-05-28,,104,117,"TO SUSPEND THE RULES, CONSIDER AND PASS S. 656, A BILL TO EXTEND THE PROVISIONS OF AN ACT APPROVED APRIL 20, 1871, ENFORCING THE PROVISIONS OF THE 14TH AMENDMENT.  (P. 3931-2)",Nullification/Secession/Reconstruction,,Domestic Social Policy,,Civil Liberties,-26.08327742207198,5.554738090901331,0.213,-0.001,-0.46,-0.102,0.808,0.91,-46.662523,
2016-10-18 10:30:10,RH0420323,42,House,323,1872-05-28,,90,79,"TO SUSPEND RULES AND CONSIDER S. 1015, A BILL QUIETING THE TITLE TO LANDS IN IOWA.  (P. 3932-1)",Public Lands,,Budget Special Interest,,Government Management,-1.1670122302779833,-0.09186823525807633,-0.101,0.026,-0.159,-0.788,0.595,0.811,-60.101502,
2016-10-18 10:30:10,RH0420324,42,House,324,1872-05-28,,120,88,"TO SUSPEND RULES, CONSIDER AND PASS S. 99, A BILL TO ENFORCE THE CIVIL RIGHTS OF THE CITIZENS OF THE U.S.  (P. 3932-3)",Civil Rights/Desegregation/Busing/Affirmative Action,,Domestic Social Policy,,Civil Liberties,19.20915614829515,-1.146549368897709,0.06,0.006,-0.734,0.221,0.989,0.995,-2.624549,
2016-10-18 10:30:10,RH0420325,42,House,325,1872-05-28,,118,90,"TO SUSPEND THE RULES, CONSIDER AND PASS S. 791, A BILL TO AMEND AN ACT APPROVED MAY 31, 1870, ENTITLED AN ACT TO EN- FORCE THE RIGHTS OF CITIZENS OF THE U.S. TO VOTE IN THE SEVERAL STATES OF THE UNION.",Civil Rights/Desegregation/Busing/Affirmative Action,,Domestic Social Policy,,Civil Liberties,-703.6814626258983,7.013814626258984,0.01,-0.023,-0.365,-0.003,0.978,0.99,-10.70097,
2016-10-18 10:30:10,RH0420326,42,House,326,1872-05-29,,137,45,"TO SUSPEND THE RULES AND PASS H.R. 2946, A BILL DIVIDING THE STATE OF ILL. INTO THREE JUDICIAL DISTRICTS. (P. 3983-3)",Judiciary,,Domestic Social Policy,,Civil Liberties,-2.797688644017589,-1.060387490664661,-0.265,-0.319,-0.104,-0.215,0.222,0.808,-78.270026,
2016-10-18 10:30:10,RH0420327,42,House,327,1872-05-29,,72,121,"TO AMEND A MOTION TO ADJOURN, BY CHANGING THE DAY WHEN THE HOUSE WILL MEET AGAIN FROM FRIDAY TO SATURDAY.  THE MOTION WAS MADE DURING CONSIDERATION OF H.R. 2945, A BILL TO AMEND AN ACT APPROVED MAY 31, 1870, ENTITLED ""AN ACT TO ENFORCE THE RIGHTS OF CITIENS OF THE U.S",Civil Rights/Desegregation/Busing/Affirmative Action,,Domestic Social Policy,,Civil Liberties,11.455061979706075,0.7891296484779555,-0.075,-0.07,0.204,-0.103,0.847,0.943,-36.079689,
2016-10-18 10:30:10,RH0420328,42,House,328,1872-05-29,,11,105,"THAT WHEN THE HOUSE ADJOURNS TODAY, IT WILL MEET AGAIN ON FRIDAY NEXT, MOTION MADE DURING CONSIDERATION OF H.R. 2945, A BILL TO AMEND AN ACT APPROVED MAY 31, 1870, ENTITLED ""AN ACT TO ENFORCE THE RIGHTS OF CITIZENS TO VOTE IN THE SEVERAL STATES OF THE UNON",Civil Rights/Desegregation/Busing/Affirmative Action,,Domestic Social Policy,,Civil Liberties,-5.216125551919027,-0.7755386365902996,-0.021,-0.666,0.193,0.214,0.545,0.957,-17.650854,
2016-10-18 10:30:10,RH0420329,42,House,329,1872-05-29,,103,83,TO ADJOURN.,,,Internal Organization,,Miscellaneous Policy,95.14158953585778,-22.077848772319005,0.232,-0.005,0.329,-0.02,0.723,0.876,-54.324678,
2016-10-18 10:30:10,RH0420330,42,House,330,1872-05-31,,104,96,"TO SUSPEND THE RULES, AND PROCEED TO THE CONSIDERATION OF THE BUSINESS ON THE SPEAKER TABLE.",,,Internal Organization,,Miscellaneous Policy,10.882456649838154,-1.4040176304724865,0.17,0.446,0.143,-0.076,0.656,0.835,-84.159225,
2016-10-18 10:30:10,RH0420331,42,House,331,1872-05-31,,136,54,"TO AMEND H.R. 2322, BY REDUCTING THE TOBACDO TAX TO 16 CENTS FROM 24 CENTS.",Tariffs,,Regulation Special Interest,,Government Management,1.2009834080298287,-0.6598574058356748,-0.145,-0.834,0.076,-0.366,0.167,0.763,-86.294868,
2016-10-18 10:30:10,RH0420332,42,House,332,1872-05-31,,104,98,"TO SUSPEND THE RULES, CONSIDER AND PASS S. 791, A BILL TO AMEND AN ACT APPROVED MAY 31, 1870, ENTITLED ""AN ACT TO ENFORCE THE RIGHTS OF CITIZENS OF THE U.S. TO VOTE IN THE SEVERAL STATES OF THE UNION.",Civil Rights/Desegregation/Busing/Affirmative Action,,Domestic Social Policy,,Civil Liberties,-17.587118467641968,2.320086756196382,0.133,-0.019,-0.745,-0.245,0.939,0.97,-12.663692,
2016-10-18 10:30:10,RH0420333,42,House,333,1872-06-01,,50,146,"TO ADJOURN, MOTION MADE DURING CONSIDERATION OF A RESOLUTION REGARDING FINAL ADJOURNMENT.  (P. 4137-3)",,,Internal Organization,,Miscellaneous Policy,-2.1688812204222896,1.8377273519293857,0.78,0.146,-0.057,-0.152,0.0,0.745,-106.370674,
2016-10-18 10:30:10,RH0420334,42,House,334,1872-06-01,,49,137,TO ADJOURN.,,,Internal Organization,,Miscellaneous Policy,-0.7552576071115419,0.9134928889390144,0.807,0.304,-0.038,-0.291,0.102,0.763,-96.667203,
2016-10-18 10:30:10,RH0420335,42,House,335,1872-06-03,,93,59,"TO SUSPEND RULES, CONSIDER AND PASS S. 1015, A BILL QUIETING THE TITLE TO LANDS WITH IOWA.",Public Lands,,Budget Special Interest,,Government Management,-1.58115081776589,-0.25508373107510385,-0.038,-0.195,-0.19,-0.695,0.729,0.895,-42.055782,
2016-10-18 10:30:10,RH0420336,42,House,336,1872-06-03,,71,94,TO SUSPEND THE RULES AND CONSIDER AND PASS A BILL REGULATING THE COMPENSATION OF AGENTS AND ATTORNEYS PROSECUTING CLAIMS OR DEMANDS BEFORE CONGRESS OR THE EXECUTIVE DEPT. OF THE GOVERNMENT.,,,Government Organization,Budget Special Interest,Government Management,-2.828975504898639,-0.05504374045202998,0.316,-0.949,0.315,0.644,0.831,0.927,-35.60613,
2016-10-18 10:30:10,RH0420337,42,House,337,1872-06-07,,101,44,"TO OVERRIDE VETO OF S. 955, GRANTING A PENSION TO MARY ANN MONTGOMERY.",,,Budget Special Interest,,Government Management,7.192905570266815,-2.1846986928315064,0.268,-0.257,0.245,-0.197,0.477,0.841,-45.60553,
2016-10-18 10:30:10,RH0420338,42,House,338,1872-06-07,,101,88,"TO SUSPEND THE RULES, CONSIDER AND PASS S. 99, A BILL ENFORCING THE CIVIL RIGHTS OF CITIZENS OF THE U.S., WITH ON AMENDMENT REDUCING THE PENALTY FOR VIOLATION FROM $5000 TO $100.",Civil Rights/Desegregation/Busing/Affirmative Action,,Domestic Social Policy,,Civil Liberties,25.0626274359909,-1.8015091753913448,0.072,0.003,-0.741,0.171,0.989,0.995,-2.258089,
2016-10-18 10:30:10,RH0420339,42,House,339,1872-06-07,,85,75,"TO SUSPEND THE RULES AND CONSIDER S. 99, A BILL ENFORCING CIVIL RIGHTS OF CITIZENS OF THE U.S.; AS AMENDED, THE MAXIMUN PENALTY FOR VIOLATION WAS REDUCED FROM $5,000 TO $500.  (P. 4322-3)",Civil Rights/Desegregation/Busing/Affirmative Action,,Domestic Social Policy,,Civil Liberties,6.305774239914747,-0.20531364687684564,0.037,0.028,-0.93,0.853,0.973,0.988,-5.291875,
2016-10-18 10:30:10,RH0420340,42,House,340,1872-06-07,,64,97,"TO SUSPEND THE RULES AND PASS S. 656, A BILL TO EXTEND THE PROVISIONS OF AN ACT APPROVED APRIL 20, 1871, TO INFORM THE 14TH AMENDMENT.  (P. 4322-3)",Nullification/Secession/Reconstruction,,Domestic Social Policy,,Civil Liberties,-12.127077791608501,2.1337469246979217,0.179,-0.037,-0.325,-0.155,0.781,0.913,-33.53066,
2016-10-18 10:30:10,RH0420341,42,House,341,1872-06-08,,78,100,"TO SUSPEND THE RULES AND PASS A RESOLUTION REFERRING H.R. 2705, A BILL MAKING APPROPRIATIONS FOR SUNDRY CIVIL EXPENSES, TOGETHER WITH SENATE AMENDMENTS, TO THE COMMITTEE ON APPROPRIATIONS, WITH INSTRUCTIONS THAT WHEN REPORTED BACK, THE SENATE AMENDMENTS ELATIVE TO AN ACT ENFORCING THE RIGHTS OF U.S",,,Internal Organization,,Miscellaneous Policy,-34.843164971987356,2.511394207927064,0.074,-0.067,0.741,0.123,0.987,0.994,-2.946182,
2016-10-18 10:30:10,RH0420342,42,House,342,1872-06-08,,97,75,"TO SUSPEND RULES AND REFER H.R. 2705, A CIVIL APPROPRIATIONS BILL, TO THE COMMITTEE ON APPROPRIATIONS.  (P. 4424-2)",,,Budget Special Interest,,Government Management,18.298377192988053,-1.2046928947372115,0.066,0.003,-0.734,0.232,0.987,0.994,-2.444535,
2016-10-18 10:30:10,RH0420343,42,House,343,1872-06-08,,72,82,TO SUSPEND RULES AND PASS A RESOLUTION REQUESTING INFORMATION REGARDING THE TITLE TO MARE ISLAND.,,,Government Organization,,Government Management,-12.11705541326833,0.6265683699646881,0.133,-0.985,0.507,0.242,0.958,0.981,-8.462128,
2016-10-18 10:30:10,RH0420344,42,House,344,1872-06-08,,64,83,"TO SUSPEND THE RULES AND RESOLVE INTO THE COMMITTEE OF THE WHOLE FOR CONSIDERATION OF S. 649, A BILL FOR THE RELIEF OF SIMEON SAVAGE.",,,Budget Special Interest,,Government Management,32.146518553855955,2.4219888915391965,-0.075,0.011,0.239,-0.043,0.922,0.966,-20.125474,
2016-10-18 10:30:10,RH0420345,42,House,345,1872-06-08,,66,86,TO ADJOURN.,,,Internal Organization,,Miscellaneous Policy,13.617945117318133,-0.014123012111726369,0.018,0.231,0.259,-0.11,0.939,0.974,-15.139309,
2016-10-18 10:30:10,RH0420346,42,House,346,1872-06-08,,58,82,TO AMEND A MOTION TO RECESS BY PROVIDING THAT THE HOUSE RECONVENE AT 7:00 INSTEAD OF 6:00.,,,Internal Organization,,Miscellaneous Policy,19.055714301534785,0.2616128573168826,-0.011,0.052,0.313,-0.095,0.966,0.986,-8.781545,
2016-10-18 10:30:10,RH0420347,42,House,347,1872-06-08,,67,89,TO ADJOURN.,,,Internal Organization,,Miscellaneous Policy,8.754009101217314,-0.46967382707687105,-0.019,-0.636,0.725,-0.479,0.985,0.994,-3.232347,
2016-10-18 10:30:10,RH0420348,42,House,348,1872-06-08,,39,108,TO ADJOURN.,,,Internal Organization,,Miscellaneous Policy,1.021928996088698,0.6423993721773019,0.301,0.95,0.047,-0.266,0.154,0.776,-71.80378,
2016-10-18 10:30:10,RH0420349,42,House,349,1872-06-08,,68,74,TO RECESS.,,,Internal Organization,,Miscellaneous Policy,8.303090732727755,-1.049278165945498,0.09,-0.302,0.379,-0.264,0.941,0.972,-13.370116,
2016-10-18 10:30:10,RH0420350,42,House,350,1872-06-08,,85,65,"TO SUSPEND RULES AND NONCONCUR IN SENATE AMENDMENTS TO H.R. 2705, AND TO AGREE TO A CONFERENCE REQUESTED BY THE SENATE.  (P. 4430-3)",,,Budget Special Interest,,Government Management,-17.837073566274068,3.8062966696163762,0.213,0.007,0.367,0.119,0.831,0.927,-34.709925,
2016-10-18 10:30:10,RH0420351,42,House,351,1872-06-08,,76,73,TO SUSPEND THE RULES AND NONCONCUR IN THE SENATE AMENDMENTS TO H.R. 2705 AND AGREE TO THE CONFERENCE ASKED BY THE SENATE.,,,Budget Special Interest,,Government Management,5.386763815427909,-0.3827176684297302,-0.024,-0.512,-0.19,0.204,0.822,0.913,-37.135371,
2016-10-18 10:30:10,RH0420352,42,House,352,1872-06-08,,75,76,"TO SUSPEND THE RULES, TAKE H.R. 2705 FROM THE TABLE, AGREE TO SENATE AMENDMENTS SEVEN THROUGH TEN, DISAGREE TO THE REMAINING SENATE AMENDMENTS, AND AGREE TO A CONFERENCE. (P. 4431-3)",,,Budget Special Interest,,Government Management,59.7383174501701,-11.127327045731638,0.186,-0.016,-0.754,0.073,0.893,0.947,-15.345296,
2016-10-18 10:30:10,RH0420353,42,House,353,1872-06-08,,68,76,TO RECESS.,,,Internal Organization,,Miscellaneous Policy,-23.222364582299264,0.6823367499751823,0.024,0.125,0.265,0.066,0.941,0.972,-16.895796,
2016-10-18 10:30:10,RH0420354,42,House,354,1872-06-08,,40,79,TO ADJOURN.,,,Internal Organization,,Miscellaneous Policy,5.953791585472951,1.237151663418918,-0.04,0.999,0.175,-0.17,0.475,0.824,-38.467272,
2016-10-18 10:30:10,RH0420355,42,House,355,1872-06-08,,59,72,TO AMEND A MOTION TO RECESS BY SETTING 11:00 INSTEAD OF 10:00 AS THE HOUR TO RECONVENE.,,,Internal Organization,,Miscellaneous Policy,46.51045283794465,3.187200340142292,-0.067,0.071,0.193,-0.024,0.864,0.939,-27.10223,
2016-10-18 10:30:10,RH0420356,42,House,356,1872-06-08,,59,68,TO AMEND A MOTION TO RECESS BY SETTING 10:30 INSTEAD OF 10:00 AS THE HOUR TO RECONVENE.,,,Internal Organization,,Miscellaneous Policy,14.2914221031694,-1.1240223461503829,0.079,0.005,0.724,-0.293,0.983,0.992,-2.146533,
2016-10-18 10:30:10,RH0420357,42,House,357,1872-06-08,,58,74,"TO AMEND MOTION OF RECESS, BY CHANGING THE TIME TO RECONVENE FROM 10:00 TO 12:00.",,,Internal Organization,,Miscellaneous Policy,5.7667223064991475,-0.03794145674887539,0.146,0.804,0.68,-0.682,0.983,0.992,-4.142503,
2016-10-18 10:30:10,RH0420358,42,House,358,1872-06-08,,49,91,TO ADJOURN.,,,Internal Organization,,Miscellaneous Policy,-6.784705356192803,-1.0542776428495424,-0.008,-1.0,0.183,0.156,0.633,0.871,-42.154287,
2016-10-18 10:30:10,RH0420359,42,House,359,1872-06-08,,70,106,TO ADJOURN.,,,Internal Organization,,Miscellaneous Policy,26.73589428948231,2.298040811684797,-0.068,0.48,0.245,-0.053,0.886,0.955,-24.956078,
2016-10-18 10:30:10,RH0420360,42,House,360,1872-06-08,,110,85,TO RECOMMIT H.R. 2705 TO THE COMMITTEE OF CONFERENCE. (P. 4438-2),,,Budget Special Interest,,Government Management,-23.134733017837757,4.46586873942485,0.192,0.024,0.268,0.067,0.741,0.887,-51.173073,
2016-10-18 10:30:10,RH0420361,42,House,361,1872-06-08,,13,150,TO ADJOURN.,,,Internal Organization,,Miscellaneous Policy,-1.3495260927072026,1.462451432844318,0.419,0.897,-0.077,-0.33,0.0,0.92,-39.57464,
2016-10-18 10:30:10,RH0420362,42,House,362,1872-06-08,,133,31,TO PASS A RESOLUTION REGARDING FINAL ADJOURNMENT.,,,Internal Organization,,Miscellaneous Policy,-5.5694727635535335,2.4981744827407755,0.276,0.961,0.156,0.162,-0.032,0.805,-61.121616,
2016-10-18 10:30:10,RH0420363,42,House,363,1872-06-08,,118,35,"TO SUSPEND THE RULES AND PASS S. 1089, A BILL REIMBURSING NEVADA FOR EXPENSES INCURRED WHILE A TERRITORY IN PURCHASE OF A PRISON, AND IN SUPPORT OF U.S. COURTS.",Public Works,,Budget Special Interest,,Government Management,0.6700608648459105,-0.8045255141666733,-0.238,-0.964,0.038,-0.328,0.086,0.791,-71.116201,
2016-10-18 10:30:10,RH0420364,42,House,364,1872-06-08,,88,65,"TO SUSPEND RULES AND PASS S. 680, A BILL ENCOURAGING THE GROWTH OF TIMBER UPON NORTH EASTERN PRAIRIES.  (P. 4448-2)",Agriculture,,Domestic Social Policy,Budget Special Interest,Agriculture,-52.053149290134954,10.349566872224292,0.18,0.98,0.099,0.011,0.4,0.745,-85.643407,
2016-10-18 10:30:10,RH0420365,42,House,365,1872-06-08,,140,29,"TO SUSPEND THE RULES AND PASS H.R. 2982, A BILL PROVIDING FOR THE TRANSMISSION OF OFFICIAL DOCUMENTS AND OTHER PUBLIC MATTERS.  (P. 4448-2)",,,Government Organization,,Government Management,-1.724243599334152,1.0623523659179261,0.724,-0.186,0.127,0.426,0.138,0.852,-63.697161,
2016-10-18 10:30:10,RH0420366,42,House,366,1872-06-08,,108,53,"TO SUSPEND THE RULES AND PASS H.R. 2984, A BILL PURCHASING A SITE FOR A PUBLIC BUILDING IN PITTSBURGH.  (P. 4452-2)",Public Works,,Budget Special Interest,,Government Management,-1.750891704823949,-0.5844601196891577,-0.516,0.319,-0.122,-0.403,0.358,0.789,-77.609042,
2016-10-18 10:30:10,RH0420367,42,House,367,1872-06-08,,118,93,TO AGREE TO THE CONFERENCE REPORT ON H.R. 2705.  (P. 4456-2),,,Budget Special Interest,,Government Management,-18.074010170185748,0.37614629493538665,0.029,-0.148,-0.375,-0.12,0.968,0.986,-11.922815,
2016-10-18 10:30:10,RH0420368,42,House,368,1872-12-04,,74,91,"TO REFER A RESOLUTION CONCERNING THE AMOUNT OF THE DEBT OF THE DISTRICT OF COLUMBIA TO THE COMMITTEE FOR THE DISTRICT OF COLUMBIA.  (P. 25,22)",,,D. C.,Budget Special Interest,Government Management,-12.693393337220714,2.572678667444143,0.2,0.034,-0.248,-0.113,0.743,0.885,-48.880175,
2016-10-18 10:30:10,RH0420369,42,House,369,1872-12-05,,105,67,"TO AMEND H.R. 3010, (17 STAT 423, 2-10-73), A BILL AUTHORIZ- ING THE CONSTRUCTION OF TEN OR MORE STEAM VESSELS OF WAR, BY REDUCING THE NUMBER OF VESSELS TO 6.  (P. 55)",,,Defense Policy Budget,,Foreign and Defense Policy,-4.083819358883546,0.880871020362003,0.249,-0.136,0.197,0.279,0.493,0.802,-61.557843,
2016-10-18 10:30:10,RH0420370,42,House,370,1872-12-09,,74,114,"TO TABLE H.R. 1647, THE SUPPLEMENTARY CIVIL RIGHTS BILL. (P. 85)",Civil Rights/Desegregation/Busing/Affirmative Action,,Domestic Social Policy,,Civil Liberties,5.941181436880423,-0.06376557001719352,0.174,0.97,0.679,-0.661,0.959,0.984,-7.381322,
2016-10-18 10:30:10,RH0420371,42,House,371,1872-12-09,,102,87,TO SUSPEND THE RULES AND PASS A BILL TO REMOVE ALL POLITICAL DISABILITIES AND TO GRANT GENERAL AMMESTY.,Amnesty (all wars),,Domestic Social Policy,,Civil Liberties,7.025206884997853,-1.5418649288045856,0.193,-0.186,0.232,-0.191,0.701,0.862,-54.614172,
2016-10-18 10:30:10,RH0420372,42,House,372,1872-12-11,,112,43,"TO PASS H.R. 2989, (17 STAT 437, 2-14-72), AN INDIAN DEPT. APPROPRIATION BILL.  (P. 143)",,,Indian Affairs,Budget Special Interest,Government Management,-5.464730133809102,-1.4809211392685104,-0.144,-0.694,-0.257,-0.272,0.651,0.903,-31.762742,
2016-10-18 10:30:10,RH0420373,42,House,373,1872-12-12,,137,21,"TO PASS H.R. 3130, A BILL AUTHORIZING THE EXCHANGE OF REGISTERED BONDS FOR COUPON BONDS.  (P. 161)",Banking and Finance,,Budget Special Interest,,Government Management,2.695117707010011,-2.653422589303001,0.999,0.039,0.137,-0.294,0.0,0.867,-53.627225,
2016-10-18 10:30:10,RH0420374,42,House,374,1872-12-12,,68,98,"TO RECOMMIT H.R. 1665, A BILL PROVIDING HOMESTEADS FOR VETERAN SOLDIERS, TO THE COMMITTEE ON MILITARY AFFAIRS. (P. 165)",Military Pensions/Veterans Benefits,,Defense Policy Budget,,Foreign and Defense Policy,1.030426326943923,0.32181355243254106,-0.454,-0.146,0.031,-0.174,0.147,0.651,-106.11887,
2016-10-18 10:30:10,RH0420375,42,House,375,1872-12-12,,108,61,"TO AMEND H.R. 1665, BY PROVIDING THAT THE LAND CANNOT BE DISPOSED OF UNTIL FULL TITLE IS HELD BY THE VETERAN. (P. 167)",Military Pensions/Veterans Benefits,,Defense Policy Budget,,Foreign and Defense Policy,-8.816590326919876,2.2259641720568886,0.251,0.013,0.125,0.082,0.295,0.746,-80.424122,
2016-10-18 10:30:10,RH0420376,42,House,376,1872-12-12,,118,54,TO PASS H.R. 1665.  (P. 167),Military Pensions/Veterans Benefits,,Defense Policy Budget,,Foreign and Defense Policy,3.800706138644775,2.2789423144791874,-0.768,-0.64,-0.069,0.105,0.056,0.703,-101.892054,
2016-10-18 10:30:10,RH0420377,42,House,377,1872-12-13,,90,76,"TO AMEND H.R. 1338, A BILL REIMBURSING WILLIAM AND MARY COLLEGE FOR PROPERTY DESTROYED DURING THE CIVIL WAR, BY REQUIRING EVIDENCE THAT THE COLLEGE SHALL ADMIT PEOPLE WITHOUT REGARD TO RACE OR CREED BEFORE DAMAGES SHALL BE PAID.  (P. 187)",Civil Rights/Desegregation/Busing/Affirmative Action,,Domestic Social Policy,Budget Special Interest,Civil Liberties,4.795934879726654,-0.7328186878009115,0.143,-0.047,-0.403,0.486,0.895,0.952,-16.183792,
2016-10-18 10:30:10,RH0420378,42,House,378,1872-12-13,,36,128,"TO ORDER ENGROSSMENT AND 3RD READING OF H.R. 1338, A BILL REIMBURSING WILLIAM AND MARY COLLEGE FOR PROPERTY DESTROYED DURING THE CIVIL WAR.  (P. 188)",Civil Rights/Desegregation/Busing/Affirmative Action,,Domestic Social Policy,Budget Special Interest,Civil Liberties,-1.557564416925988,0.6587288037149917,-0.135,0.869,-0.143,-0.531,0.306,0.848,-54.29786,
2016-10-18 10:30:10,RH0420379,42,House,379,1872-12-16,,115,54,"TO PASS H.J.RES. 169, A RESOLUTION PROVIDING FOR THE RETAINING OF CIVIL WAR BATTLE RIBBONS.  (P. 221)",,,Defense Policy Budget,,Foreign and Defense Policy,7.652257844361719,1.3232315756971307,-0.169,0.03,-0.258,0.195,0.852,0.953,-24.429194,
2016-10-18 10:30:10,RH0420380,42,House,380,1872-12-16,,84,71,TO SUSPEND RULES AND PASS A RESOLUTION PROVIDING FOR THE CANDIDACY OF NATURALIZED CITIZENS FOR PRESIDENTIAL OFFICE. (P. 1226),Constitutional Amendments,,Domestic Social Policy,,Civil Liberties,-37.764049484999866,5.7727871753249795,0.145,0.297,0.222,0.034,0.817,0.916,-39.646477,
2016-10-18 10:30:10,RH0420381,42,House,381,1872-12-16,,79,99,TO SUSPEND THE RULES AND PASS A RESOLUTION REQUESTING INFORMATION FROM THE PRESIDENT REGARDING INTERFERENCE BY THE EXECUTIVE OF THE U.S. WITH ARMED AUTHORITY IN LOUISIANA. (P. 1226),Impeachments and Investigations,,Government Organization,,Government Management,60.15030584637816,-7.8786900658755386,0.131,0.001,0.52,-0.05,0.962,0.983,-10.667446,
2016-10-18 10:30:10,RH0420382,42,House,382,1872-12-18,,109,55,"TO PASS H.J. RES. 80, A BILL REGARDING THE TWO PER CENT FUND OF THE STATES OF OHIO, INDIANA AND ILLNOIS.  (P. 281)",,,Budget Special Interest,,Government Management,3.16465687508158,-1.3184165763007427,0.622,0.65,0.116,-0.212,0.091,0.695,-93.309133,
2016-10-18 10:30:10,RH0420383,42,House,383,1872-12-18,,103,47,"TO LIMIT DEBATE ON H.R. 3131, (17 STAT 405, 1-8-73), A BILL MAKING DEFICIENCY APPROPRIATIONS.  (P. 282)",,,Budget Special Interest,,Government Management,-1.8031483087432367,-0.567637450125701,-0.266,-0.088,-0.106,-0.34,0.34,0.793,-66.190084,
2016-10-18 10:30:10,RH0420384,42,House,384,1872-12-19,,123,33,TO RESOLVE INTO COMMITTEE OF THE WHOLE FOR CONSIDERATION OF PUBLIC BILLS.  (P. 307),,,Internal Organization,,Miscellaneous Policy,-1.3931499810011787,-0.5640878035717783,0.188,-0.826,-0.165,-0.685,0.364,0.865,-47.119797,
