date_generated,id,congress,chamber,rollnumber,date,keyvote,yea,nay,description,Issue1,Issue2,Peltzman1,Peltzman2,Clausen1,slope,intercept,mid.dim1,mid.dim2,spread.dim1,spread.dim2,pre,classified,log_likelihood
2017-01-22 01:59:02,RS1130468,113,Senate,468,2014-06-09,,52,33,"Leo T. Sorokin, of Massachusetts, to be United States District Judge for the District of Massachusetts",Judiciary,,Government Organization,,Government Management,-4.816042761056902,0.8662459865479664,0.14,0.192,0.652,0.783,0.97,0.988,-1.829057
2017-01-22 01:59:02,RS1130469,113,Senate,469,2014-06-09,,53,34,"Richard Franklin Boulware II, of Nevada, to be United States District Judge for the District of Nevada",Judiciary,,Government Organization,,Government Management,-18.36956002202526,4.174303443832395,0.174,0.978,1.01,0.318,0.941,0.977,-6.560059
2017-01-22 01:59:02,RS1130470,113,Senate,470,2014-06-10,,91,0,"M. Hannah Lauck, of Virginia, to be United States District Judge for the Eastern District of Virginia",Judiciary,,Government Organization,,Government Management,,,0.0,0.0,0.0,0.0,,,0.0
2017-01-22 01:59:02,RS1130471,113,Senate,471,2014-06-10,,92,0,"Leo T. Sorokin, of Massachusetts, to be United States District Judge for the District of Massachusetts",Judiciary,,Government Organization,,Government Management,,,0.0,0.0,0.0,0.0,,,0.0
2017-01-22 01:59:02,RS1130472,113,Senate,472,2014-06-10,,59,35,"Richard Franklin Boulware II, of Nevada, to be United States District Judge for the District of Nevada",Judiciary,,Government Organization,,Government Management,-2.860685644957901,0.5082654972920304,-0.167,0.986,0.505,1.021,0.914,0.968,-8.727615
2017-01-22 01:59:02,RS1130473,113,Senate,473,2014-06-10,,59,35,"Lael Brainard, of the District of Columbia, to be a Member of the Board of Governors of the Federal Reserve System for a term of fourteen years from February 1, 2012",Banking and Finance,,Government Organization,,Government Management,-4.56521065871658,1.1309535324701616,0.444,-0.896,0.281,0.356,0.857,0.947,-15.26944
2017-01-22 01:59:02,RS1130474,113,Senate,474,2014-06-10,,58,36,"Jerome H. Powell, of Maryland, to be a Member of the Board of Governors of the Federal Reserve System for a term of fourteen years from February 1, 2014",Banking and Finance,,Government Organization,,Government Management,-11.09415606082674,2.0923214500218474,0.099,0.994,0.211,0.11,0.861,0.947,-18.376256
2017-01-22 01:59:02,RS1130475,113,Senate,475,2014-06-10,,56,38,"Stanley Fischer, of New York, to be Vice Chairman of the Board of Governors of the Federal Reserve System for a term of four years",Banking and Finance,,Government Organization,,Government Management,-9.093841595062012,1.6327448545926728,0.285,-0.959,0.25,0.159,0.921,0.968,-14.412481
2017-01-22 01:59:02,RS1130476,113,Senate,476,2014-06-11,,57,38,"A bill to amend the Higher Education Act of 1965 to provide for the refinancing of certain Federal student loans, and for other purposes.",Education,,Domestic Social Policy,Budget Special Interest,Social Welfare,-6.0911215669888445,0.9757032936014861,0.315,-0.943,0.317,0.301,0.947,0.979,-9.812662
2017-01-22 01:59:02,RS1130477,113,Senate,477,2014-06-11,,75,19,"To improve the access of veterans to medical services from the Department of Veterans Affairs, and for other purposes.",Military Pensions/Veterans Benefits,,Defense Policy Budget,Government Organization,Foreign and Defense Policy,-5.570686420725806,2.7778879215090324,0.536,-0.208,1.36,1.412,0.368,0.872,-22.012927
2017-01-22 01:59:02,RS1130478,113,Senate,478,2014-06-11,,94,3,"To improve the access of veterans to medical services from the Department of Veterans Affairs, and for other purposes.",Military Pensions/Veterans Benefits,,Defense Policy Budget,,Foreign and Defense Policy,7.200009197620194,-6.858808176684352,0.889,-0.458,1.703,-1.368,0.0,0.969,-12.127252
2017-01-22 01:59:02,RS1130479,113,Senate,479,2014-06-12,,53,41,"Crystal Nix-Hines, of California, for the rank of Ambassador during her tenure of service as the United States Permanent Representative to the United Nations Educational, Scientific, and Cultural Organization",U. N.,,Government Organization,,Government Management,53.23954585515227,-6.571775965576469,0.141,0.935,0.359,-0.039,0.951,0.979,-5.557422
2017-01-22 01:59:02,RS1130480,113,Senate,480,2014-06-12,,62,31,"Lael Brainard, of the District of Columbia, to be a Member of the Board of Governors of the Federal Reserve System for a term of fourteen years from February 1, 2012",Banking and Finance,,Government Organization,,Government Management,-4.957442789536663,1.5054883690155556,0.247,0.281,0.162,0.189,0.742,0.914,-23.607016
2017-01-22 01:59:02,RS1130481,113,Senate,481,2014-06-12,,68,24,"Jerome H. Powell, of Maryland, to be a Member of the Board of Governors of the Federal Reserve System for a term of fourteen years from February 1, 2014",Banking and Finance,,Government Organization,,Government Management,-6.804333240540516,2.832191641148642,0.275,0.961,0.16,0.136,0.375,0.837,-29.319237
2017-01-22 01:59:02,RS1130482,113,Senate,482,2014-06-12,,64,24,"Stanley Fischer, of New York, to be Vice Chairman of the Board of Governors of the Federal Reserve System for a term of four years",Banking and Finance,,Government Organization,,Government Management,-4.4399992660496705,1.7658398634852386,0.186,0.94,0.152,0.198,0.5,0.864,-26.301957
2017-01-22 01:59:02,RS1130483,113,Senate,483,2014-06-16,,55,37,"Salvador Mendoza, Jr., of Washington, to be United States District Judge for the Eastern District of Washington",Judiciary,,Government Organization,,Government Management,-55.55379968099198,11.046636533965339,0.207,-0.453,0.73,0.076,0.973,0.989,-1.374118
2017-01-22 01:59:02,RS1130484,113,Senate,484,2014-06-16,,55,37,"Staci Michelle Yandle, of Illinois, to be United States District Judge for the Southern District of Illinois",Judiciary,,Government Organization,,Government Management,-55.55379968099198,11.046636533965339,0.207,-0.453,0.73,0.076,0.973,0.989,-1.374118
2017-01-22 01:59:02,RS1130485,113,Senate,485,2014-06-16,,55,37,"Darrin P. Gayles, of Florida, to be United States District Judge for the Southern District of Florida",Judiciary,,Government Organization,,Government Management,-55.55379968099198,11.046636533965339,0.207,-0.453,0.73,0.076,0.973,0.989,-1.374118
2017-01-22 01:59:02,RS1130486,113,Senate,486,2014-06-17,,93,4,"Salvador Mendoza, Jr., of Washington, to be United States District Judge for the Eastern District of Washington",Judiciary,,Government Organization,,Government Management,-2.918542694040753,3.05292746824206,0.983,0.184,1.257,2.491,0.0,0.959,-9.972465
2017-01-22 01:59:02,RS1130487,113,Senate,487,2014-06-17,,53,44,"Staci Michelle Yandle, of Illinois, to be United States District Judge for the Southern District of Illinois",Judiciary,,Government Organization,,Government Management,-28.644863685937633,-0.6968599563796924,-0.037,0.363,0.733,0.148,0.977,0.99,-1.577805
2017-01-22 01:59:02,RS1130488,113,Senate,488,2014-06-17,,99,0,"Darrin P. Gayles, of Florida, to be United States District Judge for the Southern District of Florida",Judiciary,,Government Organization,,Government Management,,,0.0,0.0,0.0,0.0,,,0.0
2017-01-22 01:59:02,RS1130489,113,Senate,489,2014-06-17,,54,43,"Peter Joseph Kadzik, of New York, to be an Assistant Attorney General",Judiciary,,Government Organization,,Government Management,5.422203051055725,-0.3134886396637244,0.013,-0.243,0.66,-0.704,1.0,1.0,-0.17457
2017-01-22 01:59:02,RS1130490,113,Senate,490,2014-06-17,,56,43,"Peter Joseph Kadzik, of New York, to be an Assistant Attorney General",Judiciary,,Government Organization,,Government Management,3.735295435171721,-0.1176173453456758,-0.229,-0.973,0.372,-0.576,0.977,0.99,-8.883357
2017-01-22 01:59:02,RS1130491,113,Senate,491,2014-06-17,,95,3,"A bill making appropriations for the Departments of Commerce and Justice, Science, and Related Agencies for the fiscal year ending September 30, 2015, and for other purposes.",,,Budget Special Interest,,Government Management,3.219954427242322,-3.247435156406445,0.984,-0.079,1.158,-2.08,0.667,0.99,-6.600409
2017-01-22 01:59:02,RS1130492,113,Senate,492,2014-06-17,,55,38,"Gustavo Velasquez Aguilar, of the District of Columbia, to be an Assistant Secretary of Housing and Urban Development",,,Government Organization,,Government Management,-12.139379138480802,1.0364181374154424,0.003,1.0,0.382,0.182,0.947,0.978,-6.262538
2017-01-22 01:59:02,RS1130493,113,Senate,493,2014-06-23,,53,30,"Paul G. Byron, of Florida, to be United States District Judge for the Middle District of Florida",Judiciary,,Government Organization,,Government Management,-5.739533000608604,0.8450326089835677,-0.027,1.0,0.39,0.393,0.967,0.988,-6.013543
2017-01-22 01:59:02,RS1130494,113,Senate,494,2014-06-23,,53,31,"Carlos Eduardo Mendoza, of Florida, to be United States District Judge for the Middle District of Florida",Judiciary,,Government Organization,,Government Management,-5.858796023997874,0.770506955064083,-0.039,0.999,0.936,0.924,0.968,0.988,-6.966501
2017-01-22 01:59:02,RS1130495,113,Senate,495,2014-06-23,,53,31,"Beth Bloom, of Florida, to be United States District Judge for the Southern District of Florida",Judiciary,,Government Organization,,Government Management,-5.858796023997874,0.770506955064083,-0.039,0.999,0.936,0.924,0.968,0.988,-6.966501
2017-01-22 01:59:02,RS1130496,113,Senate,496,2014-06-23,,52,32,"Geoffrey W. Crawford, of Vermont, to be United States District Judge for the District of Vermont",Judiciary,,Government Organization,,Government Management,-49.39945932632415,7.699312951538188,0.161,-0.254,0.726,0.085,1.0,1.0,-0.420117
2017-01-22 01:59:02,RS1130497,113,Senate,497,2014-06-24,,95,0,"Paul G. Byron, of Florida, to be United States District Judge for the Middle District of Florida",Judiciary,,Government Organization,,Government Management,,,0.0,0.0,0.0,0.0,,,0.0
2017-01-22 01:59:02,RS1130498,113,Senate,498,2014-06-24,,95,0,"Carlos Eduardo Mendoza, of Florida, to be United States District Judge for the Middle District of Florida",Judiciary,,Government Organization,,Government Management,,,0.0,0.0,0.0,0.0,,,0.0
2017-01-22 01:59:02,RS1130499,113,Senate,499,2014-06-24,,96,0,"Beth Bloom, of Florida, to be United States District Judge for the Southern District of Florida",Judiciary,,Government Organization,,Government Management,,,0.0,0.0,0.0,0.0,,,0.0
2017-01-22 01:59:02,RS1130500,113,Senate,500,2014-06-24,,96,0,"Geoffrey W. Crawford, of Vermont, to be United States District Judge for the District of Vermont",Judiciary,,Government Organization,,Government Management,,,0.0,0.0,0.0,0.0,,,0.0
2017-01-22 01:59:02,RS1130501,113,Senate,501,2014-06-24,,52,44,"Leon Rodriguez, of Maryland, to be Director of the United States Citizenship and Immigration Services, Department of Homeland Security",Immigration/Naturalization,,Government Organization,,Government Management,-28.761037136121427,-0.7203531883558856,-0.032,0.2,0.731,0.147,0.977,0.99,-1.527219
2017-01-22 01:59:02,RS1130502,113,Senate,502,2014-06-24,,53,44,"Leon Rodriguez, of Maryland, to be Director of the United States Citizenship and Immigration Services, Department of Homeland Security",Immigration/Naturalization,,Government Organization,,Government Management,-26.568794950173046,-0.6577517980069219,-0.04,0.405,0.735,0.16,0.977,0.99,-1.563607
2017-01-22 01:59:02,RS1130503,113,Senate,503,2014-06-25,,33,63,To make the appointment and certification of a new local board permissible instead of required.,Unemployment/Jobs,,Budget Special Interest,,Government Management,10.301286592519796,-3.4314306542775874,0.257,-0.784,-0.358,0.201,0.758,0.917,-17.066146
2017-01-22 01:59:02,RS1130504,113,Senate,504,2014-06-25,,40,58,"To require that evaluation reports are due every fourth year, to establish a reservation of funds in a fiscal year in which a report is due, and to establish a reduction in funds if a report is not submitted.",Unemployment/Jobs,,Budget Special Interest,,Government Management,4.83321782453079,-0.5261778710205134,-0.097,-0.995,-0.239,0.286,0.875,0.949,-17.551756
2017-01-22 01:59:02,RS1130505,113,Senate,505,2014-06-25,,96,3,"An act to amend the Workforce Investment Act of 1998 to strengthen the United States workforce development system through innovation in, and alignment and improvement of, employment, training, and education programs in the United States, and to promote idividual and national economic growth, and for other purposes.",Unemployment/Jobs,,Budget Special Interest,,Government Management,8.151179971257395,-7.9795280525220695,0.956,-0.187,1.539,-1.092,0.0,0.97,-7.099736
2017-01-22 01:59:02,RS1130506,113,Senate,506,2014-06-26,,57,39,"Cheryl Ann Krause, of New Jersey, to be United States Circuit Judge for the Third Circuit",Judiciary,,Government Organization,,Government Management,-44.03961225082368,8.911130205148261,0.18,0.984,1.264,0.166,0.949,0.979,-10.714689
2017-01-22 01:59:02,RS1130507,113,Senate,507,2014-06-26,,94,0,"Stuart E. Jones, of Virginia, to be Ambassador to the Republic of Iraq",Iran,,Government Organization,,Government Management,,,0.0,0.0,0.0,0.0,,,0.0
2017-01-22 01:59:02,RS1130508,113,Senate,508,2014-07-07,,94,0,"Cheryl Ann Krause, of New Jersey, to be United States Circuit Judge for the Third Circuit",Judiciary,,Government Organization,,Government Management,,,0.0,0.0,0.0,0.0,,,0.0
2017-01-22 01:59:02,RS1130509,113,Senate,509,2014-07-07,,82,12,"A bill to protect and enhance opportunities for recreational hunting, fishing, and shooting, and for other purposes.",Fish and Wildlife,Parks and Conservation,Government Organization,,Government Management,-7.50126191790497,-3.9952028882730692,-0.557,0.183,-0.214,-0.165,0.0,0.872,-24.989358
2017-01-22 01:59:02,RS1130510,113,Senate,510,2014-07-09,,72,26,"Julian Castro, of Texas, to be Secretary of Housing and Urban Development",,,Government Organization,,Government Management,27.95446906322062,-11.525011918753853,0.439,0.747,1.334,-0.276,0.385,0.837,-22.682453
2017-01-22 01:59:02,RS1130511,113,Senate,511,2014-07-10,,41,56,"A bill to protect and enhance opportunities for recreational hunting, fishing, and shooting, and for other purposes.",Fish and Wildlife,Parks and Conservation,Government Organization,,Government Management,1.899607028270538,0.02667880213690521,0.455,0.891,0.291,-0.886,0.683,0.866,-26.821545
2017-01-22 01:59:02,RS1130512,113,Senate,512,2014-07-10,,76,22,"Shaun L. S. Donovan, of New York, to be Director of the Office of Management and Budget",,,Government Organization,,Government Management,31.176806876419448,-15.467342596951207,0.494,-0.066,1.698,-0.315,0.364,0.857,-28.340892
2017-01-22 01:59:02,RS1130513,113,Senate,513,2014-07-15,,51,45,"Norman C. Bay, of New Mexico, to be a Member of the Federal Energy Regulatory Commission for the term expiring June 30, 2018",Energy,,Government Organization,,Government Management,-10.286416526387594,-0.08348615516378277,-0.082,0.76,0.265,0.149,0.911,0.958,-14.215219
2017-01-22 01:59:02,RS1130514,113,Senate,514,2014-07-15,,85,10,"Cheryl A. LaFleur, of Massachusetts, to be a Member of the Federal Energy Regulatory Commission for the term expiring June 30, 2019",Energy,,Government Organization,,Government Management,-1.4987617735808512,1.6982570641485109,0.6,0.799,0.078,0.301,0.0,0.895,-32.689935
2017-01-22 01:59:02,RS1130515,113,Senate,515,2014-07-15,,53,45,"Norman C. Bay, of New Mexico, to be a Member of the Federal Energy Regulatory Commission for the term expiring June 30, 2018",Energy,,Government Organization,,Government Management,-10.241171622546014,-0.09418778927423332,-0.092,0.848,0.278,0.157,0.911,0.959,-14.297194
2017-01-22 01:59:02,RS1130516,113,Senate,516,2014-07-15,,91,7,"Cheryl A. LaFleur, of Massachusetts, to be a Member of the Federal Energy Regulatory Commission for the term expiring June 30, 2019",Energy,,Government Organization,,Government Management,-5.9764726962747545,-3.950812856670323,-0.518,-0.855,-0.155,-0.15,-0.143,0.918,-28.786037
2017-01-22 01:59:02,RS1130517,113,Senate,517,2014-07-16,,54,43,"Ronnie L. White, of Missouri, to be United States District Judge for the Eastern District of Missouri",Judiciary,,Government Organization,,Government Management,-27.039640183268972,5.011126237570139,0.205,-0.532,0.734,0.157,0.977,0.99,-1.501714
2017-01-22 01:59:02,RS1130518,113,Senate,518,2014-07-16,,54,44,"Ronnie L. White, of Missouri, to be United States District Judge for the Eastern District of Missouri",Judiciary,,Government Organization,,Government Management,-21.77208513066145,2.658598981855327,0.129,-0.15,0.719,0.191,1.0,1.0,-0.687104
2017-01-22 01:59:02,RS1130519,113,Senate,519,2014-07-16,,57,43,A bill to ensure that employers cannot interfere in their employees' birth control and other health care decisions.,Abortion/Care of deformed newborns,,Domestic Social Policy,Regulation General Interest,Social Welfare,-4.025679915300631,0.5333474891694295,0.364,-0.932,0.545,0.783,0.977,0.99,-6.984073
2017-01-22 01:59:02,RS1130520,113,Senate,520,2014-07-17,,48,49,"To allow the Secretary to extend the deadline for collecting terrorism loss risk-spreading premiums if the mandatory recoupment is more than $1,000,000,000.",,,Budget Special Interest,,Government Management,10.332647611899448,0.7529917713427934,-0.012,0.629,-0.318,0.178,0.917,0.959,-12.770376
2017-01-22 01:59:02,RS1130521,113,Senate,521,2014-07-17,,97,0,To establish the Advisory Committee on Risk-Sharing Mechanisms.,,,Budget Special Interest,,Government Management,,,0.0,0.0,0.0,0.0,,,0.0
2017-01-22 01:59:02,RS1130522,113,Senate,522,2014-07-17,,94,4,"A bill to extend the termination date of the Terrorism Insurance Program established under the Terrorism Risk Insurance Act of 2002, and for other purposes.",,,Budget Special Interest,,Government Management,32.25108741587291,-32.16558089137767,0.994,-0.108,1.829,-0.328,0.0,0.959,-12.69467
2017-01-22 01:59:02,RS1130523,113,Senate,523,2014-07-17,,68,23,"Julie E. Carnes, of Georgia, to be United States Circuit Judge for the Eleventh Circuit",Judiciary,,Government Organization,,Government Management,24.627803423200923,-10.207489113054807,0.442,0.678,1.567,-0.368,0.435,0.857,-25.186518
2017-01-22 01:59:02,RS1130524,113,Senate,524,2014-07-21,,95,0,"Julie E. Carnes, of Georgia, to be United States Circuit Judge for the Eleventh Circuit",Judiciary,,Government Organization,,Government Management,,,0.0,0.0,0.0,0.0,,,0.0
2017-01-22 01:59:02,RS1130525,113,Senate,525,2014-07-22,,56,43,"Andre Birotte, Jr., of California, to be United States District Judge for the Central District of California",Judiciary,,Government Organization,,Government Management,-24.715158093184233,4.540607409102767,0.205,-0.526,0.735,0.172,0.977,0.99,-1.496021
2017-01-22 01:59:02,RS1130526,113,Senate,526,2014-07-22,,58,42,"Robin L. Rosenberg, of Florida, to be United States District Judge for the Southern District of Florida",Judiciary,,Government Organization,,Government Management,-6.512585801596793,0.9739496567936128,-0.004,1.0,0.411,0.365,0.952,0.98,-7.727803
2017-01-22 01:59:02,RS1130527,113,Senate,527,2014-07-22,,57,39,"John W. deGravelles, of Louisiana, to be United States District Judge for the Middle District of Louisiana",Judiciary,,Government Organization,,Government Management,10.45511972921514,-2.13360805048445,0.109,-0.994,0.47,-0.26,0.949,0.979,-7.095812
2017-01-22 01:59:02,RS1130528,113,Senate,528,2014-07-22,,101,0,"Andre Birotte, Jr., of California, to be United States District Judge for the Central District of California",Judiciary,,Government Organization,,Government Management,,,0.0,0.0,0.0,0.0,,,0.0
2017-01-22 01:59:02,RS1130529,113,Senate,529,2014-07-22,,101,0,"Robin L. Rosenberg, of Florida, to be United States District Judge for the Southern District of Florida",Judiciary,,Government Organization,,Government Management,,,0.0,0.0,0.0,0.0,,,0.0
2017-01-22 01:59:02,RS1130530,113,Senate,530,2014-07-22,,101,0,"John W. deGravelles, of Louisiana, to be United States District Judge for the Middle District of Louisiana",Judiciary,,Government Organization,,Government Management,,,0.0,0.0,0.0,0.0,,,0.0
2017-01-22 01:59:02,RS1130531,113,Senate,531,2014-07-23,,93,7,A bill to provide an incentive for businesses to bring jobs back to America.,Tax rates,,Budget Special Interest,,Government Management,8.035911746375326,-6.997069189513167,0.893,0.179,1.627,-1.171,0.0,0.93,-15.226072
2017-01-22 01:59:02,RS1130532,113,Senate,532,2014-07-24,,54,41,"Pamela Harris, of Maryland, to be United States Circuit Judge for the Fourth Circuit",Judiciary,,Government Organization,,Government Management,-4.588765809467208,0.09208116884848283,0.153,-0.61,0.649,0.818,0.976,0.989,-4.449186
2017-01-22 01:59:02,RS1130533,113,Senate,533,2014-07-28,,51,43,"Pamela Harris, of Maryland, to be United States Circuit Judge for the Fourth Circuit",Judiciary,,Government Organization,,Government Management,-8.174900567402954,-0.4258438351789831,-0.062,0.081,0.694,0.491,0.977,0.989,-3.974715
2017-01-22 01:59:02,RS1130534,113,Senate,534,2014-07-29,,98,0,"Robert Alan McDonald, of Ohio, to be Secretary of Veterans Affairs",Military Pensions/Veterans Benefits,,Government Organization,,Government Management,,,0.0,0.0,0.0,0.0,,,0.0
2017-01-22 01:59:02,RS1130535,113,Senate,535,2014-07-29,,71,26,To modify the provisions relating to revenue.,Public Works,,Budget Special Interest,,Government Management,-4.772653790954961,1.9566974391277143,0.406,0.019,1.284,1.556,0.615,0.897,-21.776855
2017-01-22 01:59:02,RS1130536,113,Senate,536,2014-07-29,,66,31,In the nature of a substitute.,Public Works,,Budget Special Interest,,Government Management,1.8806631517841383,-0.4030850333754633,-0.294,-0.956,0.146,-0.449,0.484,0.835,-34.531516
2017-01-22 01:59:02,RS1130537,113,Senate,537,2014-07-29,,28,69,To empower States with authority for most taxing and spending for highway programs and mass transit programs.,Public Works,Tax rates,Budget Special Interest,,Government Management,5.653874902114963,-2.1619676043462572,0.211,-0.969,-0.392,0.401,0.679,0.907,-19.462846
2017-01-22 01:59:02,RS1130538,113,Senate,538,2014-07-29,,47,50,To ease Federal burdens on State and local governments recovering from catastrophic events.,Public Works,Pollution and Environmental Protection,Budget Special Interest,,Government Management,-14.02289518888236,-1.4595110824662358,-0.066,-0.534,-0.691,-0.285,0.915,0.959,-7.69526
2017-01-22 01:59:02,RS1130539,113,Senate,539,2014-07-29,,79,18,"A bill to provide an extension of Federal-aid highway, highway safety, motor carrier safety, transit, and other programs funded out of the Highway Trust Fund, and for other purposes.",Public Works,,Budget Special Interest,,Government Management,7.19052512716579,-3.532970096034016,0.362,-0.93,0.414,-0.333,0.5,0.907,-17.343617
2017-01-22 01:59:02,RS1130540,113,Senate,540,2014-07-30,,54,42,A bill to provide an incentive for businesses to bring jobs back to America.,Tax rates,,Budget Special Interest,,Government Management,-8.791198546778347,0.5632509442329889,0.176,-0.984,0.418,0.275,0.976,0.99,-5.929483
2017-01-22 01:59:02,RS1130541,113,Senate,541,2014-07-30,,63,33,"A bill making emergency supplemental appropriations for the fiscal year ending September 30, 2014, and for other purposes.",,,Budget Special Interest,,Government Management,-2.1905867291717045,0.564345713667231,0.112,0.319,0.164,0.433,0.667,0.885,-24.55607
2017-01-22 01:59:02,RS1130542,113,Senate,542,2014-07-31,,43,52,Of a perfecting nature.,,,Budget Special Interest,,Government Management,-35.135875770841096,-0.8403968942710274,-0.025,0.038,-0.729,-0.12,0.977,0.989,-1.548137
2017-01-22 01:59:02,RS1130543,113,Senate,543,2014-07-31,CQ,51,44,"A bill making emergency supplemental appropriations for the fiscal year ending September 30, 2014, and for other purposes.",,,Budget Special Interest,,Government Management,-10.398796234999963,-0.5761602757549988,-0.033,-0.233,0.703,0.391,0.977,0.989,-4.173007
2017-01-22 01:59:02,RS1130544,113,Senate,544,2014-07-31,,86,8,"To improve the access of veterans to medical services from the Department of Veterans Affairs, and for other purposes.",Military Pensions/Veterans Benefits,,Defense Policy Budget,,Foreign and Defense Policy,13.91314229696426,-12.816701189958549,0.936,0.206,1.809,-0.752,0.0,0.915,-16.689857
2017-01-22 01:59:02,RS1130545,113,Senate,545,2014-07-31,,91,3,"To improve the access of veterans to medical services from the Department of Veterans Affairs, and for other purposes.",Military Pensions/Veterans Benefits,,Defense Policy Budget,,Foreign and Defense Policy,8.340061458378006,-8.01613605004074,0.912,-0.41,1.703,-1.181,0.0,0.968,-11.189499
2017-01-22 01:59:02,RS1130546,113,Senate,546,2014-07-31,,81,13,"A bill to provide an extension of Federal-aid highway, highway safety, motor carrier safety, transit, and other programs funded out of the Highway Trust Fund, and for other purposes.",Public Works,,Budget Special Interest,,Government Management,2.34203470057123,-1.5573386436410588,0.422,-0.569,0.164,-0.405,0.462,0.926,-19.053326
2017-01-22 01:59:02,RS1130547,113,Senate,547,2014-07-31,,58,33,"Jill A. Pryor, of Georgia, to be United States Circuit Judge for the Eleventh Circuit",Judiciary,,Government Organization,,Government Management,36.0326182097074,-9.36315455242685,0.25,-0.355,1.327,-0.213,0.879,0.956,-12.759047
2017-01-22 01:59:02,RS1130548,113,Senate,548,2014-09-08,,98,0,"Jill A. Pryor, of Georgia, to be United States Circuit Judge for the Eleventh Circuit",Judiciary,,Government Organization,,Government Management,,,0.0,0.0,0.0,0.0,,,0.0
2017-01-22 01:59:02,RS1130549,113,Senate,549,2014-09-08,,55,43,"Henry J. Aaron, of the District of Columbia, to be a Member of the Social Security Advisory Board for a term expiring September 30, 2014",Social Security,,Government Organization,,Government Management,5.698378191709299,-0.3220626984093139,0.023,-0.191,0.668,-0.678,1.0,1.0,-0.160898
