date_generated,id,congress,chamber,rollnumber,date,keyvote,yea,nay,description,Issue1,Issue2,Peltzman1,Peltzman2,Clausen1,slope,intercept,mid.dim1,mid.dim2,spread.dim1,spread.dim2,pre,classified,log_likelihood,vote_result
2016-10-18 10:30:10,RH0060070,6,House,70,1801-01-16,,46,31,"TO PASS H.R. 276, A BILL TO CONTINUE IN FORCE THE ACTS LAYING DUTIES ON LICENSES FOR SELLING WINES AND FOREIGN DISTILLED SPIRITS, ON PROPERTY SOLD AT AUCTION, AND ON CARRIAGES FOR THE CONVEYANCE OF PERSONS.  (P. 911)",Tax rates,,Budget General Interest,,Government Management,-5.53099806373063,0.5055068121818711,0.097,-0.031,-0.197,-0.206,0.71,0.883,-20.845005,
2016-10-18 10:30:10,RH0060071,6,House,71,1801-01-20,,52,43,TO PASS H.R. 275.,Judiciary,,Domestic Social Policy,,Civil Liberties,-8.736792712774534,1.934304774948721,0.223,-0.014,-0.713,-0.472,0.977,0.989,-2.305908,
2016-10-18 10:30:10,RH0060072,6,House,72,1801-01-23,,49,48,TO PASS THE RESOLUTION TO CONTINUE IN FORCE THE ACT COMMONLY CALLED THE SEDITION LAW. (SPEAKER VOTING IN THE AFFIRMATIVE).  (P. 975),Alien and Sedition Laws,,Domestic Social Policy,,Civil Liberties,-52.12455278710358,18.598465344995976,0.357,-0.01,-0.73,-0.081,0.958,0.979,-3.791376,
2016-10-18 10:30:10,RH0060073,6,House,73,1801-01-27,,67,13,"TO PASS H.R. 279, A BILL TO DISCHARGE SAMUEL LEWIS FROM HIS IMPRISONMENT.  (P. 978)",,,Domestic Social Policy,,Civil Liberties,-2.282174903112518,-0.7516270256842719,-0.509,0.41,-0.35,-0.887,0.538,0.925,-18.448408,
2016-10-18 10:30:10,RH0060074,6,House,74,1801-01-30,,50,44,"TO PASS H.R. 281, A BILL TO INCORPORATE THE PERSONS THEREIN NAMED, AND THEIR ASSOCIATES, AS A MINE AND METAL COMPANY. (P. 989)",,,Regulation Special Interest,,Government Management,-3.997937733497308,0.5947690261516985,0.112,0.147,-0.3,-0.434,0.909,0.957,-15.382018,
2016-10-18 10:30:10,RH0060075,6,House,75,1801-02-09,,47,53,"TO DISAGREE WITH THE COMMITTEE OF THE WHOLE IN THEIR AGREEMENT TO THE FOURTH RULE OF THE REPORT OF A SPECIAL COMMITTEE CONCERNING RULES PROPER TO BE OBSERVED IN THE ELECTION OF A PRESIDENT; SAID RULE STATES THAT ""AFTER COMMENCING THE BALLOTING FOR PRESIDNT, THE HOUSE SHALL NOT ADJOURN UNTIL A CHOICE IS MADE.""  (P",Electoral Votes,,Government Organization,,Civil Liberties,-14.4311320038454,2.867549988611419,0.159,0.573,0.257,0.103,0.848,0.929,-17.890814,
2016-10-18 10:30:10,RH0060076,6,House,76,1801-02-09,,45,54,"TO DISAGREE WITH THE COMMITTEE OF THE WHOLE IN THEIR AGREEMENT TO THE FIFTH RULE OF THE COMMITTEE REPORT CONCERNING RULES TO BE OBSERVED IN THE ELECTION OF THE PRESIDENT; SAID RULE STATES THAT THE DOORS OF THE HOUSE BE CLOSED DURING THE BALLOTING, EXCEPTAGAINST THE OFFICERS OF THE HOUSE",Electoral Votes,,Government Organization,,Civil Liberties,-4.962587499779019,0.8902283374600024,0.181,-0.008,0.689,0.803,0.978,0.99,-3.726405,
2016-10-18 10:30:10,RH0060077,6,House,77,1801-02-10,,40,59,"TO POSTPONE UNTIL MONDAY, H.R. 302, A BILL TO CONTINUE IN FORCE AN ACT FURTHER TO SUSPEND THE COMMERCIAL INTERCOURSE BETWEEN THE UNITED STATES AND FRANCE AND THE DEPENDENCIES THEREOF.  (P. 1019)",,,Foreign Policy Resolutions,,Foreign and Defense Policy,-2.9676576998537194,1.066078747768696,0.214,0.431,-0.274,-0.534,0.725,0.888,-20.800174,
2016-10-18 10:30:10,RH0060078,6,House,78,1801-02-10,,59,37,"TO REJECT H.R. 302, A BILL TO EXTEND THE SUSPENSION OF COMMERCIAL INTERCOURSE WITH FRANCE.",,,Foreign Policy Resolutions,,Foreign and Defense Policy,-1.9363395126006258,0.6734297054777728,0.276,0.139,0.535,1.598,0.865,0.947,-11.99327,
2016-10-18 10:30:10,RH0060079,6,House,79,1801-02-10,,36,59,"TO AGREE TO ADD AN ADDITIONAL RULE IN RELATION TO THE PRESIDENTAL ELECTION: THAT 600 TICKETS BE PRINTED ON WHICH WOULD BE THE NAME THOMAS JEFFERSON OF VIRGINIA, AND 600 TICKETS BE PRINTED ON WHICH WOULD BE THE NAME AARON BURR OF NEW YORK"".  (P. 1022)",Electoral Votes,,Government Organization,,Civil Liberties,-4.401419332010013,1.682024380270994,0.299,0.366,-0.242,-0.318,0.694,0.883,-20.301277,
2016-10-18 10:30:10,RH0060080,6,House,80,1801-02-19,,50,50,"TO REJECT H.R. 309, A BILL TO REPEAL PART OF THE SEDITION ACT, AND TO CONTINUE IN FORCE THE RESIDUE OF THE SAME. (SPEAKER VOTING IN THE NEGATIVE).",Alien and Sedition Laws,,Domestic Social Policy,,Civil Liberties,-13.900445516649974,4.487445683944542,0.327,-0.058,0.709,0.295,0.959,0.98,-3.199186,
2016-10-18 10:30:10,RH0060081,6,House,81,1801-02-20,,48,54,"TO DECIDE IF THE MOTION TO TAKE UP A RESOLUTION IS IN ORDER; SAID RESOLUTION STATES THAT THE SPEAKER HAS ASSUMED A POWER NOT HIS, IN DIRECTING THE EXPULSION OF SAMUEL HARRISON SMITH FROM THE GALLERY OF THE HOUSE.",,,Internal Organization,,Miscellaneous Policy,-6.428361324224027,1.2525275167628216,0.209,-0.091,0.698,0.628,0.979,0.99,-2.858833,
2016-10-18 10:30:10,RH0060082,6,House,82,1801-02-20,,60,42,TO SUSTAIN THE DECISION OF THE CHAIR TO CALL A MEMBER OF THE HOUSE TO ORDER.,,,Internal Organization,,Miscellaneous Policy,-19.105650301248037,2.267481446994694,0.156,-0.713,-0.294,-0.089,0.857,0.941,-16.659233,
2016-10-18 10:30:10,RH0060083,6,House,83,1801-02-20,,50,53,"TO ADOPT THE RESOLUTION THAT THE POWER OF THE SPEAKER, OR CHAIRMAN OF THE COMMITTEE OF THE WHOLE, SHALL NOT BE CONSTRUED TO EXTEND (EXCEPT IN SPECIFIC SITUATIONS) TO THE EXPULSION OF ANY PERSON.",,,Internal Organization,,Miscellaneous Policy,-7.944125248343121,1.6186574254136536,0.203,0.006,0.706,0.514,0.959,0.98,-3.146273,
2016-10-18 10:30:10,RH0060084,6,House,84,1801-02-20,,49,53,"TO ORDER ENGROSSMENT AND THIRD READING OF H.R. 309, A BILL TO REPEAL PART OF AN ACT ENTITLED ""AN ACT IN ADDITION TO THE ACT ENTITLED ""AN ACT FOR THE PUNISHMENT OF CERTAIN CRIMES AGAINST THE UNITED STATES' AND TO CONTINUE IN FORCE THE RESIDUE OF THE SAME""  (P",,,Domestic Social Policy,,Civil Liberties,-14.29855026796917,4.682208540841549,0.339,-0.165,-0.712,-0.288,0.959,0.98,-3.211759,
2016-10-18 10:30:10,RH0060085,6,House,85,1801-02-24,,56,36,"TO PASS S. 68, AN ACT CONCERNING THE DISTRICT OF COLUMBIA. (P. 1052)",,,Government Organization,D. C.,Government Management,6.688393484207284,-0.7596055189254793,0.258,0.966,-0.207,0.179,0.694,0.879,-25.238727,
2016-10-18 10:30:10,RH0060086,6,House,86,1801-02-26,,48,49,"TO AMEND H.R. 306, A BILL TO PROVIDE FOR A NAVAL PEACE ESTABLISHMENT AND FOR OTHER PURPOSES, BY ELIMINATING THE SECTION TO PAY CERTAIN OFFICERS HALF THEIR MONTHLY PAY IF UNEMPLOYED UPON THE REDUCTION OF THE NAVY, ON CERTAIN CONDITIONS.  (P. 1057)",,,Defense Policy Budget,,Foreign and Defense Policy,-5.221487678460053,1.2886066290811926,0.233,0.072,0.678,0.751,0.936,0.969,-4.741988,
2016-10-18 10:30:10,RH0060087,6,House,87,1801-02-26,,53,40,"TO AMEND H.R. 306, BY GIVING THE PRESIDENT AUTHORITY TO DISCHARGE ANY PART OF THE MARINE CORPS WHICH MAY BE UNNECESSARY FOR THE NAVAL SERVICE.  (P. 1057)",,,Defense Policy Budget,,Foreign and Defense Policy,20.57338757657715,-9.159157471576831,0.445,-0.004,1.245,-0.35,0.8,0.913,-13.595431,
2016-10-18 10:30:10,RH0060088,6,House,88,1801-02-26,,70,27,TO ORDER ENGROSSMENT AND THIRD READING OF H.R. 306. (P. 1058),,,Defense Policy Budget,,Foreign and Defense Policy,6.874049769644415,-4.463109544740337,0.674,0.17,0.145,-0.122,0.407,0.833,-38.716871,
2016-10-18 10:30:10,RH0060089,6,House,89,1801-02-27,,49,42,"TO ORDER ENGROSSMENT AND THIRD READING OF H.R. 291, A BILL TO AMEND AND CONTINUE IN FORCE ""AN ACT TO ESTABLISH A UNIFORM SYSTEM OF BANKRUPTCY THROUGHOUT THE UNITED STATES"".",,,Domestic Social Policy,,Civil Liberties,-7.1224019824355835,0.9929930914180307,0.147,-0.054,-0.681,-0.553,0.927,0.967,-6.753886,
2016-10-18 10:30:10,RH0060090,6,House,90,1801-02-27,,69,18,TO PASS H.R. 306.  (P. 1061),,,Defense Policy Budget,,Foreign and Defense Policy,6.800209402212917,-4.5687386242649515,0.662,-0.067,0.194,-0.165,0.389,0.872,-26.975586,
2016-10-18 10:30:10,RH0060091,6,House,91,1801-02-28,,50,42,"TO RECOMMIT THE FOURTH SECTION OF H.R. 291, AN ACT TO AMEND AND CONTINUE IN FORCE ""AN ACT TO ESTABLISH A UNIFORM SYSTEM OF BANKRUPTCY THROUGHOUT THE UNITED STATES,"" TO COMMITTEE FOR RECONSIDERATION AND DISCUSSION.",,,Domestic Social Policy,,Civil Liberties,-3.9666854178814734,1.2231394462293603,0.326,-0.07,0.62,0.904,0.905,0.956,-7.250344,
2016-10-18 10:30:10,RH0060092,6,House,92,1801-03-02,,34,49,"TO AMEND THE SENATE AMENDMENT TO H.R. 270, IN ORDER TO INCREASE THE AMOUNT APPROPRIATED.  (P. 1071)",,,Government Organization,,Miscellaneous Policy,6.381995315265589,-2.857474510254457,0.318,-0.828,-0.192,0.174,0.735,0.89,-23.873956,
2016-10-18 10:30:10,RH0060093,6,House,93,1801-03-02,,46,33,TO AGREE TO CERTAIN AMENDMENTS TO H.R. 270 THAT WERE MADE AT THE CLERKS DESK.,,,Government Organization,,Miscellaneous Policy,2.6968860119108626,-1.4896617473262057,0.783,0.622,0.166,-0.356,0.394,0.744,-35.422086,
2016-10-18 10:30:10,RH0060094,6,House,94,1801-03-03,,39,28,TO AGREE TO THE RESOLUTION TO AUTHORIZE THE CLERK OF THE HOUSE TO PAY TO THE DOORKEEPER AND SERGEANT OF ARMS $200 EACH FOR EXTRA SERVICES.  (P. 1074),,,Internal Organization,Budget Special Interest,Miscellaneous Policy,110.41577122149837,-8.234598612833876,0.076,0.157,-0.21,0.011,0.679,0.864,-17.893857,
2016-10-18 10:30:10,RH0060095,6,House,95,1801-03-03,,38,40,"TO PASS THE RESOLUTION THAT THERE DOES NOT APPEAR CAUSE FOR FURTHER PROCEEDINGS ON THE MATTER OF COMPLAINT FOR MALADMINISTRATION AGAINST WINTHROP SARGEANT, GOVERNOR OF THE MISSISSIPPI TERRITORY.",,,Government Organization,,Government Management,-8.693944255111004,2.2939983356861924,0.281,-0.149,-0.708,-0.471,1.0,1.0,-0.905504,
2016-10-18 10:30:10,RH0060096,6,House,96,1801-03-03,,40,35,TO PASS THE RESOLUTION THAT THE THANKS OF THE HOUSE BE PRESENTED TO THEODORE SEDGWICK FOR HIS CONDUCT AS SPEAKER OF THE HOUSE.  (P. 1079),,,Internal Organization,,Miscellaneous Policy,-8.675524881689158,2.2089609443574925,0.259,-0.038,-0.705,-0.47,1.0,1.0,-1.007811,
