date_generated,id,congress,chamber,rollnumber,date,keyvote,yea,nay,description,Issue1,Issue2,Peltzman1,Peltzman2,Clausen1,slope,intercept,mid.dim1,mid.dim2,spread.dim1,spread.dim2,pre,classified,log_likelihood
2017-01-22 01:59:02,RS1130303,113,Senate,303,2014-01-16,,72,26,"Making consolidated appropriations for the fiscal year ending September 30, 2014, and for other purposes.",,,Budget General Interest,,Government Management,7.295208460706552,-2.9382642181254472,0.404,0.009,0.695,-0.551,0.654,0.908,-16.422384
2017-01-22 01:59:02,RS1130304,113,Senate,304,2014-01-16,,73,26,"Making consolidated appropriations for the fiscal year ending September 30, 2014, and for other purposes.",,,Budget General Interest,,Government Management,7.726210647323425,-3.1081871038178086,0.423,0.16,0.704,-0.527,0.654,0.909,-15.842307
2017-01-22 01:59:02,RS1130305,113,Senate,305,2014-01-27,,86,13,"A bill to delay the implementation of certain provisions of the Biggert-Waters Flood Insurance Reform Act of 2012 and to reform the National Association of Registered Agents and Brokers, and for other purposes.",Public Safety,,Budget Special Interest,Regulation Special Interest,Government Management,-5.380404933404742,3.959231463644345,0.621,0.618,1.601,1.721,0.231,0.899,-23.435738
2017-01-22 01:59:02,RS1130306,113,Senate,306,2014-01-29,,64,35,"A bill to delay the implementation of certain provisions of the Biggert-Waters Flood Insurance Reform Act of 2012 and to reform the National Association of Registered Agents and Brokers, and for other purposes.",Public Safety,,Budget Special Interest,Regulation Special Interest,Government Management,4.238532581086696,-1.1535963571219416,0.057,-0.912,0.299,-0.408,0.857,0.949,-17.236026
2017-01-22 01:59:02,RS1130307,113,Senate,307,2014-01-30,,34,65,To adjust phase-ins of flood insurance rate increases.,Public Safety,,Budget Special Interest,Regulation Special Interest,Government Management,4.03417052624217,-1.0161366821049687,0.004,-1.0,-0.196,0.281,0.706,0.899,-24.408902
2017-01-22 01:59:02,RS1130308,113,Senate,308,2014-01-30,,24,75,To allow States to opt-out of participation in the National Association of Registered Agents and Brokers.,Public Safety,,Budget Special Interest,Regulation Special Interest,Government Management,-79.63686942678765,37.21204932804196,0.457,0.818,-0.179,-0.013,0.458,0.869,-33.866015
2017-01-22 01:59:02,RS1130309,113,Senate,309,2014-01-30,,49,50,To clarify that any private flood insurance policy accepted by a State shall satisfy the mandatory purchase requirement under the Flood Disaster Protection Act of 1973.,Public Safety,,Budget Special Interest,Regulation Special Interest,Government Management,36.685076642571296,1.5030329124177093,-0.038,0.109,-0.222,0.035,0.878,0.939,-17.415652
2017-01-22 01:59:02,RS1130310,113,Senate,310,2014-01-30,,67,32,"A bill to delay the implementation of certain provisions of the Biggert-Waters Flood Insurance Reform Act of 2012 and to reform the National Association of Registered Agents and Brokers, and for other purposes.",Public Safety,,Budget Special Interest,Regulation Special Interest,Government Management,4.024479597894693,-1.2740146540547297,0.164,-0.614,0.167,-0.24,0.625,0.879,-28.537884
2017-01-22 01:59:02,RS1130311,113,Senate,311,2014-02-03,,72,22,"A bill to provide for the reform and continuation of agricultural and other programs of the Department of Agriculture through fiscal year 2018, and for other purposes.",Agriculture,Food Stamps/Food Programs,Budget Special Interest,,Agriculture,2.195127307798137,-1.0877596596857613,0.665,0.372,0.23,-0.606,0.591,0.904,-27.485743
2017-01-22 01:59:02,RS1130312,113,Senate,312,2014-02-04,CQ,69,32,"A bill to provide for the reform and continuation of agricultural and other programs of the Department of Agriculture through fiscal year 2018, and for other purposes.",Agriculture,Food Stamps/Food Programs,Budget Special Interest,,Agriculture,1.8418806671893904,-0.8106669204077245,0.78,0.626,0.207,-0.65,0.437,0.822,-42.971884
2017-01-22 01:59:02,RS1130313,113,Senate,313,2014-02-04,,98,0,Relating to extension and modification of emergency unemployment compensation program.,Unemployment/Jobs,,Domestic Social Policy,Budget Special Interest,Social Welfare,,,0.0,0.0,0.0,0.0,,,0.0
2017-01-22 01:59:02,RS1130314,113,Senate,314,2014-02-06,,58,40,Of a perfecting nature.,Unemployment/Jobs,,Domestic Social Policy,Budget Special Interest,Social Welfare,-3.5092010757394356,0.5253002689348589,0.25,-0.352,0.27,0.445,0.9,0.959,-11.675952
2017-01-22 01:59:02,RS1130315,113,Senate,315,2014-02-06,,56,43,"A bill to provide for the extension of certain unemployment benefits, and for other purposes.",Unemployment/Jobs,,Domestic Social Policy,Budget Special Interest,Social Welfare,-12.97117312407894,0.9229821186855258,0.07,0.015,0.231,0.103,0.93,0.97,-11.181524
2017-01-22 01:59:02,RS1130316,113,Senate,316,2014-02-06,,97,0,"Max Sieben Baucus, of Montana, to be Ambassador to the People's Republic of China",,,Government Organization,,Government Management,,,0.0,0.0,0.0,0.0,,,0.0
2017-01-22 01:59:02,RS1130317,113,Senate,317,2014-02-10,,94,0,A bill to repeal section 403 of the Bipartisan Budget Act of 2013.,Military Pensions/Veterans Benefits,,Defense Policy Budget,,Foreign and Defense Policy,,,0.0,0.0,0.0,0.0,,,0.0
2017-01-22 01:59:02,RS1130318,113,Senate,318,2014-02-11,,91,8,"Richard Stengel, of New York, to be Under Secretary of State for Public Diplomacy",,,Foreign Policy Resolutions,,Foreign and Defense Policy,-3.080417092174754,1.8997684643898243,0.308,0.951,1.462,2.745,-0.125,0.909,-23.134518
2017-01-22 01:59:02,RS1130319,113,Senate,319,2014-02-11,,98,1,"Sarah Sewall, of Massachusetts, to be an Under Secretary of State (Civilian Security, Democracy, and Human Rights)",,,Foreign Policy Resolutions,,Foreign and Defense Policy,,,0.0,0.0,0.0,0.0,,,0.0
2017-01-22 01:59:02,RS1130320,113,Senate,320,2014-02-11,,93,6,"Charles Hammerman Rivkin, of the District of Columbia, to be an Assistant Secretary of State (Economic and Business Affairs)",,,Foreign Policy Resolutions,,Foreign and Defense Policy,-1.4722961728613058,1.354158485808246,0.265,0.964,0.935,3.673,0.167,0.949,-17.673285
2017-01-22 01:59:02,RS1130321,113,Senate,321,2014-02-12,,99,0,"Tina S. Kaidanow, of the District of Columbia, to be Coordinator for Counterterrorism, with the rank and status of Ambassador at Large",,,Foreign Policy Resolutions,,Foreign and Defense Policy,,,0.0,0.0,0.0,0.0,,,0.0
2017-01-22 01:59:02,RS1130322,113,Senate,322,2014-02-12,,99,0,"Daniel Bennett Smith, of Virginia, to be an Assistant Secretary of State (Intelligence and Research)",,,Foreign Policy Resolutions,,Foreign and Defense Policy,,,0.0,0.0,0.0,0.0,,,0.0
2017-01-22 01:59:02,RS1130323,113,Senate,323,2014-02-12,,98,0,"Catherine Ann Novelli, of Virginia, to be United States Alternate Governor of the International Bank for Reconstruction and Development for a term of five years; United States Alternate Governor of the Inter-American Development Bank for a term of five yars",,,Foreign Policy Resolutions,,Foreign and Defense Policy,,,0.0,0.0,0.0,0.0,,,0.0
2017-01-22 01:59:02,RS1130324,113,Senate,324,2014-02-12,CQ,67,31,"An act to temporarily extend the public debt limit, and for other purposes.",Debt Ceilings,,Budget General Interest,,Government Management,-6.869958789560958,2.2755119227539478,0.196,0.929,0.234,0.197,0.645,0.888,-22.97557
2017-01-22 01:59:02,RS1130325,113,Senate,325,2014-02-12,,55,43,"An act to temporarily extend the public debt limit, and for other purposes.",Debt Ceilings,,Budget General Interest,,Government Management,5.622554248836669,-0.31296086798138667,0.016,-0.223,0.663,-0.682,1.0,1.0,-0.173896
2017-01-22 01:59:02,RS1130326,113,Senate,326,2014-02-12,,95,3,"An act to ensure that the reduced annual cost-of-living adjustment to the retired pay of members and former members of the Armed Forces under the age of 62 required by the Bipartisan Budget Act of 2013 will not apply to members or former members who firs became members prior to January 1, 2014, and for other purposes.",Military Pensions/Veterans Benefits,,Defense Policy Budget,,Foreign and Defense Policy,5.093094209150849,-4.726250259281518,0.905,-0.117,0.236,-0.268,-0.333,0.959,-15.403363
2017-01-22 01:59:02,RS1130327,113,Senate,327,2014-02-24,,55,37,"Jeffrey Alker Meyer, of Connecticut, to be United States District Judge for the District of Connecticut",Judiciary,,Government Organization,,Government Management,-40.54034583078644,8.833440924404028,0.234,-0.653,0.743,0.106,0.973,0.989,-3.38748
2017-01-22 01:59:02,RS1130328,113,Senate,328,2014-02-24,,92,2,"Jeffrey Alker Meyer, of Connecticut, to be United States District Judge for the District of Connecticut",Judiciary,,Government Organization,,Government Management,,,0.0,0.0,0.0,0.0,,,0.0
2017-01-22 01:59:02,RS1130329,113,Senate,329,2014-02-24,,58,34,"James Maxwell Moody, Jr., of Arkansas, to be United States District Judge for the Eastern District of Arkansas",Judiciary,,Government Organization,,Government Management,-45.3456832936438,11.54242082341095,0.25,0.206,1.129,0.144,0.912,0.967,-8.428339
2017-01-22 01:59:02,RS1130330,113,Senate,330,2014-02-25,,96,4,"James Maxwell Moody, Jr., of Arkansas, to be United States District Judge for the Eastern District of Arkansas",Judiciary,,Government Organization,,Government Management,-1.5843492912285813,1.2996115570810933,0.766,0.086,0.392,1.431,0.25,0.97,-12.505643
2017-01-22 01:59:02,RS1130331,113,Senate,331,2014-02-25,,55,42,"James Donato, of California, to be United States District Judge for the Northern District of California",Judiciary,,Government Organization,,Government Management,-30.323025062665913,5.703574087721181,0.203,-0.452,0.734,0.14,0.976,0.99,-1.481596
2017-01-22 01:59:02,RS1130332,113,Senate,332,2014-02-25,,91,5,"James Donato, of California, to be United States District Judge for the Northern District of California",Judiciary,,Government Organization,,Government Management,-1.5133775655684942,1.2213809908811515,0.776,0.047,0.387,1.479,0.2,0.958,-14.059198
2017-01-22 01:59:02,RS1130333,113,Senate,333,2014-02-25,,56,42,"Beth Labson Freeman, of California, to be United States District Judge for the Northern District of California",Judiciary,,Government Organization,,Government Management,-28.258532947962898,5.266740721384431,0.204,-0.498,0.728,0.149,0.976,0.99,-1.48705
2017-01-22 01:59:02,RS1130334,113,Senate,334,2014-02-25,,92,7,"Beth Labson Freeman, of California, to be United States District Judge for the Northern District of California",Judiciary,,Government Organization,,Government Management,-2.5215448334990844,2.0412850239239995,0.547,0.662,0.143,0.328,0.143,0.939,-23.498466
2017-01-22 01:59:02,RS1130335,113,Senate,335,2014-02-25,,99,0,"A bill to improve the provision of medical services and benefits to veterans, and for other purposes.",Military Pensions/Veterans Benefits,,Defense Policy Budget,,Foreign and Defense Policy,,,0.0,0.0,0.0,0.0,,,0.0
2017-01-22 01:59:02,RS1130336,113,Senate,336,2014-02-25,,44,52,"A bill to improve the provision of medical services and benefits to veterans, and for other purposes.",Military Pensions/Veterans Benefits,,Defense Policy Budget,,Foreign and Defense Policy,5.774866664132519,-0.33076953322943325,0.041,-0.094,-0.655,0.656,1.0,1.0,-0.156067
2017-01-22 01:59:02,RS1130337,113,Senate,337,2014-02-25,,56,41,"A bill to improve the provision of medical services and benefits to veterans, and for other purposes.",Military Pensions/Veterans Benefits,,Defense Policy Budget,,Foreign and Defense Policy,9.18159716645436,-1.599237143799152,0.161,-0.121,0.254,-0.16,0.927,0.969,-9.49023
2017-01-22 01:59:02,RS1130338,113,Senate,338,2014-02-27,,98,0,"Michael L. Connor, of New Mexico, to be Deputy Secretary of the Interior",Parks and Conservation,,Government Organization,,Government Management,,,0.0,0.0,0.0,0.0,,,0.0
2017-01-22 01:59:02,RS1130339,113,Senate,339,2014-03-05,CQ,48,52,"Debo P. Adegbile, of New York, to be an Assistant Attorney General",Judiciary,,Government Organization,,Government Management,-4.828728090243655,-0.6171603055927004,0.071,-0.96,0.895,1.072,0.875,0.94,-14.465381
2017-01-22 01:59:02,RS1130340,113,Senate,340,2014-03-05,,57,41,"Pedro A. Delgado Hernandez, of Puerto Rico, to be United States District Judge for the District of Puerto Rico",Judiciary,,Government Organization,,Government Management,-27.66274819731587,5.183875135857806,0.202,-0.404,0.727,0.152,0.976,0.99,-1.468801
2017-01-22 01:59:02,RS1130341,113,Senate,341,2014-03-05,,99,0,"Pedro A. Delgado Hernandez, of Puerto Rico, to be United States District Judge for the District of Puerto Rico",Judiciary,,Government Organization,,Government Management,,,0.0,0.0,0.0,0.0,,,0.0
2017-01-22 01:59:02,RS1130342,113,Senate,342,2014-03-05,,62,37,"Pamela L. Reeves, of Tennessee, to be United States District Judge for the Eastern District of Tennessee",Judiciary,,Government Organization,,Government Management,-3.1142909831704673,0.5830278812046688,-0.131,0.991,0.336,0.624,0.838,0.939,-13.309137
2017-01-22 01:59:02,RS1130343,113,Senate,343,2014-03-05,,100,0,"Pamela L. Reeves, of Tennessee, to be United States District Judge for the Eastern District of Tennessee",Judiciary,,Government Organization,,Government Management,,,0.0,0.0,0.0,0.0,,,0.0
2017-01-22 01:59:02,RS1130344,113,Senate,344,2014-03-05,,59,41,"Timothy L. Brooks, of Arkansas, to be United States District Judge for the Western District of Arkansas",Judiciary,,Government Organization,,Government Management,-6.814882594401819,1.0681488259440182,0.01,1.0,0.304,0.258,0.927,0.97,-11.459505
2017-01-22 01:59:02,RS1130345,113,Senate,345,2014-03-05,,101,0,"Timothy L. Brooks, of Arkansas, to be United States District Judge for the Western District of Arkansas",Judiciary,,Government Organization,,Government Management,,,0.0,0.0,0.0,0.0,,,0.0
2017-01-22 01:59:02,RS1130346,113,Senate,346,2014-03-05,,57,43,"Vince Girdhari Chhabria, of California, to be United States District Judge for the Northern District of California",Judiciary,,Government Organization,,Government Management,-28.152365510117136,5.219082564063895,0.204,-0.524,0.735,0.151,0.977,0.99,-1.501795
2017-01-22 01:59:02,RS1130347,113,Senate,347,2014-03-05,,59,41,"Vince Girdhari Chhabria, of California, to be United States District Judge for the Northern District of California",Judiciary,,Government Organization,,Government Management,-7.50401239766544,1.7057077316972973,0.301,-0.553,0.711,0.548,0.976,0.99,-3.763101
2017-01-22 01:59:02,RS1130348,113,Senate,348,2014-03-05,,55,45,"Rose Eilene Gottemoeller, of Virginia, to be Under Secretary of State for Arms Control and International Security",Arms Control,,Foreign Policy Resolutions,,Foreign and Defense Policy,-5.4374768624671495,0.5331187528661303,0.27,-0.935,0.267,0.284,0.889,0.95,-15.159508
2017-01-22 01:59:02,RS1130349,113,Senate,349,2014-03-06,,59,42,"Rose Eilene Gottemoeller, of Virginia, to be Under Secretary of State for Arms Control and International Security",Arms Control,,Foreign Policy Resolutions,,Foreign and Defense Policy,-2.7883150773288947,0.25841658827238617,-0.087,0.501,0.202,0.419,0.786,0.911,-21.721961
2017-01-22 01:59:02,RS1130350,113,Senate,350,2014-03-06,CQ,55,45,"A bill to reform procedures for determinations to proceed to trial by court-martial for certain offenses under the Uniform Code of Military Justice, and for other purposes.",Judiciary,,Foreign Policy Budget,,Foreign and Defense Policy,-5.679472745370079,0.10768172446763769,-0.155,0.988,0.109,0.111,0.533,0.79,-49.534256
2017-01-22 01:59:02,RS1130351,113,Senate,351,2014-03-06,,100,0,A bill to provide for additional enhancements of the sexual assault prevention and response activities of the Armed Forces.,Women's Equality,Judiciary,Foreign Policy Budget,Defense Policy Budget,Foreign and Defense Policy,,,0.0,0.0,0.0,0.0,,,0.0
2017-01-22 01:59:02,RS1130352,113,Senate,352,2014-03-10,,62,34,"Carolyn B. McHugh, of Utah, to be United States Circuit Judge for the Tenth Circuit",Judiciary,,Government Organization,,Government Management,-2.120683859968461,0.5063288669469701,-0.221,0.975,0.396,1.08,0.824,0.938,-14.886314
2017-01-22 01:59:02,RS1130353,113,Senate,353,2014-03-10,,97,0,A bill to provide for additional enhancements of the sexual assault prevention and response activities of the Armed Forces.,Women's Equality,Judiciary,Foreign Policy Budget,Defense Policy Budget,Foreign and Defense Policy,,,0.0,0.0,0.0,0.0,,,0.0
2017-01-22 01:59:02,RS1130354,113,Senate,354,2014-03-11,,55,43,"Matthew Frederick Leitman, of Michigan, to be United States District Judge for the Eastern District of Michigan",Judiciary,,Government Organization,,Government Management,-29.15610188549416,5.412844784640808,0.204,-0.535,0.736,0.146,0.977,0.99,-1.506852
2017-01-22 01:59:02,RS1130355,113,Senate,355,2014-03-11,,56,42,"Judith Ellen Levy, of Michigan, to be United States District Judge for the Eastern District of Michigan",Judiciary,,Government Organization,,Government Management,-28.340047946851254,5.267709829104507,0.205,-0.542,0.735,0.15,0.976,0.99,-1.506774
2017-01-22 01:59:02,RS1130356,113,Senate,356,2014-03-11,,56,43,"Laurie J. Michelson, of Michigan, to be United States District Judge for the Eastern District of Michigan",Judiciary,,Government Organization,,Government Management,-24.715158093184233,4.540607409102767,0.205,-0.526,0.735,0.172,0.977,0.99,-1.496021
2017-01-22 01:59:02,RS1130357,113,Senate,357,2014-03-11,,56,42,"Linda Vivienne Parker, of Michigan, to be United States District Judge for the Eastern District of Michigan",Judiciary,,Government Organization,,Government Management,-28.152365510117136,5.219082564063895,0.204,-0.524,0.735,0.151,0.976,0.99,-1.501782
2017-01-22 01:59:02,RS1130358,113,Senate,358,2014-03-12,,99,0,"Carolyn B. McHugh, of Utah, to be United States Circuit Judge for the Tenth Circuit",Judiciary,,Government Organization,,Government Management,,,0.0,0.0,0.0,0.0,,,0.0
2017-01-22 01:59:02,RS1130359,113,Senate,359,2014-03-12,,99,0,"Matthew Frederick Leitman, of Michigan, to be United States District Judge for the Eastern District of Michigan",Judiciary,,Government Organization,,Government Management,,,0.0,0.0,0.0,0.0,,,0.0
2017-01-22 01:59:02,RS1130360,113,Senate,360,2014-03-12,,98,0,"Judith Ellen Levy, of Michigan, to be United States District Judge for the Eastern District of Michigan",Judiciary,,Government Organization,,Government Management,,,0.0,0.0,0.0,0.0,,,0.0
2017-01-22 01:59:02,RS1130361,113,Senate,361,2014-03-12,,99,0,"Laurie J. Michelson, of Michigan, to be United States District Judge for the Eastern District of Michigan",Judiciary,,Government Organization,,Government Management,,,0.0,0.0,0.0,0.0,,,0.0
2017-01-22 01:59:02,RS1130362,113,Senate,362,2014-03-12,,61,37,"Linda Vivienne Parker, of Michigan, to be United States District Judge for the Eastern District of Michigan",Judiciary,,Government Organization,,Government Management,-7.303317678180154,1.797364944599817,0.11,0.994,0.322,0.255,0.838,0.939,-14.418016
2017-01-22 01:59:02,RS1130363,113,Senate,363,2014-03-12,,98,0,"To require the Secretary of Health and Human Services, in conjunction with the Secretary of Education, to conduct a review of Federal early learning and care programs and make recommendations for streamlining the various programs.","Children (aid, infant mortality, etc.)",,Government Organization,,Social Welfare,,,0.0,0.0,0.0,0.0,,,0.0
2017-01-22 01:59:02,RS1130364,113,Senate,364,2014-03-12,,93,6,To reserve not less than 2 percent of the amount appropriated under the Child Care and Development Block Grant Act of 1990 in each fiscal year for payments to Indian tribes and tribal organizations.,"Children (aid, infant mortality, etc.)",,Budget Special Interest,Indian Affairs,Social Welfare,-28.254183741673,26.080661798464256,0.935,-0.337,1.744,0.357,0.0,0.939,-14.015532
2017-01-22 01:59:02,RS1130365,113,Senate,365,2014-03-12,,98,0,To require a statewide child care disaster plan.,"Children (aid, infant mortality, etc.)",,Budget Special Interest,,Social Welfare,,,0.0,0.0,0.0,0.0,,,0.0
2017-01-22 01:59:02,RS1130366,113,Senate,366,2014-03-13,,100,0,"To establish a $1,000,000 asset limit for eligibility for child care assistance.","Children (aid, infant mortality, etc.)",,Budget Special Interest,,Social Welfare,,,0.0,0.0,0.0,0.0,,,0.0
2017-01-22 01:59:02,RS1130367,113,Senate,367,2014-03-13,,96,4,"Caroline Diane Krass, of the District of Columbia, to be General Counsel of the Central Intelligence Agency",CIA/Spying/Intelligence,,Government Organization,,Government Management,4.241790735717099,-4.037328059967,0.965,0.056,1.337,-1.823,-0.25,0.95,-9.244065
2017-01-22 01:59:02,RS1130368,113,Senate,368,2014-03-13,,96,2,"A bill to reauthorize and improve the Child Care and Development Block Grant Act of 1990, and for other purposes.","Children (aid, infant mortality, etc.)",,Budget Special Interest,,Social Welfare,,,0.0,0.0,0.0,0.0,,,0.0
2017-01-22 01:59:02,RS1130369,113,Senate,369,2014-03-13,,72,22,"A bill to delay the implementation of certain provisions of the Biggert-Waters Flood Insurance Reform Act of 2012, and for other purposes.",Public Safety,,Budget Special Interest,Regulation Special Interest,Government Management,-4.984621752198596,2.385325012668373,0.304,0.87,0.131,0.152,0.182,0.809,-35.225502
2017-01-22 01:59:02,RS1130370,113,Senate,370,2014-03-24,,78,17,"An original bill to support sovereignty and democracy in Ukraine, and for other purposes.",,,Foreign Policy Budget,,Foreign and Defense Policy,-2.0574742069142595,1.1665066946263916,0.322,0.504,0.868,2.44,0.529,0.916,-21.671943
2017-01-22 01:59:02,RS1130371,113,Senate,371,2014-03-26,,56,43,"Christopher Reid Cooper, of the District of Columbia, to be United States District Judge for the District of Columbia",Judiciary,,Government Organization,,Government Management,-25.83141968862866,4.788778196791618,0.203,-0.455,0.728,0.163,0.977,0.99,-1.481333
2017-01-22 01:59:02,RS1130372,113,Senate,372,2014-03-26,,56,43,"M. Douglas Harpool, of Missouri, to be United States District Judge for the Western District of Missouri",Judiciary,,Government Organization,,Government Management,-25.83141968862866,4.788778196791618,0.203,-0.455,0.728,0.163,0.977,0.99,-1.481333
2017-01-22 01:59:02,RS1130373,113,Senate,373,2014-03-26,,56,43,"Gerald Austin McHugh, Jr., of Pennsylvania, to be United States District Judge for the Eastern District of Pennsylvania",Judiciary,,Government Organization,,Government Management,-2.814982049097368,0.21768229771553682,-0.128,0.578,0.293,0.602,0.837,0.929,-13.595281
2017-01-22 01:59:02,RS1130374,113,Senate,374,2014-03-26,,75,23,"Edward G. Smith, of Pennsylvania, to be United States District Judge for the Eastern District of Pennsylvania",Judiciary,,Government Organization,,Government Management,-6.490087316072805,3.2078025688951564,0.373,0.787,0.147,0.131,0.13,0.796,-35.676558
2017-01-22 01:59:02,RS1130375,113,Senate,375,2014-03-26,,101,0,"Christopher Reid Cooper, of the District of Columbia, to be United States District Judge for the District of Columbia",Judiciary,,Government Organization,,Government Management,,,0.0,0.0,0.0,0.0,,,0.0
2017-01-22 01:59:02,RS1130376,113,Senate,376,2014-03-26,,94,5,"M. Douglas Harpool, of Missouri, to be United States District Judge for the Western District of Missouri",Judiciary,,Government Organization,,Government Management,-13.81863374240885,13.807810137499942,0.988,0.155,1.866,0.781,0.0,0.949,-14.848904
2017-01-22 01:59:02,RS1130377,113,Senate,377,2014-03-26,,60,41,"Gerald Austin McHugh, Jr., of Pennsylvania, to be United States District Judge for the Eastern District of Pennsylvania",Judiciary,,Government Organization,,Government Management,-2.6207314746769335,0.3200658708739069,-0.074,0.514,0.232,0.512,0.805,0.921,-17.939141
2017-01-22 01:59:02,RS1130378,113,Senate,378,2014-03-26,,70,31,"Edward G. Smith, of Pennsylvania, to be United States District Judge for the Eastern District of Pennsylvania",Judiciary,,Government Organization,,Government Management,-7.686701615604157,-2.359919589193144,-0.179,-0.984,-0.206,-0.155,0.387,0.812,-35.05768
2017-01-22 01:59:02,RS1130379,113,Senate,379,2014-03-27,,98,2,In the nature of a substitute.,,,Foreign Policy Budget,,Foreign and Defense Policy,,,0.0,0.0,0.0,0.0,,,0.0
2017-01-22 01:59:02,RS1130380,113,Senate,380,2014-03-27,,54,44,"John B. Owens, of California, to be United States Circuit Judge for the Ninth Circuit",Judiciary,,Government Organization,,Government Management,5.343097964992308,-0.2984602735449,0.013,-0.229,0.667,-0.722,1.0,1.0,-0.183123
2017-01-22 01:59:02,RS1130381,113,Senate,381,2014-03-27,,66,34,A bill to amend the Internal Revenue Code of 1986 to ensure that emergency services volunteers are not taken into account as employees under the shared responsibility requirements contained in the Patient Protection and Affordable Care Act.,Unemployment/Jobs,,Domestic Social Policy,Budget Special Interest,Social Welfare,-2.2805997912788554,0.5832922235854894,-0.113,0.841,0.444,1.126,0.794,0.93,-13.506028
2017-01-22 01:59:02,RS1130382,113,Senate,382,2014-03-31,,57,43,"John B. Owens, of California, to be United States Circuit Judge for the Ninth Circuit",Judiciary,,Government Organization,,Government Management,3.7461455518615634,-0.3901090028058729,-0.158,-0.982,0.41,-0.633,0.953,0.98,-8.742515
2017-01-22 01:59:02,RS1130383,113,Senate,383,2014-03-31,,64,35,"A bill to amend the Social Security Act to extend Medicare payments to physicians and other provisions of the Medicare and Medicaid programs, and for other purposes.",Welfare,,Domestic Social Policy,Budget Special Interest,Social Welfare,-5.282734311159803,1.3932050733369852,0.075,0.997,0.232,0.254,0.771,0.919,-21.714662
