date_generated,id,congress,chamber,rollnumber,date,keyvote,yea,nay,description,Issue1,Issue2,Peltzman1,Peltzman2,Clausen1,mid.dim1,mid.dim2,spread.dim1,spread.dim2,pre,classified,log_likelihood,geo_mean_probability
2017-01-23 00:25:07,RH0360001,36,House,1,1859-12-05,,99,131,TO ADJOURN UNTIL TOMORROW AT 12 O'CLOCK AS A SPEAKER WAS NOT ELECTED.  (P. 2-3),,,Internal Organization,,Miscellaneous Policy,-0.25,-0.311,0.247,-0.569,0.798,0.913,-39.004293,0.844
2017-01-23 00:25:07,RH0360002,36,House,2,1859-12-05,,113,115,TO ADJOURN.  (P. 3),,,Internal Organization,,Miscellaneous Policy,0.087,0.154,0.26,-0.48,0.912,0.956,-29.941903,0.877
2017-01-23 00:25:07,RH0360003,36,House,3,1859-12-06,,116,116,"TO TABLE A RESOLUTION REGARDING SLAVERY, IN ORDER TO DEFEAT ANY ATTEMPT TO INJECT THE SLAVERY QUESTION INTO CONGRESS, WHILE THE HOUSE IS ABOUT TO VOTE FOR A SPEAKER.",Slavery,,Internal Organization,,Miscellaneous Policy,0.08,0.038,-0.622,1.28,0.966,0.983,-9.888872,0.958
2017-01-23 00:25:07,RH0360004,36,House,4,1859-12-06,,68,163,"TO ADJOURN, UNTIL A MORE QUIET SESSION.  (P. 25-1)",,,Internal Organization,,Miscellaneous Policy,0.383,0.806,0.085,-0.466,0.162,0.753,-95.90385,0.66
2017-01-23 00:25:07,RH0360005,36,House,5,1859-12-06,,107,122,TO ADJOURN.  (P. 25-2),,,Internal Organization,,Miscellaneous Policy,-0.047,-0.076,0.202,-0.404,0.85,0.93,-41.813728,0.833
2017-01-23 00:25:07,RH0360006,36,House,6,1859-12-09,,102,127,TO RECESS OVER THE WEEKEND WHEN THEY DO ADJOURN TODAY. (P. 87-2),,,Internal Organization,,Miscellaneous Policy,-0.157,-0.069,0.279,-0.889,0.873,0.943,-31.757587,0.871
2017-01-23 00:25:07,RH0360007,36,House,7,1859-12-09,,107,123,TO ADJOURN AS IT WAS IMPOSSIBLE TO ELECT A SPEAKER OF THE HOUSE TODAY.  (P. 87-2),,,Internal Organization,,Miscellaneous Policy,-0.024,0.081,0.256,-0.798,0.888,0.948,-30.498514,0.876
2017-01-23 00:25:07,RH0360008,36,House,8,1859-12-10,,115,113,TO ADJOURN AS IT WAS IMPOSSIBLE TO ELECT A SPEAKER TODAY. (P. 88-2),,,Internal Organization,,Miscellaneous Policy,0.143,0.196,0.596,-0.957,0.965,0.982,-13.876365,0.941
2017-01-23 00:25:07,RH0360009,36,House,9,1859-12-13,,112,107,TO ADJOURN BECAUSE OF THE LATE HOUR.  (P. 97-2),,,Internal Organization,,Miscellaneous Policy,0.038,-0.056,0.161,-0.28,0.804,0.904,-60.730627,0.758
2017-01-23 00:25:07,RH0360010,36,House,10,1859-12-13,,105,112,TO ADJOURN BECAUSE OF THE LATE HOUR.  (P. 120-3),,,Internal Organization,,Miscellaneous Policy,-0.154,-0.447,0.248,-0.494,0.886,0.945,-32.722272,0.86
2017-01-23 00:25:07,RH0360011,36,House,11,1859-12-14,,84,105,TO ADJOURN.  (P. 159),,,Internal Organization,,Miscellaneous Policy,-0.007,0.119,0.256,-0.76,0.869,0.942,-28.483505,0.86
2017-01-23 00:25:07,RH0360012,36,House,12,1859-12-14,,96,98,TO ADJOURN.  (P. 160),,,Internal Organization,,Miscellaneous Policy,0.172,0.405,0.294,-0.654,0.917,0.959,-24.11653,0.883
2017-01-23 00:25:07,RH0360013,36,House,13,1859-12-14,,84,80,TO ADJOURN BECAUSE OF THE LATE HOUR.,,,Internal Organization,,Miscellaneous Policy,0.074,0.012,0.556,-1.291,0.95,0.976,-7.610549,0.955
2017-01-23 00:25:07,RH0360014,36,House,14,1859-12-26,,74,123,TO ADJOURN BECAUSE OF THE LATE HOUR.  (P. 254-2),,,Internal Organization,,Miscellaneous Policy,-0.449,-0.438,0.199,-0.529,0.622,0.858,-57.185168,0.748
2017-01-23 00:25:07,RH0360015,36,House,15,1859-12-30,,107,104,"THAT WHEN THE HOUSE ADJOURNS TODAY, IT SHALL STAY ADJOURNED UNTIL TUESDAY NEXT SO AS TO HAVE A EXTRA WEEKEND. (P. 294-1)",,,Internal Organization,,Miscellaneous Policy,0.176,0.219,0.17,-0.537,0.808,0.905,-53.343194,0.777
2017-01-23 00:25:07,RH0360016,36,House,16,1859-12-30,,102,101,TO ADJOURN.,,,Internal Organization,,Miscellaneous Policy,0.149,0.264,0.172,-0.428,0.792,0.897,-53.32246,0.769
2017-01-23 00:25:07,RH0360017,36,House,17,1860-01-05,,90,106,TO ADJOURN.,,,Internal Organization,,Miscellaneous Policy,-0.049,0.018,0.272,-0.789,0.878,0.944,-25.520465,0.878
2017-01-23 00:25:07,RH0360018,36,House,18,1860-01-05,,124,90,TO DISPENSE WITH ALL FURTHER PROCEEDINGS UNDER THE ROLL CALL OF THE HOUSE AS A QUORUM WAS PRESENT.  (P. 347-2),,,Internal Organization,,Miscellaneous Policy,-0.121,0.04,-0.213,0.57,0.789,0.911,-41.202845,0.825
2017-01-23 00:25:07,RH0360019,36,House,19,1860-01-05,,76,135,"TO ADJOURN BECAUSE OF ABSENCE, DUE TO SICKNESS, OF A MEMBER ON THE REPUBLICAN SIDE OF THE HOUSE, WHOSE PAIRING WAS OBJECTED TO BY THE OTHER SIDE.  (P. 347-3)",,,Internal Organization,,Miscellaneous Policy,-0.064,0.338,0.16,-0.452,0.645,0.872,-59.258659,0.755
2017-01-23 00:25:07,RH0360020,36,House,20,1860-01-06,,122,94,THAT ALL FURTHER PROCEEDINGS BE DISPENSED WITH UNDER THE HOUSE CALL AS A QUORUM WAS PRESENT.,,,Internal Organization,,Miscellaneous Policy,-0.249,-0.238,-0.302,0.802,0.819,0.921,-31.17778,0.866
2017-01-23 00:25:07,RH0360021,36,House,21,1860-01-09,,210,5,TO PUT THE MAIN QUESTION ON PROCEEDING TO VOTE FOR A SPEAKER.,,,Internal Organization,,Miscellaneous Policy,0.0,0.0,0.0,0.0,,,0.0,
2017-01-23 00:25:07,RH0360022,36,House,22,1860-01-17,,108,106,TO PUT THE MAIN QUESTION ON THE MOTION TO VOTE FOR A SPEAKER VIVA VOCE.  (P. 372-3),,,Internal Organization,,Miscellaneous Policy,0.052,-0.016,0.554,-1.327,0.972,0.986,-9.495224,0.957
2017-01-23 00:25:07,RH0360023,36,House,23,1860-01-17,,106,109,TO ORDER A CALL OF THE HOUSE.  (P. 484-2),,,Internal Organization,,Miscellaneous Policy,0.047,0.051,0.493,-1.3,0.962,0.981,-12.495292,0.944
2017-01-23 00:25:07,RH0360024,36,House,24,1860-01-19,,79,114,TO ORDER A CALL OF THE HOUSE.,,,Internal Organization,,Miscellaneous Policy,-0.114,-0.205,0.181,-0.183,0.797,0.917,-45.01623,0.792
2017-01-23 00:25:07,RH0360025,36,House,25,1860-01-19,,96,111,TO ORDER A CALL OF THE HOUSE.,,,Internal Organization,,Miscellaneous Policy,-0.007,-0.054,0.199,-0.231,0.823,0.918,-43.301159,0.811
2017-01-23 00:25:07,RH0360026,36,House,26,1860-01-26,,128,99,TO DISPENSE WITH ALL FURTHER PROCEEDINGS UNDER THE CALL OF THE HOUSE.  (P. 602-3),,,Internal Organization,,Miscellaneous Policy,-0.147,-0.086,-0.277,0.538,0.859,0.938,-29.789861,0.877
2017-01-23 00:25:07,RH0360027,36,House,27,1860-01-26,,32,190,TO ADJOURN.  (P. 603-1),,,Internal Organization,,Miscellaneous Policy,-0.22,0.93,0.138,-0.329,0.062,0.865,-63.306575,0.752
2017-01-23 00:25:07,RH0360028,36,House,28,1860-01-27,,114,111,THAT WHEN HOUSE ADJOURNS IT WILL ADJOURN TILL MONDAY NEXT. (P. 621-1),,,Internal Organization,,Miscellaneous Policy,0.059,0.024,-0.59,1.13,0.964,0.982,-10.802165,0.953
2017-01-23 00:25:07,RH0360029,36,House,29,1860-01-30,,108,123,TO ADJOURN BECAUSE OF THE LATE HOUR.  (P. 635-1),,,Internal Organization,,Miscellaneous Policy,0.21,0.508,0.383,-1.064,0.917,0.961,-23.719848,0.902
2017-01-23 00:25:07,RH0360030,36,House,30,1860-01-31,,90,139,TO ADJOURN DUE TO THE LATE HOUR.  (P. 645-3),,,Internal Organization,,Miscellaneous Policy,-0.185,0.005,0.211,-0.435,0.767,0.908,-46.533833,0.816
2017-01-23 00:25:07,RH0360031,36,House,31,1860-02-01,,119,107,THAT MR. HORACE A. CLARK BE EXCUSED BECAUSE IT IS NOT HIS HABIT TO ATTEND THE HOUSE SO EARLY AS THIS.  (P. 649-1),,,Internal Organization,,Miscellaneous Policy,0.226,0.795,-0.183,0.278,0.757,0.885,-70.338244,0.733
2017-01-23 00:25:07,RH0360032,36,House,32,1860-02-03,,120,101,"PROVIDING THAT WHEN THE HOUSE DOES ADJOURN, IT DOES SO TO MEET NEXT FRIDAY IN ORDER TO HAVE NO SESSION ON THURSDAY. (P. 657-1)",,,Internal Organization,,Miscellaneous Policy,0.103,0.426,-0.247,0.431,0.901,0.955,-32.363513,0.864
2017-01-23 00:25:07,RH0360033,36,House,33,1860-02-03,,147,69,THAT ALL FURTHER PROCEEDINGS BE DISPENSED WITH IN THE CALL OF THE HOUSE.  (P. 662-2),,,Internal Organization,,Miscellaneous Policy,-0.205,0.278,-0.147,0.273,0.594,0.87,-68.052612,0.73
2017-01-23 00:25:07,RH0360034,36,House,34,1860-02-03,,75,130,"TO PASS A RESOLUTION THAT THERE BE PAID OUT OF CONTINGENT FUND OF THE HOUSE TO JAMES C. ALLEN, LATE CLERK, IN ADDITION TO THE SALARY ALLOWED HIM BY LAW, EIGHT DOLLARS PER DIEM FOR ADDITIONAL SERVICES PERFORMED BY HIM FROM DEC. 4, 1859 TO FEB. 3, 1860.  (",,,Internal Organization,Budget Special Interest,Government Management,-0.178,0.104,0.049,-0.43,0.307,0.746,-102.306941,0.607
2017-01-23 00:25:07,RH0360035,36,House,35,1860-02-03,,112,97,THAT WHEN THE HOUSE ADJOURNS IT ADJOURN TO MEET ON MONDAY NEXT.  (P. 665-1),,,Internal Organization,,Miscellaneous Policy,0.021,0.257,-0.212,0.252,0.835,0.923,-39.543043,0.828
2017-01-23 00:25:07,RH0360036,36,House,36,1860-02-06,,157,41,"TO SUSPEND THE RULES AND CONSIDER H.R. 1, (12 STAT-1, APP. 2/15/1860), MAKING APPROPRIATIONS TO SUPPLY DEFICIENCIES IN APPROPRIATIONS FOR THE POST OFFICE DEPT. FOR FISCAL 1859, AND IN PART FOR FISCAL 1860. (P. 681-2)",,,Budget Special Interest,,Government Management,-0.091,-0.996,0.024,-0.28,-0.073,0.778,-94.073959,0.622
2017-01-23 00:25:07,RH0360037,36,House,37,1860-02-06,,135,59,"TO TABLE THE APPEAL AGAINST THE DECISION OF THE CHAIR, WHICH RULED THAT THE AMENDMENT TO H.R. 1 IS IN ORDER; THE AMENDMENT PROPOSED THAT THE SUM OF $2,400,000 IS HEREBY APPROPRIATED TO BE EXPENDED IN THE PAYMENT EXCLUSIVELY OF COMPENSATION TO POSTMASTERSAND CLERKS, AND TO STRIKE OUT THE 3RD SECTION OF THE BILL WHICH ALLOWED INTEREST OF 6 PERCENT ON SUMS DUE CONTRACTORS FOR CARRYING THE MAILS.",,,Budget Special Interest,,Government Management,-0.298,-0.104,-0.185,0.194,0.61,0.881,-49.910345,0.773
2017-01-23 00:25:07,RH0360038,36,House,38,1860-02-06,,76,118,"TO AMEND H.R. 1, BY PROVIDING THAT INTEREST AT THE RATE OF 6% PER ANNUM, TO COMMENCE ONE MONTH AFTER EXPIRATION OF THE QUARTER IN WHICH THE SERVICE WAS RENDERED, TO THE DATE OF THE APPROVAL OF THIS ACT, SHALL BE PAID ON ALL SUMS DUE TO THE CONTRACTORS CARYING MAIL, AND THAT SUM BE APPROPRIATED FOR THIS PURPOSE.",,,Budget Special Interest,,Government Management,0.206,-0.091,-0.158,0.194,0.592,0.84,-72.828424,0.687
2017-01-23 00:25:07,RH0360039,36,House,39,1860-02-10,,103,61,"TO TABLE THE APPEAL OF MR. BURNETT AGAINST THE DECISION OF THE CHAIR, WHICH DECIDED IN ORDER THE RESOLUTION WHICH PROPOSED TO ALLOW ALL COMMITTEES, WITH THE ADDITION OF THE COMMITTEE ON ACCOUNTS AND TERRITORIES, THAT WERE AUTHORIZED AT THE 2ND SESSION OFTHE LAST CONGRESS TO EMPLOY CLERKS TO HAVE THE SAME PRIVILEGE DURING THE SESSION OF THE PRESENT CONGRESS, AT THE RATE OF COMPENSATION OF FOUR DOLLARS A DAY DURING THE SESSIONS OF CONGRESS.",,,Internal Organization,Budget Special Interest,Government Management,-0.139,0.069,-0.189,0.283,0.787,0.921,-34.165062,0.812
2017-01-23 00:25:07,RH0360040,36,House,40,1860-02-10,,96,63,"TO TABLE THE APPEAL OF MR. BURNETT AGAINST THE DECISION OF THE CHAIR, WHICH ADMITTED INTRODUCTION OF RESOLUTION AUTHORIZING EMPLOYMENT OF CLERKS BY COMMITTEES.  (P. 729-2)",,,Internal Organization,Budget Special Interest,Government Management,-0.011,0.422,-0.183,0.291,0.778,0.912,-37.068149,0.792
2017-01-23 00:25:07,RH0360041,36,House,41,1860-02-10,,81,89,TO TABLE RESOLUTION AUTHORIZING THE EMPLOYMENT OF CLERKS BY SEVERAL COMMITTEES.  (P. 729-3),,,Internal Organization,Budget Special Interest,Government Management,0.049,0.103,0.185,-0.166,0.79,0.9,-43.723287,0.773
2017-01-23 00:25:07,RH0360042,36,House,42,1860-02-10,,48,113,"TO ORDER A CALL OF THE HOUSE, IN ORDER TO DELAY ACTION ON THE RESOLUTION AUTHORIZING EMPLOYMENT OF CLERKS BY COMMITTEES.  (P. 730-2)",,,Internal Organization,Budget Special Interest,Government Management,-0.573,-0.77,0.231,-0.401,0.583,0.876,-45.389015,0.754
2017-01-23 00:25:07,RH0360043,36,House,43,1860-02-13,,71,96,"TO SUSPEND THE RULES SO AS TO ENABLE MR. BURCH TO PRESENT THE MEMORIAL OF THE PACIFIC RAILROAD CONVENTION HELD AT SAN FRANCISCO, CA. SEPT. 1859.  (P. 750-1)",,,Government Organization,,Government Management,0.649,0.728,0.22,-1.036,0.62,0.838,-58.648955,0.704
2017-01-23 00:25:07,RH0360044,36,House,44,1860-02-13,,7,170,"TO ADJOURN, DURING ELECTION OF A PRINTER FOR THE HOUSE OF REPRESENTATIVES.  (P. 769-1)",,,Internal Organization,,Miscellaneous Policy,-0.459,0.86,0.113,-0.427,0.0,0.96,-28.671807,0.85
2017-01-23 00:25:07,RH0360045,36,House,45,1860-02-13,,86,89,"TO POSTPONE REGULAR ORDERS OF CONGRESS TILL 1 P.M. TOMORROW, WHICH REGULAR ORDER IS WITH A VIEW TO GOING INTO COMMITTEE OF THE WHOLE ON THE STATE OF THE UNION, IN ORDER TO TAKE UP THE AMENDMENTS OF THE SENATE ON THE POST OFFICE APPROPRIATION BILL, H.R. 1  (P",,,Budget Special Interest,,Government Management,0.062,0.096,0.205,-0.275,0.86,0.931,-35.041675,0.819
2017-01-23 00:25:07,RH0360046,36,House,46,1860-02-13,,28,139,TO ADJOURN.  (P. 769-3),,,Internal Organization,,Miscellaneous Policy,-0.055,0.849,0.091,-0.402,0.036,0.838,-55.794013,0.716
2017-01-23 00:25:07,RH0360047,36,House,47,1860-02-14,,149,21,"TO CONCUR IN A SENATE AMENDMENT TO H.R. 1 (12 STAT-1, APP. 2/15/1860), A BILL TO SUPPLY DEFICIENCIES IN APPROPRIATIONS FOR THE POST OFFICE DEPT. FOR FISCAL 1859, AND IN PART FOR ITS SUPPORT FOR FISCAL 1860, WHICH AMENDMENT REQUIRED THE SUPERINTENDENT OF UBLIC PRINTING TO PROCURE PRINTING OF THE P.O",,,Budget Special Interest,,Government Management,-0.641,-0.767,-0.055,-0.327,-0.048,0.871,-66.475754,0.676
2017-01-23 00:25:07,RH0360048,36,House,48,1860-02-15,,60,112,"TO CONCUR IN SENATE AMENDMENT TO H.R. 1, WHICH AMENDMENT ABOLISHES THE FRANKING PRIVILEGE AND REPEALS ALL LAWS AUTHORIZING RECEIVING OR SENDING ANY MATTER THROUGH THE MAILS FREE OF POSTAGE FROM AND AFTER APR. 10- NEXT. (P. 777-3)",Congressional Pay and Benefits,,Internal Organization,Budget Special Interest,Government Management,-0.259,-0.376,0.129,-0.077,0.467,0.814,-67.040045,0.677
2017-01-23 00:25:07,RH0360049,36,House,49,1860-02-15,,122,54,TO ORDER A CALL OF THE HOUSE.  (P. 790-1),,,Internal Organization,,Miscellaneous Policy,0.334,-0.043,0.1,-0.081,0.093,0.722,-94.194435,0.586
2017-01-23 00:25:07,RH0360050,36,House,50,1860-02-17,,90,82,TO POSTPONE ELECTION OF A PRINTER TILL MONDAY NEXT. (P. 830),,,Internal Organization,,Miscellaneous Policy,0.018,-0.014,-0.494,0.966,0.951,0.977,-10.159064,0.943
2017-01-23 00:25:07,RH0360051,36,House,51,1860-02-17,,72,99,TO TABLE THE BILL S. 35 TO ABOLISH THE FRANKING PRIVILEGE. (P. 832-2),Congressional Pay and Benefits,,Internal Organization,Budget Special Interest,Government Management,0.152,0.898,-0.161,0.035,0.486,0.784,-75.161793,0.644
2017-01-23 00:25:07,RH0360052,36,House,52,1860-02-22,,71,97,"TO ADJOURN, DURING DEBATE ON S. 35.  (P. 833-1)",Congressional Pay and Benefits,,Internal Organization,Budget Special Interest,Government Management,-0.432,-0.761,0.106,-0.231,0.465,0.774,-81.883481,0.614
2017-01-23 00:25:07,RH0360053,36,House,53,1860-02-22,,64,95,TO REFER S. 35 TO COMMITTEE ON POST OFFICE AND POST ROADS.,Congressional Pay and Benefits,,Internal Organization,Budget Special Interest,Government Management,-0.123,0.357,0.117,-0.015,0.594,0.836,-69.210608,0.647
2017-01-23 00:25:07,RH0360054,36,House,54,1860-02-22,,115,54,TO ORDER A CALL OF THE HOUSE.  (P. 843-2),,,Internal Organization,,Miscellaneous Policy,0.329,-0.003,0.144,-0.283,0.389,0.805,-69.160495,0.664
2017-01-23 00:25:07,RH0360055,36,House,55,1860-02-22,,87,97,"TO TABLE A RESOLUTION REGARDING ARRANGEMENT OF BENCHES, CHAIRS AND DESKS IN THE HALL.  (P. 856-3)",,,Internal Organization,,Miscellaneous Policy,0.089,-0.333,0.022,0.093,0.115,0.582,-124.436175,0.509
2017-01-23 00:25:07,RH0360056,36,House,56,1860-02-22,,95,86,"TO PASS A RESOLUTION DIRECTING THAT THE SUPERINTENDENT OF THE CAPITOL EXTENSION BE DIRECTED TO REMOVE THE PRESENT BENCHES FROM THE HALL, AND REPLACE THE OLD CHAIRS AND DESKS, ADOPTING SUBSTANTIALLY THE ORIGINAL ARRANGEMENT THEREOF, BUT HAVING REGARD TO RDUCTION OF SPACE",,,Internal Organization,Budget Special Interest,Government Management,-0.219,0.168,-0.033,-0.056,0.14,0.591,-120.104428,0.515
2017-01-23 00:25:07,RH0360057,36,House,57,1860-02-22,,105,74,"TO TABLE THE RESOLUTION PROVIDING THAT WHEN THE HOUSE ADJOURNS ON FRIDAY NEXT, IT ADJOURN TO MEET ON MONDAY, MARCH 5TH NEXT.  (P. 856-1)",,,Internal Organization,,Miscellaneous Policy,-0.415,0.423,0.005,0.149,0.054,0.609,-118.666302,0.515
2017-01-23 00:25:07,RH0360058,36,House,58,1860-02-22,,86,82,"TO POSTPONE THE SPECIAL ORDER, WHICH IS THE ELECTION OF A PRINTER, IN ORDER TO RESOLVE THE HOUSE INTO THE COMMITTEE OF THE WHOLE ON THE STATE OF THE UNION.  (P. 859-1)",,,Internal Organization,,Miscellaneous Policy,0.001,0.05,-0.352,0.783,0.939,0.97,-13.075356,0.925
2017-01-23 00:25:07,RH0360059,36,House,59,1860-02-23,,81,77,"TO ADJOURN, DURING DEBATE ON ELECTION OF A PRINTER. (P. 873-2)",,,Internal Organization,,Miscellaneous Policy,0.091,0.108,0.205,-0.535,0.883,0.943,-26.866566,0.844
2017-01-23 00:25:07,RH0360060,36,House,60,1860-02-24,,93,88,"TO ORDER A CALL OF THE HOUSE, DURING DEBATE ON ELECTIONS OF A PRINTER.  (P. 877-2)",,,Internal Organization,,Miscellaneous Policy,0.168,0.397,0.179,-0.234,0.784,0.895,-51.639279,0.752
2017-01-23 00:25:07,RH0360061,36,House,61,1860-02-27,,74,108,"TO AMEND MOTION THAT THE ELECTION OF A PRINTER BE POSTPONED TILL MONDAY NEXT BY INSERTING INSTEAD, THE FIRST MONDAY IN JUNE.  (P. 898-3)",,,Internal Organization,,Miscellaneous Policy,-0.138,-0.003,0.204,-0.292,0.811,0.923,-35.70228,0.822
2017-01-23 00:25:07,RH0360062,36,House,62,1860-02-28,,24,149,"TO TABLE H.R. 63, A BILL TO AMEND AN ACT TO REGULATE THE COMPENSATION OF MEMBERS OF CONGRESS, SO AS TO REPEAL ALL THAT ALLOWS A MILEAGE ALLOWANCE TO SENATORS, REPRESENTATIVES AND DELEGATES.  (P. 904-2)",Congressional Pay and Benefits,,Internal Organization,Budget Special Interest,Government Management,-0.505,0.304,0.104,-0.444,0.208,0.89,-51.599534,0.742
2017-01-23 00:25:07,RH0360063,36,House,63,1860-02-28,,77,108,TO COMMIT H.R. 63 TO THE COMMITTEE OF THE WHOLE HOUSE ON THE STATE OF THE UNION FOR THEIR CONSIDERATION.  (P. 860-1),Congressional Pay and Benefits,,Internal Organization,Budget Special Interest,Government Management,-0.649,-0.045,0.023,-0.411,0.221,0.676,-111.473744,0.547
2017-01-23 00:25:07,RH0360064,36,House,64,1860-02-28,,35,142,"TO TABLE H.R. 63, AND AMENDMENTS THERETO.   (P. 906-1)",Congressional Pay and Benefits,,Internal Organization,Budget Special Interest,Government Management,-0.712,-0.013,0.104,-0.629,0.229,0.847,-70.630558,0.671
2017-01-23 00:25:07,RH0360065,36,House,65,1860-02-28,,58,108,"THAT MR. NOEL BE EXCUSED FROM VOTING ON THE AMENDMENT TO H.R. 63, ON THE GROUND THAT HE WAS NOT ALLOWED TO EXPRESS HIS OPINION OR DEBATE THEREON AS THE PREVIOUS QUESTION WAS ORDERED.  (P. 906-3)",Congressional Pay and Benefits,,Internal Organization,Budget Special Interest,Government Management,-0.565,0.339,0.001,-0.293,0.086,0.681,-101.868506,0.541
2017-01-23 00:25:07,RH0360066,36,House,66,1860-02-28,,129,44,"TO AMEND H.R. 63, BY PROVIDING THAT EACH MEMBER OF CONGRESS SHALL BE PAID A MILEAGE ALLOWANCE AT THE BEGINNING AND END OF EVERY SESSION, TO BE COMPUTED BY A STRAIGHT LINE FROM HIS RESIDENCE TO THE SEAT OF CONGRESS.  (P. 903-2)",Congressional Pay and Benefits,,Internal Organization,Budget Special Interest,Government Management,-0.374,0.311,-0.044,0.328,0.045,0.757,-85.850194,0.609
2017-01-23 00:25:07,RH0360067,36,House,67,1860-02-28,,126,52,TO TABLE THE MOTION TO RECONSIDER THE VOTE BY WHICH H.R. 63 WAS ORDERED ENGROSSED AND READ A THIRD TIME.,Congressional Pay and Benefits,,Internal Organization,Budget Special Interest,Government Management,-0.51,0.116,-0.051,0.391,0.212,0.77,-92.702416,0.594
2017-01-23 00:25:07,RH0360068,36,House,68,1860-02-29,,81,99,"TO ADJOURN, DURING DEBATE ON H.R. 63.  (P. 908)",Congressional Pay and Benefits,,Internal Organization,Budget Special Interest,Government Management,-0.83,-0.467,0.071,-0.471,0.198,0.639,-109.971465,0.543
2017-01-23 00:25:07,RH0360069,36,House,69,1860-02-29,,96,84,"TO ADJOURN, DURING DEBATE ON H.R. 63.  (P. 908-2)",Congressional Pay and Benefits,,Internal Organization,Budget Special Interest,Government Management,-0.645,-0.508,0.054,-0.417,0.333,0.689,-104.040155,0.561
2017-01-23 00:25:07,RH0360070,36,House,70,1860-03-01,,104,73,"TO AMEND A RESOLUTION AUTHORIZING EMPLOYMENT OF A CLERK BY THE COMMITTEE ON COMMERCE, BY INCLUDING THE COMMITTEES ON ELECTIONS, FORIEGN AFFAIRS, TERRITORIES, MILITARY AFFAIRS, POST OFFICE AND POST ROADS, JUDICIARY, INVALID PENSIONS, NAVAL AFFAIRS, PUBLICLANDS AND ACCOUNTS",,,Internal Organization,Budget Special Interest,Government Management,-0.004,-0.871,-0.181,-0.043,0.671,0.864,-54.491183,0.735
2017-01-23 00:25:07,RH0360071,36,House,71,1860-03-02,,79,94,"TO REFER TO THE COMMITTEE OF THE WHOLE, H.R. 237, (12 STAT 19, APP. 6/9/1860), FOR RELIEF OF A. SCHANDLER, A SETTLER MAKING IMPROVEMENTS ON LAND UNDER A DUPLICATE CERTIFICATE.  (P. 974-2)",,,Budget Special Interest,,Government Management,-0.023,0.215,0.157,-0.006,0.684,0.855,-60.248929,0.706
2017-01-23 00:25:07,RH0360072,36,House,72,1860-03-02,,38,129,"TO TABLE H.R. 237, (12 STAT 19, APP. 6/9/1860), FOR THE RELIEF OF A. SCHANDLER, A SETTLER ON LAND UNDER A DUPLICATE CERTIFICATE.  (P. 975)",,,Budget Special Interest,,Government Management,-0.438,0.061,0.121,-0.272,0.132,0.802,-64.126792,0.681
2017-01-23 00:25:07,RH0360073,36,House,73,1860-03-02,,91,64,THAT WHEN THE HOUSE ADJOURNS IT MEET ON MONDAY NEXT. (P. 976),,,Internal Organization,,Miscellaneous Policy,-0.188,-0.438,0.056,-0.316,0.375,0.742,-82.198823,0.588
2017-01-23 00:25:07,RH0360074,36,House,74,1860-03-05,,61,116,"TO TABLE A RESOLUTION THAT THE HOUSE SHALL PROCEED TOMORROW, AT ONE O'CLOCK P.M. TO ELECT A CHAPLAIN, WHO SHALL OFFICIATE DURING THE PRESENT CONGRESS ALTERNATELY WITH THE CHAPLAIN ALRESDY ELECTED BY THE SENATE.  (P. 992, 994)",,,Internal Organization,,Miscellaneous Policy,-0.139,-0.99,0.166,0.056,0.656,0.881,-54.766376,0.734
2017-01-23 00:25:07,RH0360075,36,House,75,1860-03-05,,62,107,TO GO INTO COMMITTEE OF THE WHOLE ON STATE OF THE UNION.,,,Internal Organization,,Miscellaneous Policy,-0.677,-0.111,0.052,-0.442,0.306,0.746,-96.126468,0.566
2017-01-23 00:25:07,RH0360076,36,House,76,1860-03-05,,35,118,"TO SUSPEND RULES AND CONSIDER A RESOLUTION THAT THE UNAPPROPRIATED BALANCE REMAINING OF THE APPROPRIATION MADE MAR. 3, 1854, FOR REPAIRING WORKS AND PIERS AND SECURE LIGHTHOUSE AT CHICAGO, IS HEREBY DIRECTED TO BE EXPENDED IN IMPROVING HARBOR AT CHICAGO. (P",Public Works,,Budget Special Interest,,Government Management,-0.185,0.837,-0.053,-0.318,0.086,0.791,-70.674895,0.63
2017-01-23 00:25:07,RH0360077,36,House,77,1860-03-05,,125,43,"TO SUSPEND THE RULES AND CONSIDER A RESOLUTION THAT THE COMMITTEE OF THE WHOLE ON THE STATE OF THE UNION BE DISCHARGED FROM FURTHER CONSIDERATION OF THE PRESIDENTS MESSAGE AS RELATES TO A RAILROAD TO THE PACIFIC, AND THAT SAME BE REFERRED TO A SELECT COMITTEE OF 15 MEMBERS, WITH LEAVE TO REPORT BY BILL OR OTHERWISE",Public Works,,Budget Special Interest,,Government Management,-0.36,-0.066,-0.191,-0.023,0.558,0.887,-38.93941,0.793
2017-01-23 00:25:07,RH0360078,36,House,78,1860-03-05,,96,70,"TO SUSPEND RULES AND CONSIDER A RESOLUTION THAT THE PRESIDENT OF THE SENATE AND THE SPEAKER OF THE HOUSE OF REPRESENTATIVES BE AUTHORIZED TO CLOSE THE PRESENT SESSIONS, BY ADJOURNING THEIR RESPECTIVE HOUSES ON MONDAY, JUNE 4TH- AT 12 O'CLOCK AT NOON.  (P 997)",,,Internal Organization,,Miscellaneous Policy,-0.329,-0.944,0.061,-0.186,0.229,0.675,-96.569842,0.559
2017-01-23 00:25:07,RH0360079,36,House,79,1860-03-05,,117,45,"TO SUSPEND RULES AND CONSIDER A RESOLUTION PROVIDING FOR A CONGRESSIONAL INVESTIGATION INTO IMPROPER ACTIONS OF THE PRESIDENT OR OFFICERS OF GOVERNMENT TO INFLUENCE PASSAGE OF OF LAWS REGARDING STATES OR TERRITORIES, AND INTO ABUSES AT CERTAIN PUBLIC BUIDINGS AND WORKS",Impeachments and Investigations,,Government Organization,,Government Management,-0.339,0.005,-0.242,0.593,0.689,0.914,-33.632099,0.813
2017-01-23 00:25:07,RH0360080,36,House,80,1860-03-06,,69,117,"TO TABLE A MOTION TO RECONSIDER THE VOTE TO REFER TO THE COMMITTEE OF THE WHOLE, H.R. 280, A BILL TO SECURE HOMESTEADS TO ACTUAL SETTLERS ON THE PUBLIC DOMAIN. (P. 1014-3, 1015)",Public Lands,,Budget Special Interest,,Government Management,-0.418,-0.886,0.225,-0.312,0.565,0.839,-50.692099,0.761
2017-01-23 00:25:07,RH0360081,36,House,81,1860-03-06,,156,21,"TO PASS H.R. 63, A BILL TO AMEND AN ACT OF 1856 REGULATING COMPENSATION OF MEMBERS OF CONGRESS, BY PROHIBITING PAYMENT OF MILEAGE.  (P. 1017)",Congressional Pay and Benefits,,Internal Organization,Budget Special Interest,Government Management,0.084,0.768,-0.062,0.591,0.19,0.904,-47.612058,0.764
2017-01-23 00:25:07,RH0360082,36,House,82,1860-03-07,,72,106,"TO TABLE H.R. 6, A BILL DONATING PUBLIC LANDS TO STATES WHICH MAY PROVIDE COLLEGES FOR THE AGRICULTURAL AND MECHANICAL ARTS.  (P. 1023, 1025)",Public Lands,,Budget Special Interest,,Government Management,-0.037,0.561,0.181,-0.106,0.722,0.888,-50.380293,0.753
2017-01-23 00:25:07,RH0360083,36,House,83,1860-03-07,,48,102,TO ADJOURN.  (P. 1027),,,Internal Organization,,Miscellaneous Policy,0.2,0.894,0.115,-0.358,0.354,0.793,-60.134915,0.67
2017-01-23 00:25:07,RH0360084,36,House,84,1860-03-08,,118,53,A RESOLUTION THAT THE COMMITTEE ON PUBLIC EXPENDITURES ARE HEREBY AUTHORIZED TO EMPLOY A PERSON TO ACT AS CLERK AND STENOGRAPHER TO SAID COMMITTEE.  (P. 1064),,,Internal Organization,Budget Special Interest,Government Management,-0.156,0.758,-0.181,0.151,0.642,0.889,-48.867573,0.751
2017-01-23 00:25:07,RH0360085,36,House,85,1860-03-08,,84,82,"TO REFER TO THE COMMITTEE OF THE WHOLE H.R. 305, (12 STAT 64, APP. 6/22/1860), A BILL APPROPRIATING FOR THE ARMY FOR FISCAL 1861.  (P. 1067-2, 1069)",,,Defense Policy Budget,,Foreign and Defense Policy,0.151,-0.989,-0.046,-0.026,0.207,0.608,-109.54613,0.517
2017-01-23 00:25:07,RH0360086,36,House,86,1860-03-08,,54,106,"TO TABLE H.R. 228, RELATIVE TO THE PRINTING AND DISTRIBUTION OF THE ANNUAL MESSAGE OF THE PRESIDENT OF THE U.S. AND ACCOMPANYING DOCUMENTS.  (P. 1073-2)",,,Budget Special Interest,,Government Management,0.126,0.917,0.162,-0.339,0.537,0.844,-53.22628,0.717
