date_generated,id,congress,chamber,rollnumber,date,keyvote,yea,nay,description,Issue1,Issue2,Peltzman1,Peltzman2,Clausen1,slope,intercept,mid.dim1,mid.dim2,spread.dim1,spread.dim2,pre,classified,log_likelihood,vote_result
2016-10-19 13:03:23,RH0330458,33,House,458,1854-12-06,,93,83,TO RECONSIDER THE VOTE BY WHICH HOUSE REFUSED TO REFER A RESOLUTION RELATIVE TO THE CONFERENCE OF MINISTERS AT OSTEND TO THE COMMITTEE ON FOREIGN AFFAIRS.  (P. 18-1),,,Foreign Policy Resolutions,,Foreign and Defense Policy,-25.40284409801793,-3.1947867973304387,-0.136,0.26,0.224,0.051,0.771,0.892,-51.215626,
2016-10-19 13:03:23,RH0330459,33,House,459,1854-12-06,,92,83,TO REFER A RESOLUTION RELATIVE TO THE CONFERENCE OF MINISTERS AT OSTEND TO THE COMMITTE  ON FOREIGN AFFAIRS. (P. 18-2),,,Foreign Policy Resolutions,,Foreign and Defense Policy,-18.91172619712134,-2.1068485126689542,-0.115,0.068,0.206,0.063,0.747,0.88,-51.732905,
2016-10-19 13:03:23,RH0330460,33,House,460,1854-12-06,,95,80,"TO PASS, OVER THE PRESIDENT'S VETO, H.R. 392, THE RIVERS AND HARBORS APPROPRIATIONS BILL.  (P. 19)",Public Works,,Budget Special Interest,,Government Management,-3.4098812838082866,-0.6856651883159318,-0.209,0.027,-0.26,-0.441,0.762,0.891,-49.906066,
2016-10-19 13:03:23,RH0330461,33,House,461,1854-12-12,,126,45,"TO PASS S. 393 (12-14-54), AN ACT FOR THE BETTER PRESERVATION OF LIFE AND PROPERTY FROM VESSELS SHIPWRECKED ON THE COAST OF THE U. S.  (P. 32-3)",,,Domestic Social Policy,,Government Management,-25.569968072346995,-9.919147612070633,-0.388,0.002,-0.252,-0.057,0.622,0.901,-44.389492,
2016-10-19 13:03:23,RH0330462,33,House,462,1854-12-13,,74,107,TO TABLE A RESOLUTION DIRECTING THAT THERE BE PRINTED 15000 COPIES OF THE RETURNS OF THE 7TH CENSUS WHICH RELATE TO MORTALITY STATISTICS FOR THE USE OF THE CONGRESS DURING THIS SESSION.  (P. 45-2),,,Budget Special Interest,,Government Management,-15.97865034706591,-3.505495223230907,-0.211,-0.134,0.163,0.059,0.527,0.807,-72.345017,
2016-10-19 13:03:23,RH0330463,33,House,463,1854-12-21,,49,86,TO TABLE H.R. 517 (3/2/55) AUTHORIZING THE CORPORATE AUTHORITIES OF GEORGETOWN TO IMPOSE ADDITIONAL TAXES. (P. 104-2),Tax rates,,Regulation Special Interest,D. C.,Government Management,-0.6990026545350588,-0.4028168904043454,0.418,-0.695,0.062,0.513,0.224,0.719,-74.393201,
2016-10-19 13:03:23,RH0330464,33,House,464,1854-12-21,,83,63,TO PASS H.R. 517 AUTHORIZING THE CORPORATE AUTHORITIES OF GEORGETOWN TO IMPOSE ADDITIONAL TAXES. (P. 115-3),Tax rates,,Regulation Special Interest,D. C.,Government Management,-0.5474845799124227,-0.29488296065681485,0.192,-0.4,-0.039,-0.412,0.317,0.705,-85.692157,
2016-10-19 13:03:23,RH0330465,33,House,465,1854-12-21,,82,53,"TO ORDER THE MAIN QUESTION TO BE PUT ON THE AMENDMENTS OF THE COMMITTEE OF THE JUDICIARY TO H.R. 445 (10 STAT 642, 3/3/55), A BILL TO REORGANIZE THE COURTS OF THE DISTRICT OF COLUMBIA AND TO REFORM AND IMPROVE THE LAWS THEREOF. (P. 123-3)",Judiciary,,Domestic Social Policy,D. C.,Civil Liberties,10.632629821329473,-0.21911979963156003,0.114,0.993,0.182,-0.099,0.623,0.852,-49.971466,
2016-10-19 13:03:23,RH0330466,33,House,466,1854-12-21,,45,76,"TO ADJOURN, MOTION MADE DURING DEBATE ON H.R. 445, (10 STAT 642, 3/3/55), A BILL TO REORGANIZE THE COURTS OF THE DISTRICT OF COLUMBIA.  (P. 124)",Judiciary,,Domestic Social Policy,D. C.,Civil Liberties,9.39848528849659,-0.3069909698125295,0.138,0.99,-0.195,0.12,0.644,0.868,-40.334752,
2016-10-19 13:03:23,RH0330467,33,House,467,1854-12-22,,78,52,"TO PASS H.J.RES. 40, AUTHORIZING THE PRESIDENT TO ADOPT MEASURES TO PROCURE THE ERECTION OF A LIGHT-HOUSE AT CAPE RACE ON NEWFOUNDLAND.",Public Works,,Budget Special Interest,,Government Management,-51.08920208105838,-12.340140893210835,-0.237,-0.232,-0.159,-0.018,0.558,0.823,-51.152031,
2016-10-19 13:03:23,RH0330468,33,House,468,1854-12-22,,113,35,"TO PASS H.R. 445 (10 STAT 642, 3/3/55), A BILL TO REORGANIZE THE JUDICIARY OF THE DISTRICT OF COLUMBIA.  (P. 128-1)",Judiciary,,Domestic Social Policy,D. C.,Civil Liberties,-12.669020462149247,2.121240992764416,0.244,-0.97,0.184,0.084,0.543,0.892,-48.884927,
2016-10-19 13:03:23,RH0330469,33,House,469,1854-12-22,,61,79,"TO ADJOURN IN ORDER TO PREVENT ACTION ON A MOTION TO RESOLVE INTO A COMMITTEE OF THE WHOLE HOUSE TO CONSIDER BILLS UPON THE PRIVATE CALENDAR, IN ORDER TO SECURE A CHRISTMAS WEEK-END UNTIL TUESDAY NEXT.  (P. 128-2)",,,Internal Organization,,Miscellaneous Policy,-1.15289367198527,0.04945518037557439,0.572,-0.61,-0.06,-0.301,0.213,0.657,-88.523979,
2016-10-19 13:03:23,RH0330470,33,House,470,1854-12-26,,58,62,TO ADJOURN UNTIL FRIDAY NEXT.  (P. 134-3),,,Internal Organization,,Miscellaneous Policy,-4.626946603567552,-0.713451612027672,-0.232,0.36,-0.096,-0.12,0.466,0.742,-65.985816,
2016-10-19 13:03:23,RH0330471,33,House,471,1855-01-05,,86,51,"TO PASS A RESOLUTION DIRECTING THAT 20,000 EXTRA COPIES OF THE PRESIDENT'S MESSAGE DELIVERED TO THIS HOUSE ON THE 2ND DAY OF JANUARY BE PRINTED FOR THE USE OF THE MEMBERS OF THIS HOUSE.  (P. 200-2)",,,Budget Special Interest,,Government Management,-5.817906232296478,-0.18172837507081407,0.004,-0.205,0.17,0.169,0.529,0.825,-49.135833,
2016-10-19 13:03:23,RH0330472,33,House,472,1855-01-09,,68,96,"TO AMEND A RESOLUTION THAT DEBATE IN COMMITTEE OF THE WHOLE ON H.R. 295, THE PACIFIC RAILROAD BILL, BE TERMINATED ON JAN. 16TH, BY PROVIDING THAT DEBATE BE TERMINATED ON JAN. 12TH.",,,Budget Special Interest,,Government Management,-2.073112439260786,-0.4828161867834075,0.194,-0.885,0.276,0.77,0.632,0.848,-54.461264,
2016-10-19 13:03:23,RH0330473,33,House,473,1855-01-09,,65,98,"TO TABLE H.R. 550, A BILL TO AMEND AN ACT ENTITLED ""AN ACT TO GRADUATE AND REDUCE THE PRICE OF THE PUBLIC LANDS TO ACTUAL SETTLERS AND CULTIVATORS.""  (P. 223-2)",Public Lands,,Budget Special Interest,,Government Management,-1.8338507879993342,-1.16079179816741,-0.886,0.464,0.052,0.164,0.092,0.638,-103.963803,
2016-10-19 13:03:23,RH0330474,33,House,474,1855-01-10,,82,88,"TO REFER TO COMMITTEE OF THE WHOLE AND HAVE PRINTED, THE BILL H.R. 550.  (P. 230-2)",Public Lands,,Budget Special Interest,,Government Management,-1.3910124282877132,-0.5022458929170197,-0.796,0.605,0.038,0.158,0.049,0.541,-114.361636,
2016-10-19 13:03:23,RH0330475,33,House,475,1855-01-10,,85,89,TO RECOMMIT H.R. 550 AND AMENDMENTS TO COMMITTEE ON PUBLIC LANDS.  (P. 232-2),Public Lands,,Budget Special Interest,,Government Management,-1.1256833179820385,-0.454961970146571,-0.859,0.512,0.029,0.149,0.035,0.529,-117.702584,
2016-10-19 13:03:23,RH0330476,33,House,476,1855-01-10,,73,93,"TO AMEND H.R. 550 SO AS TO PROVIDE THAT ANY FREE PERSON WHO IS THE HEAD OF A FAMILY, OR WHO IS 21 YEARS OF AGE AND A CITIZEN OF THE U. S. OR WHO HAS FILED A DECLARATION OF BECOMING A CITIZEN MAY ENTER AT THE RATE OF $0.14 1/2 PER ACRE, AN APPLICATION FORA QUARTER SECTION OF PUBLIC LAND",Public Lands,,Budget Special Interest,,Government Management,0.30984017434604133,0.3058401743460413,-1.0,-0.004,0.009,-0.168,0.096,0.602,-112.255753,
2016-10-19 13:03:23,RH0330477,33,House,477,1855-01-10,,68,95,TO PASS H.R. 550.  (P. 235-3),Public Lands,,Budget Special Interest,,Government Management,0.5597112826896231,0.3746614156910191,-0.48,0.106,0.018,-0.186,0.118,0.632,-106.40532,
2016-10-19 13:03:23,RH0330478,33,House,478,1855-01-17,,81,84,TO TABLE A RESOLUTION THAT THE COMMUNICATION FROM HON. RUFUS CHOATE RESIGNING HIS OFFICE AS ONE OF THE REGENTS OF THE SMITHSONIAN INSTITUTION BE REFERRED TO A COMMITTEE OF FIVE AND THAT SAID COMMITTEE INQUIRE AND REPORT WHETHER THAT INSTITUTION HAS BEEN ANAGED AS REQUIRED BY LAW AND THE DESIGN OF ITS FOUNDERS,Impeachments and Investigations,,Government Organization,,Government Management,-20.564207126966895,-3.2361488040124784,-0.197,0.815,0.128,0.036,0.531,0.77,-84.208951,
2016-10-19 13:03:23,RH0330479,33,House,479,1855-01-17,,93,85,TO PASS A RESOLUTION THAT THE COMMUNICATION OF THE HON. RUFUS CHOATE RESIGNING HIS OFFICE AS ONE OF THE REGENTS OF THE SMITHSONIAN SHALL BE REFERRED TO A COMMITTEE WHO SHALL INVESTIGATE WHETHER THAT INSTITUTION HAS BEEN MANAGED AS REQUIRED BY LAW AND WHEHER ADDITIONAL LEGISLA- TION IS NECESSARY TO CARRY OUT THE DESIGN OF ITS FOUNDERS,Impeachments and Investigations,,Government Organization,,Government Management,66.19104168992469,9.974847295178629,-0.151,-0.02,-0.103,0.009,0.529,0.775,-92.219484,
2016-10-19 13:03:23,RH0330480,33,House,480,1855-01-17,,94,82,TO TABLE A MOTION TO RECONSIDER THE VOTE BY WHICH A RESOLUTION RELATIVE TO THE RESIGNATION OF THE HON. RUFUS CHOATE AND THE MANAGEMENT OF THE SMITHSONIAN INSTITUTION WAS ADOPTED.  (P. 283),Impeachments and Investigations,,Government Organization,,Government Management,-17.351049763378317,-3.250221111430666,-0.163,-0.422,-0.093,-0.031,0.488,0.761,-95.555394,
2016-10-19 13:03:23,RH0330481,33,House,481,1855-01-18,,54,126,"TO TABLE H.R. 295, A BILL TO PROVIDE FOR THE ESTABLISHMENT OF A RAILROAD AND TELEGRAPHIC COMMUNICATION BETWEEN THE ATLANTIC STATES AND THE PACIFIC OCEAN.  (P. 318-2)",Public Works,,Budget Special Interest,,Government Management,-1.1764817999825032,-0.5419437775959408,-0.232,-0.269,0.143,0.703,0.5,0.85,-63.037731,
2016-10-19 13:03:23,RH0330482,33,House,482,1855-01-18,,59,117,"TO CONCUR IN THE AMENDMENT OF THE COMMITTEE OF THE WHOLE TO H.R. 295, SAID AMENDMENT BEING TO STRIKE THE ENACTING CLAUSE.  (P. 317-2)",Public Works,,Budget Special Interest,,Government Management,-1.0493940530944412,-0.46453397054787693,-0.274,-0.177,0.131,0.722,0.559,0.852,-65.926672,
2016-10-19 13:03:23,RH0330483,33,House,483,1855-01-20,,49,126,TO TABLE H.R. 295.  (P. 338-2),Public Works,,Budget Special Interest,,Government Management,-1.314093011505256,-0.6094977646922299,-0.234,-0.302,0.157,0.691,0.469,0.851,-58.515277,
2016-10-19 13:03:23,RH0330484,33,House,484,1855-01-20,,71,117,TO REFER H.R. 295 AND PENDING AMENDMENTS TO A SELECT COMMITTEE OF 13.  (P. 338-3),Public Works,,Budget Special Interest,,Government Management,0.1655860236450555,-0.16705736415781283,-0.67,-0.278,-0.028,0.978,0.451,0.793,-77.770712,
2016-10-19 13:03:23,RH0330485,33,House,485,1855-01-20,,104,91,"TO AMEND H.R. 295 SO AS TO REDUCE THE NUMBER OF RAILROADS TO ONE INSTEAD OF THREE.  THE AMENDMENT PROVIDES ONE GRAND TRUNK RAILROAD AND TELEGRAPHIC LINE FROM SOME POINT ON WESTERN BOUNDARY OF THE STATE OF MISSOURI OR IOWA BETWEEN 36 AND 43 DEGREES OF NORH LATITUDE AND THE MOST ELIGIBLE ROUTE TO THE CITY OF SAN FRANCISCO, AND ONE FROM THE SAID CENTRAL ROAD AT THE POINT LAST MENTIONED TO THE MOST ELIGIBLE POINT ON THE WESTERN SHORE OF LAKE SUPERIOR",Public Works,,Budget Special Interest,,Government Management,1.4149683802958872,0.3597772338130387,-0.72,-0.659,-0.08,0.327,0.33,0.687,-118.017873,
2016-10-19 13:03:23,RH0330486,33,House,486,1855-01-20,,108,92,TO TABLE A MOTION TO RECONSIDER THE VOTE BY WHICH AN AMENDMENT TO H.R. 295 REDUCING THE NUMBER OF RAILROADS FROM THREE TO ONE WAS AGREED TO.  (P. 339-2),Public Works,,Budget Special Interest,,Government Management,0.4954150994855694,0.13068970182858106,-0.722,-0.227,-0.043,0.502,0.337,0.695,-113.887409,
2016-10-19 13:03:23,RH0330487,33,House,487,1855-01-20,,79,123,TO TABLE THE SUBSTITUTE FOR H.R. 295 AS AMENDED.  (P. 339-3),Public Works,,Budget Special Interest,,Government Management,-1.5664142147494315,-0.519435624761105,-0.255,-0.12,0.117,0.432,0.443,0.782,-92.782788,
2016-10-19 13:03:23,RH0330488,33,House,488,1855-01-20,,121,79,"TO PASS THE SUBSTITUTE BILL H.R. 295, AS AMENDED. (P. 339-1)",Public Works,,Budget Special Interest,,Government Management,-4.575698777262215,-1.3310442600788956,-0.278,-0.059,-0.125,-0.158,0.405,0.765,-96.696369,
2016-10-19 13:03:23,RH0330489,33,House,489,1855-01-20,,105,97,TO ORDER ENGROSSMENT AND THIRD READING OF H.R. 295. (P. 340-2),Public Works,,Budget Special Interest,,Government Management,-1.5505598198633037,-0.34156140415279745,-0.199,-0.033,-0.163,-0.608,0.577,0.797,-81.72846,
2016-10-19 13:03:23,RH0330490,33,House,490,1855-01-20,,96,100,"TO ADJOURN, DURING DEBATE ON H.R. 295  (P. 340-3)",Public Works,,Budget Special Interest,,Government Management,-0.38991123063771493,-0.18057046669584495,-0.558,0.037,0.018,0.267,0.167,0.592,-128.452805,
2016-10-19 13:03:23,RH0330491,33,House,491,1855-01-20,,87,104,TO TABLE THE MOTION TO RECONSIDER THE VOTE BY WHICH THE MAIN QUESTION ON PASSAGE OF H.R. 295 WAS ORDERED. (P. 353-1),Public Works,,Budget Special Interest,,Government Management,-0.9311490052822665,-0.16723069427863602,-0.81,0.587,-0.194,-1.205,0.379,0.717,-96.952344,
2016-10-19 13:03:23,RH0330492,33,House,492,1855-01-22,,105,92,"TO RECONSIDER THE VOTE BY WHICH THE MAIN QUESTION, ON PASSAGE OF H.R. 295, WAS ORDERED TO BE PUT.  (P. 352-3)",Public Works,,Budget Special Interest,,Government Management,-0.9350592012335842,-0.18794336740783835,-0.817,0.576,0.205,1.268,0.413,0.726,-99.552492,
2016-10-19 13:03:23,RH0330493,33,House,493,1855-01-22,,101,104,TO RECOMMIT H.R. 295 TO THE SELECT COMMITTEE OF THIRTEEN. (P. 353-3),Public Works,,Budget Special Interest,,Government Management,-0.872216748857996,-0.24485083751559256,-0.862,0.507,0.187,1.24,0.416,0.712,-108.269487,
2016-10-19 13:03:23,RH0330494,33,House,494,1855-01-22,,98,103,TO TABLE THE MOTION TO RECONSIDER THE VOTE BY WHICH THE HOUSE REFUSED TO RECOMMIT H.R. 295 TO THE SELECT COMMITTEE OF 13.  (P. 354-2),Public Works,,Budget Special Interest,,Government Management,-0.9190174662806313,-0.22413663674316897,-0.838,0.546,-0.225,-1.416,0.459,0.736,-99.10082,
2016-10-19 13:03:23,RH0330495,33,House,495,1855-01-22,,103,100,TO RECONSIDER THE VOTE BY WHICH THE HOUSE REFUSED TO RECOMMIT H.R. 295 TO THE SELECT COMMITTEE OF 13  (P. 354-3),Public Works,,Budget Special Interest,,Government Management,-0.9274591867096005,-0.22928333927593558,-0.837,0.547,0.233,1.453,0.45,0.729,-100.753386,
2016-10-19 13:03:23,RH0330496,33,House,496,1855-01-22,,103,104,TO RECOMMIT H.R. 295 TO THE SELECT COMMITTEE OF 13. (P. 354-3),Public Works,,Budget Special Interest,,Government Management,-0.8305354121088604,-0.22207420229838193,-0.867,0.498,0.221,1.539,0.466,0.734,-100.991971,
2016-10-19 13:03:23,RH0330497,33,House,497,1855-01-22,,109,97,TO PASS H.R 295.  (P. 218-1),Public Works,,Budget Special Interest,,Government Management,-1.3693957566268868,-0.3579386302002845,-0.747,0.665,-0.255,-1.077,0.464,0.748,-94.677742,
2016-10-19 13:03:23,RH0330498,33,House,498,1855-01-22,,97,106,TO TABLE A MOTION TO RECONSIDER THE VOTE BY WHICH H.R. 295 WAS PASSED.  (P. 355-3),Public Works,,Budget Special Interest,,Government Management,-1.076723270258034,-0.23968810677410501,-0.791,0.612,-0.218,-1.171,0.423,0.724,-100.263848,
2016-10-19 13:03:23,RH0330499,33,House,499,1855-01-22,,100,94,TO RECONSIDER THE VOTE BY WHICH H.R. 295 WAS PASSED.,Public Works,,Budget Special Interest,,Government Management,-1.0651767749200378,-0.2470110663861902,-0.798,0.603,0.235,1.276,0.436,0.727,-93.106145,
2016-10-19 13:03:23,RH0330500,33,House,500,1855-01-22,,106,91,TO RECOMMIT H.R. 295 TO THE SELECT COMMITTEE OF 13. (P. 356-2),Public Works,,Budget Special Interest,,Government Management,-0.9607233053672869,-0.20495021717970607,-0.816,0.579,0.149,0.897,0.33,0.69,-107.033349,
2016-10-19 13:03:23,RH0330501,33,House,501,1855-01-23,,95,94,"TO TABLE THE MOTION TO RECONSIDER THE VOTE BY WHICH THE HOUSE AGREED TO RECOMMIT THE BILL H.R. 295, TO THE SELECT COMMITTEE OF 13.  (P. 368-3)",Public Works,,Budget Special Interest,,Government Management,-0.6524484047333797,-0.19190975569203622,-0.78,0.317,0.096,0.851,0.415,0.709,-102.793865,
2016-10-19 13:03:23,RH0330502,33,House,502,1855-01-23,,107,64,TO RECONSIDER H.R. 651 (I/10/55) A BILL FOR THE RELIEF OF SAMUEL BELDEN AND CO.  (P. 371-3),,,Budget Special Interest,,Government Management,-3.391934540209295,-1.093359204644857,-0.501,0.606,-0.156,-0.266,0.406,0.778,-81.321002,
2016-10-19 13:03:23,RH0330503,33,House,503,1855-01-26,,81,97,"TO RECOMMIT H.R. 651, (2/10/55) FOR THE RELIEF OF SAMUEL A. BALDEN AND CO. TO THE COMMITTEE OF THE WHOLE HOUSE.  (P. 417)",,,Budget Special Interest,,Government Management,-2.0419288384505596,-0.4256813296395924,0.103,-0.636,0.191,0.541,0.605,0.82,-68.314032,
2016-10-19 13:03:23,RH0330504,33,House,504,1855-01-26,,82,88,TO PASS H.R. 651 (2/10/55) A BILL FOR THE RELIEF OF SAMUEL A. BELDEN AND CO.  (P. 417-2),,,Budget Special Interest,,Government Management,-2.316090353030137,-0.3578162296394083,0.086,-0.557,-0.177,-0.442,0.598,0.806,-66.314596,
2016-10-19 13:03:23,RH0330505,33,House,505,1855-01-26,,88,92,"TO TABLE THE MOTION TO RECONSIDER THE VOTE BY WHICH H.R. 651 (2/10/55) FOR THE RELIEF OF SAMUEL A. BELDEN AND CO., WAS PASSED.  (P. 417-3)",,,Budget Special Interest,,Government Management,-2.260811821601884,-0.35610110370753845,0.245,-0.91,0.249,0.637,0.602,0.806,-67.808797,
2016-10-19 13:03:23,RH0330506,33,House,506,1855-01-27,,111,77,"TO PASS H.R. 117, PROVIDING FOR THE ASCERTAINMENT AND SATISFACTION OF CLAIMS OF AMERICAN CITIZENS FOR SPOLIATIONS COMMITTED BY THE FRENCH PRIOR TO JULY 31, 1801.  (P. 432)",,,Budget Special Interest,,Government Management,-3.574465187305404,-0.9913184360771293,-0.246,-0.112,-0.144,-0.233,0.416,0.761,-84.391523,
2016-10-19 13:03:23,RH0330507,33,House,507,1855-01-27,,33,120,"TO ADJOURN, DURING DEBATE ON H.R. 117.  (P. 433-1)",,,Budget Special Interest,,Government Management,-2.060151027314048,-1.1453308739666115,-0.072,-0.997,0.135,0.379,0.121,0.81,-54.717329,
2016-10-19 13:03:23,RH0330508,33,House,508,1855-01-27,,1,120,"TO AMEND H.R. 117, SO THAT THE TITLE READS ""AN ACT TO ACCOMPLISH THE FOLLOWING OBJECTS--TO ENABLE UNSCRUPULOUS COMPANIES, ETC., TO FURTHER AGGRANDIZE THEMSELVES IN THE ASSUMED NAME OF WIDOWS AND ORPHANS BY PREYING UPON WHOSE HELPLESSNESS THEY HAVE AMASSE FORTUNES",,,Budget Special Interest,,Government Management,,,0.0,0.0,0.0,0.0,-54.999,0.537,0.0,
2016-10-19 13:03:23,RH0330509,33,House,509,1855-01-29,,116,16,"TO PASS H.J.RES. 49, DISAPPROVING OF AN ACT OF THE LEGISLATIVE ASSEMBLY OF THE TERRITORY OF MINNESOTA, ENTITLED ""AN ACT TO INCORPORATE THE TRANSIT RAILROAD CO."" (P. 451-3)",,,Government Organization,,Government Management,0.48269189605026613,0.6272866047359071,0.161,0.705,-0.056,0.671,-0.062,0.871,-39.15054,
2016-10-19 13:03:23,RH0330510,33,House,510,1855-02-01,,110,70,"TO PASS S. 60 (2/17/55), AUTHORIZING THE CONSTRUCTION OF A TELEGRAPH LINE FROM THE MISSISSIPPI ROVER TO THE PACIFIC OCEAN.  (P. 503-3)",Public Works,,Budget Special Interest,,Government Management,-1.86841310216657,-0.5029482111703436,0.106,-0.701,-0.178,-0.551,0.471,0.794,-72.333646,
2016-10-19 13:03:23,RH0330511,33,House,511,1855-02-01,,109,74,"TO STRIKE THE ENACTING CLAUSE OF H.R. 689 (2/21/55), A BILL TO ESTABLISH THE OFFICE OF SURVEYOR-GENERAL OF UTAH, AND TO GRANT LANDS TO SETTLERS THEREIN.  (P. 504-2)",Public Lands,,Budget Special Interest,,Government Management,-4.448987118814953,-1.296082136960602,-0.067,-0.998,-0.06,-0.078,0.068,0.623,-115.103642,
2016-10-19 13:03:23,RH0330512,33,House,512,1855-02-01,,127,57,"TO STRIKE ALL AFTER THE ENACTING CLAUSE OF S. 60, A BILL TO ESTABLISH THE OFFICE OF SURVEYOR-GENERAL OF UTAH, AND TO GRANT LANDS TO ACTUAL SETTLERS THEREIN, AND INSERT A SUB- STITUTE BILL, AUTHORIZING THE PRESIDENT TO APPOINT A SURVEYOR-GENERAL IN UTAH, ND PROVIDING THAT CERTAIN SEC- TIONS IN EACH TOWNSHIP SHALL BE RESERVED FOR THE PURPOSE OF BEING APPLIED TO SCHOOLS AND UNIVERSITIES",Public Lands,,Budget Special Interest,,Government Management,6.052691777922669,-2.0573974369587265,0.482,0.86,0.09,-0.086,0.175,0.745,-104.201935,
2016-10-19 13:03:23,RH0330513,33,House,513,1855-02-01,,64,114,"TO TABLE H.R. 689, (P. 2/22/55) A BILL TO ESTABLISH THE OFFICE OF SURVEYOR-GENERAL OF UTAH, AND TO RESERVE CERTAIN SECTIONS OF TOWNSHIPS IN UTAH FOR THE PURPOSE OF AID TO EDUCATION.  (P. 506-2)",Public Lands,,Budget Special Interest,,Government Management,5.645976510305643,-1.3839124396943965,0.407,0.914,-0.082,0.084,0.187,0.708,-105.673986,
2016-10-19 13:03:23,RH0330514,33,House,514,1855-02-01,,66,85,"TO TABLE THE MOTION TO RECONSIDER THE VOTE BY WHICH H.R. 651 (2/10/55), FOR THE RELIEF OF SAMUEL BELDEN AND CO., WAS REJECTED.  (P. 507-3)",,,Budget Special Interest,,Government Management,-1.7736628647008945,-0.43076134349957607,-0.085,-0.28,0.161,0.525,0.561,0.808,-59.229342,
2016-10-19 13:03:23,RH0330515,33,House,515,1855-02-01,,89,65,"TO RECONSIDER THE VOTE BY WHICH H.R. 651 (2/10/55), FOR THE RELIEF OF SAMUEL BELDEN AND CO. WAS REJECTED.  (P. 507-3)",,,Budget Special Interest,,Government Management,-1.864623751920321,-0.4209169900153626,-0.008,-0.406,-0.167,-0.518,0.6,0.831,-60.265337,
2016-10-19 13:03:23,RH0330516,33,House,516,1855-02-02,,86,59,"TO PASS H.R. 651 (2/10/55), FOR THE RELIEF OF SAMUEL A BELDEN AND CO. (P. 526-3)",,,Budget Special Interest,,Government Management,-1.7764169995839703,-0.45345030293385125,-0.159,-0.171,-0.172,-0.56,0.542,0.814,-54.316949,
2016-10-19 13:03:23,RH0330517,33,House,517,1855-02-03,,85,77,TO RESOLVE INTO THE COMMITTEE OF THE WHOLE HOUSE ON THE PRIVATE CALENDAR.  (P. 547-2),,,Internal Organization,,Miscellaneous Policy,2.757337365498105,-0.33101512764665675,0.445,0.896,0.041,-0.086,0.156,0.599,-108.361065,
2016-10-19 13:03:23,RH0330518,33,House,518,1855-02-05,,126,43,TO PASS A RESOLUTION PROVIDING THAT FEB. 8TH BE SET APART FOR THE CONSIDERATION OF BUSINESS REPORTED FROM THE COMMITTE ON THE JUDICIARY AND THAT FEB. 13TH BE SET APART FOR PUBLIC BILLS FROM THE COMMITTEE ON NAVAL AFFAIRS.  (P. 569-1),,,Internal Organization,,Miscellaneous Policy,-1.0291251342454517,-1.2317466186729793,-0.884,-0.322,-0.05,-0.281,-0.023,0.74,-88.799084,
2016-10-19 13:03:23,RH0330519,33,House,519,1855-02-05,,109,55,"TO PASS S. 256 (2/10/55) A BILL FOR THE RELIEF OF THE WEST FELICIANA RAILROAD AND THE GEORGIA RAILROAD AND BANKING CO.  (P. 569, 570)",,,Budget Special Interest,,Government Management,-0.02794049881381372,-0.4697178964365165,0.368,-0.48,-0.002,-0.414,0.127,0.707,-91.609792,
2016-10-19 13:03:23,RH0330520,33,House,520,1855-02-05,,103,73,"TO SUSPEND THE RULES AND CONSIDER A RESOLUTION PROVIDING THAT DURING THE REMAINDER OF THIS SESSION, DEBATE IN COMMITTEE OF THE WHOLE SHALL BE STRICTLY CONFINED TO THE PROPOSITION UNDER CONSIDERATION.  (P. 570-2)",,,Internal Organization,,Miscellaneous Policy,14.665768252379289,-0.4526415110666201,0.028,-0.042,0.071,-0.028,0.315,0.716,-102.381171,
2016-10-19 13:03:23,RH0330521,33,House,521,1855-02-05,,104,78,"TO SUSPEND THE RULES AND INTRODUCE A RESOLUTION THAT IN THE OPINION OF THIS HOUSE, THE EXISTENCE OF SECRET, OATH-BOUND POLITICAL ASSOCIATIONS, HAVING IN VIEW AN INTERFERENCE WITH THE SANCITY OF THE BALLOT-BOX, AND THE DIRECTION OF THE COURSE OF NATIONAL R MUNICIPAL LEGISLATION IS  INCONSISTENT WITH AND DANGEROUS TO THE INSTITUTION OF REPUBLICANISM AND HOSTILE TO THE GENIUS OF THIS GOVERNMENT",,,Domestic Social Policy,,Civil Liberties,19.57554332278579,0.9181081426899331,-0.061,-0.276,0.088,-0.026,0.41,0.747,-99.511571,
2016-10-19 13:03:23,RH0330522,33,House,522,1855-02-06,,62,78,TO ADJOURN.,,,Internal Organization,,Miscellaneous Policy,0.3029548371383516,-0.20480494102882885,0.577,-0.03,-0.044,0.84,0.468,0.764,-69.582284,
2016-10-19 13:03:23,RH0330523,33,House,523,1855-02-07,,120,82,"TO AMEND S. 96 (I/28/55) AN ACT TO PROVIDE FOR THE PAYMENT OF SUCH CREDITORS OF THE LATE REPUBLIC OF TEXAS AS ARE COMPREHENDED IN THE ACT OF CONGRESS OF SEPT 9, 1850, BY REDUCING THE APPROPRIATION FROM 8.5 MILLION TO $6.5 MILLION. (P. 617-1)",Banking and Finance,,Budget Special Interest,,Government Management,-0.40445337443772306,-0.01393356820536687,-0.524,0.198,0.04,0.572,0.305,0.718,-112.060284,
2016-10-19 13:03:23,RH0330524,33,House,524,1855-02-07,,29,161,TO AMEND S. 96 (2/28/55) A BILL TO PROVIDE FOR PAYMENT OF DEBTS OF LATE REPUBLIC OF TEXAS BY PROVIDING THAT THE SECRETARY OF TREASURY SHALL ISSUE SO MUCH STOCK TO THE STATE OF TEXAS AS TEXAS HAS ALREADY PAID IN DISCHARGING ITS DEBT. (P. 618-1),Banking and Finance,,Budget Special Interest,,Government Management,-4.226537762874205,-3.241806138126919,-0.573,-0.82,0.095,0.13,0.0,0.847,-77.551637,
2016-10-19 13:03:23,RH0330525,33,House,525,1855-02-07,,153,43,TO PASS S. 96 (2/28/55) PROVIDING PAYMENT TO CREDITORS OF THE REPUBLIC OF TEXAS.  (P. 619-2),Banking and Finance,,Budget Special Interest,,Government Management,-1.5613745667932324,-1.47569539217121,-0.826,-0.186,-0.071,-0.263,0.093,0.801,-95.539128,
2016-10-19 13:03:23,RH0330526,33,House,526,1855-02-07,,104,97,"THAT THE HOUSE RESOLVE ITSELF IN TO THE COMMITTEE OF THE WHOLE FOR THE PURPOSE OF TAKING UP H.R. 403, A BILL TO REDUCE THE DUTY ON IMPORTS.  (P. 619-3)",Tariffs,,Regulation General Interest,,Government Management,-6.966709374689779,-0.9697067905756748,-0.159,0.138,0.106,0.088,0.402,0.711,-108.063543,
2016-10-19 13:03:23,RH0330527,33,House,527,1855-02-08,,107,50,TO PASS H.R. 337 (2/17/55) A BILL TO REGULATE THE SALARIES OF THE DISTRICT JUDGES OF THE UNITED STATES.  (P. 630-2),Judiciary,,Budget Special Interest,Domestic Social Policy,Government Management,-0.16349634641581456,-0.46565852719818956,0.418,-0.534,-0.016,-0.566,0.28,0.771,-77.227009,
2016-10-19 13:03:23,RH0330528,33,House,528,1855-02-08,,117,38,"TO PASS S. 47 (2/10/55), PROVIDING FOR TWO JUDICIAL DISTRICT IN THE STATE OF OHIO.  (P. 632-1)",Judiciary,,Government Organization,Domestic Social Policy,Government Management,-0.9893142408943778,-1.0075743326830238,-0.227,-0.783,-0.039,-0.228,0.026,0.761,-81.399914,
2016-10-19 13:03:23,RH0330529,33,House,529,1855-02-08,,50,90,"TO COMMIT H.R. 742, A BILL TO AMEND THE ACT OF AUG. 31, 1852 MAKING FURTHER PROVISION FOR THE SATISFACTION OF VIRGINIA LAND WARRENTS TO THE COMMITTEE OF THE WHOLE HOUSE ON THE STATE OF THE UNION.  (P. 634-3)",Public Lands,,Budget Special Interest,,Government Management,1.4799424798175622,-0.3853423413039916,0.307,0.069,-0.087,0.34,0.46,0.807,-67.130061,
