date_generated,id,congress,chamber,rollnumber,date,keyvote,yea,nay,description,Issue1,Issue2,Peltzman1,Peltzman2,Clausen1,slope,intercept,mid.dim1,mid.dim2,spread.dim1,spread.dim2,pre,classified,log_likelihood,vote_result
2016-10-19 13:03:23,RH0260544,26,House,544,1840-07-07,,153,10,TO PASS H.R. 6.,,,Defense Policy Budget,,Foreign and Defense Policy,1.868914856603528,-2.118072052090347,0.892,-0.451,0.169,-0.523,0.0,0.939,-35.641776,
2016-10-19 13:03:23,RH0260545,26,House,545,1840-07-08,,58,125,TO RECONSIDER VOTE BY WHICH H.R. 6 WAS PASSED.,,,Defense Policy Budget,,Foreign and Defense Policy,-11.357050754211262,-4.344251083583434,-0.376,-0.074,0.108,0.055,0.0,0.683,-97.126574,
2016-10-19 13:03:23,RH0260546,26,House,546,1840-07-09,,68,89,"TO AMEND S.J.R. 16, (APP. 7-20-40), A BILL AUTHORIZING THE PRESIDENT TO ACCEPT PRESENTS FROM THE IMAUM OF MUSCAT AND THE EMPEROR OF MOROCCO, TO SELL SAID PRESENTS AND PLACE PROCEEDS IN U.S. TREASURY; SAID AMEND. AUTHORIZING THE DISTRIBUTION THE PROCEEDS MONG THE INSTITUTIONS IN THE DISTRICT OF COLUMBIA FOR THE SUPPORT OF ORPHANS.",Welfare,,Domestic Social Policy,Defense Policy Budget,Social Welfare,-0.9866283198783748,0.08479856552002929,-0.658,0.734,-0.029,-0.17,0.075,0.603,-101.267274,
2016-10-19 13:03:23,RH0260547,26,House,547,1840-07-09,,75,87,TO ORDER ENGROSSMENT AND THIRD READING OF S.J.R. 16.,Welfare,,Domestic Social Policy,Defense Policy Budget,Social Welfare,-2.5804125289126723,-0.5595535828450597,0.161,-0.975,0.145,0.325,0.649,0.839,-65.318139,
2016-10-19 13:03:23,RH0260548,26,House,548,1840-07-09,,39,33,TO ADJOURN.,,,Internal Organization,,Miscellaneous Policy,-2.143759044123962,-0.376929106542621,0.237,-0.885,-0.096,-0.259,0.469,0.761,-36.511691,
2016-10-19 13:03:23,RH0260549,26,House,549,1840-07-10,,43,85,"TO ORDER A CALL OF THE HOUSE, MOTION MADE DURING CONSIDER- -ATION OF S.J.R. 16.",Welfare,,Domestic Social Policy,Defense Policy Budget,Social Welfare,3.1617468457711606,-1.4689090142487586,0.154,-0.982,-0.041,0.075,0.047,0.68,-80.307947,
2016-10-19 13:03:23,RH0260550,26,House,550,1840-07-10,,86,66,"TO SUSTAIN THE CHAIR'S DECISION THAT A SUBMITTED RES., BEING A QUESTION OF PRIVILEGE, SUSPENDED THE MOTION TO RECONSIDER THE VOTE BY WHICH THE HOUSE REJECTED S.J.R. 16, AND THAT SAID RESOLUTION WAS OPEN TO DEBATE, SAID RESOLUTION STATING THAT THE CLERK HS VIOLATED HIS OFFICIAL DUTY IN RETAINING A SENATE RESOLUTION.",Welfare,,Domestic Social Policy,Defense Policy Budget,Social Welfare,-1.9949769773324542,-0.6535726245841003,0.114,-0.881,-0.228,-0.661,0.727,0.881,-41.259804,
2016-10-19 13:03:23,RH0260551,26,House,551,1840-07-10,,75,79,TO TABLE RESOLUTION THAT THE CLERK HAS VIOLATED HIS OFFICIAL DUTY IN RETAINING A SENATE RESOLUTION.,,,Internal Organization,,Miscellaneous Policy,-1.9001549301221663,-0.4805603378887254,0.256,-0.967,0.137,0.417,0.587,0.797,-63.70765,
2016-10-19 13:03:23,RH0260552,26,House,552,1840-07-10,,59,101,TO TABLE A RESOLUTION THAT THE CLERK VIOLATED HIS OFFICIAL DUTY IN RETAINING A SENATE RESOLUTION.,,,Internal Organization,,Miscellaneous Policy,-3.161498885074292,0.005109775386649917,-0.247,0.786,-0.17,-0.311,0.569,0.843,-55.180833,
2016-10-19 13:03:23,RH0260553,26,House,553,1840-07-10,,108,54,TO RECONSIDER THE VOTE BY WHICH THE HOUSE REJECTED S.J.R.16.,Welfare,,Domestic Social Policy,Defense Policy Budget,Social Welfare,-4.031691611685229,0.22931733383545727,0.294,-0.956,0.191,0.274,0.574,0.858,-50.438699,
2016-10-19 13:03:23,RH0260554,26,House,554,1840-07-10,,70,76,"TO RECONSIDER THE VOTE TO REJECT AN AMENDMENT TO S.J.R. 16, SAID AMENDMENT AUTHORIZING THE PRESIDENT TO DISPENSE, AT HIS PLEASURE, PRESENTS FROM OTHER LANDS, AND TO DISTRIBUTE THE PROCEEDS AMONG THE INSTITUTIONS FOR ORPHANS IN THE DISTRICT.",Welfare,,Domestic Social Policy,Defense Policy Budget,Social Welfare,-3.8219661272158865,-0.4788440722627801,-0.175,0.19,-0.113,-0.171,0.594,0.807,-67.841779,
2016-10-19 13:03:23,RH0260555,26,House,555,1840-07-10,,81,76,"TO AMEND S.J.R. 16, SAID AMENDMENT AUTHORIZING THE PRESIDENT TO DISPENSE PRESENTS FROM OTHER LANDS AT HIS PLEASURE, AND TO PLACE PROCEEDS IN THE U.S. TREASURY.",Welfare,,Domestic Social Policy,Defense Policy Budget,Social Welfare,-1.7235376098289128,-0.2806525066790676,0.053,-0.372,0.149,0.5,0.8,0.904,-41.943418,
2016-10-19 13:03:23,RH0260556,26,House,556,1840-07-10,,81,66,TO ORDER ENGROSSMENT OF AMENDMENT AND THIRD READING OF S.J.RES. 16.,Welfare,,Domestic Social Policy,Defense Policy Budget,Social Welfare,-1.9196201931825325,-0.2041208988521206,0.213,-0.613,0.232,0.699,0.831,0.925,-28.016859,
2016-10-19 13:03:23,RH0260557,26,House,557,1840-07-10,,82,72,"TO PASS S.J.R. 16, AS AMENDED.",Welfare,,Domestic Social Policy,Defense Policy Budget,Social Welfare,-1.6931157068089693,-0.25939673560213455,-0.015,-0.234,0.25,0.854,0.889,0.948,-20.555683,
2016-10-19 13:03:23,RH0260558,26,House,558,1840-07-10,,63,64,TO ADJOURN.,,,Internal Organization,,Miscellaneous Policy,-3.0632946881326677,-0.5445837690157205,-0.42,0.742,0.134,0.253,0.651,0.827,-60.081636,
2016-10-19 13:03:23,RH0260559,26,House,559,1840-07-10,,79,54,TO SUSPEND THE RULES AND RESOLVE THE HOUSE INTO THE COMM. OF THE WHOLE TO CONSIDER THE BUSINESS BEFORE THAT COMMITTEE.,,,Internal Organization,,Miscellaneous Policy,-3.555668069364246,-0.11311538663584136,-0.038,0.022,0.233,0.379,0.852,0.939,-23.022709,
2016-10-19 13:03:23,RH0260560,26,House,560,1840-07-13,,73,55,TO ORDER A CALL OF THE HOUSE.,,,Internal Organization,,Miscellaneous Policy,-4.017118913139192,-0.10577035109126363,-0.045,0.075,0.166,0.239,0.782,0.906,-38.01992,
2016-10-19 13:03:23,RH0260561,26,House,561,1840-07-13,,110,66,"TO SUSPEND THE RULES AND SUBMIT A RESOL. PROPOSING THAT THE COMMITTEE ON THE JUDICIARY REPORT TO HIS HOUSE, WHO ARE LEGAL WITNESSES IN THE LT. HOOE CASE, AND WHO SHALL, IN THE FUTURE, BE EXAMINED AS WITNESSES IN COURT MARTIALS.",,,Defense Policy Resolutions,,Foreign and Defense Policy,-3.793288518510804,0.06859194407383493,0.031,-0.049,0.263,0.401,0.8,0.926,-29.997695,
2016-10-19 13:03:23,RH0260562,26,House,562,1840-07-14,,29,112,TO ORDER A CALL OF THE HOUSE.,,,Internal Organization,,Miscellaneous Policy,-0.2409868022691433,0.6129791391199492,0.141,0.579,-0.013,-0.312,0.036,0.807,-63.234655,
2016-10-19 13:03:23,RH0260563,26,House,563,1840-07-14,,18,133,"TO EXCUSE MR. E. STANLY FROM VOTING ON A MOTION TO SUSPEND THE RULES AND INSTRUCT THE JUDICIARY COMMITTEE TO REPORT A BILL PROHIBITING ENLISTMENT OF COLORED PERSONS IN THE NAVY AND ARMY, BECAUSE THE COMMITTEE HAD NOT YET HAD TIME TO INVESTIGATE THE REPOR OF SUCH A BILL.",Slavery,,Defense Policy Resolutions,,Foreign and Defense Policy,3.8683076312293654,3.971756247285842,-0.989,0.146,0.103,-0.154,0.0,0.887,-51.703048,
2016-10-19 13:03:23,RH0260564,26,House,564,1840-07-14,,108,73,TO SUSPEND THE RULES TO SUBMIT A RESOLUTION THAT THE JUDICIARY COMMITTEE REPORT A BILL PROHIBITING THE ENLISTMENT OF NEGROES IN THE NAVY OR ARMY OF THE U.S.,Slavery,,Defense Policy Resolutions,,Foreign and Defense Policy,-6.588532380484538,-0.5192697561362064,-0.116,0.245,0.352,0.309,0.903,0.961,-26.154007,
2016-10-19 13:03:23,RH0260565,26,House,565,1840-07-14,,27,105,TO ADJOURN.,,,Internal Organization,,Miscellaneous Policy,-0.8947643950280153,0.40998952988935417,-0.38,0.75,-0.097,-0.627,0.154,0.832,-36.85302,
2016-10-19 13:03:23,RH0260566,26,House,566,1840-07-14,,34,52,TO ADJOURN.,,,Internal Organization,,Miscellaneous Policy,-1.414103485197907,-0.14130305412528665,-0.532,0.611,-0.2,-0.818,0.794,0.919,-18.262881,
2016-10-19 13:03:23,RH0260567,26,House,567,1840-07-14,,39,53,TO ADJOURN.,,,Internal Organization,,Miscellaneous Policy,-2.1150263819919393,-0.15259701760985594,-0.266,0.41,-0.162,-0.443,0.816,0.923,-22.656949,
2016-10-19 13:03:23,RH0260568,26,House,568,1840-07-14,,70,35,A CALL OF THE HOUSE.,,,Internal Organization,,Miscellaneous Policy,-1.4625405930816973,0.15719220612831414,-0.192,0.438,0.088,0.348,0.471,0.827,-42.340644,
2016-10-19 13:03:23,RH0260569,26,House,569,1840-07-14,,40,75,TO ADJOURN.,,,Internal Organization,,Miscellaneous Policy,-2.2949018417923917,0.12906826956379125,-0.288,0.79,-0.173,-0.436,0.675,0.887,-33.849734,
2016-10-19 13:03:23,RH0260570,26,House,570,1840-07-14,,24,62,TO ADJOURN.,,,Internal Organization,,Miscellaneous Policy,-0.9726314181673533,-0.03254101468749537,-0.236,0.197,-0.168,-0.999,0.652,0.906,-16.436494,
2016-10-19 13:03:23,RH0260571,26,House,571,1840-07-15,,23,102,"***MISSING TEXT*** STANLY'S REASON FOR EXCLUSION FROM VOTING ON A MOTION TO SUBMIT A RESOLUTION PROPOSING THAT THE JUDICIARY COMMITTEE REPORT A BILL PROHIBITING THE ENLISTMENT OF NEGROES IN THE U.S. NAVY AND ARMY, SAID REASON BEING THE COMMITTEE HAD NOT IME TO INVESTIGATE AND REPORT SUCH A BILL.",Slavery,,Defense Policy Resolutions,,Foreign and Defense Policy,-1.2009309083179898,0.5687579638373226,-0.26,0.881,-0.125,-0.602,0.217,0.856,-37.566375,
2016-10-19 13:03:23,RH0260572,26,House,572,1840-07-15,,123,20,"TO CONCUR IN AMENDMENT TO H.R. 5, THE ARMY APPROPRAITION BILL, (APP.7-20-40), A BILL MAKING APPROPRIATIONS FOR THE ARMY FOR 1840, SAID AMENDMENT TO APPROPRIATE $300,000 FOR HOSTILITIES IN FLORIDA, ARREARAGES, AND MISCELLANEOUS.",,,Defense Policy Budget,,Foreign and Defense Policy,-10.165261477534772,3.2607437047379664,0.301,0.201,0.174,0.099,0.35,0.909,-32.498596,
2016-10-19 13:03:23,RH0260573,26,House,573,1840-07-15,,147,0,TO ORDER ENGROSSMENT AND THIRD READING OF H.R. 5.,,,Defense Policy Budget,,Foreign and Defense Policy,,,0.0,0.0,0.0,0.0,-3400000.0,0.769,0.0,
2016-10-19 13:03:23,RH0260574,26,House,574,1840-07-15,,38,61,TO ADJOURN.,,,Internal Organization,,Miscellaneous Policy,-2.3949616225510737,-0.2124965953386851,-0.219,0.312,-0.241,-0.582,0.868,0.949,-15.643728,
2016-10-19 13:03:23,RH0260575,26,House,575,1840-07-15,,36,55,TO ADJOURN.,,,Internal Organization,,Miscellaneous Policy,-2.1435483759789027,-0.19593548720632914,0.3,-0.839,-0.275,-0.742,0.806,0.923,-18.807825,
2016-10-19 13:03:23,RH0260576,26,House,576,1840-07-16,,52,88,TO ORDER A CALL OF THE HOUSE.,,,Internal Organization,,Miscellaneous Policy,-2.6026574645067475,0.33595886089187993,-0.166,0.768,-0.054,-0.12,0.098,0.669,-84.175983,
2016-10-19 13:03:23,RH0260577,26,House,577,1840-07-16,,114,64,"TO SUSPEND THE RULES, AND SUBMIT 2 REPORTS FROM THE COMMITTEE OF ELECTIONS.",Disputed Elections to Congress,,Internal Organization,,Miscellaneous Policy,-2.4798983754875947,0.15135928862841316,0.007,0.134,0.301,0.702,0.828,0.938,-26.74917,
2016-10-19 13:03:23,RH0260578,26,House,578,1840-07-16,,123,66,"TO ORDER THE PREVIOUS QUESTION, ON SUSTAINING THE CHAIR'S DECISION REGARDING THE RIGHT TO SUBMIT REPORTS FROM THE COMM. OF ELECTIONS.",Disputed Elections to Congress,,Internal Organization,,Miscellaneous Policy,-2.4620449817148438,0.10600347765134771,-0.145,0.463,0.232,0.545,0.785,0.926,-34.900443,
2016-10-19 13:03:23,RH0260579,26,House,579,1840-07-16,,86,95,TO SUSTAIN THE CHAIR'S DECISION THAT IT IS NOT IN ORDER FOR THE COMMITTEE OF ELECTIONS TO SUBMIT REPORTS AT THIS TIME.,Disputed Elections to Congress,,Internal Organization,,Miscellaneous Policy,-1.5462224133122273,-0.3435293293204432,0.021,-0.376,-0.343,-1.283,0.894,0.95,-19.03192,
2016-10-19 13:03:23,RH0260580,26,House,580,1840-07-16,,124,39,"TO SUSTAIN THE CHAIR'S DECISION THAT THE SITTING MEMBERS FROM N.J., HAD THE RIGHT TO VOTE ON THE QUESTION OF WHEN TO RECEIVE THE REPORTS OF THE COMMITTEE OF ELECTIONS REGARDING THE RIGHT OF CERTAIN PERSONS TO SEATS IN THE HOUSE.",Disputed Elections to Congress,,Internal Organization,,Miscellaneous Policy,-1.2219049129139659,0.3417666719519888,0.035,0.299,0.105,0.497,0.333,0.84,-49.111759,
2016-10-19 13:03:23,RH0260581,26,House,581,1840-07-16,,65,100,"TO RECONSIDER THE VOTE ORDERING THE PREVIOUS QUESTION ON A RESOLUTION TO PRINT A REPORT OF THE MAJORITY OF THE COMM. OF ELECTIONS ON THE N.J., CONTESTED ELECTIONS.",Disputed Elections to Congress,,Internal Organization,,Miscellaneous Policy,-2.433546599142601,-0.16443071027653455,-0.144,0.186,-0.531,-1.262,0.969,0.988,-7.071927,
2016-10-19 13:03:23,RH0260582,26,House,582,1840-07-16,,174,1,"TO PRINT MAJORITY REPORT OF THE COMMITTEE OF ELECTIONS ON THE N.J., CONTESTED ELECTIONS, SAID REPORT TO ENTITLE THE SITTING MEMBERS FROM N.J. TO THEIR SEATS.",Disputed Elections to Congress,,Internal Organization,,Miscellaneous Policy,,,0.0,0.0,0.0,0.0,-44.0,0.741,0.0,
2016-10-19 13:03:23,RH0260583,26,House,583,1840-07-16,,154,18,"TO PRINT THE JOURNAL OF THE COMMITTEE OF ELECTIONS ON THE N.J., CONTESTED ELECTIONS.",Disputed Elections to Congress,,Internal Organization,,Miscellaneous Policy,-5.997893745365346,-3.5967889035850735,-0.575,-0.148,-0.196,-0.189,0.056,0.901,-45.368426,
2016-10-19 13:03:23,RH0260584,26,House,584,1840-07-16,,102,69,TO PRINT THE MINORITY REPORT OF THE COMMITTEE OF ELECTIONS SAID REPORT RECOMMENDING THAT THE SITTING MEMBERS FROM N.J. BE ENTITLED TO THEIR SEATS.,Disputed Elections to Congress,,Internal Organization,,Miscellaneous Policy,-1.8282418239742562,-0.5897671437116653,-0.013,-0.566,-0.318,-1.006,0.826,0.929,-26.535311,
2016-10-19 13:03:23,RH0260585,26,House,585,1840-07-16,,67,74,"TO ORDER A CALL OF THE HOUSE, MOTION DURING CONSIDERATION OF THE COMM. OF ELECTIONS RECOMMENDATION THAT THE SITTING MEMBERS FROM N.J. BE ENTITLED TO THEIR SEATS.",Disputed Elections to Congress,,Internal Organization,,Miscellaneous Policy,-2.0047029607090483,-0.3456707927503666,0.07,-0.486,-0.087,-0.251,0.552,0.787,-68.273377,
2016-10-19 13:03:23,RH0260586,26,House,586,1840-07-16,,101,85,TO ORDER THE PREVIOUS QUESTION ON ADOPTING THE RESOL. OF THE COMMITTEE OF ELECTIONS ENTITLING THE PRESENT OCCUPANTS FROM N.J. TO THEIR SEATS.,Disputed Elections to Congress,,Internal Organization,,Miscellaneous Policy,-2.069391256182735,-0.29836781958466924,-0.135,-0.019,0.507,1.417,0.964,0.984,-7.609789,
2016-10-19 13:03:23,RH0260587,26,House,587,1840-07-16,,69,101,TO EXCUSE MR. H. EVERETT FROM VOTING ON THE RESOLUTION ENTITLING THE SEATING MEMBERS FROM N.J. TO THEIR SEATS.,Disputed Elections to Congress,,Internal Organization,,Miscellaneous Policy,-2.082949271712794,-0.16848846207473656,-0.464,0.798,-0.506,-1.405,0.956,0.982,-13.258923,
2016-10-19 13:03:23,RH0260588,26,House,588,1840-07-16,,34,107,"TO ADJOURN, MOTION MADE DURING CONSIDERATION OF A RESOLUTION ENTITLING THE SITTING MEMBERS FROM N.J. TO THEIR SEATS.",Disputed Elections to Congress,,Internal Organization,,Miscellaneous Policy,2.3563153999649566,1.797124067187104,-0.368,0.93,0.055,-0.135,0.029,0.764,-75.405649,
2016-10-19 13:03:23,RH0260589,26,House,589,1840-07-16,,101,22,TO ADOPT A RESOLUTION THAT THE SITTING MEMBERS FROM N.J. ARE ENTITLED TO THEIR SEATS.,Disputed Elections to Congress,,Internal Organization,,Miscellaneous Policy,-1.980036758288249,-0.08778224225558319,-0.061,0.033,0.481,1.405,0.952,0.992,-3.236871,
2016-10-19 13:03:23,RH0260590,26,House,590,1840-07-17,,99,30,TO TABLE MOTION TO SUSPEND THE RULES AND SUBMIT A RESOL. TO ENTER CERTAIN INFORMATION IN THE JOURNAL.,,,Internal Organization,,Miscellaneous Policy,-1.9651741444710253,0.46355224030263154,0.099,0.269,0.123,0.362,0.069,0.789,-42.901774,
2016-10-19 13:03:23,RH0260591,26,House,591,1840-07-17,,88,75,"TO TABLE MOTION TO AMEND JOURNAL OF JULY 16, 1840, SAID AMENDMENT TO INSERT IN JOURNAL:  ""THAT MR. EVANS MOVED TO THE TESTIMONY IN THE N.J. CASE READ, TO WHICH MR. DROMGOOLE OBJECTED.""",Disputed Elections to Congress,,Internal Organization,,Miscellaneous Policy,-1.975739973056217,-0.14704271116243928,-0.328,0.501,0.468,1.37,0.959,0.981,-9.701674,
2016-10-19 13:03:23,RH0260592,26,House,592,1840-07-17,,26,73,TO ADJOURN.,,,Internal Organization,,Miscellaneous Policy,-1.3493447291683358,0.2550350428117739,-0.435,0.842,-0.248,-1.063,0.692,0.919,-18.356128,
2016-10-19 13:03:23,RH0260593,26,House,593,1840-07-17,,16,42,TO ADJOURN.,,,Internal Organization,,Miscellaneous Policy,-12.549501401185575,-1.3487966499268564,-0.107,-0.006,-0.23,-0.106,0.467,0.86,-15.362203,
2016-10-19 13:03:23,RH0260594,26,House,594,1840-07-17,,22,34,TO ADJOURN.,,,Internal Organization,,Miscellaneous Policy,-4.385014755015001,-0.6745014755015001,-0.1,-0.236,-0.116,-0.153,0.476,0.8,-25.702362,
2016-10-19 13:03:23,RH0260595,26,House,595,1840-07-18,,34,99,TO SUSPEND THE RULES AND INTRODUCE A RESOLUTION THAT THE COMMITTEE OF ELECTIONS INCREASE THEIR PAYMENT TO THEIR CLERK.,,,Internal Organization,,Miscellaneous Policy,-3.3738152317680066,1.4495640052906265,0.368,0.208,-0.07,-0.12,-0.03,0.742,-71.464229,
2016-10-19 13:03:23,RH0260596,26,House,596,1840-07-18,,81,59,"TO SUSPEND THE RULES AND INTRODUCE A RESOLUTION THAT THE CLERK PAY THE UNSEATED CLAIMANTS TO THE N.J. SEATS THE SAME COMPENSATION AND MILEAGE, PAID TO THE SITTING MEMBERS FROM N.J.",Disputed Elections to Congress,,Internal Organization,,Miscellaneous Policy,-3.043017159175961,-0.7565162059101115,-0.012,-0.72,-0.312,-0.593,0.797,0.914,-25.45673,
2016-10-19 13:03:23,RH0260597,26,House,597,1840-07-18,,48,86,"TO SUSPEND THE RULES AND INTRODUCE A RESOLUTION THAT THE CLERK PAY MR. C. INGERSOLL THE SAME COMPENSATION PER DIEM AND MILEAGE ALLOWED TO MEMBERS OF CONGRESS, UP TO JULY 17.",Disputed Elections to Congress,,Internal Organization,,Miscellaneous Policy,-1.279083796659299,0.2891109058794885,-0.383,0.779,-0.046,-0.208,0.149,0.699,-76.473936,
2016-10-19 13:03:23,RH0260598,26,House,598,1840-07-18,,92,63,"TO SUSPEND THE RULES AND COMMIT H.R. 100, ""AN ACT TO ENSURE FAITHFUL EXECUTION OF THE LAWS ON COLLECTION OF DUTIES ON IMPORTS,"" TO THE COMMITTEE OF THE WHOLE.",Tariffs,,Regulation General Interest,,Government Management,4.505184850842089,0.9315732641243124,-0.207,-0.001,-0.148,0.19,0.508,0.799,-64.75448,
2016-10-19 13:03:23,RH0260599,26,House,599,1840-07-18,,78,67,"TO CONCUR IN AN AMENDMENT TO H.R. 4, (APP. 7-20-40), A BILL MAKING APPROPRIATIONS FOR THE CURRENT AND CONTINGENT EXPENSES OF THE INDIAN DEPARTMENT, AND FULFILLING TREATY STIPULATIONS, WITH INDIAN TRIBES FOR 1840, SAID AMENDMENT TO APPROPRIATE $38,646 FORPAYMENT OF THE CLAIM PRESENTED BY THE ALABAMA EMIGRATING COMPANY.",,,Indian Affairs,Budget Special Interest,Government Management,-1.8277440587685672,-0.20697711147855774,0.145,-0.472,0.146,0.462,0.806,0.91,-39.367473,
2016-10-19 13:03:23,RH0260600,26,House,600,1840-07-18,,81,52,"TO CONCUR IN AMENDMENT TO H.R. 4, SAID AMENDMENT TO APPROP- -RIATE $45,000 FOR EXPENSES IN INVOLVED IN MOVING WINNEBAGO INDIANS.",,,Indian Affairs,Budget Special Interest,Government Management,-1.881624952117471,0.012591875239412643,-0.005,0.022,0.122,0.375,0.725,0.894,-41.550908,
2016-10-19 13:03:23,RH0260601,26,House,601,1840-07-18,,77,57,"TO CONCUR IN AMENDMENT TO H.R. 4, SAID AMENDMENT TO APPROPRIATE APPROXIMATELY $32,000 TO EFFECT THE TREATY WITH THE STOCKBRIDGE AND MAUME INDIAN TRIBE.",Treaties,,Indian Affairs,Budget Special Interest,Government Management,-2.3926279093098146,-0.058322023976732695,-0.309,0.681,0.266,0.643,0.893,0.955,-20.391142,
2016-10-19 13:03:23,RH0260602,26,House,602,1840-07-18,,61,78,"TO CONCUR IN THE AMENDMENT TO H.R. 4, SIAD AMENDMENT TO APPROPRIATE $5,000 FOR HOLDING A TREATY WITH CHEROKEE INDIANS.",Treaties,,Indian Affairs,Budget Special Interest,Government Management,-3.5129766246276524,-0.40140307526712793,0.046,-0.563,-0.345,-0.568,0.918,0.964,-15.308305,
2016-10-19 13:03:23,RH0260603,26,House,603,1840-07-18,,34,97,"TO CONCUR IN AMENDMENT TO S. 397, (APP.7-20-40), A BILL TO PROVIDE FOR EXPENSES MAKING AN EXPLORATION AND SURVEY OF THAT PART OF THE U.S. BOUNDARY SEPARATING MAINE AND N.H. FROM BRITISH PROVINCES, SAID AMENDMENT TO PROVIDE $20,000 FOR ESTABLISHMENT OF STTIONS FOR OBSERVATIONS OF TERRESTRIAL NAVIGATION AND METEOROLOGY FOR THREE YEARS",,,Budget Special Interest,,Government Management,-11.899762098255628,1.7789643147383443,0.15,-0.006,-0.179,-0.087,0.667,0.915,-35.106925,
2016-10-19 13:03:23,RH0260604,26,House,604,1840-07-18,,42,93,"TO ORDER A CALL OF THE HOUSE, MOTION MADE DURING CONSIDERA- TION OF H.R. 6, (APP. 20-40), A BILL AUTHORIZING THE PRES. TO ACCEPT PRESENTS FROM THE IMAUM OF MUSCAT AND THE COMPEROR OF MORACCO, TO SELL SAID PRESENTS AND PLACE PROCEEDS IN TREASURY.",,,Budget Special Interest,Defense Policy Budget,Government Management,-2.3500018276014143,0.03664937678791769,-0.341,0.838,-0.193,-0.475,0.738,0.919,-31.791355,
2016-10-19 13:03:23,RH0260605,26,House,605,1840-07-18,,93,62,"TO CONCUR IN THE SENATE AMENDMENT TO H.R. 6, (APP. 7-20-40), A BILL MAKING APPROPRIATIONS FOR THE NAVY FOR 1840, SAID AMENDMENT PROVIDING THAT SEVERAL RECENT APPROPRIATIONS FOR IMPROVEMENT AND REPAIR OF NAVY YARDS WILL NOT BE EXPENDED BEFORE MARCH 4, 184, UNLESS ABSOLUTELY NECESSARY FOR PRESERVATION OF PUBLIC WORKS AND PUBLIC BUSINESS AT SAID YARDS",,,Defense Policy Budget,,Foreign and Defense Policy,-5.568333346048714,-0.5051500011443842,-0.09,-0.004,0.362,0.376,0.919,0.968,-15.872169,
2016-10-19 13:03:23,RH0260606,26,House,606,1840-07-18,,91,51,"TO CONCUR IN THE SENATE AMENDMENT TO H.R. 6, SAID AMENDMENT TO ELIMINATE FROM SECOND SECTION THE WORDS.""  ""A VIOLATION OF EXISTING CONTRACTS,"" AND INSERT, ""IMPAIRING THE ABILITY OF THE NAVY TO MAKE PAYMENTS UNDER EXISTING CIRCUMSTANCES PRIOR TO MAR. 4, 141.""  (IN REFERENCE TO DIVERTING PART OF NAVAL APPROPRIATIONS FOR COMPLETING TWO STEAM VESSELS)""",,,Defense Policy Budget,,Foreign and Defense Policy,-4.751424825842006,-0.31609688815725645,-0.068,0.007,0.313,0.381,0.863,0.951,-15.92258,
2016-10-19 13:03:23,RH0260607,26,House,607,1840-07-18,,93,49,"TO CONCUR IN AN AMENDMENT TO H.R. 6, SAID AMENDMENT TO ELIMINATE FROM THE SECOND SECTION THE FOLLOWING WORDS: ""AND THE RESIDUE OF THE SAID SUM OF $340,000 SHALL BE AND THE SAME HEREBY IS APPROPRIATED, AND SHALL BE PAID OUT OF ANY MONEY IN THE TREASURY NO OTHERWISE APPROPRIATED.""",,,Defense Policy Budget,,Foreign and Defense Policy,-3.147004123749989,0.058647934020000174,-0.016,0.109,0.185,0.34,0.776,0.923,-30.742766,
2016-10-19 13:03:23,RH0260608,26,House,608,1840-07-18,,84,55,"TO CONCUR IN SENATE AMENDMENT TO H.R. 6, SAID AMENDMENT TO STRIKE OUT THE PASSAGE APPROPRIATING $60,000 FOR THE BUILD- -ING OF A STEAM VESSEL OF WAR.",,,Defense Policy Budget,,Foreign and Defense Policy,-3.488097632844095,-0.2960482129453357,-0.248,0.569,0.234,0.388,0.855,0.942,-26.794293,
2016-10-19 13:03:23,RH0260609,26,House,609,1840-07-18,,95,50,"TO CONCUR IN THE SENATE AMENDMENT TO H.R. 6, SAID AMENDMENT TO STRIKE OUT: ""FOR THE PURCHASE OF A SITE AND THE CONSTRUCTION OF A DRY DOCK FOR THE NAVAL SERVICE IN THE HARBOR OF N.Y., AS AUTHORIZED BY THE ACT OF MARCH 3, 1835.""",,,Defense Policy Budget,,Foreign and Defense Policy,-5.858472262060208,-0.10480806264671694,-0.178,0.938,0.235,0.232,0.72,0.903,-35.168814,
2016-10-19 13:03:23,RH0260610,26,House,610,1840-07-18,,65,89,"TO CONCUR IN THE SENATE AMENDMENT TO H.R. 6, SAID AMENDMENT TO APPROPRIATE $30,000 FOR SURVEY OF COAST TO ASCERTAIN THE PRACTICABILITY OF ESTABLISHING A NAVY YARD AND NAVAL STATION FOR PROTECTION OF COMMERCE OF GULF OF MEXICO.",,,Defense Policy Budget,,Foreign and Defense Policy,13.613900583573756,3.050432602125407,-0.175,0.668,0.153,-0.065,0.431,0.758,-71.20794,
2016-10-19 13:03:23,RH0260611,26,House,611,1840-07-20,,32,126,TO ADOPT A RESOLUTION THAT SEVERAL OFFICERS OF THE HOUSE BE PAID THE SAME COMPENSATION AS THE SENATE PAID THEIR OFFICERS AND THAT SEVERAL OTHERS IN THE SERVICE OF THE HOUSE BE PAID THE USUAL EXTRA COMPENSATION.,,,Internal Organization,Budget Special Interest,Government Management,-6.190984892097428,4.031312143890663,0.52,0.812,-0.076,-0.071,0.0,0.797,-81.061599,
2016-10-19 13:03:23,RH0260612,26,House,612,1840-07-20,,86,64,TO TABLE MOTION TO RECONSIDER THE VOTE TO PAY HOUSE OFFICERS EXTRA.,,,Internal Organization,Budget Special Interest,Government Management,-2.933153650475858,-0.11793045840761372,-0.016,-0.071,0.071,0.14,0.359,0.727,-83.710604,
2016-10-19 13:03:23,RH0260613,26,House,613,1840-07-20,,80,89,"TO RECEDE FROM DISAGREEMENT TO A SENATE AMENDMENT TO H.R. 6, SAID AMENDMENT TO APPROPRIATE $30,000 FOR SURVEY OF APPALACHIA BAY.",,,Budget Special Interest,,Government Management,6.8633041286252015,1.0772726656216527,-0.137,0.137,0.178,-0.15,0.562,0.793,-67.432628,
2016-10-19 13:03:23,RH0260614,26,House,614,1840-07-20,,119,44,"TO SUSPEND THE RULES AND SUBMIT A RESOLUTION THAT THE HOUSE RULES BE SO FAR SUSPENDED THAT THE COMMITTEE OF THE WHOLE BE DISCHARGED FROM CONSIDERATION OF H.R. 5, A BILL MAKING APPROPRIATIONS FOR THE ARMY FOR THE YEAR 1840, WITH ADOPTED AND PENDING AMENDMNTS AND THE BILL BE TAKEN UP BY THE HOUSE UNTIL DISPOSED OF.",,,Defense Policy Budget,,Foreign and Defense Policy,-1.9250675934930979,0.36827925839006515,0.063,0.247,0.227,0.682,0.545,0.877,-37.127798,
2016-10-19 13:03:23,RH0260615,26,House,615,1840-07-20,,54,84,"TO AGREE TO SENATE AMENDMENT TO H.R. 5, SAID AMENDMENT TO APPROPRIATE $6,000 FOR MINISTERS RESIDENT AT CONSTANTINOPLE.",,,Foreign Policy Budget,,Foreign and Defense Policy,-1.3380162752853926,-0.6652562566843596,0.23,-0.973,0.062,0.268,0.278,0.717,-74.534109,
2016-10-19 13:03:23,RH0260616,26,House,616,1840-07-20,,49,99,"TO CONCUR IN THE SENATE AMENDMENT TO H.R. 5, SAID AMENDMENT FOR USE OF PUBLIC WORKS AT FORT SNELLING.  (P. 544)",Public Works,,Defense Policy Budget,,Foreign and Defense Policy,0.4415025385083541,-0.7442198988903945,0.945,-0.327,-0.03,0.393,-0.082,0.642,-92.695072,
2016-10-19 13:03:23,RH0260617,26,House,617,1840-07-20,,92,79,"TO AGREE TO SENATE AMENDMENT TO H.R. 5, THAT THE PRESIDENT OF THE U.S. SUSPEND CERTAIN AMOUNT OF APPROPRIATIONS IN CASE OF DEFICIENCY OF CUSTOMS RECEIPTS OR FAILURE OF U.S. BANK AND DEPOSIT BANKS TO PAY THE DEBTS DUE FROM THEM.",,,Budget General Interest,,Government Management,-2.793697041617346,-0.3868654674911223,-0.18,0.116,0.612,1.267,0.987,0.994,-3.004325,
