date_generated,id,congress,chamber,rollnumber,date,keyvote,yea,nay,description,Issue1,Issue2,Peltzman1,Peltzman2,Clausen1,slope,intercept,mid.dim1,mid.dim2,spread.dim1,spread.dim2,pre,classified,log_likelihood
2017-01-22 01:59:02,RS1130001,113,Senate,1,2013-01-24,,78,16,A resolution to improve procedures for the consideration of legislation and nominations in the Senate.,,,Internal Organization,,Miscellaneous Policy,39.92607149852645,-21.693409322230806,0.522,-0.852,0.214,-0.031,0.562,0.926,-20.313227
2017-01-22 01:59:02,RS1130002,113,Senate,2,2013-01-24,,86,9,A resolution amending the Standing Rules of the Senate.,,,Internal Organization,,Miscellaneous Policy,10.473156163480606,-7.278356821357976,0.62,-0.785,0.201,-0.111,0.222,0.926,-17.219109
2017-01-22 01:59:02,RS1130003,113,Senate,3,2013-01-28,,35,62,To offset the cost of the bill with rescissions and discretionary cap reductions.,,,Budget Special Interest,,Government Management,35.28046785220257,-10.733689595060113,0.277,-0.961,-0.305,0.05,0.771,0.918,-19.224179
2017-01-22 01:59:02,RS1130004,113,Senate,4,2013-01-28,CQ,63,36,"A bill making supplemental appropriations for the fiscal year ending September 30, 2013, and for other purposes.",,,Budget Special Interest,,Government Management,6.786975247579953,-2.1354601732780907,0.195,-0.812,0.46,-0.392,0.889,0.96,-15.04151
2017-01-22 01:59:02,RS1130005,113,Senate,5,2013-01-29,,95,3,"John Forbes Kerry, of Massachusetts, to be Secretary of State",,,Foreign Policy Resolutions,,Foreign and Defense Policy,79.02860946913718,-78.93855225019891,0.998,-0.068,1.749,-0.128,0.0,0.969,-9.732314
2017-01-22 01:59:02,RS1130006,113,Senate,6,2013-01-31,,54,44,To require that any debt limit increase be balanced by equal spending cuts over the next decade.,Debt Ceilings,,Budget General Interest,,Government Management,3.9289537098604916,-0.11948809125041282,-0.218,-0.976,0.358,-0.527,0.977,0.99,-8.964141
2017-01-22 01:59:02,RS1130007,113,Senate,7,2013-01-31,,52,46,"To amend title 31, United States Code, to provide for automatic continuing resolutions.",Debt Ceilings,,Budget General Interest,,Government Management,-5.148481047322276,0.2530719062216116,0.216,-0.859,0.308,0.346,0.913,0.959,-12.252802
2017-01-22 01:59:02,RS1130008,113,Senate,8,2013-01-31,,53,45,To protect Social Security benefits and military pay and require that the United States Government prioritize all obligations on the debt held by the public in the event that the debt limit is reached.,Debt Ceilings,,Budget General Interest,,Government Management,5.487734549918386,-0.31153391289689863,0.038,-0.103,0.649,-0.684,1.0,1.0,-0.174219
2017-01-22 01:59:02,RS1130009,113,Senate,9,2013-01-31,,79,19,"To prohibit the sale, lease, transfer, retransfer, or delivery of F-16 aircraft, M1 tanks, or certain other defense articles or services to the Government of Egypt.",,,Defense Policy Budget,Foreign Policy Resolutions,Foreign and Defense Policy,-12.336370204204547,8.150295151916136,0.646,0.181,1.909,0.895,0.158,0.837,-28.620292
2017-01-22 01:59:02,RS1130010,113,Senate,10,2013-01-31,,53,45,"A bill to ensure the complete and timely payment of the obligations of the United States Government until May 19, 2013, and for other purposes.",Debt Ceilings,,Budget General Interest,,Government Management,5.487734549918386,-0.31153391289689863,0.038,-0.103,0.649,-0.684,1.0,1.0,-0.174219
2017-01-22 01:59:02,RS1130011,113,Senate,11,2013-01-31,,64,34,"A bill to ensure the complete and timely payment of the obligations of the United States Government until May 19, 2013, and for other purposes.",Debt Ceilings,,Budget General Interest,,Government Management,-22.48173652136653,6.987162572914185,0.347,-0.814,0.241,0.062,0.676,0.888,-22.848082
2017-01-22 01:59:02,RS1130012,113,Senate,12,2013-02-04,,85,8,A bill to reauthorize the Violence Against Women Act of 1994.,Women's Equality,,Domestic Social Policy,Budget Special Interest,Civil Liberties,-113.02571371967723,86.00969670927276,0.766,-0.568,1.622,0.083,0.125,0.925,-14.585092
2017-01-22 01:59:02,RS1130013,113,Senate,13,2013-02-07,,34,65,In the nature of a substitute.,Women's Equality,,Domestic Social Policy,Budget Special Interest,Civil Liberties,-2.270631203602594,0.49108492242904483,-0.214,0.977,-0.265,-0.675,0.794,0.929,-22.291215
2017-01-22 01:59:02,RS1130014,113,Senate,14,2013-02-11,,31,59,To reaffirm the inalienable rights of every American citizen guaranteed by the Constitution of the United States.,Women's Equality,,Domestic Social Policy,Indian Affairs,Civil Liberties,205.80272913784833,-52.62448501359994,0.251,-0.968,-0.427,0.012,0.935,0.978,-7.306499
2017-01-22 01:59:02,RS1130015,113,Senate,15,2013-02-12,,93,5,"To authorize appropriations for fiscal years 2014 through 2017 for the Trafficking Victims Protection Act of 2000, to enhance measures to combat trafficking in persons, and for other purposes.",Women's Equality,,Domestic Social Policy,Budget Special Interest,Civil Liberties,57.21947309608468,-55.218449957009966,0.968,0.17,1.761,-0.178,0.0,0.949,-11.919993
2017-01-22 01:59:02,RS1130016,113,Senate,16,2013-02-12,,100,0,To clarify that child victims of sex trafficking are eligible to receive assistance under grants provided to enhance the safety of youth and children.,Women's Equality,,Domestic Social Policy,Budget Special Interest,Civil Liberties,,,0.0,0.0,0.0,0.0,,,0.0
2017-01-22 01:59:02,RS1130017,113,Senate,17,2013-02-12,,46,53,To more quickly resolve rape cases and reduce the deficit by consolidating unnecessary duplication within the Department of Justice.,Women's Equality,,Domestic Social Policy,Budget Special Interest,Civil Liberties,5.995075186274477,0.3748919169117573,-0.225,-0.974,-0.709,0.684,0.957,0.98,-4.522595
2017-01-22 01:59:02,RS1130018,113,Senate,18,2013-02-12,,43,57,To amend the requirements for speedy notice to victims and to require a report to Congress.,Women's Equality,Public Health,Domestic Social Policy,Budget Special Interest,Civil Liberties,-2.4691362385627302,0.23344445229412913,0.018,0.189,-0.368,-0.862,0.953,0.98,-10.146797
2017-01-22 01:59:02,RS1130019,113,Senate,19,2013-02-12,,79,22,A bill to reauthorize the Violence Against Women Act of 1994.,Women's Equality,,Domestic Social Policy,Budget Special Interest,Civil Liberties,-14.170023973425625,6.932493041543541,0.544,-0.776,1.568,0.64,0.364,0.861,-26.291529
2017-01-22 01:59:02,RS1130020,113,Senate,20,2013-02-13,,89,12,"William J. Kayatta, Jr., of Maine, to be United States Circuit Judge for the First Circuit",Judiciary,,Government Organization,,Government Management,-1.7560665502630175,1.3008480455976061,0.181,0.983,0.821,2.704,0.167,0.901,-19.891879
2017-01-22 01:59:02,RS1130021,113,Senate,21,2013-02-14,,59,40,"Charles Timothy Hagel, of Nebraska, to be Secretary of Defense",,,Defense Policy Resolutions,,Foreign and Defense Policy,-16.4834972752094,2.7842373787477426,0.228,-0.974,0.285,0.1,0.9,0.96,-12.190355
2017-01-22 01:59:02,RS1130022,113,Senate,22,2013-02-25,,94,0,"Robert E. Bacharach, of Oklahoma, to be United States Circuit Judge for the Tenth Circuit",Judiciary,,Government Organization,,Government Management,,,0.0,0.0,0.0,0.0,,,0.0
2017-01-22 01:59:02,RS1130023,113,Senate,23,2013-02-26,,71,27,"Charles Timothy Hagel, of Nebraska, to be Secretary of Defense",,,Defense Policy Resolutions,,Foreign and Defense Policy,-19.87698489899938,7.922916974700752,0.399,-0.008,1.684,0.49,0.407,0.837,-29.221653
2017-01-22 01:59:02,RS1130024,113,Senate,24,2013-02-26,CQ,59,41,"Charles Timothy Hagel, of Nebraska, to be Secretary of Defense",,,Defense Policy Resolutions,,Foreign and Defense Policy,2.767848417763438,-0.27980574397690394,-0.249,-0.969,0.346,-0.723,0.902,0.96,-13.67312
2017-01-22 01:59:02,RS1130025,113,Senate,25,2013-02-27,,72,26,"Jacob J. Lew, of New York, to be Secretary of the Treasury",Banking and Finance,,Government Organization,,Government Management,-5.508269766151846,2.4193486135871245,0.284,0.855,0.16,0.168,0.423,0.847,-30.804702
2017-01-22 01:59:02,RS1130026,113,Senate,26,2013-02-28,,38,63,A bill to provide for a sequester replacement.,,,Budget General Interest,,Government Management,-2.477075497427847,0.2900979176841926,-0.266,0.949,-0.215,-0.502,0.711,0.891,-26.419148
2017-01-22 01:59:02,RS1130027,113,Senate,27,2013-02-28,,52,49,"A bill to appropriately limit sequestration, to eliminate tax loopholes, and for other purposes.",,,Budget General Interest,,Government Management,-6.45415707435579,-0.3495842925644209,0.1,-0.995,0.953,0.854,0.878,0.941,-10.56524
2017-01-22 01:59:02,RS1130028,113,Senate,28,2013-03-04,,92,0,"Katherine Polk Failla, of New York, to be United States District Judge for the Southern District of New York",Judiciary,,Government Organization,,Government Management,,,0.0,0.0,0.0,0.0,,,0.0
2017-01-22 01:59:02,RS1130029,113,Senate,29,2013-03-05,,44,53,To strike supplemental staff funding available only to a limited number of Senators in a time of sequestration.,,,Internal Organization,Budget Special Interest,Miscellaneous Policy,2.9372632234689298,-0.020824821383818137,-0.316,-0.949,-0.097,0.191,0.432,0.742,-53.903795
2017-01-22 01:59:02,RS1130030,113,Senate,30,2013-03-06,,52,41,"Caitlin Joan Halligan, of New York, to be United States Circuit Judge for the District of Columbia Circuit",Judiciary,,Government Organization,,Government Management,-9.775239303311729,0.7256668780795524,0.175,-0.985,0.36,0.213,0.927,0.968,-7.980322
2017-01-22 01:59:02,RS1130031,113,Senate,31,2013-03-07,,81,16,"John Owen Brennan, of Virginia, to be Director of the Central Intelligence Agency",CIA/Spying/Intelligence,,Defense Policy Resolutions,,Foreign and Defense Policy,-1.6380802245745687,1.0345971624445935,0.189,0.725,0.13,0.459,0.187,0.866,-26.770262
2017-01-22 01:59:02,RS1130032,113,Senate,32,2013-03-07,,64,34,"John Owen Brennan, of Virginia, to be Director of the Central Intelligence Agency",CIA/Spying/Intelligence,,Defense Policy Resolutions,,Foreign and Defense Policy,-4.536222160360345,1.2395348802900878,0.139,0.609,0.12,0.153,0.618,0.867,-34.813638
2017-01-22 01:59:02,RS1130033,113,Senate,33,2013-03-11,,92,0,"Richard Gary Taranto, of Maryland, to be United States Circuit Judge for the Federal Circuit",Judiciary,,Government Organization,,Government Management,,,0.0,0.0,0.0,0.0,,,0.0
2017-01-22 01:59:02,RS1130034,113,Senate,34,2013-03-13,,45,52,To prohibit the use of funds to carry out the Patient Protection and Affordable Care Act.,Public Health,,Budget General Interest,Regulation General Interest,Government Management,6.283740697340925,-0.29112114767075015,0.011,-0.222,-0.666,0.613,1.0,1.0,-0.142251
2017-01-22 01:59:02,RS1130035,113,Senate,35,2013-03-13,,48,50,To strike certain authorities relating to the use for grants of funds of the Office of Economic Assistance of the Department of Defense.,,,Budget General Interest,,Government Management,13.637316305251733,1.3786184045032979,-0.172,-0.967,1.12,-0.475,0.917,0.959,-12.60351
2017-01-22 01:59:02,RS1130036,113,Senate,36,2013-03-14,,54,45,Of a perfecting nature.,Education,,Budget General Interest,Domestic Social Policy,Government Management,5.801451866608316,-0.32766823773059084,0.047,-0.055,0.653,-0.651,1.0,1.0,-0.164865
2017-01-22 01:59:02,RS1130037,113,Senate,37,2013-03-14,,45,54,To temporarily freeze the hiring of nonessential Federal employees.,,,Budget Special Interest,,Government Management,-5.722802378096708,0.4206409778775002,0.243,-0.97,-0.376,-0.38,0.933,0.97,-9.382176
2017-01-22 01:59:02,RS1130038,113,Senate,38,2013-03-18,,63,35,In the nature of a substitute.,,,Budget General Interest,,Government Management,4.563851877155266,-1.2922832669008903,0.302,0.086,0.217,-0.275,0.771,0.918,-20.014453
2017-01-22 01:59:02,RS1130039,113,Senate,39,2013-03-20,,48,51,To prohibit Urban Area Security Initiative grant recipients from funding projects that do not improve homeland security.,,,Defense Policy Budget,Budget General Interest,Government Management,-12.705886834599871,-0.4761769859789854,-0.115,0.985,-0.279,-0.127,0.875,0.939,-17.083476
2017-01-22 01:59:02,RS1130040,113,Senate,40,2013-03-20,,45,54,To transfer appropriations from the National Heritage Partnership Program to fund the resumption of public tours of the White House and visitor services and maintenance at national parks and monuments.,,,Budget Special Interest,,Government Management,16.57591695607963,-1.392356124719387,0.143,0.978,-0.278,0.097,0.911,0.96,-13.083321
2017-01-22 01:59:02,RS1130041,113,Senate,41,2013-03-20,,40,59,"To increase by $25,000,000 the amount appropriated for Operation and Maintenance for the Department of Defense for programs, projects, and activities in the continental United States, and to provide an offset.",Energy,Pollution and Environmental Protection,Budget Special Interest,,Government Management,27.06763763087017,-5.128348557523136,0.153,-0.987,-0.234,0.05,0.85,0.939,-17.986954
2017-01-22 01:59:02,RS1130042,113,Senate,42,2013-03-20,,70,29,In the nature of a substitute.,,,Budget General Interest,,Government Management,8.165199888648619,-3.071899167039991,0.296,-0.655,0.192,-0.136,0.517,0.859,-26.34972
2017-01-22 01:59:02,RS1130043,113,Senate,43,2013-03-20,,63,36,"Amend the title to read: ""An Act making consolidated appropriations and further continuing appropriations for the fiscal year ending September 30, 2013.""",,,Budget General Interest,,Government Management,7.634461895886461,-1.9637489702570128,0.132,-0.956,0.231,-0.175,0.75,0.909,-20.845848
2017-01-22 01:59:02,RS1130044,113,Senate,44,2013-03-20,,74,26,"Amend the title to read: ""An Act making consolidated appropriations and further continuing appropriations for the fiscal year ending September 30, 2013.""",,,Budget General Interest,,Government Management,3.771046224519341,-1.5446805345966528,0.163,-0.93,0.178,-0.273,0.615,0.9,-27.353924
2017-01-22 01:59:02,RS1130045,113,Senate,45,2013-03-21,,46,53,"An original concurrent resolution setting forth the congressional budget for the United States Government for fiscal year 2014, revising the appropriate budgetary levels for fiscal year 2013, and setting forth the appropriate budgetary levels for fiscal ears 2015 through 2023.",Budget resolution ,,Budget General Interest,,Government Management,-42.82262450018958,-0.941984616503223,-0.017,-0.214,-0.733,-0.099,0.978,0.99,-1.57865
2017-01-22 01:59:02,RS1130046,113,Senate,46,2013-03-21,,40,59,To amend the resolution.,Budget resolution ,,Budget General Interest,,Government Management,-3.1349839465137923,0.3624081625367829,-0.197,0.98,-0.303,-0.559,0.85,0.939,-15.187832
2017-01-22 01:59:02,RS1130047,113,Senate,47,2013-03-21,,79,20,"To promote innovation, preserve high-paying jobs, and encourage economic growth for manufacturers of lifesaving medical devices and cutting edge medical therapies.",Public Health,Budget resolution ,Budget General Interest,Domestic Social Policy,Government Management,2.483128010581253,0.9627530798412812,0.015,1.0,-0.161,0.375,0.05,0.808,-36.525984
2017-01-22 01:59:02,RS1130048,113,Senate,48,2013-03-21,,96,3,To establish a deficit-neutral reserve fund to protect Medicare's guaranteed benefits and to prohibit replacing guaranteed benefits with the House passed budget plan to turn Medicare into a voucher program.,Budget resolution ,,Budget General Interest,,Government Management,-172.12241365271288,139.73464471330828,0.814,-0.373,0.744,0.025,0.667,0.99,-2.399412
2017-01-22 01:59:02,RS1130049,113,Senate,49,2013-03-21,,45,54,"To protect Americans from a $1,000,000,000,000 tax increase and provide for pro-growth revenue-neutral comprehensive tax reform.",Tax rates,Budget resolution ,Budget General Interest,,Government Management,5.765941894783183,-0.3311905717922078,0.059,0.009,-0.65,0.652,1.0,1.0,-0.168571
2017-01-22 01:59:02,RS1130050,113,Senate,50,2013-03-22,,45,54,"To prohibit the consideration of a budget resolution that includes revenue increases while the civilian unemployment rate is above 5.5 percent, the administration's prediction for the unemployment rate without the stimulus.",Budget resolution ,Unemployment/Jobs,Budget General Interest,Domestic Social Policy,Government Management,5.765941894783183,-0.3311905717922078,0.059,0.009,-0.65,0.652,1.0,1.0,-0.168571
2017-01-22 01:59:02,RS1130051,113,Senate,51,2013-03-22,,45,54,"To establish a deficit-neutral reserve fund to provide for the repeal of the Patient Protection and Affordable Care Act and the Health Care and Education Reconciliation Act of 2010 and to encourage patient-centered reforms to improve health outcomes and educe health care costs, promoting economic growth.",Public Health,Budget resolution ,Budget General Interest,Domestic Social Policy,Government Management,5.765941894783183,-0.3311905717922078,0.059,0.009,-0.65,0.652,1.0,1.0,-0.168571
2017-01-22 01:59:02,RS1130052,113,Senate,52,2013-03-22,,99,0,To amend the deficit-neutral reserve fund for tax relief to provide tax relief for low and middle income families.,Budget resolution ,Tax rates,Budget General Interest,,Government Management,,,0.0,0.0,0.0,0.0,,,0.0
2017-01-22 01:59:02,RS1130053,113,Senate,53,2013-03-22,,45,54,To establish a deficit neutral reserve fund to repeal the tax increases enacted under the Patient Protection and Affordable Care Act that were imposed on low- and middle-income Americans.,Budget resolution ,Tax rates,Budget General Interest,,Government Management,5.765941894783183,-0.3311905717922078,0.059,0.009,-0.65,0.652,1.0,1.0,-0.168571
2017-01-22 01:59:02,RS1130054,113,Senate,54,2013-03-22,,56,43,"To establish a deficit-neutral reserve fund to protect women's access to health care, including primary and preventative health care, family planning and birth control, and employer-provided contraceptive coverage, such as was provided under the Affordabe Care Act (PL 111-148).",Budget resolution ,Women's Equality,Budget General Interest,Domestic Social Policy,Government Management,-3.5561062386329816,0.3975132798291227,0.125,-0.047,0.621,1.01,0.953,0.98,-3.565739
2017-01-22 01:59:02,RS1130055,113,Senate,55,2013-03-22,,44,55,"To establish a deficit-neutral reserve fund to protect women's access to health care, including primary and preventive care, in a manner consistent with protecting rights of conscience.",Budget resolution ,Religion,Budget General Interest,Regulation Special Interest,Government Management,-2.8641564593450135,0.21969877512140162,0.12,-0.124,-0.569,-1.149,0.955,0.98,-5.620147
2017-01-22 01:59:02,RS1130056,113,Senate,56,2013-03-22,,49,50,To call for a comprehensive approach for wage index reform.,Budget resolution ,,Budget Special Interest,Domestic Social Policy,Government Management,14.630501891071614,2.0297277931161,-0.155,-0.238,0.726,-0.287,0.918,0.96,-10.525205
2017-01-22 01:59:02,RS1130057,113,Senate,57,2013-03-22,,68,31,To establish a deficit-neutral reserve fund to sunset the provision of Patient Protection and Affordable Care Act that increases payments to hospitals in a few States by reducing payments to the majority of States through the Medicare hospital wage index.,Budget resolution ,,Budget Special Interest,Domestic Social Policy,Government Management,9.476091207871399,2.540078958090909,-0.164,0.986,-0.29,0.177,0.452,0.828,-31.879806
2017-01-22 01:59:02,RS1130058,113,Senate,58,2013-03-22,,41,58,To establish a deficit-neutral reserve fund relating to ensuring that all revenue from a fee on carbon pollution is returned to the American people.,Pollution and Environmental Protection,Budget resolution ,Budget General Interest,Regulation General Interest,Government Management,-4.166100609091218,-0.8557693688273076,-0.113,-0.385,0.631,0.876,0.829,0.929,-12.931569
2017-01-22 01:59:02,RS1130059,113,Senate,59,2013-03-22,,53,46,To create a point of order against legislation that would create a Federal tax or fee on carbon emissions.,Pollution and Environmental Protection,Budget resolution ,Budget General Interest,Regulation General Interest,Government Management,-4.157225646343736,-0.5884462515000932,-0.041,-0.418,-0.639,-0.889,0.891,0.949,-10.117742
2017-01-22 01:59:02,RS1130060,113,Senate,60,2013-03-22,,33,66,To establish a deficit-neutral reserve fund relating to protecting the interests of the United States in making a decision relating to the Keystone XL pipeline.,Pollution and Environmental Protection,Energy,Budget Special Interest,,Government Management,-4.347043062241338,-1.1979844210624035,-0.242,-0.146,1.171,1.558,0.636,0.879,-26.414753
2017-01-22 01:59:02,RS1130061,113,Senate,61,2013-03-22,,62,37,"To establish a deficit-neutral reserve fund to promote investment and job growth in United States manufacturing, oil and gas production, and refining sectors through the construction of the Keystone XL Pipeline.",Pollution and Environmental Protection,Energy,Budget Special Interest,,Government Management,-4.802583959812108,-1.2044392731680584,-0.17,-0.388,-0.7,-0.843,0.919,0.97,-12.031508
2017-01-22 01:59:02,RS1130062,113,Senate,62,2013-03-22,,75,24,Of a perfecting nature.,Radio/Television/Motion Pictures/Telecommunications,Tax rates,Budget Special Interest,,Government Management,0.45753275238117275,-0.4369105886569954,-0.669,-0.743,0.078,-0.986,0.167,0.798,-41.166964
2017-01-22 01:59:02,RS1130063,113,Senate,63,2013-03-22,,39,60,"To establish a deficit-neutral reserve fund related to the education of low-income children, which may include allowing funding under the Elementary and Secondary Education Act of 1965 to follow children from low-income families to the school children atend.",Education,Budget resolution ,Budget Special Interest,Domestic Social Policy,Government Management,16.813032716451858,-4.301980477857468,0.198,-0.973,-0.375,0.129,0.897,0.96,-11.944724
2017-01-22 01:59:02,RS1130064,113,Senate,64,2013-03-22,,48,51,To express the sense of the Senate to enact Child Interstate Abortion Notification Act.,Abortion/Care of deformed newborns,Budget resolution ,Domestic Social Policy,Regulation Special Interest,Government Management,-2.3645697515882103,-0.028648305210945746,0.182,-0.459,-0.435,-1.064,0.917,0.96,-10.284952
2017-01-22 01:59:02,RS1130065,113,Senate,65,2013-03-22,,68,31,To establish a deficit-neutral reserve fund relating to establishing a biennial budget and appropriations process.,Budget resolution ,,Budget General Interest,Government Organization,Government Management,-0.7526711084570503,-0.5292445790251864,0.47,-0.883,-0.038,-0.292,0.194,0.747,-52.747593
2017-01-22 01:59:02,RS1130066,113,Senate,66,2013-03-22,,80,19,"To repeal or reduce the estate tax, but only if done in a fiscally responsible way.",Budget resolution ,Tax rates,Budget General Interest,,Government Management,-2.333546822840468,-1.1203444347877043,-0.052,-0.999,-0.186,-0.461,0.316,0.869,-29.682145
2017-01-22 01:59:02,RS1130067,113,Senate,67,2013-03-22,,46,53,To establish a deficit-neutral reserve fund to permanently eliminate the Federal estate tax.,Budget resolution ,Tax rates,Budget General Interest,,Government Management,-7.633611354231391,-0.02627556333540451,-0.032,0.218,-0.359,-0.272,0.935,0.97,-6.710899
2017-01-22 01:59:02,RS1130068,113,Senate,68,2013-03-22,,45,54,"To create a point of order against legislation that would raise taxes on veterans, and for other purposes.",Budget resolution ,,Budget General Interest,,Government Management,5.765941894783183,-0.3311905717922078,0.059,0.009,-0.65,0.652,1.0,1.0,-0.168571
2017-01-22 01:59:02,RS1130069,113,Senate,69,2013-03-22,,18,81,In the nature of a substitute.,Budget resolution ,,Budget General Interest,,Government Management,-3.8434700221327907,2.0124488289859133,0.406,0.452,-0.624,-0.939,0.722,0.949,-12.995817
2017-01-22 01:59:02,RS1130070,113,Senate,70,2013-03-22,,99,0,"To end ""Too Big To Fail"" subsidies or funding advantage for Wall Street mega-banks (over $500 billion in total assets).",Budget resolution ,Banking and Finance,Budget General Interest,Regulation General Interest,Government Management,,,0.0,0.0,0.0,0.0,,,0.0
2017-01-22 01:59:02,RS1130071,113,Senate,71,2013-03-22,,45,54,To repeal the tax increase on catastrophic medical expenses created by Obamacare.,Public Health,Tax rates,Budget General Interest,Domestic Social Policy,Government Management,5.765941894783183,-0.3311905717922078,0.059,0.009,-0.65,0.652,1.0,1.0,-0.168571
2017-01-22 01:59:02,RS1130072,113,Senate,72,2013-03-22,,46,53,"To establish a deficit-neutral reserve fund to enable prompt action relating to the Presidential exemption for the rule of the Environmental Protection Agency commonly known as the Mercury and Air Toxins Standard for affected electric utility steam generting units that need additional time to install the major emissions control equipment, construct replacement generation, or implement other mitigation measures in order to ensure the reliability of the grid.",Pollution and Environmental Protection,Public Health,Budget General Interest,Domestic Social Policy,Government Management,-2.266072878274906,0.04651238837283225,-0.077,0.221,-0.545,-1.391,0.957,0.98,-6.079615
2017-01-22 01:59:02,RS1130073,113,Senate,73,2013-03-22,,46,53,"To provide a point of order against budgets spending more on net interest payments on the debt than on national defense, and to ensure the United States government funds its military at higher levels than the militaries of foreign holders of its debt.",Budget resolution ,,Budget General Interest,Defense Policy Budget,Government Management,-42.82262450018958,-0.941984616503223,-0.017,-0.214,-0.733,-0.099,0.978,0.99,-1.57865
2017-01-22 01:59:02,RS1130074,113,Senate,74,2013-03-22,,46,53,To force Congress to ensure the solvency of the Social Security and Medicare programs.,Social Security,,Budget General Interest,,Government Management,-42.82262450018958,-0.941984616503223,-0.017,-0.214,-0.733,-0.099,0.978,0.99,-1.57865
