date_generated,id,congress,chamber,rollnumber,date,keyvote,yea,nay,description,Issue1,Issue2,Peltzman1,Peltzman2,Clausen1,slope,intercept,mid.dim1,mid.dim2,spread.dim1,spread.dim2,pre,classified,log_likelihood,vote_result
2016-10-18 10:30:10,RH0390242,39,House,242,1866-05-29,,35,86,"TO AMEND H. R. 613, BY ADDING TO SECTION TWO A, WHICH PROVIDES THAT SUPERVISION AND CARE OF BUREAU SHALL BE EXTENDED TO ALL LOYAL REFUGEES AND FREEDMEN NECESSARY IN AIDING THEM TO BECOME SELF-SUPPORTING CITIZENS, THE FOLLOWING:  THAT POWERS CONFERRED ANDDUTIES ENJOINED SHALL BE APPLICABLE TO ALL PERSONS REFERRED TO; TO REPEAL ALL INCONSISTENT PROVISIONS AND TO ELIMINATE ALL REMAINING SECTIONS OF BILL",Civil Rights/Desegregation/Busing/Affirmative Action,,Government Organization,,Government Management,3.1502381224384584,-0.38283619461064566,0.152,0.096,0.573,-1.052,0.886,0.967,-12.64987,
2016-10-18 10:30:10,RH0390243,39,House,243,1866-05-29,,96,32,TO PASS H. R. 613.  (P. 2878),Civil Rights/Desegregation/Busing/Affirmative Action,,Government Organization,,Government Management,2.408375844349209,0.009565476358222136,0.028,0.077,-0.538,1.292,0.844,0.961,-9.479683,
2016-10-18 10:30:10,RH0390244,39,House,244,1866-05-31,,77,42,"TO PASS H. R. 537, A BILL TO AUTHORIZE THE CLEVELAND- MAHONING RAILROAD COMPANY TO CONTINUE TO CONSTRUCT THE RAIL- ROAD OF SAID COMPANY FROM THE VILLAGE OF YOUNGSTOWN, MAHONING COUNTY, IN SAID STATE OF OHIO TO AND INTO STATE OF PA. AND TO ESTABLISH SAID OAD AS A MILITARY, POSTAL, AND COMMERCIAL RAILROAD OF UNITED STATES",Public Works,,Budget Special Interest,,Government Management,3.2766874711576284,-0.20853181922027253,-0.233,-0.972,-0.149,0.263,0.429,0.798,-52.230103,
2016-10-18 10:30:10,RH0390245,39,House,245,1866-05-31,,65,37,"TO PASS H. R. 527, A BILL TO PROMOTE THE CONSTRUCTION OF A LINE OF RAILROADS BETWEEN THE CITY OF WASHINGTON AND THE NORTHWEST FOR NATIONAL PURPOSES.  (P. 2928)",Public Works,,Budget Special Interest,,Government Management,2.791430459617577,-0.14148516671090272,-0.29,-0.951,-0.139,0.288,0.378,0.775,-47.009721,
2016-10-18 10:30:10,RH0390246,39,House,246,1866-06-04,,75,31,"TO PASS A RESOLUTION PROVIDING THAT THE PRESIDENT BE REQUESTED  TO INFORM THE HOUSE WHETHER ANY OF THE MILITARY OR CIVIL EMPLOYEES OF THE GOVERNMENT WITHIN THE STATE OF GEORGIA OR OTHER REBEL STATES HAVE COUNTENANCED OR ASSISTED IN THE RENDITION OF PUBLI HONORS TO ANY OF THE TRAITORS WAGING WAR AGAINST THE GOVERNMENT IN COMMEMORATION OF THEIR CRIME BY CLOSING THEIR OFFICES, ETC",Nullification/Secession/Reconstruction,,Domestic Social Policy,,Civil Liberties,5.4996630946422345,-0.585462603505288,0.111,0.025,-0.639,0.672,0.871,0.962,-8.723605,
2016-10-18 10:30:10,RH0390247,39,House,247,1866-06-05,,87,42,"TO PASS H. R. 450, A BILL TO REDUCE AND ESTABLISH THE PAY OF OFFICERS AND TO REGULATE THE PAY OF THE SOLDIERS OF ARMY OF UNITED STATES.  (P. 2979)",,,Defense Policy Budget,,Foreign and Defense Policy,3.039888126917248,0.23879849508629913,-0.371,-0.889,-0.154,0.293,0.476,0.829,-50.600549,
2016-10-18 10:30:10,RH0390248,39,House,248,1866-06-07,,57,67,"TO AMEND H. R. 452 (14 STAT 396, 2/18/1867), A BILL TO AUTHORIZE THE SECRETARY OF NAVY TO ACCEPT LEAGUE ISLAND, IN THE RIVER DELAWARE, FOR A NAVAL DEPOT BY ELIMINATING IN A SUBSTITUTE AMENDMENT, AUTHORIZING THE PRESIDENT TO APPOINT A COMMISSION OF SEVEN OR SURVEY OF PROPOSED SITES FOR NAVY, THE WORDS ""AND TO REPORT TO CONGRESS AND BY SELECTION OF WHICH PUBLIC INTERESTS BE BEST PROMOTED""; AND INSERT THAT SECRETARY OF NAVY BE AUTHORIZED TO ACCEPT TITLE TO SUCH SITES SO RECOMMENDED, PROVIDED THAT A PERFECT ...",,,Defense Policy Budget,,Foreign and Defense Policy,0.4284209818118103,0.15198532349633764,0.852,0.517,0.008,-0.108,-0.053,0.516,-84.032056,
2016-10-18 10:30:10,RH0390249,39,House,249,1866-06-07,,75,50,"TO PASS H. R. 452 (14 STAT 396, 2/18/1867), A BILL TO AUTHORIZE THE SECRETARY OF NAVY TO ACCEPT LEAGUE ISLAND, IN THE RIVER DELAWARE, FOR A NAVAL DEPOT.  (P. 3024)",,,Defense Policy Budget,,Foreign and Defense Policy,-12.049340113457163,-6.970015437522782,-0.507,-0.861,-0.025,-0.012,0.02,0.608,-83.678616,
2016-10-18 10:30:10,RH0390250,39,House,250,1866-06-07,,34,61,"TO TABLE MOTION TO RECONSIDER VOTE BY WHICH JOINT RESOLUTION WAS PASSED.  THE RESOLUTION PROVIDES THAT PRESIDENT PRO TEM OF SENATE AND SPEAKER OF HOUSE BE AUTHORIZED TO CLOSE PRESENT SESSION BY ADJOURNING ON THURSDAY JUNE 28, 1866 AT 12 O'CLOCK.  (P. 302)",,,Internal Organization,,Miscellaneous Policy,-28.147258505035936,2.82840052395827,0.091,0.267,0.219,0.045,0.559,0.842,-30.113778,
2016-10-18 10:30:10,RH0390251,39,House,251,1866-06-08,,54,67,"TO AMEND H. R. 276 (14 STAT 434, 3/2/1867), A BILL TO ESTABLISH A NATIONAL BUREAU OF EDUCATION, BY PROVIDING FOR TWO CLERKS AT $1800 PER YEAR TO COLLECT FACTS SHOWING PROGRESS OF EDUCATION, ORGANIZING AND MANAGEMENT OF SCHOOLS, ETC. AND TO PRESENT ANNUALY TO CONGRESS REPORTS OF INVESTIGATIONS",Education,,Government Organization,Budget Special Interest,Government Management,-1.3743405753170945,0.47647288554282197,-0.338,0.941,-0.024,-0.101,-0.074,0.521,-81.527786,
2016-10-18 10:30:10,RH0390252,39,House,252,1866-06-08,,60,62,"TO PASS H. R. 276 (14 STAT 434, 3/2/1867), A BILL TO ESTABLISH A NATIONAL BUREAU OF EDUCATION.  (P. 3051-2)",Education,,Government Organization,Budget Special Interest,Government Management,-33.049618596911074,5.979492408133572,0.151,0.989,-0.12,-0.021,0.267,0.639,-70.0681,
2016-10-18 10:30:10,RH0390253,39,House,253,1866-06-11,,5,112,"***MISSING TEXT*** FOR PUNISHMENT OF CERTAIN CRIMES AGAINST U.S., AND THE PREAMBLE THERETO, DECLARING THAT ""WHEREAS THE IRISH PEOPLE IN THIS COUNTRY ARE MOVED BY A PATRIOTIC PURPOSE TO ASSERT THE INDEPENDENCE OF IRELAND AND WHEREAS THE SYMPATATHIES OF TH UNITED STATES POEPLE ARE WITH ALL WHO STRUGGLE TO ACHIEVE SUCH ENDS, AND WHEREAS THE BRITISH ARE ENTITLED TO NO CONSIDERATION FROM THE UNITED STATES FOR REASON OF HER CONDUCT..."" (P",,,Foreign Policy Resolutions,,Foreign and Defense Policy,6.510774863591484,-4.455501599020457,0.557,-0.829,-0.197,0.175,0.0,0.957,-19.0106,
2016-10-18 10:30:10,RH0390254,39,House,254,1866-06-11,,8,113,"TO TABLE A RESOLUTION AS MODIFIED AND TO WIT:  RESOLUTION THAT THE COMMITTEE FOR FOREIGN AFFAIRS INQUIRE INTO THE EXPEDIENCY OF REPORTING A BILL REPEALING AN ACT APPROVED JAN. 20, 1818, ETC.  (SEE 391248).",,,Foreign Policy Resolutions,,Foreign and Defense Policy,-198.9587039534047,127.3555292341324,0.641,-0.177,-0.172,-0.005,0.0,0.934,-29.557372,
2016-10-18 10:30:10,RH0390255,39,House,255,1866-06-11,,89,35,TO REFER THE MODIFIED RESOLUTION TO COMMITTEE ON FOREIGN AFFAIRS.,,,Foreign Policy Resolutions,,Foreign and Defense Policy,3.4738474893136884,0.23365868322607225,-0.166,-0.343,-0.191,0.318,0.657,0.903,-28.436244,
2016-10-18 10:30:10,RH0390256,39,House,256,1866-06-11,,97,20,"TO SUSPEND THE RULES AND TO INTRODUCE A RESOLUTION PROVIDING THAT JEFFERSON DAVIS, LEADER OF THE LATE REBELLION, IS GUILTY OF TREASON AND WAS CHARGED BY PROCLAMATION OF PRESIDENT LINCOLN - RESOLVED, THAT DAVIS BE HELD IN CUSTODY AS A PRISONER, SUBJECT TOTRIAL ACCORDING TO LAWS",Nullification/Secession/Reconstruction,,Domestic Social Policy,,Civil Liberties,12.72633193948493,1.8889497909227395,-0.15,-0.02,-1.142,0.519,0.95,0.991,-4.856084,
2016-10-18 10:30:10,RH0390257,39,House,257,1866-06-11,,105,20,"TO PASS A RESOLUTION PROVIDING THAT JEFFERSON DAVIS, LEADER OF THE LATE REBELLION, IS GUILTY OF TREASON AND WAS CHARGED BY PROCLAMATION OF PRESIDENT MAY 18, 1865, - RESOLVED THAT DAVIS BE HOLD IN CUSTODY AS A PRISONER, SUBJECT TO TRIAL ACCORDING TO LAWS. (P",Nullification/Secession/Reconstruction,,Domestic Social Policy,,Civil Liberties,3.706734944363629,0.9344433264247255,-0.244,0.03,-0.63,0.983,0.9,0.984,-4.84622,
2016-10-18 10:30:10,RH0390258,39,House,258,1866-06-12,,62,62,"TO POSTPONE INDEFINITELY S. 190, A BILL TO INCORPORATE THE DISTRICT OF COLUMBIA CANAL AND SEWERAGE COMPANY. (P. 3122-1)",,,Government Organization,D. C.,Government Management,10.368310224457774,-2.6017092458899858,0.249,-0.02,0.294,-0.164,0.613,0.806,-46.360954,
2016-10-18 10:30:10,RH0390259,39,House,259,1866-06-13,,140,37,"TO CONCUR IN A SENATE AMENDMENT TO H. J. RES. 127, A RESOLUTION PROPOSING AN AMENDMENT TO THE UNITED STATES CONSTITUTION.  THE SENATE AMENDMENT (1) DEFINES BORN WHO ARE CITIZENS OF UNITED STATES AS ALL PERSONS BORN OR NATURAL- IZED IN UNITED STATES AND SBJECT TO THE JURISDICTION THEREOF;  (2) REFUSES REPRESENTATION IN THE HOUSE OF ALL STATES WHICH EXCLUDE THE NEGRO FROM VOTING, EXCLUDES FROM THE COUNT THE ENTIRE COLORED POPULATION OF STATES WHOSE CONSTITUTION OR LAWS MAY DEPRIVE THESE PEOPLE OF THE RIGHT...",Constitutional Amendments,,Domestic Social Policy,,Civil Liberties,6.3078295493948255,0.840633500520117,-0.132,0.008,-0.698,0.64,0.973,0.994,-2.561408,
2016-10-18 10:30:10,RH0390260,39,House,260,1866-06-14,,67,41,"TO PASS S. 350 (14 STAT 66, 6/18/1866), A BILL TO AUTHORIZE THE COMMISSIONER OF PATENTS TO PAY THOSE EMPLOYED AS EXAMINER AND ASSISTANT EXAMINERS THE SALARY FIXED BY LAW FOR THE DUTIES PERFORMED BY THEM.  (P. 3164)",,,Budget Special Interest,,Government Management,-0.3417631013998759,-0.3648135476708469,0.378,-0.494,-0.013,-0.22,0.146,0.676,-66.138151,
2016-10-18 10:30:10,RH0390261,39,House,261,1866-06-14,,41,73,"TO AMEND H. R. 674, A BILL TO ESTABLISH ADDITIONAL OFFICES FOR THE ASSAY OF GOLD AND SILVER AND F. O. P. BY ESTABLISH- ING A BRANCH MINT IN PORTLAND, ORE. (INSTEAD OF DALLAS CITY, ORE..  (P. 3164-2)",,,Government Organization,,Government Management,1.0812973040945906,-0.6934317820640685,-0.253,-0.967,-0.043,0.23,0.024,0.649,-67.921599,
2016-10-18 10:30:10,RH0390262,39,House,262,1866-06-18,,33,73,TO TABLE A RESOLUTION PROVIDING THAT WITH BEGINNING OF PRESENT FISCAL YEAR CHIEF CLERK OF HOUSE BE PAID SALARY OF $3000 PER YEAR.  (P. 3238-2),,,Internal Organization,Budget Special Interest,Government Management,-0.5257893867690399,-0.6753847743025438,0.431,-0.902,0.018,0.198,0.121,0.726,-63.280942,
2016-10-18 10:30:10,RH0390263,39,House,263,1866-06-18,,84,21,"TO PASS H. J. R. 161 (14 STAT 361, 6/23/1866), A BILL TO PAY STATE OF VT. THE SUM EXPENDED FOR THE PROTECTION OF THE FRONTIER AGAINST THE INVASION FROM CANADA IN 1864, (PAYMENT NOT EXCEEDING $16,463.81).  (P. 3239)",,,Budget Special Interest,,Government Management,8.675524881689158,1.1972391718056072,-0.027,0.963,-0.252,0.168,0.81,0.962,-13.585056,
2016-10-18 10:30:10,RH0390264,39,House,264,1866-06-18,,59,61,"TO AGREE TO A CONCURRENT RESOLUTION, PROPOSING AN AMEND- MENT TO THE CONSTITUTION OF THE UNITED STATES, PROVIDING THAT CONGRESS SHALL HAVE POWER TO LAY ON EXPORT DUTY OR TAX ON COTTON EXPORTED FROM UNITED STATES.  (P. 3240-1)",Constitutional Amendments,,Budget Special Interest,,Government Management,4.003058548804102,-1.1538563936651485,0.28,-0.033,-0.299,0.432,0.559,0.783,-49.268549,
2016-10-18 10:30:10,RH0390265,39,House,265,1866-06-18,,92,25,"TO SUSPEND RULES AND TO ALLOW INTRODUCTION OF RESOLUTION, PROVIDING THAT PRESIDENT OF UNITED STATES TRANSMIT TO EXECUTIVES OF STATES COPIES OF ARTICLE OF AMENDMENT TO AMEND CONSTITUTION OF UNITED STATES PASSED JUNE 13, 1866 REGARDING CITIZENSHIP, BASIS O REPRESENTATION, ETC",Civil Rights/Desegregation/Busing/Affirmative Action,,Government Organization,,Government Management,6.085749660990347,0.6925182123699285,-0.111,0.017,-0.685,0.651,1.0,1.0,-0.827792,
2016-10-18 10:30:10,RH0390266,39,House,266,1866-06-19,,36,77,"TO TABLE MOTION TO RECONSIDER VOTE BY WHICH H. R. 276, (14 STAT 434, 3/2/1867), AN ACT TO ESTABLISH A NATIONAL BUREAU OF EDUCATION, WAS REJECTED FOR PASSAGE.  (P. 3269-3)",Education,,Government Organization,Budget Special Interest,Government Management,14.552493349930202,-0.38425984039832484,0.024,-0.035,0.156,-0.062,0.611,0.876,-39.152284,
2016-10-18 10:30:10,RH0390267,39,House,267,1866-06-19,,76,48,TO RECONSIDER VOTE BY WHICH H. R. 276 WAS REJECTED. (P. 3270-2),Education,,Government Organization,Budget Special Interest,Government Management,12.952192076888041,-1.3623586650727888,0.118,0.166,-0.159,0.071,0.458,0.79,-50.335667,
2016-10-18 10:30:10,RH0390268,39,House,268,1866-06-19,,80,44,TO PASS H. R. 276.  (P. 3270-2),Education,,Government Organization,Budget Special Interest,Government Management,14.086067281022181,-0.9708525751095084,0.068,-0.013,-0.151,0.062,0.5,0.823,-48.972177,
2016-10-18 10:30:10,RH0390269,39,House,269,1866-06-20,,34,74,"TO AMEND H. R. 692 (14 STAT 230, 7/25/1866E, A BILL INCREASING THE PENSIONS OF WIDOWS AND ORPHANS AND F. O. P. BY ELIMINATING THE SECTION THAT PROVIDES THAT PENSION LAWS BE EXTENDED TO INCLUDE CERTAIN OFFICERS OR THEIR DEPENDENTS. (P. 3296-2)",Military Pensions/Veterans Benefits,,Defense Policy Budget,,Foreign and Defense Policy,3.396458287014771,-0.16161438041927184,-0.117,-0.559,0.175,-0.298,0.676,0.898,-32.952845,
2016-10-18 10:30:10,RH0390270,39,House,270,1866-06-20,,75,39,"TO RESOLVE THE HOUSE INTO THE COMMITTEE OF THE HOUSE AND TO CONSIDER SENATE AMENDMENT TO H. J. RES. 52 (14 STAT 362, 7/5/1866), A BILL TO PROVIDE FOR THE EXPENSES ATTENDING THE EXHIBITION OF THE PRODUCTS OF INDUSTRY OF UNITED STATES AT EXPOSITION AT PARI 1867",Science and Technology,,Budget Special Interest,,Government Management,-3.6830058460001145,-0.35146383564403594,-0.314,0.805,-0.135,-0.212,0.359,0.781,-56.565206,
2016-10-18 10:30:10,RH0390271,39,House,271,1866-06-20,,40,74,"TO TABLE SENATE AMENDMENTS TO H. J. RES. 52 (14 STAT 362, 7/5/1866), A BILL PROVIDING FOR APPROPRIATION OF CERTAIN SUMS IN COIN RATHER THAN IN CURRENCY FOR THE EXPENSES ATTENDING THE EXHIBITION OF PRODUCTS OF UNITED STATES INDUSTRY AT THE PARIS EXPOSITIO IN 1867",Science and Technology,,Budget Special Interest,,Government Management,-2.1516091287920784,-0.1503478058339801,-0.154,0.181,0.109,0.293,0.375,0.781,-57.254185,
2016-10-18 10:30:10,RH0390272,39,House,272,1866-06-21,,41,76,"TO AMEND A MOTION TO RECOMMIT H.R. 696 TO COMMITTEE ON WAYS AND MEANS BY SUBSTITUTING THE COMMITTEE ON APPROPRIATIONS. H.R. 696, IS A BILL TO REORGANIZE THE TREASURY DEPARTMENT AND FIX THE PAY OF ITS OFFICERS.  (P. 3325)",,,Budget Special Interest,Government Organization,Government Management,3.1802019034492077,-1.2158726852417148,0.36,-0.071,-0.193,0.351,0.195,0.718,-57.003173,
2016-10-18 10:30:10,RH0390273,39,House,273,1866-06-21,,91,23,"TO AMEND A RESOLUTION PROVIDING THAT THERE BE 50,000 EXTRA COPIES OF EACH OF THE REPORTS FROM THE COMMITTEE ON RECON- STRUCTION PRINTED FOR THE USE OF THE MEMBERS OF THIS HOUSE, BY ELIMINATING 50,000 AND INSERTING 10,000 EXTRA COPIES EACH OF REPORTS OF MJORITY AND MINORITY",Nullification/Secession/Reconstruction,,Budget Special Interest,,Government Management,30.385292460022413,3.671235095202689,-0.12,0.025,-0.725,0.138,0.957,0.991,-1.6634,
2016-10-18 10:30:10,RH0390274,39,House,274,1866-06-21,,61,49,"TO PASS S. 145 (14 STAT 212, 7/23/1866), PROVIDING FOR A GRANT OF LANDS TO STATE OF KAN. TO AID IN CONSTRUCTION OF NORTHERN KAN. RAILROAD AND TELEGRAPH.  (P. 3327)",Public Lands,,Budget Special Interest,,Government Management,17.351049763378313,-2.387498016636342,0.141,0.059,-0.141,0.047,0.531,0.791,-50.761858,
2016-10-18 10:30:10,RH0390275,39,House,275,1866-06-21,,72,41,"TO PASS H. R. 361, A BILL TO REORGANIZE AND ESTABLISH THE ARMY OF THE UNITED STATES.  (P. 3332-3)",,,Defense Policy Budget,,Foreign and Defense Policy,9.639472090765732,-0.8960971788011222,0.119,0.251,-0.17,0.102,0.61,0.858,-40.43676,
2016-10-18 10:30:10,RH0390276,39,House,276,1866-06-23,,51,41,"TO PASS H. R. 708, AUTHORIZING THE SECRETARY OF TREASURY TO PAY DR. EDWARD JARVIS THE SUM OF $1,500 IN FULL, FOR HIS SERVICES IN THE PREPARATION OF UNITED STATES CENSUS OF 1850. (P. 3374)",,,Budget Special Interest,,Government Management,-2.9365608276507977,0.2791085194451109,-0.049,0.423,-0.197,-0.388,0.463,0.761,-38.053897,
2016-10-18 10:30:10,RH0390277,39,House,277,1866-06-25,,89,21,"TO PASS A RESOLUTION PROVIDING THAT COMPENSATION OF CERTAIN CLERKS EQUAL THAT OF ASSISTING, DISBURSING CLERK JOHN M. BARCLAY (JOURNAL CLERK).  AND FURTHER PROVIDING THAT SALARIES OF OFFICERS INCREASED AT PRESENT SESSION NOT EXTEND BEYOND 1ST SESSION OF NXT CONGRESS",,,Internal Organization,Budget Special Interest,Government Management,-0.7590135504539947,-0.7450380706033897,-0.448,-0.405,-0.05,-0.381,0.048,0.818,-50.118013,
2016-10-18 10:30:10,RH0390278,39,House,278,1866-06-25,,77,29,"TO PASS A RESOLUTION PROVIDING THAT UNTIL OTHERWISE ORDERED THE CLERK OF HOUSE OF REPRESENTATIVES, PAY CLERKS, AND EMPLOYEES OF HOUSE NOW RECEIVING $1200 OR LESS, RECEIVE AN INCREASE OF 25%, TO DATE FROM COMMENCEMENT OF 39TH CONGRESS, THE INCREASE TO BE AID ONLY DURING PRESENT CONGRESS",,,Internal Organization,Budget Special Interest,Government Management,-2.9167712964299763,-0.8036365898828579,-0.509,0.681,-0.117,-0.232,0.31,0.811,-52.727933,
2016-10-18 10:30:10,RH0390279,39,House,279,1866-06-25,,84,37,"TO SUSPEND RULES AND TO DISCHARGE THE COMMITTEE ON THE PACIFIC RAILROAD FROM FURTHER CONSIDERATION OF S. 317 (14 STAT 79, 7/3/1866), A BILL TO AMEND AN ACT TO AID THE CONSTRUCTION OF A RAILROAD AND TELEGRAPH LINE FROM THE MO. RIVER TO THE PACIFIC OCEAN AD TO SECURE TO THE GOVERNMENT THE USE OF SAME FOR POSTAL, MILITARY, AND OTHER PURPOSES",Public Works,,Budget Special Interest,,Government Management,-15.087869359459404,6.2054199053513255,0.46,-0.735,0.12,0.046,-0.027,0.686,-67.643773,
2016-10-18 10:30:10,RH0390280,39,House,280,1866-06-26,,80,31,"TO PASS H. R. 18, (14 STAT 82, 7/3/1866), PROVIDING FOR THE RELIEF OF THE 37TH REGIMENT IOWA VOLUNTEERS INFANTRY. (P. 3415, 3416)",,,Budget Special Interest,,Government Management,22.773252814434038,-0.2011860225154723,0.008,-0.019,-0.189,0.048,0.774,0.937,-28.332965,
2016-10-18 10:30:10,RH0390281,39,House,281,1866-06-26,,99,37,"TO PASS S. 317 (14 STAT 79, 7/3/1866), A BILL TO AMEND AN ACT TO AID IN THE CONSTRUCTION OF A RAILROAD AND TELEGRAPH LINE FROM THE MO. RIVER TO THE PACIFIC OCEAN AND TO SECURE TO THE GOVERNMENT THE USE OF SAME FOR POSTAL, MILITARY AND OTHER PURPOSES.  (P 3424)",Public Works,,Budget Special Interest,,Government Management,-35.85883617764852,16.01051183967245,0.471,-0.879,0.124,0.02,-0.027,0.721,-73.73206,
2016-10-18 10:30:10,RH0390282,39,House,282,1866-06-27,,100,33,"TO PASS S. 222 (14 STAT 178, 7/18/1866), A BILL TO PREVENT SMUGGLING AND FOR OTHER PURPOSES.  (P. 3440)",,,Domestic Social Policy,,Civil Liberties,16.16643994017578,0.9318185961114258,-0.065,-0.119,-0.232,0.083,0.848,0.962,-19.286147,
2016-10-18 10:30:10,RH0390283,39,House,283,1866-06-27,,84,47,"TO TABLE A MOTION TO RECONSIDER THE VOTE BY WHICH HOUSE REFUSED TO CONCUR IN THE SENATE AMENDMENT TO H. R. 513, (14 STAT 98, 7/13/1866), THE INTERNAL REVENUE BILL WHICH PROVIDED FOR A TAX OF TWO CENTS PER POUND ON COTTON INSTEAD OF FIVE CENTS PER POUND. (P",Tax rates,,Budget Special Interest,,Government Management,13.105580140424046,-1.5293528764296134,0.117,0.004,-0.213,0.094,0.574,0.847,-40.917735,
2016-10-18 10:30:10,RH0390284,39,House,284,1866-06-27,,55,75,TO TABLE THE MOTION TO RECONSIDER VOTE BY WHICH HOUSE AGREED TO H. R. 513.  (P. 3448-1),Tax rates,,Budget Special Interest,,Government Management,-2.4380449411105944,0.5863244484464776,0.366,-0.306,-0.137,-0.325,0.473,0.777,-65.081003,
2016-10-18 10:30:10,RH0390285,39,House,285,1866-06-27,,49,77,"TO AMEND H. R. 513, BY PROVIDING THAT GAS COMPANIES WHOSE PRICE IS FIXED BY LAW ADD TAX ON EACH 1000 FT. OF GAS SOLD AND ON CONTRACTS TO ADD TAX TO CONTRACT PRICE.  (P. 3448)",Tax rates,,Budget Special Interest,,Government Management,-3.0052471812387282,0.8164377276594116,0.274,-0.007,-0.212,-0.408,0.49,0.802,-51.219072,
2016-10-18 10:30:10,RH0390286,39,House,286,1866-06-28,,50,54,"TO TABLE MOTION TO RECONSIDER S 343 (14 STAT 218), A BILL TO QUIET LAND TITLES IN CAL..  (P.--)",Public Lands,,Government Organization,,Government Management,2.01421804881672,-0.6348294083151832,0.621,0.616,-0.07,0.201,0.18,0.606,-67.668558,
2016-10-18 10:30:10,RH0390287,39,House,287,1866-06-28,,46,72,"TO TABLE H. R. 191 (14 STAT 93, 7/13/1866), A BILL TO AMEND AN ACT MAKING A GRANT OF LANDS TO THE STATE OF MINNESOTA TO AID IN THE CONSTRUCTION OF A RAILROAD FROM ST. PAUL TO LAKE SUPERIOR; APPROVED MAY 5, 1864.  (P. 3465)",Public Lands,,Budget Special Interest,,Government Management,9.220364608558526,-0.8396109382567557,0.03,-0.563,0.11,-0.069,0.348,0.746,-61.875837,
2016-10-18 10:30:10,RH0390288,39,House,288,1866-06-29,,102,11,TO RECOMMIT H. R. 165 WITH INSTRUCTIONS TO COMMITTEE ON INVALID PENSIONS TO REPORT IT WITH RECOMMENDATIONS THAT IT PASS.  H. R. 165 IS A BILL GRANTING PENSIONS TO SOLDIERS OF WAR OF 1812 WITH GREAT BRITAIN.  (P. 3354-2),Military Pensions/Veterans Benefits,,Defense Policy Budget,,Foreign and Defense Policy,283.40047946851246,-178.38790158569432,0.629,-0.129,0.147,-0.003,0.0,0.903,-35.376121,
2016-10-18 10:30:10,RH0390289,39,House,289,1866-07-02,,59,66,"TO TABLE A RESOLUTION PROVIDING THAT SPEAKER BE AUTHORIZED TO APPOINT A STENOGRAPHER AS ASSISTANT OFFICIAL REPORTER TO COMMITTEES OF HOUSE TO COMMENCE MAY 1, 1866; COMPENSATION SAME AS OFFICIAL REPORTER; PAID OUT OF CONTINGENCY FUND OF HOUSE.  (P. 3537-2)",,,Internal Organization,Budget Special Interest,Government Management,-11.231105854589842,1.9935990538261716,0.18,-0.028,0.167,0.086,0.525,0.776,-59.6175,
2016-10-18 10:30:10,RH0390290,39,House,290,1866-07-02,,58,73,"TO TABLE H. R. 275, PROVIDING FOR RELIEF OF ELLEN SANDERSON, WIDOW OF COL. JOHN P. SANDERSON, THE PROVOST MARSHAL GENERAL OF MO.; $10,000 AS COMPEN- SATION FOR LABOR AND SERVICES IN DETECTING COMSPIRACIES IN LOYAL STATE AGAINST GOVERNMENT OF UNITED STATE.",,,Budget Special Interest,,Government Management,-7.346840890799829,0.3421311607188152,-0.089,0.996,0.094,0.074,0.345,0.71,-77.493553,
2016-10-18 10:30:10,RH0390291,39,House,291,1866-07-02,,57,79,"TO PASS H. R. 275 PROVIDING FOR RELIEF OF ELLEN SANDERSON, WIDOW OF COL. JOHN P. SANDERSON, THE PROVOST MARSHAL GENERAL OF MO.; $10,000 AS COMPENSATION FOR LABOR AND SERVICES IN DETECTING CONSPIRACIES IN LOYAL STATES AGAINST THE GOVERNMENT OF UNITED STATS",Nullification/Secession/Reconstruction,,Budget Special Interest,,Government Management,17.49934933400548,-5.077322368183496,0.273,-0.3,-0.118,0.039,0.123,0.632,-79.313828,
2016-10-18 10:30:10,RH0390292,39,House,292,1866-07-03,,25,102,"TO TABLE REPORT OF CONFERENCE COMMITTEE ON H. R. 613, AN ACT TO CONTINUE IN FORCE AND TO AMEND AN ACT TO ESTABLISH A BUREAU FOR THE RELIEF OF FREEDMEN AND REFUGEES AND FOR OTHER PURPOSES.",Civil Rights/Desegregation/Busing/Affirmative Action,,Government Organization,,Government Management,5.707582159006026,0.5723430515825906,-0.098,0.013,0.675,-0.684,1.0,1.0,-1.114292,
2016-10-18 10:30:10,RH0390293,39,House,293,1866-07-03,,85,47,"TO PROVIDE THAT WHEN THE HOUSE ADJOURNS TODAY IT BE TO MEET AGAIN ON THURSDAY JULY 5, 1866.  (P. 3570)",,,Internal Organization,,Miscellaneous Policy,3.5316295978557637,-1.5734620615551709,0.394,-0.182,0.069,-0.113,-0.021,0.636,-81.424095,
2016-10-18 10:30:10,RH0390294,39,House,294,1866-07-05,,71,67,"TO AMEND H. R. 753, PROVIDING FOR AN EXPLANATION OF AN ACT TO AMEND AN ACT TO AID IN THE CONSTRUCTION OF A RAILROAD AND A TELEGRAPH LINE FROM THE MO. RIVER TO THE PACIFIC OCEAN, AND TO SECURE TO THE GOVERNMENT THE USE OF SAME FOR POSTAL, MILITARY, AND OTER PURPOSES, BY SUBSTITUTING AS FOLLOWS: ""BE IT ENACTED THAT THE UNION PACIFIC RAILROAD COMPANY, EASTERN DIVISION, IS HEREBY AUTHORIZED TO DESIGNATE THE GENERAL ROUTE OF THIS ROAD AND TO FILE MAPS OF ROUTE BEFORE JAN",Public Works,,Budget Special Interest,,Government Management,-13.880839810702652,2.8616913213833404,0.204,0.03,0.06,0.025,0.164,0.594,-89.95452,
2016-10-18 10:30:10,RH0390295,39,House,295,1866-07-05,,123,11,"TO TABLE H. R. 753, PROVIDING FOR AN EXPLANATION OF AN ACT TO AMEND AN ACT TO AID IN THE CONSTRUCTION OF A RAILROAD AND TELEGRAPH LINE FROM THE MO. RIVER TO THE PACIFIC OCEAN AND TO SECURE TO THE GOVERNMENT THE USE OF SAME FOR POSTAL, MILITARY, AND OTHERPURPOSES",Public Works,,Budget Special Interest,,Government Management,-1.7936739206867878,-1.6229435075592331,-0.989,0.151,-0.245,-0.79,0.0,0.918,-35.685248,
2016-10-18 10:30:10,RH0390296,39,House,296,1866-07-06,,46,84,"TO TABLE H. R. 665, A BILL GRANTING PENSIONS TO SOLDIERS AND SAILORS OF THE WAR OF 1812 AND THOSE ENGAGED IN INDIAN WARS DURING THAT PERIOD.  (P. 3628)",Military Pensions/Veterans Benefits,,Defense Policy Budget,,Foreign and Defense Policy,-3.5919717054011255,1.249404031384676,0.423,-0.27,-0.118,-0.19,0.283,0.746,-68.073777,
2016-10-18 10:30:10,RH0390297,39,House,297,1866-07-06,,74,47,TO RECOMMIT H. R. 665 TO COMMITTEE ON INVALID PENSIONS. H. R. 665 IS A BILL GRANTING PENSIONS TO SOLDIERS AND SAILORS OF THE WAR OF 1812 AND THOSE ENGAGED IN INDIAN WARS DURING THAT PERIOD.  (P. 3629),Tax rates,,Budget General Interest,,Government Management,-41.06415110666201,2.7647584975864663,0.043,0.999,-0.142,-0.02,0.426,0.777,-58.130266,
2016-10-18 10:30:10,RH0390298,39,House,298,1866-07-06,,71,57,"TO AGREE TO CONFERENCE REPORT ON H. R. 513 (14 STAT 98, 7/13/1866), A BILL TO AMEND AN ACT TO PROVIDE INTERNAL REVENUE TO SUPPORT THE GOVERNMENT, TO PAY INTEREST ON THE PUBLIC DEBT AND FOR OTHER PURPOSES, APPROVED JUNE 20, 1864, AND ACTS AMENDATORY THEREF",Tax rates,,Budget General Interest,,Government Management,-2.986483716848146,0.36995883629083287,0.225,-0.302,-0.142,-0.275,0.544,0.797,-60.730434,
2016-10-18 10:30:10,RH0390299,39,House,299,1866-07-07,,30,91,"TO AMEND S. 343 (14 STAT 218, 7/23/1866), AN ACT TO QUIET LAND TITLES IN CAL., BY PROVIDING THAT ACT OF CONGRESS APPROVED MAR. 3, 1863 TO GUARD RIGHTS OF PREEMPTION ON SOSCOL RANCH IN CAL. SHALL NOT INTERFERE WITH CLAIM OF BONA FIDE SETTLERS ON SAID LAND CLAIMING PREEMPTIONS PRIOR TO TIME OF PASSAGE OF SAID ACT",Public Lands,,Government Organization,,Government Management,-0.4626946603567552,-0.6682866655959238,-0.381,-0.492,0.028,0.35,0.067,0.769,-63.594182,
