date_generated,id,congress,chamber,rollnumber,date,keyvote,yea,nay,description,Issue1,Issue2,Peltzman1,Peltzman2,Clausen1,mid.dim1,mid.dim2,spread.dim1,spread.dim2,pre,classified,log_likelihood,geo_mean_probability
2017-01-25 03:21:58,RS1070414,107,Senate,414,2002-02-14,,40,55,To clarify the ability of election officials to remove registrants from official list of voters on grounds of change of residence.,,,Domestic Social Policy,Budget Special Interest,Civil Liberties,0.157,0.987,-0.38,0.002,0.875,0.947,-12.437072,0.877
2017-01-25 03:21:58,RS1070415,107,Senate,415,2002-02-26,,99,0,"Robert E. Blackburn, of Colorado, to be United States District Judge for the District of Colorado",Judiciary,,Government Organization,,Government Management,0.0,0.0,0.0,0.0,,,0.0,
2017-01-25 03:21:58,RS1070416,107,Senate,416,2002-02-26,,97,0,"To amend the short title to read ?Martin Luther King, Jr. Equal Protection of Voting Rights Act of 2001"".",,,Domestic Social Policy,Budget Special Interest,Civil Liberties,0.0,0.0,0.0,0.0,,,0.0,
2017-01-25 03:21:58,RS1070417,107,Senate,417,2002-02-26,,99,0,"Cindy K. Jorgenson, of Arizona, to be United States District Judge for the District of Arizona",Judiciary,,Government Organization,,Government Management,0.0,0.0,0.0,0.0,,,0.0,
2017-01-25 03:21:58,RS1070418,107,Senate,418,2002-02-27,,46,51,"To permit the use of a signature or personal mark for the purpose of verifying the identity of voters who register by mail, and for other purposes.",,,Domestic Social Policy,Budget Special Interest,Civil Liberties,0.111,-0.109,-0.609,0.976,0.978,0.99,-4.108414,0.959
2017-01-25 03:21:58,RS1070419,107,Senate,419,2002-03-01,,49,39,"A bill to require States and localities to meet uniform and nondiscriminatory election technology and administration requirements applicable to Federal elections, to establish grant programs to provide assistance to States and localities to met those reqirements and to improve election technology and the administration of Federal elections, to establish the Election Administration Commission, and for other purposes.",,,Domestic Social Policy,Budget Special Interest,Civil Liberties,-0.139,-0.978,0.321,-0.287,0.949,0.977,-9.878848,0.894
2017-01-25 03:21:58,RS1070420,107,Senate,420,2002-03-04,,51,44,"A bill to require States and localities to meet uniform and nondiscriminatory election technology and administration requirements applicable to Federal elections, to establish grant programs to provide assistance to States and localities to met those reqirements and to improve election technology and the administration of Federal elections, to establish the Election Administration Commission, and for other purposes.",,,Domestic Social Policy,Budget Special Interest,Civil Liberties,0.082,-0.217,0.606,-0.96,0.977,0.989,-4.048935,0.958
2017-01-25 03:21:58,RS1070421,107,Senate,421,2002-03-06,,93,5,To prohibit the issuance of any permit which would authorize the transport of Alaska North Slope natural gas via a pipeline running offshore in the Beaufort Sea between Alaska and Canada.,Energy,,Budget Special Interest,,Government Management,0.432,-0.902,0.222,-0.359,-0.2,0.939,-14.506014,0.862
2017-01-25 03:21:58,RS1070422,107,Senate,422,2002-03-07,,78,21,To reauthorize the Price-Anderson Act.,Energy,Nuclear Power,Regulation Special Interest,Budget Special Interest,Government Management,-0.064,-0.774,-0.115,-0.363,0.143,0.818,-35.870273,0.696
2017-01-25 03:21:58,RS1070423,107,Senate,423,2002-03-07,,78,21,To study whether there is a need to regulate hydraulic fracturing.,Pollution and Environmental Protection,,Regulation Special Interest,Budget Special Interest,Government Management,-0.393,0.017,-0.29,-0.633,0.476,0.889,-21.973919,0.801
2017-01-25 03:21:58,RS1070424,107,Senate,424,2002-03-08,,85,9,A bill to provide tax incentives for economic recovery.,Tax rates,,Budget Special Interest,,Government Management,-0.364,0.931,-0.187,0.164,0.0,0.904,-24.069123,0.774
2017-01-25 03:21:58,RS1070425,107,Senate,425,2002-03-08,,94,0,"To provide for enhanced safety, public awareness, and environmental protection in pipeline transportation, and for other purposes.",Energy,,Budget Special Interest,Regulation General Interest,Government Management,0.0,0.0,0.0,0.0,,,0.0,
2017-01-25 03:21:58,RS1070426,107,Senate,426,2002-03-12,,98,0,"Ralph R. Beistline, of Alaska, to be United States District Judge for the District of Alaska",Judiciary,,Government Organization,,Government Management,0.0,0.0,0.0,0.0,,,0.0,
2017-01-25 03:21:58,RS1070427,107,Senate,427,2002-03-13,CQ,62,38,To provide alternative provisions to better encourage increased use of alternative fueled and hybrid vehicles.,Energy,,Budget Special Interest,Regulation General Interest,Government Management,-0.266,0.198,-0.165,-0.297,0.553,0.83,-38.268203,0.682
2017-01-25 03:21:58,RS1070428,107,Senate,428,2002-03-13,,56,44,To prohibit the increase of the average fuel economy standard for pickup trucks.,Energy,,Budget Special Interest,Regulation General Interest,Government Management,0.024,-0.247,-0.148,-0.541,0.659,0.85,-33.802755,0.713
2017-01-25 03:21:58,RS1070429,107,Senate,429,2002-03-14,,60,40,To establish an organization to enforce reliability standards with respect to electricity.,Energy,,Budget Special Interest,Regulation Special Interest,Government Management,-0.186,0.408,-0.166,-0.076,0.575,0.83,-37.965531,0.684
2017-01-25 03:21:58,RS1070430,107,Senate,430,2002-03-14,,29,70,To establish renewable electric energy generation standards.,Energy,Pollution and Environmental Protection,Budget Special Interest,Regulation General Interest,Government Management,0.111,-0.602,0.291,1.318,0.759,0.929,-20.487627,0.813
2017-01-25 03:21:58,RS1070431,107,Senate,431,2002-03-15,,91,0,"David C. Bury, of Arizona, to be United States District Judge for the District of Arizona",Judiciary,,Government Organization,,Government Management,0.0,0.0,0.0,0.0,,,0.0,
2017-01-25 03:21:58,RS1070432,107,Senate,432,2002-03-18,,92,0,"Randy  Crane, of Texas, to be United States District Judge for the Southern District of Texas",Judiciary,,Government Organization,,Government Management,0.0,0.0,0.0,0.0,,,0.0,
2017-01-25 03:21:58,RS1070433,107,Senate,433,2002-03-20,,68,32,A bill to amend the Federal Election Campaign Act of 1971 to provide bipartisan campaign reform.,,,Domestic Social Policy,Budget Special Interest,Civil Liberties,0.065,0.915,0.473,0.589,0.781,0.93,-18.231968,0.833
2017-01-25 03:21:58,RS1070434,107,Senate,434,2002-03-20,CQ,60,40,A bill to amend the Federal Election Campaign Act of 1971 to provide bipartisan campaign reform.,,,Domestic Social Policy,Budget Special Interest,Civil Liberties,-0.015,0.5,0.343,0.588,0.725,0.89,-17.872724,0.836
2017-01-25 03:21:58,RS1070435,107,Senate,435,2002-03-21,,40,58,To provide for appropriate State regulatory authority with respect to renewable sources of electricity.,Energy,Pollution and Environmental Protection,Budget Special Interest,Regulation General Interest,Government Management,0.039,0.218,-0.216,-0.364,0.75,0.898,-23.744209,0.785
2017-01-25 03:21:58,RS1070436,107,Senate,436,2002-03-21,,97,1,To express the sense of the Senate on the fair treatment of judicial nominees.,Judiciary,,Internal Organization,,Miscellaneous Policy,0.0,0.0,0.0,0.0,,,0.0,
2017-01-25 03:21:58,RS1070437,107,Senate,437,2002-03-21,,47,51,To provide for the fair treatment of Presidential judicial nominees.,Judiciary,,Internal Organization,,Miscellaneous Policy,0.076,-0.082,-0.625,0.998,0.979,0.99,-1.753784,0.982
2017-01-25 03:21:58,RS1070438,107,Senate,438,2002-03-21,,39,57,To protect State portfolio requirements.,Central America,Pollution and Environmental Protection,Budget Special Interest,Regulation General Interest,Government Management,0.257,-0.377,-0.203,-0.413,0.795,0.917,-26.072505,0.762
2017-01-25 03:21:58,RS1070439,107,Senate,439,2002-03-21,,37,58,"To allow the Governor of a State the ability to waive certain provisions of the Federal mandate, if the provisions would adversely effect retail electric customers of the State, with respect to the application of the Federal renewable portfolio standard.",Central America,Pollution and Environmental Protection,Budget Special Interest,Regulation General Interest,Government Management,0.036,0.222,-0.25,-0.527,0.784,0.916,-20.894813,0.803
2017-01-25 03:21:58,RS1070440,107,Senate,440,2002-04-09,,40,59,To provide a substitute.,Banking and Finance,,Regulation Special Interest,,Government Management,-0.157,0.075,0.171,0.135,0.6,0.838,-34.030966,0.709
2017-01-25 03:21:58,RS1070441,107,Senate,441,2002-04-10,,48,50,"To provide regulatory oversight over energy trading markets, and for other purposes.",Energy,,Budget Special Interest,,Government Management,-0.188,0.982,0.403,0.328,0.875,0.939,-13.589112,0.871
2017-01-25 03:21:58,RS1070442,107,Senate,442,2002-04-10,,32,68,To provide for consumer protections and electric reliability.,Energy,,Regulation Special Interest,,Government Management,0.219,0.57,-0.039,-0.136,0.094,0.71,-59.224555,0.553
2017-01-25 03:21:58,RS1070443,107,Senate,443,2002-04-11,,56,43,To eliminate the administrative procedures of requiring election officials to notify voters by mail whether or not their individual vote was counted.,,,Domestic Social Policy,Budget Special Interest,Civil Liberties,0.034,-0.936,-0.179,-0.125,0.744,0.889,-31.850452,0.725
2017-01-25 03:21:58,RS1070444,107,Senate,444,2002-04-11,,48,52,To establish a residual ballot performance benchmark.,,,Domestic Social Policy,Budget Special Interest,Civil Liberties,-0.135,-0.523,0.274,-0.273,0.917,0.96,-14.486478,0.865
2017-01-25 03:21:58,RS1070445,107,Senate,445,2002-04-11,CQ,99,1,"A bill to require States and localities to meet uniform and nondiscriminatory election technology and administration requirements applicable to Federal elections, to establish grant programs to provide assistance to States and localities to met those reqirements and to improve election technology and the administration of Federal elections, to establish the Election Administration Commission, and for other purposes.",,,Domestic Social Policy,Budget Special Interest,Civil Liberties,0.0,0.0,0.0,0.0,,,0.0,
2017-01-25 03:21:58,RS1070446,107,Senate,446,2002-04-11,,69,30,To establish a Consumer Energy Commission to assess and provide recommendations regarding energy price spikes from the perspective of consumers.,Energy,,Budget Special Interest,,Government Management,0.236,0.441,0.21,0.15,0.5,0.848,-27.498527,0.757
2017-01-25 03:21:58,RS1070447,107,Senate,447,2002-04-11,,61,36,To reduce the period of time in which the Administrator may act on a petition by 1 or more States to waive the renewable fuel content requirement.,Pollution and Environmental Protection,Energy,Budget Special Interest,,Government Management,-0.974,0.186,-0.069,-0.462,-0.028,0.619,-58.902166,0.545
2017-01-25 03:21:58,RS1070448,107,Senate,448,2002-04-15,,99,0,"Terrence L. O'Brien, of Wyoming, to be United States Circuit Judge for the Tenth Circuit",Judiciary,,Government Organization,,Government Management,0.0,0.0,0.0,0.0,,,0.0,
2017-01-25 03:21:58,RS1070449,107,Senate,449,2002-04-17,,98,0,"Lance M. Africk, of Louisiana, to be United States District Judge for the Eastern District of Louisiana",Judiciary,,Government Organization,,Government Management,0.0,0.0,0.0,0.0,,,0.0,
2017-01-25 03:21:58,RS1070450,107,Senate,450,2002-04-18,,36,64,"To create jobs for Americans, to strengthen the United States steel industry, to reduce dependence on foreign sources of crude oil and energy, to promote national security.",Pollution and Environmental Protection,Energy,Budget Special Interest,,Government Management,-0.34,0.903,-0.134,-0.405,0.333,0.76,-44.715527,0.639
2017-01-25 03:21:58,RS1070451,107,Senate,451,2002-04-18,CQ,46,54,"To create jobs for Americans, to reduce dependence on foreign sources of crude oil and energy, to strengthen the economic self determination of the Inupiat Eskimos and to promote national security.",Energy,,Budget Special Interest,,Government Management,-0.003,0.112,-0.188,-0.324,0.761,0.89,-27.372647,0.761
2017-01-25 03:21:58,RS1070452,107,Senate,452,2002-04-18,,88,10,To make the United States' energy policy toward Iraq consistent with the national security policies of the United States.,Energy,Iran,Budget Special Interest,Regulation Special Interest,Government Management,-0.587,-0.809,-0.094,-0.21,0.0,0.898,-34.996574,0.7
2017-01-25 03:21:58,RS1070453,107,Senate,453,2002-04-18,,97,0,To revise provisions relating to the compliance by institutions and other entities with record keeping and reporting requirements with respect to nonimmigrant students and exchange visitors.,Immigration/Naturalization,,Regulation Special Interest,,Social Welfare,0.0,0.0,0.0,0.0,,,0.0,
2017-01-25 03:21:58,RS1070454,107,Senate,454,2002-04-18,,97,0,To require as a condition of a country's designation or continued designation as a program country under the Visa Waiver Program that the country reports to the United States Government  the theft of blank passports issued by that country.,Immigration/Naturalization,,Regulation Special Interest,Foreign Policy Resolutions,Social Welfare,0.0,0.0,0.0,0.0,,,0.0,
2017-01-25 03:21:58,RS1070455,107,Senate,455,2002-04-18,,97,0,"A bill to enhance the border security of the United States, and for other purposes.",Immigration/Naturalization,,Regulation Special Interest,Foreign Policy Resolutions,Social Welfare,0.0,0.0,0.0,0.0,,,0.0,
2017-01-25 03:21:58,RS1070456,107,Senate,456,2002-04-18,,95,0,"Legrome D. Davis, of Pennsylvania, to be United States District Judge for the Eastern District of Pennsylvania",Judiciary,,Government Organization,,Government Management,0.0,0.0,0.0,0.0,,,0.0,
2017-01-25 03:21:58,RS1070457,107,Senate,457,2002-04-23,,86,13,To provide for the energy security of the nation.,Energy,,Budget Special Interest,,Government Management,-0.187,-0.83,-0.088,-0.391,-0.077,0.859,-31.244692,0.729
2017-01-25 03:21:58,RS1070458,107,Senate,458,2002-04-23,,69,30,To strike the section establishing a renewable fuel content requirement for motor vehicle fuel.,Energy,Pollution and Environmental Protection,Budget Special Interest,,Government Management,0.777,0.623,0.079,-0.075,-0.033,0.687,-58.186459,0.556
2017-01-25 03:21:58,RS1070459,107,Senate,459,2002-04-23,,100,0,"Jeffrey R. Howard, of New Hampshire, to be United States Circuit Judge for the First Circuit",Judiciary,,Government Organization,,Government Management,0.0,0.0,0.0,0.0,,,0.0,
2017-01-25 03:21:58,RS1070460,107,Senate,460,2002-04-24,,58,39,To protect electricity consumers.,Energy,,Budget Special Interest,,Government Management,0.138,-0.99,-0.21,-0.33,0.615,0.845,-28.649348,0.744
2017-01-25 03:21:58,RS1070461,107,Senate,461,2002-04-24,,54,43,In the nature of a substitute.,Energy,Fish and Wildlife,Budget Special Interest,Regulation Special Interest,Government Management,-0.241,0.402,-0.301,-0.519,0.791,0.907,-19.744528,0.816
2017-01-25 03:21:58,RS1070462,107,Senate,462,2002-04-24,,37,60,To encourage the efficient generation of electricity through combined heat and power and to modify the provision relating to termination of mandatory purchase and sale requirements under PURPA.,Energy,,Budget Special Interest,Regulation Special Interest,Government Management,-0.029,0.597,-0.128,-0.212,0.568,0.835,-41.217513,0.654
2017-01-25 03:21:58,RS1070463,107,Senate,463,2002-04-24,,38,59,"To provide that not withstanding any other provision in this Act, ""3 cents"" shall be considered by law to be ""1.5 cents""  in any place ""3 cents"" appears in Title II of this Act.",Energy,Pollution and Environmental Protection,Budget Special Interest,Regulation General Interest,Government Management,0.128,-0.992,0.208,0.338,0.737,0.897,-28.636932,0.744
2017-01-25 03:21:58,RS1070464,107,Senate,464,2002-04-24,,50,46,To modify the definitions of biomass and renewable energy to exclude municipal solid waste.,Energy,Pollution and Environmental Protection,Budget Special Interest,Regulation Special Interest,Government Management,-0.553,0.403,-0.066,-0.317,0.283,0.656,-59.515771,0.538
2017-01-25 03:21:58,RS1070465,107,Senate,465,2002-04-25,,100,0,"Percy Anderson, of California, to be United States District Judge for the Central District of California",Judiciary,,Government Organization,,Government Management,0.0,0.0,0.0,0.0,,,0.0,
2017-01-25 03:21:58,RS1070466,107,Senate,466,2002-04-25,,100,0,"John F. Walter, of California, to be United States District Judge for the Central District of California",Judiciary,,Government Organization,,Government Management,0.0,0.0,0.0,0.0,,,0.0,
2017-01-25 03:21:58,RS1070467,107,Senate,467,2002-04-25,,57,42,To provide for equal liability treatment of vehicle fuels and fuel additives.,Energy,,Budget Special Interest,Regulation Special Interest,Government Management,-0.345,0.384,-0.136,-0.324,0.452,0.768,-46.014512,0.628
2017-01-25 03:21:58,RS1070468,107,Senate,468,2002-04-25,,60,39,To modify the provision relating to the renewable content of motor vehicle fuel to eliminate the required volume of renewable fuel for calendar year 2004.,Energy,,Budget Special Interest,Regulation Special Interest,Government Management,-0.699,0.166,-0.036,-0.099,0.026,0.616,-65.358196,0.517
2017-01-25 03:21:58,RS1070469,107,Senate,469,2002-04-25,,52,47,To direct the Secretary of Energy to revise the seasonal energy efficiency ratio standard for central air conditioners and central air conditioning heat pumps within 60 days.,Energy,,Budget Special Interest,Regulation Special Interest,Government Management,-0.16,0.307,-0.15,-0.22,0.66,0.838,-38.384483,0.679
2017-01-25 03:21:58,RS1070470,107,Senate,470,2002-04-25,,57,42,To decrease the United States dependence on imported oil by the year 2015.,Energy,,Regulation General Interest,,Government Management,0.357,-0.934,-0.13,-0.382,0.476,0.778,-43.64684,0.643
2017-01-25 03:21:58,RS1070471,107,Senate,471,2002-04-25,,91,8,To strike the provisions relating to alternative vehicles and fuels incentives.,Energy,,Regulation Special Interest,,Government Management,0.498,-0.676,0.15,-0.31,-0.125,0.909,-23.090038,0.792
2017-01-25 03:21:58,RS1070472,107,Senate,472,2002-04-25,,73,26,To strike a section of Division H relating to energy tax incentives.,,,Regulation Special Interest,,Government Management,-0.328,-0.016,-0.159,-0.163,0.308,0.818,-38.705193,0.676
2017-01-25 03:21:58,RS1070473,107,Senate,473,2002-04-25,,70,29,To limit the effective dates of the provisions of Division H (relating to energy tax incentives).,Tax rates,Energy,Budget General Interest,,Government Management,-0.447,0.543,-0.191,-0.273,0.448,0.838,-39.31506,0.672
2017-01-25 03:21:58,RS1070474,107,Senate,474,2002-04-25,,88,11,"A bill to enhance energy conservation, research and development and to provide for security and diversity in the energy supply for the American people, and for other purposes.",Energy,,Budget Special Interest,,Government Management,-0.666,0.084,-0.176,-0.358,-0.091,0.879,-28.817848,0.747
2017-01-25 03:21:58,RS1070475,107,Senate,475,2002-04-25,,100,0,"Joan E. Lancaster, of Minnesota, to be United States District Judge for the District of Minnesota",Judiciary,,Government Organization,,Government Management,0.0,0.0,0.0,0.0,,,0.0,
2017-01-25 03:21:58,RS1070476,107,Senate,476,2002-04-25,,98,0,"William C. Griesbach, of Wisconsin, to be United States District Judge for the Eastern District of Wisconsin",Judiciary,,Government Organization,,Government Management,0.0,0.0,0.0,0.0,,,0.0,
2017-01-25 03:21:58,RS1070477,107,Senate,477,2002-04-29,,69,21,"A bill to extend the Andean Trade Preference Act, to grant additional trade benefits under that Act, and for other purposes.",Tariffs,,Regulation Special Interest,,Government Management,-0.609,-0.793,-0.123,0.139,0.048,0.778,-44.320149,0.611
2017-01-25 03:21:58,RS1070478,107,Senate,478,2002-04-30,,99,0,"Michael M. Baylson, of Pennsylvania, to be United States District Judge for the Eastern District of Pennsylvania",Judiciary,,Government Organization,,Government Management,0.0,0.0,0.0,0.0,,,0.0,
2017-01-25 03:21:58,RS1070479,107,Senate,479,2002-04-30,,99,0,"Cynthia M. Rufe, of Pennsylvania, to be United States District Judge for the Eastern District of Pennsylvania",Judiciary,,Government Organization,,Government Management,0.0,0.0,0.0,0.0,,,0.0,
2017-01-25 03:21:58,RS1070480,107,Senate,480,2002-05-01,,77,21,"A bill to extend the Andean Trade Preference Act, to grant additional trade benefits under that Act, and for other purposes.",Tariffs,,Regulation Special Interest,,Government Management,-0.561,-0.549,-0.115,0.087,0.048,0.796,-44.884002,0.633
2017-01-25 03:21:58,RS1070481,107,Senate,481,2002-05-02,,29,67,To ensure transparency of investor protection dispute resolution tribunals under the North American Free Trade Agreement.,Tariffs,,Regulation Special Interest,,Government Management,-0.128,-0.992,-0.126,0.356,0.345,0.802,-36.358278,0.685
2017-01-25 03:21:58,RS1070482,107,Senate,482,2002-05-02,,94,2,To express solidarity with Israel in its fight against terrorism.,,,Foreign Policy Resolutions,,Foreign and Defense Policy,0.0,0.0,0.0,0.0,,,0.0,
2017-01-25 03:21:58,RS1070483,107,Senate,483,2002-05-08,,64,35,"To provide for the continuation of agricultural programs through fiscal year 2007, and for other purposes.",Agriculture,,Budget Special Interest,,Agriculture,0.432,-0.012,0.102,-0.449,0.371,0.778,-46.469094,0.625
2017-01-25 03:21:58,RS1070484,107,Senate,484,2002-05-09,,98,0,"Leonard E. Davis, of Texas, to be United States District Judge for the Eastern District of Texas",Judiciary,,Government Organization,,Government Management,0.0,0.0,0.0,0.0,,,0.0,
2017-01-25 03:21:58,RS1070485,107,Senate,485,2002-05-09,,98,0,"Andrew S. Hanen, of Texas, to be United States District Judge for the Southern District of Texas",Judiciary,,Government Organization,,Government Management,0.0,0.0,0.0,0.0,,,0.0,
2017-01-25 03:21:58,RS1070486,107,Senate,486,2002-05-09,,98,0,"Samuel H. Mays, Jr., of Tennessee, to be United States District Judge for the Western District of Tennessee",Judiciary,,Government Organization,,Government Management,0.0,0.0,0.0,0.0,,,0.0,
2017-01-25 03:21:58,RS1070487,107,Senate,487,2002-05-09,,96,0,"Thomas M. Rose, of Ohio, to be United States District Judge for the Southern District of Ohio",Judiciary,,Government Organization,,Government Management,0.0,0.0,0.0,0.0,,,0.0,
2017-01-25 03:21:58,RS1070488,107,Senate,488,2002-05-13,,68,20,"Paul G. Cassell, of Utah, to be United States District Judge for the District of Utah",Judiciary,,Government Organization,,Government Management,-0.311,0.001,-0.737,-0.193,0.65,0.92,-14.969878,0.844
2017-01-25 03:21:58,RS1070489,107,Senate,489,2002-05-14,,98,0,To clarify the principal negotiating objectives of the United States with respect to foreign investment.,Tariffs,,Regulation Special Interest,,Government Management,0.0,0.0,0.0,0.0,,,0.0,
2017-01-25 03:21:58,RS1070490,107,Senate,490,2002-05-14,,39,61,To limit the application of trade authorities procedures.,Tariffs,,Regulation Special Interest,,Government Management,-0.142,-0.99,-0.121,0.239,0.462,0.79,-43.184991,0.649
2017-01-25 03:21:58,RS1070491,107,Senate,491,2002-05-15,,66,33,To authorize the Secretary of Labor to award grants to community colleges to establish job training programs for adversely affected workers.,Tariffs,,Regulation Special Interest,,Government Management,0.293,-0.17,0.419,-0.821,0.697,0.899,-19.133059,0.824
2017-01-25 03:21:58,RS1070492,107,Senate,492,2002-05-15,,55,44,To clarify the principal negotiating objectives with respect to labor.,Tariffs,,Regulation Special Interest,,Government Management,-0.16,-0.012,-0.534,-0.048,0.909,0.96,-12.24364,0.884
2017-01-25 03:21:58,RS1070493,107,Senate,493,2002-05-15,,70,30,"To provide alternative fast-track trade negotiating authority to the President, and for other purposes.",Tariffs,,Regulation Special Interest,,Government Management,-0.256,0.219,-0.756,0.277,0.667,0.9,-19.572063,0.822
2017-01-25 03:21:58,RS1070494,107,Senate,494,2002-05-16,,58,38,To strike the provision relating to wage insurance.,Tariffs,,Regulation Special Interest,,Government Management,0.15,-0.456,0.173,-0.045,0.763,0.906,-26.839794,0.756
2017-01-25 03:21:58,RS1070495,107,Senate,495,2002-05-16,,53,46,To clarify the principal negotiating objectives of the United States with respect to labor and the environment.,Tariffs,Pollution and Environmental Protection,Regulation Special Interest,,Government Management,-0.136,0.028,-0.72,0.196,0.935,0.97,-9.044906,0.913
2017-01-25 03:21:58,RS1070496,107,Senate,496,2002-05-17,,85,6,"A bill to endorse the vision of further enlargement of the NATO Alliance articulated by President George W. Bush on June 15, 2001, and by former President William J. Clinton on October 22, 1996, and for other purposes.",,,Defense Policy Resolutions,Defense Policy Budget,Foreign and Defense Policy,0.434,0.901,0.193,0.219,0.0,0.934,-18.472396,0.816
2017-01-25 03:21:58,RS1070497,107,Senate,497,2002-05-21,,56,40,To provide a 1-year eligibility period for steelworker retirees and eligible beneficiaries affected by a qualified closing of a qualified steel company for assistance with health insurance coverage and interim assistance.,Tariffs,,Regulation Special Interest,,Government Management,0.075,-0.689,0.208,-0.138,0.775,0.906,-21.986282,0.795
2017-01-25 03:21:58,RS1070498,107,Senate,498,2002-05-21,,58,35,"A bill to extend the Andean Trade Preference Act, to grant additional trade benefits under that Act, and for other purposes.",,,Internal Organization,,Miscellaneous Policy,-0.036,0.999,0.219,0.232,0.6,0.849,-27.741534,0.742
2017-01-25 03:21:58,RS1070499,107,Senate,499,2002-05-21,,50,49,To provide mortgage assistance for employees who are separated from employment.,Tariffs,,Regulation Special Interest,,Government Management,0.097,-0.987,-0.106,-0.054,0.49,0.747,-50.162776,0.602
