date_generated,id,congress,chamber,rollnumber,date,keyvote,yea,nay,description,Issue1,Issue2,Peltzman1,Peltzman2,Clausen1,slope,intercept,mid.dim1,mid.dim2,spread.dim1,spread.dim2,pre,classified,log_likelihood,vote_result
2016-10-18 10:30:10,RH0560128,56,House,128,1901-02-16,,202,0,"TO GO INTO THE COMMITTEE OF THE WHOLE FOR PURPOSE OF TAKING UP FOR CONSIDERATION BILL H.R. 14018, MAKING APPROPRIATION FOR SUNDRY CIVIL EXPENSES OF THE GOVERNMENT FOR FISCAL YEAR JUNE 30, 1902, AND FOR OTHER PURPOSES.  (P. 2536-1)",,,Budget Special Interest,,Government Management,,,0.0,0.0,0.0,0.0,-8500000.0,0.579,0.0,
2016-10-18 10:30:10,RH0560129,56,House,129,1901-02-16,,190,43,"TO SUSPEND THE RULES AND PASS AS AMENDED BILL H.R. 9829, PROVIDING FOR THE CELEBRATION OF THE 100TH ANNIVERSARY OF THE PURCHASE OF THE LOUISIANA TERRITORY BY THE U.S. BY HOLDING AN INTERNATIONAL EXHIBITION OF ARTS, INDUSTRIES, MANUFACTURES AND THE PRODUCS OF THE SOIL, MINE, FOREST, AND SEA, IN THE CITY OF ST",Science and Technology,,Budget Special Interest,,Government Management,21.557364857530636,11.93002587421987,-0.567,-0.293,-0.123,0.033,0.116,0.837,-96.907039,
2016-10-18 10:30:10,RH0560130,56,House,130,1901-02-18,,54,145,"TO SUSPEND THE RULES AND BRING UP FOR FINAL PASSAGE THE BILL H.R. 8917, LIMITING THE MEANING OF THE WORD ""CONSPIRACY"" AND ALSO THE USE OF RESTRAINING ORDERS AND INJUNCTIONS AS APPLIED TO DISPUTES BETWEEN EMPLOYERS AND EMPLOYEES IN D.C. AND TERRITORIES ORENGAGED IN COMMERCE BETWEEN THE SEVERAL STATES, IN D.C",Union Regulation/Davis-Bacon/Situs Picketing,,Regulation Special Interest,Domestic Social Policy,Government Management,27.15117972232348,-11.628704921154448,0.428,-0.008,-0.169,0.036,0.296,0.809,-75.903587,
2016-10-18 10:30:10,RH0560131,56,House,131,1901-02-23,,131,82,"TO AGREE TO THE SENATE AMENDMENTS TO BILL 13801 (31 STAT. 922, 3/2/1901), MAKING APPROPRIATIONS FOR THE DEPARTMENT OF AGRICULTURE FOR THE FISCAL YEAR ENDING JUNE 30, 1902, WHICH AMENDMENTS INCREASE THE APPROPRIATIONS FOR SEEDS BY $1,000,000.  (P. 2915-1)",Agriculture,,Budget Special Interest,,Agriculture,2.4321129582855074,-0.5306269897588956,-0.186,-0.983,0.082,-0.195,0.305,0.732,-110.3396,
2016-10-18 10:30:10,RH0560132,56,House,132,1901-02-25,,160,88,"TO CONCUR IN THE SENATE AMENDMENT TO BILL H.R. 13705, MAKING APPROPRIATIONS FOR THE NAVAL SERVICE FOR THE FISCAL YEAR ENDING JUNE 30, 1902.  (P. 2991-1, 1989-1)",,,Defense Policy Budget,,Foreign and Defense Policy,0.6547565948444648,-0.3107177265407868,-0.648,-0.735,0.06,-0.53,0.25,0.734,-125.000421,
2016-10-18 10:30:10,RH0560133,56,House,133,1901-02-25,,143,84,"TO AGREE TO THE CONFERENCE REPORT ON BILL S. 2799, CARRYING INTO EFFECT THE STIPULATIONS OF ARTICLE VII OF THE TREATY BETWEEN THE U.S. AND SPAIN CONCLUDED DEC. 10, 1898.",Treaties,,Foreign Policy Resolutions,,Foreign and Defense Policy,3.210870418845809,0.6011740837691618,-0.2,-0.041,-0.156,0.281,0.69,0.885,-63.691473,
2016-10-18 10:30:10,RH0560134,56,House,134,1901-02-26,,119,130,TO CONSIDER THE H. RES. WHICH SUGGESTS THAT THE SPEAKER HAS NO RIGHT TO WITHHOLD FROM THE RECORD THE SPEECH OF A MEMBER MADE UNDER A GENERAL LEAVE TO PRINT.  (P. 3093-1),,,Internal Organization,,Miscellaneous Policy,77.18588197769506,-5.73594114832713,0.075,0.053,0.734,-0.055,1.0,1.0,-0.147914,
2016-10-18 10:30:10,RH0560135,56,House,135,1901-02-26,,115,128,"TO TAKE UP FOR CONSIDERATION THE H. RES. STATING THAT: ""WHEREAS THE SPEECH OF MR. LENTZ, ON THE GENERAL DEFICIENCY BILL, MADE FEB. 20, 1901, HAS BEEN WITHHELD FROM PUBLICATION IN CONGRESSIONAL RECORD, AFTER SAME WAS DELIVERED TO PUBLIC PRINTER, RESOLVED,THAT SUCH ACTION IS HEREBY CONDEMNED BY THE HOUSE, AND IT IS HEREBY ORDERED THAT SAID SPEECH BE DELIVERED FORTHWITH TO THE PUBLIC PRINTER FOR PUBLICATION IN THE RECORD",,,Internal Organization,,Miscellaneous Policy,80.77877612061684,2.1261330746535703,-0.022,0.349,0.419,-0.03,0.991,0.996,-6.274953,
2016-10-18 10:30:10,RH0560136,56,House,136,1901-02-26,,115,101,TO ADJOURN.  (P. 3095-1),,,Internal Organization,,Miscellaneous Policy,-15.92737388535753,-0.1472737388535753,-0.01,0.012,-0.716,-0.26,1.0,1.0,-0.641365,
2016-10-18 10:30:10,RH0560137,56,House,137,1901-02-27,,118,132,"TO RECEDE FROM THE DISAGREEMENT TO THE SENATE AMENDMENT AND CONCUR IN THE SAME RELATING TO BILL H.R. 13705, THE 1902 NAVAL APPROPRIATION BILL, WHICH AMENDMENT AUTHORIZES THE SECRETARY OF THE NAVY TO CONTRACT TO BUILD THREE SUBMARINES OF THE ""HOLLAND TYPE SIMILAR TO DESIGN OF THE SIX SUBMARINES CONTRACTED FOR ON AUG",,,Defense Policy Budget,,Foreign and Defense Policy,-2.031174476268493,0.1531220377496274,0.453,-0.767,0.059,0.168,0.314,0.676,-152.458634,
2016-10-18 10:30:10,RH0560138,56,House,138,1901-02-28,,157,92,"TO RESOLVE INTO COMMITTEE OF THE WHOLE TO TAKE UP FOR FURTHER CONSIDERATION BILL H.R. 5499, PROMOTING THE EFFICIENCY OF THE REVENUE CUTTER SERVICE.  (P. 3235-1)",,,Budget Special Interest,,Government Management,0.5131805285731397,0.22957106315754156,-0.233,0.11,-0.037,0.417,0.261,0.727,-129.627114,
2016-10-18 10:30:10,RH0560139,56,House,139,1901-02-28,,167,79,TO ORDER THE PREVIOUS QUESTION ON THE MOTION THAT GENERAL DEBATE REGARDING BILL H.R. 5499 BE CLOSED IN 5 MINUTES. (P. 3260-1),,,Budget Special Interest,,Government Management,1.2804401951711326,0.4452200975855663,-0.5,-0.195,-0.118,0.533,0.443,0.821,-100.733078,
2016-10-18 10:30:10,RH0560140,56,House,140,1901-03-01,,122,134,TO GO INTO COMMITTEE OF THE WHOLE FOR CONSIDERATION OF H.R. 5499.  (P. 3324-1),,,Budget Special Interest,,Government Management,0.3186927507559283,0.06761510745830482,-0.937,-0.231,-0.054,0.98,0.369,0.699,-145.317086,
2016-10-18 10:30:10,RH0560141,56,House,141,1901-03-01,,91,164,"TO RECEDE AND CONCUR IN THE SENATE AMENDMENT TO H.R. 9829 (31 STAT. 1440, 3/3/1901), PROVIDING FOR THE CELEBRATION OF THE 100TH ANNIVERSARY OF THE PURCHASE OF THE LOUISIANA TERRITORY BY THE U.S., BY HOLDING AN INTERNATIONAL EXHIBITION OF ARTS, INDUSTRIES MANUFACTURES AND THE PRODUCTS OF THE SOIL, MINE, FOREST AND SEA IN THE CITY OF ST",Public Works,,Budget Special Interest,,Government Management,-0.9825562285568158,-0.43594130628147654,-0.29,-0.151,0.044,0.259,0.253,0.733,-150.004869,
2016-10-18 10:30:10,RH0560142,56,House,142,1901-03-01,,139,120,"TO ORDER THE PREVIOUS QUESTION ON H. RES. 441, THAT IMMEDIATELY AFTER THE ADOPTION OF THIS RESOLUTION IT SHALL BE IN ORDER TO TAKE FROM SPEAKERS TABLE BILL H.R. 14017, MAKING APPROPRIATIONS FOR THE SUPPORT OF THE ARMY ENDING THE FISCAL YEAR JUNE 30, 1902 AND WITHOUT AN INTERVENING MOTION TO MOVE TO CONCUR IN THIS SENATE AMENDMENTS TO BILL H.R",,,Defense Policy Budget,,Foreign and Defense Policy,21.296927123897373,-0.04367234411507634,0.009,0.148,-0.394,0.107,0.992,0.996,-6.84624,
2016-10-18 10:30:10,RH0560143,56,House,143,1901-03-01,,145,127,"TO ADOPT H. RES. 441, PROVIDING THAT IMMEDIATELY UPON ITS ADOPTION IT SHALL BE IN ORDER TO TAKE FROM THE SPEAKERS TABLE, H.R. 14017, AND WITHOUT AN INTERVENING MOTION TO MOVE TO CONCUR IN THE SENATE AMENDMENTS TO SAID BILL. (P. 3336-1)",,,Defense Policy Budget,,Foreign and Defense Policy,-25.724441937744967,2.4776175195877315,0.103,-0.172,-0.298,-0.067,0.976,0.989,-12.853757,
2016-10-18 10:30:10,RH0560144,56,House,144,1901-03-01,,147,116,"TO TABLE AN APPEAL FROM THE DECISION OF THE CHAIR IN ORDER TO SUSTAIN THE DECISION OF CHAIR; THAT THERE IS NOWHERE IN THE RULES OR DECISION ANY NOTATION, SAYING WHEN A BILL SHALL OR MUST BE REFERRED TO A COMMITTEE, IN ANSWER TO A POINT OF ORDER THAT BILLH.R",,,Defense Policy Budget,,Foreign and Defense Policy,-21.350405205291754,-0.5262048624635011,-0.012,-0.27,-0.347,-0.094,0.991,0.996,-7.912645,
2016-10-18 10:30:10,RH0560145,56,House,145,1901-03-01,,161,136,TO CONCUR IN THE SENATE AMENDMENTS TO BILL H.R. 14017 (P. 3338-2),,,Defense Policy Budget,,Foreign and Defense Policy,-38.602723116973465,4.952751282089577,0.129,-0.027,-0.287,-0.043,0.963,0.983,-19.194113,
2016-10-18 10:30:10,RH0560146,56,House,146,1901-03-02,,93,9,"TO ORDER A SECOND TO THE MOTION FOR THE SUSPENSION OF THE RULES AND THE PASSAGE OF H.R. 12251, PREVENTING THE SALE OF FIREARMS, OPIUM, AND INTOXICATING LIQUORS IN CERTAIN ISLANDS OF THE PACIFIC.  (P. 3445-2)",Temperance and Liquor,,Foreign Policy Resolutions,Regulation Special Interest,Foreign and Defense Policy,-1.4053809777191162,-0.7818107619554383,-0.002,-0.779,-0.13,-0.535,0.0,0.912,-17.919397,
2016-10-18 10:30:10,RH0560147,56,House,147,1901-03-02,,117,80,"TO SUSPEND THE RULES AND PASS BILL H.R. 12251, MAKING IT PUNISHABLE BY IMPRISONMENT UP TO 3 MONTHS OR A FINE OF $50 OR BOTH TO SUPPLY ARMS, AMMUNITIONS, EXPLOSIVES, INTOXICATING LIQUORS OR OPIUM TO NATIONS OF ANY OF THE PACIFIC ISLANDS EXCEPT FOR LAWFUL EDICAL PURPOSES",Temperance and Liquor,,Foreign Policy Resolutions,Regulation Special Interest,Foreign and Defense Policy,-20.242891390608037,-2.8817050344193813,-0.147,0.094,-0.182,-0.052,0.787,0.914,-44.412618,
2016-10-18 10:30:10,RH0560148,56,House,148,1901-03-02,,137,86,TO RECESS UNTIL 12 O'CLOCK MIDNIGHT.  (P. 3588-2),,,Internal Organization,,Miscellaneous Policy,-6.802400191324454,-0.8707543963648354,0.019,-1.0,-0.207,-0.176,0.767,0.91,-51.788208,
2016-10-18 10:30:10,RH0560149,56,House,149,1901-03-02,,83,140,"TO ADOPT H.R. 438, AUTHORIZING THE COMMITTEE ON INSULAR AFFAIRS TO VISIT PUERTO RICO AND THE PHILIPPINES. (P. 3594-2)",,,Internal Organization,Budget Special Interest,Government Management,-17.351049763378317,-2.3866154739716148,-0.11,-0.478,0.117,0.039,0.602,0.852,-89.214703,
2016-10-18 10:30:10,RS0560001,56,Senate,1,1899-12-14,,44,20,"TO TABLE THE RESOLUTION DIRECTING THE SECRETARY OF THE NAVY TO INFORM THE SENATE WHETHER THE FLAG OF THE PHILIPPINE REPUBLIC WAS CARRIED BY VESSELS IN THE BAY OF MANILA, AND IF IT WAS EVER SALUTED BY ADMIRAL DEWEY OR ANY VESSELS OF HIS FLEET AT ANY TIME INCE MAY 1, 1898.",,,Defense Policy Resolutions,,Foreign and Defense Policy,6.6609835233942984,0.8137462306724799,0.014,0.907,-0.205,0.178,0.8,0.938,-10.91183,
2016-10-18 10:30:10,RS0560002,56,Senate,2,1900-01-04,,48,5,"TO AMEND S. 764, FIXING THE TIMES WHEN, REGULATING THE MAN- NER IN WHICH, AND DECLARING THE CHARACTER OF, THE ACCOUNTS BETWEEN THE UNITED STATES AND THE SEVERAL PUBLIC-LAND STATES RELATIVE TO THE NET PROCEEDS OF THE SALES AND OTHER DISPOS- ITION OF THE PBLIC-LANDS, AND CERTIFIED TO THE TREASURY DEPARTMENT FOR PAYMENT; WHICH AMENDMENT EXCLUDES ALL FORMER AND EXISTING INDIAN MILITARY, OR OTHER RESERVATIONS, IN ORDER TO SAVE THE GOVERNMENT FROM PAYING TO ANY STATE WHERE SAID RESERVATIONS ARE LOCATED, 5% OF ...",Public Lands,,Budget Special Interest,Indian Affairs,Government Management,-0.9878699865281085,0.7409272199191687,0.006,0.735,0.117,0.685,0.2,0.925,-11.773191,
2016-10-18 10:30:10,RS0560003,56,Senate,3,1900-01-16,,42,24,"TO TABLE FOR THE PURPOSE OF DEFEATING AN AMENDMENT TO A SENATE RESOLUTION REQUESTING THE PRESIDENT TO COMMUNICATE TO THE SENATE ALL COMMUNICATIONS RECEIVED BY HIM, OR BY ANY DEPARTMENT, OF PEOPLE IN ARMS AGAINST THE UNITED STATES IN THE PHILIPPINES, IF T DO SO IS, IN HIS JUDGEMENT, NOT IN- COMPATIBLE WITH THE PUBLIC INTEREST, WHICH AMENDMENT PRO- POSES TO REQUEST THE PRESIDENT TO FURNISH THE SENATE WITH ALL INSTRUCTIONS GIVEN TO THE COMMISSIONER WHO NEGOTIATED THE TREATY OF PEACE WITH SPAIN, ON THE GROUN...",Treaties,,Foreign Policy Resolutions,,Foreign and Defense Policy,7.682144170045361,0.6948535307285939,0.031,0.933,-0.174,0.131,0.667,0.879,-17.841506,
2016-10-18 10:30:10,RS0560004,56,Senate,4,1900-01-23,,10,20,"TO RECONSIDER THE RESOLUTION, RATIFIED 3/5/1900, (31 STAT. L. 1875) ADVISING AND CONSENTING TO THE CONVENTION BETWEEN THE UNITED STATES, GREAT BRITAIN AND GERMANY, TO ADJUST AMICABLY THE QUESTIONS BETWEEN THE THREE GOVERNMENTS IN RE- SPECT TO THE SAMOAN ROUP OF INLANDS",Treaties,,Foreign Policy Resolutions,,Foreign and Defense Policy,13.488919169117572,-1.563181381124991,0.119,0.042,0.709,-0.304,1.0,1.0,-0.287921,
2016-10-18 10:30:10,RS0560005,56,Senate,5,1900-01-24,,31,32,"THAT THE SENATE RECEDE FROM ITS DISAGREEMENT TO THE HOUSE AMENDMENT BILL S. 2179 (31 STAT. 3, 2/1/1900), PROVIDING FOR TAKING OF THE TWELFTH AND SUBSEQUENT CENSUSES; IN ORDER TO AGREE TO AMENDMENT AUTHORIZING THE DIRECTOR OF THE CENSUS TO COLLECT STATISTCS RELATING TO THE DEAF, DUMB, AND BLIND",,,Budget Special Interest,,Government Management,-4.3650439656297655,0.7545309034761818,0.248,-0.328,0.12,0.159,0.387,0.698,-32.399636,
2016-10-18 10:30:10,RS0560006,56,Senate,6,1900-01-24,,16,36,"TO RECEDE FROM THE DISAGREEMENT TO HOUSE AMENDMENT TO BILL S. 2179 (31 STAT. 3, 2/1/1900), PROVIDING FOR THE TAKING OF THE TWELFTH AND SUBSEQUENT CENSUSES, IN ORDER TO AGREE TO AUTHORIZING AND DIRECTING THE DIRECTOR OF THE CENSUS TO COL- LECT STATISTICS N MINES, MINING AND MINERALS, AT THE SAME TIME THEY ARE COLLECTED ON POPULATIONS, AGRICULTURE, AND MANUFACTURES, SO AS TO SAVE TIME AND EXPENSE.",,,Budget Special Interest,,Government Management,1.829532458043292,1.0752274463752742,-0.861,-0.5,0.093,-0.294,-0.125,0.654,-30.455404,
2016-10-18 10:30:10,RS0560007,56,Senate,7,1900-01-29,,21,38,"TO RATIFY THE CONVENTION BETWEEN THE UNITED STATES, GERMANY AND GREAT BRITAIN TO ADJUST AMICABLY THE QUESTIONS BETWEEN THE THREE GOVERNMENTS IN RESPECT TO THE SAMOAN GROUP OF ISLANDS, SIGNED AT WASHINGTON, D. C., DEC. 2, 1899.",Treaties,,Foreign Policy Resolutions,,Foreign and Defense Policy,48.75966299245666,0.22179831496228333,-0.005,-0.022,1.214,-0.144,0.905,0.966,-3.847746,
2016-10-18 10:30:10,RS0560008,56,Senate,8,1900-01-30,,43,23,"TO REFER TO THE COMMITTEE ON FOREIGN RELATIONS, THE RESOLU- TION REQUESTING THE PRESIDENT TO INFORM THE SENATE WHETHER THE SAMOAN PEOPLE WERE CONSULTED RELATIVE TO THE TREATY BET- WEEN THE UNITED STATES AND GERMANY REGARDING SAMOA.  (P.1295 -1)",Human Rights,Treaties,Foreign Policy Resolutions,,Foreign and Defense Policy,6.3035648953097265,0.1621969838986732,0.085,0.698,-0.194,0.178,0.826,0.939,-13.025966,
2016-10-18 10:30:10,RS0560009,56,Senate,9,1900-02-14,,27,50,"TO AMEND H. R. 1 (31 STAT. 45, 3/14/1900), A BILL DEFINING AND FIXING THE STANDARD OF VALUE TO MAINTAIN THE PARITY OF ALL FORMS OF MONEY ISSUED OR CARRIED BY THE UNITED STATES, BY GIVING THE PRESIDENT AUTHORITY TO APPOINT COMMISSIONS TO ANY INTERNATIONALCONFERENCE CALLED BY THE UNITED STATES, OR ANY OTHER COUNTRY, TO SECURE INTERNATIONAL AGREEMENT ON VALUE BETWEEN GOLD AND SILVER AS MONEY BY MEANS OF A COMMON RATIO BETWEEN THEM",Banking and Finance,U.S. Currency,Foreign Policy Resolutions,,Foreign and Defense Policy,2.723648211762325,-0.1697356364931677,0.399,0.917,0.251,-0.533,0.741,0.909,-14.371422,
2016-10-18 10:30:10,RS0560010,56,Senate,10,1900-02-15,,30,47,"TO AGREE TO A SUBSTITUTE FOR H. R. 1, WHICH STATES THAT THE PEOPLE OF THE UNITED STATES FAVORABLE TO BIMETALISM AND DESIROUS OF AN INTERNATIONAL AGREEMENT ADMITTING OF THE USE OF BOTH GOLD AND SILVER AT SUCH AN ESTABLISHED RATIO THAT WILL MAINTAIN PARITYBETWEEN GOLD AND SILVER COINS, AND THAT THE GOVERNMENT USE ITS EFFORTS TO SECURE THESE ENDS",Banking and Finance,U.S. Currency,Foreign Policy Resolutions,,Foreign and Defense Policy,2.5521649916503555,-0.28415836265375,0.281,0.433,0.278,-0.63,0.767,0.909,-12.231213,
2016-10-18 10:30:10,RS0560011,56,Senate,11,1900-02-15,,47,32,"TO AGREE TO THE AMENDMENT TO BILL H. R. 1, WHICH DECLARES THIS ACT IS NOT INTENDED TO OBSTRUCT INTERNATIONAL BIMETAL- LISM SECURED BY CONCURRENT ACTION OF THE LEADING COMMERCIAL NATIONS, AT A RATIO INSURING PERMANENCE OF RELATIVE VALUE BETWEEN GOLD AND SLVER",Banking and Finance,U.S. Currency,Foreign Policy Resolutions,,Foreign and Defense Policy,6.407687727967945,-1.0858992260265827,0.169,-0.003,-0.688,0.621,0.937,0.975,-3.846843,
2016-10-18 10:30:10,RS0560012,56,Senate,12,1900-02-15,,47,29,"TO TABLE THE AMENDMENT TO H. R. 1, WHICH AMENDMENT PROPOSES TO MAKE THE NEW ISSUE OF TWO PER CENT UNITED STATES BONDS PAYABLE IN BOTH SILVER AND GOLD COIN OF THE VALUE OF THE ACT OF JULY 14, 1870.  (P.1829-1)",Banking and Finance,U.S. Currency,Budget Special Interest,,Government Management,2.587064200830509,-0.23096999367157645,0.327,0.615,-0.365,0.816,0.793,0.921,-9.102416,
2016-10-18 10:30:10,RS0560013,56,Senate,13,1900-02-15,,28,46,"TO AMEND H. R. 1, BY PROVIDING THAT GOLD COINS AND SILVER DOLLARS COINED BY THE UNITED STATES SHALL BE LEGAL TENDER IN ALL PAYMENTS AT THEIR NOMINAL VALUE WHEN NOT BELOW THE WEIGHT AND LIMIT OF TOLERANCE, AND WHEN REDUCED IN WEIGHT BELOW STANDARD, SHALL E LEGAL TENDER AT VALUATION IN PRO- PORTION TO THEIR ACTUAL WEIGHT",Banking and Finance,U.S. Currency,Budget Special Interest,,Government Management,4.673422629719457,0.2677227705784616,-0.255,-0.924,0.181,-0.224,0.679,0.878,-20.123766,
2016-10-18 10:30:10,RS0560014,56,Senate,14,1900-02-15,,28,46,"TO AMEND H. R. 1, BY PROVIDING THAT NOTHING CONTAINED IN THIS ACT SHALL BE HELD OR CONSTRUED TO AFFECT THE PRESENT LEGAL TENDER QUALITY OF SILVER DOLLARS COINED BY THE UNITED STATES.  (P.1836-1)",Banking and Finance,U.S. Currency,Budget Special Interest,,Government Management,4.566065727204821,0.2596110233460487,-0.259,-0.923,0.18,-0.228,0.679,0.878,-20.036188,
2016-10-18 10:30:10,RS0560015,56,Senate,15,1900-02-15,,22,49,"TO AMEND H. R. 1, BY REPEALING ALL OTHER ACTS, OR PARTS OF ACTS, WHICH IMPOSE ANY TAX UPON THE CIRCULATION OF STATE BANKS OR STATE BANKING ASSOCIATIONS.  (P.1833-1)",Banking and Finance,U.S. Currency,Budget Special Interest,,Government Management,-14.270022235301793,-1.990164624942773,-0.208,0.978,0.264,0.107,0.864,0.958,-11.019366,
2016-10-18 10:30:10,RS0560016,56,Senate,16,1900-02-15,,28,49,"TO AMEND H. R. 1, BY DECLARING IT IS THE FIXED POLICY OF THE UNITED STATES TO PAY AND CLEAR OFF THE NATIONAL DEBT AS RA- PIDLY AS JUST AND EQUAL TAXATION, AND THE ACCUMULATION OF OTHER GOVERNMENT REVENUE WILL PERMIT, AND THAT SPECIE BASED ON GOLD AND SILER IS THE ONLY TRUE BASIS ON WHICH TO ISSUE BANK BILLS CIRCULATING AS MONEY",Banking and Finance,U.S. Currency,Budget Special Interest,,Government Management,4.642166822658234,0.27567904024582457,-0.258,-0.922,0.183,-0.228,0.679,0.883,-20.154694,
2016-10-18 10:30:10,RS0560017,56,Senate,17,1900-02-15,,29,48,"TO AMEND H. R. 1, BY AUTHORIZING SILVER COINAGE AND THE COINING OF A SILVER DOLLAR OF 412 1/2 GRAINS TROY, OF STANDARD SILVER 9/10 FINE.  (P.1833-2)",Banking and Finance,U.S. Currency,Budget Special Interest,,Government Management,3.633827307900503,0.14637312813584236,-0.283,-0.882,0.191,-0.304,0.724,0.896,-19.061294,
2016-10-18 10:30:10,RS0560018,56,Senate,18,1900-02-15,,49,33,TO PASS H. R. 1.,Banking and Finance,U.S. Currency,Foreign Policy Resolutions,,Foreign and Defense Policy,2.569487714016714,-0.2903311704985295,0.271,0.406,-0.275,0.619,0.788,0.915,-12.182058,
2016-10-18 10:30:10,RS0560019,56,Senate,19,1900-02-23,,38,32,"TO PROCEED TO THE CONSIDERATION OF S. RES. 107, BARRING MATTHEW S. QUAY FROM THE SENATE.",,,Internal Organization,,Miscellaneous Policy,0.6384585410766914,-0.6504585410766914,1.0,-0.012,0.017,-0.154,0.187,0.629,-46.118084,
2016-10-18 10:30:10,RS0560020,56,Senate,20,1900-02-26,,47,1,"TO AMEND S. 222 (31 STAT. L. 141, 4/13/1900), PROVIDING A GOVERNMENT FOR THE TERRITORY OF HAWAII, BY ELIMINATING A RESTRICTION ON VOTERS IN THE TERRITORY WHICH WOULD REQUIRE POSSESSION IN THEIR OWN RIGHT OF REAL PROPERTY IN THE TERRITORY OF NOT LESS THANONE THOUSAND DOLLARS, OR AN IN- COME OF $600 FOR THE YEAR PROCEDING REGISTRATION",Voting Rights,,Government Organization,,Government Management,,,0.0,0.0,0.0,0.0,-16.0,0.646,0.0,
2016-10-18 10:30:10,RS0560021,56,Senate,21,1900-03-06,,44,26,TO AGREE TO THE REPORT OF THE COMMITTEE OF CONFERENCE ON H. R. 1.  (P.2589-1),Banking and Finance,U.S. Currency,Foreign Policy Resolutions,,Foreign and Defense Policy,2.90730602095822,-0.2858995654491373,0.26,0.47,-0.282,0.561,0.846,0.943,-8.660641,
2016-10-18 10:30:10,RS0560022,56,Senate,22,1900-03-16,,42,19,"TO TABLE AN AMENDMENT TO H. R. 9080 (31 STAT. L. 51, APP. 3/24/1900), APPROPRIATING FOR THE BENEFIT AND GOVERNMENT OF PUERTO RICO, REVENUES COLLECTED ON IMPORTATIONS THEREFROM SINCE ITS EVACUATION BY SPAIN, AND REVENUES HEREAFTER COL- LECTED ON SUCH IMPOTATIONS UNDER EXISTING LAWS, SO AS TO DISPOSE ADVERSELY OF DECLARATION THAT CONSTITUTION OF THE UNITED STATES WAS, BY FORCE OF THE TREATY CONCLUDED BETWEEN THE UNITED STATES AND SPAIN, APRIL 11, 1899, EXTENDED OVER PUERTO RICO AND ITS INHABITANTS",Tariffs,,Foreign Policy Budget,,Foreign and Defense Policy,3.215271282906728,0.1388905515758776,0.256,0.962,-0.507,0.912,0.895,0.967,-2.606675,
2016-10-18 10:30:10,RS0560023,56,Senate,23,1900-03-21,,17,30,"TO AMEND THE TREATY (RATIFIED 7/16/1900) (31 STAT. L. 1939) BETWEEN THE UNITED STATES AND GREAT BRITAIN RELATING TO THE TENURE AND DISPOSITION OF REAL AND PERSONAL PROPERTY, SIGNED MARCH 2, 1899, BY ELIMINATING FROM ARTICLE FOUR THE PROVI- SION THAT THE UEEN CAN GIVE NOTICE OF ADHESION ON BEHALF OF ANY BRITISH PROTECTORATE OR SPHERE OF INFLUENCE OR ON BEHALF OF THE ISLAND OF CYPRESS IN VIRTUE OF THE CONVENTION OF JUNE 4, 1878, BETWEEN GREAT BRITAIN AND TURKEY.",Treaties,,Foreign Policy Resolutions,,Foreign and Defense Policy,6.398968707061508,-0.2387205904437361,0.077,0.254,0.676,-0.611,1.0,1.0,-0.21843,
2016-10-18 10:30:10,RS0560024,56,Senate,24,1900-03-21,,14,29,TO AMEND THE TREATY BETWEEN THE UNITED STATES AND GREAT BRITAIN ELIMINATING THEREFROM THE FIFTH ARTICLE.,Treaties,,Foreign Policy Resolutions,,Foreign and Defense Policy,68.18962557007677,1.52401614609284,-0.037,-0.999,1.179,-0.1,0.857,0.953,-3.089263,
2016-10-18 10:30:10,RS0560025,56,Senate,25,1900-03-22,,37,13,TO RATIFY THE TREATY BETWEEN THE UNITED STATES AND GREAT BRITAIN.,Treaties,,Foreign Policy Resolutions,,Foreign and Defense Policy,3.061045126695288,0.8396337292398283,0.006,0.858,-0.199,0.376,0.692,0.92,-8.546589,
2016-10-18 10:30:10,RS0560026,56,Senate,26,1900-03-23,,40,18,"TO AGREE TO THE REPORT OF THE COMMITTEE OF CONFERENCE ON BILL H. R. 9080 (31 STAT. 51, 3/24/1900), APPROPRIATING FOR THE BENEFIT AND GOVERNMENT OF PURETO RICO, REVENUES COLLEC- TED ON IMPORTATIONS THEREFROM SINCE ITS EVACUATION BY SPAIN, AND REVENUES THEEAFTER COLLECTED ON SUCH IMPORTATIONS UNDER EXISTING LAWS",Tariffs,,Foreign Policy Budget,,Foreign and Defense Policy,-38.41639152503333,-0.4688294813504667,-0.014,0.069,-0.724,-0.109,1.0,1.0,-0.02091,
2016-10-18 10:30:10,RS0560027,56,Senate,27,1900-03-27,,11,30,"TO AMEND BILL H. R. 8245 (31 STAT. 77, 4/12/1900), TEMPOR- ARILY PROVIDING REVENUES FOR THE RELIEF OF THE ISLAND OF PUERTO RICO; BY PROPOSING THAT ANY CITIZEN DEPOSITING FOR COINAGE AT ANY UNITED STATES MINT, SILVER BULLION OF NOT LESS THAN $100, ESTIMATD AT 371 1/4 GRAIN OF PURE SILVER PER DOLLAR AND AT SAME TIME AS PART OF SAME, DEPOSITS OF GOLD BULLION OF EQUAL OR GREATER AMOUNT AT RATE OF 23 AND 22 1/160 GRAINS OF PURE GOLD PER DOLLAR, SHALL BE ENTITLED TO HAVE SAME COINED IN UNITED STATES COINS, IN ...",Banking and Finance,U.S. Currency,Foreign Policy Budget,,Foreign and Defense Policy,13.807892454340102,0.3019418907079696,-0.094,-0.996,0.265,-0.111,0.818,0.951,-4.678241,
2016-10-18 10:30:10,RS0560028,56,Senate,28,1900-03-28,,22,29,"TO AMEND S. 3419 (31 STAT. L. 321, 6/6/1900), BY MAKING IT THE DUTY OF THE SECRETARY OF THE INTERIOR TO DECLARE AND PUBLISH PROPER RULES AND REGULATIONS WHEREBY THE AURIFEROUS DEPOSITS IN ALASKA WHICH LIE BELOW THE LOW-WATER MARK OF THE OCEAN AND ITS TRIUTARIES SHALL, IF FEASIBLE, BE OPEN TO EX- PLORATION BY ANY UNITED STATES CITIZEN AND GIVING THE SECRE- TARY OF WAR POWER TO POLICE THE SOIL AND FULFILL THE OBLIGA- TIONS HE OWES UNDER LAW TO DREDGE AND EXCAVATE CANELS",Public Lands,,Budget Special Interest,Regulation Special Interest,Government Management,4.373028802152259,-2.856573667293828,0.787,0.585,-0.031,0.041,0.0,0.569,-34.667351,
2016-10-18 10:30:10,RS0560029,56,Senate,29,1900-03-28,,16,37,"TO AMEND H. R. 8245, BY PROPOSING THAT ANY CITIZEN DEPOSTING FOR COINAGE AT ANY UNITED STATES MINT, SILVER BULLION OF NOT LESS THAN $100, ESTIMATED AT 371 1/4 GRAINS OF PURE SILVER PER DOLLAR AND AT THE SAME TIME, AS PART OF SAME, DEPOSITS GOLD BULLION O EQUAL OR GREATER AMOUNT AT RATE OF 23 AND 22 1/160 GRAINS OF PURE GOLD PER DOLLAR, SHALL BE ENTITLED TO HAVE SOME COINED IN UNITED STATES COINS IN LAWFUL DEMON- INATIONS",Banking and Finance,U.S. Currency,Foreign Policy Budget,,Foreign and Defense Policy,2.6207314746769335,0.2949048319860329,-0.198,-0.224,0.203,-0.448,0.75,0.925,-8.07955,
2016-10-18 10:30:10,RS0560030,56,Senate,30,1900-03-29,,15,34,"TO AMEND BILL H. R. 8245, BY ELIMINATING TAX LEVIED ON COFFEE IN THE BEAN OR GROUND, IMPORTED INTO PUERTO RICO. (P.3469-1)",Tax rates,,Foreign Policy Budget,,Foreign and Defense Policy,-109.7377796438225,-11.950417981176654,-0.109,0.011,0.721,0.038,1.0,1.0,-1.183451,
2016-10-18 10:30:10,RS0560031,56,Senate,31,1900-03-29,,18,37,"TO AMEND H. R. 8245, BY ELIMINATING THE SECTION PROPOSING TO LEVY A DUTY ON ALL MERCHANDISE IMPORTED AND EXPORTED BET- WEEN THE UNITED STATES AND PUERTO RICO, THE DUTY TO BE 15% OF LIKE MERCHANDISE IMPORTED FROM FOREIGN COUNTRIES. (P.3474-1)",Tariffs,,Foreign Policy Budget,Regulation Special Interest,Foreign and Defense Policy,-13.869609357781377,0.8893962480715142,0.112,-0.664,0.247,0.103,0.833,0.945,-7.874634,
2016-10-18 10:30:10,RS0560032,56,Senate,32,1900-03-30,,38,18,"TO CONSENT TO THE APPOINTMENT OF WILLIAM D. BYNUM AS GENERAL APPRAISER OF MERCHANDISE.  (P.443, 232-412)",,,Government Organization,,Government Management,13.495260927072026,1.9538886595922915,-0.129,0.213,-0.714,0.306,1.0,1.0,-1.224434,
