id,congress,chamber,rollnumber,date,keyvote,yea,nay,description,Issue1,Issue2,Peltzman1,Peltzman2,Clausen1,slope,intercept,mid.dim1,mid.dim2,spread.dim1,spread.dim2
RH0620001,62,House,1,1911-04-04,,351,17,"TO ELECT A SPEAKER OF THE HOUSE FOR THE 62ND CONGRESS. VOTES FOR C. CLARK DEMOCRAT ARE CODED 1.  VOTES FOR J. R. MANN, REPUBLICAN ARE CODED 2 .  VOTES FOR H. A. COOPER, REPUBLICAN, ARE CODED 5.  VOTES FOR G. W. NORRIS, REPUBLICAN ARE CODED 6.",Election of the Speaker of the House,,Internal Organization,,Miscellaneous Policy,-0.5486236687087239,0.9745761502945343,-0.019,0.985,0.083,0.875
RH0620002,62,House,2,1911-04-05,,206,138,"TO CONSIDER H. RES. 30, PROVIDING FOR THE CONSIDERATION OF H. RES. 11, A RESOLUTION ADOPTING THE RULES OF THE 62ND HOUSE.  H. RES. 30 PROVIDES THAT IT SHALL BE IN ORDER TO OFFER ONE SUBSTITUTE FOR H. RES. 11, THAT 4 HOURS OF DEBATE BE ALLOWED AND DIVIDED EQUALLY BETWEEN PROPONENTS AND OPPONENTS, AND THAT VOTE ON ORIGINAL OR SUBSTITUTE SHALL BE TAKEN  AT END OF ALLOTTED TIME.  (P. 56-1)",,,Internal Organization,,Miscellaneous Policy,-24.416344648087293,3.4572882507322213,0.14,0.039,0.743,0.176
RH0620003,62,House,3,1911-04-05,,200,136,"TO AGREE TO H. RES. 30, RULES FOR CONSIDERATION OF H. RES. 11, WHICH PROVIDES RULES FOR THE HOUSE OF REPRESENTATIVES OF THE 62ND CONGRESS.  (P. 54-2)",,,Internal Organization,,Miscellaneous Policy,-30.384702167793957,4.391012409994536,0.143,0.046,0.746,0.142
RH0620004,62,House,4,1911-04-13,,127,195,"TO AMEND H. J. RES. 39, PROPOSING AN AMENDMENT TO THE CONSTITUTION PROVIDING FOR THE DIRECT ELECTION OF SENATORS, BY STRIKING OUT (1) AUTHORITY IN CONGRESS TO MAKE OR ALTER REGULATIONS AS TO TIME AND MANNER OF HOLDING SENATORIAL ELECTIONS AND (2) THE TIME, MANNER AND PLACE OF HOLDING ELECTIONS FOR SENATORS SHALL BE PRESCRIBED IN ONE STATE BY THE LEGISLATUR THEREOF.  (P. 241-1)",Constitutional Amendments,,Government Organization,,Government Management,-13.405172402859261,0.7384482753372446,0.048,0.095,-0.744,-0.321
RH0620005,62,House,5,1911-04-13,,297,15,"TO ADOPT H. RES. 39, PROVIDING AN AMENDMENT TO THE CONSTITUTION FOR THE DIRECT ELECTION OF U. S. SENATORS, AND ALLOWING THE LEGISLATURE OF ANY STATE TO EMPOWER THE GOVERNOR TO MAKE TEMPORARY APPOINTMENTS FOR VACANCIES, UNTIL FILLED BY ELECTIONS.  (P.203-2)",Constitutional Amendments,,Government Organization,,Government Management,9.083202159836167,-5.276423657024649,0.582,0.01,1.192,-0.759
RH0620006,62,House,6,1911-04-14,,111,196,"TO AMEND BY SUBSTITUTION H. R. 2958 (37 STAT. 25, 8/19/1911) A BILL PROVIDING FOR PUBLICITY OF CONTRIBUTIONS MADE FOR THE PURPOSE OF INFLUENCING ELECTIONS, BY PROVIDING THAT THE TREASURER OF EVERY POLITICAL COMMITTEE SHALL, WITHIN 15 AND 10 DAYS BEFORE AN ELECTION OF REPRESENTATIVES IN TWO OR MORE STATES, FILE IN THE CLERK'S OFFICE AN ITEMIZED SWORN STATE- MENT CONFORMING TO THIS ACT; THAT THE BOOKS AND ACCOUNTS OF SAID COMMITTEES SHALL BE OPEN FOR PUBLIC INSPECTION; AND THAT A SIMILAR STATEMENT SHALL BE FILED WITHIN 30 DAYS AFTER ELECTION, TO BE PRESERVED FOR 15 MONTHS FOR PUBLIC INSPEC- TION.  (P.264-2)","Campaign Contributions, Lobbying/House Ethics Campaign Laws",,Domestic Social Policy,,Government Management,17.728246497364797,-2.4594444592812783,0.083,-0.988,-0.282,0.092
RH0620007,62,House,7,1911-04-14,,173,131,"TO AMEND H. R. 2958, BY PROVIDING THAT CANDIDATES FILE RE- PORTS OF CAMPAIGN CONTRIBUTIONS, AND THAT SUCH REPORTS BE MADE UNDER OATH, AND PENALTIES PRESCRIBED FOR VIOLATION OF THIS ACT.  (P.265-2)","Campaign Contributions, Lobbying/House Ethics Campaign Laws",,Domestic Social Policy,,Government Management,8.87091958623171,2.0433441481434396,-0.222,0.074,-0.227,0.148
RH0620008,62,House,8,1911-04-14,,157,149,TO RECOMMIT H. R. 2958 TO COMMITTEE ON ELECTIONS WITH INSTRUCTIONS TO REPORT IT BACK AFTER STRIKING OUT ALL REFER- ENCE TO THE FILING OF CAMPAIGN CONTRIBUTIONS AND PUNISHMENT OF VIOLATION.  (P.266-2),"Campaign Contributions, Lobbying/House Ethics Campaign Laws",,Domestic Social Policy,,Government Management,7.9383887806306035,1.1649621005017992,-0.098,0.387,0.28,-0.204
RH0620009,62,House,9,1911-04-14,,165,139,"TO CONCUR IN AMENDMENT TO H. R. 2958, WHICH AMENDMENT STRIKES OUT ALL REFERENCE TO THE FILING OF A SWORN STATEMENT ON CAMPAIGN CONTRIBUTIONS RECEIVED AND PENALTIES FOR VIOLA- TIONS THEREOF.  (P.267-2)","Campaign Contributions, Lobbying/House Ethics Campaign Laws",,Domestic Social Policy,,Government Management,20.045720370569647,2.29316640187437,-0.113,0.028,0.305,-0.088
RH0620010,62,House,10,1911-04-14,,307,0,TO PASS H. R. 2958.  (P.268-2),"Campaign Contributions, Lobbying/House Ethics Campaign Laws",,Domestic Social Policy,,Government Management,,,0.0,0.0,0.0,0.0
RH0620011,62,House,11,1911-04-21,,274,94,"TO PASS H. R. 4412 (37 STAT. 4, 7/26/1911), A BILL TO PRO- MOTE RECIPROCAL TRADE RELATIONS WITH CANADA.  (P.559-2)",Tariffs,,Foreign Policy Resolutions,,Foreign and Defense Policy,-1.7114981059114664,0.6759303409359361,-0.18,0.984,0.116,0.392
RH0620012,62,House,12,1911-04-27,,108,186,"TO RECOMMIT H. R. 2983 (37 STAT. 13, 8/8/1911), A BILL PRO- VIDING FOR THE APPORTIONMENT OF REPRESENTATIVES IN CONGRESS UNDER THE 13TH CENSUS, TO THE COMMITTEE ON CENSUS WITH IN- STRUCTIONS TO PROVIDE THAT AFTER THE 14TH CENSUS THE DEPART- MENT OF COMMERCE AND LABOR BE DIRECTED TO ASCERTAIN THE POP- ULATION OF EACH STATE IN ORDER TO OBTAIN RATIO OF APPORTION- MENT OF REPRESENTATIVES OF EACH STATE EVERY 10 YEARS. (P.704-2)",Ratio of Representatives to Population,,Internal Organization,,Miscellaneous Policy,28.77382419093571,-1.5784053192555567,0.038,-0.485,-0.199,0.04
RH0620013,62,House,13,1911-05-08,,227,147,"TO TABLE APPEAL OF THE DECISION OF THE CHAIR MADE DURING CONSIDERATION OF H. R. 4413, A BILL TO PLACE ON THE FREE LIST AGRICULTURAL IMPLEMENTS AND OTHER ARTICLES, WHICH DE- CISION HELD THAT THE PROPOSED AMENDMENT RELATIVE TO THE RECOMMITMENT OF BILL WITH INSTRUCTIONS WAS NOT GERMANE TO THE BILL.  (P.1119-1)",Agriculture,,Regulation Special Interest,,Agriculture,1440.1371303604,-169.9031813825272,0.118,0.033,0.747,-0.003
RH0620014,62,House,14,1911-05-08,,251,124,"TO PASS H. R. 4413, A BILL PLACING ON THE FREE LIST AGRI- CULTURAL IMPLEMENTS AND OTHER ARTICLES.  (P.1121)",Agriculture,,Regulation Special Interest,,Agriculture,4.130283258468253,-0.845232686075095,0.186,-0.077,0.642,-0.899
RH0620015,62,House,15,1911-05-12,,131,85,TO ADJOURN UNTIL TUESDAY.  (P.1193-1),,,Internal Organization,,Miscellaneous Policy,-65.23994711030245,1.9551984133090734,0.03,-0.002,0.282,0.025
RH0620016,62,House,16,1911-05-17,,139,83,"TO ORDER THE PREVIOUS QUESTION ON A MOTION TO REFER TO COMMITTEE ON RULES THE RESOLUTION H. RES. 171, SETTING UP A SELECT COMMITTEE, AS PROVIDED FOR IN H. RES. 148, AND CONSISTING OF FIFTEEN MEMBERS, TO INVESTIGATE VIO- LATION OF THE ANTI-TRUST ACT OF 1890, AND OTHER ACTS.",Interstate Commerce/Anti-trust/Restraint of Commerce,,Internal Organization,,Miscellaneous Policy,-14.686019244166616,0.9406730006966639,0.052,0.177,0.259,0.102
RH0620017,62,House,17,1911-05-17,,76,137,"TO COMMIT H. RES. 171, PROVIDING THAT A SELECT COMMITTEE SHALL INVESTIGATE VIOLATION OF THE ANTI-TRUST ACT OF 1890 AND OTHER ACTS, TO A SELECT COMMITTEE OF 15.  (P.1295-2)",Interstate Commerce/Anti-trust/Restraint of Commerce,,Internal Organization,,Miscellaneous Policy,65.46077865274547,-3.634499711290019,0.051,-0.296,-0.249,0.022
RH0620018,62,House,18,1911-05-23,,65,225,"TO RECOMMIT H. J. RES. 14, A RESOLUTION FOR THE ADMISSION OF ARIZONA AND NEW MEXICO AS STATES, TO THE COMMITTEE ON TERRITORIES WITH INSTRUCTIONS TO REPORT BACK THE RESOLUTION WITH AMENDMENTS APPROVING THE RATIFIED CONSTITUTION OF NEW MEXICO, REAFFIRMING THE BOUNDARY LINE BETWEEN TEXAS AND NEW MEXICO, AND ADMITTING ARIZONA, PROVIDED THAT IT RATIFY ARTI- CLE 8 OF ITS CONSTITUTION RELATING TO THE RECALL OF PUBLIC OFFICERS, EXCEPT THOSE OF THE JUDICIARY.  (P.1528-1,2)",,,Government Organization,,Government Management,5.240545486908679,-1.7358989197060466,0.328,-0.017,-0.357,0.394
RH0620019,62,House,19,1911-06-02,,154,68,TO ADJOURN UNTIL TUESDAY.  (P.1684-2),,,Internal Organization,,Miscellaneous Policy,-11.567366508918878,0.2093757646159454,0.013,0.059,0.276,0.138
RH0620020,62,House,20,1911-06-06,,148,58,"TO DISCHARGE THE COMMITTEE ON THE POST OFFICE AND POST ROADS FROM FURTHER CONSIDERATION OF H. R. 11031, A BILL MAKING IMMEDIATELY AVAILABLE A PART OF THE AMOUNT APPROPRIATED FOR INLAND TRANSPORTATION BY STAR ROUTE FOR FISCAL 1912, AND FOR OTHER PURPOSES, AND REFER IT TO THE COMMITTEE ON APPROPRIA- TIONS.  (P.1713-1)",,,Budget Special Interest,,Government Management,-0.07229604068074298,-0.9021781689074444,0.371,-0.929,-0.002,-0.16
RH0620021,62,House,21,1911-06-15,,79,124,"TO ADOPT H. RES. 105, RESOLVING THAT THE SECRETARY OF THE INTERIOR BE REQUIRED TO FURNISH THE HOUSE UNIT COPIES OF ALL COMPLAINTS AND CHARGES OF EVERY CHARACTER MADE AGAINST THE MANAGEMENT OF THE GOVERNMENT HOSPITAL FOR THE INSANE WITHIN THE PAST TWO YEARS.  (P.2100-1)",,,Government Organization,,Government Management,1.408461725179242,0.6327453657568965,0.101,0.775,0.047,-0.193
RH0620022,62,House,22,1911-06-19,,156,117,TO ADJOURN.,,,Internal Organization,,Miscellaneous Policy,-604.9732684164574,-73.20776547839134,-0.121,-0.006,0.523,0.005
RH0620023,62,House,23,1911-06-20,,128,207,"TO RECOMMIT H. R. 11019, A BILL TO REDUCE THE DUTIES ON WOOL AND THE MANUFACTURE OF WOOL, TO WAYS AND MEANS COMMITTEE WITH INSTRUCTIONS TO AWAIT REPORT OF THE TARIFF BOARD AND INCORPORATE IN BILL SUCH PROVISIONS AS THE COMMITTEE MAY DEEM PROPER, BASED ON SAID REPORT.  (P. 2355-2)",Tariffs,,Regulation Special Interest,,Government Management,11.227149846891852,-1.0576787461722963,0.025,-0.777,-0.363,0.187
RH0620024,62,House,24,1911-06-20,,232,112,"TO PASS H. R. 11019, A BILL TO REDUCE THE DUTIES ON WOOL AND WOOLEN GOODS.  (P.2356-2)",Tariffs,,Budget Special Interest,,Government Management,3.6553840111344478,-0.6752676173806715,0.124,-0.222,0.304,-0.481
RH0620025,62,House,25,1911-06-21,,116,176,"TO CONCUR IN SENATE AMENDMENT TO H. R. RES. 39, PROPOSING AN AMENDMENT TO THE CONSTITUTION PROVIDING FOR POPULAR ELEC- TION OF SENATORS, WHICH AMENDMENT STRIKES OUT AND ADDS TO CERTAIN PASSAGES IN ORDER TO CLARIFY AND STATE THE MANNER OF ELECTION AS WELL AS ENTITLEMENTS OF VOTES. (P.2404-1 2433-1)",Constitutional Amendments,,Government Organization,,Government Management,237.13101343283702,-13.269467765671711,0.057,0.247,-0.328,0.008
RH0620026,62,House,26,1911-07-31,,6,183,"TO DECIDE A POINT OF ORDER, WHETHER A QUORUM IS PRESENT, DURING DEBATE ON CONCURRING IN SENATE AMENDMENT TO H. J. RES. 130, SUPPLYING A DEFICIENCY IN THE APPROPRIATIONS FOR CONTINGENT EXPENSES OF THE HOUSE INCIDENT TO THE FIRST SESSION OF THE 62ND CONGRESS, WHICH AMENDMENT APPROPRIATES FUNDS FOR OFFICIAL REPORTERS TO THE PROCEEDINGS OF THE SENATE AND FOR CLERICAL SERVICE.  (P.3403-1, 3398-1)",,,Internal Organization,Budget Special Interest,Government Management,-15.405137640382616,9.12836918816623,0.539,0.825,-0.285,-0.107
RH0620027,62,House,27,1911-08-03,,115,194,"TO RECOMMIT H. R. 12812, A BILL FOR THE REDUCTION OF DUTIES ON MANUFACTURE OF COTTON GOODS, TO THE COMMITTEE ON WAYS AND MEANS WITH INSTRUCTIONS TO HOLD SAME UNTIL THE TARIFF BOARD MAKES ITS REPORT, AND TO REPORT BILL BACK TO THE HOUSE WITH SUCH PROVISIONS AS THE COMMITTEE MAY DEEM PROPER. (P. 3583-2)",Tariffs,,Regulation Special Interest,,Government Management,5.454845076112247,-0.8564139727868576,0.168,0.06,-0.282,0.299
RH0620028,62,House,28,1911-08-03,,210,98,"TO PASS H. R. 12812, A BILL REDUCING THE TARIFF ON MANUFAC- TURES OF COTTON GOODS.  (P.3583-1, 3584-1)",Tariffs,,Regulation Special Interest,,Government Management,3.3897413160918806,-0.75796360690803,0.218,-0.019,0.674,-1.15
RH0620029,62,House,29,1911-08-04,,86,169,"TO ADJOURN FOR LACK OF QUORUM DURING DEBATE ON H. RES. 266, A RESOLUTION PROVIDING INSTRUCTIONSFOR CONSIDERATION OF H. RES. 246, INCLUDING TIME LIMITS ON DEBATE AND SPEAKERS TO BE RECOGNIZED.  (P.3609-12)",,,Government Organization,,Government Management,-9.360434740769882,2.8278512917125043,0.302,0.001,-0.369,-0.228
RH0620030,62,House,30,1911-08-04,,147,108,"TO ADOPT H. RES. 266, A RESOLUTION PROVIDING INSTRUCTIONS FOR CONSIDERATION OF H. RES. 246, SETTING TIME LIMITS ON DEBATE OF SAID RESOLUTION AND STATING SPEAKERS TO BE RECOGNIZED.  (P.3609-14)",,,Government Organization,,Government Management,84.74353290229699,1.813614190948237,-0.021,0.034,0.337,-0.023
RH0620031,62,House,31,1911-08-05,,128,136,"TO AMEND H. RES. 246, BY ELIMINATING FROM THE RESOLUTION, ""CONCURRED AND ADOPTION"" AND INSERT INSTEAD ""TRANSMIT THE SAME TO THE PRESIDENT TOGETHER WITH THE MINORITY VIEWS AND THE TESTIMONY TAKEN BY SAID COMMITTEE,"" FOR HIS CONSIDER- ATION AND ACTION.",,,Government Organization,,Government Management,46.26946603567551,2.4437427678194505,-0.051,0.084,-0.208,0.026
RH0620032,62,House,32,1911-08-05,,132,136,"TO RECOMMIT H. RES. 246, TO THE COMMITTEE ON EXPENDITURES AND HAVE MR. MICHAEL APPEAR AND GIVE TESTIMONY BEFORE SUCH COMMITTEE, AND THAT COMMITTEE REPORT THEREON.  (P.3666-2)",,,Internal Organization,,Miscellaneous Policy,44.044972476268036,3.535597798101443,-0.08,0.012,-0.198,0.026
RH0620033,62,House,33,1911-08-05,,136,123,"TO ADOPT AMENDED RESOLUTION H. RES. 246, WITH REPORT RELAT- ING TO DISMISSAL OF W. H. MICHAEL, CHIEF CLERK OF THE STATE DEPARTMENT, AND THOMAS W. NORRISON, FORMER DISBURSING CLERK, ON ACCOUNT OF CHARGES MADE AGAINST THEM.  (P. 3667-1,2 3087)",,,Government Organization,,Government Management,-23.042928521735227,-0.9573004996521466,-0.007,-0.796,0.251,0.063
RH0620034,62,House,34,1911-08-07,,117,131,"TO ADJOURN, MADE DURING CONSIDERATION OF H. R. 8768 (37 STAT. 657, 2/4/1913), A BILL REGULATING LOANS IN THE DIS- TRICT OF COLUMBIA.  (P.3705-2; 3707-1,2)",Banking and Finance,,D. C.,Regulation Special Interest,Government Management,-4.473567158145424,-0.36111017935789225,0.042,-0.549,0.14,0.181
RH0620035,62,House,35,1911-08-07,,146,113,TO ADJOURN.  (P.3710-2),,,Internal Organization,,Miscellaneous Policy,-9.35086514194041,-0.25266506387807464,-0.133,0.991,0.27,0.167
RH0620036,62,House,36,1911-08-08,,178,80,"TO ORDER PREVIOUS QUESTION ON PASSAGE OF H. RES. 269, PROVIDING THAT THE REMAINDER OF THIS DAY BE DEVOTED BY THE HOUSE TO THE CONSIDERATION OF SUCH BILLS AS HAVE BEEN REPORTED BY THE COMMITTEE ON THE DISTRICT OF COLUMBIA, WITHOUT INTERFERING WITH CONFERENCE REPORTS.  (P. 3748-2)",,,Internal Organization,,Miscellaneous Policy,-4.173037284863139,1.3165248259929199,0.344,-0.119,0.399,0.553
RH0620037,62,House,37,1911-08-12,,160,90,"TO TABLE AN APPEAL FROM THE DECISION OF THE CHAIR RULING THAT THE HOUSE COULD REFUSE OR AGREE TO SEND CERTAIN PAPERS TO THE SENATE, MADE DURING CONSIDERATION OF H. R. 11019, A BILL REGARDING THE REDUCTION OF DUTIES ON WOOL AND WOOLEN GOODS.  (P.3873-1,2; 3867)",Tariffs,,Regulation Special Interest,,Government Management,7.067804758557894,-0.8844755948197367,0.125,-0.001,0.688,-0.563
RH0620038,62,House,38,1911-08-14,,173,118,"TO ORDER PREVIOUS QUESTION ON H. R. 11019.  (P.3915-1,2)",Tariffs,,Regulation Special Interest,,Government Management,-8.774485241556334,0.8185735925865979,0.197,-0.91,0.399,0.263
RH0620039,62,House,39,1911-08-14,,206,91,"TO ADOPT THE CONFERENCE REPORT ON H. R. 11019.  (P.3919-1,2; 3916-1)",Tariffs,,Regulation Special Interest,,Government Management,3.3243936674268273,-0.7337714574944874,0.212,-0.029,0.611,-1.063
RH0620040,62,House,40,1911-08-15,,92,157,"TO ADJOURN, FOR LACK OF QUORUM.  (P.3987-2)",,,Internal Organization,,Miscellaneous Policy,-26.65523586837828,6.461567080147544,0.242,0.011,-0.212,-0.046
RH0620041,62,House,41,1911-08-15,,139,71,"TO ORDER A CALL OF THE HOUSE DURING CONSIDERATION OF H. CON. RES. 11, A RESOLUTION TO HAVE THE PRESIDENT INVITE REPRE- SENTATIVES OF FOREIGN NATIONS TO VISIT THE CITY OF KEY WEST AND PARTICIPATE IN THE CELEBRATION OF THE COMPLETION OF THE FLORIDA EAST COAST RAILWAY CO.  (P.3991-2)",,,Foreign Policy Resolutions,,Foreign and Defense Policy,-1.9070523163352748,0.6306382807691974,0.445,-0.218,0.122,0.37
RH0620042,62,House,42,1911-08-17,,171,122,"TO REFER TO THE COMMITTEE A MOTION TO MAKE CHANGES IN THE RECORD BY STRIKING OUT THE WORDS ""APPLAUSE"" AND ""GREAT APPLAUSE"" WHERE OCCURING IN THE SPEECH OF MR. LITTLEPAGE. (P. 4031; 4032; 4033; 4070-1,2)",,,Internal Organization,,Miscellaneous Policy,-9.74094021803695,1.2692242827352422,0.196,-0.64,0.384,0.228
RH0620043,62,House,43,1911-08-17,,283,27,"TO ADOPT THE CONFERENCE REPORT ON H. R. 2958 (37 STAT. 25, 8/19/1911), A BILL PROVIDING FOR PUBLICITY OF CONTRIBUTIONS MADE FOR THE PURPOSE OF INFLUENCING ELECTIONS OF REPRESENT- ATIVES IN CONGRESS.  (P.4102-1,2; 4071-1)","Campaign Contributions, Lobbying/House Ethics Campaign Laws",,Domestic Social Policy,,Government Management,-126.66266327266172,-70.40444077959992,-0.556,0.02,-0.219,-0.01
RH0620044,62,House,44,1911-08-18,,241,136,"TO PASS OVER THE PRESIDENT'S VETO, H. R. 11019, A BILL RE- DUCING DUTIES ON WOOL AND WOOLEN GOODS.  (P.4170-1,2)",Tariffs,,Regulation Special Interest,,Government Management,3.8067745714379915,-0.7006058737159625,0.178,-0.023,0.699,-1.062
RH0620045,62,House,45,1911-08-18,,241,133,"TO PASS OVER THE PRESIDENT'S VETO, H. R. 4413, A BILL PLACING ON THE FREE LIST AGRICULTURAL IMPLEMENTS, AND OTHER ARTICLES.  (P.4174-1,2)",Agriculture,,Regulation Special Interest,,Agriculture,3.7593941153986354,-0.7490442760411394,0.191,-0.031,0.689,-1.06
RH0620046,62,House,46,1911-08-18,,187,141,"TO TABLE A HOUSE RESOLUTION, STATING THAT THE AMENDMENTS OF THE SENATE TO H. R. 12812, A BILL TO REDUCE THE DUTIES ON MANUFACTURES OF COTTON, HAVE, BY ADDING PROVISIONS AS TO DUTIES ON STEEL, CHEMICAL, AND MINERAL PRODUCTS, CONTRAVENED THE TRUE INTENT AND PURPOSES OF THAT CLAUSE OF THE CONSTITU- TION WHICH REQUIRES THAT ""ALL BILLS FOR RAISING REVENUE SHALL ORIGINATE IN THE HOUSE,"" AND THAT THE SAID BILL WITH SAID AMENDMENTS, BE RETURNED TO THE SENATE WITH NOTIFICATION OF THIS OBJECTION OF THE HOUSE.  (P.4175-1,2)",Tariffs,,Regulation Special Interest,,Government Management,-14.23675878020785,1.1445201497353807,0.074,0.091,0.736,0.299
RH0620047,62,House,47,1911-08-21,,143,112,"TO ADOPT H. RES. 295, A RESOLUTION TO PROCEED TO CONSIDER- ATION OF H. R. 12812, A BILL TO REDUCE DUTIES ON MANUFAC- TURERS OF COTTON AND THE SENATE AMENDMENTS THERETO, AND TO SET TIME LIMITS FOR DEBATE OF SAID AMENDMENTS.  (P. 4314-1, 2; 4312-1)",Tariffs,,Regulation Special Interest,,Government Management,-28.541219538310706,-3.4986990273674206,-0.114,-0.245,0.227,0.046
RH0620048,62,House,48,1911-08-21,,183,110,"TO CONCUR IN THE SENATE AMENDMENTS TO H. R. 12812, A BILL REDUCING THE DUTIES ON RAW COTTON AND MANUFACTURERS OF COTTON.  (P.4351-1,2)",Tariffs,,Regulation Special Interest,,Government Management,10.201142118101687,-1.7939987285496934,0.174,-0.019,0.448,-0.254
RH0620049,62,House,49,1911-08-21,,175,12,"TO TABLE AN APPEAL FROM THE DECISION OF THE CHAIR THAT A QUORUM WAS PRESENT IN DISCUSSION OF H. RES. 90, A RESOLUTION TO INVESTIGATE THE TAYLOR AND OTHER SYSTEMS OF SHOP MANAGEMENT.  (P.4363-1,2)",,,Government Organization,,Government Management,15.50625424255936,-8.136783477343664,0.525,0.004,0.311,-0.116
RH0620050,62,House,50,1911-12-06,,152,116,"TO ADJOURN FOR LACK OF QUORUM.  (P.57-1,2)",,,Internal Organization,,Miscellaneous Policy,-15.175010519126252,0.5606508204918477,0.078,-0.623,0.265,0.101
RH0620051,62,House,51,1911-12-12,,241,105,"TO PASS H. R. 1 (37 STAT. 112, 5/11/1912), A BILL GRANTING SERVICE PENSIONS TO CERTAIN DEFINED VETERANS OF THE CIVIL WAR AND THE MEXICAN WAR.  (P.284-1,2; 285-1; 233-1)",Military Pensions/Veterans Benefits,,Defense Policy Budget,,Foreign and Defense Policy,-20.799014780459906,-6.957826601794305,-0.379,0.925,-0.187,-0.052
RH0620052,62,House,52,1911-12-13,,181,132,"TO PASS H. R. 9833 (37 STAT. 319, 8/20/1912), A BILL PRO- VIDING FOR THE ACCEPTANCE AND FUNDING OF THE BEQUEST OF GERTRUDE M. HUBBARD OF $20,000 TO BE USED FOR THE PURPOSE OF ADDING TO THE GARDINER GREENE HUBBARD ENGRAVING COLLECTION IN THE LIBRARY OF CONGRESS.  (P.308-1,2)",,,Budget Special Interest,,Government Management,0.6725213086580742,0.23827083857231235,-0.274,0.054,-0.045,0.387
RH0620053,62,House,53,1911-12-13,,194,89,"TO PASS S. 2877 (37 STAT. 46, 12/21/1911), A BILL AMENDING SECTION 67 OF THE 3/3/1911 ACT TO CODIFY, REVISE AND AMEND THE LAWS PERTAINING TO THE JUDICIARY.  (P.311-1)",Judiciary,,Domestic Social Policy,,Civil Liberties,-1.5947656032516835,0.5839928099771954,0.116,0.399,0.075,0.272
RH0620054,62,House,54,1911-12-13,,116,183,"TO PASS AN AMENDMENT TO H. J. RES. 166 (37 STAT. 627, 12/21/1911), PROVIDING FOR THE TERMINATION OF THE TREATY OF 1832 BETWEEN THE UNITED STATES AND RUSSIA, WHICH AMENDMENT PROVIDES THAT THE GOVERNMENT OF THE U. S. WILL NOT BE A PARTY TO ANY TREATY WHICH DISCRIMINATES BETWEEN AMERICAN CITIZENS ON THE GROUND OF RACE OR RELIGION.  (P.352-1, 351- 2)",Civil Rights/Desegregation/Busing/Affirmative Action,,Foreign Policy Resolutions,,Foreign and Defense Policy,-24.58065383145262,3.463807882189682,0.165,-0.592,-0.153,-0.036
RH0620055,62,House,55,1911-12-13,,303,1,"TO ADOPT H. J. RES. 166 (37 STAT. 627, 12/21/1911), A RESOL- UTION PROVIDING FOR THE TERMINATION OF THE TREATY OF 1832 BETWEEN RUSSIA AND THE U. S. BECAUSE OF RUSSIA'S DISCRIMIN- ATION BETWEEN U. S. CITIZENS ON BASIS OF RACE OR RELIGION. (P.351-2, 353-2)",Civil Rights/Desegregation/Busing/Affirmative Action,,Foreign Policy Resolutions,,Foreign and Defense Policy,,,0.0,0.0,0.0,0.0
RH0620056,62,House,56,1911-12-16,,99,128,"TO RECOMMIT H. R. 15930 (37 STAT. 47, 12/21/1911), A BILL SUPPLYING A DEFICIENCY IN THE APPROPIAITIONS FOR CONTIN- GENT EXPENSES OF THE HOUSE OF REPRESENTATIVES FOR FISCAL 1912, AND FOR OTHER PURPOSES, TO THE COMMITTEE ON APPROPRI- ATIONS WITH INSTRUCTIONS TO REPORT THE SAME WITH AN AMEND- MENT TO PROVIDE FOR THE PAYMENT OF MILEAGE TO MEMBERS OF CONGRESS AT THE RATE OF 10 CENTS PER OFFICIAL MILE TRAVELLED.  (P.442-1, 443-1)",Congressional Pay and Benefits,,Internal Organization,Budget Special Interest,Government Management,1.5423155345225172,0.34830872310641636,0.359,0.902,0.064,-0.24
RH0620057,62,House,57,1912-01-11,,107,167,"TO SUBSTITUTE THE NAME OF VICTOR MURDOCK (R.-KANS.-8) FOR PHILIP P. CAMPBELL (R.-KANS.-3) AS A NOMINEE FOR MINORITY MEMBER OF THE COMMITTEE ON RULES AND TO VOTE ON SUCH SELECTION.  (P.864-2, 865-1)",,,Internal Organization,,Miscellaneous Policy,1.0041116761214304,0.1424055323673774,0.631,0.776,0.15,-0.864
RH0620058,62,House,58,1912-01-15,,1,224,TO ADJOURN SO AS TO TERMINATE DEBATE ON MOTION TO DISCHARGE THE COMMITTEE ON INVALID PENSIONS FROM FURTHER CONSIDERATION OF THE BILL H. R. 60.  (P.954-2),,,Internal Organization,,Miscellaneous Policy,,,0.0,0.0,0.0,0.0
RH0620059,62,House,59,1912-01-20,,221,0,"TO ORDER A CALL OF THE HOUSE DURING DISCUSSION OF H. R. 17681 (37 STAT. 139, 6/26/1912), A BILL MAKING APPROPRI- ATIONS TO PROVIDE FOR THE EXPENSES OF THE GOVERNMENT OF THE DISTRICT OF COLUMBIA FOR THE FISCAL YEAR ENDING 6/30/1913 AND FOR OTHER PURPOSES.",,,D. C.,Budget Special Interest,Government Management,,,0.0,0.0,0.0,0.0
RH0620060,62,House,60,1912-01-24,,151,87,"TO AMEND H. R. 17595, A BILL RELATING TO POSITIONS IN CIRCUIT COURTS, AND AMENDING THE 1911 ACT CODIFYING, REVIS- ING AND AMENDING THE LAWS PERTAINING TO THE JUDICIARY, BY REQUIRING THE PRESIDENT TO ANNOUNCE PUBLICLY THE ENDORSE- MENTS MADE IN BEHALF OF ANY OF HIS NOMINEES FOR CIRCUIT OR SUPREME COURT JUDGESHIPS.  (P.1287-1,2)",Judiciary,,Domestic Social Policy,,Civil Liberties,2.782024856575427,-0.5315764780008643,0.502,0.865,0.228,-0.474
RH0620061,62,House,61,1912-01-24,,147,93,"TO PASS H. R. 17595, A BILL RELATING TO POSITIONS IN CIRCUIT COURTS, AND AMENDING THE 1911 ACT CODIFYING, REVISING AND AMENDING THE LAWS ON THE JUDICIARY.  (P.1288-1)",Judiciary,,Domestic Social Policy,,Civil Liberties,4.6448112622685835,-0.659366961597707,0.334,0.892,0.208,-0.259
RH0620062,62,House,62,1912-01-25,,74,122,"TO RECOMMIT H. R. 17681 (37 STAT. 139, 6/26/1912), A BILL MAKING APPROPRIATIONS TO PROVIDE FOR THE EXPENSES OF THE GOVERNMENT OF THE DISTRICT OF COLUMBIA FOR THE FISCAL YEAR ENDING 6/30/1913 AND FOR OTHER PURPOSES.",,,D. C.,Budget Special Interest,Government Management,-63.39806644311307,1.279572930203583,0.014,0.392,-0.285,-0.026
RH0620063,62,House,63,1912-01-27,,166,107,"TO ORDER THE PREVIOUS QUESTION ON H. R. 18642, A BILL TO AMEND AN ACT ENTITLED ""AN ACT TO PROVIDE REVENUE TO EQUALIZE DUTIES, AND TO ENCOURAGE INDUSTRIES OF THE U. S., AND FOR OTHER PURPOSES.  (P.1406-2)",Tariffs,,Regulation General Interest,,Government Management,193.93412912609307,1.3645389038826514,-0.007,0.007,1.073,-0.032
RH0620064,62,House,64,1912-01-27,,159,108,TO CLOSE DEBATE ON H. R. 18642.  (P.1407-2),Tariffs,,Regulation General Interest,,Government Management,-36.59987059462614,-0.5187983177301398,-0.013,-0.043,0.405,0.064
RH0620065,62,House,65,1912-01-29,,203,124,TO ORDER THE PREVIOUS QUESTION ON AMENDMENT TO AND PASSAGE OF H.R. 18642.,Tariffs,,Regulation General Interest,,Government Management,7.209614379406813,-0.4493750653385572,-0.065,-0.918,0.541,-0.434
RH0620066,62,House,66,1912-01-29,,106,207,"TO RECOMMIT H. R. 18642, TO THE COMMITTEE ON WAYS AND MEANS WITH INSTRUCTIONS TO HOLD THE BILL UNTIL THE TARIFF BOARD SHALL MAKE A REPORT OF THE INVESTIGATION OF THE METAL SCHE- DULE, AND TO REPORT BILL BACK WITH AMENDMENTS.  (P.1501-2)",Tariffs,,Regulation Special Interest,,Government Management,4.449959575015787,-0.7524931277526838,0.17,0.004,-0.704,0.915
RH0620067,62,House,67,1912-01-29,,211,110,TO PASS H. R. 18642.,Tariffs,,Regulation General Interest,,Government Management,4.195417904789231,-0.6352897752423308,0.155,0.015,0.28,-0.386
