date_generated,id,congress,chamber,rollnumber,date,keyvote,yea,nay,description,Issue1,Issue2,Peltzman1,Peltzman2,Clausen1,mid.dim1,mid.dim2,spread.dim1,spread.dim2,pre,classified,log_likelihood,geo_mean_probability
2017-01-23 13:12:32,RH1060227,106,House,227,1999-06-17,,300,126,McIntosh of Indiana Amendment,Education,,Domestic Social Policy,Regulation Special Interest,Civil Liberties,-0.484,0.288,-0.173,-0.439,0.563,0.871,-144.012,0.713
2017-01-23 13:12:32,RH1060228,106,House,228,1999-06-17,,364,60,Schaffer of Colorado Amendment,,,Domestic Social Policy,Regulation Special Interest,Civil Liberties,0.158,-0.987,-0.112,-0.609,-0.1,0.844,-109.756,0.772
2017-01-23 13:12:32,RH1060229,106,House,229,1999-06-17,,355,68,Emerson of Missouri Amendment,Radio/Television/Motion Pictures/Telecommunications,,Domestic Social Policy,Regulation Special Interest,Civil Liberties,-0.52,-0.001,-0.175,-0.138,0.206,0.872,-127.104,0.74
2017-01-23 13:12:32,RH1060230,106,House,230,1999-06-17,,192,233,Consequences for Juvenile Offenders Act,,,Domestic Social Policy,Regulation Special Interest,Civil Liberties,-0.107,-0.034,0.372,0.152,0.927,0.967,-31.819,0.928
2017-01-23 13:12:32,RH1060231,106,House,231,1999-06-17,,287,139,Consequences for Juvenile Offenders Act,,,Domestic Social Policy,Domestic Social Policy,Civil Liberties,-0.446,0.793,-0.217,-0.232,0.604,0.871,-130.029,0.737
2017-01-23 13:12:32,RH1060232,106,House,232,1999-06-18,,218,212,Dingell of Michigan Amendment,Firearms,,Domestic Social Policy,,Civil Liberties,0.06,-0.028,-0.179,-0.822,0.736,0.87,-115.268,0.765
2017-01-23 13:12:32,RH1060233,106,House,233,1999-06-18,,194,235,McCarthy of New York Amendment,Firearms,,Domestic Social Policy,,Civil Liberties,0.092,-0.171,0.214,0.869,0.773,0.897,-97.428,0.797
2017-01-23 13:12:32,RH1060234,106,House,234,1999-06-18,,311,115,Davis of Virginia Amendment,Firearms,,Domestic Social Policy,,Civil Liberties,0.355,0.109,0.16,0.65,0.478,0.859,-134.581,0.729
2017-01-23 13:12:32,RH1060235,106,House,235,1999-06-18,,372,52,Cunningham of California Amendment,Firearms,,Domestic Social Policy,,Civil Liberties,-0.728,0.418,-0.23,-0.369,0.154,0.896,-110.077,0.771
2017-01-23 13:12:32,RH1060236,106,House,236,1999-06-18,,354,69,McCollum of Florida Amendment,Firearms,,Domestic Social Policy,,Civil Liberties,0.372,0.436,0.127,0.398,0.188,0.868,-130.512,0.735
2017-01-23 13:12:32,RH1060237,106,House,237,1999-06-18,,247,181,Sessions of Texas Amendment,Firearms,,Domestic Social Policy,,Civil Liberties,-0.118,-0.013,-0.114,-0.533,0.669,0.86,-156.921,0.693
2017-01-23 13:12:32,RH1060238,106,House,238,1999-06-18,,175,250,Goode of Virginia Amendment,Firearms,,Domestic Social Policy,D. C.,Civil Liberties,0.071,0.157,-0.151,-0.634,0.669,0.864,-132.774,0.732
2017-01-23 13:12:32,RH1060239,106,House,239,1999-06-18,,213,208,Hunter of California Amendment,Firearms,,Domestic Social Policy,D. C.,Civil Liberties,-0.048,0.106,-0.173,-0.627,0.75,0.876,-113.953,0.763
2017-01-23 13:12:32,RH1060240,106,House,240,1999-06-18,,395,27,Rogan of California Amendment,Firearms,,Domestic Social Policy,,Civil Liberties,0.416,0.881,0.16,0.391,-0.074,0.931,-71.959,0.843
2017-01-23 13:12:32,RH1060241,106,House,241,1999-06-18,,184,242,Conyers of Michigan Amendment,Firearms,,Domestic Social Policy,,Civil Liberties,-0.004,-0.108,0.241,0.912,0.821,0.923,-85.502,0.818
2017-01-23 13:12:32,RH1060242,106,House,242,1999-06-18,CQ,147,280,Mandatory Gun Show Background Check Act,Firearms,,Domestic Social Policy,,Civil Liberties,-0.118,-0.993,-0.117,0.252,0.374,0.785,-180.684,0.655
2017-01-23 13:12:32,RH1060243,106,House,243,1999-06-22,,418,4,Protect America’s Treasures of the Revolution for Independence for Our Tomorrow Act or the PATRIOT Act.,Parks and Conservation,,Budget Special Interest,,Government Management,0.0,0.0,0.0,0.0,,,0.0,
2017-01-23 13:12:32,RH1060244,106,House,244,1999-06-22,,415,5,"To Locate and Secure the Return of Zachary Baumel, an American Citizen, and other Israeli Soldiers Missing in Action.",,,Foreign Policy Resolutions,,Foreign and Defense Policy,0.0,0.0,0.0,0.0,,,0.0,
2017-01-23 13:12:32,RH1060245,106,House,245,1999-06-23,,416,3,Providing for the bill H.R. 2084; FY 2000 Appropriations Act,,,Budget Special Interest,,Government Management,0.0,0.0,0.0,0.0,,,0.0,
2017-01-23 13:12:32,RH1060246,106,House,246,1999-06-23,,289,141,Andrews of New Jersey Amendment,,,Budget Special Interest,,Government Management,0.094,-0.996,0.143,-0.175,0.411,0.807,-166.934,0.678
2017-01-23 13:12:32,RH1060247,106,House,247,1999-06-23,,241,190,Rogan of California Amendment,,,Budget Special Interest,,Government Management,-0.111,0.172,-0.249,0.259,0.9,0.956,-61.762,0.866
2017-01-23 13:12:32,RH1060248,106,House,248,1999-06-23,,429,3,Department of Transportation and Related Agencies Appropriations Act FY 2000,,,Budget Special Interest,,Government Management,0.0,0.0,0.0,0.0,,,0.0,
2017-01-23 13:12:32,RH1060249,106,House,249,1999-06-24,,115,310,Watt of North Carolina Substitute Amendment,Constitutional Amendments,,Domestic Social Policy,,Civil Liberties,-0.287,-0.202,0.166,0.352,0.53,0.873,-124.774,0.746
2017-01-23 13:12:32,RH1060250,106,House,250,1999-06-24,,305,124,Constitutional Amendment to Prohibit the Physical Desecration of the United States Flag,Constitutional Amendments,,Domestic Social Policy,,Civil Liberties,-0.396,0.122,-0.187,-0.469,0.556,0.872,-123.369,0.75
2017-01-23 13:12:32,RH1060251,106,House,251,1999-06-24,,426,0,Year 2000 Readiness and Responsibility Act,,,Regulation Special Interest,,Government Management,0.0,0.0,0.0,0.0,,,0.0,
2017-01-23 13:12:32,RH1060252,106,House,252,1999-06-24,,155,268,Hutchinson of Arkansas Substitute Amendment,,,Domestic Social Policy,,Civil Liberties,0.426,0.905,-0.018,-0.067,-0.013,0.629,-284.397,0.511
2017-01-23 13:12:32,RH1060253,106,House,253,1999-06-24,,375,48,Civil Asset Forfeiture Reform Act,,,Domestic Social Policy,,Civil Liberties,-0.415,0.91,-0.05,0.301,0.0,0.887,-158.222,0.688
2017-01-23 13:12:32,RH1060254,106,House,254,1999-06-25,,381,6,Foster Care Independence Act,,,Domestic Social Policy,,Social Welfare,0.0,0.0,0.0,0.0,,,0.0,
2017-01-23 13:12:32,RH1060255,106,House,255,1999-06-29,,424,0,Veterans Benefits Improvement Act of 1999,,,Defense Policy Budget,Budget Special Interest,Foreign and Defense Policy,0.0,0.0,0.0,0.0,,,0.0,
2017-01-23 13:12:32,RH1060256,106,House,256,1999-06-29,,425,0,"Expressing the Sense of the House of Representatives Condemning the Acts of Arson at Three Sacramento, California Synagogues",,,Government Organization,,Civil Liberties,0.0,0.0,0.0,0.0,,,0.0,
2017-01-23 13:12:32,RH1060257,106,House,257,1999-06-29,,275,140,Recognizing the Need for Reconciliation and Healing and Prayer,Religion,,Domestic Social Policy,,Civil Liberties,-0.309,0.156,-0.214,-0.465,0.707,0.901,-95.518,0.794
2017-01-23 13:12:32,RH1060258,106,House,258,1999-06-30,,164,268,Child Custody Protection Act,Abortion/Care of deformed newborns,,Domestic Social Policy,,Civil Liberties,0.227,-0.732,0.278,0.821,0.762,0.91,-92.038,0.808
2017-01-23 13:12:32,RH1060259,106,House,259,1999-06-30,,270,160,Child Custody Protection Act,Abortion/Care of deformed newborns,,Domestic Social Policy,,Civil Liberties,-0.055,-0.231,-0.195,-0.648,0.731,0.9,-99.078,0.794
2017-01-23 13:12:32,RH1060260,106,House,260,1999-07-01,,358,56,JOURNAL QUESTION: ON APPROVING THE JOURNAL,,,Internal Organization,,Miscellaneous Policy,-0.593,-0.07,-0.161,0.249,0.161,0.886,-138.354,0.716
2017-01-23 13:12:32,RH1060261,106,House,261,1999-07-01,,423,1,Waiving points of order against the conference report to accompany H.R. 775; Year 2000 Readiness and Responsibility Act,,,Regulation Special Interest,,Government Management,0.0,0.0,0.0,0.0,,,0.0,
2017-01-23 13:12:32,RH1060262,106,House,262,1999-07-01,,227,203,Providing for consideration of H.R. 10; Financial Services Act,Banking and Finance,,Regulation Special Interest,,Government Management,-0.127,-0.306,-0.392,0.31,0.97,0.986,-19.713,0.955
2017-01-23 13:12:32,RH1060263,106,House,263,1999-07-01,,404,24,Year 2000 Readiness and Responsibility Act,,,Regulation Special Interest,,Government Management,-0.63,-0.012,-0.249,-0.054,0.0,0.944,-66.368,0.856
2017-01-23 13:12:32,RH1060264,106,House,264,1999-07-01,,261,162,DOD Authorization for FY 2000,,,Defense Policy Budget,,Foreign and Defense Policy,0.274,-0.151,0.151,0.082,0.599,0.846,-143.339,0.713
2017-01-23 13:12:32,RH1060265,106,House,265,1999-07-01,,413,9,DOD Authorization for FY 2000,,,Defense Policy Budget,,Foreign and Defense Policy,0.0,0.0,0.0,0.0,,,0.0,
2017-01-23 13:12:32,RH1060266,106,House,266,1999-07-01,,238,189,Burr of North Carolina Amendment,Banking and Finance,,Regulation Special Interest,,Government Management,-0.032,-0.211,-0.085,-0.119,0.503,0.78,-213.656,0.606
2017-01-23 13:12:32,RH1060267,106,House,267,1999-07-01,,129,299,Barr of Georgia Amendment,Banking and Finance,,Regulation Special Interest,,Government Management,0.356,0.038,-0.15,-0.257,0.457,0.836,-153.182,0.699
2017-01-23 13:12:32,RH1060268,106,House,268,1999-07-01,,114,313,Cook of Utah Amendment,Banking and Finance,,Regulation Special Interest,,Government Management,0.278,0.888,-0.13,-0.124,0.263,0.803,-176.837,0.661
2017-01-23 13:12:32,RH1060269,106,House,269,1999-07-01,,407,20,Roukema of New Jersey Amendment,Banking and Finance,,Regulation Special Interest,,Government Management,-0.569,0.605,-0.22,0.165,-0.1,0.948,-75.91,0.837
2017-01-23 13:12:32,RH1060270,106,House,270,1999-07-01,,179,232,Financial Services Act,Banking and Finance,,Regulation Special Interest,,Government Management,-0.135,0.008,0.242,-0.132,0.883,0.949,-59.261,0.866
2017-01-23 13:12:32,RH1060271,106,House,271,1999-07-01,,226,203,Bliley of Virginia Amendment,Banking and Finance,,Regulation Special Interest,,Government Management,-0.086,0.719,-0.161,-0.061,0.783,0.897,-129.628,0.739
2017-01-23 13:12:32,RH1060272,106,House,272,1999-07-01,,427,1,Oxley of Ohio Amendment,Banking and Finance,,Regulation Special Interest,,Government Management,0.0,0.0,0.0,0.0,,,0.0,
2017-01-23 13:12:32,RH1060273,106,House,273,1999-07-01,,198,232,Financial Services Act,Banking and Finance,,Regulation Special Interest,,Government Management,-0.073,-0.071,0.27,-0.079,0.944,0.974,-37.955,0.916
2017-01-23 13:12:32,RH1060274,106,House,274,1999-07-01,CQ,343,86,Financial Services Act,Banking and Finance,,Regulation Special Interest,,Government Management,-0.517,-0.855,-0.148,-0.008,0.14,0.828,-171.281,0.671
2017-01-23 13:12:32,RH1060275,106,House,275,1999-07-12,,329,36,JOURNAL QUESTION: ON APPROVING THE JOURNAL,,,Internal Organization,,Miscellaneous Policy,-0.728,-0.283,-0.233,0.573,0.139,0.915,-96.273,0.768
2017-01-23 13:12:32,RH1060276,106,House,276,1999-07-12,,355,0,Expressing the Sense of Congress Concerning the sexual relationships between adults and children,"Children (aid, infant mortality, etc.)",,Domestic Social Policy,,Civil Liberties,0.0,0.0,0.0,0.0,,,0.0,
2017-01-23 13:12:32,RH1060277,106,House,277,1999-07-12,,365,5,Concerning United Nations General Assembly Resolution ES-10/6,U. N.,,Foreign Policy Resolutions,,Foreign and Defense Policy,0.0,0.0,0.0,0.0,,,0.0,
2017-01-23 13:12:32,RH1060278,106,House,278,1999-07-13,,418,4,"Military Construction Appropriations Act, 2000",,,Defense Policy Budget,,Foreign and Defense Policy,0.0,0.0,0.0,0.0,,,0.0,
2017-01-23 13:12:32,RH1060279,106,House,279,1999-07-13,,213,202,McGovern of Massachusetts Amendment,,,Budget Special Interest,,Government Management,0.076,-0.01,0.11,0.417,0.653,0.831,-169.972,0.664
2017-01-23 13:12:32,RH1060280,106,House,280,1999-07-13,,248,169,Sanders of Vermont Amendment,,,Budget Special Interest,,Government Management,-0.671,0.575,0.007,0.177,0.006,0.597,-277.098,0.515
2017-01-23 13:12:32,RH1060281,106,House,281,1999-07-13,,131,287,Coburn of Oklahoma Amendment,Fish and Wildlife,,Budget Special Interest,,Government Management,0.424,-0.432,-0.178,-0.171,0.489,0.84,-145.898,0.705
2017-01-23 13:12:32,RH1060282,106,House,282,1999-07-14,,243,180,Sanders of Vermont Amendment,Welfare,,Domestic Social Policy,Budget Special Interest,Social Welfare,0.084,0.348,0.147,0.203,0.683,0.865,-142.869,0.713
2017-01-23 13:12:32,RH1060283,106,House,283,1999-07-14,,198,225,Sanders of Vermont Amendment,Welfare,,Domestic Social Policy,Budget Special Interest,Social Welfare,-0.008,0.137,0.13,-0.053,0.722,0.87,-147.209,0.706
2017-01-23 13:12:32,RH1060284,106,House,284,1999-07-14,,207,217,Slaughter of New York Amendment,,,Budget Special Interest,,Government Management,-0.057,0.177,0.261,0.775,0.855,0.929,-79.146,0.83
2017-01-23 13:12:32,RH1060285,106,House,285,1999-07-14,,124,300,Stearns of Florida Amendment,,,Budget Special Interest,,Government Management,0.282,0.247,-0.206,-0.391,0.54,0.866,-115.941,0.761
2017-01-23 13:12:32,RH1060286,106,House,286,1999-07-14,,273,151,Rahall of West Virginia Amendment,Pollution and Environmental Protection,,Budget Special Interest,,Government Management,0.118,0.346,0.174,0.445,0.649,0.875,-126.163,0.743
2017-01-23 13:12:32,RH1060287,106,House,287,1999-07-14,,205,217,Weldon of Florida Amendment,,,Regulation Special Interest,Indian Affairs,Government Management,-0.122,0.993,-0.121,-0.094,0.59,0.801,-193.913,0.632
2017-01-23 13:12:32,RH1060288,106,House,288,1999-07-14,,227,199,Klink of Pennsylvania Amendment,Parks and Conservation,,Budget Special Interest,,Government Management,0.096,-0.433,0.178,-0.055,0.854,0.932,-102.232,0.787
2017-01-23 13:12:32,RH1060289,106,House,289,1999-07-14,,259,166,Farr of California Amendment,Fish and Wildlife,,Regulation Special Interest,,Government Management,-0.047,0.272,0.119,0.688,0.608,0.847,-155.56,0.693
2017-01-23 13:12:32,RH1060290,106,House,290,1999-07-14,,135,291,Tancredo of Colorado Amendment,Parks and Conservation,,Budget Special Interest,,Government Management,0.343,-0.003,-0.169,-0.034,0.496,0.84,-146.066,0.71
2017-01-23 13:12:32,RH1060291,106,House,291,1999-07-14,,174,250,Wu of Oregon Amendment,Fish and Wildlife,,Budget Special Interest,,Government Management,-0.058,-0.085,0.161,0.589,0.701,0.877,-118.468,0.756
2017-01-23 13:12:32,RH1060292,106,House,292,1999-07-14,,220,206,Klink of Pennsylvania Amendment,Parks and Conservation,,Budget Special Interest,,Government Management,0.035,-0.553,0.221,-0.158,0.908,0.955,-70.142,0.848
2017-01-23 13:12:32,RH1060293,106,House,293,1999-07-15,,187,239,"Department of the Interior and Related Agencies Appropriations Act, 2000",,,Budget Special Interest,,Government Management,-0.085,-0.016,0.722,0.684,0.957,0.981,-23.199,0.947
2017-01-23 13:12:32,RH1060294,106,House,294,1999-07-15,,377,47,"Department of the Interior and Related Agencies Appropriations Act, 2000",,,Budget Special Interest,,Government Management,-0.688,0.064,-0.162,-0.182,0.064,0.896,-123.619,0.747
2017-01-23 13:12:32,RH1060295,106,House,295,1999-07-15,,346,53,JOURNAL QUESTION: ON APPROVING THE JOURNAL,,,Internal Organization,,Miscellaneous Policy,-0.664,-0.085,-0.15,0.329,0.038,0.872,-139.569,0.705
2017-01-23 13:12:32,RH1060296,106,House,296,1999-07-15,,190,234,Nadler of New York Substitute Amendment,Religion,,Domestic Social Policy,,Civil Liberties,-0.141,0.234,0.396,0.925,0.868,0.941,-53.025,0.882
2017-01-23 13:12:32,RH1060297,106,House,297,1999-07-15,,306,118,Religious Liberty Protection Act,Religion,,Domestic Social Policy,,Civil Liberties,-0.64,0.768,-0.233,-0.439,0.475,0.854,-144.345,0.711
2017-01-23 13:12:32,RH1060298,106,House,298,1999-07-15,,276,147,"Providing for the consideration of H.R. 2490, Treasury and General Government Appropriations Act, FY 2000",,,Budget Special Interest,,Government Management,-0.397,0.693,-0.001,0.162,0.027,0.662,-268.028,0.531
2017-01-23 13:12:32,RH1060299,106,House,299,1999-07-15,,188,230,DeLauro of Connecticut Amendment,Abortion/Care of deformed newborns,,Domestic Social Policy,Regulation Special Interest,Civil Liberties,0.318,-0.526,0.223,0.798,0.793,0.907,-107.058,0.774
2017-01-23 13:12:32,RH1060300,106,House,300,1999-07-15,,82,334,Sessions of Texas Amendment,,,Budget Special Interest,,Government Management,0.041,0.88,-0.07,-0.314,0.061,0.815,-169.039,0.666
2017-01-23 13:12:32,RH1060301,106,House,301,1999-07-15,,217,200,Lowey of New York to Smith of New Jersey Amendment,Abortion/Care of deformed newborns,,Domestic Social Policy,Regulation Special Interest,Social Welfare,0.12,-0.075,0.168,0.515,0.74,0.875,-119.392,0.751
2017-01-23 13:12:32,RH1060302,106,House,302,1999-07-15,,192,228,Sanders of Vermont Amendment,,,Foreign Policy Budget,,Foreign and Defense Policy,0.4,-0.917,-0.107,-0.137,0.448,0.748,-222.909,0.588
2017-01-23 13:12:32,RH1060303,106,House,303,1999-07-15,,210,209,"Treasury and General Appropriations Act, FY 2000",,,Budget Special Interest,,Government Management,-0.358,-0.934,-0.232,0.419,0.9,0.95,-92.079,0.803
2017-01-23 13:12:32,RH1060304,106,House,304,1999-07-16,,263,141,"Providing for the consideration of H.R. 434, African Growth and Opportunity Act",Tariffs,,Foreign Policy Resolutions,,Foreign and Defense Policy,0.16,0.534,-0.065,0.295,0.213,0.725,-202.037,0.606
2017-01-23 13:12:32,RH1060305,106,House,305,1999-07-16,,235,163,African Growth and Opportunity Act,Tariffs,,Foreign Policy Resolutions,,Foreign and Defense Policy,0.335,0.257,-0.014,0.298,0.092,0.628,-245.781,0.539
2017-01-23 13:12:32,RH1060306,106,House,306,1999-07-19,,381,1,Lewis and Clark Expedition Bicentennial Commemorative Coin Act,,,Budget Special Interest,,Government Management,0.0,0.0,0.0,0.0,,,0.0,
2017-01-23 13:12:32,RH1060307,106,House,307,1999-07-19,,381,0,Expressing the Sense of the Congress Regarding the Victory of the United States in the Cold War and the Fall of the Berlin Wall,,,Defense Policy Resolutions,,Foreign and Defense Policy,0.0,0.0,0.0,0.0,,,0.0,
2017-01-23 13:12:32,RH1060308,106,House,308,1999-07-19,,383,2,Iran Nuclear Proliferation Prevention Act,Iran,,Defense Policy Resolutions,,Foreign and Defense Policy,0.0,0.0,0.0,0.0,,,0.0,
2017-01-23 13:12:32,RH1060309,106,House,309,1999-07-20,,417,0,Designating the Document Door of the United States Capitol as the “Memorial Door”.,,,Government Organization,,Government Management,0.0,0.0,0.0,0.0,,,0.0,
2017-01-23 13:12:32,RH1060310,106,House,310,1999-07-20,,221,198,Campbell of (Cal) to Smith of New Jersey Amendment,U. N.,Communists/Communism/Unamerican Activities,Foreign Policy Resolutions,,Foreign and Defense Policy,0.261,-0.25,0.216,0.728,0.773,0.893,-101.977,0.784
2017-01-23 13:12:32,RH1060311,106,House,311,1999-07-20,,180,237,Sanford of South Carolina Amendment,,,Foreign Policy Budget,,Foreign and Defense Policy,0.238,-0.165,-0.141,-0.316,0.611,0.832,-152.797,0.693
2017-01-23 13:12:32,RH1060312,106,House,312,1999-07-20,,74,343,Paul of Texas Amendment,,,Foreign Policy Budget,,Foreign and Defense Policy,0.351,0.459,-0.178,-0.379,0.27,0.871,-113.237,0.762
2017-01-23 13:12:32,RH1060313,106,House,313,1999-07-20,,227,187,Providing for consideration of H.R. 1995; Teacher Empowerment Act,Education,,Domestic Social Policy,Budget Special Interest,Social Welfare,-0.074,0.154,-0.299,0.41,0.947,0.976,-34.459,0.92
2017-01-23 13:12:32,RH1060314,106,House,314,1999-07-20,,424,1,Goodling of Pennsylvania Amendment,Education,,Domestic Social Policy,Budget Special Interest,Social Welfare,0.0,0.0,0.0,0.0,,,0.0,
2017-01-23 13:12:32,RH1060315,106,House,315,1999-07-20,,181,242,Mink of Hawaii Amendment,Education,,Domestic Social Policy,Budget Special Interest,Social Welfare,-0.169,0.025,0.296,-0.147,0.867,0.943,-56.705,0.875
2017-01-23 13:12:32,RH1060316,106,House,316,1999-07-20,,425,0,Crowley of New York Amendment,Education,,Domestic Social Policy,,Social Welfare,0.0,0.0,0.0,0.0,,,0.0,
2017-01-23 13:12:32,RH1060317,106,House,317,1999-07-20,CQ,208,217,Martinez of California Substitute Amendment,Education,,Domestic Social Policy,Budget Special Interest,Social Welfare,0.092,0.988,0.495,-0.141,0.99,0.995,-15.86,0.963
2017-01-23 13:12:32,RH1060318,106,House,318,1999-07-20,,239,186,Teacher Empowerment Act,Education,,Domestic Social Policy,Budget Special Interest,Social Welfare,-0.04,0.917,-0.239,0.098,0.86,0.939,-75.567,0.837
2017-01-23 13:12:32,RH1060319,106,House,319,1999-07-21,,305,121,Gilman of New York Amendment (as modified),Nuclear Weapons,,Foreign Policy Resolutions,,Foreign and Defense Policy,-0.236,0.537,-0.196,0.209,0.331,0.81,-138.947,0.722
2017-01-23 13:12:32,RH1060320,106,House,320,1999-07-21,,117,308,Sanders of Vermont Amendment,,,Foreign Policy Budget,,Foreign and Defense Policy,-0.49,0.525,0.154,0.167,0.419,0.84,-169.56,0.671
2017-01-23 13:12:32,RH1060321,106,House,321,1999-07-21,,418,3,Gibbons of Nevada Amendment,"Children (aid, infant mortality, etc.)",,Foreign Policy Resolutions,,Foreign and Defense Policy,0.0,0.0,0.0,0.0,,,0.0,
2017-01-23 13:12:32,RH1060322,106,House,322,1999-07-21,,169,257,Goodling of Pennsylvania Amendment,U. N.,,Foreign Policy Budget,Foreign Policy Resolutions,Foreign and Defense Policy,0.077,0.5,-0.194,-0.278,0.704,0.883,-111.2,0.77
2017-01-23 13:12:32,RH1060323,106,House,323,1999-07-21,,287,136,Stearns of Florida Amendment,,,Foreign Policy Resolutions,Regulation Special Interest,Foreign and Defense Policy,-0.288,0.27,-0.205,0.019,0.603,0.872,-121.31,0.751
2017-01-23 13:12:32,RH1060324,106,House,324,1999-07-21,,189,234,Waters of California Amendment,Human Rights,,Foreign Policy Resolutions,,Foreign and Defense Policy,-0.151,0.525,0.181,0.135,0.81,0.915,-109.372,0.772
2017-01-23 13:12:32,RH1060325,106,House,325,1999-07-21,,427,0,Bilbray of California Amendment,Pollution and Environmental Protection,,Foreign Policy Resolutions,Domestic Social Policy,Foreign and Defense Policy,0.0,0.0,0.0,0.0,,,0.0,
2017-01-23 13:12:32,RH1060326,106,House,326,1999-07-21,,427,0,Doggett of Texas Amendment,Iran,,Foreign Policy Budget,Foreign Policy Resolutions,Foreign and Defense Policy,0.0,0.0,0.0,0.0,,,0.0,
2017-01-23 13:12:32,RH1060327,106,House,327,1999-07-21,,424,0,Engel of New York Amendment,,,Foreign Policy Resolutions,,Foreign and Defense Policy,0.0,0.0,0.0,0.0,,,0.0,
2017-01-23 13:12:32,RH1060328,106,House,328,1999-07-22,,219,208,Providing for consideration of H.R. 2488; Financial Freedom Act of 1999,Tax rates,,Budget General Interest,,Government Management,0.123,0.257,-0.744,0.581,0.99,0.995,-7.618,0.982
2017-01-23 13:12:32,RH1060329,106,House,329,1999-07-22,,173,258,Rangel of New York Substitute Amendment,Tax rates,,Budget General Interest,,Government Management,-0.163,-0.181,0.205,0.042,0.809,0.923,-90.55,0.811
2017-01-23 13:12:32,RH1060330,106,House,330,1999-07-22,,211,220,Financial Freedom Act of 1999,Tax rates,,Budget General Interest,,Government Management,0.081,0.091,0.457,-0.523,0.995,0.998,-7.035,0.984
2017-01-23 13:12:32,RH1060331,106,House,331,1999-07-22,,223,209,Financial Freedom Act of 1999,Tax rates,,Budget General Interest,,Government Management,0.011,0.008,-0.32,-0.049,0.962,0.981,-27.853,0.938
2017-01-23 13:12:32,RH1060332,106,House,332,1999-07-22,,379,45,Department of Defense Appropriations for F.Y. 2000,,,Defense Policy Budget,,Foreign and Defense Policy,-0.717,0.3,-0.302,-0.64,0.2,0.915,-83.068,0.822
2017-01-23 13:12:32,RH1060333,106,House,333,1999-07-26,,192,217,Hoeffel of Pennsylvania Amendment,,,Budget Special Interest,Regulation Special Interest,Government Management,-0.114,0.209,0.199,0.392,0.839,0.924,-90.555,0.801
2017-01-23 13:12:32,RH1060334,106,House,334,1999-07-26,,254,158,Regulatory Right-to-Know Act of 1999,,,Budget Special Interest,Regulation Special Interest,Government Management,-0.25,0.234,-0.226,-0.261,0.766,0.91,-88.775,0.806
2017-01-23 13:12:32,RH1060335,106,House,335,1999-07-27,,352,53,JOURNAL QUESTION: ON APPROVING THE JOURNAL,,,Internal Organization,,Miscellaneous Policy,-0.708,-0.304,-0.173,0.304,0.075,0.879,-139.045,0.709
2017-01-23 13:12:32,RH1060336,106,House,336,1999-07-27,,170,260,Disapprove Normal Trade Relations with China,Tariffs,Communists/Communism/Unamerican Activities,Foreign Policy Resolutions,,Foreign and Defense Policy,-0.571,-0.821,0.064,-0.07,0.188,0.679,-272.838,0.53
2017-01-23 13:12:32,RH1060337,106,House,337,1999-07-27,,227,201,"Providing for consideration of H.R. 2587; District of Columbia Appropriations Act, 2000",,,Budget Special Interest,D. C.,Government Management,-0.093,-0.042,-0.34,0.228,0.96,0.981,-25.003,0.943
2017-01-23 13:12:32,RH1060338,106,House,338,1999-07-27,,426,1,Boehlert of New York Amendment,Pollution and Environmental Protection,,Budget Special Interest,,Government Management,0.0,0.0,0.0,0.0,,,0.0,
2017-01-23 13:12:32,RH1060339,106,House,339,1999-07-27,,183,245,Visclosky of Indiana Amendment,Pollution and Environmental Protection,,Budget Special Interest,,Government Management,-0.05,-0.175,0.271,0.401,0.88,0.949,-60.545,0.868
2017-01-23 13:12:32,RH1060340,106,House,340,1999-07-27,,420,8,"Energy and Water Appropriations Act, 2000",,,Budget Special Interest,,Government Management,0.0,0.0,0.0,0.0,,,0.0,
2017-01-23 13:12:32,RH1060341,106,House,341,1999-07-29,,412,8,"Military Construction Appropriations Act, FY 2000",,,Defense Policy Budget,,Foreign and Defense Policy,0.0,0.0,0.0,0.0,,,0.0,
2017-01-23 13:12:32,RH1060342,106,House,342,1999-07-29,,241,187,Tiahrt of Kansas Amendment,Narcotics,,Domestic Social Policy,D. C.,Social Welfare,-0.054,-0.05,-0.192,-0.439,0.791,0.909,-97.765,0.796
2017-01-23 13:12:32,RH1060343,106,House,343,1999-07-29,,214,214,Norton of the District of Columbia Amendment,Voting Rights,,D. C.,,Government Management,-0.038,0.777,0.234,0.114,0.893,0.946,-72.601,0.844
2017-01-23 13:12:32,RH1060344,106,House,344,1999-07-29,,213,215,Largent of Oklahoma Amendment,Homosexuality,,D. C.,,Government Management,-0.15,0.337,-0.237,-0.74,0.803,0.902,-95.889,0.799
2017-01-23 13:12:32,RH1060345,106,House,345,1999-07-29,,333,92,"District of Columbia Appropriations Act, 2000",,,Budget Special Interest,D. C.,Government Management,0.867,-0.492,0.11,0.113,-0.022,0.779,-209.47,0.611
