date_generated,id,congress,chamber,rollnumber,date,keyvote,yea,nay,description,Issue1,Issue2,Peltzman1,Peltzman2,Clausen1,slope,intercept,mid.dim1,mid.dim2,spread.dim1,spread.dim2,pre,classified,log_likelihood,vote_result
2016-10-18 10:30:10,RS0500018,50,Senate,18,1888-01-26,,55,6,"TO PASS S. 574, A BILL INCREASING THE PENSION OF MRS. APPOLINE A. BLAIR, WIDOW OF FRANCIS P. BLAIR, JR., MAJOR GENERAL OF U.S. VOLUNTEER IN THE WAR FOR THE UNION, $30 A MONTH, PUTTING HER ON THE SAME BASIS AS THE WIDOW OF GENERAL LOGAN, WHO WAS GRANTED APENSION OF $2,000, ANNUALLY DURING HER NATURAL LIFE.",Military Pensions/Veterans Benefits,,Defense Policy Budget,,Foreign and Defense Policy,-22.069317681489967,-12.352817901634383,-0.56,0.006,-0.725,-0.19,0.167,0.918,-8.260833,
2016-10-18 10:30:10,RS0500019,50,Senate,19,1888-01-26,,31,18,"TO PROVIDE THAT WHEN THE SENATE ADJOURNS TODAY IT DO SO UNTIL MONDAY NEXT, JANUARY 30.",,,Internal Organization,,Miscellaneous Policy,0.19365010896627585,0.3307136078766131,-0.99,0.139,-0.015,0.448,-0.111,0.592,-29.835333,
2016-10-18 10:30:10,RS0500020,50,Senate,20,1888-01-30,,15,42,"TO CONSIDER A TREATY BETWEEN THE U.S. AND GREAT BRITAIN CONCERNING EXTRADITION OF CRIMINALS, SIGNED AT LONDON, JUNE 25, 1886.",Treaties,,Foreign Policy Resolutions,,Foreign and Defense Policy,-3.706049464022554,1.119675968611841,0.525,-0.826,-0.132,-0.206,0.0,0.737,-29.537055,
2016-10-18 10:30:10,RS0500021,50,Senate,21,1888-01-31,,31,13,"TO ADJOURN, WHILE CONSIDERING CERTAIN NOMINATIONS.",,,Internal Organization,,Miscellaneous Policy,6.800209402212917,-1.607677897623205,0.372,0.922,0.194,-0.165,0.462,0.841,-16.257404,
2016-10-18 10:30:10,RS0500022,50,Senate,22,1888-02-02,,38,25,"TO PROVIDE THAT WHEN SENATE ADJOURNS TODAY IT DO SO TO MEET ON MONDAY NEXT, FEBRUARY 6.",,,Internal Organization,,Miscellaneous Policy,-9.800129958945162,1.6036340492436323,0.262,-0.964,0.061,0.036,0.08,0.635,-39.633682,
2016-10-18 10:30:10,RS0500023,50,Senate,23,1888-02-08,,27,25,"TO POSTPONE UNTIL THE FIRST MONDAY IN DECEMBER THE CONSIDERATION OF A TREATY BETWEEN THE U.S. AND BRITAIN CONCERNING THE EXTRADITION OF PRISONERS CHARGED WITH CRIME SIGNED AT LONDON JUNE 25, 1886.",Treaties,,Foreign Policy Resolutions,,Foreign and Defense Policy,-1.0592210611364672,-0.4836475233503193,-0.889,0.458,-0.063,-0.344,0.28,0.654,-33.511022,
2016-10-18 10:30:10,RS0500024,50,Senate,24,1888-02-08,,44,9,"TO PROCEED TO CONSIDERATION OF EXECUTIVE BUSINESS, THUS LAYING ASIDE THE S. 371, A BILL, TO AID IN THE ESTABLISHMENT AND TEMPORARY SUPPORT OF THE COMMON SCHOOLS.",Education,,Budget Special Interest,Government Organization,Social Welfare,-5.893500025113733,2.186317009593446,0.382,-0.065,0.161,0.158,0.111,0.849,-18.997815,
2016-10-18 10:30:10,RS0500025,50,Senate,25,1888-02-15,,23,49,"TO AMEND S. 371, BY ELIMINATING SEC. 2 AND INSERTING THAT SUCH MONEY BE DIVIDED ANNUALLY AMONG THE STATES, TERRITORIES AND THE DISTRICT OF COLUMBIA, ACCORDING TO THE POPULATION, RESPECTIVELY, BETWEEN THE AGES OF TEN AND 21 YEARS, BY THE 1880 CENSUS.",Education,,Budget Special Interest,Government Organization,Social Welfare,-3.855788836306293,1.2707610073777467,0.071,0.997,-0.062,-0.093,-0.13,0.639,-41.701611,
2016-10-18 10:30:10,RS0500026,50,Senate,26,1888-02-15,,26,45,"TO AMEND, S. 371, BY STRIKING OUT THAT SECTION OF THE BILL WHICH REQUIRES A REPORT FROM THE GOVERNOR OF A STATE OR TERRITORY, GIVING DETAILS OF THEIR SCHOOL SYSTEM.",Education,,Budget Special Interest,Government Organization,Social Welfare,-5.297444396783645,-2.0106602009655057,-0.446,0.352,0.207,0.226,0.5,0.817,-23.352833,
2016-10-18 10:30:10,RS0500027,50,Senate,27,1888-02-15,,24,45,"TO AMEND S. 371, BY ELIMINATING THAT SECTION OF THE BILL WHICH REQUIRES A STATEMENT FROM THE GOVERNOR OF ANY STATE OR TERRITORY REGARDING THE DISBURSEMENTS OF SCHOOL FUNDS BEFORE THEY COULD RECEIVE A SECOND OR SUBSEQUENT ALLOTMENT.",Education,,Budget Special Interest,Government Organization,Social Welfare,-5.003695436428013,-1.9894596973890653,-0.395,-0.013,0.34,0.393,0.667,0.884,-16.174628,
2016-10-18 10:30:10,RS0500028,50,Senate,28,1888-02-15,,42,33,TO PASS S. 371.,Education,,Budget Special Interest,Government Organization,Social Welfare,-2.246554652558625,-0.9600843868225957,-0.556,0.289,-0.047,-0.121,0.182,0.64,-48.942599,
2016-10-18 10:30:10,RS0500029,50,Senate,29,1888-02-20,,30,15,"TO PROCEED TO THE CONSIDERATION OF S. 931, INCORPORATING THE WASHINGTON CABLE ELECTRIC RAILWAY OF THE DISTRICT OF COLUMBIA.",,,Budget Special Interest,D. C.,Government Management,-2.407687146652798,-0.9783308156801248,0.009,-1.0,-0.092,-0.221,-0.133,0.622,-22.336282,
2016-10-18 10:30:10,RS0500030,50,Senate,30,1888-02-20,,25,22,"TO AMEND S. 931, BY ELIMINATING THE CLAUSE ""ALONG NEW YORK AVENUE TO 14TH STREET,"" AND IN LINE 38 AFTER THE WORK ""ALONG"" TO STRIKE OUT ""FOURTEENTH"" AND INSERT ""FIFTEENTH,"" SO AS TO READ ""ALONG FIFTEENTH STREET TO G STREET,"" THEREBY CHANGING THE ROUTE.",,,Budget Special Interest,D. C.,Government Management,-2.0649556619437215,-0.16008333909119876,-0.263,0.383,-0.457,-1.28,0.909,0.957,-6.508539,
2016-10-18 10:30:10,RS0500031,50,Senate,31,1888-02-20,,29,17,"TO AMEND S. 931, BY PROVIDING THAT THE RAILS USED BY THE COMPANY BE OF AMERICAN MANUFACTURE.",,,Budget Special Interest,D. C.,Government Management,4.678194429872888,1.1041230520292389,-0.242,-0.028,-0.639,0.79,0.941,0.978,-2.220498,
2016-10-18 10:30:10,RS0500032,50,Senate,32,1888-02-21,,24,22,"TO AMEND S. 931, BY PROVIDING THAT THE COMPANY SHALL PAY TO THE DISTRICT OF COLUMBIA AS TAXES TEN PER CENT OF ITS GROSS EARNINGS PER YEAR.",Tax rates,,Budget Special Interest,D. C.,Government Management,-2.4340242176682922,-0.2299443874826927,-0.016,-0.191,0.529,1.257,1.0,1.0,-1.060043,
2016-10-18 10:30:10,RS0500033,50,Senate,33,1888-02-21,,23,25,"TO AMEND S. 931, BY PROVIDING THAT THE COMPANY SHALL PAY TO THE DISTRICT OF COLUMBIA AS TAXES FOR EACH YEAR TEN PER CENT OF THE GROSS EARNINGS OF THE PRECEDING YR., NO QUORUM VOTING.",Tax rates,,Budget Special Interest,D. C.,Government Management,-6.366753761413073,-0.698976159994025,-0.109,-0.005,0.677,0.615,1.0,1.0,-0.075989,
2016-10-18 10:30:10,RS0500034,50,Senate,34,1888-02-21,,24,16,"TO AMEND S. 931, BY CHANGING THE ROUTE OF THE COMPANY. NO QUORUM VOTING.",,,Budget Special Interest,D. C.,Government Management,-2.1202656616131135,-0.1074916532565241,-0.345,0.624,0.338,0.922,0.937,0.975,-5.130972,
2016-10-18 10:30:10,RS0500035,50,Senate,35,1888-02-21,,23,19,"TO AMEND S. 931, BY CHANGING THE ROUTE OF THE COMPANY.",,,Budget Special Interest,D. C.,Government Management,-2.318908242978256,-0.11050332190726114,0.058,-0.245,0.512,1.277,0.947,0.976,-1.688163,
2016-10-18 10:30:10,RS0500036,50,Senate,36,1888-02-21,,22,23,TO RECOMMIT S. 931.,,,Budget Special Interest,D. C.,Government Management,-3.07899630456609,-0.5005185838785577,0.158,-0.987,0.255,0.479,0.909,0.956,-7.796903,
2016-10-18 10:30:10,RS0500037,50,Senate,37,1888-02-23,,16,24,"TO AMEND S. 931, BY STRIKING OUT IN SECTION ONE LINES THREE, FOUR, FIVE, SIX AND SEVEN TO THE WORD ""BE"" IN THE SEVENTH LINE, AND TO INSERT IN LIEN THEREOF, ""THAT SUCH PERSONS, NOT EXCEEDING 13 IN NUMBER, UNDER RULES AND REGULATIONS TO BE PRESCRIBED BY TH COMMISSIONERS OF THE DISTRICT OF COLUMBIA AND THE SECRETARY OF THE INTERIOR, BE THE HIGHEST AND BEST BIDDERS FOR THE PRIVILEGES AND FRANCHISE HEREINAFTER GRANTED; NO QUORUM VOTING.",,,Budget Special Interest,D. C.,Government Management,3.4796143156910446,0.8563358130566672,0.041,0.999,0.148,-0.246,0.375,0.75,-15.868398,
2016-10-18 10:30:10,RS0500038,50,Senate,38,1888-02-23,,17,28,"TO AMEND S. 931 BY STRIKING OUT IN SECTION ONE LINES THREE, FOUR, FIVE, SIX AND SEVEN TO THE WORD ""BE"" IN THE SEVENTH LINE AND TO INSERT IN LIEN THEREOF, ""THAT SUCH PERSONS, NOT EXCEEDING 13 IN NUMBER, UNDER RULES AND REGULATIONS TO BE PRESCRIBED BY THE OMMISSIONERS OF THE DISTRICT OF COLUMBIA AND THE SECRETARY OF THE INTERIOR, BE THE HIGHEST AND BEST BIDDERS FOR THE PRIVILEGES AND FRANCHISE HEREINAFTER GRANTED.",,,Budget Special Interest,D. C.,Government Management,183.92112749181015,64.72984251457622,-0.357,-0.93,0.159,-0.005,0.529,0.822,-18.517342,
2016-10-18 10:30:10,RS0500039,50,Senate,39,1888-02-23,,16,20,"TO AMEND S. 931, BY PROVIDING THAT THE COMPANY SHALL REPORT TO THE COMMISSION OF THE DISTRICT OF COLUMBIA ALL DETAILS REGARDING ITS BUSINESS, SUCH AS STOCKHOLDERS, INCOME, ETC; NO QUORUM VOTING.",,,Budget Special Interest,D. C.,Government Management,-1.9541600096811185,-0.08825304163610903,-0.169,0.242,-0.372,-1.101,0.937,0.972,-4.611695,
2016-10-18 10:30:10,RS0500040,50,Senate,40,1888-02-23,,19,23,"TO AMEND S. 931, BY PROVIDING THAT THE COMPANY SHALL REPORT TO THE COMMISSION OF THE DISTRICT OF COLUMBIA ALL DETAILS REGARDING ITS BUSINESS, SUCH AS STOCKHOLDERS, INCOME, ETC.",,,Budget Special Interest,D. C.,Government Management,-1.8389395582551404,-0.11374002168967853,-0.132,0.129,-0.379,-1.192,0.895,0.952,-6.278905,
2016-10-18 10:30:10,RS0500041,50,Senate,41,1888-02-23,,41,3,"TO AMEND S. 931, BY PROVIDING THAT THE COMPANY SHALL PAY IN TAXES FOUR PER CENT OF THEIR GROSS RECEIPTS OF THE PRECEDING YEAR FOR FOUR YEARS; FOR THE NEXT FOUR YEARS SIX PER CENT AND THEREAFTER EIGHT PER CENT PER ANNUM.",Tax rates,,Budget Special Interest,D. C.,Government Management,1.923502859114073,2.0311148362411604,-0.992,0.123,-0.146,0.439,0.0,0.932,-10.124722,
2016-10-18 10:30:10,RS0500042,50,Senate,42,1888-02-27,,23,23,"TO AMEND S. 1305, (25 STAT L. 673), A BILL TO INCORPORATE THE MARITIME CANAL COMPANY OF NICARAGUA, BY ADDING, AS SECTION FIVE, A PROVISION TO PREVENT THE U.S. FROM BEING INVOLVED IN ANY MANNER IN ANY PECUNIARY OBLIGATIONS, EXCEPT THE PAYMENT OF TOLLS PROIDED IN THIS ACT.",Panama Canal,Treaties,Foreign Policy Resolutions,,Foreign and Defense Policy,9.328521378160385,2.473971550019389,-0.283,-0.166,0.7,-0.434,0.87,0.935,-24.905721,
2016-10-18 10:30:10,RS0500043,50,Senate,43,1888-02-27,,20,26,"TO AMEND S. 1305, BY PROVIDING THAT NO PART OF THE CAPITAL STOCKS PAID IN SHALL BE, AT ANY TIME, WITHDRAWN OR RETURNED TO THE STOCKHOLDERS OR IN ANY MANNER DIVERTED FROM THE PROP- ER USES OF THE CORP. UNLESS FOR THE PURPOSE OF WITHDRAWING FROM OR WINDINGUP ITS BUSINESS, AND THAT ANY PERSON VIOLATING THIS PROVISION SHALL BE PUNISHED BY A FINE NOT EXCEEDING $10,000 OR IMPRISONMENT FOR A PERIOD NOT EXCEEDING FIVE YEARS, OR BOTH, AT THE DESCRETION OF THE COURT.",Banking and Finance,Treaties,Foreign Policy Resolutions,,Foreign and Defense Policy,-36.573291167905275,-8.580628994823277,-0.261,0.965,0.215,0.034,0.8,0.913,-10.299541,
2016-10-18 10:30:10,RS0500044,50,Senate,44,1888-02-27,,19,26,"TO AMEND S. 1305, BY INSERTING AT THE END OF SECTION THREE, A CLAUSE STATING THAT IF STOCK TO THE AMOUNT OF $10,000,000 SHALL NOT BE SUBSCRIBED AND TEN PER CENT THEREOF ACTUALLY PAID IN BEFORE THE EXPIRATION OF TWO YEARS FROM THE PASSAGE OF THIS ACT, OR F THE CONSTRUCTION OF THE CANAL HAS NOT ACTUALLY COMMENCED, THEN THE FRANCHISE SHALL BE DEEMED TO CEASED.",Banking and Finance,Treaties,Foreign Policy Resolutions,,Foreign and Defense Policy,3.3484481999502016,0.8146682792021911,0.044,0.962,0.396,-0.684,0.842,0.933,-7.159162,
2016-10-18 10:30:10,RS0500045,50,Senate,45,1888-02-27,,11,33,TO AMEND S. 1305 BY PROVIDING THAT ALL LABORERS EMPLOYED IN SUCH WORK SHALL EITHER BE NATIVE OR NATURALIZED CITIZENS OF THE U.S.,Panama Canal,Treaties,Foreign Policy Resolutions,Government Organization,Social Welfare,-99.47935197670236,-48.51360959684043,-0.479,-0.863,0.258,0.015,0.182,0.795,-13.664718,
2016-10-18 10:30:10,RS0500046,50,Senate,46,1888-02-27,,24,26,"TO AMEND S. 1305, BY STIPULATING THAT THE U.S. SHALL NOT BECOME INVOLVED IN ANY MANNER IN ANY OBLIGATIONS EXCEPT IN THE PAYMENT OF TOLLS PROVIDED IN THIS ACT.",Panama Canal,Treaties,Foreign Policy Resolutions,,Foreign and Defense Policy,6.149160869275201,1.4193952521031492,-0.244,-0.081,0.673,-0.633,0.917,0.96,-2.901419,
2016-10-18 10:30:10,RS0500047,50,Senate,47,1888-02-27,,39,15,TO PASS S. 1305.,Panama Canal,Treaties,Foreign Policy Resolutions,,Foreign and Defense Policy,3.120144913589961,1.100382171779264,-0.153,0.623,-0.164,0.304,0.267,0.796,-16.627345,
2016-10-18 10:30:10,RS0500048,50,Senate,48,1888-02-27,,32,25,"TO AMEND S. 181, A BILL GRANTING PENSIONS TO EX-SOLDIERS AND SAILORS WHO ARE INCAPACITATED FOR THE PERFORMANCE OF MANUAL LABOR, AND PROVIDING FOR PENSIONS TO DEPENDENT RELATIVES OF DECEASED SOLDIERS AND SAILORS, BY INSERTING A PROVISO GRANTING PENSIONS T DEPENDENT RELATIVES OF DECEASED SOLDIERS AND SAILORS WHO ARE WITHOUT ADEQUATE MEANS OF SUPPORT.",Military Pensions/Veterans Benefits,,Defense Policy Budget,Domestic Social Policy,Foreign and Defense Policy,-6.296051590815456,-2.0201640688272127,-0.389,0.429,-0.725,-0.666,0.88,0.947,-4.735067,
2016-10-18 10:30:10,RS0500049,50,Senate,49,1888-02-27,,29,26,"TO AMEND S. 181, BY PROVIDING THAT A PENSION OF $12 PER MONTH BE GIVEN TO PERSONS SERVING THREE MONTHS OR MORE, AND WHO WERE INCAPACITATED THROUGH PARTICIPATION IN SAID WAR.",Military Pensions/Veterans Benefits,,Defense Policy Budget,Domestic Social Policy,Foreign and Defense Policy,-8.973786574183704,-0.6237417555608178,-0.048,-0.193,-0.692,-0.446,1.0,1.0,-0.016711,
2016-10-18 10:30:10,RS0500050,50,Senate,50,1888-02-27,,28,26,"TO AMEND S. 181, BY PROVIDING THAT SUCH PENSIONS SHALL COMMENCE FROM THE DATE OF THE FILING OF THE APPLICATION IN THE PENSION OFFICE, AFTER PASSAGE OF THIS ACT AND UPON PROOF THAT THE DISABILITY THEN EXISTED AND SHALL CONTINUE DURING THE EXISTENCE OF THEPENSIONER.",Military Pensions/Veterans Benefits,,Defense Policy Budget,Domestic Social Policy,Foreign and Defense Policy,-9.452627697816968,-0.5828419694235939,-0.035,-0.252,-0.742,-0.454,1.0,1.0,-0.015841,
2016-10-18 10:30:10,RS0500051,50,Senate,51,1888-03-07,,34,20,"TO AMEND H. R. 6437, A BILL PROVIDING FOR CERTAIN OF THE MOST URGENT DEFICIENCIES IN THE APPROPRIATIONS FOR THE SERVICE OF THE GOVERNMENT FOR FISCAL YEAR ENDING JUNE 30, 1888, BY ELIMINATING THE CLAUSE IN SECTION ONE, ""THAT THE PUBLIC PRINTER IS HEREBY DRECTED TO RIGIDLY ENFORCE THE PROVISIONS OF THE EIGHT HOUR LAW IN THE DEPARTMENT UNDER HIS CHARGE.""",Workplace conditions/8 hour day,,Domestic Social Policy,,Social Welfare,-1.5469135791314004,-0.02499012283879587,-0.554,0.832,0.157,0.587,0.55,0.833,-20.899376,
2016-10-18 10:30:10,RS0500052,50,Senate,52,1888-03-07,,25,26,"TO AMEND H. R. 6437, BY APPROPRIATING THE SUM OF $60,000 FOR THE PAY OF ASSISTANT CUSTODIANS AND JANITORS OF THE U.S. PUBLIC BUILDINGS FOR THE FIISCAL YEAR.",Public Works,,Budget Special Interest,,Government Management,-4.526981707811462,-0.6303144816672716,0.081,-0.997,0.317,0.405,0.96,0.98,-4.562536,
2016-10-18 10:30:10,RS0500053,50,Senate,53,1888-03-07,,25,30,"STO AMEND H. R. 6437, BY STIPULATING THAT THE SUM OF $60,000 BE APPROPRIATED FOR THE PAY OF ASSISTANT CUSTODIANS AND JANITORS OF U.S. PUBLIC BUILDINGS FOR THE CURRENT FISCAL YEAR.",Public Works,,Budget Special Interest,,Government Management,-3.8129467381251114,-0.5430722849012368,0.118,-0.993,0.356,0.54,0.96,0.982,-4.721946,
2016-10-18 10:30:10,RS0500054,50,Senate,54,1888-03-08,,44,17,TO PROVIDE THAT WHEN THE SENATE ADJOURNS TODAY IT DO SO UNTIL MONDAY.,,,Internal Organization,,Miscellaneous Policy,2.616428138922127,-1.2340949606419136,0.091,-0.996,0.057,-0.126,0.0,0.721,-33.607131,
2016-10-18 10:30:10,RS0500055,50,Senate,55,1888-03-08,,13,47,"TO AMEND S. 181, BY INSERTING A CLAUSE TO INCLUDE THE PAYMENT OF $12 PER MONTH PENSION TO THOSE EX-SOLDIERS AND SAILORS SUFFERING FROM INFIRMITIES DUE TO OLD AGE.",Military Pensions/Veterans Benefits,,Defense Policy Budget,Domestic Social Policy,Foreign and Defense Policy,-5.97253821787036,1.787519019417405,0.236,0.378,-0.253,-0.245,0.231,0.833,-17.790428,
2016-10-18 10:30:10,RS0500056,50,Senate,56,1888-03-08,,21,37,"TO AMEND S. 181, BY INCLUDING ON THE PENSION LIST AT $12 PER MONTH ALL PERSONS WHO SERVED THREE MONTHS OR MORE IN THE WAR WITH MEXICO, OR THIRTY DAYS IN ANY OF THE WARS WITH INDIAN TRIBES.",Military Pensions/Veterans Benefits,,Defense Policy Budget,Domestic Social Policy,Foreign and Defense Policy,2.3563153999649566,0.688791480791169,-0.252,0.095,0.11,-0.27,0.429,0.793,-22.943671,
2016-10-18 10:30:10,RS0500057,50,Senate,57,1888-03-08,,16,47,"TO AMEND S. 181, BY MAKING THOSE PERSONS ELIGIBLE FOR PENSIONS WHO HAVE BEEN HONORABLY DISCHARGED FROM THE U.S. ARMY WHO ARE NOW OR MAY HEREAFTER SUFFER FROM MENTAL OR PHYSICAL DISABILITIES, NOT THE RESULT OF THEIR OWN HABITS, WHICH INCAPACITATED THEM FRM THE PERFORMANCE OF MANUAL LABOR.",Military Pensions/Veterans Benefits,,Defense Policy Budget,Domestic Social Policy,Foreign and Defense Policy,-10.259751164432394,2.897301274806045,0.236,0.476,-0.204,-0.115,0.125,0.778,-22.016378,
2016-10-18 10:30:10,RS0500058,50,Senate,58,1888-03-08,,49,19,TO PASS S. 181.,Military Pensions/Veterans Benefits,,Defense Policy Budget,Domestic Social Policy,Foreign and Defense Policy,102.13138234703985,45.02493961504457,-0.441,-0.015,-0.724,0.041,0.684,0.912,-12.183794,
2016-10-18 10:30:10,RS0500059,50,Senate,59,1888-03-13,,26,31,"TO AMEND A RESOLUTION, CALLING FOR THE APPOINTMENT OF A SELECT COMMITTEE OF SEVEN SENATORS TO EXAMINE INTO THE PRESENT CONDITION OF THE CIVIL SERVICE BY INCLUDING THE WRITTEN MESSAGES OF THE PRESIDENT AND POSTMASTER GENERAL AS THEY RELATE TO  PROHIBITINGGOVERNMENTAL EMPLOYEES FROM BEING ASSOCIATED OR AFFILIATED WITH ANY POLITICAL PARTY IN AN OFFICAL SENSE.",Civil Service and Patronage,,Internal Organization,,Miscellaneous Policy,-20.63045779425738,-1.5296975391291054,-0.082,0.162,0.692,0.194,1.0,1.0,-0.006069,
2016-10-18 10:30:10,RS0500060,50,Senate,60,1888-03-16,,6,49,"TO AMEND S. 977, A BILL REGULATING THE IMPORTATION OF FOREIGN MERCHANDISE AND TO SECURE UNIFORMITY IN THE CLASSIFICATION AND VALUATION THEREOF, BY DECLARING THE FINDINGS OF THE BOARD OF APPRAISERS NOT CONCLUSIVE, BUT SUBJECT TO JUDICIAL REVIEW.",Tariffs,,Foreign Policy Resolutions,Regulation Special Interest,Foreign and Defense Policy,-1.1091995282524953,-1.156311112254964,-0.186,-0.95,0.084,0.438,0.333,0.927,-14.983618,
2016-10-18 10:30:10,RS0500061,50,Senate,61,1888-03-19,,34,21,"TO PASS S. 406, A BILL APPROPRIATING THE SUM OF $100,000 FOR THE ERECTION OF A MONUMENT IN THE GOVERNMENT RESERVATION BETWEEN HOWARD UNIVERSITY AND THE FREEDMEN'S HOSPITAL, IN THE DISTRICT OF COLUMBIA, TO THE NEGRO SOLDIERS WHO GAVE THEIR LIVES FOR THE PESERVATION OF THE UNION.",Nullification/Secession/Reconstruction,,Budget Special Interest,D. C.,Government Management,5.698252187185297,1.506363421465886,-0.307,-0.243,-0.667,0.677,1.0,1.0,-1.748491,
2016-10-18 10:30:10,RS0500062,50,Senate,62,1888-03-20,,47,5,"TO CONSIDER S. 1226, A BILL RELATING TO JOHN N. QUACKENBUSH, CONCERNING THE GRADE OF COMMANDER IN THE NAVY, AND TO CORRECT AN ERROR IN RELATION TO AN APPOINTMENT THEREIN.",,,Defense Policy Resolutions,,Foreign and Defense Policy,-4.973967598835117,3.6879245238121783,0.848,-0.53,0.172,0.2,0.0,0.904,-14.360109,
2016-10-18 10:30:10,RS0500063,50,Senate,63,1888-03-20,,43,14,"TO PASS S. 1226, A BILL RELATING TO JOHN N. QUACKENBUSH, CONCERNING THE GRADE OF COMMANDER IN THE NAVY AND TO CORRECT AN ERROR IN RELATION TO AN AAPPOINTMENT THEREIN.",,,Defense Policy Resolutions,,Foreign and Defense Policy,2.0451312408786753,1.1971810297833594,-0.846,-0.533,-0.157,0.444,0.214,0.807,-25.85141,
2016-10-18 10:30:10,RS0500064,50,Senate,64,1888-03-26,,26,25,"TO TABLE AN AMENDMENT TO H.R. 5034, A BILL PROVIDING FOR THE PURCHASE OF U.S. BONDS BY THE SECRETARY OF THE TREASURY. THE AMENDMENT AUTHORIZES THE SECRETARY OF THE TREASURY TO ISSUE TREASURY NOTES IN EQUIVALENT AMOUNT TO ANY NATIONAL BANK'S SURRENDERED CRCULATION, PROVIDED NO OTHER NATIONAL BANK TAKES THEM UP WITHIN 30 DAYS, SAID ISSUED TREASURY NOTES TO BE KEPT IN THE TREASURY UNTIL PAID OUT FOR GOVERNMENT DEBTS.",Banking and Finance,U.S. Currency,Budget Special Interest,,Government Management,0.07541885254388837,-0.09300275002588596,0.305,-0.07,-0.016,1.227,0.6,0.804,-19.02935,
2016-10-18 10:30:10,RS0500065,50,Senate,65,1888-03-26,,28,28,"TO TABLE THE AMENDMENT TO H. R. 5034, WHICH PROVIDES THAT THE TREASURY NOTES TO BE ISSUED ARE RECEIVABLE FOR GOVERNMENT DUES AND LGAL TENDER ONLY BETWEEN NATIONAL BANKS; AND MAINTAINS THE PRESENT VOLUME OF PAPER MONEY OUTSTANDING, EXCLUSIVE OF GOLD OR SIVER CERTIFICATES.",Banking and Finance,U.S. Currency,Budget Special Interest,,Government Management,0.5315885344172279,-0.07191247248669727,0.203,0.036,-0.075,0.816,0.679,0.839,-21.203917,
2016-10-18 10:30:10,RS0500066,50,Senate,66,1888-03-26,,32,26,"TO AMEND H. R. 5034, BY STIPULATING THAT THE VOLUME OF PAPER MONEY OUTSTANDING (EXCLUSIVE OF GOLD AND SILVER CERTIFICATES) SHALL REMAIN AS NOW EXISTING.",Banking and Finance,U.S. Currency,Budget Special Interest,,Government Management,0.278731723106479,-0.17305414815724507,0.115,-0.141,0.052,-1.079,0.731,0.879,-18.363448,
2016-10-18 10:30:10,RS0500067,50,Senate,67,1888-03-29,,33,14,"TO PASS S. 71, A BILL RELATING TO THE CLAIM OF REAR ADMIRAL SAMUEL P. CARTER OF THE U.S. NAVY FOR PAY AND COMPENSATION OF A REAR ADMIRAL ON THE RETIRED LIST.",Military Pensions/Veterans Benefits,,Defense Policy Budget,,Foreign and Defense Policy,-2.082125971605398,-1.0626186513127132,-0.799,0.601,-0.18,-0.5,-0.143,0.66,-25.035172,
2016-10-18 10:30:10,RS0500068,50,Senate,68,1888-04-02,,4,45,"TO AMEND H. R. 2927, A BILL AUTHORIZING THE CONSTRUCTION OF A BRIDGE ACROSS THE MISSISSIPPI RIVER AT MEMPHIS, TENNESEE, BY INCREASING THE MAIN CHANNEL SPAN FROM 700 FEET TO NO LESS THAN 1000 FEET IN LENGTH, SO AS NOT TO BE AN OBSTRUCTION TO RIVER TRAFFIC.",Public Works,,Budget Special Interest,,Government Management,0.6176043676244376,0.8564791264751125,0.2,0.98,0.085,-0.796,0.0,0.918,-10.399611,
2016-10-18 10:30:10,RS0500069,50,Senate,69,1888-04-02,,33,11,"TO AMEND H. R. 2927, A BILL AUTHORIZING THE CONSTRUCTION OF A BRIDGE ACROSS THE MISSISSIPPI RIVER AT MEMPHIS, TENNESEE, BY STIPULATING THAT SAID BRIDGE SHOULD PROVIDE FOR THE PASSAGE OF RAILWAY TRAINS, WAGONS AND VEHICLES OF ALL KINDS AND FOR FOOT PASSENERS AND TRANSIT OF ANIMALS AT TOLL RATES APPROVED BY THE SECRETARY OF WAR.",Tax rates,Public Works,Budget Special Interest,,Government Management,-2.8101511857825523,0.8468721383393073,-0.052,0.993,0.086,0.177,0.091,0.773,-20.452103,
2016-10-18 10:30:10,RS0500070,50,Senate,70,1888-04-03,,41,8,"TO REFER A RESOLUTION TO COMMITTEE ON FOREIGN RELATIONS, PROVIDING THAT AS MUCH OF RULES 36-38 AS PROVIDE FOR EXECUTIVE SESSIONS, BE SUSPENDED DURING CONSIDERATION OF THE FISHERIES TREATY, WHEN THE SAME SHALL BE REPORTED BY THE SENATE.",Fish and Wildlife,Treaties,Foreign Policy Resolutions,,Foreign and Defense Policy,-3.736691111632739,1.1922907245310346,0.166,0.572,0.502,0.777,0.125,0.857,-11.314208,
2016-10-18 10:30:10,RS0500071,50,Senate,71,1888-04-04,,34,17,"TO PROCEED TO CONSIDERATION OF S. 325, A BILL GRANTING RIGHT OF WAY THROUGH THE CROW INDIAN RESERVATION TO THE BILLINGS', CLARK'S FORK AND COOKE CITY RAILROAD COMPANY.",Public Lands,,Budget Special Interest,Indian Affairs,Government Management,2.461973277236113,-0.7584224050487498,-0.09,-0.98,0.063,-0.148,0.353,0.784,-27.864895,
2016-10-18 10:30:10,RS0500072,50,Senate,72,1888-04-04,,31,15,"TO PASS S. 325, A BILL GRANTING RIGHT OF WAY THROUGH THE CROW INDIAN RESERVATION TO THE BILLINGS, CLARK'S FORK AND COOKE CITY RAILROAD.",Public Lands,,Budget Special Interest,Indian Affairs,Government Management,1.6081460756301857,-0.556269662789917,-0.016,-0.582,0.057,-0.205,0.133,0.717,-24.798864,
2016-10-18 10:30:10,RS0500073,50,Senate,73,1888-04-04,,46,16,"TO AMEND H. R. 5034, BY AUTHORIZING THE SECRETARY OF TREASURY TO PURCHASE SILVER BULLION, IN ADDITION TO THE $2,000,000 PER MONTH MINIMUM FOR COINAGE PURPOSES, IN EQUAL AMOUNT TO THE CIRCULATION SURRENDERED BY NATIONAL BANKS NOT IN LIQUIDATION, PROVIDED HAT IT IS NOT TAKEN UP WITHIN 30 DAYS BY OTHER NATIONAL BANKS; THIS EXTRA SILVER BULLION, PURCHASES AT MARKET PRICE, SHALL BE COINED AND USED AS PROVIDED BY ""AN ACT TO AUTHORIZE THE COINAGE OF THE STANDARD SILVER DOLLAR AND  RRESTORE ITS LEGAS TENDER CHAR...",Banking and Finance,U.S. Currency,Budget Special Interest,,Government Management,0.647427229976803,-0.40715436620139184,-0.06,-0.446,0.135,-1.206,0.75,0.935,-13.933037,
2016-10-18 10:30:10,RS0500074,50,Senate,74,1888-04-05,,22,37,TO RECOMMIT H. R. 5034.,Banking and Finance,U.S. Currency,Budget Special Interest,,Government Management,1.6717542875465925,-0.27962634236241996,-0.27,-0.731,-0.285,0.986,0.773,0.915,-11.456253,
2016-10-18 10:30:10,RS0500075,50,Senate,75,1888-04-05,,25,20,"TO AMEND H. R. 3839, A BILL GRANTING A PENSION TO MRS. HETTIE K. PAINTER, A VOLUNTEER NURSE DURING LATEWAR, BY AUTHORIZING THE SECRETARY OF THE INTERIOR TO INCREASE HER PENSION FROM $12 TO $25 PER MONTH, SUBJECT TO PROVISIONS AND LIMITATIONS OF THE PENSIN LAW.",Military Pensions/Veterans Benefits,,Defense Policy Budget,,Foreign and Defense Policy,-7.657270787594187,-0.5535771854417384,-0.045,-0.209,-0.658,-0.497,1.0,1.0,-0.009851,
2016-10-18 10:30:10,RS0500076,50,Senate,76,1888-04-06,,13,28,"TO AMEND S. 2083, A BILL ESTABLISHING A BUREAU OF ANIMAL INDUSTRY FOR THE PURPOSE OF FACILITATING EXPORTATION OF LIVESTOCK, AND TO ELIMINATE CERTAIN DISEASES, BY PROVIDING FOR THE ELIMINATION OF DISEASE AS WELL AS DISEASE CONDITIONS.",Agriculture,,Budget Special Interest,,Agriculture,-17.017375729467194,4.226257053719463,0.245,0.057,-0.306,-0.104,0.538,0.854,-11.468544,
