date_generated,id,congress,chamber,rollnumber,date,keyvote,yea,nay,description,Issue1,Issue2,Peltzman1,Peltzman2,Clausen1,slope,intercept,mid.dim1,mid.dim2,spread.dim1,spread.dim2,pre,classified,log_likelihood,vote_result
2016-10-19 13:03:23,RH0330001,33,House,1,1853-12-05,,178,18,"TO ELECT A SPEAKER OF THE 33RD HOUSE, L. BOYD (DEM), CODED 1, VERSUS JOS. CHANDLER (WHIG) CODED 2.  VOTES FOR L. CAMPBELL, (WHIG) ARE CODED 5, FOR P. ERVING (WHIG) ARE CODED 6.",Election of the Speaker of the House,,Internal Organization,,Miscellaneous Policy,28.918416272297197,-13.336918997087794,0.43,-0.902,0.18,-0.036,0.333,0.938,-45.060126,
2016-10-19 13:03:23,RH0330002,33,House,2,1853-12-05,,149,30,"TO ELECT A CLERK OF THE HOUSE FOR THE 33RD CONGRESS, JOHN FORNEY, CODED 1, VERSUS RICHARD YOUNG, CODED 2. VOTES FOR P. TRINDLE ARE CODED 5, FOR E. HUTCHINSON, 6. VOTES FOR OTHERS ARE CODED 8.",Election of House Officers,,Internal Organization,,Miscellaneous Policy,-3.05727879125888,0.4637899156112077,0.136,0.048,0.231,0.437,0.5,0.916,-35.649956,
2016-10-19 13:03:23,RH0330003,33,House,3,1853-12-06,,18,186,"TO TABLE A RESOLUTION WHICH PROVIDES FOR THE ELECTION OF TWO CHAPLAINS, ONE BY THE SENATE, THE OTHER BY THE HOUSE, AND THAT THEY OFFICIATE ALTERNATELY DURING THE PRESENT SESSION OF CONGRESS.  (P. 13-3)",Election of House Officers,,Internal Organization,,Miscellaneous Policy,-3.740346056776164,-3.2315897816993733,-0.664,-0.748,0.108,0.167,-0.333,0.882,-65.670027,
2016-10-19 13:03:23,RH0330004,33,House,4,1853-12-07,,190,20,"TO ELECT A PRINTER FOR THE HOUSE OF REPRESENTATIVES.  VOTES FOR ARMSTRONG ARE CODED 1, FOR GALES AND SEATON 2, FOR TUCKER, 5, FOR OTHERS, 8.",Election of House Officers,,Internal Organization,,Miscellaneous Policy,-2.2426526905046806,-2.1519593627318927,-0.618,-0.766,-0.095,-0.245,-0.15,0.89,-65.045997,
2016-10-19 13:03:23,RH0330005,33,House,5,1853-12-07,,116,33,"TO ELECT A CHAPLAIN FOR THE HOUSE OF REPRESENTATIVES, VOTES FOR REV. TUSTIN ARE CODED 1, FOR THE REV. MILBURN ARE CODED 2, FOR THE REV. TEASDALE ARE CODED 5.",Election of House Officers,,Internal Organization,,Miscellaneous Policy,8.223674627434514,-5.6591110899874035,0.765,0.632,0.091,-0.064,0.03,0.785,-78.271179,
2016-10-19 13:03:23,RH0330006,33,House,6,1853-12-07,,173,23,"SECOND VOTE FOR CHAPLAIN OF THE HOUSE OF REPRESENTATIVES. VOTES FOR REV. MILBURN ARE CODED 1, FOR REV. TUSTIN 2, FOR REV. TEASDALE, 5, FOR OTHERS, 8.",Election of House Officers,,Internal Organization,,Miscellaneous Policy,143.43534471059408,-98.9201292291523,0.694,0.624,0.124,-0.005,0.043,0.888,-73.291204,
2016-10-19 13:03:23,RH0330007,33,House,7,1853-12-08,,94,108,"TO TABLE A RESOLUTION WHICH PROVIDES FOR A LIBRARIAN FOR THE HOUSE, AND SPECIFIES THE DUTIES AND SALARIES OF THE POSITION.  (P. 22-2)",,,Internal Organization,,Miscellaneous Policy,-1.3026313636169908,-0.31042114909958807,0.448,-0.894,0.05,0.222,0.118,0.592,-130.947917,
2016-10-19 13:03:23,RH0330008,33,House,8,1853-12-12,,98,100,TO PASS A RESOLUTION PROVIDING FOR THE ELECTION OF A LIBRARIAN FOR THE HOUSE AND SPECIFYING THE DUTIES AND SALARIES OF THAT POSITION.  (P. 35-1),,,Internal Organization,,Miscellaneous Policy,-1.847565484063432,-0.11039440733678774,0.429,-0.903,-0.046,-0.144,0.265,0.636,-130.293493,
2016-10-19 13:03:23,RH0330009,33,House,9,1853-12-12,,126,72,"TO TABLE A RESOLUTION DECLARING THAT CONGRESS PROPOSES TO EXERCISE ITS POWERS TO PROVIDE FOR THE BUILDING OF A TRANSCONTINENTAL RAILROAD FOR THE SAFER AND MORE EXPEDITIOUS TRANSPORTATION OF THE PUBLIC MONEYS, THE MAILS, THE TROOPS, AND THE MUMITIONS OF WR",Public Works,,Budget Special Interest,,Government Management,-3.669849780748375,0.001405149133623107,0.232,-0.85,0.25,0.394,0.597,0.854,-63.516217,
2016-10-19 13:03:23,RH0330010,33,House,10,1853-12-13,,97,94,TO TABLE THE MOTION TO RECONSIDER THE VOTE BY WHICH A RESOLUTION PROVIDING FOR THE ELECTION OF A HOUSE LIBRARIAN WAS DEFEATED.,,,Internal Organization,,Miscellaneous Policy,-2.368122277416463,-0.12199781429132017,0.345,-0.939,0.052,0.127,0.298,0.654,-124.106367,
2016-10-19 13:03:23,RH0330011,33,House,11,1853-12-13,,106,93,TO TABLE A RESOLUTION AUTHORIZING A PERMANENT CLERK FOR THE COMMITTEE ON WAYS AND MEANS AT A SALARY OF $1500 PER ANNUM.  (P. 42-1),,,Internal Organization,Budget Special Interest,Miscellaneous Policy,1.128523561845744,0.1403234761256171,0.192,0.357,-0.032,0.164,0.183,0.618,-128.735879,
2016-10-19 13:03:23,RH0330012,33,House,12,1853-12-13,,118,75,TO TABLE A RESOLUTION DECLARING THAT CONGRESS IS EMPOWERED TO PROVIDE FOR THE CONSTRUCTION OF RAILROADS FOR THE PURPOSE OF CARRYING MAIL AND THE MUNITIONS OF WAR. (P. 42-2),Public Works,,Budget Special Interest,,Government Management,-3.3534059260383717,-0.1686228918460047,0.052,-0.343,0.178,0.307,0.533,0.819,-73.880993,
2016-10-19 13:03:23,RH0330013,33,House,13,1853-12-13,,119,68,"TO TABLE A RESOLUTION WHICH PROVIDES FOR THE PASSING OF AN ACT FOR THE IMMEDIATE COMMENCEMENT AND EARLY COMPLETION OF THE PACIFIC RAILROAD THROUGH THE TERRITORIES OF THE U. S., FOR THE SAFE AND RAPID TRANSPORTATION OF MONEYS, MAILS, TROOPS AND THE MUNITINS OF WAR",Public Works,,Budget Special Interest,,Government Management,-2.908087928506291,-0.07744487779099041,0.081,-0.313,0.179,0.356,0.559,0.84,-66.885842,
2016-10-19 13:03:23,RH0330014,33,House,14,1853-12-14,,102,75,TO TABLE A RESOLUTION WHICH INSTRUCTS THE COMMITTEE ON PUBLIC WORKS TO REPORT A BILL FOR THE COMPLETION OF THE PUBLIC WORKS FOR WHICH APPROPRIATIONS WERE MADE BY THE LAST CONGRESS.  (P. 45-1),Public Works,,Budget Special Interest,,Government Management,-3.8119730540755397,-0.20171668859085612,0.174,-0.865,0.232,0.352,0.56,0.814,-63.625742,
2016-10-19 13:03:23,RH0330015,33,House,15,1853-12-15,,97,103,"TO TABLE H.J.RES. 6, A RESOLUTION PROVIDING FOR THE PURCHASE OF MT. VERNON.  (P. 52-2)",,,Budget Special Interest,,Government Management,-3.2794080308790634,-0.6111758134347152,-0.176,-0.034,0.11,0.194,0.412,0.715,-105.813938,
2016-10-19 13:03:23,RH0330016,33,House,16,1853-12-20,,88,85,"TO TABLE H.J.RES. 6, A RESOLUTION PROVIDING FOR THE PURCHASE OF MT. VERNON.  (P. 52-2)",,,Budget Special Interest,,Government Management,-2.462729643834342,-0.3996863517808283,0.005,-0.412,0.132,0.31,0.424,0.717,-84.213609,
2016-10-19 13:03:23,RH0330017,33,House,17,1853-12-20,,97,84,"TO TABLE THE MOTION TO RECONSIDER THE VOTE BY WHICH H.J.RES. 6, PROVIDING FOR THE PURCHASE OF MT. VERNON WAS TABLED.  (P. 69-2)",,,Budget Special Interest,,Government Management,-2.6358425323602037,-0.38425448863260714,-0.035,-0.292,0.139,0.305,0.476,0.757,-83.546075,
2016-10-19 13:03:23,RH0330018,33,House,18,1853-12-20,,81,103,"TO TABLE H.R. 57, A BILL ALLOWING COMPANIES IMPORTING IRON FOR THE PURPOSE OF RAILROAD CONSTRUCTION TO GIVE BONDS WITH SECURITY INSTEAD OF CASH FOR DUTIES.  (P. 71-2)",Tariffs,,Regulation Special Interest,,Government Management,0.9718484157083485,0.02654725525446866,-0.691,-0.645,-0.082,0.488,0.37,0.723,-97.576611,
2016-10-19 13:03:23,RH0330019,33,House,19,1853-12-20,,86,95,"TO TABLE H.R. 57, AND AN AMENDMENT THERETO.  (P. 71-2)",Tariffs,,Regulation Special Interest,,Government Management,0.8329442415144426,0.07570351203400516,-0.762,-0.559,-0.071,0.493,0.372,0.702,-101.918925,
2016-10-19 13:03:23,RH0330020,33,House,20,1853-12-21,,55,112,TO TABLE A RESOLUTION WHICH RPOVIDES THAT THE COMMITTEE ON COMMERCE BE INSTRUCTED TO INQUIRE INTO THE PROPRIETY OF CONTINUING AND COMPLETING THE RIVER AND HARBOR IMPROVEMENTS APPROPRIATED FOR IN THE LAST CONGRESS.  (P. 76-2),Public Works,,Budget Special Interest,,Government Management,-2.334806559689569,-0.7692331539411094,0.068,-0.928,0.197,0.488,0.509,0.838,-62.38507,
2016-10-19 13:03:23,RH0330021,33,House,21,1853-12-21,,111,53,TO PASS A RESOLUTION DIRECTING THE COMMITTEE ON COMMERCE TO INQUIRE INTO THE PROPRIETY OF COMPLETING RIVER AND HARBOR IMPROVEMENTS APPROPRIATED FOR IN THE LAST CONGRESS. (P. 76-2),Public Works,,Budget Special Interest,,Government Management,-2.513529751383703,-0.8522735990336592,-0.205,-0.337,-0.196,-0.451,0.547,0.854,-54.832229,
2016-10-19 13:03:23,RH0330022,33,House,22,1854-01-03,,61,91,"TO TABLE A BILL PROVIDING FOR THE EQUAL DISTRIBUTION OF PUBLIC LANDS TO THE WESTERN STATES TO AID IN CONSTRUC- TION OF RAILROADS AND FOR THE SUPPORT OF SCHOOLS. (P. 111, 112)",Public Lands,,Budget Special Interest,,Government Management,3.4993713808494085,1.1982718112483353,-0.363,-0.072,0.072,-0.119,0.213,0.684,-90.212137,
2016-10-19 13:03:23,RH0330023,33,House,23,1854-01-03,,78,65,TO TABLE A RESOLUTION INSTRUCTING THE COMM. ON WAYS AND MEANS TO REPORT A BILL REPEALING ALL DUTY ON RAILROAD IRON. (P. 114-2),Tariffs,,Regulation Special Interest,,Government Management,1.1615765531968747,0.3389075487702874,-0.804,-0.595,-0.096,0.478,0.369,0.713,-81.620083,
2016-10-19 13:03:23,RH0330024,33,House,24,1854-01-04,,105,66,"TO TABLE A RESOLUTION DIRECTING THE SECRETARY OF THE TREASURY TO THE COLLECTOR OF CUSTOMS AT NEW YORK, RELATIVE TO THE REMOVAL OF THE COLLECTOR FOR INSUBORDINATION TO THE SECRETARY AND ABUSE OF HIS OFFICE FOR POLITICAL ENDS. (P. 121-2)",,,Government Organization,,Government Management,-2.7502004046715296,-0.28476062144759107,-0.053,-0.139,0.233,0.49,0.667,0.871,-52.071101,
2016-10-19 13:03:23,RH0330025,33,House,25,1854-01-04,,56,82,"TO TABLE S.J.RES. 4 (10 STAT 723, FEB. 15, 1855), AUTHORIZING THE PRESIDENT TO CONFER THE TITLE OF LIEUTENANT-GENERAL BY BREVET FOR EMINENT SERVICE. (P. 124-2)",,,Defense Policy Resolutions,,Foreign and Defense Policy,-1.5773681603071201,-0.5120021490684038,0.168,-0.777,0.138,0.506,0.5,0.797,-62.811679,
2016-10-19 13:03:23,RH0330026,33,House,26,1854-01-11,,30,153,"TO COMMIT H.J.RES. 7 (10 STAT 594, AUG. 4, 1854) TO THE COMMITTEE OF THE WHOLE.  H.J.RES. 7 EXPRESSES THANKS AND PROVIDES FOR THE PRESENTATION OF A SWORD TO CAPTAIN DUNCAN INGRAHAM FOR THE RESCUE OF MARTIN KOSTA, AN AMERICAN CITIZEN AT SMYRNA WITH THE SLOP OF WAR, ST",,,Foreign Policy Resolutions,,Foreign and Defense Policy,1.5292450638909705,1.6996601626131511,-0.98,0.201,0.078,-0.295,0.0,0.836,-81.983715,
2016-10-19 13:03:23,RH0330027,33,House,27,1854-01-11,,174,9,TO PASS AN AMENDED RESOLUTION EXPRESSING THANKS AND PROVIDING FOR PRESENTATION OF A MEDAL TO CAPTAIN INGRAHAM FOR THE RESCUE OF MARTIN KOSTA.  (P. 157-1),,,Foreign Policy Resolutions,,Foreign and Defense Policy,-7.107068405903548,-6.342725408781875,-0.81,-0.586,-0.145,-0.118,0.0,0.951,-41.788917,
2016-10-19 13:03:23,RH0330028,33,House,28,1854-01-12,,114,64,"TO AMEND A RESOLUTION RELATIVE TO THE PRINTING OF THE CENSUS, BY PROVIDING FOR THE PRINTING OF 100,000 COPIES INSTEAD OF 50,000.  (P. 160-2)",,,Budget Special Interest,,Government Management,-3.255138314067624,-1.048246639075246,-0.048,-0.892,-0.112,-0.199,0.266,0.736,-92.589445,
2016-10-19 13:03:23,RH0330029,33,House,29,1854-01-12,,126,54,"TO AMEND S. 12 (10 STAT 267, FEB. 10, 1854), A BILL REGULATING THE DISBURSEMENT OF THE CONTINGENT FUNDS OF THE SENATE, BY STRIKING THE PROVISION THAT THE ACCOUNTS OF THE SECRETARY OF THE SENATE SHALL BE HELD CONCLUSIVE BY ALL THE OFFICERS OF THE TREASURYDEPARTMENT",,,Internal Organization,,Government Management,-1.57736816030712,0.25414101508422526,0.144,0.027,0.081,0.297,0.148,0.744,-92.510806,
2016-10-19 13:03:23,RH0330030,33,House,30,1854-01-12,,113,52,"TO PASS S. 12, A BILL TO REGULATE THE DISBURSEMENT OF THE CONTINGENT FUNDS OF THE SENATE.  (P. 163-1)",,,Internal Organization,,Government Management,7.815788181701946,-3.5232100999616422,0.33,-0.944,0.05,-0.037,-0.038,0.673,-102.219868,
2016-10-19 13:03:23,RH0330031,33,House,31,1854-01-13,,96,70,"TO AMEND S. 13, PRESCRIBING THE MANNER OF APPOINTING THE ASSISTANT SECRETARY OF THE TREASURY, BY PROVIDING THAT WHEN THE OFFICE BECOMES VACANT, THE PRESIDENT SHALL APPOINT A SUCCESSOR BY AND WITH THE ADVICE AND CONSENT OF THE SENATE.",,,Government Organization,,Government Management,-5.082630738767386,-0.3248263073876739,-0.01,-0.274,0.116,0.132,0.471,0.777,-80.998146,
2016-10-19 13:03:23,RH0330032,33,House,32,1854-01-13,,70,107,"TO PASS S. 13, WHICH AS AMENDED PROVIDES THAT THE ASSISTANT SECRETARY BE APPOINTED BY THE PRESIDENT WITH THE CONSENT OF THE SENATE.  (P. 172, 173)",,,Government Organization,,Government Management,-3.041788970863853,-1.008713347805418,-0.041,-0.884,0.071,0.135,0.157,0.667,-107.001493,
2016-10-19 13:03:23,RH0330033,33,House,33,1854-01-13,,32,128,"CALL OF THE HOUSE, DURING DEBATE ON S. 13.  (P. 173-2)",,,Government Organization,,Government Management,-8.13068515481979,2.6998762479026013,0.374,-0.341,-0.097,-0.069,-0.062,0.787,-76.206842,
2016-10-19 13:03:23,RH0330034,33,House,34,1854-01-13,,105,30,TO TABLE A MOTION TO RECONSIDER THE VOTE BY WHICH S. 13 WAS REJECTED.  (P. 173-3),,,Government Organization,,Government Management,-3.4987713514631174,0.7004668264895042,0.027,0.606,0.098,0.162,-0.033,0.77,-58.99747,
2016-10-19 13:03:23,RH0330035,33,House,35,1854-01-16,,98,92,TO TABLE A RESOLUTION WHICH PROVIDES THAT THE COMMITTEE ON WAYS AND MEANS BE INSTRUCTED TO REPORT A BILL GIVING A FOUR YEAR CREDIT TO RAILROAD COMPANIES IMPORTING IRON FOR RAILROAD PURPOSES.  (P. 178-3),Tariffs,,Regulation Special Interest,,Government Management,0.6583054110766842,0.09394255725832651,-0.565,-0.278,-0.042,0.369,0.326,0.674,-112.326877,
2016-10-19 13:03:23,RH0330036,33,House,36,1854-01-16,,139,53,"TO SUSPEND THE RULES AND CONSIDER THE HOMESTEAD BILL, GRANTING 160 ACRES TO EVERY CITIZEN HEAD OF FAMILY ON CONDITION OF OCCUPANCY AND CULTIVATION AND TO FIX A TIME OF DEBATE FOR THE BILL.  (P. 179-1)",Public Lands,,Budget Special Interest,,Agriculture,-10.603419299842304,-4.918656679814372,-0.543,0.839,-0.143,-0.078,0.434,0.844,-87.740377,
2016-10-19 13:03:23,RH0330037,33,House,37,1854-01-16,,91,64,TO TABLE A RESOLUTION PROVIDNG THAT THE COMMITTEE OF WAYS AND MEANS BE INSTRUCTED TO REPORT A BILL GIVING CREDIT FOR DUTIES ON RAILROAD IRON TO COMPANIES THAT WILL OBLIGATE THEMSELVES TO PAY BE TRANSPORTING MAIL. (P. 180-3),Tariffs,,Regulation Special Interest,,Government Management,0.596028426986278,0.20974836955082163,-0.013,0.202,-0.027,0.262,0.281,0.703,-94.292851,
2016-10-19 13:03:23,RH0330038,33,House,38,1854-01-17,,113,60,"SHALL THE MAIN QUESTION BE PUT (ON PASSAGE) ON H.R. 73, (10 STAT 773, JAN. 24, 1854) RESTORING PAY, ALLOWANCE AND EMOLUMENTS TO COL. B. S. ROBERTS, CHARGED WITH DEFALCATION AND FORCED TO RESIGN HIS COMMISSION IN 1839.",,,Defense Policy Budget,,Foreign and Defense Policy,-1.2615057745401363,-0.5425147526993305,0.216,-0.815,-0.118,-0.541,0.317,0.763,-79.964784,
2016-10-19 13:03:23,RH0330039,33,House,39,1854-01-17,,72,102,"TO AMEND A RESOLUTION FIXING ""THURSDAY NEXT"" AS THE DAY FOR ENDING DEBATE ON THE PRESIDENT'S ANNUAL MESSAGE, BY CHANGING THE DAY TO ""THE FIRST DAY O F MARCH NEXT."" (P. 189-2)",,,Internal Organization,,Miscellaneous Policy,-3.2533218306334346,-0.18070595349927296,-0.062,0.021,-0.117,-0.208,0.444,0.77,-84.840156,
2016-10-19 13:03:23,RH0330040,33,House,40,1854-01-17,,97,82,"TO PASS A RESOLUTION WHICH FIXES THE DATE FOR ENDING DEBATE ON THE PRESIDENT'S ANNUAL MESSAGE AS ""THURSDAY THE 26TH INSTANT.""",,,Internal Organization,,Miscellaneous Policy,-3.7456234409832567,-0.3628424438753972,-0.036,-0.228,0.136,0.21,0.5,0.771,-83.084824,
2016-10-19 13:03:23,RH0330041,33,House,41,1854-01-24,,101,78,"TO TABLE THE MOTION TO RECONSIDER THE VOTE BY WHICH S.J.RES. 4, AUTHORIZING THE PRESIDENT OF THE U. S. TO CONFER THE TITLE OF LIEUTENANT-GENERAL BY BREVET, WAS REFERRED TO THE COMMITTEE OF THE WHOLE ON THE STATE OF THE UNION.  (P. 246-1)",,,Defense Policy Resolutions,,Foreign and Defense Policy,-2.2739267496165314,-0.17942260559740097,0.254,-0.757,0.184,0.468,0.538,0.799,-77.150043,
2016-10-19 13:03:23,RH0330042,33,House,42,1854-01-30,,62,97,"CALL OF THE HOUSE MOTION MADE DURING DEBATE ON H.R. 197, (10 STAT 268, FEB. 23, 1854) A BILL SUPPLEMENTAL TO AN ACT TO ASCERTAIN AND SETTLE PRIVATE AND CLAIMS IN CALIFORNIA. (P. 287-1)",,,Budget Special Interest,,Government Management,9.436535836223296,-8.72632825942947,0.956,0.295,-0.031,0.019,0.0,0.61,-105.751677,
2016-10-19 13:03:23,RH0330043,33,House,43,1854-01-30,,57,108,"TO TABLE H.R. 243, A BILL PROVIDING FOR PROTECTION TO THE MAILS ON RAILROADS.  (P. 298-2)",,,Budget Special Interest,,Government Management,-4.39430683020382,-1.7239093478578078,-0.578,0.816,0.136,0.179,0.316,0.764,-84.452204,
2016-10-19 13:03:23,RH0330044,33,House,44,1854-01-31,,109,69,THAT H.R. 243 BE REFERRED TO THE COMMITTEE OF THE WHOLE AND PRINTED.  (P. 298-3),,,Budget Special Interest,,Government Management,-2.1329895690205025,-0.12477107657767716,-0.472,0.882,0.104,0.282,0.159,0.674,-98.812252,
2016-10-19 13:03:23,RH0330045,33,House,45,1854-02-01,,83,102,TO TABLE THE MOTION TO RECONSIDER THE VOTE BY WHICH H.R. 243 WAS REFERRED TO THE COMMITTEE ON THE WHOLE.  (P. 306-3),,,Budget Special Interest,,Government Management,-2.961245826283233,-0.8263364168923273,-0.559,0.829,0.128,0.25,0.446,0.751,-101.18125,
2016-10-19 13:03:23,RH0330046,33,House,46,1854-02-01,,92,93,"THAT THE RULES BE SUSPENDED; AND THE HOUSE RESOLVE ITSELF INTO THE COMM. OF THE WHOLE ON THE STATE OF THE UNION, DURING DEBATE ON H.R. 243.",,,Budget Special Interest,,Government Management,-4.68371895453157,-0.885915516449186,-0.386,0.922,0.132,0.163,0.489,0.746,-99.581937,
2016-10-19 13:03:23,RH0330047,33,House,47,1854-02-01,,96,95,TO RESOLVE INTO COMMITTEE OF THE WHOLE ON THE STATE OF UNION DURING CONSIDERATION OF H.R. 243.  (P. 307-2),,,Budget Special Interest,,Government Management,-4.102379982814253,-0.7924876928679149,-0.415,0.91,0.122,0.172,0.453,0.728,-105.608848,
2016-10-19 13:03:23,RH0330048,33,House,48,1854-02-03,,101,50,"THAT WHEN THE HOUSE ADJOURN TODAY, IT BE TO MEET AGAIN ON MONDAY NEXT, FEB. 6, 1854.  (P. 333-1)",,,Internal Organization,,Miscellaneous Policy,-0.10365023753511539,-0.5949098372952967,-0.578,-0.535,-0.005,-0.279,0.04,0.682,-90.272228,
2016-10-19 13:03:23,RH0330049,33,House,49,1854-02-06,,65,103,"TO RECEDE FROM ITS AMENDMENT TO S. 12, A BILL TO REGULATE DISBURSEMENT OF THE CONTINGENT FUND OF THE SENATE.  THE AMENDMENT STIPULATES THAT THE SALARY OF THE SECRETARY OF THE SENATE BE RAISED FROM $3000 TO $4000 PER YEAR. (P. 346-1)",,,Internal Organization,Budget Special Interest,Government Management,-0.9273416188584755,-0.021493452519126044,0.227,-0.232,-0.076,-0.474,0.323,0.738,-87.615856,
2016-10-19 13:03:23,RH0330050,33,House,50,1854-02-06,,90,77,"TO SUSPEND THE RULES AND INTRODUCE A RESOLUTION WHICH PROVIDES THAT THE PRESIDENT BE REQUESTED TO PRESENT THREE GOLD MEDALS TO CAPTAINS OF SHIPS AS TESTIMONIALS OF NATIONAL GRATITUDE FOR RESCUING AMERICANS FROM THE WRECK OF THE SAN FRANCISCO OFF PROVIDENE, AND THAT $100,000 BE APPROPRIATED FOR REWARDS",,,Budget Special Interest,,Government Management,-2.4134381975398647,-0.46359141671416826,0.209,-0.968,-0.169,-0.405,0.494,0.766,-76.353423,
2016-10-19 13:03:23,RH0330051,33,House,51,1854-02-06,,97,61,"TO PASS S.J.RES. 7, (10 STAT 591, FEB. 10, 1854), AUTHORIZING AN INCREASE OF FORCE IN THE OFFICE OF THE SUPERINTENDENT OF THE PUBLIC PRINTING.  (P. 350, 1)",,,Budget Special Interest,,Government Management,-5.162295797368755,-1.8117396869396338,-0.479,0.661,-0.108,-0.121,0.279,0.722,-88.222057,
2016-10-19 13:03:23,RH0330052,33,House,52,1854-02-09,,85,64,"TO CONCUR IN AN AMENDMENT MADE IN COMMITTEE OF THE WHOLE TO H.R. 49, A BILL TO SUPPLY DEFICIENCIES IN APPROPRIATIONS FOR FISCAL 1854; SAID AMENDMENT PROVIDING FOR CONTINUING AND COMPLETING THE CUSTOM-HOUSE AT CINCINNATTI, OHIO. (P. 392-3)",Public Works,,Budget Special Interest,,Government Management,-1.7803514779883647,-0.47223243871093995,-0.263,-0.004,-0.181,-0.588,0.531,0.799,-58.545031,
2016-10-19 13:03:23,RH0330053,33,House,53,1854-02-09,,82,77,"TO CONCUR IN AN AMENDMENT TO H.R. 49, PAID AMENDMENT PROVIDING FOR COMPLETING THE CUSTOM-HOUSE AT LOUISVILLE, KY.  (P. 392-3)",Public Works,,Budget Special Interest,,Government Management,-1.6556772179110195,-0.3527435131344284,-0.175,-0.063,-0.148,-0.517,0.597,0.805,-68.338555,
2016-10-19 13:03:23,RH0330054,33,House,54,1854-02-09,,87,74,"TO CONCUR IN AN AMENDMENT TO H.R. 49, SAID AMENDMENT PROVIDING FOR COMPLETING CUSTOM-HOUSE AT BATH, ME. (P. 393-1)",Public Works,,Budget Special Interest,,Government Management,-1.7648739342651965,-0.43778201522931526,-0.103,-0.256,-0.166,-0.544,0.622,0.826,-62.296011,
2016-10-19 13:03:23,RH0330055,33,House,55,1854-02-09,,85,74,"TO CONCUR IN AN AMENDMENT TO H.R. 49, SAID AMENDMENT PROVIDING FOR COMPLETION OF THE CUSTOM-HOUSE AT ST. LOUIS, MO.  (P. 393-1)",Public Works,,Budget Special Interest,,Government Management,-1.6424252649580562,-0.41384262772665315,-0.199,-0.087,-0.14,-0.493,0.568,0.799,-67.204583,
2016-10-19 13:03:23,RH0330056,33,House,56,1854-02-09,,83,66,"TO CONCUR IN AN AMENDMENT TO H.R. 49, SAID AMENDMENT PROVIDING FOR COMPLETION OF CUSTOM-HOUSE AT MOBILE, ALA.  (P. 393-2)",Public Works,,Budget Special Interest,,Government Management,-1.2099755762467446,-0.39733868111732423,-0.054,-0.332,-0.1,-0.478,0.53,0.792,-71.014955,
2016-10-19 13:03:23,RH0330057,33,House,57,1854-02-09,,87,60,"TO CONCUR IN AMENDMENT TO H.R. 49, SAID AMENDMENT PROVIDING FOR THE PURCHASE OF LAND BY U. S. FROM THE BANK OF COMMERCE AND THE BANK OF N. Y., PROVIDED THAT, BEFORE PURCHASE IS MADE, THE STATE OF N. Y. CEDE JURISDICTION OVER SAID LAND AND EXONERATE SAME ROM TAXES WHILE PROPERTY OF THE U",,,Budget Special Interest,,Government Management,-1.9786284817887556,-0.7087346190696081,-0.106,-0.499,-0.065,-0.19,0.267,0.701,-87.860834,
2016-10-19 13:03:23,RH0330058,33,House,58,1854-02-09,,57,93,TO PASS H.R. 49.,,,Budget General Interest,,Government Management,-0.8850788010612173,-0.05191197316726015,-0.723,0.588,-0.101,-0.66,0.246,0.713,-79.595433,
2016-10-19 13:03:23,RH0330059,33,House,59,1854-02-09,,60,114,"CALL OF THE HOUSE, DURING DEBATE ON H.R. 49.",,,Budget General Interest,,Government Management,0.2605262727233981,0.3928210574549794,0.112,0.422,0.01,-0.222,0.083,0.684,-103.787389,
2016-10-19 13:03:23,RH0330060,33,House,60,1854-02-09,,89,88,TO TABLE MOTION TO RECONSIDER THE VOTE BY WHICH H.R. 49 WAS REJECTED.  (P. 395-1),,,Budget General Interest,,Government Management,-0.3967698274827055,-0.16794104480647193,-0.204,-0.087,0.026,0.379,0.375,0.689,-105.860382,
2016-10-19 13:03:23,RH0330061,33,House,61,1854-02-10,,134,35,"TO TABLE ON MR. JONES APPEAL FROM THE DECISION OF THE CHAIR, HOLDING THAT THE MOTION OF MR. JONES TO RECONSIDER THE VOTE BY WHICH THE MOTION TO RECONSIDER THE VOTE REJECTING H.R. 49 WAS LAID ON THE TABLE, WAS NOT IN ORDER, BECAUSE THE UNIVERSAL PRACTICE F THE HOUSE HAS BEEN TO REGARD A VOTE TO TABLE A MOTION TO RECONSIDER AS FINAL.",,,Budget General Interest,,Government Management,-2.582651012997611,1.4889375875386142,0.58,-0.009,0.071,0.159,-0.029,0.787,-87.635715,
2016-10-19 13:03:23,RH0330062,33,House,62,1854-02-13,,107,72,TO SUSPEND THE RULES AND FURTHER CONSIDER H.R. 49 (P. 411-2),,,Budget General Interest,,Government Management,-4.479093046686633,0.04103121262950182,0.142,-0.595,0.103,0.133,0.333,0.732,-96.217305,
2016-10-19 13:03:23,RH0330063,33,House,63,1854-02-13,,102,78,TO SUSPEND THE RULES AND CONSIDER H.R. 49. (P. 411-3),,,Budget General Interest,,Government Management,0.019605705947320137,-0.3362342875011878,0.471,-0.327,0.001,-0.295,0.141,0.628,-115.767928,
2016-10-19 13:03:23,RH0330064,33,House,64,1854-02-13,,105,61,"TO SUSPEND THE RULES AND PASS A RESOLUTION ALLOWING MEMBERS WHO ARE WITHIN THE BAR TO VOTE, BEFORE THE CALL OF THE ROLL IS FINISHED.  (P. 413-3)",,,Internal Organization,,Miscellaneous Policy,-0.5660626163939025,-0.5652240514425793,0.095,-0.619,-0.023,-0.235,0.131,0.681,-102.949039,
2016-10-19 13:03:23,RH0330065,33,House,65,1854-02-13,,80,65,TO TABLE A RESOLUTION INSTRUCTING THE COMMITTEE ON WAYS AND MEANS TO LOOK INTO THE PROPRIETY OF GREATLY REDUCING OR WHOLLY REPEALING THE DUTY ON RAILROAD IRON.  (P. 415-3),Tariffs,,Regulation Special Interest,,Government Management,1.3787727882147887,0.29479236126785546,-0.707,-0.68,-0.077,0.323,0.292,0.683,-85.173361,
2016-10-19 13:03:23,RH0330066,33,House,66,1854-02-17,,114,46,"TO PASS S. 2 (10 STAT 267, FEB. 23, 1854), A BILL TO INDEMNIFY THE STATE OF INDIANA FOR THE FAILURE OF TITLE TO A TOWNSHIP OF LAND GRANTED TO HER ON ADMISSION INTO THE UNION IN 1816.  (P. 442-3)",,,Budget Special Interest,,Government Management,-3.304961859691108,-1.5885797892558227,-0.661,0.596,-0.132,-0.231,0.283,0.794,-80.456961,
2016-10-19 13:03:23,RH0330067,33,House,67,1854-02-23,,53,82,TO ADJOURN.,,,Internal Organization,,Miscellaneous Policy,0.11684208594867554,0.3057063242685314,0.439,0.357,0.004,-0.198,0.113,0.652,-86.064438,
2016-10-19 13:03:23,RH0330068,33,House,68,1854-02-27,,96,86,"TO AMEND A RESOLUTION PROVIDING THAT AT AT 2:00 O'CLOCK TOMORROW PROCEED TO THE ELECTION OF A PUBLIC PRINTER IN PLACE OF BOB ARMSTRONG, BY CHANGING THE DATE OF THE ELECTION FROM TOMORROW TO NEXT WEDNESDAY.  (P. 488-3)",,,Internal Organization,,Miscellaneous Policy,-37.78673059580167,-6.34438400949888,-0.167,-0.034,-0.098,-0.015,0.442,0.736,-100.022806,
2016-10-19 13:03:23,RH0330069,33,House,69,1854-02-27,,127,60,"TO SUSPEND THE RULES AND TAKE UP S. 226, AUTHORIZING THE CONSTRUCTION OF SIX STEAM FRIGATES.  (P. 489-1)",,,Defense Policy Budget,,Foreign and Defense Policy,-0.854821109935829,-0.8949662888258932,-0.999,-0.041,-0.047,-0.318,0.0,0.679,-113.186883,
2016-10-19 13:03:23,RH0330070,33,House,70,1854-02-27,,98,80,"TO SUSPEND THE RULES AND CONSIDER S. 226, THE STEAM FRIGATE BILL, IN THE HOUSE BEFORE IT IS CONSIDERED IN COMM. OF THE WHOLE.  (P. 489-2)",,,Defense Policy Budget,,Foreign and Defense Policy,0.144592081361486,-0.2681150148907903,0.478,-0.199,0.006,-0.24,0.175,0.629,-115.692552,
