date_generated,id,congress,chamber,rollnumber,date,keyvote,yea,nay,description,Issue1,Issue2,Peltzman1,Peltzman2,Clausen1,slope,intercept,mid.dim1,mid.dim2,spread.dim1,spread.dim2,pre,classified,log_likelihood,vote_result
2016-10-19 13:03:23,RH0260302,26,House,302,1840-04-27,,20,143,TO RECONSIDER THE VOTE TO PRINT A REPORT ON THE HOUSE DISTURBANCE CREATED BY MR. J. GARLAND AND MR. BYNUM. (P. 359-1),,,Internal Organization,,Miscellaneous Policy,1.0215744878800639,1.136085151766849,-0.143,0.99,0.065,-0.368,0.0,0.877,-50.302252,
2016-10-19 13:03:23,RH0260303,26,House,303,1840-04-27,,32,89,"TO ADJOURN, MOTION MADE DURING DEBATE ON H.R. 8. (P. 360-3)",,,Foreign Policy Budget,,Foreign and Defense Policy,-2.4731574859136325,-0.05939852612019636,0.257,-0.695,-0.254,-0.594,0.75,0.934,-20.852124,
2016-10-19 13:03:23,RH0260304,26,House,304,1840-04-27,,34,85,"TO ADJOURN, MOTION MADE DURING DEBATE ON H.R. 8. (P. 360-3)",,,Foreign Policy Budget,,Foreign and Defense Policy,-1.4556905488419873,0.007164195125887202,0.064,-0.086,-0.149,-0.592,0.676,0.908,-26.307389,
2016-10-19 13:03:23,RH0260305,26,House,305,1840-04-27,,35,67,"TO ADJOURN, MOTION MADE DURING DEBATE ON H.R. 8. (P. 361-1)",,,Foreign Policy Budget,,Foreign and Defense Policy,-2.487388252791997,-0.37874696713808764,-0.139,-0.033,-0.123,-0.286,0.543,0.843,-39.433217,
2016-10-19 13:03:23,RH0260306,26,House,306,1840-04-27,,57,37,"TO ROUNDUP ABSENTEES, MOTION MADE DURING DEBATE ON H.R. 8.",,,Internal Organization,,Miscellaneous Policy,-5.828173125647589,-0.8914875994183884,-0.067,-0.501,0.131,0.13,0.514,0.809,-42.334457,
2016-10-19 13:03:23,RH0260307,26,House,307,1840-04-27,,45,50,"TO RECONSIDER THE VOTE TO COMPEL THE ATTENDANCE OF MEMBERS, MOTION MADE DURING DEBATE ON H.R. 8.  (P. 361-1)",,,Internal Organization,,Miscellaneous Policy,-4.923016103498212,-1.41175323522003,-0.263,-0.117,-0.143,-0.168,0.422,0.726,-46.053336,
2016-10-19 13:03:23,RH0260308,26,House,308,1840-04-27,,22,65,"TO ADJOURN, MOTION MADE DURING DEBATE ON H.R. 8. (P. 361-2)",,,Foreign Policy Budget,,Foreign and Defense Policy,-2.8171446110282137,0.03186802597022553,-0.311,0.908,-0.132,-0.271,0.364,0.839,-33.387278,
2016-10-19 13:03:23,RH0260309,26,House,309,1840-04-27,,13,61,TO DISPENSE WITH THE CALL OF THE HOUSE MOTION MADE DURING DEBATE ON H.R. 8.  (P. 361-2),,,Foreign Policy Budget,,Foreign and Defense Policy,-2.5729282515165353,0.2738657534031701,0.101,0.014,-0.238,-0.535,0.615,0.932,-8.474298,
2016-10-19 13:03:23,RH0260310,26,House,310,1840-04-27,,65,9,"TO ORDER THE SERGENT-AT-ARMS TO TAKE INTO CUSTODY ABSENTEE MEMBERS, MOTION MADE DURING CONSIDERATION H.R. 8. (P. 361-2)",,,Internal Organization,,Miscellaneous Policy,-1.0528217744524275,0.4792938644146484,-0.392,0.892,0.077,0.423,0.222,0.905,-18.973962,
2016-10-19 13:03:23,RH0260311,26,House,311,1840-04-27,,47,24,TO FINE MR. BRIGGS FOR BEING ABSENT DURING DEBATE ON H.R. 8. (P. 361-2),,,Internal Organization,,Miscellaneous Policy,-9.29781991539682,-1.3280773474787293,-0.148,0.048,0.127,0.079,0.417,0.803,-33.90144,
2016-10-19 13:03:23,RH0260312,26,House,312,1840-04-27,,25,66,"TO ADJOURN, MOTION MADE DURING DEBATE ON H.R. 8. (P. 361-3)",,,Foreign Policy Budget,,Foreign and Defense Policy,-2.6411039138861025,0.22307351154365307,0.284,-0.527,-0.158,-0.346,0.56,0.879,-27.048821,
2016-10-19 13:03:23,RH0260313,26,House,313,1840-04-27,,23,61,"TO DISPENSE WITH THE BRINGING IN OF ABSENTEES, MOTION MADE DURING DEBATE ON H.R. 8.",,,Internal Organization,,Miscellaneous Policy,-2.250186798087563,0.023745330047810924,-0.025,0.08,-0.128,-0.329,0.609,0.893,-25.213041,
2016-10-19 13:03:23,RH0260314,26,House,314,1840-04-27,,62,12,TO RESCIND THE ORDER WHICH ORDERED MR. SMITH OF MAINE TO BE TAKEN INTO CUSTODY.,,,Internal Organization,,Miscellaneous Policy,3.3484481999502016,-1.5209209963750012,0.502,0.16,0.154,-0.266,0.083,0.851,-27.794905,
2016-10-19 13:03:23,RH0260315,26,House,315,1840-04-27,,20,51,"TO ADJOURN, MOTION MADE DURING DEBATE ON H.R. 8.",,,Foreign Policy Budget,,Foreign and Defense Policy,-1.3679969374320229,-0.13265464634495416,-0.442,0.472,-0.158,-0.668,0.6,0.887,-17.268949,
2016-10-19 13:03:23,RH0260316,26,House,316,1840-04-27,,25,67,"TO STOP THE CALL OF THE HOUSE, MOTION MADE DURING DEBATE ON H.R. 8.  (P. 362-1)",,,Foreign Policy Budget,,Foreign and Defense Policy,-1.6065786817942884,-0.028099979816365916,-0.076,0.094,-0.09,-0.324,0.4,0.837,-35.930262,
2016-10-19 13:03:23,RH0260317,26,House,317,1840-04-27,,79,60,"TO TABLE THE MOTION TO EXCUSE CERTAIN MEMBERS FROM PAYMENT OF FINES FOR ABSENTEEISM, MOTION MADE DURING DEBATE ON H.R. 8.  (P. 362-1)",,,Internal Organization,,Miscellaneous Policy,-2.7223031733720315,-0.5214795772434616,-0.434,0.66,0.281,0.597,0.883,0.95,-26.065086,
2016-10-19 13:03:23,RH0260318,26,House,318,1840-04-27,,87,34,"TO ORDER A CALL OF THE HOUSE, MOTION MADE DURING DEBATE ON H.R. 8.  363-1)",,,Foreign Policy Budget,,Foreign and Defense Policy,-1.275142764762711,0.14796970153725414,0.138,-0.028,0.112,0.508,0.441,0.843,-37.117631,
2016-10-19 13:03:23,RH0260319,26,House,319,1840-04-29,,100,56,TO TABLE A RESOL. THAT THE COMM. APPOINTED ON THE MEMORIAL OF H. GARLAND EMPLOY A CLERK.  (P. 364-2),,,Internal Organization,Budget Special Interest,Government Management,-3.8402413006760256,-0.06329013462839309,-0.042,0.098,0.247,0.372,0.804,0.929,-26.114459,
2016-10-19 13:03:23,RH0260320,26,House,320,1840-04-29,,54,76,"TO ADJOURN, MOTION MADE DURING DEBATE ON H.R. 8. (P. 367-2)",,,Foreign Policy Budget,,Foreign and Defense Policy,-2.1265533277520654,-0.148867881372992,0.246,-0.672,-0.157,-0.427,0.667,0.862,-42.473922,
2016-10-19 13:03:23,RH0260321,26,House,321,1840-04-29,,61,75,"TO ADJOURN, MOTION MADE DURING DEBATE ON H.R. 8. (P. 367-3)",,,Foreign Policy Budget,,Foreign and Defense Policy,-2.3298229364253573,-0.28147008443982,-0.056,-0.151,-0.114,-0.283,0.639,0.838,-53.554104,
2016-10-19 13:03:23,RH0260322,26,House,322,1840-04-29,,64,72,"TO ADJOURN, MOTION MADE DURING DEBATE ON H.R. 8. (P. 261297)",,,Foreign Policy Budget,,Foreign and Defense Policy,-2.6369376540088627,-0.48413417471726433,0.083,-0.703,-0.15,-0.329,0.73,0.874,-47.36566,
2016-10-19 13:03:23,RH0260323,26,House,323,1840-04-30,,91,65,THAT WHEN THE HOUSE ADJOURNS IT WILL MEET AFTER MONDAY NEXT. (P. 368-3),,,Internal Organization,,Miscellaneous Policy,5.205314929013495,-1.7377805012195209,0.335,0.006,0.027,-0.03,-0.062,0.558,-104.486089,
2016-10-19 13:03:23,RH0260324,26,House,324,1840-04-30,,109,26,"A CALL OF THE HOUSE, MOTION MADE DURING DEBATE ON H.R. 8. (P. 369-2)",,,Internal Organization,,Miscellaneous Policy,-1.6286183893423691,0.7012250024099799,-0.076,0.825,0.078,0.277,-0.038,0.8,-53.752473,
2016-10-19 13:03:23,RH0260325,26,House,325,1840-05-02,,111,48,"TO ORDER THE PREVIOUS QUESTION, TO CONSIDER THE AMENDMENTS TO H.R. 8.  (P. 374-3)",,,Internal Organization,,Miscellaneous Policy,-2.0183209856087347,0.17549605010889924,-0.355,0.892,0.186,0.533,0.596,0.88,-43.402058,
2016-10-19 13:03:23,RH0260326,26,House,326,1840-05-02,,144,15,TO ORDER ENGROSSMENT AND THIRD READING OF H.R. 8. (P. 374-3),,,Foreign Policy Budget,,Foreign and Defense Policy,-1.0844406102111448,0.7901024446077536,-0.058,0.853,0.096,0.512,0.067,0.911,-35.905824,
2016-10-19 13:03:23,RH0260327,26,House,327,1840-05-07,,51,50,"TO ORDER A CALL OF THE HOUSE, MOTION MADE DURING DEBATE ON H.R. 8.  NP. 385-2)",,,Internal Organization,,Miscellaneous Policy,-1.5664142147494315,-0.25198004661828016,0.053,-0.335,0.065,0.24,0.5,0.752,-52.841979,
2016-10-19 13:03:23,RH0260328,26,House,328,1840-05-07,,73,48,"TO CONCUR IN THE SENATE AMENDMENT TO H.R. 8, SAID AMENDMENT ELIMINATING AN APPROPRIATION OF $45,000 FOR THE PUBLICATION OF THE DOCUMENTARY HISTORY OF THE AMERICAN REVOLUTION. (P. 384-1)",,,Budget Special Interest,,Government Management,-3.422066807475439,-0.19485812094216137,0.088,-0.496,0.526,0.889,0.937,0.975,-9.095522,
2016-10-19 13:03:23,RH0260329,26,House,329,1840-05-11,,119,24,TO SUSPEND THE RULES TO INTRODUCE A RESOLUTION TO CHANGE THE HOUR OF MEETING.  (P. 389-1),,,Internal Organization,,Miscellaneous Policy,-2.222833489587023,0.9536643611464901,0.178,0.558,0.103,0.268,0.087,0.852,-51.347988,
2016-10-19 13:03:23,RH0260330,26,House,330,1840-05-12,,81,60,TO SUSPEND THE RULES TO INTRODUCE A RESOLUTION PROPOSING A DAILY RECESS AT 2:30 P.M.  (P. 390-1),,,Internal Organization,,Miscellaneous Policy,-1.1647695443008594,0.41696361098522045,0.722,-0.424,0.029,0.144,0.017,0.582,-94.582795,
2016-10-19 13:03:23,RH0260331,26,House,331,1840-05-12,,87,67,TO SUSPEND THE RULES TO PRINT EXTRA COPIES OF THE PRESIDENT'S MESSAGE RELATING TO THE SURRENDER TO THE U.S. OF PERSONS CHARGED WITH PIRACY AND MURDER ON THE U.S. VESSEL PLATTSBURG IN 1817.  (P. 390-2),,,Foreign Policy Budget,,Foreign and Defense Policy,-757.6625063341866,-132.16227610214847,-0.174,-0.329,-0.131,-0.001,0.418,0.747,-71.252,
2016-10-19 13:03:23,RH0260332,26,House,332,1840-05-12,,72,85,"TO AMEND H.R. 100, A BILL TO INSURE EXECUTION OF THE LAWS RELATING TO THE COLLECTION OF DUTIES ON IMPORTS, SAID AMENDMENT TO ELIMINATE SECTION PROVIDING THAT WHENEVER A SUIT BE BROUGHT AGAINST A CUSTOMS OFFICER FOR EXECUTION OF HIS DUTIES, NO PERSON HAVIG THE SAME INTERESTS WITH THAT OF THE PARTY TO THE SUIT SHALL BE COMPETENT AS A WITNESS UNLESS CALLED TO TESTIFY BY THE ADVERSE PARTY",Tariffs,,Domestic Social Policy,,Civil Liberties,-1.134911431063739,-0.08088296160504782,-0.644,0.65,-0.052,-0.265,0.347,0.701,-92.948409,
2016-10-19 13:03:23,RH0260333,26,House,333,1840-05-12,,122,32,"TO ORDER H.R. 100, A BILL TO INSURE EXECUTION OF THE LAWS RELATING TO THE COLLECTION OF DUTIES ON IMPORTS, TO BE ENGROSSED FOR THIRD READING.  (P. 391-2)",Tariffs,,Domestic Social Policy,,Civil Liberties,0.7924758305389136,0.8268265239862218,-0.661,0.303,-0.057,0.416,0.219,0.838,-60.486384,
2016-10-19 13:03:23,RH0260334,26,House,334,1840-05-13,,15,52,"TO ADJOURN, MOTION MADE DURING DEBATE ON THE PUBLIC PRINTING BILL, A BILL PROPOSING TO CHANGE THE MODE OF EXECUTING THE PUBLIC PRINTING TO THAT OF A GOVERNMENT PRINTING OFFICE. (P. 392-3)",,,Government Organization,,Government Management,-2.1265259642658947,0.19278915879169978,-0.302,0.835,-0.182,-0.495,0.467,0.881,-15.22158,
2016-10-19 13:03:23,RH0260335,26,House,335,1840-05-13,,33,63,"TO ADJOURN, MOTION MADE DURING DEBATE ON THE PUBLIC PRINTING BILL.  (P. 392-3)",,,Government Organization,,Government Management,-2.376241957258529,-0.388912767492943,-0.433,0.64,-0.318,-0.774,0.848,0.948,-13.394979,
2016-10-19 13:03:23,RH0260336,26,House,336,1840-05-13,,37,72,"TO ADJOURN, MOTION MADE DURING DEBATE ON THE PUBLIC PRINTING BILL.  (P. 393-1)",,,Government Organization,,Government Management,-1.5542056322556201,-0.06910841126451124,-0.002,-0.066,-0.122,-0.454,0.622,0.872,-33.396982,
2016-10-19 13:03:23,RH0260337,26,House,337,1840-05-13,,68,52,TO ORDER A CALL OF THE HOUSE MOTION MADE DURING DEBATE ON THE PUBLIC PRINTING BILL.  (P. 393-1),,,Government Organization,,Government Management,-1.87258597173072,-0.2524745674555586,-0.373,0.446,0.079,0.244,0.481,0.775,-63.238461,
2016-10-19 13:03:23,RH0260338,26,House,338,1840-05-13,,63,84,"TO ADJOURN, MOTION MADE DURING DEBATE ON THE PUBLIC PRINTING BILL.  (P. 393-2)",,,Government Organization,,Government Management,-2.522582079419899,-0.23260607727140636,0.261,-0.891,-0.304,-0.697,0.857,0.939,-26.223967,
2016-10-19 13:03:23,RH0260339,26,House,339,1840-05-14,,81,97,TO TABLE A REPORT RELATING TO THE HOUSE DISTURBANCE BETWEEN MR. R. GARLAND AND MR. J. BYNUM.  (P. 395-2),,,Internal Organization,,Miscellaneous Policy,-2.1143181708519174,-0.5687079566838761,0.195,-0.981,0.155,0.424,0.716,0.871,-64.953298,
2016-10-19 13:03:23,RH0260340,26,House,340,1840-05-14,,69,108,TO SUSTAIN THE CHAIR'S DECISION THAT A REPORT BY A SELECT COMMITTEE IS GERMANE TO THE DISCUSSION OF THE HOUSE DISTURBANCE BETWEEN MR. R. GARLAND AND MR. J. BYNUM. (P. 394-3),,,Internal Organization,,Miscellaneous Policy,-1.1420011521544116,0.09738225462612496,0.221,-0.155,-0.093,-0.471,0.522,0.814,-68.666377,
2016-10-19 13:03:23,RH0260341,26,House,341,1840-05-14,,88,93,TO TABLE ANY CONSIDERATION OF HOUSE DISTURBANCE BETWEEN MR. R. GARLAND AND MR. J. BYNUM.  (P. 396-1),,,Internal Organization,,Miscellaneous Policy,-2.5661393279171576,-0.5609949485967335,-0.136,-0.212,0.13,0.293,0.693,0.851,-68.4255,
2016-10-19 13:03:23,RH0260342,26,House,342,1840-05-14,,73,106,TO TABLE ANY CONSIDERATION REGARDING THE PUNISHMENT OF MR. R. GARLAND AND MR. J. BYNUM FOR CREATING A HOUSE DISTURBANCE.  (P. 396-3),,,Internal Organization,,Miscellaneous Policy,-2.1611627819154484,-0.6929102308192588,-0.198,-0.265,0.105,0.281,0.507,0.799,-78.798617,
2016-10-19 13:03:23,RH0260343,26,House,343,1840-05-14,,106,57,TO ADOPT A RESOLUTION FOR SELECT COMMITTEE TO INSTRUCT HOUSE ON WHAT FURTHER PROCEEDINGS ARE NECESSARY REGARDING THE HOUSE DISTURBANCE CREATED BY MR. R. GARLAND AND MR. J. BYNUM.,,,Internal Organization,,Miscellaneous Policy,-2.144511768507433,0.28404632951820813,0.028,0.224,0.066,0.178,0.228,0.73,-86.87099,
2016-10-19 13:03:23,RH0260344,26,House,344,1840-05-14,,83,79,TO ADJOURN.  (P. 398-1),,,Internal Organization,,Miscellaneous Policy,-2.3383791148412567,-0.44970703291873004,-0.008,-0.431,-0.169,-0.418,0.772,0.889,-42.791052,
2016-10-19 13:03:23,RH0260345,26,House,345,1840-05-15,,74,80,TO SUSPEND THE RULES TO INTRODUCE A RESOLUTION DESIGNATING A DAY FOR THE CONSIDERATION OF ALL MATTERS REPORTED BY THE COMMITTEE FOR THE DISTRICT OF COLUMBIA.,,,Internal Organization,,Miscellaneous Policy,-3.2277212496558345,-0.5379799574456219,-0.158,-0.028,-0.197,-0.353,0.797,0.903,-38.278355,
2016-10-19 13:03:23,RH0260346,26,House,346,1840-05-15,,70,105,TO ORDER A CALL OF THE HOUSE MOTION MADE DURING CONSIDERATION OF THE PUBLIC PRINTING BILL.  (P. 399-2),,,Government Organization,,Government Management,-2.034999663606099,0.04052499495409148,0.015,0.01,-0.152,-0.432,0.757,0.903,-47.56591,
2016-10-19 13:03:23,RH0260347,26,House,347,1840-05-15,,98,107,TO ADOPT A REPORT AND RESOLUTION OF THE MINORITY OF THE SELECT COMMITTEE ON THE PUBLIC PRINTING OF THE HOUSE AS A SUBSTITUTE TO REPORT AND RESOLUTION OF MAJORITY MEMBERS OF SELECT COMMITTEE.,,,Government Organization,,Government Management,-2.6911832286056163,-0.40042759917713794,-0.167,0.049,-0.57,-1.225,0.98,0.99,-7.852215,
2016-10-19 13:03:23,RH0260348,26,House,348,1840-05-15,,176,13,"TO ADOPT A REPORT OF THE SELECT COMMITTEE ON PUBLIC PRINTING, SAID REPORT PROVIDING WAYS TO REDUCE COST OF PUBLIC PRINTING BY FIFTEEN PER CENT.  (P. 399-2)",,,Budget Special Interest,,Government Management,9.347366875894043,-5.6699781423407964,0.521,-0.8,0.16,-0.099,0.077,0.937,-41.097559,
2016-10-19 13:03:23,RH0260349,26,House,349,1840-05-15,,104,87,TO TABLE A REPORT OF THE COMMITTEE ON PRINTING IN RELATION TO THE SEPARATION OF THE PATRONAGE OF THE GOVERNMENT FROM THE PUBLIC PRESS.  (P. 399-3),Civil Service and Patronage,,Government Organization,,Government Management,-2.49635656674692,-0.3664744959672284,-0.007,-0.349,0.546,1.265,0.966,0.984,-10.987722,
2016-10-19 13:03:23,RH0260350,26,House,350,1840-05-15,,117,83,TO SUSPEND THE RULES TO PROCEED TO THE BUSINESS IN THE COMMITTEE OF THE WHOLE.  (P. 400-1),,,Internal Organization,,Miscellaneous Policy,-2.9654253836477786,-0.03158244072955893,-0.041,0.09,0.403,0.786,0.904,0.96,-18.586622,
2016-10-19 13:03:23,RH0260351,26,House,351,1840-05-15,,73,94,"TO TABLE H.R. 53, A BILL TO AMEND AN ACT TO REMIT THE DUTIES UPON CERTAIN GOODS DESTROYED BY A N.Y. FIRE IN DEC. 1835.",Tariffs,,Regulation Special Interest,,Government Management,-24.00228550600667,-4.511454815695329,-0.199,0.265,0.249,0.06,0.644,0.844,-54.09662,
2016-10-19 13:03:23,RH0260352,26,House,352,1840-05-15,,60,100,"TO ORDER A CALL OF THE HOUS, MOTION MADE DURING DEBATE ON H.R. 53.",Tariffs,,Regulation Special Interest,,Government Management,-9.88823266085001,-2.719757851853654,-0.369,0.929,0.159,0.093,0.4,0.775,-73.487993,
2016-10-19 13:03:23,RH0260353,26,House,353,1840-05-15,,87,80,TO ORDER ENGROSSMENT AND THIRD READING OF H.R. 53. (P. 400-2),Tariffs,,Regulation Special Interest,,Government Management,60.0860426991064,8.464132020574002,-0.141,-0.008,-0.187,0.018,0.6,0.808,-63.541297,
2016-10-19 13:03:23,RH0260354,26,House,354,1840-05-15,,69,81,"TO ORDER THE PREVIOUS QUESTION, ON H.R. 53.",Tariffs,,Regulation Special Interest,,Government Management,-10.46765208729631,-1.24768016100715,-0.149,0.312,-0.257,-0.142,0.739,0.88,-37.039317,
2016-10-19 13:03:23,RH0260355,26,House,355,1840-05-15,,36,90,"TO ADJOURN, MOTION MADE DURING DEBATE ON H.R. 53.",Tariffs,,Regulation Special Interest,,Government Management,-27.816762319066825,-13.10416095372794,-0.463,-0.225,0.101,0.021,0.194,0.77,-65.473052,
2016-10-19 13:03:23,RH0260356,26,House,356,1840-05-15,,78,51,TO ORDER A CALL OF THE HOUSE.,,,Internal Organization,,Miscellaneous Policy,-7.747953038992833,-2.9649718840601507,-0.258,-0.966,-0.071,-0.053,0.059,0.628,-79.6723,
2016-10-19 13:03:23,RH0260357,26,House,357,1840-05-15,,124,0,TO RESOLVE THE HOUSE INTO THE COMMITTEE OF THE WHOLE.,,,Internal Organization,,Miscellaneous Policy,,,0.0,0.0,0.0,0.0,-3200000.0,0.742,0.0,
2016-10-19 13:03:23,RH0260358,26,House,358,1840-05-15,,43,69,"TO ADJOURN, MOTION MADE DURING CONSIDERATION OF H.R. 55, A BILL FOR THE RELIEF OF ANDREW LAW.",,,Budget Special Interest,,Government Management,1.5898276244485663,0.37479084856965617,0.353,0.936,0.058,-0.211,0.279,0.723,-64.659255,
2016-10-19 13:03:23,RH0260359,26,House,359,1840-05-16,,72,94,"TO ORDER A CALL OF THE HOUSE, MOTION MADE DURING RE- CONSIDERATION OF THE RESOLUTION PROVIDING WAYS TO REDUCE THE COST OF PUBLIC PRINTING BY FIFTEEN PER CENT.",,,Budget Special Interest,,Government Management,-2.3940656094278827,-0.14677095459935557,-0.106,0.107,-0.101,-0.244,0.667,0.855,-71.323406,
2016-10-19 13:03:23,RH0260360,26,House,360,1840-05-16,,84,98,TO RECONSIDER THE VOTE WHICH PASSED THE RESOLUTION PROPOSING TO REDUCE THE PRICE OF PUBLIC PRINTING BY 15%.,,,Budget Special Interest,,Government Management,-1.824014211786733,-0.20808710465743582,0.063,-0.323,-0.199,-0.631,0.905,0.956,-28.947815,
2016-10-19 13:03:23,RH0260361,26,House,361,1840-05-16,,132,42,TO SUSPEND THE RULES TO CONSIDER A RESOLUTION PROPOSING THAT FROM MONDAY NEXT THE HOUSE WILL RECESS EACH DAY FROM 2:30 TO 4:00.,,,Internal Organization,,Miscellaneous Policy,-0.52578938676904,0.668237312013107,0.649,0.327,0.034,0.374,0.024,0.764,-87.908698,
2016-10-19 13:03:23,RH0260362,26,House,362,1840-05-16,,80,96,TO PASS H.R. 53.,Tariffs,,Regulation Special Interest,,Government Management,-11.770302763461316,-1.2484642034653521,-0.146,0.47,-0.232,-0.114,0.7,0.864,-50.841323,
2016-10-19 13:03:23,RH0260363,26,House,363,1840-05-16,,78,96,TO RECONSIDER THE VOTE BY WHICH THE HOUSE REFUSED TO PASS H.R. 53.,Tariffs,,Regulation Special Interest,,Government Management,-20.170595349927297,-2.0877654884920025,-0.11,0.131,-0.279,-0.08,0.769,0.897,-41.540332,
2016-10-19 13:03:23,RH0260364,26,House,364,1840-05-16,,54,68,"TO ORDER A CALL OF THE HOUSE AND TO THEN PROCEED TO THE CONSIDERATION OF H.R. 23, A BILL FOR THE RELIEF OF B. ADAMS, AND CO.",,,Budget Special Interest,,Government Management,40.48578278121607,1.4311469668729642,-0.06,-0.998,-0.07,0.01,0.278,0.68,-74.762416,
2016-10-19 13:03:23,RH0260365,26,House,365,1840-05-16,,63,60,TO ADJOURN.,,,Internal Organization,,Miscellaneous Policy,8.097156556243215,0.7148578278121608,-0.05,0.31,0.063,-0.045,0.317,0.667,-76.370217,
2016-10-19 13:03:23,RH0260366,26,House,366,1840-05-18,,86,47,TO ORDER A CALL OF THE HOUSE.,,,Internal Organization,,Miscellaneous Policy,4.957442789536663,1.6453824482188395,-0.132,0.991,-0.066,0.077,0.085,0.677,-80.742083,
2016-10-19 13:03:23,RH0260367,26,House,367,1840-05-18,,106,76,"TO SUSPEND THE RULES IN ORDER FOR THE HOUSE TO RESOLVE ITSELF INTO THE COMMITTEE OF THE WHOLE AND CONSIDER THE SENATE BILL CALLED ""THE INDEPENDENT TREASURY BILL.""",,,Internal Organization,,Miscellaneous Policy,-2.9143087652881077,-0.0013718665404740468,-0.019,0.054,0.454,0.901,0.921,0.967,-15.4673,
2016-10-19 13:03:23,RH0260368,26,House,368,1840-05-18,,105,79,"TO SUSPEND THE RULES AND CONSIDER A RES. THAT THE HOUSE RESOLVE ITSELF INTO THE COMMITTEE OF THE WHOLE TO CONSIDER S. 127, A BILL ""TO PROVIDE FOR THE COLLECTION, SAFEKEEPING, TRANSFER, AND DISBURSEMENT OF THE PUBLIC REVENUE,"" AND THAT IT BE MADE THE SPECAL ORDER OF THE DAY UNTIL DISPOSED OF.",,,Internal Organization,,Miscellaneous Policy,-2.6656091189770548,-0.1519568463558314,-0.356,0.797,0.542,1.176,0.949,0.978,-14.896901,
2016-10-19 13:03:23,RH0260369,26,House,369,1840-05-18,,37,108,"TO ORDER A CALL OF THE HOUSE, MOTION MADE DURING CONSIDER- ATION,OF A PETITION OF CITIZENS OF N.J. REQUESTING THAT THE PROCEEDS FROM THE SALES OF PUBLIC LANDS BE JUSTLY DISTRIBUTED AMONG THE STATES OF THE UNION.",Public Lands,,Budget General Interest,,Government Management,-3.3512931007148152,-2.454756464235248,-0.469,-0.883,0.062,0.107,0.0,0.745,-81.576586,
2016-10-19 13:03:23,RH0260370,26,House,370,1840-05-18,,86,61,TO TABLE THE PETITION FROM N.J. REQUESTING THAT THE PROCEEDS FROM THE SALES OF PUBLIC LANDS BE JUSTLY DISTRIBUTED AMONG THE STATES OF THE UNION.,Public Lands,,Budget General Interest,,Government Management,-3.327744225451846,-0.43087502648705145,-0.082,-0.158,0.313,0.544,0.934,0.973,-15.572581,
2016-10-19 13:03:23,RH0260371,26,House,371,1840-05-18,,64,78,TO TABLE A RESOLUTION AND AMENDMENT FROM IND. EXPRESSING DISSATISFACTION AT THE FAILURE OF THE HOUSE TO MAKE APPROPRIATIONS FOR THE CUMBERLAND ROAD.,Public Works,,Government Organization,,Government Management,4.8438347256097805,0.8655149117073213,-0.176,0.013,0.134,-0.16,0.5,0.775,-66.19505,
2016-10-19 13:03:23,RH0260372,26,House,372,1840-05-18,,55,82,"TO ORDER A CALL OF THE HOUSE, MOTION MADE DURING CONSIDERA- TION OF A PETITION AND RESOLUTION FROM IND., EXPRESSING DISSATISFACTION AT THE FAILURE OF THE HOUSE TO MAKE APPROPRIATIONS FOR THE CUMBERLAND ROAD.",Public Works,,Government Organization,,Government Management,3.5238335060282675,0.9587160124340353,-0.072,0.705,0.092,-0.151,0.309,0.723,-75.035654,
2016-10-19 13:03:23,RH0260373,26,House,373,1840-05-19,,116,86,"TO SUSPEND THE RULES OF THE HOUSE TO RESOLVE INTO THE COMMITTEE OF THE WHOLE UNTIL THE FIRST BILL TAKEN UP ""IN COMMITTEE"" SHALL BE DISPOSED OF.",,,Internal Organization,,Miscellaneous Policy,-2.8591390563240524,-0.18485801205533176,-0.072,0.021,0.612,1.238,0.976,0.99,-9.2673,
2016-10-19 13:03:23,RH0260374,26,House,374,1840-05-19,,84,61,"TO ADJOURN, MOTION MADE DURING CONSIDERATION OF H.R. 15, A BILL TO SECURE THE FREEDOM OF ELECTIONS AND PROVIDE FOR MORE FAITHFUL ADMINISTRATION OF PATRONAGE.",Civil Service and Patronage,,Government Organization,,Government Management,-2.1335364894228155,-0.7267133925672475,-0.23,-0.236,-0.083,-0.225,0.443,0.764,-74.64978,
2016-10-19 13:03:23,RH0260375,26,House,375,1840-05-20,,58,83,"TO TABLE A MOTION TO AMEND YESTERDAY'S JOURNAL REGARDING CONSIDERATION OF H.R. 15, A BILL TO SECURE THE FREEDOM OF ELECTIONS AND PROVIDE MORE EFFECTUALLY FOR THE ADMINI- STRATION OF GOVERNMENT PATRONAGE.",Civil Service and Patronage,,Government Organization,,Government Management,-2.3155688391948117,-0.17271676436672787,-0.091,0.038,-0.221,-0.552,0.879,0.95,-20.219141,
2016-10-19 13:03:23,RH0260376,26,House,376,1840-05-20,,60,113,"TO ORDER A CALL OF THE HOUSE, MOTION MADE DURING CONSIDER- ATION OF S. 12, A BILL SUPPLEMENTAL TO AN ACT ENTITLED: ""AN ACT TO GRANT PRE-EMPTION RIGHTS TO SETTLERS ON THE PUBLIC LANDS.""",Public Lands,,Budget Special Interest,,Government Management,-1.231849420430322,0.2156555133785637,0.322,-0.181,-0.082,-0.385,0.283,0.751,-80.459886,
2016-10-19 13:03:23,RH0260377,26,House,377,1840-05-20,,92,53,SHALL H.R. 15 BE REJECTED?,Civil Service and Patronage,,Government Organization,,Government Management,-2.220276510005756,-0.2264884832018419,-0.32,0.484,0.486,1.266,0.943,0.979,-7.49648,
2016-10-19 13:03:23,RH0260378,26,House,378,1840-05-20,,108,53,TO DECIDE IF H.R. 15 SHALL BE REJECTED.,Civil Service and Patronage,,Government Organization,,Government Management,-2.4517286783844003,0.18901076708974923,0.093,-0.039,0.532,1.255,0.868,0.957,-16.733156,
2016-10-19 13:03:23,RH0260379,26,House,379,1840-05-21,,53,122,"TO TABLE S. 12, PUBLIC LANDS BILL.",Public Lands,,Budget General Interest,,Government Management,-1.5272642348170737,0.3516852446229881,0.667,-0.667,-0.23,-0.871,0.377,0.811,-65.916797,
2016-10-19 13:03:23,RH0260380,26,House,380,1840-05-21,,100,90,"TO SUSTAIN THE SPEAKERS' DECISION THAT IF THE MOTION FOR THE PREVIOUS QUESTION BE SUSTAINED THE MAIN QUESTION WILL BE, SHALL S. 12 BE READ FOR A THIRD TIME?",Public Lands,,Budget General Interest,,Government Management,-1.0345291176909666,-0.0342838737984581,0.571,-0.625,0.171,0.956,0.584,0.804,-66.596954,
2016-10-19 13:03:23,RH0260381,26,House,381,1840-05-21,,59,72,"TO ADJOURN, MOTION MADE DURING CONSIDERATION OF S. 127, A BILL ""TO PROVIDE FOR THE COLLECTION, SAFEKEEPTING, TRANSFER AND DISBURSEMENT OF THE PUBLIC REVENUE.""",,,Budget General Interest,,Government Management,-4.308844024572281,-0.4603523673119761,0.028,-0.581,-0.149,-0.2,0.661,0.847,-47.887127,
2016-10-19 13:03:23,RH0260382,26,House,382,1840-05-21,,69,58,TO ADJOURN.,,,Internal Organization,,Miscellaneous Policy,-4.977304339174228,-1.0425956508761343,-0.15,-0.296,-0.179,-0.208,0.759,0.89,-38.954023,
2016-10-19 13:03:23,RH0260383,26,House,383,1840-05-22,,61,78,TO ORDER A CALL OF THE HOUSE.,,,Internal Organization,,Miscellaneous Policy,-2.3024216777306687,-0.1477737847194024,0.176,-0.553,-0.125,-0.314,0.705,0.871,-51.647024,
