date_generated,id,congress,chamber,rollnumber,date,keyvote,yea,nay,description,Issue1,Issue2,Peltzman1,Peltzman2,Clausen1,mid.dim1,mid.dim2,spread.dim1,spread.dim2,pre,classified,log_likelihood,geo_mean_probability
2017-01-23 07:31:50,RS0370593,37,Senate,593,1863-01-22,,14,21,TO CONSENT TO THE APPOINTMENT OF HIRAM PAULDING TO BE A REAR-ADMIRAL IN THE NAVY.,,,Defense Policy Resolutions,,Foreign and Defense Policy,-0.014,-1.0,0.134,-0.009,0.286,0.714,-18.469917,0.59
2017-01-23 07:31:50,RS0370594,37,Senate,594,1863-01-22,,12,25,"TO REFER TO THE COMMITTEE ON NAVAL AFFAIRS, S.J.RES. 124, A RESOLUTION PROVIDING THAT THE SECRETARY OF THE NAVY BE DIRECTED NOT TO RECEIVE AND ACCEPT LEAGUE ISLAND, NEAR PHILADELPHIA, UNLESS CONGRESS SHOULD OTHERWISE DIRECT, WITH INSTRUCTIONS TO EXAMINE ND REPORT THE ADVISABILITY OF ACQUIRING THIS ISLAND",Public Lands,,Defense Policy Resolutions,,Foreign and Defense Policy,0.206,0.979,0.121,-0.203,0.25,0.757,-18.093611,0.613
2017-01-23 07:31:50,RS0370595,37,Senate,595,1863-01-22,,6,30,"TO AMEND S. 448, A BILL AUTHORIZING THE SECRETARY OF THE TREASURY TO PUT TO THE GOVERNOR OF MINNESOTA, EXPENSES INCURRED IN SUPPRESSING INDIAN HOSTILITIES WITHIN THAT STATE, WHICH AMENDMENT PROPOSES THAT THE PRESIDENT APPOINT ONE OR MORE COMMISSIONERS TOADJUST AND SETTLE CLAIMS BETWEEN THE U",,,Government Organization,,Government Management,-0.276,0.046,0.144,-0.306,0.5,0.917,-9.602725,0.766
2017-01-23 07:31:50,RS0370596,37,Senate,596,1863-01-23,,26,13,"TO AMEND S. 470, AN ACT TO PROVIDE GREATER COMFORT FOR SICK AND WOUNDED SOLDIERS AND TO PROMOTE THE EFFICIENCY OF THE MEDICAL DEPARTMENT OF THE ARMY; WHICH AMENDMENT ELIMINATES SECTION 5 WHICH PROVIDES THAT THE CHIEF MEDICAL DIRECTOR OF DEPARTMENTS AND AMIES IN THE FIELD AND THE SENIOR SURGEON ON DUTY IN THE SURGEON GENERALS OFFICE, SHALL HAVE THE RANK, PAY AND EMOLUMENTS OF A COLONEL OF CAVALRY",,,Defense Policy Resolutions,,Foreign and Defense Policy,-0.047,-0.993,-0.011,-0.133,0.0,0.667,-24.5013,0.534
2017-01-23 07:31:50,RS0370597,37,Senate,597,1863-01-24,,21,18,"TO PASS S.J.RES. 124, A BILL WHICH PROVIDES THAT THE SECRETARY OF THE NAVY BE DIRECTED NOT TO RECEIVE AND ACCEPT LEAGUE ISLAND, NEAR PHILADELPHIA, UNLESS CONGRESS SHALL OTHERWISE DIRECT.",Public Lands,,Defense Policy Resolutions,,Foreign and Defense Policy,0.251,0.738,-0.187,0.17,0.389,0.718,-18.742929,0.618
2017-01-23 07:31:50,RS0370598,37,Senate,598,1863-01-24,,17,18,"TO AMEND S. 463 (12 STAT 641, APP. FEB. 7, 1863), A BILL MAKING APPOINTMENTS AND PROVISIONS FOR THE QUARTERMASTER GENERAL'S DEPARTMENT; WHICH AMENDMENT FIXES RESPONSIBILITIES FOR SUPPLIES.  (P. 501-1, 2)",,,Defense Policy Budget,,Foreign and Defense Policy,0.27,0.962,-0.129,0.069,0.059,0.543,-20.902369,0.55
2017-01-23 07:31:50,RS0370599,37,Senate,599,1863-01-24,,21,16,"TO CONCUR IN THE AMENDMENT, MADE IN THE COMMITTEE OF THE WHOLE, TO S. 463 (12 STAT 641, APP. FEB. 7, 1863), A BILL MAKING APPOINTMENTS AND PROVISIONS FOR THE QUARTERMASTER GENERAL'S DEPARTMENT; WHICH AMENDMENT FIXES RESPONSIBILITIES FOR SUPPLIES.  (P. 50-3)",,,Defense Policy Budget,,Foreign and Defense Policy,-0.705,0.074,0.008,0.397,0.312,0.703,-22.40158,0.546
2017-01-23 07:31:50,RS0370600,37,Senate,600,1863-01-24,,14,19,"TO ADJOURN, MOTION MADE DURING CONSIDERATION OF S. 430 (12 STAT 642, APP. FEB. 7, 1863), A BILL WHICH PROVIDES FOR THE PROTECTION OF OVERLAND IMMIGRANTS TO THE STATES AND TERRITORIES OF THE PACIFIC.  (P. 504-2)",,,Defense Policy Resolutions,,Foreign and Defense Policy,-0.241,-0.971,0.152,-0.306,0.5,0.788,-15.8658,0.618
2017-01-23 07:31:50,RS0370601,37,Senate,601,1863-01-26,,10,25,"TO AMEND H.R. 582 (12 STAT 652, APP. FEB. 16, 1863), A BILL TO PROVIDE FOR THE RELIEF OF PERSONS FOR DAMAGES SUSTAINED BY REASON OF DEPREDATIONS AND INJURIES BY CERTAIN BANDS OF SIOUX INDIANS; WHICH AMENDMENT PROPOSES TO DECREASE THE AP- PROPRIATIONS.  (",,,Indian Affairs,Budget Special Interest,Government Management,-0.558,-0.83,0.088,-0.147,0.0,0.714,-18.313547,0.593
2017-01-23 07:31:50,RS0370602,37,Senate,602,1863-01-27,,18,22,TO CONSIDER THE RESOLUTION WHICH REQUESTS THE PRESIDENT OF THE U. S. TO TRANSMIT TO THE SENATE COPIES OF THE RECORD AND ALL PROCEEDINGS RELATING TO THE COURT MARTIAL OF MAJOR GENERAL F. J. PORTER.  (P. 527-1),,,Defense Policy Resolutions,,Foreign and Defense Policy,-0.316,-0.949,0.103,-0.223,0.389,0.725,-21.689865,0.581
2017-01-23 07:31:50,RS0370603,37,Senate,603,1863-01-27,,27,15,"TO AMEND H.R. 591 (12 STAT 755, APP. MAR. 3, 1863), A BILL TO INDEMNIFY THE PRESIDENT AND OTHER PERSONS FOR SUSPENDING THE WRIT OF HABEAS CORPUS, AND ACTS DONE IN PURSUANCE THEREOF; WHICH AMENDMENT PROPOSES TO EXTEND TO CRIMINAL PROSECUTIONS PROVISION FO THE TRANSFER OF SUITS AGAINST GOVERNMENT OFFICERS ACTING UNDER PRESIDENTIAL AUTHORITY FROM THE STATE COURTS WHERE THEY MAY HAVE COMMENCED TO THE U",Judiciary,,Domestic Social Policy,Government Organization,Civil Liberties,-0.315,-0.884,-0.291,0.603,0.667,0.881,-10.590111,0.777
2017-01-23 07:31:50,RS0370604,37,Senate,604,1863-01-27,,14,27,TO AMEND H.R. 591 SO AS TO PREVENT THE REMOVAL OF CASES FROM STATE COURTS TO THE NEXT CIRCUIT COURT OF THE U.S. (P. 540-3),Judiciary,,Domestic Social Policy,Government Organization,Civil Liberties,-0.014,-0.024,0.241,-0.209,0.643,0.878,-10.522859,0.774
2017-01-23 07:31:50,RS0370605,37,Senate,605,1863-01-27,,18,20,"TO AMEND H.R. 591 BY PROVIDING THAT IF AT THE TRIAL THERE APPEARED TO BE CAUSE FOR ARREST, OR IF THE DEFENDANT ACTED IN GOOD FAITH OR UNDER PRESIDENTIAL ORDERS, SUCH ACTS SHALL CONSTITUTE A COMPLETE DEFENSE AND THE JUDGE SHOULD SO INSTRUCT THE JURY.  (P.546-2)",Judiciary,,Domestic Social Policy,Government Organization,Civil Liberties,-0.031,1.0,-0.074,-0.052,0.0,0.526,-24.105298,0.53
2017-01-23 07:31:50,RS0370606,37,Senate,606,1863-01-27,,14,24,TO AMEND H.R. 591 SO AS TO BAR A DEFENDANT FROM SETTING UP THE DEFENSE OF PROBABLE CAUSE.  (P. 546-3),Judiciary,,Domestic Social Policy,Government Organization,Civil Liberties,0.046,-0.091,0.164,-0.225,0.5,0.816,-15.707399,0.661
2017-01-23 07:31:50,RS0370607,37,Senate,607,1863-01-27,,20,20,"TO AMEND H.R. 591 BY PROVIDING THAT, WITH THE EXCEPTION OF THOSE IN THE MILITARY OR NAVAL SERVICE, NO PERSON ARRESTED OR TO BE ARRESTED FOR AIDING IN THE REBELLION, AFTER PASSAGE OF THIS ACT, SHALL BE HELD IN CUSTODY FOR MORE THAN 10 DAYS; UNLESS SUCH CHRGES ARE PRODUCED IN WRITING AND FILED IN A U",Judiciary,,Domestic Social Policy,Government Organization,Civil Liberties,0.168,-0.001,0.2,-0.217,0.55,0.775,-17.076637,0.653
2017-01-23 07:31:50,RS0370608,37,Senate,608,1863-01-27,,11,29,TO AMEND H.R. 591 TO RENDER THE PRESIDENT AMENABLE TO THE CONSTITUTION AND TO DISALLOW ARBITRARY ARRESTS.  (P. 552-2),Judiciary,,Domestic Social Policy,Government Organization,Civil Liberties,0.03,0.996,0.264,-0.171,0.727,0.925,-9.358541,0.791
2017-01-23 07:31:50,RS0370609,37,Senate,609,1863-01-27,,18,18,"TO AMEND H.R. 591 BY PROVIDING THAT THE PRESIDENT BE EMPOWERED TO EMPLOY COUNSEL OR TAKE ANY STEPS NECESSARY FOR THE DEFENSE OF ANY OFFICER OR PERSON BEING SUED OR PROSECUTED, UPON APPLICATION OF THAT PERSON OR OFFICER TO THE PRESIDENT FOR HIS ASSISTANCE  (P",Judiciary,,Domestic Social Policy,Government Organization,Civil Liberties,0.129,0.992,-0.114,0.005,0.5,0.75,-20.81964,0.561
2017-01-23 07:31:50,RS0370610,37,Senate,610,1863-01-27,,6,33,"TO AMEND H.R. 591 BY PROVIDING THAT ANY STATE OR POLITICAL PRISONERS IN CUSTODY OF ARMY OFFICERS BE IMMEDIATELY TURNED OVER TO THE JUDICIAL TRIBUNAL HAVING JURISDICTION IN THEIR CASES, SO THAT THEY MAY BE TRIED BY LAW. (P. 553-1)",Judiciary,,Domestic Social Policy,Government Organization,Civil Liberties,-0.219,0.001,0.585,-1.074,1.0,1.0,-0.226462,0.994
2017-01-23 07:31:50,RS0370611,37,Senate,611,1863-01-27,,6,34,TO AMEND H.R. 591 BY SUBSTITUTING 3 YEARS IN PLACE OF 2 YEARS AS THE PERIOD OF TIME TO PERMIT INSTITUTION OF PROCEEDINGS.  (P. 553-3),Judiciary,,Domestic Social Policy,Government Organization,Civil Liberties,-0.418,-0.874,0.271,-0.233,0.667,0.95,-6.209068,0.856
2017-01-23 07:31:50,RS0370612,37,Senate,612,1863-01-27,,30,9,"TO AMEND H.R. 591 BY PROVIDING THAT PROBABLE CAUSE BE A COMPLETE DEFENSE IN AN ACTION FOR FALSE ARREST, AND THE JURY BE SO INSTRUCTED BY THE COURT.  (P. 554-2)",Judiciary,,Domestic Social Policy,Government Organization,Civil Liberties,-0.287,-0.356,-0.151,0.385,0.667,0.923,-10.503463,0.764
2017-01-23 07:31:50,RS0370613,37,Senate,613,1863-01-27,,22,17,TO AMEND H.R. 591 BY PROVIDING THAT ALL CIVILIANS UNDER ARREST BE RELEASED WITHIN 30 DAYS UNLESS A WRITTEN COMPLAINT IS MADE AGAINST THE PERSON HELD.  (P. 554-2),Judiciary,,Domestic Social Policy,Government Organization,Civil Liberties,0.221,0.01,1.18,-1.122,0.529,0.795,-13.985479,0.699
2017-01-23 07:31:50,RS0370614,37,Senate,614,1863-01-27,,33,7,TO PASS H.R. 591.  (P. 554-3),Judiciary,,Domestic Social Policy,Government Organization,Civil Liberties,-0.153,0.068,-0.567,1.159,1.0,1.0,-0.576002,0.986
2017-01-23 07:31:50,RS0370615,37,Senate,615,1863-01-28,,21,20,TO POSTPONE CONSIDERATION OF THE RESOLUTION WHICH AMENDS THE THE 34TH RULE OF THE SENATE BY ADDING THE FOLLOWING WORDS: A COMMITTEE ON AGRICULTURE TO CONSIST OF 5 MEMBERS.,Agriculture,,Internal Organization,,Miscellaneous Policy,0.259,-0.049,-0.036,0.403,0.5,0.756,-21.651885,0.59
2017-01-23 07:31:50,RS0370616,37,Senate,616,1863-01-28,,8,28,"TO AMEND H.R. 610 (12 STAT 642, APP. FEB. 9, 1863), A BILL MAKING APPROPRIATIONS FOR THE SUPPORT OF THE ARMY FOR THE FISCAL YEAR ENDING JUNE 30, 1864; WHICH AMENDMENT PROPOSES THAT NO NEGRO, SLAVE OR FREE, IS TO PARTICIPATE IN THE BENEFITS OF THIS APPROPIATION",Civil Rights/Desegregation/Busing/Affirmative Action,,Defense Policy Budget,,Foreign and Defense Policy,-0.143,-0.029,0.575,-1.155,1.0,1.0,-0.545179,0.985
2017-01-23 07:31:50,RS0370617,37,Senate,617,1863-01-28,,31,6,"TO AMEND H.R. 649 (12 STAT 638, APP. FEB. 4, 1863), A BILL MAKING APPROPRIATIONS FOR THE CONSULAR AND DIPLOMATIC EXPENSES OF THE GOVERNMENT FOR THE FISCAL YEAR ENDING JUNE 30, 1864; WHICH AMENDMENT PROVIDES FOR THE SLA- VERY OF THE CONSUL AT GUAYAMAS.",,,Foreign Policy Budget,,Foreign and Defense Policy,-0.992,-0.124,-0.124,-0.398,0.0,0.838,-14.303316,0.679
2017-01-23 07:31:50,RS0370618,37,Senate,618,1863-01-28,,38,1,"TO GO INTO EXECUTIVE SESSION, MOTION MADE DURING CONSIDERATION OF H.R. 649 (12 STAT 638, APP. FEB. 4, 1863), A BILL MAKING APPROPRIATIONS FOR THE CONSULAR AND DIPLOMATIC EXPENSES OF THE GOVERNMENT FOR THE FISCAL YEAR ENDING JUNE 30, 1864.  (P. 569-1)",,,Foreign Policy Budget,,Foreign and Defense Policy,-0.995,0.097,-0.963,-2.018,0.0,0.974,-4.003354,0.902
2017-01-23 07:31:50,RS0370619,37,Senate,619,1863-01-30,,12,28,"TO ADJOURN, MOTION MADE DURING CONSIDERATION OF H.R. 634, AN ACT TO GIVE AID TO THE STATE OF MISSOURI TO SECURE THE ABOLISHMENT OF SLAVERY IN SAID STATE.",Slavery,,Domestic Social Policy,,Civil Liberties,-0.113,-0.154,0.721,-0.335,1.0,1.0,-1.24423,0.969
2017-01-23 07:31:50,RS0370620,37,Senate,620,1863-01-30,,16,22,"TO AMEND H.R. 634 BY PROVIDING THAT SLAVERY BE ABOLISHED IN MISSOURI IN 1885 INSTEAD OF 1876, SO AS TO ALLOW THIS STATE TO PARTICIPATE IN THE BENEFITS OF THE APPROPRIATIONS IN THIS BILL.  (P. 617-1)",Slavery,,Domestic Social Policy,,Civil Liberties,0.007,1.0,0.095,0.001,0.187,0.658,-22.875166,0.548
2017-01-23 07:31:50,RS0370621,37,Senate,621,1863-01-30,,16,21,"TO AMEND H.R. 634 BY MAKING APPROPRIATIONS FOR IMMEDIATE EMANCIPATION BY 1865, AND BY APPROPRIATING A LESSER SUM FOR GRADUAL EMANCIPATION IN 1876.  (p. 622-2)",Slavery,,Budget Special Interest,,Government Management,0.193,-0.273,-0.214,0.136,0.375,0.73,-15.976181,0.649
2017-01-23 07:31:50,RS0370622,37,Senate,622,1863-01-31,,15,21,"TO PASS H.R. 519, A BILL TO INCREASE THE PAY OF E.H. BROOKE, THE CHIEF CLERK IN THE PAYMASTER'S DEPARTMENT, DURING THE WAR FOR SIX MONTHS THEREAFTER.  (P. 639-2)",,,Budget Special Interest,,Government Management,-0.451,-0.892,0.038,-0.017,0.067,0.611,-23.787517,0.516
2017-01-23 07:31:50,RS0370623,37,Senate,623,1863-01-31,,30,7,"TO PASS H.R. 635 (12 STAT 682, APP. FEB. 25, 1863), A BILL MAKING APPROPRIATIONS FOR THE LEGISLATIVE, EXECUTIVE AND JUDICIAL EXPENSES OF THE GOVERNMENT FOR THE FISCAL YEAR ENDING JUNE 30, 1864; WHICH AMENDMENT PROPOSES TO REDUCE THE MILEAGE OF THE MEMBER OF BOTH HOUSES TO ONE-FORTH OF WHAT IT IS TODAY.",Congressional Pay and Benefits,,Internal Organization,Budget Special Interest,Government Management,0.275,0.665,0.198,0.075,0.0,0.811,-11.99288,0.723
2017-01-23 07:31:50,RS0370624,37,Senate,624,1863-02-02,,22,16,TO TABLE THE RESOLUTION WHICH PROVIDES FOR THE INVESTIGATION OF FACTS RELATING TO THE ARREST AND IMPRISONMENT OF M. Y. JOHNSON.  (P. 666-2),Nullification/Secession/Reconstruction,,Domestic Social Policy,,Civil Liberties,-0.021,-0.122,-0.541,1.224,0.937,0.974,-2.666668,0.932
2017-01-23 07:31:50,RS0370625,37,Senate,625,1863-02-02,,19,20,"TO AMEND H.R. 635 (12 STAT 682, APP. FEB. 25, 1863), A BILL MAKING APPROPRIATIONS FOR THE LEGISLATIVE, EXECUTIVE AND JUDICIAL EXPENSES OF THE GOVERNMENT FOR THE FISCAL YEAR ENDING JUNE 30, 1864; WHICH AMENDMENT PROPOSES TO INCREASE THE APPROPRIATIONS.",Congressional Pay and Benefits,,Internal Organization,Budget Special Interest,Government Management,-0.619,0.597,-0.044,-0.245,0.368,0.692,-25.671893,0.518
2017-01-23 07:31:50,RS0370626,37,Senate,626,1863-02-02,,26,12,TO AMEND H.R. 635 BY MAKING AN APPROPRIATION FOR INVESTIGATIONS TO TEST THE PRACTICABILITY OF CULTIVATING AND PREPARING HEMP AND FLAX AS A SUBSTITUTE FOR COTTON.  (P. 670-2),Agriculture,,Budget Special Interest,,Agriculture,-0.136,-0.991,-0.261,0.149,0.667,0.895,-10.858219,0.751
2017-01-23 07:31:50,RS0370627,37,Senate,627,1863-02-02,,8,35,TO AMEND H.R. 635 BY PROPOSING TO REPEAL ALL LAWS AND PARTS OF LAWS GIVING A BOUNTY ON THE TONNAGE OF VESSELS ENGAGED IN THE COD AND OTHER BANK FISHERIES.  (P. 673-2),Tax rates,,Regulation Special Interest,,Government Management,-0.41,-0.443,0.186,-0.29,0.75,0.953,-10.484786,0.784
2017-01-23 07:31:50,RS0370628,37,Senate,628,1863-02-02,,27,14,TO AMEND H.R. 635 BY INCREASING THE APPROPRIATION FOR THE COLLECTION OF AGRICULTURAL STATISTICS AND FOR OTHER AIDS TO AGRICULTURE.  (P. 676-1),Agriculture,,Budget Special Interest,,Government Management,0.997,0.082,0.051,-0.212,0.0,0.659,-25.660013,0.535
2017-01-23 07:31:50,RS0370629,37,Senate,629,1863-02-02,,12,17,"TO ADJOURN, MOTION MADE DURING DISCUSSION ON THE RESOLUTION REGARDING RELATIONS WITH FRANCE AND MEXICO, OBJECTING TO FRENCH AUTHORITY IN MEXICO.  (NO QUORUM.)  (P. 679-2)",,,Foreign Policy Resolutions,,Foreign and Defense Policy,0.296,0.191,-0.073,0.043,0.0,0.586,-18.579559,0.527
2017-01-23 07:31:50,RS0370630,37,Senate,630,1863-02-03,,22,22,"TO AMEND S. 356, AN ACT PROVIDING FOR SETTLEMENT OF THE ACCOUNTS OF I. R. DILLES, LATE CONSUL AT BREMEN; WHICH AMENDMENT REDUCES THE ALLOTMENT SETTLING HIS CLAIM. (P. 693-3)",,,Foreign Policy Budget,,Foreign and Defense Policy,-0.116,-0.993,-0.128,0.142,0.455,0.727,-22.434466,0.601
2017-01-23 07:31:50,RS0370631,37,Senate,631,1863-02-03,,29,16,"TO POSTPONE ALL PRIOR ORDERS AND CONSIDER A RESOLUTION REGARDING RELATIONS WITH FRANCE AND MEXICO, OBJECTING TO FRENCH AUTHORITY IN MEXICO.  (P. 694-3)",,,Foreign Policy Resolutions,,Foreign and Defense Policy,0.365,0.927,0.159,-0.113,0.187,0.711,-22.775894,0.603
2017-01-23 07:31:50,RS0370632,37,Senate,632,1863-02-04,,34,10,"TO TABLE THE RESOLUTION REGARDING RELATIONS WITH FRANCE AND MEXICO, OBJECTING TO FRENCH AUTHORITY IN MEXICO.",,,Foreign Policy Resolutions,,Foreign and Defense Policy,-0.303,-0.953,-0.283,0.215,0.7,0.932,-9.313647,0.809
2017-01-23 07:31:50,RS0370633,37,Senate,633,1863-02-04,,25,17,"TO RECONSIDER THE VOTE PASSING S.J.RES. 124  A BILL PROVI- DING THAT THE SECRETARY OF THE NAVY BE DIRECTED NOT TO RECEIVE AND ACCEPT TITLE TO LEAGUE ISLAND, NEAR PHILADELPHIA, UNLESS CONGRESS SHALL OTHERWISE DIRECT. (P. 504-2)",,,Defense Policy Resolutions,,Foreign and Defense Policy,0.187,-0.162,0.204,-0.255,0.412,0.762,-17.352809,0.662
2017-01-23 07:31:50,RS0370634,37,Senate,634,1863-02-04,,14,33,"TO AMEND S. 493, A BILL PROVIDING FOR THE ENCOURAGEMENT OF REENLISTMENTS, FOR ENROLLING AND DRAFTING THE MILITIA, AND FOR OTHER PURPOSES; WHICH AMENDMENT PROPOSES TO ELIMINATE FROM SECTION TWO, THAT PORTION WHICH CONFERS TO THE PRESIDENT, ADDITIONAL POWES OVER THE MILITIA",,,Defense Policy Resolutions,,Foreign and Defense Policy,-0.118,0.008,0.285,-0.278,0.786,0.936,-7.966687,0.844
2017-01-23 07:31:50,RS0370635,37,Senate,635,1863-02-05,,13,28,"TO AMEND S. 493, A BILL PROVIDING FOR THE ENCOURAGEMENT OF REENLISTMENTS, FOR ENROLLING AND DRAFTING THE MILITIA, AND FOR OTHER PURPOSES; WHICH AMENDMENT ELIMINATES SECTION 2 WHICH PROVIDES THAT A MAN IS SUBJECT TO MARTIAL LAW ONLY WHEN HE IS IN THE SERVCE",,,Domestic Social Policy,,Civil Liberties,-0.204,-0.723,0.461,-0.373,0.769,0.927,-5.226299,0.88
2017-01-23 07:31:50,RS0370636,37,Senate,636,1863-02-05,,9,26,"TO AMEND H.R. 118 (APP. FEB. 16, 1863), A BILL TO SECURE THE MEN EMPLOYED IN THE WESTERN DEPARTMENT OR DEPARTMENT OF MISSOURI, THEIR PAY, BOUNTY, PENSION, AND FOR OTHER PUR- POSES; WHICH AMENDMENT PROPOSES THAT THE PROVISIONS OF THIS ACT APPLY TO ALL OFFCERS AND MEN IN ANY MILITARY DEPARTMENT OF THE U.S",,,Defense Policy Budget,,Foreign and Defense Policy,-0.217,-0.976,0.144,-0.032,0.333,0.829,-14.355325,0.664
2017-01-23 07:31:50,RS0370637,37,Senate,637,1863-02-06,,2,30,"TO AGREE TO THE AMENDMENT TO H.R. 118, WHICH AMENDMENT PRO- POSES THAT PROVISIONS OF THIS ACT APPLY TO ALL OFFICERS AND MEN IN ANY MILITARY DEPARTMENT OF THE U.S.",,,Defense Policy Budget,,Foreign and Defense Policy,-0.462,-0.887,0.257,-0.088,0.0,0.938,-3.868712,0.886
2017-01-23 07:31:50,RS0370638,37,Senate,638,1863-02-06,,14,24,"TO POSTPONE CONSIDERATION OF H.R. 265 (12 STAT 915, APP. FEB. 9, 1863), AN ACT TO AUTHORIZE THE COURT OF CLAIMS OF THE U. S. TO HEAR AND DETERMINE THE CLAIMS OF THE HEIRS OF STEPHEN JOHNSON.",,,Budget Special Interest,,Government Management,-0.975,-0.085,0.036,0.393,0.214,0.711,-25.890322,0.506
2017-01-23 07:31:50,RS0370639,37,Senate,639,1863-02-06,,17,19,TO AMEND H.R. 265 BY AUTHORIZING THE SECRETARY OF THE INTERIOR TO ISSUE A LAND SCRIP TO SAID HEIRS.  (P. 750-2),Slavery,,Budget Special Interest,,Government Management,-0.297,-0.953,-0.067,0.205,0.235,0.639,-21.788068,0.546
2017-01-23 07:31:50,RS0370640,37,Senate,640,1863-02-06,,18,20,TO AMEND H.R. 265 BY PROVIDING THAT THE COURT DETERMINE THE AMOUNT OF LAND SCRIP NECESSARY TO COMPENSATE THE SAID HEIRS.  (P. 761-3),Slavery,,Budget Special Interest,,Government Management,-0.265,-0.964,-0.14,0.39,0.333,0.684,-18.690678,0.611
2017-01-23 07:31:50,RS0370641,37,Senate,641,1863-02-06,,14,22,TO AMEND H.R. 265 BY SETTING THE ESTIMATION OF THE SCRIP. (P. 761-3),Slavery,,Budget Special Interest,,Government Management,-0.378,-0.926,-0.116,0.547,0.143,0.667,-17.942413,0.608
2017-01-23 07:31:50,RS0370642,37,Senate,642,1863-02-06,,24,16,TO PASS H.R. 265.  (P. 762-2),Slavery,,Budget Special Interest,,Government Management,-0.252,-0.947,0.13,-0.435,0.187,0.675,-19.121335,0.62
2017-01-23 07:31:50,RS0370643,37,Senate,643,1863-02-07,,2,36,"TO AMEND H.R. 634, A BILL WHICH PROVIDES FOR GIVING AID TO THE STATE OF MISSOURI TO SECURE THE ABOLISHMENT OF SLAVERY IN SAID STATE; WHICH AMENDMENT PROPOSES COMPENSATION FOR INCONVENIENCES CAUSED BY THE EMANCIPATION OF THE SLAVES. (P. 776-1)",Slavery,,Budget Special Interest,,Government Management,-0.692,-0.721,0.192,-0.129,0.0,0.947,-7.546092,0.82
2017-01-23 07:31:50,RS0370644,37,Senate,644,1863-02-07,,8,27,"TO AMEND H.R. 634 BY PROVIDING THAT COMPENSATION BE MADE TO THE STATE OF MISSOURI, PROVIDED EMANCIPATION IS ADOPTED WITHIN 3 YEARS AFTER PASSAGE OF THIS ACT.  (P. 776-3)",Slavery,,Budget Special Interest,,Government Management,-0.164,-0.025,0.652,-0.858,1.0,1.0,-0.789815,0.978
2017-01-23 07:31:50,RS0370645,37,Senate,645,1863-02-07,,9,27,TO AMEND H.R. 634 BY ELIMINATING THE PROVISION ALLOWING PAYMENTS FOR EACH SLAVE EMANCIPATED UNDER THIS ACT AND AN ACT TO BE PASSED BY MISSOURI.  (P. 781-2),Slavery,,Budget Special Interest,,Government Management,-0.088,-0.021,0.389,-0.509,0.889,0.972,-4.487126,0.883
2017-01-23 07:31:50,RS0370646,37,Senate,646,1863-02-07,,10,25,"TO ADJOURN, MOTION MADE DURING CONSIDERATION OF H.R. 634. (P. 789-3)",Slavery,,Budget Special Interest,,Government Management,-0.108,0.069,0.529,-1.303,1.0,1.0,-1.289442,0.964
2017-01-23 07:31:50,RS0370647,37,Senate,647,1863-02-07,,13,27,"TO AMEND H.R. 634 BY PROVIDING THAT THE MISSOURI LEGISLATURE PUT THE QUESTION OF EMANCIPATION BEFORE THE VOTERS OF THAT STATE, BEFORE THE BONDS ARE DELIVERED. (P. 791-1)",Slavery,,Budget Special Interest,,Government Management,-0.028,-0.027,0.637,-0.943,0.846,0.95,-3.576418,0.914
2017-01-23 07:31:50,RS0370648,37,Senate,648,1863-02-07,,12,27,"TO AMEND H.R. 634 BY ENDORSING THE BONDS ISSUED PURSUANT TO THIS BILL WITH THE PURPOSE OF THE BILL, TO TEST ITS CONSTITUTIONALITY.  (P. 794-1)",Slavery,,Budget Special Interest,,Government Management,-0.088,-0.018,0.618,-0.982,1.0,1.0,-1.376634,0.965
2017-01-23 07:31:50,RS0370649,37,Senate,649,1863-02-07,,13,22,TO AMEND H.R. 634 BY REDUCING THE APPROPRIATION FOR THE EMANCIPATION OF SLAVES IN MISSOURI.  (P. 794-2),Slavery,,Budget Special Interest,,Government Management,0.328,0.659,0.085,-0.249,0.462,0.8,-18.639781,0.587
2017-01-23 07:31:50,RS0370650,37,Senate,650,1863-02-07,,14,24,TO AMEND H.R. 634 BY FIXING THE SUM TO BE APPROPRIATED FOR THE EMANCIPATION OF SLAVES IN MISSOURI.  (P. 794-2),Slavery,,Budget Special Interest,,Government Management,0.033,0.981,0.15,-0.076,0.5,0.816,-17.757121,0.627
2017-01-23 07:31:50,RS0370651,37,Senate,651,1863-02-07,,15,21,TO AMEND H.R. 634 BY REDUCING THE APPROPRIATION FOR THE EMANCIPATION OF SLAVES IN MISSOURI.  (P. 794-3),Slavery,,Budget Special Interest,,Government Management,0.42,0.847,0.101,-0.245,0.333,0.722,-20.527904,0.565
2017-01-23 07:31:50,RS0370652,37,Senate,652,1863-02-07,,11,26,"TO AMEND H.R. 634 BY PROVIDING THAT THE EMANCIPATION OF SLAVES IN MISSOURI BE MADE OPERATIVE JULY 14, 1864 INSTEAD OF JULY 4, 1876.  (P. 795-1)",Slavery,,Budget Special Interest,,Government Management,0.164,0.986,-0.087,-0.118,0.0,0.703,-20.269066,0.578
2017-01-23 07:31:50,RS0370653,37,Senate,653,1863-02-07,,9,30,"TO ADJOURN, MOTION MADE DURING DEBATE ON H.R. 634. (P. 800-2)",Slavery,,Budget Special Interest,,Government Management,-0.188,0.133,0.393,-1.567,0.889,0.974,-2.337712,0.942
2017-01-23 07:31:50,RS0370654,37,Senate,654,1863-02-07,,9,28,"TO AMEND H.R. 634 BY PROVIDING THAT THE FUNDS APPROPRIATED BE RESTRICTED TO THE SOLE PURPOSES EXPRESSED IN THE BILL, THAT NO PART BE USED FOR SALARIES OR OTHERWISE.  (P. 800-2)",Slavery,,Budget Special Interest,,Government Management,-0.113,-0.232,0.711,-0.466,1.0,1.0,-1.095819,0.971
2017-01-23 07:31:50,RS0370655,37,Senate,655,1863-02-09,,12,26,"TO AMEND S. 505 (12 STAT 650, APP. FEB. 14, 1863), AN ACT TO INCORPORATE THE NATIONAL ASSOCIATION FOR THE RELIEF OF COLORED WOMEN AND CHILDREN; WHICH AMENDMENT PROHIBITS THE SECRETARY OF WAR FROM GIVING THE CORPORATION THE USE OF LAND NOT USED FOR MILITAY PURPOSES",Public Lands,Civil Rights/Desegregation/Busing/Affirmative Action,Budget Special Interest,,Government Management,-0.006,0.031,0.476,-0.737,0.667,0.895,-5.033231,0.876
2017-01-23 07:31:50,RS0370656,37,Senate,656,1863-02-09,,27,9,"TO PASS S. 505 (12 STAT 650, APP. FEB. 14, 1863), AN ACT TO INCORPORATE THE NATIONAL ASSOCIATION FOR THE RELIEF OF COLORED WOMEN AND CHILDREN.",Civil Rights/Desegregation/Busing/Affirmative Action,,Government Organization,,Government Management,-0.111,-0.044,-0.595,1.075,1.0,1.0,-1.557603,0.958
2017-01-23 07:31:50,RS0370657,37,Senate,657,1863-02-09,,20,21,"TO POSTPONE CONSIDERATION OF S. 486 (12 STAT 665, APP. FEB. 25, 1863), AN ACT TO PROVIDE A NATIONAL CURRENCY SECURED BY A PLEDGE OF U. S. STOCKS AND TO PROVIDE FOR THE CIRCULATION AND REDEMPTION THEREOF. (P. 820-3)",U.S. Currency,,Budget General Interest,,Government Management,-0.412,-0.834,0.053,-0.182,0.05,0.537,-26.261749,0.527
2017-01-23 07:31:50,RS0370658,37,Senate,658,1863-02-10,,14,22,TO AMEND S. 486 BY PROVIDING THAT ALL BANKING INSTITUTIONS ORGANIZED UNDER THIS ACT BE REQUIRED TO KEEP GOLD AND SILVER EQUAL TO ONE-FOURTH OF THE NOTES EACH BANK IS AUTHORIZED TO ISSUE.  (P. 846-2),Banking and Finance,,Regulation Special Interest,,Government Management,-0.413,-0.905,0.243,-0.69,0.643,0.861,-10.602556,0.745
2017-01-23 07:31:50,RS0370659,37,Senate,659,1863-02-10,,9,27,TO AMEND S. 486 BY ELIMINATING THE PROVISION WHICH PROHIBITS THE PAYMENT OF THESE NOTES FOR DUTIES ON IMPORTS AND WOULD ALLOW THESE NOTES TO BE INTRODUCED TO THE EXCLUSION OF ALL OTHER CURRENCY.  (P. 846-3),Banking and Finance,Tariffs,Regulation Special Interest,,Government Management,-0.127,0.903,0.145,-0.136,0.556,0.889,-12.762167,0.702
2017-01-23 07:31:50,RS0370660,37,Senate,660,1863-02-10,,21,16,TO AMEND S. 486 BY PROVIDING THAT ALL CERTIFICATES OF ASSOCIATION SHALL BE PRINTED AND PUBLISHED WITH THE LAWS OF THE UNITED STATES CONTAINED THEREON.  (P. 848-1),Banking and Finance,,Government Organization,,Government Management,-0.348,-0.937,-0.044,0.064,0.125,0.622,-24.636365,0.514
2017-01-23 07:31:50,RS0370661,37,Senate,661,1863-02-10,,19,21,"TO AMEND S. 486 BY PROVIDING THAT AT THE TIME OF COMMENCE- MENT OF BUSINESS, A BANK MUST PROVIDE FOR PAYMENT OF AT LEAST 30% OF ITS CAPITAL STOCK IN GOLD OR SILVER COIN. (P. 849-3)",Banking and Finance,,Regulation Special Interest,,Government Management,-0.095,-0.363,0.107,-0.341,0.526,0.775,-18.367434,0.632
2017-01-23 07:31:50,RS0370662,37,Senate,662,1863-02-10,,6,31,TO AMEND S. 486 BY INCREASING THE MINIMUM AMOUNT OF CAPITAL STOCK REQUIRED OF BANKS.  (P. 850-1),Banking and Finance,,Regulation Special Interest,,Government Management,0.953,-0.255,-0.134,-0.587,-0.167,0.811,-14.667405,0.673
