id,congress,chamber,rollnumber,date,keyvote,yea,nay,description,Issue1,Issue2,Peltzman1,Peltzman2,Clausen1,slope,intercept,mid.dim1,mid.dim2,spread.dim1,spread.dim2
RH0620193,62,House,193,1912-08-22,,94,87,"TO PASS S. 7343, A BILL AUTHORIZING THE ALABAMA POWER COR- PORATION TO CONSTRUCT, MAINTAIN, AND OPERATE A DAM OVER THE COOSA RIVER, ALABAMA.  (P.11596)",Public Works,,Budget Special Interest,,Government Management,-20.483878192877178,-1.7389361847090863,-0.097,0.248,0.085,0.024
RH0620194,62,House,194,1912-08-23,,130,24,TO ADOPT THE REPORT OF THE COMMITTEE ON CONFERENCE ON H. R. 21279.  NO QUORUM.  (P.11761),,,Budget Special Interest,,Government Management,2.1607580697840043,1.6701810368516519,-0.872,-0.214,-0.133,0.356
RH0620195,62,House,195,1912-12-04,,26,253,"TO RECOMMIT H. R. 17470, A BILL GRANTING PENSIONS TO WIDOWS AND MINOR CHILDREN OF ANY OFFICER OR ENLISTED MAN WHO SERVED IN WAR WITH SPAIN OR PHILIPPINE INSURRECTION, TO THE COMMIT- TEE ON PENSIONS WITH INSTRUCTIONS TO REPORT BACK BILL WITH AMENDMENT, PROVIDING THAT NO WIDOW OR CHILD SHALL HAVE A PENSIONABLE STATUS UNLESS IT IS SHOWN THAT THE DECEASED HUS- BAND OR FATHER WAS ACTUALLY ENGAGED IN AND EXPOSED TO DANGER IN ONE OR MORE BATTLES.  (P.113)",Military Pensions/Veterans Benefits,,Defense Policy Budget,,Foreign and Defense Policy,4.903557541824308,2.647403284876005,-0.535,0.024,0.273,-0.322
RH0620196,62,House,196,1912-12-09,,102,145,"TO ADOPT A RESOLUTION PROVIDING FOR AN INQUIRY AS TO THE PURCHASE OF THE HOME OF THOMAS JEFFERSON AT MONTICELLO, VA. (P.346)",,,Government Organization,,Government Management,2.7363662709270464,0.8817544479756992,0.037,0.983,0.044,-0.093
RH0620197,62,House,197,1912-12-10,,169,116,"TO CONSIDER H. RES. 687, A RESOLUTION DECLARING THAT CHARLES C. BOWMAN WAS NOT ELECTED A REPRESENTATIVE TO THE 62ND CONGRESS FROM THE 11TH DISTRICT OF PENNSYLVANIA AND IS NOT ENTITLED TO A SEAT.  (P.384)",Disputed Elections to Congress,,Internal Organization,,Miscellaneous Policy,17.758710257084708,-0.08655485899796478,0.035,0.535,0.697,-0.227
RH0620198,62,House,198,1912-12-11,,94,174,"TO RECOMMIT H. R. 16314, A BILL AMENDING SECTION 162 OF THE ACT TO CODIFY, REVISE, AND AMEND THE LAWS RELATING TO THE JUDICIARY (APP. 3/3/1911), TO THE COMMITTEE ON REVISION OF THE LAWS WITH INSTRUCTIONS TO STRIKE OUT PROVISIONS IN LINES 12, 13 AND 14 AS FOLLOWS.  ""PROVIDED, THAT NO ALLEGATION OR PROOF OF LOYALTY SHALL BE REQUIRED IN THE PRESENTATION OR ADJUDICATION OF SUCH CLAIMS.""  (P.497)",Judiciary,,Domestic Social Policy,,Civil Liberties,-11.495963011950243,2.4394624940712126,0.257,-0.515,-0.322,-0.162
RH0620199,62,House,199,1912-12-12,,129,149,"TO ADOPT A SUBSTITUTE FOR THE RESOLUTION THAT CHARLES C. BOWMAN WAS NOT ELECTED AND IS NOT ENTITLED TO A SEAT IN THE THE 62ND HOUSE, SAID SUBSTITUTE PROVIDING THAT THE CASE OF MCLEAN AGAINST BOWMAN SHOULD BE DISMISSED FOR WANT OF JURISDICTION.  (P. 550)",Disputed Elections to Congress,,Internal Organization,,Miscellaneous Policy,-27.078153418605556,-0.3290781534186055,-0.001,-0.302,-0.309,-0.066
RH0620200,62,House,200,1912-12-12,,155,120,"TO ADOPT H. RES. 687, A RESOLUTION DECLARING THAT CHARLES P. BOWMAN WAS NOT ELECTED A REPRESENTATIVE TO THE 62ND CONGRESS FROM THE 11TH DISTRICT OF PENNSYLVANIA AND IS NOT ENTITLED TO A SEAT.  (P.551)",Disputed Elections to Congress,,Internal Organization,,Miscellaneous Policy,-16.72998310518133,0.045059628313989186,0.022,-0.323,0.431,0.149
RH0620201,62,House,201,1912-12-12,,88,183,"TO ADOPT H. RES. 743, THE RESOLUTION DECLARING THAT GEORGE R. MC LEAN, THE CONTESTANT, WAS ELECTED A REPRESENTATIVE IN THE 62ND CONGRESS FROM THE ELEVENTH DISTRICT OF PENNSYLVANIA AND IS ENTITLED TO A SEAT.",Disputed Elections to Congress,,Internal Organization,,Miscellaneous Policy,-5.9786388697782975,-1.674564831154726,-0.114,-0.993,0.184,0.178
RH0620202,62,House,202,1912-12-14,,198,86,"TO ORDER THE PREVIOUS QUESTION ON ADOPTION OF H. RES. 752, A RESOLUTION FOR CONSIDERATION OF S. 3175, WITH AMENDMENTS RE- PORTED BY HOUSE COMMITTEE ON IMMIGRATION AND NATURALIZATION. (P.650)",Immigration/Naturalization,,Domestic Social Policy,,Social Welfare,0.7334816601289518,-0.29264671048469215,-0.584,-0.721,0.061,-0.481
RH0620203,62,House,203,1912-12-16,,133,118,"TO AMEND THE MOTION TO LIMIT DEBATE ON S. 3974 (37 STAT. 647 APP. 2/19/1912), A BILL INCREASING THE LIMIT OF COST OF THE U. S. PUBLIC BUILDING AT DENVER, COLO., BY INCREASING THE LIMIT OF GENERAL DEBATE TO 30 MINUTES INSTEAD OF 15 MINUTES. (P.734)",Public Works,,Budget Special Interest,,Government Management,-98.90098365125641,-15.527444596734693,-0.147,-0.989,-0.171,-0.01
RH0620204,62,House,204,1912-12-17,,211,75,"TO AGREE TO A SUBSTITUTE FOR S. 3175, A BILL TO REGULATE THE IMMIGRATION OF ALIENS AND THE RESIDENCE OF ALIENS IN THE UNITED STATES, WHICH SUBSTITUTE PROVIDES FOR THE EXCLUSION OF ILLITERATE IMMIGRANTS.  (P.656)",Immigration/Naturalization,,Domestic Social Policy,,Social Welfare,0.025897089199072115,-0.330778435682617,-0.665,-0.348,0.006,-1.34
RH0620205,62,House,205,1912-12-18,,170,80,TO DISPENSE WITH CALENDAR WEDNESDAY FOR THIS DAY AND ALLOW OTHER BUSINESS.  (P.859),,,Internal Organization,,Miscellaneous Policy,0.6475938779124467,-0.18783774871105213,-0.743,-0.669,0.087,-0.777
RH0620206,62,House,206,1912-12-18,,192,66,"TO PASS S. 3175, ""AN ACT REGULATING THE IMMIGRATION OF ALIENS TO AND RESIDENCE OF ALIENS IN THE UNITED STATES.""",Immigration/Naturalization,,Domestic Social Policy,,Social Welfare,0.0,-0.325,-0.663,-0.325,0.0,-1.132
RH0620207,62,House,207,1913-01-03,,104,89,"TO DISCHARGE APPROPRIATIONS COMMITTEE FROM FURTHER CONSIDERATION OF S.C. RES. 32, A BILL APPROVING PLAN, DESIGN AND LOCATION FOR LINCOLN MEMORIAL, AND REFER SAME TO THE LIBRARY COMMITTEE INSTEAD OF APPROPRIATION COMMITTEE. (P.944)",,,Budget Special Interest,Government Organization,Government Management,-0.3951584832239368,0.20248624015899735,-0.844,0.536,0.011,0.161
RH0620208,62,House,208,1913-01-10,,86,144,"TO GO INTO COMMITTEE OF THE WHOLE HOUSE FOR FURTHER CONSI- DERATION OF H. R. 27148 (37 STAT. 791, APP. 3/4/1913), A BILL MAKING POST OFFICE APPROPRIATIONS FOR 1914.  (P.1358)",,,Budget Special Interest,,Government Management,18.993330193656924,5.44007242596685,-0.289,-0.049,0.266,-0.081
RH0620209,62,House,209,1913-01-10,,40,153,"TO AMEND PROCEDURE FOR DEBATE ON H.R. 27475 (37 STAT. 1400, 3/3/1913), A BILL GRANTING PENSIONS AND INCREASE IN PENSIONS TO SOLDIERS AND SAILORS OF CIVIL WAR AND TO WIDOWS AND DEPENDENT CHILDREN OF SOLDIERS AND SAILORS IN SAID WAR, BY LIMITING THE TIME OF DEBATE TO TWO HOURS INSTEAD OF TEN MINUTES.  (P. 1371)",Military Pensions/Veterans Benefits,,Defense Policy Budget,,Foreign and Defense Policy,12.045716251768908,5.038120908317236,-0.462,-0.527,0.277,-0.133
RH0620210,62,House,210,1913-01-11,,47,183,"TO RECOMMIT H. R. 27475 (37 STAT. 1400, 3/3/1913), A BILL GRANTING PENSIONS TO SOLDIERS AND SAILORS OF THE CIVIL WAR AND TO WIDOWS AND DEPENDENT CHILDREN OF SAID SOLDIERS, TO THE COMMITTEE ON INVALID PENSIONS WITH INSTRUCTIONS TO STRIKE OUT GIVEN LIST OF NAMES AND REPORT BACK FORTHWITH. (P.1405-2)",Military Pensions/Veterans Benefits,,Defense Policy Budget,,Foreign and Defense Policy,10.010221017333643,3.9040168598121223,-0.393,-0.03,0.72,-0.416
RH0620211,62,House,211,1913-01-14,,122,118,"TO AMEND H. R. 27148 (37 STAT. 791, APP. 3/4/1913), A BILL MAKING POST OFFICE APPROPRIATIONS FOR 1914, BY INSERTING CLAUSE WHICH PROVIDES THAT ""NO PART OF THE SUMS HEREIN PRO- VIDED FOR THE SALARIES OF POST-OFFICE INSPECTORS OR FOR PER DIEM ALLOWANCES TO SUCH INSPECTORS SHALL BE PAID OR ALLOWED TO THEM WHILE THEY MAY BE ENGAGED IN MAKING SELECTIONS AND RECOMMENDATIONS FOR THE APPOINTMENT OF FOURTH-CLASS POST- MASTERS"", AS A LIMITATION TO THE EXPENDITURE OF THE MONEY APPROPRIATED.  (P.1517)",Civil Service and Patronage,,Regulation Special Interest,,Government Management,8.555031480554584,1.0284937147054407,-0.118,0.019,0.284,-0.192
RH0620212,62,House,212,1913-01-14,,108,143,"TO AMEND H. R. 27148 (37 STAT. 791, APP. 3/4/1913), A BILL MAKING POST OFFICE APPROPRIATIONS FOR 1914 BY ANNULING THE EXECUTIVE ORDER PLACING ASSISTANT POSTMASTERS AND CLERKS OF SECOND CLASS POSTOFFICES AND 4TH CLASS POSTMASTERS UNDER CIVIL SERVICE.  (P.1518)",Civil Service and Patronage,,Regulation Special Interest,,Government Management,4.593539046863093,0.9189271922320293,-0.197,0.014,0.22,-0.277
RH0620213,62,House,213,1913-01-15,,210,10,"TO ORDER THE PREVIOUS QUESTION ON H. R. 20195, A BILL AMEND- ING THE NATURALIZATION LAW.  (P.1579-1)",Immigration/Naturalization,,Domestic Social Policy,,Social Welfare,0.5477418968072585,-1.0833038427724915,0.729,-0.684,0.093,-0.982
RH0620214,62,House,214,1913-01-17,,186,78,TO PROCEED TO CONSIDERATION OF THE CONFERENCE REPORT ON S. 3175.  (P.1682-2),Immigration/Naturalization,,Domestic Social Policy,,Social Welfare,0.27739488030980525,-0.23263888551277542,-0.798,-0.454,0.06,-1.251
RH0620215,62,House,215,1913-01-17,,60,193,TO TABLE THE CONFERENCE REPORT ON S. 3175.,Immigration/Naturalization,,Domestic Social Policy,,Social Welfare,0.030371930068429163,-0.31656423844846354,-0.607,-0.335,-0.007,1.333
RH0620216,62,House,216,1913-01-17,,168,76,TO ORDER THE PREVIOUS QUESTION ON AGREEING TO CONFERENCE RE- PORT ON S. 3175.  (P.1686),Immigration/Naturalization,,Domestic Social Policy,,Social Welfare,0.3194476216125853,-0.24438643611508415,-0.772,-0.491,0.038,-0.688
RH0620217,62,House,217,1913-01-17,,77,157,"TO RECOMMIT S. 3175 TO THE COMMITTEE ON CONFERENCE WITH IN- STRUCTIONS TO STRIKE OUT THE FOLLOWING: ""CITIZENS OR SUB- JECTS OF ANY COUNTRY THAT ISSUES PENAL CERTIFICATES OR CERT- IFICATES OF CHARACTER WHO DO NOT PRODUCE TO THE IMMIGRATION OFFICIALS SUCH A CERTIFICATE"", AND REPORT BACK FORTHWITH. (P.1673-2)",Immigration/Naturalization,,Domestic Social Policy,,Social Welfare,0.3533818689079087,-0.24173799943504248,-0.728,-0.499,-0.03,0.491
RH0620218,62,House,218,1913-01-20,,36,181,"TO ADJOURN DURING DEBATE ON H. R. 21532, A BILL TO INCORPOR- ATE THE ROCKEFELLER FOUNDATION.  (P.1809)",,,Government Organization,,Government Management,2.6017215934299744,1.541997688082324,-0.231,0.941,0.139,-0.309
RH0620219,62,House,219,1913-01-20,,156,65,"TO SUSPEND RULE AND PASS H. R. 21532, A BILL INCORPORATING THE ROCKEFELLER FOUNDATION.  (P.1810)",,,Government Organization,,Government Management,0.8713409269818806,0.5630068365973668,0.241,0.773,-0.069,0.458
RH0620220,62,House,220,1913-01-21,,84,144,"TO AMEND H. R. 27941 (37 STAT. 704, APP. 3/2/1913), A BILL MAKING 1914 ARMY APPROPRIATIONS, WHICH AMENDMENT PROVIDES THAT NO PART OF THIS OR ANY OTHER APPROPRIATION SHALL BE EXPENDED IN PAYMENT FOR HEAT AND LIGHT FOR QUARTERS OF OFFICERS WHO RECEIVE COMMUTATION OF QUARTERS.  (P.1852)",,,Defense Policy Budget,Regulation Special Interest,Foreign and Defense Policy,0.8414388681236977,0.41212317405129284,-0.447,0.036,0.087,-0.598
RH0620221,62,House,221,1913-01-22,,98,89,"TO ADJOURN DURING DEBATE ON H. R. 23669, A BILL PROVIDING FOR THE DISPOSITION OF TOWN SITES IN CONNECTION WITH RECLAMATION PROJECTS.  (P.1904)",Public Lands,,Budget Special Interest,,Government Management,10.209458266567532,0.7753919181355143,0.022,1.0,0.203,-0.115
RH0620222,62,House,222,1913-01-23,,259,3,TO DISPENSE WITH FURTHER PROCEEDINGS UNDER THE CALL AND PRO- CEED WITH READING JOURNAL.  (P.1920-2),,,Internal Organization,,Miscellaneous Policy,,,0.0,0.0,0.0,0.0
RH0620223,62,House,223,1913-01-23,,2,258,TO TABLE MOTION ON PREVIOUS QUESTION TO APPROVE READING OF JOURNAL IN FULL.  (P.1922),,,Internal Organization,,Miscellaneous Policy,,,0.0,0.0,0.0,0.0
RH0620224,62,House,224,1913-01-23,,140,86,TO ORDER THE PREVIOUS QUESTION ON MOTION TO APPROVE READING OF JOURNAL.  (P.1923),,,Internal Organization,,Miscellaneous Policy,-7.017918390646812,1.349039266657515,0.058,0.942,0.489,0.403
RH0620225,62,House,225,1913-01-23,,150,82,TO APPROVE READING OF JOURNAL.,,,Internal Organization,,Miscellaneous Policy,1000,-531.0,0.107,0.424,0.283,0.0
RH0620226,62,House,226,1913-01-24,,109,152,"TO PASS H. R. 23669, A BILL PROVIDING FOR THE DISPOSITION OF TOWN SITES IN CONNECTION WITH RECLAMATION PROJECTS. (P.1573)",Public Lands,,Budget Special Interest,,Government Management,-514.74780964689,1.5714956192937801,0.002,0.542,-0.178,-0.002
RH0620227,62,House,227,1913-01-25,,183,84,"TO ADOPT THE CONFERENCE REPORT ON S. 3175.  (P.2016, 2017, 1725)",Immigration/Naturalization,,Domestic Social Policy,,Social Welfare,0.20047428958264957,-0.2314153511484712,-0.811,-0.394,0.04,-1.154
RH0620228,62,House,228,1913-01-28,,83,164,"TO RECOMMIT H. R. 28180 (37 STAT. 801, APP. 3/3/1913), A BILL MAKING APPROPRIATIONS WITH INSTRUCTIONS TO STRIKE OUT CLAUSE ""IMPROVING INLAND WATERWAY FROM NORFOLK VA. TO BEAUFORT, N. C.  (P.2147)",Public Works,,Budget Special Interest,,Government Management,0.0184782212602538,0.3166434918864727,0.344,0.323,0.002,-0.626
RH0620229,62,House,229,1913-02-04,,88,121,"TO ADJOURN DURING DEBATE ON H. R. 28499 (37 STAT. 938, APP. 3/4/1913), A BILL MAKING 1914 DISTRICT OF COLUMBIA APPROPRI- ATIONS.  (P.2568)",,,D. C.,Budget Special Interest,Government Management,-1.1091995282524953,-0.3064726424363335,-0.334,0.064,0.042,0.219
RH0620230,62,House,230,1913-02-05,,103,182,TO DISPENSE WITH CALENDAR WEDNESDAY FOR TODAY.  (P.2608),,,Internal Organization,,Miscellaneous Policy,3.5378913524618905,1.0575486208203964,-0.252,0.166,0.115,-0.188
RH0620231,62,House,231,1913-02-08,,221,67,"TO ADOPT H. RES. 818, A RESOLUTION TO PROCEED TO CONSIDER H. R. 17593 WITH COMMITTEE AMENDMENTS AND TO SET UP RULES FOR SAID CONSIDERATION.  (P.2784)",Temperance and Liquor,,Regulation Special Interest,,Social Welfare,-0.22167427107684262,-0.45593564377318874,-0.523,-0.34,-0.022,-0.574
RH0620232,62,House,232,1913-02-08,,86,222,"TO AMEND H. R. 17593, A BILL RELATING TO INTERSTATE SHIPMENT OF INTOXICATING LIQUORS, BY PROVIDING PENALTIES FOR TRANS- PORTATION OR DELIVERY OF INTOXICATING LIQUORS.  (P.2866)",Temperance and Liquor,,Regulation Special Interest,,Social Welfare,-0.5927377248359054,-0.500350313805801,-0.117,-0.431,0.033,0.322
RH0620233,62,House,233,1913-02-08,,247,72,"TO PASS H. R. 17593, A BILL RELATING TO INTERSTATE SHIPMENT OF INTOXICATING LIQUORS.  (P.2762)",Temperance and Liquor,,Regulation Special Interest,,Social Welfare,-0.6284296722156665,-0.573549046112989,-0.561,-0.221,-0.059,-0.543
RH0620234,62,House,234,1913-02-10,,216,0,"TO ADOPT H. RES. 779, A RESOLUTION REQUESTING FROM THE PRESIDENT INFORMATION CONCERNING THE EXEMPTION OF AMERICAN IMPORTERS OF MANILA HEMP FROM PAYMENT OF THE EXPORT TAX THEREON.  (P.2925)",Tariffs,,Regulation Special Interest,,Government Management,,,0.0,0.0,0.0,0.0
RH0620235,62,House,235,1913-02-10,,86,42,TO ORDER THE CALL OF THE HOUSE.  (P.2964),,,Internal Organization,,Miscellaneous Policy,2.6425449352271575,1.484061683159061,-0.26,0.797,-0.053,0.116
RH0620236,62,House,236,1913-02-10,,54,78,TO ADJOURN FOR LACK OF QUORUM.  (P.2966),,,Internal Organization,,Miscellaneous Policy,13.850399372521288,3.769135786657238,-0.34,-0.94,0.091,-0.038
RH0620237,62,House,237,1913-02-11,,129,119,"TO ADOPT H. RES. 519, A RESOLUTION THAT ALL EXPENSES INCUR- RED BY THE COMMITTEE ON BANKING AND CURRENCY IN MAKING THE INVESTIGATION NOT EXCEEDING $25,000, IN ADDITION TO THAT AUTHORIZED BY H. RES. 465, BE PAID OUT OF CONTINGENT FUND. (P.3018)",Impeachments and Investigations,,Internal Organization,Budget Special Interest,Government Management,-3.9508258850884905,0.2737560243774321,0.31,-0.951,0.097,0.142
RH0620238,62,House,238,1913-02-12,,135,123,"TO DISPENSE WITH PROCEEDINGS UNDER CALENDAR WEDNESDAY, AND PROCEED TO CONSIDERATION OF APPROPRIATIONS BILLS. OF APPROPRIATION BILLS.  (P.3043-2)",,,Internal Organization,,Miscellaneous Policy,4.302496079536899,0.41058876113366016,-0.316,-0.949,0.122,-0.164
RH0620239,62,House,239,1913-02-12,,77,183,TO ADJOURN.  (P.3047),,,Internal Organization,,Miscellaneous Policy,3.1509672210675075,1.1635197739432983,-0.434,-0.204,0.152,-0.279
RH0620240,62,House,240,1913-02-12,,131,111,"TO TABLE MOTION TO LIMIT TO 2 1/2 HOURS THE DEBATE ON H. R. 27876, A BILL PROVIDING FOR THE PARTICIPATION OF THE U. S. IN THE PANAMA PACIFIC EXPOSITION.  (P.3048)",,,Budget Special Interest,,Government Management,3.6685076642571306,0.6646904868658833,-0.194,-0.047,-0.111,0.175
RH0620241,62,House,241,1913-02-12,,133,114,TO TABLE A MOTION TO LIMIT DEBATE TO THREE HOURS ON H. R. 27876.  (P.3049),,,Budget Special Interest,,Government Management,4.938375701884598,0.8139216375693813,-0.196,-0.154,-0.111,0.13
RH0620242,62,House,242,1913-02-12,,117,119,TO ORDER THE PREVIOUS QUESTION ON MOTION TO LIMIT DEBATE ON H. R. 27876 TO FIVE MINUTES.  (P.3049),,,Budget Special Interest,,Government Management,3.5328902638077357,0.4364923341052798,-0.243,-0.422,-0.124,0.203
RH0620243,62,House,243,1913-02-18,,155,112,"TO AMEND H. R. 28730 (37 STAT. 736, APP. 3/3/1913), A BILL MAKING 1914 PENSION APPROPRIATIONS BY ELIMINATING CLAUSE, ""THAT FROM AND AFTER 7/1/1913 NO PENSION SHALL BE PAID TO A NOW-RESIDENT WHO IS NOT A CITIZEN OF THE U. S. EXCEPT FOR ACTUAL DISABILITIES INCURRED IN SERVICE.""",Military Pensions/Veterans Benefits,,Defense Policy Budget,,Foreign and Defense Policy,4.196477039098428,0.9070637011715715,-0.209,0.03,-0.349,0.481
RH0620244,62,House,244,1913-02-18,,221,40,"TO PASS H. R. 28730 (37 STAT. 736, APP. 3/3/1913), A BILL MAKING APPROPRIATIONS FOR THE PAYMENT OF INVALID AND OTHER PENSIONS OF THE U. S. FOR 1914.  (P.3362)",Military Pensions/Veterans Benefits,,Defense Policy Budget,,Foreign and Defense Policy,5.551067108941875,2.4925312661327856,-0.451,-0.011,-0.525,0.547
RH0620245,62,House,245,1913-02-19,,174,129,"TO TABLE S. 4356, A BILL INCORPORATING THE AMERICAN ACADEMY OF ARTS AND LETTERS.  (P.3410)",,,Government Organization,,Government Management,1.7051496447410297,-0.030188512880837792,-0.177,-0.332,0.074,-0.251
RH0620246,62,House,246,1913-02-19,,223,119,"TO PASS, OVER PRESIDENT'S VETO, S. 3175, A BILL REGULATING THE IMMIGRATION AND RESIDENCE OF ALIENS IN THE U. S. (P.3410)",Immigration/Naturalization,,Domestic Social Policy,,Social Welfare,0.35272687112398377,-0.19958942383821748,-0.829,-0.492,0.068,-1.115
RH0620247,62,House,247,1913-02-21,,179,34,"TO RESOLVE INTO COMMITTEE OF THE WHOLE TO CONSIDER H. R. 28812 (37 STAT. 891, APP. 3/4/1913), A BILL MAKING 1914 NAVAL APPROPRIATIONS.  (P.3622)",,,Defense Policy Budget,,Foreign and Defense Policy,1.9786284817887554,1.2369046559538668,-0.332,0.58,-0.143,0.418
RH0620248,62,House,248,1913-02-24,,171,102,"TO AMEND H. J. RES. 398, A RESOLUTION EMPOWERING THE COMMIS- SIONER OF THE DISTRICT OF COLUMBIA TO REVOKE LICENSES UNDER CERTAIN CONDITIONS, BY PROVIDING A PENALTY OF $25.00 FOR EACH OFFENCE AND THAT ANYONE AGGRIEVED BY VIOLATION MAY CON- TINUE AT SUCH HOTEL FREE OF CHARGE DURING THE TIME HE RE- MAINS IN THE DISTRICT OF COLUMBIA FOR THE PURPOSE OF PROSE- CUTING HIS COMPLAINT.  (P.3807)",,,D. C.,,Civil Liberties,3.1517824476548633,-0.5284538838923434,0.451,0.893,0.194,-0.356
RH0620249,62,House,249,1913-02-26,,176,158,"TO AMEND H. R. 28812 (37 STAT. 891, APP. 3/4/1913), A BILL MAKING 1914 NAVAL APPROPRIATIONS, BY PROVIDING THAT IN THE PURCHASE OF POWDER FROM THE INDIAN HEAD INDIANA POWDER FAC- TORY, THAT FACTORY SHALL OPERATE ON A MAXIMUM CAPACITY BASIS FOR THE PURPOSE OF ECONOMY.  (P.3853)",,,Defense Policy Budget,Regulation Special Interest,Foreign and Defense Policy,1.6413155181574084,0.0992096606022318,-0.281,-0.362,0.126,-0.444
RH0620250,62,House,250,1913-02-27,,4,288,"TO RECOMMIT H. R. 28858 (37 STAT. 912, 3/4/1913), A BILL MAKING 1913 DEFICIENCY APPROPRIATIONS, TO THE COMMITTEE ON APPROPRIATIONS WITH INSTRUCTIONS TO INCREASE APPROPRIATIONS FOR INSTITUTIONS ADJUDGED TO BE UNDER SECTARIAN CONTROL FOR 1913.",,,Budget Special Interest,,Government Management,,,0.0,0.0,0.0,0.0
RH0620251,62,House,251,1913-02-27,,86,190,"TO ADOPT THE RESOLUTION INSTRUCTING CONFEREES ON H.R. 28766, A BILL RELATING TO PUBLIC BUILDINGS, TO AGREE TO SENATE AMENDMENT 196, WHICH AMENDMENT PROHIBITS AUTHORIZATION OF ANY CONTRACTS FOR THE ERECTION OF POST OFFICE BUILDINGS IN ANY DISTRICT UNTIL ITS RECIEPTS ARE MORE THAN $10,000 PER ANNUM.  (P.4247-2, 4348-1)",Public Works,,Budget Special Interest,,Government Management,1.842210221790784,1.1507456586304259,-0.084,0.996,0.043,-0.135
RH0620252,62,House,252,1913-02-28,,287,15,"TO SUSPEND THE RULES, TAKE BILL FROM SPEAKERS TABLE, DIS- AGREE TO SENATE'S AMENDMENTS AND ASK FOR CONFERENCE ON H. R. 28283 (37 STAT. 828, APP. 3/4/1913), A BILL MAKING 1914 AGRICULTURAL APPROPRIATIONS.  (P.4329-2)",Agriculture,,Budget Special Interest,,Agriculture,1.4298192455345162,1.4621292027539288,-0.447,0.823,-0.111,0.449
RH0620253,62,House,253,1913-02-28,,130,172,"TO SUSPEND THE RULES, DISCHARGE COMMITTEE ON APPROPRIATIONS FROM FURTHER CONSIDERATION OF THE BILL, CONCUR IN SENATE AMENDMENT WITH AN AMENDMENT, DISAGREE TO ALL OTHER SENATE AMENDMENTS AND SEND BILL TO CONFERENCE, ON H. R. 28499 (37 STAT. 938, APP. 3/4/1913), A BILL MAKING 1914 DISTRICT OF COLUMBIA APPROPRIATIONS.  (P.4346-1)",,,D. C.,Budget Special Interest,Government Management,-0.032311079633851617,-0.06634447588878072,-0.413,-0.053,0.003,0.537
RH0620254,62,House,254,1913-03-01,,249,97,"TO PASS OVER PRESIDENT'S VETO, S. 4043 (37 STAT. 699, 3/1/1913), A BILL DIVESTING INTOXICATING LIQUORS OF THEIR INTERSTATE CHARACTER IN CERTAIN CASES.  (P.4434)",Temperance and Liquor,,Regulation General Interest,,Government Management,-0.022636725066377452,-0.3554780874660633,-0.242,-0.35,-0.002,-0.511
RH0620255,62,House,255,1913-03-01,,118,170,"TO RECEDE FROM DISAGREEMENT TO SENATE AMENDMENT #26 AND CONCUR IN SAME WITH AMENDMENT TO H. R. 27148 (37 STAT. 791, APP. 3/4/1913), A BILL MAKING 1914 POST OFFICE APPROPRIA- TIONS, WHICH AMENDMENT PROPOSES TO ELIMINATE CLAUSE AUTHOR- IZING THE POSTMASTER GENERAL TO WEIGH THE MAILS ON RAILROAD ROUTES FOR 30 DAYS IN ORDER TO PROMULGATE RATES DUE TO EST- ABLISHMENT OF THE PARCEL POST SYSTEM, AND ALSO THE CLAUSE DISCONTINUING SECOND CLASS MATTER BEING TRANSPORTED BY FAST FREIGHT.  (P.4461-1)",,,Budget Special Interest,,Government Management,0.2997640711152758,0.2121533537750707,0.65,0.407,0.034,-0.656
RH0620256,62,House,256,1913-03-01,,201,52,"TO SUSPEND RULES AND ADOPT S. J. RES. 164 (37 STAT. 1025, APP. 3/2/1913), A RESOLUTION STOPPING TRAFFIC AND PREVENTING INTERFERENCE WITH THE SUFFRAGE PROCESSION.  (P.4471)",Women's Equality,,D. C.,Domestic Social Policy,Social Welfare,223.63575250576494,130.04746494833213,-0.578,0.786,-0.116,0.003
RH0620257,62,House,257,1913-03-01,,220,84,"TO SUSPEND RULES AND PASS S. 5382, A BILL RELATING TO WORK- MEN'S COMPENSATION, PROVIDING AN EXCLUSIVE REMEDY AND COMPENSATIONS FOR ACCIDENTAL INJURIES RESULTING IN DISABILITY OR DEATH, TO EMPLOYEES OF COMMON CARRIERS BY RAILROAD ENGAGED IN INTERSTATE OR FOREIGN COMMERCE, OR IN THE DISTRICT OF COLUMBIA.",Workplace conditions/8 hour day,,Regulation Special Interest,Domestic Social Policy,Social Welfare,3.784624948387888,1.3796498550261127,-0.387,-0.085,-0.195,0.298
RH0620258,62,House,258,1913-03-02,,195,72,"TO INSTRUCT HOUSE CONFEREES ON H. R. 28858 (37 STAT. 912, APP. 3/4/1913), A BILL MAKING 1913 DEFICIENCY APPROPRIATIONS TO AGREE IN CONFERENCE TO THE SUBSTANCE OF SENATE AMENDMENT #1, INCREASING THE SALARY OF THE SECRETARY TO THE PRESIDENT FROM $6,000 TO $7,500 PER ANNUM.  (P.4616)",,,Budget Special Interest,,Government Management,1.2370655849816021,0.6046671670399038,-0.277,0.262,-0.154,0.72
RH0620259,62,House,259,1913-03-03,,119,91,"TO APPROVE FIRST PART OF RESOLUTION TO THE SUNDRY CIVIL APPROPRIATION BILL, THAT THE MANAGERS OF THE HOUSE SHOULD AGREE IN CONFERENCE TO A PROPOSITION INVOLVING A GOVERNMENT EXHIBIT AT THE EXPOSITION AT SAN FRANCISCO, PROVIDED, THE AMOUNT OF THE APPROPRIATION FOR THE PURPOSE DOES NOT EXCEED $1,000,000.  (P.4788-1, 4787-2)",,,Budget Special Interest,,Government Management,2.071989619509954,0.5098207093846554,-0.317,-0.147,-0.139,0.388
RH0620260,62,House,260,1913-03-03,,98,105,"TO AMEND THE RESOLUTION TO THE SUNDRY CIVIL APPROPRIATION BILL, BY LIMITING THE APPROPRIATION FOR GOVERNMENT EXHIBIT AT SAN FRANCISCO TO $750,000 INSTEAD OF $1,000,000 AS PROPOSED.  (P.4786)",,,Budget Special Interest,,Government Management,3.112746195976434,0.32344622884877156,-0.137,-0.103,-0.155,0.288
RH0620261,62,House,261,1913-03-03,,147,172,"TO RECEDE FROM SENATE AMENDMENT #46 TO H.R. 28812 (37 STAT. 891, APP. 3/4/1913), A BILL MAKING 1914 NAVAL APPROPRIA- TIONS, WHICH AMENDMENT PROVIDES FOR THE BUILDING OF TWO BATTLESHIPS INSTEAD OF ONE.  (P. 4808)",,,Defense Policy Budget,,Foreign and Defense Policy,1.62426019290322,0.12924846558709485,-0.34,-0.423,-0.148,0.527
RH0620262,62,House,262,1913-03-04,,264,48,"TO PASS OVER PRESIDENT'S VETO, H. R. 28775, A BILL MAKING APPROPRIATIONS FOR SUNDRY CIVIL EXPENSES OF THE GOVERNMENT FOR FISCAL YEAR ENDING 1914.  (P.4852)",,,Budget Special Interest,,Government Management,5.282734311159803,-2.347251299843793,0.443,-0.007,0.232,-0.254
