date_generated,id,congress,chamber,rollnumber,date,keyvote,yea,nay,description,Issue1,Issue2,Peltzman1,Peltzman2,Clausen1,mid.dim1,mid.dim2,spread.dim1,spread.dim2,pre,classified,log_likelihood,geo_mean_probability
2017-01-23 07:31:50,RH0540001,54,House,1,1895-12-02,,334,7,"TO ELECT A SPEAKER OF THE HOUSE OF REPRESENTATIVES FOR THE 54TH CONGRESS, T. B. REED (REP) VS. C. F. CRISP (DEM). VOTES FOR CRISP ARE CODED 1, VOTES FOR REED ARE CODED 2. OTHER CANDIDATES INCLUDE J. C. BELL (PEOPLE'S) CODED 5, AND O. B. CULBERSON (DEM) CDED 6.",Election of the Speaker of the House,,Internal Organization,,Miscellaneous Policy,0.0,0.0,0.0,0.0,,,0.0,
2017-01-23 07:31:50,RH0540002,54,House,2,1895-12-10,,92,208,"TO REFER TO THE COMMITTEE ON JUDICIARY A PENDING RESOLUTION REFERRING TO THE IMPEACHMENT OF THOMAS F. BAYARD, U.S. AMBASSADOR TO GREAT BRITAIN, FOR A SPEECH MADE ON THE TARIFF IN SCOTLAND.",Impeachment of President,,Domestic Social Policy,,Civil Liberties,-0.087,-0.615,0.702,0.223,0.956,0.987,-6.625988,0.978
2017-01-23 07:31:50,RH0540003,54,House,3,1895-12-17,,62,200,"TO AMEND A RESOLUION MAKING PROVISION FOR THE AMENDMENT OF HOUSE RULES, BY PROVIDING THAT SIX HOURS SHALL BE ALLOWED FOR DEBATE, IF SO MUCH BE DESIRED, ON ANY CONTESTED ELECTION CASE.",,,Internal Organization,,Miscellaneous Policy,0.021,-0.329,0.246,0.302,0.883,0.973,-20.729888,0.924
2017-01-23 07:31:50,RH0540004,54,House,4,1895-12-26,,210,89,"TO PASS H. RES. 68, RESOLVING THAT IMMEDIATELY AFTER THE ADOPTION OF THIS RESOLUTUTION IT SHALL BE IN ORDER TO CALL UP FOR DEBATE, THE PREVIOUS QUESTION BEING CONSIDERED AS ORDERED, H.R. 2749, A BILL TEMPORARILY INCREASING REVENUE TO MEET EXPENNSES OF TH GOVERNMENT (THE BILL HAD BEEN REPORTED BY THE COMMITTEE ON WAYS AND MEANS)",Tax rates,,Budget General Interest,,Government Management,-0.108,-0.994,-0.368,0.127,0.918,0.976,-20.111653,0.935
2017-01-23 07:31:50,RH0540005,54,House,5,1895-12-26,,227,83,"TO PASS H.R. 2749, A BILL TO TEMPORARILY INCREASE REVENUE TO MEET THE EXPENSES OF THE GOVERNMENT AND TO PROVIDE AGAINST A DEFICIENCY.  (P. 305-1)",Tax rates,,Budget General Interest,,Government Management,-0.096,-0.663,-0.758,-0.279,0.937,0.984,-8.385984,0.973
2017-01-23 07:31:50,RH0540006,54,House,6,1895-12-27,,196,102,"TO PASS H. RES. 70 CONCERNING H.R. 2904, A BILL TO MAINTAIN AND PROTECT THE COIN RESERVE FUND AND TO AUTHORIZE THE ISSUE OF CERTIFICATES OF INDEBTEDNESS TO MEET TEMPORARY DEFICIENCIES OF REVENUE; UPON ADOPTION OF H.RES. 70, IT IMMEDIATELY BECOMES THE ORDR OF THE HOUSE TO CALL UP FOR DEBATE THE SAID BILL H.R",U.S. Currency,,Budget General Interest,,Government Management,-0.068,-0.926,-0.355,0.313,0.898,0.966,-35.143637,0.889
2017-01-23 07:31:50,RH0540007,54,House,7,1895-12-28,,172,136,"TO PASS THE FIRST SECTION OF H.R. 2904, A BILL TO MAINTAIN AND PROTECT THE COIN REDEMPTION FUND AND TO AUTHORIZE THE ISSUE OF CERTIFICATES OF INDEBTEDNESS TO MEET TEMPORARY DEFICIENCIES OF REVENUE.",U.S. Currency,,Budget General Interest,,Government Management,0.12,-0.297,-0.187,0.268,0.669,0.856,-93.780358,0.738
2017-01-23 07:31:50,RH0540008,54,House,8,1896-01-10,,114,181,"TO AMEND AN AMENDMENT TO A HOUSE RES. AMENDING CLAUSE 57 OF RULE 11 OF THE RULES OF THE HOUSE, AND PROVIDING FOR REPORT- ING OF BILLS BY COMMITTEES.  (P. 658-1)",,,Internal Organization,,Miscellaneous Policy,0.18,0.145,0.237,-0.246,0.802,0.925,-58.6601,0.82
2017-01-23 07:31:50,RH0540009,54,House,9,1896-01-10,,115,160,"TO AMEND THE HOUSE RULES, BY GIVING THE COMMITTEE ON BANKING AND CURRENCY THE RIGHT TO REPORT BILLS AT ANY TIME.",Banking and Finance,,Internal Organization,,Miscellaneous Policy,0.191,0.153,0.202,0.007,0.75,0.897,-73.139275,0.766
2017-01-23 07:31:50,RH0540010,54,House,10,1896-02-05,,138,147,"TO PASS H.R. 5210 (29 STAT 393 6/11/1896), A BILL MAKING APPROPRIATIONS TO PRROVIDE FOR THE EXPENSES OF THE GOVERN- MENT OF THE DISTRICT OF COLUMBIA FOR THE FISCAL YEAR ENDING JUNE 30, 1897.",,,D. C.,Budget Special Interest,Government Management,-0.183,0.983,-0.127,-0.296,0.507,0.761,-132.91629,0.627
2017-01-23 07:31:50,RH0540011,54,House,11,1896-02-05,,86,192,TO TABLE THE MOTION TO RECONSIDER THE VOTE BY WHICH H.R. 5210 WAS REJECTED.,,,D. C.,Budget Special Interest,Government Management,-0.095,-0.028,0.242,0.088,0.906,0.971,-24.363295,0.916
2017-01-23 07:31:50,RH0540012,54,House,12,1896-02-05,,188,82,TO RECONSIDER THE VOTE BY WHICH H.R. 5210 WAS REJECTED.,,,D. C.,Budget Special Interest,Government Management,-0.157,0.363,-0.32,-0.243,0.951,0.985,-14.327001,0.948
2017-01-23 07:31:50,RH0540013,54,House,13,1896-02-07,,201,71,"TO COMMIT H.RES. 158 TO THE COMMITTEE ON THE JUDICIARY, IN ORDER TO DEFEAT IT.  THE RESOLUTION STATES THAT THE WORDS OF MR. TALBERT OF S. CAROLINA THAT ""IN THE HEAT OF THE MOMENT HE SAID THAT S. CAROLINA WAS PROUD OF THE PART SHE TOOK IN THE WAR, THAT HEENDORSED SECESSION AND WOULD DO SO AGAIN,"" ARE TREASONABLE AND SEDITIOUS, AND OUGHT TO BE CENSURED AND STRICKEN FROM THE RECORD.",Nullification/Secession/Reconstruction,,Internal Organization,,Miscellaneous Policy,0.437,0.38,0.112,0.22,0.127,0.772,-132.075562,0.615
2017-01-23 07:31:50,RH0540014,54,House,14,1896-02-14,,93,238,"TO CONCUR IN THE SENATE AMENDMENT TO H.R. 2904, A BILL TO MAINTAIN AND PROTECT THE COIN REDEMPTION FUND AND TO AUTHORIZE THE ISSUE OF CERTIFICATES OF INDEBTEDNESS TO MEET TEMPORARY DEFICIENCIES OF REVENUE.  THE AMENDMENT IS A SUBSTITUTE FOR THE ENTIRE BIL",U.S. Currency,,Budget General Interest,,Government Management,-0.022,0.22,0.131,-0.532,0.56,0.878,-98.718807,0.742
2017-01-23 07:31:50,RH0540015,54,House,15,1896-02-19,,72,155,"TO AMEND H.R. 5474, A BILL AMENDING SECTION 8 OF AN ACT OF MAR. 3, 1891 BY EXTENDING FROM 5 TO 10 YEARS THE TIME WITHIN WHICH SUITS MAY BE BROUGHT TO VACATE AND ANNUL PATENTS ON PUBLIC LANDS; WHICH PROPOSED AMENDMENT SUBSTITUTES FOR ALL AFTER THE ENACTIN CLAUSE OF SECTION 8 OF THE ACT OF MAR",Public Lands,,Regulation Special Interest,,Government Management,-0.127,-0.992,0.602,-0.273,0.972,0.991,-6.181142,0.973
2017-01-23 07:31:50,RH0540016,54,House,16,1896-02-26,,155,93,"TO CONCUR IN THE SENATE AMENDMENT TO H.R. 5474 (29 STAT 43, 3/2/1896), A BILL EXTENDING THE TIME WITHIN WHICH SUITS MAY BE BROUGHT TO VACATE AND ANNUL PATENTS ON PUBLIC LANDS, WHICH PROVIDES THAT SUITS SHALL ONLY BE BROUGHT WITH SIX YEARS OF THE DATE OF SSUANCE OF SUCH PATENT.",Public Lands,,Regulation Special Interest,,Government Management,0.023,-0.738,-0.282,0.109,0.902,0.964,-30.178983,0.885
2017-01-23 07:31:50,RH0540017,54,House,17,1896-02-27,,111,166,"TO AMEND A RESOLUTION WHICH DECLARES THAT JOHN C. TARSNEY WAS ELECTED TO CONGRESS FROM THE FIFTH DISTRICT OF MISSOURI, BY PROVIDING THAT THE CASE BE RECOMMITTED TO THE COMMMITTEE ON ELECTION FOR FURTHER INVESTIGATION. (P. 2234-C2)",Disputed Elections to Congress,,Internal Organization,,Miscellaneous Policy,-0.051,0.69,0.198,0.238,0.793,0.917,-65.498648,0.789
2017-01-23 07:31:50,RH0540018,54,House,18,1896-02-29,,199,38,"TO OVERRIDE THE VETO OF THE PRESIDENT OF H.R. 2769 (24 STAT 90 4/7/96), A BILL AUTHORIZING THE LEASING OF LANDS FOR EDUCATIONAL PURPOSES IN ARIZ..  (P. 2296-C1)",Education,,Domestic Social Policy,,Social Welfare,0.139,-0.99,-0.292,-1.028,0.368,0.899,-41.072964,0.841
2017-01-23 07:31:50,RH0540019,54,House,19,1896-03-02,,264,17,"TO SUSPEND THE RULES AND PASS A RES. AS A SUBSTITUTE TO H.C.R. 25, THE SUBSTITUTE DECLARING THAT IN THE OPINION OF CONGRESS, WAR EXISTS IN CUBA AND THE U.S. SHALL OBSERVE STRICT NEUTRALITY BETWEEN THE BELLIGERENTS, AND THAT THE SOLUTION OF THE CONTEST ISIN THE ESTABLISHMENT OF A GOVERNMENT BY THE CHOICE OF THE PEOPLE OF CUBA; DUE TO THE CLOSER RELATIONS BETWEEN THE U.S",,,Foreign Policy Resolutions,,Foreign and Defense Policy,-0.779,0.237,-0.241,-0.427,0.059,0.943,-54.561315,0.824
2017-01-23 07:31:50,RH0540020,54,House,20,1896-03-07,,108,118,"TO CONCUR IN SENATE AMENDMENT NO. 46 TO THE AGRICULTURAL APPROPRIATION BILL, H.R. 5161 (29 STAT 99, 4/25/96), FOR FISCAL YEAR ENDING JUNE 30, 1897, WHICH AMENDMENT PROVIDES THAT THERE BE PUBLISHED 25,000 COPIES OF THE SPECIAL REPORT ON CATTLE AND DAIRY FRMING, OF WHICH 8,000 COPIES BE FOR THE SENATE AND 17,000 COPIES FOR THE HOUSE, $65,000 TO BE IMMEDIATELY AVAILABLE FOR THIS PURPOSE",Agriculture,,Budget Special Interest,,Agriculture,0.197,0.156,-0.034,-0.136,0.231,0.631,-145.295908,0.526
2017-01-23 07:31:50,RH0540021,54,House,21,1896-03-11,,112,138,"TO AMEND H.R. 6614 (29 STAT 313, 6/9/96), THE POST OFFICE APPROPRIATION BILL FOR FISCAL YEAR ENDING JUNE 30, 1897, BY ELIMINATING THE APPROPRIATION OF $196,614.22 FOR SPECIAL FACILITIES ON TRUNK LINES BETWEEN BOSTON AND NEW ORLEANS VIA N.Y., WASHINGTON AD ATLANTA",,,Budget Special Interest,,Government Management,0.441,0.014,-0.052,-0.669,0.58,0.81,-113.066589,0.636
2017-01-23 07:31:50,RH0540022,54,House,22,1896-03-13,,60,175,"TO SUBSTITUTE FOR H.RES. 193, A RESOLUTION DECLARING THAT W. F. ALDRICH WAS ELECTED A REPRESENTATIVE FROM THE FOURTH CONGRESSIONAL DISTRICT OF ALABAMA TO THE 54TH CONGRESS, THE MINORITY REPORT DECLARING THAT GASTON ROBBINS WAS ELECTED IN THAT DISTRICT.",Disputed Elections to Congress,,Internal Organization,,Miscellaneous Policy,-0.245,0.132,0.412,0.551,0.95,0.987,-10.437303,0.957
2017-01-23 07:31:50,RH0540023,54,House,23,1896-03-13,,32,109,TO DISPENSE WITH ALL PROCEEDINGS UNDER THE CALL OF THE HOUSE (P. 2805-2),,,Internal Organization,,Miscellaneous Policy,-0.847,0.512,0.097,-0.002,0.0,0.773,-74.367443,0.59
2017-01-23 07:31:50,RH0540024,54,House,24,1896-03-20,,186,74,"TO PASS THE FIRST BRANCH OF H.RES. 179, WHICH PROVIDES FOR THE CENSURING OF THOMAS F. BAYARD, U.S. AMBASSADOR TO GREAT BRITAIN, FOR REMARKS MADE IN A PUBLLIC SPEECH IN BOSTON, ENGLAND, AUG 2, 1895, AND IN EDINBURGH, SCOTLAND, NOV. 7, 1895, FOR USING LANGAGE UNBECOMING TO ONE IN THE 1.S",,,Government Organization,,Government Management,-0.289,0.5,-0.217,-0.286,0.838,0.954,-41.812248,0.851
2017-01-23 07:31:50,RH0540025,54,House,25,1896-03-20,,194,60,"TO PASS THE SECOND BRANCH OF H.RES. 179, A RESOLUTION CENSURING THOMAS F. BAYARD, U. S. AMBASSADOR OF GREAT BRITAIN FOR REMARKS MADE IN A PUBLIC SPEECH IN BOSTON, ENGLAND AUG. 2, 1895, AND IN EDINBURGH, SCOTLAND, NOV. 7, 1895; FOR IN THE OPINION OF THE HUSE OF REPRESENTATIVES PUBLIC SPEECHES BY OUR DIPLOMATIC OR CONSULAR OFFICES ABROAD WHICH DISPLAY PARTISANSHIP OR CONDEMN ANY POLICICAL PARTY OR ORGANIZATION OF CITIZENS IN THE U",,,Government Organization,,Government Management,-0.113,-0.689,-0.299,-0.406,0.833,0.961,-28.63974,0.893
2017-01-23 07:31:50,RH0540026,54,House,26,1896-03-20,,61,135,"TO PASS A RESOLUTION RELATING TO CONTESTED ELECTION CASE OF BENOIT VS. BOATNER, DECLARING THAT CHARLES J. BOATNER WAS ELECTED A REPRESENTATIVE TO THE 54TH CONGRESS FROM THE 5TH CONGRESSIONAL DISTRICT OF LOUISIANA ON NOV. 6, 1894 AND IS ENTITTLED TO HIS SAT AS SUCH.",Disputed Elections to Congress,,Internal Organization,,Miscellaneous Policy,-0.373,0.928,0.429,0.757,0.934,0.98,-16.384212,0.92
2017-01-23 07:31:50,RH0540027,54,House,27,1896-03-24,,170,61,"TO PASS H.R. 878 (29 STAT 487 1/15/97), A BILL PROVIDING FOR THE REDUCTION OF CASES IN WHICH THE PENALTY OF DEATH MAY BE INFLICTED.",,,Domestic Social Policy,,Civil Liberties,0.36,0.933,0.089,0.156,0.115,0.766,-122.276245,0.589
2017-01-23 07:31:50,RH0540028,54,House,28,1896-03-27,,145,78,TO RESOLVE INTO THE COMMITTEE OF THE WHOLE HOUSE FOR THE CONSIDERATION OF BUSINESS ON THE PRIVATE CALENDAR.,,,Internal Organization,,Miscellaneous Policy,-0.455,-0.164,-0.044,-0.051,0.065,0.676,-138.750888,0.537
2017-01-23 07:31:50,RH0540029,54,House,29,1896-04-02,,130,109,"TO AMEND H.R. 7664 (29 STAT 413, 6/11/1896), THE CIVIL APPROPRIATION BILL FOR FISCAL YR. ENDING JUNE 30, 1897; WHICH AMENDMENT PROPOSES TO APPROPRIATE $29,600 FOR MAINTENANCE OF HOWARD UNIVERSITY, TO BE USED IN PAYMENT OF PART OF SALARIES OF OFFICERS, TECHERS, FOR FACILITIES, ETC.; NO PART TO BE USED FOR RELIGIOUS INSTRUCTIONS, AND THE BALANCE TO BE PAID BY DONATIONS.",Civil Rights/Desegregation/Busing/Affirmative Action,,Budget Special Interest,,Government Management,-0.563,-0.805,-0.105,0.367,0.394,0.724,-132.531231,0.574
2017-01-23 07:31:50,RH0540030,54,House,30,1896-04-06,,260,29,"TO PASS H.C.RES. 25 A RESOLUTION RELATING TO WAR IN CUBA, PROVIDING THAT THE U. S. ACCORD THE PEOPLE OF CUBA THE RIGHTS OF BELLIGERENTS IN THE PORTS AND TERRITORY OF THE U. S. AND MAINTAIN A STRICT NEUTRALITY BETWEEN THE CONTEND- ING POWERS; THAT THE U. ",,,Foreign Policy Resolutions,,Foreign and Defense Policy,-0.852,0.524,-0.31,-0.755,0.0,0.9,-80.401815,0.757
2017-01-23 07:31:50,RH0540031,54,House,31,1896-04-07,,113,127,"TO RECEDE FROM THE HOUSE AMENDMENT TO S. 1247 (29 STAT 244 6/3/1896), A BILL ESTABLISHING AND PROVIDING FOR THE MAINTENANCE OF A FREE PUBLIC LIBRARY AND READING ROOM IN THE DISTRICT OF COLUMBIA.  THE AMENDMENT PROVIDES THAT THE ENTIRE EXPENSE BE PAID BY HE DISTRICT.",,,D. C.,Budget Special Interest,Government Management,-0.365,-0.747,-0.084,0.339,0.389,0.711,-131.865781,0.577
2017-01-23 07:31:50,RH0540032,54,House,32,1896-04-08,,122,120,TO ORDER ENGROSSMENT AND THIRD READING OF H.R. 7251 A BILL FIXING THE STANDARD OF WEIGHTS AND MEASURES BY THE ADOPTION OF THE METRIC SYSTEM OF WEIGHTS AND MEASURES.,Science and Technology,,Domestic Social Policy,,Government Management,-0.147,-0.193,-0.024,0.162,0.218,0.614,-159.930348,0.516
2017-01-23 07:31:50,RH0540033,54,House,33,1896-04-08,,111,133,TO TABLE A MOTION TO RECONSIDER THE VOTE BY WHICH H.R. 7251 WAS ENGROSSED AND BROUGHT TO A THIRD READING.,Science and Technology,,Domestic Social Policy,,Government Management,-0.294,-0.396,-0.028,0.228,0.171,0.621,-156.817151,0.526
2017-01-23 07:31:50,RH0540034,54,House,34,1896-04-08,,143,99,TO RECONSIDER THE VOTE BY WHICH THE THIRD READING AND ENGROSSMENT OF H.R. 7251 WAS AGREED TO.,Science and Technology,,Domestic Social Policy,,Government Management,0.18,-0.298,0.038,-0.208,0.192,0.668,-149.884584,0.538
2017-01-23 07:31:50,RH0540035,54,House,35,1896-04-11,,169,61,"TO PASS H.R. 8008 (29 STAT 253 6/6/1896), A BILL DEFINING CHEESE AND ALSO IMPOSING A TAX UPON AND REGULATING THE MANUFACTURE, SALE, IMPORTATION, AND EXPORTATION OF ""FILLED CHEESE"".",Agriculture,,Regulation Special Interest,,Agriculture,0.034,-0.959,-0.183,-0.074,0.705,0.922,-52.036338,0.798
2017-01-23 07:31:50,RH0540036,54,House,36,1896-04-16,,59,154,"TO AMEND H.J.RES. 160 (29 STAT 472 4/21/1896), A RESOLUTION RELATING TO APPOINTING OF FOUR MEMBERS OF THE BOARD OF MANAGERS OF THE NATIONAL HOME FOR DISABLED VOLUNTEER SOLDIERS, BY ELIMINATING THE NAME OF WILLIAM B. FRANKLIN OF CONNECTICUT, AND INSERTINGTHAT OF OLIVER O",,,Government Organization,,Government Management,-0.234,0.756,-0.075,-0.671,0.186,0.775,-93.302825,0.645
2017-01-23 07:31:50,RH0540037,54,House,37,1896-04-21,,61,132,TO RECOMMIT THE RESOLUTION ON THE CONTESTED ELECTION CASE OF ALBERT T. GOODWYN VS. JAMES E. COBB TO THE COMMITTEE ON ELECTIONS WITH INSTRUCTIONS TO REPORT A RESOLUTION AUTHORIZ- ING THE CONTESTEE TO TAKE FURTHER TESTIMONY IN REBUTTAL OF EVIDENCE IN THE RCORD TAKEN BY THE CONTESTANT IN THE LAST TEN DAYS IN WHICH TESTIMONY WAS TAKEN.,Disputed Elections to Congress,,Internal Organization,,Miscellaneous Policy,-0.347,0.805,0.349,0.746,0.902,0.969,-22.393284,0.89
2017-01-23 07:31:50,RH0540038,54,House,38,1896-04-21,,120,45,"TO PASS A RESOLUTION RELATING TO CONTESTED ELECTION OF GOODWYN VS. COBB, DECLARING THAT ALBERT T. GOODWYN WAS ELECTED A MEMBER OF THE 54TH CONGRESS AS THE REPRESENTATIVE OF THE 5TH CONGRESSIONAL DISTRICT OF THE STATE OF ALABAMA AT THE ELECTION HELD IN SAD DISTRICT NOV",Disputed Elections to Congress,,Internal Organization,,Miscellaneous Policy,-0.217,0.302,-0.595,-1.158,1.0,1.0,-0.698445,0.996
2017-01-23 07:31:50,RH0540039,54,House,39,1896-04-22,,146,55,"TO PASS THE RESOLUTION RELATING TO CONTESTED ELECTION CASE OF GOODWYN VS. COBB IN THE 5TH CONGRESSIONAL DISTRICT OF THE STATE OF ALABAMA ON NOV. 6, 1894.",Disputed Elections to Congress,,Internal Organization,,Miscellaneous Policy,-0.206,0.207,-0.638,-1.088,0.981,0.995,-2.298614,0.989
2017-01-23 07:31:50,RH0540040,54,House,40,1896-04-24,,78,139,TO RESOLVE ITSELF INTO THE COMMITTEE OF THE WHOLE HOUSE FOR THE CONSIDERATION OF BUSINESS ON THE PRIVATE CALENDAR.,,,Internal Organization,,Miscellaneous Policy,0.068,0.998,0.155,-0.015,0.641,0.87,-73.202604,0.714
2017-01-23 07:31:50,RH0540041,54,House,41,1896-04-27,,120,93,"TO PASS A RULES COMMITTEE RESOLUTION, WHEREUPON THE CONSIDERATION OF H.R. 8271, A BILL RELATING TO PENSIONS, SHALL BE RESUMED AND CONSIDERED UNDER THE FIVE MINUTE RULE FOR ONE AND ONE-HALF HOURS, WHEN WITH ANY AMENDMENTS THAT MAY BE ADOPTED, IT SHALL BE AVORABLY REPORTED TO THE HOUSE; AND ON TUESDAY, APR",Military Pensions/Veterans Benefits,,Defense Policy Budget,,Foreign and Defense Policy,-0.067,-0.998,-0.213,0.281,0.645,0.845,-70.863792,0.717
2017-01-23 07:31:50,RH0540042,54,House,42,1896-04-28,,197,63,"TO PASS H.R. 8271, A BILL RELATING TO INVALID PENSIONS.",Military Pensions/Veterans Benefits,,Defense Policy Budget,,Foreign and Defense Policy,-0.194,-0.064,-0.293,0.023,0.825,0.958,-21.228508,0.922
2017-01-23 07:31:50,RH0540043,54,House,43,1896-04-28,,162,48,"TO PASS H.R. 6739, A BILL PROVIDING FOR THE RELIEF OF JOHN N. QUACKENBUSH, FORMER COMMANDER IN THE NAVY. (P. 4529-2)",,,Budget Special Interest,,Government Management,0.112,0.79,-0.08,0.258,0.271,0.833,-81.729356,0.678
2017-01-23 07:31:50,RH0540044,54,House,44,1896-05-02,,114,130,"TO PASS A SUBSTITUTE BILL FOR H.R. 8110, A BILL ESTABLISHING A UNIFORM LAW ON THE SUBJECT OF BANKRUPTCIES THROUGHOUT THE THE UNITED STATES.  (P. 4756-1)",,,Domestic Social Policy,,Civil Liberties,0.154,0.019,0.097,-0.432,0.579,0.803,-105.974936,0.648
2017-01-23 07:31:50,RH0540045,54,House,45,1896-05-02,,157,82,"TO PASS H.R. 8110, A BILL ESTABLISHING A UNIFORM LAW ON THE SUBJECT OF BANKRUPTCIES THROUGHOUT THE UNITED STATES.",,,Domestic Social Policy,,Civil Liberties,0.089,0.23,-0.078,0.572,0.427,0.803,-95.806616,0.67
2017-01-23 07:31:50,RH0540046,54,House,46,1896-05-04,,112,44,TO PASS H. RES. 305 A RESOLUTION REGARDING ORDER OF BUSI- NESS.  NO QUORUM VOTED.,,,Internal Organization,,Miscellaneous Policy,-0.188,-0.012,-0.214,-0.076,0.818,0.949,-21.759847,0.87
2017-01-23 07:31:50,RH0540047,54,House,47,1896-05-05,,176,56,"TO PASS H.RES. 305, REGARDING ORDER OF BUSINESS.",,,Internal Organization,,Miscellaneous Policy,-0.16,-0.268,-0.22,-0.012,0.804,0.953,-28.35803,0.885
2017-01-23 07:31:50,RH0540048,54,House,48,1896-05-05,,84,143,"TO CONCUR IN THE SENATE AMENDMENT TO H.R. 7542, A BILL MAKING APPROPRIATIONS FOR THE NAVAL SERVICE FOR THE FISCAL YEAR ENDING JUNE 30, 1897; WHICH AMENDMENT PROVIDES THAT THE NUMBR OF BATTLESHIPS TO BE BUILT BE REDUCED FROM FOUR TO TWO.",,,Defense Policy Budget,,Foreign and Defense Policy,-0.287,-0.0,0.056,-0.424,0.321,0.749,-119.896744,0.59
2017-01-23 07:31:50,RH0540049,54,House,49,1896-05-06,,38,59,"TO ADJOURN, IN ORDER TO SECURE A ROLL CALL AND DETERMINE WHETHER A SUFFICIENT NUMBER OF MEMBERS ARE PRESENT TO CONTINUE WITH BUSINESS, MADE DURING DEBATE ON H.R. 2317 (29 STAT 834 3/3/97), A BILL TO INCREASE THE PENSION OF LEVI T. E. JOHNSON.",,,Budget Special Interest,,Government Management,0.242,-0.009,0.07,0.318,0.289,0.722,-53.042418,0.579
2017-01-23 07:31:50,RH0540050,54,House,50,1896-05-06,,52,48,TO ADJOURN DUE TO THE LACK OF A QUORUM.,,,Internal Organization,,Miscellaneous Policy,0.218,0.271,0.077,0.388,0.396,0.71,-54.340175,0.581
2017-01-23 07:31:50,RH0540051,54,House,51,1896-05-07,,182,34,"TO ORDER THE PREVIOUS QUESTION ON H.R. 7370, AN ACT ESTABLISHING CIRCUIT COURTS OF APPEALS AND DEFINING AND REGULATING, IN CERTAIN CASES, THE JURISDICTION OF THE U. S. COURTS.",Judiciary,,Government Organization,,Civil Liberties,-0.361,-0.784,-0.174,-0.025,0.118,0.861,-54.988655,0.775
2017-01-23 07:31:50,RH0540052,54,House,52,1896-05-07,,204,0,"TO NONCONCUR IN SENATE AMENDMENTS AND AGREE TO THE CONFER- ENCE REQUESTED BY THE SENATE ON H.R 3013 (29 STAT 188 5/28/ 1896), AN ACT TO AMEND SECTION 4131 OF THE REVISED STATUTES OF THE U. S. TO IMPROVE THE MERCHANT MARINE ENGINEER SERVICE AND THEREBY ASO TO INCREASE THE EFFICIENCY OF THE NAVAL RESERVE.",,,Defense Policy Budget,,Foreign and Defense Policy,0.0,0.0,0.0,0.0,,,0.0,
2017-01-23 07:31:50,RH0540053,54,House,53,1896-05-07,,129,112,"TO PASS H.RES. 248, AUTHORIZING THE CLERK OF THE HOUSE TO PAY OUT OF THE CONTINGENT FUND OF THE HOUSE TO EACH MEMBER AND DELEGATE, ANNUAL CLERK HIRE OF $100.00 PER MONTH TO BE CERTIFIED BY THEM EACH MONTH IN THE MANNER PROVIDED IN RESOLUTION OF 3/3/1893 ND THE PROVISIONS OF SAME SHALL NOT APPLY TO MEMBERS WHO ARE CHAIRMEN OF COMMITTEES ENTITLED UNDER THE RULES TO ANNUAL CLERKS.",,,Internal Organization,Budget Special Interest,Government Management,-0.602,-0.799,-0.1,0.365,0.286,0.668,-138.891212,0.562
2017-01-23 07:31:50,RH0540054,54,House,54,1896-05-12,,75,148,"TO RECOMMIT TO THE COMMITTEE ON RULES THE RESOLUTION ELIMINATING FROM THE RECORD THE MATTER INSERTED BY MR. WHEELER, ASIDE FROM THE MATTER ACCORDING TO THE REPORTERS NOTES, ACTUALLY DELIVERED BY HIM IN HIS FIVE MINUTES TIME.",,,Internal Organization,,Miscellaneous Policy,0.055,0.12,0.234,0.198,0.893,0.964,-27.061591,0.886
2017-01-23 07:31:50,RH0540055,54,House,55,1896-05-13,,100,140,"TO ADJOURN, MOTION MADE DURING DEBATE ON H.RES. 284, PROVIDING FOR RECOMMITAL OF THE CONTESTED ELECTION CASE OF JOHN RINAKER AND FINIS E. DOWNING TO THE COMMITTEE ON ELECTIONS NO. 1, WITH INSTRUCTIONS EITHER TO RECOUNT DISPUTED VOTES OR PERMIT THE PARTIE TO CONTEST TO RECOUNT SUCH VOTES AND TO TAKE SUCH ACTION, BY WAY OF A RESOLUTION TO THE HOUSE OR OTHERWISE, AS THEY MAY THINK NECESSARY AND PROPER.",Disputed Elections to Congress,,Internal Organization,,Miscellaneous Policy,0.365,0.071,-0.367,-0.643,0.63,0.846,-72.76149,0.738
2017-01-23 07:31:50,RH0540056,54,House,56,1896-05-13,,143,76,"TO ORDER THE PREVIOUS QUESTION ON H.RES. 284, IN ORDER TO CLOSE DEBATE AND BRING UP A SUBSTITUTE RESOLUTION SEATING JOHN S. RINAKER FOR IMMEDIATE VOTE.",Disputed Elections to Congress,,Internal Organization,,Miscellaneous Policy,0.386,0.113,0.331,0.647,0.579,0.854,-68.842537,0.73
2017-01-23 07:31:50,RH0540057,54,House,57,1896-05-13,,141,69,TO TABLE THE MOTION TO RECONSIDER THE VOTE BY WHICH THE PREVIOUS QUESTION WAS ORDERED ON H.RES. 284.,Disputed Elections to Congress,,Internal Organization,,Miscellaneous Policy,0.396,0.095,0.489,0.961,0.551,0.852,-60.019623,0.751
2017-01-23 07:31:50,RH0540058,54,House,58,1896-05-13,,60,133,"TO ADJOURN, MADE DURING DEBATE ON H.RES. 284.",Disputed Elections to Congress,,Internal Organization,,Miscellaneous Policy,0.409,0.092,-0.55,-1.268,0.583,0.87,-46.283067,0.787
2017-01-23 07:31:50,RH0540059,54,House,59,1896-05-13,,139,35,"TO PASS A RESOLUTION IN THE NATURE OF A SUBSTITUTE FOR H.RES. 284, PROVIDING FOR THE SEATING OF JOHN S. RINAKER.",Disputed Elections to Congress,,Internal Organization,,Miscellaneous Policy,0.446,0.078,0.567,0.961,0.286,0.856,-43.116229,0.781
2017-01-23 07:31:50,RH0540060,54,House,60,1896-05-15,,137,13,"TO PASS H.RES. 284, WHICH AS AMENDED, PROVIDES FOR THE SEATING OF JOHN S. RINAKER.",Disputed Elections to Congress,,Internal Organization,,Miscellaneous Policy,0.51,0.077,0.51,0.917,0.462,0.953,-22.837177,0.859
2017-01-23 07:31:50,RH0540061,54,House,61,1896-05-15,,27,119,TO ADJOURN BECAUSE OF LATENESS OF HOUR.,,,Internal Organization,,Miscellaneous Policy,0.815,0.579,-0.113,0.083,0.0,0.815,-69.799879,0.62
2017-01-23 07:31:50,RH0540062,54,House,62,1896-05-21,,196,47,"TO OVERRIDE THE VETO OF THE PRESIDENT OF H.R. 1094 (29 STAT 755, 6/10/96), AUTHORIZING AND DIRECTING THE SECRETARY OF THE INTERIOR TO PLACE THE NAME OF FRANCIS E. HOOVER, LATE A PRIVATE IN CO. I - 64TH REGIMENT OHIO INFANTRY VOLUNTEER, AT $50.00 PER MONT, IN LIEU OF A PRESENT PENSION DRAWN BY HIM.",Military Pensions/Veterans Benefits,,Defense Policy Budget,,Foreign and Defense Policy,-0.321,0.315,-0.226,-0.405,0.745,0.951,-34.539336,0.868
2017-01-23 07:31:50,RH0540063,54,House,63,1896-05-22,,190,57,"THAT THE HOUSE ADOPT A CONFERENCE REPORT ON H.R. 7977 (29 STAT 202, 6/3/96), THE RIVERS AND HARBORS APPROPRIATIONS BILL, IN WHICH THE HOUSE INSISTS ON ITS DISAGREEMENT TO THE SENATE AMENDMENTS AND AGREES TO THE REQUEST OF THE SENATE FOR A FURTHER CONFERECE.",Public Works,,Budget Special Interest,,Government Management,0.317,0.646,-0.046,0.461,0.107,0.797,-98.304842,0.672
2017-01-23 07:31:50,RH0540064,54,House,64,1896-05-22,,59,152,"TO ADOPT THE CONFERENCE REPORT TO H.R. 7664 (29 STAT 413 6/11/96), A BILL MAKING SUNDRY CIVIL APPROPRIATIONS FOR EXPENSES OF THE GOVERNMENT FOR FISCAL YEAR ENDING 1897.",,,Budget Special Interest,,Government Management,0.449,0.493,-0.102,-0.148,0.0,0.72,-114.620137,0.581
2017-01-23 07:31:50,RH0540065,54,House,65,1896-05-23,,159,23,"TO PASS THE RESOLUTION THAT THE HOUSE CONFEREES ON H.R. 6249, ""A BILL MAKING APPROPRIATIONS FOR CURRENT AND CONTINGENT EXPENSES OF THE INDIAN DEPARTMENT, ETC. BE AND ARE HEREBY INSTRUCTED TO INSIST UPON THE FOLLOWING PROVISION IN SAID BILL, (L.) DECLARIN THAT IT IS THE INTENTION OF THIS ACT THAT NO MONEY THEREIN APPROPRIATED SHALL BE PAID FOR EDUCATION IN SECTARIAN SCHOOLS, AND THE SEC",Religion,,Indian Affairs,Regulation Special Interest,Government Management,0.269,-0.772,-0.021,-0.455,0.13,0.89,-53.005183,0.747
2017-01-23 07:31:50,RH0540066,54,House,66,1896-05-25,,129,55,TO RESOLVE INTO THE COMMITTEE OF THE WHOLE HOUSE FOR CONSIDERATION OF REVENUE BILLS.,,,Internal Organization,,Miscellaneous Policy,-0.065,-0.974,0.112,-0.347,0.236,0.772,-82.864913,0.637
2017-01-23 07:31:50,RH0540067,54,House,67,1896-05-26,,124,89,"TO MOVE THE PREVIOUS QUESTION AND TO RESOLVE INTO THE COMMITTEE OF THE WHOLE HOUSE ON THE STATE OF THE UNION FOR CONSIDERATION OF REVENUE BILLS, AND TO CLOSE ALL GENERAL DEBATE AT 2 O'CLOCK.",,,Internal Organization,,Miscellaneous Policy,0.671,-0.741,-0.016,-0.129,0.022,0.592,-138.840371,0.521
